created_utc,score,title
1324643747.0,1472,Snoo as every League of Legends Champion.
1368309062.0,1469,MOST AWKWARD INTERVIEW NA ft. Quantic Gaming Balls and Lemonation
1346598040.0,1466,Day 4 | NA Season 2 Regionals | Finals/3rd place match | Live Update/Discussion Thread!
1368149799.0,1468,How to get Dan Dinh's attention in champ select to take smite
1374081811.0,1468,So the Legendary Udyr skin came out today.
1363538211.0,1465,Cannon Minion MVP
1362389601.0,1467,There are bad Sions and there is this (skip to 1:35)
1352743320.0,1470,Want the old /r/leagueoflegends theme back? Wish granted
1374772948.0,1468,Remove Tier 1 and 2 runes completely.
1360481025.0,1470,It never gets easier.
1372002180.0,1471,Just a little hint for Nocturne players and Baron.
1368902001.0,1466,how wombo combo looks like in bronze V
1362136002.0,1463,Finally received the Gift from Riot. Pics inside;)
1345242565.0,1465,We should be able to sell the item for 100% of its cost within 10 seconds of its purchase 
1376026859.0,1467,Riot is clearly dedicated to improving and furthering eSports
1374512061.0,1464,Lightblind has been hired by Riot!
1369852753.0,1462,Ezreal's time to shine - [0:23]
1366648335.0,1469,Toggle smartcast by rightclicking the spell.
1353929842.0,1468,So I knew the flash bug existed...but SERIOUSLY?!
1359183686.0,1460,"""Damnation: How many souls does Thresh need?"" by DiffTheEnder @ Reign of Gaming"
1350260185.0,1468,"It's been a great year, thanks community &amp; Riot Games! [spoiler]"
1372189099.0,1464,Curse EDWard AMA
1370161370.0,1467,What Playing LoL Support Feels Like (League of Legends)
1340329372.0,1463,Would you enjoy matchmade ARAM?
1373039029.0,1460,Wouldn't it be cool if Zac's voice got higher pitched as he lost health and got smaller?
1365341477.0,1459,"Idea: adding new, cheap starting items (theory)"
1357767552.0,1460,Doublelift's thoughts on the current state of the game
1363096962.0,1462,"Sivir: I wanta run faster, but hold on I need to stop moving &amp; yell first!!"
1359961310.0,1458,Najin Sword Maknoon AMA
1349791432.0,1454,"I feel like Riot should create bundles based on ""Role"""
1371912582.0,1460,Math on bans
1370477141.0,1453,Pro Player Pick: TheOddOne Picks Maokai
1365264030.0,1458,Hecarim dies and gets revenge when he respawns. (funny)
1364715833.0,1455,met the sweetest family in league :D
1357158728.0,1463,For those of you who don't know: How To Instantly Reconnect To A Match
1353367558.0,1459,"Got emailed a survey from Riot, included some interesting ward skin ideas"
1370843558.0,1459,A while ago league player XDemonic25 made a program which replaces the default announcer with custom ones and allows players to make their own. Riot has allowed this program to exist and it is awesome
1360005806.0,1454,Patch 3.01 Aftermath (The Statistics of the Nerfs and Buffs)
1351753296.0,1463,"League of Legend Characters, listed in order of Beard Strength"
1374370672.0,1458,"Going through ranked, while a player plays Maokai as a tree, making us lose."
1371335753.0,1455,"So, I've encountered lvl 3 player in a bot game..."
1373539879.0,1457,Staples Center will host Season3 World Finals
1374909320.0,1454,The Tribunal Dubbed: Again
1374823097.0,1452,TSM commercial during the IEM Grand Final?
1360155260.0,1451,"A ""Armory"" Concept i made a year ago - Wanted to share it."
1358623106.0,1455,IEM Katowice - SK vs Fnatic - xPeke with the PLAYS! (extended 5:39)
1338895164.0,1453,Riot Patch Night (Comic)
1357733563.0,1445,I love SaintVicious' quotes.
1353055385.0,1451,Future Items - Stats and costs
1372809329.0,1448,"Morello on Olaf: ""We overnerfed him, but we need to buff him in ways that don't just revert the nerfs. Scarizard is working on this now."""
1367961163.0,1450,"I know Akali is a ninja, but how can she be this sneaky?"
1347914932.0,1452,Elementz wise words(from FB)
1349866337.0,1445,We've come a long way.  E-sports is on the front page of USA today (10/10/12).
1366995875.0,1444,aAa disqualified from EU LCS Playoffs due to lack of sub
1365804326.0,1446,"Does anyone else think ""Veteran"" is a badge of shame?"
1355294967.0,1444,Just a useless little fact about LoL
1363126329.0,1444,Full ZAC image!
1359632291.0,1445,LoL for pre-schoolers
1347813686.0,1444,Every Champ should have a birthday &amp; be on sale on their birthday
1345866170.0,1441,Comic Entry - An Evening at the Jungle Cafe
1375218676.0,1443,Froggen 300cs after 20:01
1342013615.0,1443,League Of Legends Officially Becomes Most Played PC Game In The World | Forbes
1370581909.0,1437,CRS Edward spoiled on Stream???
1364799849.0,1442,League of Legends: CHEW arrives!
1345903654.0,1440,I would buy it.
1365360402.0,1445,"I created lolnexus.com, a site that lets you lookup ongoing matches in realtime. Instantly find out who is in a premade with who, each player’s ranked tier, runes, masteries, champion wins, and more! Give it a try!"
1358978645.0,1438,Mac Client Now ON PBE!
1370529915.0,1433,Best Caitlyn Q [HD]
1371378995.0,1441,Darker Quoting Siren - LCS Interview (Video)
1349874649.0,1434,Custom Games should be more customizable!
1348326112.0,1437,Aren't Zilean's 'W' and 'E' ability icons accidentally reversed?
1371031519.0,1436,LP lost or gained should be visible in Match History
1356658009.0,1436,The state of Udyr
1354893165.0,1433,Day 3 of new patch.
1341421226.0,1437,Best Janna Cosplay
1375799501.0,1437,"Promised Ocelote I'd draw him a picture, hope my choice of scarf was okay ;&gt; [Fanart]"
1375163882.0,1439,We cant forget that dunkey pulled a madlife before madlife.
1373884404.0,1440,Golem takes its revenge on the jungler
1367361530.0,1440,Nunu new icon so ugly :(
1362621244.0,1441,Please fix Zed's Living Shadow (W)..
1360761441.0,1432,"I'm colourblind and I would like to see this small, simple change to champ select"
1341906029.0,1437,That's my sister!
1368243481.0,1441,One of the nicest things anyone has ever done to me in my life happened....in a solo queue Silver ranked game.
1350757669.0,1438,Heartseeker Draven? Yes please.
1363721458.0,1436,The Laws of League
1360595542.0,1429,Something Needs to be done about challenger tier
1352407800.0,1439,o.O - Snoopeh AMA - O.o
1374096470.0,1433,Our Ranking Can't Hold Us!
1365733334.0,1429,Skin RP price changes! (Graphical)
1375446338.0,1431,"Dont reset the ingame chat when someone purchases or types something, pings."
1358813071.0,1433,Effect of pre-season balance patch #2
1374959393.0,1433,Riot should team up with Twitch and create a Twitch Twitch skin
1359007934.0,1436,Professional players Wizikx and Darkwinjax from Team Solo Mebdi banned for life from competitive play (and Rayt3ch for 1 year).
1354439416.0,1426,Clg vs Fnatic
1354322567.0,1428,I made a Lee Sin Montage. I really enjoyed making this. I hope you guys enjoy it too :D
1376096280.0,1436,Reddit Community Elo - Results of 51.000 VOTES!
1373775341.0,1429,Add summoner level to tribunal
1354182182.0,1430,Day 1 | IGN ProLeague Season5 | Group Stage | Live Update/Discussion Thread!
1374384008.0,1426,Baron should burrow out of the ground when it spawns!
1329091844.0,1428,I have a brilliant idea for next patch:
1364834338.0,1433,"Phreak, the Minion Master, Revealed"
1374071785.0,1430,Morello announces changes to 'role names'; Ad carries are now called 'marksmen'
1372587887.0,1425,What if Corki used Heat?
1363101369.0,1431,Silver elo jukes
1361874220.0,1424,Riot champ select idea
1331338859.0,1428,"""What ability did he just rank up?"" In regard to streamers..."
1371048247.0,1423,Ninja-nerf to Caitlyn's ult?
1359992217.0,1429,Steel Legion Lux is pretty annoying to play against
1354691924.0,1426,locodoco leaves clg
1365782806.0,1429,I think we need a tab in our profile where we can see all the skins we own
1361794225.0,1424,PSA: Don't tell enemy junglers you know they are there when they sit on a ward.
1358543023.0,1424,WE NEED A PENGUIN CHAMPION!
1376045594.0,1424,Don't forget about Dyrus.
1373190740.0,1423,"Simple guide on how to get to Diamond/Challenger, ward and good internet."
1370882558.0,1423,I'd really like to be able to decide my team's pick order in Ranked 5v5.
1369543781.0,1425,Big thanks to the NA All-Stars!
1361487039.0,1425,League of Carpets
1369772087.0,1419,GameSpot Interview with HotShotGG on Roster Changes
1353423345.0,1428,[PBE 11/19] Summoner's Rift: Passive Gold change infographic
1353038531.0,1424,I don't care what kind of skin it has to go on...
1376591487.0,1424,What I learned from watching Trick2g's stream
1375393345.0,1415,"Shout out to Phreak and Jatt, their 20 minute fillibuster"
1367752809.0,1423,Pro players patch notes (NA)
1362819523.0,1420,Wanting to build an LoL team + salary + house
1360785676.0,1415,How Quinn looks like
1343309903.0,1419,This is the most epic video riot has ever published.
1365102205.0,1420,So Lee sin decided to push top.
1362681809.0,1420,Zaun Amorphous Experiment - Development Log 001
1361796553.0,1420,"Hey laner, take a hint"
1360147241.0,1425,Jannas pushing power
1344730989.0,1418,Today I was playing the beta of WoW: Mists of Pandaria when I saw this...
1360274810.0,1423,"Doublelift : ""Hotshot played that game with no runes""."
1359393527.0,1418,Alex Ich AMA :P
1358242170.0,1424,Bigfatlp is now a sub for CLG
1345612007.0,1419,Ain't no party like a Fiddlesticks party
1370816937.0,1415,SIV DOES IT AGAIN
1370313617.0,1416,AD Annie with a Twist
1358677443.0,1419,We will remember you. [Video]
1347416685.0,1417,The Ultimate Toplane Gank
1367795788.0,1416,"Instead of all these ""When this is x hours old"" posts, would it be possible to have daily countdowns in the sidebar?"
1366547344.0,1418,Riot All-Star Team
1363552789.0,1422,"Whenever Nasus is picked in a competitive match, please, PLEASE, mouse-over his Q every now and then so we can see how much damage he has on it!"
1353093949.0,1416,"Title: We’re the design team behind the Preseason gameplay changes, ask us anything!"
1373476458.0,1416,Why does it show the name of the person who started a surrender vote?
1369592821.0,1412,Step aside blue ezreal...
1362303163.0,1417,Orianna vs Lux | Oh how scared I was
1348270100.0,1416,The League of Legends client is the Internet Explorer of all game clients.
1375140154.0,1410,Has anybody noticed that the front two creeps in a wave sometimes get a burst of speed?
1366584145.0,1417,[Infographic] Greatest Achievements of Riot's mighty Nerf hammer
1368927741.0,1414,Has anyone noticed how vague Kennen is?
1368547061.0,1416,Allstar Wars (episode 1)
1361992171.0,1413,GameCrib: TSM Snapdragon - Episode 2 The Game Begins
1346224742.0,1413,"Dear Riot, as we look towards Season 3, I think we need to have a big look at how we allow for innovation in LoL"
1342601362.0,1412,"Summoners, y u no communicate??"
1363712831.0,1412,Karma Relaunch AMA!
1375588430.0,1408,Madlife vs. Ezreal
1361667049.0,1410,Gamebreaking Garen bug.
1359857862.0,1412,Epidemic Singed Completed 3d Model and Texture
1340282621.0,1409,Does this annoying process happen a lot to everyone? Or is it just me? Literally every time I start up LoL...
1359577055.0,1405,ESPN says that League of Legends 'mimics real sports' 
1354982155.0,1403,Lux and Gragas QoL improvements
1351315143.0,1402,"""I am Doomy, AMA and I will answer my best"""
1345294009.0,1407,I Want My Buff Back (Swain Comic by Mikkynga)
1353524523.0,1405,Epic Sax Teemo
1374070098.0,1405,PLEASE RIOT give us the option ''appear offline''
1355583622.0,1402,Does anyone not feel like Baron Buff is WAAAAY too small?
1352788993.0,1401,Wingsofdeath 5 Tiamat shyvanna - 1 autoattack pentakill - Youtubevideo
1340589438.0,1402,"I made my first League of Legends toy about 2 years ago, I haven't stopped making them since."
1370017462.0,1403,3000 ELO WALL
1359207710.0,1400,I have discovered why so many people decline or don't accept game invite..
1360939158.0,1402,"[PBE] When you are dead, the battlefield isn't fully black and white anymore"
1357135956.0,1402,The Ol' Razzle Dazzle
1353492129.0,1397,Sunfire Cape new particles: FIRE!
1375991848.0,1395,"Eclipse Leona and Diana, riot pls!"
1370615724.0,1404,"A ""Notification"" when a friend on your friendlist change name."
1375367484.0,1396,Hydra on Lee?
1373812080.0,1403,I feel so frustrated playing jungle
1370386685.0,1399,Riot apology and compensation for EUW - (20 win IP boosts)
1367238295.0,1397,Alternative ARAM draft formats
1361347724.0,1399,Ashe Passive Idea
1355322686.0,1400,Yorick-The Snowbuster
1371112050.0,1400,Dan Dinh has made analysis videos for ALL lcs games (Day 1). Really should be recognized.
1366437171.0,1399,Curse Response
1359745387.0,1399,Riot Games - League of Legends Championship Series Promo
1372824160.0,1402,How a pro player gets his name
1348481374.0,1401,One-Man Army Rumble (Skin Concept)
1366646732.0,1392,All 1350 RP skins should at least have a backing animation.
1350583942.0,1391,Ward skins need to be permanent.
1344563753.0,1394,"Champion Relaunch: Katarina, the Sinister Blade"
1343473645.0,1400,"In light of the new Cho'Gath skin, here is a tip from all of the veteran Cho players."
1373453448.0,1399,Lucian Ability Kit First Look feat. Dan Dinh
1366683168.0,1389,"What happens when BoxBox gets a triple, then dies."
1350960681.0,1398,Karthus should get a pirate skin too!
1372204038.0,1390,The Long Awaited Dignitas House Tour
1369599250.0,1394,"Aatrox patch (According to ""A Twist of Fate"")"
1356572442.0,1396,I got this. Just one jump and- DAMN IT
1351732081.0,1397,"On behalf of all low-res monitor users, the scroll bar in the shop is really annoying to use."
1345172821.0,1390,So me and my friend decided to find out where exactly on the map it became more time efficient to run to base rather than recalling depending on your movement speed.
1334136345.0,1395,So unnecessary...But had to.
1365971327.0,1395,Dyrus best ADC
1362753031.0,1388,"Hi, I'm Reapered in SKT1, 
and I'm writing this to correct the mistranslation of the interview with CJ blaze "
1362487854.0,1388,"Hi, I'm Krepo and I play support for Evil Geniuses. We just went 1-4 in LCS superweek. AMA"
1365257498.0,1388,Gambit vs EG (spoiler)
1340201258.0,1395,Battle of Helm's Deep (x-post from r/bestoftribunal by request)
1372314806.0,1389,Udyr Skin is Here! WIP Post
1344818075.0,1393,Pool party Xin skin idea
1375949077.0,1389,Yi is getting nerfed..
1372926403.0,1390,Dunkey - Escape From Hell
1358930193.0,1391,Can we take out the runes that we have 9x (or 3x) from the shop?
1354301207.0,1385,The Tribunal: Dubbed
1338091291.0,1387,Shoutout to Dignitas for surrendering when TSM had internet troubles.
1367191405.0,1385,Hotshot just made me sad.
1349304015.0,1387,Twisted Fate's new dance is Gangnam Style
1339504193.0,1388,The terror of a good jungler.
1373816827.0,1385,Wallpaper for every Champion - 21 currently
1349751262.0,1390,Season 2 Finals personal experience: ocelote.
1369494167.0,1382,WARNING: lolking.net Trojan from banner.
1364992936.0,1384,LCS Caster announcer packs
1350568147.0,1389,This guy makes a great point on viktor
1375117401.0,1389,Ocelote: Controlling the Beast
1374004185.0,1379,EdWard Shirt Design!
1370413156.0,1381,Voyboy is not a forgiving person
1365173406.0,1381,"Make CV a viable passive support pick, by giving it gp10 when it's OFF CD"
1358870505.0,1381,Good Guy Gosu (Or Should I Say Edward)
1356257394.0,1385,"Do you think LoL could use a new ""trailer""? "
1355656990.0,1382,Rengar and Diana: The Day After The Nerfs
1340220974.0,1386,"I wanted to practice photoshop, so I made these pots."
1364402755.0,1381,"Oh, How I miss Aphros stream."
1359738801.0,1378,New Anivia skin?
1340708310.0,1381,My first League of Legends Runepage - A flowchart for Beginners.
1367849840.0,1382,Why isn't there a Division 2 planned?
1367190969.0,1381,I feel bad for Rhux
