created_utc,score,title
1373362943.0,1678,Erik Braa ( Draven voice actor) shaved his beard to a draven-like mustache
1356393785.0,1674,"One of the things we would all want for Christmas, Announcer packs."
1366673064.0,1672,Gentleman Cho'gath and Brolaf are not legendary skins.
1352649226.0,1675,"Let's make these new themes beta, and put the old theme back on this subreddit by default. (reminds me of battle.net 2.0)"
1366771334.0,1674,Travis on his side of living with DLift
1361054014.0,1670,Dyrus &amp; Dyrusdad a touching story
1368192092.0,1667,InSec godly Lee Sin initiate in OGN
1368117770.0,1666,Lower the surrender timer by 1-2 minutes for every disconnected player.
1363369811.0,1671,"Shoutcaster Kobe24 is now officially @RiotKobe, congratulations!"
1370865087.0,1663,Froggen showing perfect Anivia combo
1365525009.0,1668,Can we have the LP we earn in the match history?
1353273607.0,1668,We don't see that every day
1371224407.0,1668,"ARAM infographic - champions, items and summoner spells [1920x1080]"
1366043180.0,1670,I'd like to show some appreciation to CLG and Crs for showing their scrims.
1373078029.0,1663,I've got to give it to Phreak.
1370355360.0,1672,Can we show Riot the support there really is for an East Coast Server?
1346026283.0,1668,Curse and Dignitas disqualified from MLG
1372281504.0,1664,7-point Criticism of the New Draven Passive
1341954477.0,1667,"Stealth re-work update!
"
1368698959.0,1666,A Suggestion for Item Sets
1354861129.0,1665,Candycane Fiddlesticks
1350163390.0,1664,I realise why AZF doesnt like to play Ezreal
1375736653.0,1666,CLG need to move away from Azubu TV
1369670966.0,1662,You can get the same champion using the reroll function in ARAM.
1355947325.0,1661,"This is what happens when you close your laptop while spectating a game, and come back an hour later."
1376431346.0,1662,Riot I miss your double ip weekends... Please bring them back!
1355319769.0,1658,"[Suggestion] As you buy more RP, you get more refund credits."
1358342523.0,1657,"Visual Upgrade: Annie, the Dark Child"
1353102756.0,1657,Regarding the HUD update...
1344094046.0,1659,Careful...theres a fed Fiddle
1326307393.0,1660,Help Riot and stop SOPA
1371524776.0,1662,"My friend carried the LCS Midlaners at Dreamhack Summer, including Deman, qu1kshot, Sjokz and Rachel [pictures inside]"
1363633430.0,1657,Diamond Finest Plays 
1372425683.0,1660,An idea to make Twin Shadows (Spooky Ghosts) more viable.
1366453539.0,1656,Reginald's TF FailLight Video - Presented by Dan Dinh
1368802575.0,1656,Insane Thresh play by MadLife in OGN Spring
1362758289.0,1655,Dear tournament organizers: There are other music genres than dubstep
1372875093.0,1659,New Champion Teaser - Shadows and Reflections
1365545315.0,1658,xPeke does it AGAIN!
1348038802.0,1654,In the spirit of the upcoming Season Finals: Shoutcaster Mundo (Skin Concept)
1345914108.0,1647,LoL Comic Entry: Rise of the Battlecasts
1374540667.0,1654,Chauster and Doublelift Travel to Bronze (Highlights)
1367399909.0,1645,From Chaox : Video of what a REAL Lan Cafe should look like!
1366206020.0,1650,Faker on LeBlanc [SKT T1 #2 vs MVP Blue - OGN Spring 2013]
1362641853.0,1647,Thank you Soon®™ Riot.
1372984709.0,1651,Every league casters worst dream.
1370997697.0,1651,The Unaired CLG Doc: Season 2 by Max Sims
1370831542.0,1647,Was 14 points short on RP-This is what I did
1365137423.0,1647,Riot PLS don't have the store reset to the store homepage everytime you click on store
1353454762.0,1642,Spectate Anyone You Wish
1375220666.0,1643,3.10 Official Patch Notes
1372529002.0,1638,Anyone at MLG want to watch the LCS matches with me?
1372361747.0,1638,Thresh's lantern reveals his own wards
1361913197.0,1636,TheOddOne(Hecarim) &amp; Orianna's Epic Wombo Combo
1360013971.0,1637,Dragon and Baron Spawn Animations
1359306270.0,1638,Saw a familiar friend on the LOL Mac Client
1376272332.0,1635,Reverse Soraka (Bananaraka)
1369091424.0,1636,Papa John's getting involved in eSports! 50% off Pizza this week!
1361388202.0,1637,GameCrib: TSM Snapdragon - Episode 1 Welcome Home
1375132263.0,1632,If Champions Got Called Out For Cypher/Rap
1372517476.0,1636,"Yorick will be reworked. Xelnath: ""His 'no-brain' playstyle clearly must go."""
1363565543.0,1628,Champion Lore and Relationship Schematic (UPDATED)
1358787401.0,1628,This is what League of Legends needs.
1355778363.0,1628,"Irelia:"" I swear if one of you takes my pentakill..."""
1367105395.0,1624,Dan Dinh cheering for tsm!
1362956710.0,1629,"League of Legends PARODY: Rift Shop - Sonny Psydup, Collective, Cody"
1353288744.0,1625,"High-level player receives mysterious permaban with no response from Riot, and pro-level character witnesses. "
1342143448.0,1628,Twisted Fate kitty: The card mewster
1356706330.0,1626,"Elo, The Elephant"
1370041470.0,1623,A Twist of Draven
1372233523.0,1620,One shot by AP Rammus!(0:40)
1376324971.0,1619,Viktor and Jayce Lore Comic
1361359837.0,1617,Different LoL Stats
1360527485.0,1619,Thank you Giants
1349978559.0,1622,CLG.EU Froggen AMA 
1372535057.0,1621,Viktor's ult should go over terrain
1368642452.0,1624,How I plan to get Diamond with Riven [Flowchart]
1346765403.0,1620,Zileans got swag.
1367783151.0,1622,Malzahar Gets Wombo'd!
1364911521.0,1618,LET THE PROS VOTE FOR ALL-STAR
1350017013.0,1614,I'd like to repost and present to reddit again Kuenaimaku's now 7 month old concept: a redesigned in-game shop mock up
1375984731.0,1620,Has anyone else noticed the glitch in picking phase where u change masteries and it changes back?
1367625541.0,1618,Upcoming champion leak - Gun Templar.
1346544347.0,1616,Lady Gragas
1375891967.0,1614,MachinimaVs set to partner with OGN and produce 10 part web series about Korean LoL pros
1370220892.0,1618,Every singe LoL player needs to watch this
1365651976.0,1622,Draven's Spinning Axe to be reverted; Volty reflects on his design decisions
1375117992.0,1611,There needs to be a loading spinner in the loading screen.
1336069520.0,1617,"I am Marc ""Tryndamere"" Merrill, President &amp; co-founder of Riot Games.  AMA! "
1375093688.0,1613,Yordle's Paradise Parody - Mass Collab
1366404591.0,1613,I just love the new cam in the LCS
1347310090.0,1612,"Rioter Kades telling us what it means to ""Man up,"" and I cannot agree more."
1370633748.0,1618,"I finally did it, after 840 games of solo queue in Bronze, I made it to Silver! I know it's not a great achievement but it really means quite a bit to me!"
1370375847.0,1610,Edward leaves Gambit Gaming
1348786749.0,1615,Aphromoo has left the building.
1369384251.0,1611,Game Breaking Zed bug in Game 1 Allstar China vs NA
1361466458.0,1611,"Riot please, when spectating and purple team wins, let the crystals be purple, not blue."
1354588832.0,1610,Dignitas.ODEEs house was devastated by fire. I am asking for your help.
1374078059.0,1608,"As someone who just leveled up his first smurf, after almost 2 years of playing. I have to say, Runes are the most frustrating thing in this game."
1358111931.0,1610,Gangplank's biggest play of 2012
1351621174.0,1606,"Find out how much IP anyone's earned, ever."
1367269332.0,1608,Patch Notes 3.6!
1363533220.0,1603,"50 Tips how to come a better Supporter, by Xpecial (Support for TSM)"
1373698772.0,1609,League of Legends concept skin : mecha zed (login screen)
1368072310.0,1605,Skin Idea: Freljord Maokai who throws Poros.
1362660736.0,1608,In a parallel universe...
1342715814.0,1610,Voidling Dance :&gt;
1342570360.0,1602,Lux Kitty: The kitty of lumewnosity
1366056549.0,1608,Wickd versus sOAZ for allstar spot!
1358952895.0,1607,"So obvious Draven, so obvious..."
1368367994.0,1603,Team MRN disbands
1368040864.0,1598,So i tried to install a custom skin...
1366250540.0,1606,"My dad, who is 64, watches LCS and has a request. Pics inside. RIOT PLS"
1365690532.0,1604,Watching LoL rather than playing
1375670022.0,1601,The 10 types of people you meet in bot games
1361200124.0,1598,League of Legends restaurant opens in China
1358804181.0,1594,Appear Offline Function added
1374212926.0,1598,If Brolaf kills Trundle....
1366406682.0,1598,"My friend worked for 3 weeks on a video, here it is: League of Legends Sounds"
1366109989.0,1599,I'm colourblind and i can't see Zac's blobs
1346832898.0,1598,"To everyone going to the World Finals, a word of caution:"
1375761733.0,1599,"Suggestion: If we ever get to Patch 3.14, please change the potions to pies."
1371602740.0,1598,The creeps deserve a rework! Who is with me!?!?!
1371125552.0,1602,RobertxLee with a massive outplay.
1360843900.0,1599,So Anivia now has a different Champion name while in egg form...
1359249476.0,1597,Thresh/Blitzcrank Lantern Pull. Seen this yet?
1369553460.0,1593,Riot deserves a huge round of applause.
1369505609.0,1597,I feel really sad when I watch Yellowpete's Facebook
1354903640.0,1597,PSA: This button makes shopping easier
1354615768.0,1594,"Most OP duo bot lane - Kog'maw &amp; Sona - Happy 
Holidays"
1374245984.0,1593,Where are the SILLY skins?
1368984111.0,1593,TheOddOne becomes victim of the Twitch chat
1360287892.0,1590,"Congratulations, Riot"
1374625287.0,1594,Would you be ready to drink in a League of legends-theme bar to watch tournaments ?
1369258223.0,1591,I have a theory that none of you actually play this game.
1364079836.0,1587,"So I derped Really Hard and said ""Hey Saint, can I have a picture."" He said sure.  @ PAX EAST"
1363657890.0,1593,"Now on PBE: Not picking a champion in champ select results in a dodge, just as if you closed the client."
1355518183.0,1590,Manmo - The Man's Teemo Skin
1353244197.0,1589,"No more ""in 1 hour"" posts. I always see them 8 hours too late. We needz more time!"
1371178896.0,1585,Even his teacher calls him ZionSpartan
1355160363.0,1588,"Not a big thing, but why don't keep stats in same order in both frames?"
1351532778.0,1589,College Project
1358708574.0,1587,Gratz to the winners of IEM Katowice (Spoilers)
1357519608.0,1587,Unofficial pluginisable PvP.net client
1357060521.0,1585,"Good guy Ezreal, wait... never mind."
1372615516.0,1581,Why you see Shoutcasters standing more and more!!!
1365927769.0,1587,Incredibly annoying Talon bug.
1365015072.0,1587,Lissandra the Ice Witch Revealed In English
1372659346.0,1584,I am 110% sure I had THE BEST TIME at MLG this weekend!!!!!(had to re-post as self-post)
1371665121.0,1588,"New Riven splash art, riot fix it plz .."
1373024006.0,1588,Tear should change icon when fully stacked -- or have a dynamic change when stacked.
1363563377.0,1578,Riot should have amateur IP and RP tournaments for ALL summoners on the client
1376064921.0,1576,I'd recommend not making World Playoffs plans based on the assumption you can get tickets to every one of the the studio days
1370575159.0,1583,This Poppy's play...
1371142320.0,1577,Garena is claiming copyright on many of Dan Dinh's videos on youtube.
1340542771.0,1576,Sent Riot support a joke email about my recent account suspension. Needless to say the response made my day.
1367508122.0,1580,"Dear LoL players who usually doesnt play ARAM, ITS FOR FUN"
1349598662.0,1575,Proof that Azubu Frost looked at minimap during game against TSM. 
1371854753.0,1577,Edward about Cop
1342216166.0,1579,Jax's new quote (in memory of Joe).
1371921932.0,1578,Karthus Skin Idea - Pope Karthus
1339799418.0,1578,Dat gif.
1364786156.0,1566,LONG LIVE TEEMO OUR ETERNAL LEADER
1362215854.0,1573,"Sorry Twitch, but my stream of choice is YouTube now"
1353606625.0,1571,I really think Riot's #1 priority should be a new client
1376428315.0,1573,Teamfight UI coming to the PBE!
1366923056.0,1572,TSM sketch
1360375688.0,1569,Leek ob Lerginds
1354754744.0,1576,On behalf of all junglers....
1374625219.0,1568,Put Dragon Fist Lee Sin on sale to honor Bruce Lee!
1368400039.0,1566,"If Riot can limit the amount of health potions to 5, why can't they limit the amount of boots to 1?"
1359588714.0,1567,Own3d Will Shut Down Tomorrow
1365481225.0,1564,Petition to change the name of the Ruthless Pantheon skin to Mantheon.
1340206263.0,1568,"Riot, let us surrender before 20 minutes playtime, if 2 or more people disconnects from the game."
1362302410.0,1565,Riot Needs to add a new secret to vi
1354462616.0,1561,Do you miss Summoners Rift Winter Edition too ?
1372381197.0,1561,These AMAs suck.
1366209173.0,1562,So when you're carefully last hitting a lane as jungler and get pinged a million times...
1354783321.0,1557,Best thing about this patch.
1374861344.0,1561,I would love to watch Jatt stream League like Phreak does.
1374656685.0,1561,MonteCristo confirmed as CLG coach
1364678272.0,1557,Bee Keeper Singed Custom Skin
1374446321.0,1559,"LMFAO PhantomL0rd rage quits ""VLAD PRESS R"""
1366493399.0,1559,Elementz to Become Free Agent; Rhux in as Support for Curse
1345355392.0,1555,I saw this on the train too
1365586281.0,1561,League of Legends has the worst tutorial possible
1365691630.0,1561,GG.BenQ Diamond AMA
1371992395.0,1553,An amazing fact: At max CDR (40%) Karthus's E (Defile) can be toggled on and off rapidly to give a whopping 1.67 times the damage as just leaving it on.
1362797855.0,1557,A PSA to the League Community
1343592950.0,1557,Potential Problem with Diana's Q (Crescent Strike)
1351109861.0,1552,A Thank You; To all the Random Summoners who Queue Dodge for the Best.
1374722694.0,1554,Wouldn't it be cool if at the end of a season riot would give us a summoner icon of most played champ?
1373082469.0,1550,Muting somebody on your friends list shouldn't remove them.
1372878682.0,1554,"The ""magic"" behind Doublelift"
1369592606.0,1554,Petition to have Phreak commentate on the A Twist of Fate Cinematic
1368225546.0,1547,tl;dr lore - Poppy
1358787431.0,1549,If you've ever wondered what complete new players think while playing.
1355483347.0,1557,"New buff particles are really hard to see !
"
1348751595.0,1553,Karma makes a sad.
1370715324.0,1551,Just give him a gold medal (3500+ games with Heimerdinger)
1353365222.0,1552,Shen ultimate sacrifice
1346043890.0,1550,Yi + Baron = Jax ?
1334080952.0,1551,LEGENDARY SKIN - BRORELIA by MaTTcom
1349394149.0,1548,CHAMPIONSHIP RIVEN SKIN 
1375724778.0,1550,A friendly question/request from Husky :)!
1376490113.0,1548,Don´t be THAT guy in ranked Champ Select.
1370217161.0,1544,"If girls want to be taken seriously in competitive e-sports, they need to integrate not segregate."
1360527874.0,1548,PSA: Beware of twicth.tv (x-post from r/gaming)
1366870813.0,1542,Reggie donating $100 for every death this weekend to Boston victims.
1341162420.0,1544,Someone suggested a t-rex champ...
1350559689.0,1547,Twisted treeline item remakes + stuff
1343830807.0,1546,"""We Shall Protect"" - A Support Illustration by FF Sade"
1374781263.0,1544,Why are there no double ip weekends anymore?
1358370032.0,1543,Glowing effect on models with fire like brand or tibbers ( or xerath's body )
1351033228.0,1546,Impressive Skin Idea - Firedancer Draven - Gallery inside!
1374281914.0,1548,Something most of the LCS players can learn from Nien
1366772145.0,1546,Why doesn't homeguard give full energy like mana?
1364232237.0,1541,Trundle Visual Rework And Journey to the Freljord Part III
1361558161.0,1540,Just another amazing Volibear skin made by Korean
1352951180.0,1542,Nidalee visual upgrade confirmed and images posted by riot
1350043200.0,1544,"Idea for custom ""recommended"" item layout."
1376384115.0,1539,"Sorry, back again with more art.."
1371247055.0,1543,How Most People Judge New LoL Champions
1357348790.0,1540,League REALLY needs a sandbox mode.
1365712974.0,1536,New ARAM Feature: Rerolls
1359046191.0,1543,Apparently Own3d will be shut down within the next 2 weeks.
1355082323.0,1539,"Black cleaver changes need to be hotfixed, not waited for until next patch"
1354827020.0,1536,"Is this ever getting fixed? (I've never seen a post about this, sorry if I'm re-posting)"
1372179225.0,1540,Why you always carry a ward with you
1358070640.0,1540,"PhantomL0rd Rage Pentakill
"
1346628684.0,1540,Thank you Riot for the free HD stream!
1375448984.0,1543,"Riot, Do you need help with your codebase or something?"
1374113079.0,1537,Fabbbyyy the Gatekeeper joins Crs Academy!
1373277676.0,1539,Lee Sin vs Zed - Nice play
1369823662.0,1535,Eu-West: Riot has to step it up!
1350448681.0,1538,"@Riot. This year for Runeterra-ween, Instead of pumpkin head minons, Give us Minons with Draven Masks or just make them all miniutre Dravens. Either is fine.
Love, Everyone ever"
1364439493.0,1534,"Replace the lock in button with a ""Ready"" button."
1351515672.0,1534,Shouldn't Guardian Angel give Wings instead of that wierd light?
1360632328.0,1541,BIG PLAYS on support!
1336411026.0,1537,Lee Sin's great escape (player Orb Link in a ~2400 elo game with Scarra &amp; others)
1373322272.0,1529,Team MRN. Beggining. End. - Marns side of a story.
1371427217.0,1533,Best idea ever from Riot games
1371583403.0,1534,Lee Sin's Ultimate Sacrifice
1326948583.0,1536,"Well, we're screwed."
1376217658.0,1534,"With everyone changing their login screens.... I thought I would give it a try,"
1350543191.0,1538,"Is it just me, or did the patch break towers?"
1347898922.0,1534,New Botlane Meta!
1360346316.0,1529,LeagueSniffer - The allround tool for every summoner
1373090713.0,1530,"Can we please make the shop range cover the fountain evenly, instead of the weird off-center area it covers now?"
1367946476.0,1533,We worked on the Freljord. AMA!
1355093319.0,1531,DAE feel the shop is not recognizing double clicks sometimes?
1366826946.0,1526,Mana Manipulator should build into other things besides the shard of true ice
1366726679.0,1527,Rune Combiner change to Rune Seller
1358366114.0,1525,Ranked League System AMA
1367373089.0,1526,"""As soon as you stop worrying about whether you win or lose and just focus on improving yourself that's when you start to love ranked"" --- Box Box"
1356717528.0,1524,CLG in 2013! [Announcements]
1348017620.0,1524,"A great ""prison"" idea for League."
1352126934.0,1528,"With the upcoming importance of 5v5 ranked, is anyone else hoping that some underground nobodies show up and dominate?"
1351091118.0,1519,Bischu's Teemo the Silent Denier of Pentas
1374210711.0,1528,Battlecast Kog'Maw Skin w/splashart Made By Taiwanese Player
1371661851.0,1525,Froggen trolling the crowd at LCS
1369217214.0,1520,"Died vs Thresh, when i noticed this"
1366504629.0,1520,IDGAF Parody - IDGAF (League)
1328749432.0,1523,I can't be the only one that noticed this..
1372409082.0,1517,New boot enchantment idea: Ward slot
1351687001.0,1517,Ahri pumpkin!
1369414056.0,1521,Insec vs Diamondprox - Lee Sin mirror match confirmed
1364757119.0,1521,Getting Fit while watching streams! Why not?
1371770630.0,1523,BUG: Autoattack Cancelling; Attacks that don't cause damage
1374018370.0,1522,My thoughts on Rengar and why Riot shouldn't go through with them
1370265047.0,1514,Different approach to ward skins.
1366139866.0,1517,Skin idea: Bee Sin
1355516841.0,1515,Nidalee's heal is getting out of hand
1354029839.0,1512,I don't want Teemo to welcome me in Reddit.
1351159218.0,1521,The honor system system has really changed the community.
1348081448.0,1519,The sickest escape/luck i have ever seen on league of legends so far
1366035519.0,1515,So 30 second Chaox videos about passport and gamecrib with drama is allowed but a 30 minute vlog with Elementz discussing his team is removed?
1361464460.0,1519,Would be cool if Riot would make a competition on who could make the best skin and then release it.
1367679488.0,1518,"Suggestion - ""WTF mode"" for practicing flashes and combos"
1363007842.0,1513,LOL's Nickname in Korea
1348349849.0,1518,Good guy HotshotGG (tournament)
1344248994.0,1519,"Jesus Christ, Singed DO SOMETHING !!"
1363835645.0,1516,Spellblade should use the crit animation
1370790561.0,1515,Teamspeak server for your Ranked Team!
1347255278.0,1512,Scarra #1 Warder NA [0:36]
1362175060.0,1512,Good Guy Yellowpete!
1337998470.0,1512,Reverse Soraka Skin Idea
1368262934.0,1507,New game mode idea ( sole survivor)
1367513353.0,1517,"If Ionia had their boots (Ionian boots of ludicity) , the tribe who win battle for freljord must have a item for them too"
1350501935.0,1510,A Shadow Isles Halloween
1368388516.0,1511,A small tribute to AD carrys[00:08]
1361218093.0,1507,I don't recognize Sona anymore
1357467582.0,1507,Congratulations /r/LeagueofLegends! You are today's Subreddit of the Day!
1373545057.0,1510,Fabbbyyy the Gatekeeper Movie! - 8:09
1360288383.0,1505,Rivington goes all Zoidberg on Reginald's Kha Zix
1355969683.0,1507,"Hi! I'm sjokz and I made a compilation of bloopers/funny moments in interviews with pro's in S2 (Saintvicious, froggen, reginald,...) - hope you like it :)"
1376572042.0,1505,Legal Legends
1367476036.0,1510,Does anyone else feel completely unsatisfied reporting a troll/feeder?
1366574329.0,1508,To all the LCS players
1363381488.0,1508,Scarizard reveals new Karma kit!
1359735855.0,1508,"PSA no-one cares if you think you should be in a higher division/tier, if you belong higher earn it again"
1372258915.0,1507,"Almost 2 months since BlackFrost anivia came out for 1850RP, still cant play her in ranked since riot didnt fix any bug"
1339530843.0,1509,"""Fear the wild"" By nfouque on DeviantArt!"
1355873119.0,1504,Legendary Skin refunds
1354853601.0,1496,My friend is so good at this game.
1375577681.0,1497,Curse partners with Nissan
1375708040.0,1496,Rabadon's or Deathcap? Zhonya's or Hourglass? Baron or Nashor? What do YOU call it? Polls Inside!
1366314522.0,1502,Presenting your NA All-Star Team
1351367297.0,1498,Something I noticed on the new Hecarim skin
1360882665.0,1501,So I wondered what the file type for replays on the PBE would be...[SURPRISE]
1348943610.0,1494,Season 2 World Finals Information Post
1370005838.0,1501,[Reminder] Platinum VS Silver
1363672969.0,1493,LCS Competition Rulings: NA Elo-Boosters
1375290449.0,1495,Froggen with an awesome play with annie!
1350644736.0,1496,I am Sona. I have 2HP more than a melee minion.
1350123298.0,1497,hi guys this is maknoon :)
1375815795.0,1496,Iron Will: A Lee Sin compilation of all of my past montages.
1359246631.0,1491,How is this even possible?
1368466586.0,1492,"We need a ""ward"" ping."
1365462200.0,1491,Tiamat needs to be cheaper and have no health regen
1366742727.0,1493,11 Things I Learned While Jungling My Way to Diamond.
1373231212.0,1494,Whats with all the AA Cancelling At the moment
1368884615.0,1497,What the flying fuck [state of runes and masteries]
1365631043.0,1489,Scumbag Oddone baits HotshotGG to certain death.
1369927891.0,1491,I think it's time Arcade Sona gets a proper partner. [Skin Idea]
1367424698.0,1487,My tribute painting to TheOddOne's performance in the LCS Spring Finals [Now following self-post format rules!]
1366154271.0,1489,Oldest LoL pro team is having it's third birthday today!
1357298076.0,1490,WHO NEEDS MOBILITY ON AN AP MID CHAMPION?
1362573024.0,1487,The best LoL thread ever?
1374763847.0,1490,Get Rid of Pando Media Player
1361080725.0,1486,"Make Challenger Tier watchable by all Summoners, Riot pls!"
1348362643.0,1490,"Rules and Structure for ""The Tournament"""
1353165979.0,1485,Wtb old League!
1346902205.0,1491,What do you call a Graves + Blitzcrank lane?
1350317064.0,1486,TPA Toyz opinion on other mid laners in WC
1349568572.0,1486,Regi Retires from LoL
1372777618.0,1484,Baron and his ad debuff
1372061376.0,1486,Where DID Rengar get that eye from? Poor Bear.
1361633885.0,1488,"Why is ""Challenger League"" not called ""The League of Legends""? "
1375896191.0,1486,"Has anyone noticed the minimap glitching, showing people in one place and then magically appearing elsewhere?"
1366894782.0,1482,Dunkey - Nunu Nights
1359506893.0,1483,"Incredible work my friend put into her brother-in-law's birthday cake. Yes, the Baron is edible."
1371783381.0,1482,Riot should seriously consider a huge summer sale.
1360149342.0,1481,Does anyone else feel that sometimes this game is only fun if playing with friends?
1372731825.0,1477,I will not rest until Jarvan the IV'th of July comes out!
1358008585.0,1485,"Minion HP Bars, visualized 100hp versions for discussion"
1356493807.0,1482,A Kha'zix Tip.
1356263744.0,1476,PBE - Teleport now green and shown on Minimap
1350399499.0,1480,Froggen Lee Sin Mid Tribute. I hope you like it Froggen.
1349304090.0,1479,"Visual Upgrade: Twisted Fate, the Card Master | LoL - League of Legends"
1366278669.0,1476,New 1v1 and 2v2 Map
1353764597.0,1480,Just an idea to make Summoners Rift a bit more varied...
1342793416.0,1476,Minions have spawned! *Buys BF sword*
1335557305.0,1472,Spectator Mode Announced!
1374436553.0,1481,How to REMOVE Udyr Comic!
1372602605.0,1483,An idea for Ahri's ultimate skin
1357425062.0,1482,Best Friends
1369598728.0,1478,Petition to make TPA Ezreal have red particles
1355401868.0,1475,The Loudest(And Greatest) Level 1 Gank - YouTube
1371823278.0,1470,Why does Ahri's charm cause neutral monster's to reset?
1370495974.0,1472,Trick I learned today for laning.
1361839754.0,1476,"So we have ""Challenger"" for the top 50 players, can we have ""Challenged"" for the bottom 50?"
1360767869.0,1473,How to make champions feel more alive
1358934758.0,1472,Singed walks into a bar.
1375035328.0,1476,Draven's New Passive: Almost useless
1371975039.0,1469,Jatt breaks down CLG's strategy in C9's first loss (extensive and fantastic analysis)
1366219350.0,1470,"Morello is ""considering"" letting Leona proc her own passive on minions &amp; monsters, which would make jungle Leona much stronger. Discuss."
1352563403.0,1477,[Suggestion] The select a Theme buttons should be changed to the logo of Leona and Diana.
1346421568.0,1472,Improving Player Reports - A comprehensive revamp of the report system
1375950529.0,1469,Krepo and Pete on Fire!
1367176408.0,1476,[Spoiler] Congratulations to the winners of the EU LCS Spring Split!
1358620256.0,1468,HOLY SHIT! Sk vs Fnatic
1355799405.0,1472,"Master Beta icons arrive today, three years late"
1353619334.0,1475,League of Legends : Ancient Secret
