created_utc,score,title
1356621487.0,4357,I'd like to see Riot test the effectiveness of this.
1363038116.0,4168,Veigar's new bromance - thought this was hilarious
1353848143.0,3220,I have made a Season 3 Item Shop simulator. Please try and comment.
1356010820.0,3177,Thats what happens everytime i play pantheon
1350994388.0,3090,24 hours in CLG gaming house
1346447786.0,3076,Steve Wang made Riot a Ryze and Tryndamere statue. Jaws were dropped.
1357590907.0,2947,"After epic fight, big fail and big los... OR NOT?"
1356095862.0,2781,LEGO League of Legends Animation
1358300528.0,2758,Dunk-master Ziggs
1333202349.0,2758,League of Legends: Stick Figure Spotlight
1350178666.0,2739,Stickfigure Spotlight 2 - Demacia vs Noxus
1352238259.0,2699,Picking guide for Solo Q Supports
1363964931.0,2692,My friend and I try funny skin-themed lane combos. This one has brought us both up several divisions: the Space Lane. Astronauts OP.
1354104224.0,2671,Idea for s3 update. A pause before game starts.
1369551294.0,2647,League of Legends Cinematic: A Twist of Fate
1364725652.0,2636,The Dunk Squad
1355097226.0,2626,I don't want to receive honor anymore.
1356094052.0,2584,What skin do you think is the worst?
1362619923.0,2586,[PBE] Afk players in champion select now get kicked instead of randomed.
1370645480.0,2561,"Going to E3, would anyone be interested in a video compilation of all the pros present saying how they got their in game name?"
1356198073.0,2535,3D Model Viewer before buying a skin (PLEASE RIOT)
1354655540.0,2506,IWillDominate banned from League of Legends competitive play for a year
1339037565.0,2447,"I don't know much about this subreddit or the game, but I just wanted to inform you all that Joe Kelly (the teenager who got to meet the creators of this game) passed away this afternoon from cancer.  He found a lot of love and support on reddit-- especially you all. Thanks guys. "
1351952128.0,2433,Worst/Best First Blood
1353938906.0,2426,[Idea] Tier 1 and Tier 2 Runes Should Be Removed
1355858469.0,2414,Deman has finally joined Riot!
1370101181.0,2414,RivingtonThe3rd Shoutcasting himself whilst playing
1368642308.0,2381,My Diana Lore Comic is Finished!
1373621903.0,2373,"The US Governement recognises the #LCS as a Sport on par with NBA,NFL,NHL so pro's get visas now"
1354932250.0,2365,"Guess what they were showing at Buffalo Wild Wings (Irvine, CA)..."
1375755271.0,2353,xPeke Shaco box
1363062152.0,2359,The rune page system is one of the most anti-fun elements of this game.
1371608117.0,2336,Apparently some Riot engineers created a stream dedicated to a constant stream of Teemo deaths from the live servers
1361285716.0,2322,Caitlyn scoring a field goal.
1376478642.0,2314,Gangplank the Saltwater Scourge (Flash Animation)
1371318599.0,2305,The best recreation of A Twist of Fate 10/10
1366652399.0,2311,Doublelift: The Road to Success
1336990253.0,2297,Singed Skin Idea - Epidemic Singed
1354149447.0,2293,r/LoL sent my daughter to Riot HQ. Thank you.
1349366919.0,2285,I want to say thank you to Riot games for giving us free HD on Twitch **AND** Own3d. means alot.. 
1365471999.0,2273,40-0 akali apology
1360666852.0,2253,How Riot and ESL are not paying tournament prizes.
1355428408.0,2250,Dunk.
1370627456.0,2249,Team Curse welcomes Crs Edward!
1366343250.0,2237,Hands Free Penta Kill
1372609514.0,2237,One of the bravest caster minions I'ver ever seen:
1362852525.0,2225,Probably the cleanest baron steal I've ever had
1354672244.0,2217,Team betrays darius
1350221799.0,2201,"Double Kat, Double Penta."
1352757151.0,2201,My idea to help new players learn champions.
1368727651.0,2189,"Riot on Pick Order vs. Call Order - ""we've ultimately decided to endorse Pick Order over Call Order as an underlying system."""
1376501875.0,2178,High elo Ahri montage
1367244762.0,2182,"Please, for the love of God, let us edit in game settings (video settings, key bindings, etc) OUTSIDE the game"
1362344299.0,2180,Why i love Joe Miller
1375925467.0,2180,Corki in real life - ACTUAL Voice Actor
1341992870.0,2162,League of Legends needs more MANLY SUPPORTS
1372892751.0,2160,What to do with thresh and syndra (1:01)
1348516449.0,2153,HotshotGG Hero-Flashes Into TheRainMan LeeSin's Q
1366291155.0,2154,MadLife on Thresh OP
1371423428.0,2155,Shit League Players DON'T Say.
1351518056.0,2149,Twisted Fate's Q target assist/indicators should be like Kha'Zix' evolved W 
1374667330.0,2141,Brave Minion Who Survived It All (Xpeke minion go?)
1370915758.0,2142,Rivington freestyles his way to victory
1365435506.0,2143,"Nexus down to 1 hp, all inhibitors gone, comeback to win game"
1354205270.0,2138,My main issue with league right now
1354801166.0,2138,Please add a filter for aura- and gp10-items to the shop (supports unite!)
1363617565.0,2135,Thresh and Ashe big plays!
1374932425.0,2132,Madlife thresh hook perfectly calculated (video)
1376340528.0,2135,Forecast Janna (New Legendary Skin)
1331062267.0,2135,"Ok guys, what do you think of my Happy Trees Maokai skin?!"
1351425304.0,2122,Can we PLEASE make Sheen's buff colour Blue?
1345036573.0,2123,The Supports dedication shown Fully in this drawing.
1362161130.0,2120,Mac Trailer Video
1351176821.0,2119,"Petition for Proving Ground ARAM Matchmaking, Over 10000 votes."
1367312674.0,2110,"Thank you for the ARAM queue, Riot!"
1353390073.0,2108,I'll never be able to officially recommend Trinity Force ever again.
1373391187.0,2101,League of Fighters - A fan made LoL 2D fighting game
1343036003.0,2096,Beep Boop fuck the potato
1370152484.0,2096,Best Ryze flash ever
1375455965.0,2087,Mercy voting and unfair advantages
1368425187.0,2081,Why you shouldn't 5v1 facecheck [0:30]
1368809102.0,2084,League Of Legends Pro player picks: Kim Jong-Un
1355491287.0,2081,"HOW TO WARD - An in depth, concise, and thought provoking guide on warding"
1363289113.0,2079,Wasn't expecting this!
1356303546.0,2068,Survival Guide to Chaox' (A-Z) Marathon
1347275773.0,2073,"Lee Sin, does whatever Lee Sin does."
1373301302.0,2067,"I was playing support, when suddenly..."
1373583164.0,2069,Thresh should start with 1 soul if lucian is in the game
1359309362.0,2065,Shushei ChestBumped Hosan - Video
1370899766.0,2061,All of these changes in patch 3.8 and one thing strikes me the most...
1354012288.0,2058,"96 hours at IPL5, Las Vegas"
1362938036.0,2057,This guy has some way cool ideas for skins. Just thought I would share his work. All credit goes to him.
1371572573.0,2046,It will be cool if riot did a documentary on the entire process of making a champion
1365702163.0,2048,Fix the chat so it doesn't automatically scroll down when someone types while you are looking for timers?
1360300862.0,2047,Kog'Maw Robot
1375583500.0,2037,Thought I'd share a quick Leona/Diana sketch!
1341029570.0,2039,Awesome Fiddlesticks cosplay from Anime Expo 2012
1367521946.0,2029,Ever wish you could find videos of Pros playing a specific matchup?
1360869147.0,2036,Riot Replays on PBE for testing
1372549222.0,2023,"Camera Guy Fail, Casters Standing Up Shouting ""WHAT ARE YOU DOING"" - Video"
1371054747.0,2023,Arcade MF concept art
1370621008.0,2023,Wallpaper for each role [1920x1080]
1333385844.0,2016,"AFK Summoners in Ranked should be given a dodge, not an auto-picked champion."
1376139883.0,2016,Streamers In A Nutshel
1361731492.0,2015,Origins of champions and their relationships with eachother
1371093144.0,2013,The Cannon Minion Bait Theory
1364405082.0,2007,GameCrib: TSM Snapdragon - Episode 6 Shake Up
1371655305.0,2002,Bug with Shaco and Bloodthirster!
1363398297.0,2001,Proving Grounds remake / Official ARAM gametype and map!
1372084348.0,2002,"5 Revive champions, 5 revives, 5 GA's. The Full Revive Bungaloo."
1370927718.0,1997,"""ireli outplayed this sejuani"" - thien chau"
1369237250.0,1996,riot(korea) don't punishing abusing..please help
1362758791.0,2001,Adidas now sponsors Copenhagen Wolves
1369973461.0,1991,ABSURD Caitlin kill in ranked match. Bend the bullet!
1364656368.0,1991,Actual Zac fly-by baron smite steal
1362202196.0,1986,Easy way to remember the new ping system!
1372160464.0,1984,Change your own healthbar color to better locate yourself in teamfights (3.8 fix)
1372836286.0,1985,Typical diamond 1 Lee Sin escape
1373249504.0,1983,The Korean Pro LoL scene
1369473928.0,1981,Stick Figure Spotlight 3 - The Twisted Treeline
1362615914.0,1975,Karma rework!
1375685003.0,1978,Finished that Leona/Diana image!
1374861255.0,1967,Inspiring fan meets the LCS pros!
1361893461.0,1972,[Bug] Sivir Bot doesn't care about s3 patch
1376304062.0,1973,Urgot + thresh combo by Krepo and Yellowpete
1352289617.0,1969,Make the AFK-er the queue dodger
1349361442.0,1969,"We pulled several all-nighters for this, hope you guys like it! Going live at 9am PST."
1365276194.0,1964,Here's my first go at LoL fight scenes. 3D modeling.
1356019899.0,1971,Champion Reduction Incoming! 
1375310332.0,1964,League of Draven mod is out!
1376400660.0,1964,Madlife is God
1373285995.0,1963,A new sight on the Tribunal (image in post)
1374290190.0,1953,Siv HD - JUKE CITY
1376016750.0,1954,Nautilus gets hooked
1375535101.0,1954,Amazing Darth Floater Kassadin.
1372094769.0,1951,[IDEA] Riot Games x Red Cross - Free Vladimir skin code for blood donors?
1363934854.0,1955,Udyr Takes The Long Way To Red!!
1338733493.0,1951,The League's supports hard at work [Wallpaper].
1366660188.0,1950,Ooh! A piece of Candy!... Ooh! A piece of Candy!
1363807906.0,1948,Just feeding my carry.
1359055970.0,1946,Season 3 Ranked system explained - YouTube
1352413452.0,1944,last night I sold my soul for some ELO...
1365096468.0,1943,"Tired of fighting over your role? Come join ""Practice Mode"" chat."
1366382618.0,1937,IP boosts shouldn't be used up from custom games.
1369079164.0,1937,HOW TO DARIUS(WITH DUNK INCLUDED)
1359928797.0,1938,Anty Meta with Heimerdinger.
1365878443.0,1922,What its like to jungle in silver
1375199742.0,1926,Our idea for a better way to voice chat...
1374465693.0,1920,randomly spectating friend's aram when...
1354029085.0,1915,Thank you Riot Games for helping a father.
1370477588.0,1914,"True ""mage"" AP mids really need to be looked at."
1364865621.0,1914,[PBE] You can now Make your own custom Item sets from within the air client!
1365978800.0,1912,HonoLulu Skin Idea [Art]
1369931428.0,1911,Reginald: Fear of Failure by VS
1371359683.0,1909,An Infographic on Crowd Control [750x2280]
1369614234.0,1903,CLG Roster Changes
1356257047.0,1908,auto attack range indicator shown when hovering over AD in new patch
1355625224.0,1909,Petition for Santa Baron 2012 - Morello plz
1370245514.0,1905,d Imaqtpie is a forgiving man
1376315922.0,1896,"Not today, Lee Sin"
1369311910.0,1904,Riot Korea being a spectator
1349349227.0,1897,Day 1 | Season 2 World Championship Playoffs | Group Stage | Live Update/Discussion Thread!
1371502778.0,1901,Amazing fan skin idea: Special Forces Varus
1345390489.0,1899,Junkbot Pantheon
1370008426.0,1897,"Riot please, we need a security authenticator"
1351691347.0,1901,This tip is one of the best things to happen in LoL
1376344801.0,1893,"Well... with the new janna skin, this just has to happen now"
1351367919.0,1896,"Whether or not Darius is OP, this guy has a point."
1367940188.0,1891,New Meta: Smite on Support Blitzcrank!
1353740436.0,1894,"This is why You're stuck in ""ELO Hell"" "
1374776493.0,1888,What They should add: Trickshots with Ziggs
1365509303.0,1885,Hello /r/leagueoflegends i am an designer for Lego. Can i ask a question?
1355152082.0,1887,Nami is not a fish
1374724874.0,1882,SKIN IDEA: Definitely Not Darius (pic included)!
1359767839.0,1882,Useless Exp Bar can be replaced!
1353250807.0,1879,New Movement Speed Record ITS OVER 9000!!
1361309212.0,1876,"""I see you use that bird of yours to scout, Quinn"""
1374592073.0,1879,"More of the story than you already know, and a ""fix"" for those of you suffering from Comcast, and other ISP's connections to Riot (&amp; Twitch!)"
1366892735.0,1874,Troll team vs Tryhard team
1373555245.0,1875,The Season 3 World Finals will be at the awesome Staples Center. Official announcement inside. AMA about it!
1365080104.0,1879,New Camera Idea
1373172468.0,1872,Now that Olaf isn't played anymore...
1375289355.0,1875,Stealth Bomber Lissandra skin!
1354038489.0,1869,IPL will be free HD :O
1355521389.0,1871,Distribution of Champion Health at Level One
1358137481.0,1870,High Elo Baron attempt
1350193803.0,1864,Congratulations to the Season 2 Champions! (Spoilers)
1358513140.0,1865,Batter Up! GIF
1367153700.0,1863,Blitzcrank Revive Bug
1355348270.0,1861,What Elo Would A Team Of Beginner/Intermediate Bots Manage To Get In Solo Queue?  riot pls this would be hilarious
1375072076.0,1857,The Difference Between You and the Pros
1373399421.0,1864,"Arm yourself as Lucian, the Purifier"
1343667708.0,1861,My Corgi Corki skin!
1373054062.0,1856,Mundo can solo Baron over the wall.
1368990797.0,1858,Everyone for Allstars missed their flight
1371397259.0,1852,Dunkey - Ready 2 Rumble
1369170318.0,1855,Support Hotline
1345036659.0,1855,Demacia time!
1369303177.0,1850,How to ADC and Jungle at the same time by Quantic Hai! [NEW META]
1349715461.0,1848,Honeymooning League of Legends style!!
1352996365.0,1850,Nami Sneak Peek - New Support
1352989452.0,1846,Advanced Game Options! Please Riot!
1376089989.0,1849,League of Legends: Ultimate Conflict [IRL Video]
1362388170.0,1843,"Would you like to see LCS All-Stars, NA vs. EUW  by the end of lcs?"
1373233824.0,1839,A Warning to New LCS teams and rising Amateur teams
1371593466.0,1843,fabbbyyy - The GateKeeper by Ey3shi3ld
1350671880.0,1841,Definitely Blitzcrank
1376256243.0,1841,Fiora's R is hideously broken.
1370441651.0,1844,How Miss Fortune's Double Up Works.
1358537274.0,1835,Pre-S3 Support Pick Guide Update - by Spellsy 
1352651455.0,1837,Warding Pro Tip
1370224202.0,1827,Would you watch CLG streams more if they were on twitch?
1352976038.0,1831,My buying habits are an adventure on it's own
1375358273.0,1819,This Bug is getting out of hand...
1368927925.0,1826,Visual Change to Ashe's Ult
1351267482.0,1824,"The Tale of Doomy, Troll Support Nasus (Or, Why You Should Trust People and Be Supportive)"
1347953720.0,1826,I knew that this game would be special from the beginning...
1370550846.0,1821,World's most unfortunate lee sin Q
1351057713.0,1824,How real men fight in summoner's rift
1369248100.0,1813,Magma chamber inc?
1373751626.0,1812,Hecarim is the Ruined King of the Shadow Isles
1364486690.0,1804,Some useful LoL websites that EVERYONE should know about
1329310993.0,1815,As Requested: a redesigned in-game shop mock up
1371582387.0,1809,Master Yi getting both visual and kit rework. Looks interesting!
1360952176.0,1803,Ashe Arrows?
1356114140.0,1811,Warning! There is a toxic link around which steals your account data!
1374158750.0,1805,Champion quotes on being banned.
1361720491.0,1808,"I'm foxdrop, a Diamond jungler who makes videos to help people improve their jungling. Would you guys be interested in a bunch of ~2minute long champion guides covering runes, masteries, item builds, and some playstyle tips for those times when you're in champ select with an unfamiliar character?"
1374612507.0,1801,Shyvana Comic
1353351376.0,1801,This subreddit lately
1364064850.0,1799,Reverse Draft Mode
1364573373.0,1798,Leona bug
1339616665.0,1801,Welcome to the League of Draven
1372746662.0,1800,Instalok - Get LP (Daft Punk - Get Lucky ft. Pharrell Williams PARODY)
1364785337.0,1802,[OFFICIAL] Declaration of War against the Imperial Kingdom of /r/DotA2
1360677816.0,1801,"Riot, we really need official replay system."
1360716740.0,1801,"Every level-up this happened, best graphics glitch I've experienced."
1367094703.0,1799,Riot approves Edwards lane dominance
1375230684.0,1790,I drew every single NA LCS player!
1360611469.0,1790,Debonair Jayce Splash Art
1375443803.0,1789,Lissandra summer skin idea
1373386061.0,1792,IMPORTANT fact about the Mecha Khazix Skin! Riot Fix please!
1354049383.0,1793,Lets turn off adblocker @ipl5
1367331942.0,1786,Enter the Freljord
1370145588.0,1782,Sejuani's Revenge
1356892896.0,1791,Characters should have a globally heard line when they get a Pentakill.
1373857743.0,1788,Does anyone else want LCS to show more of the team's communication during games?
1370885467.0,1786,Patch Preview 3.8
1371790436.0,1783,In celebration of Miami Heat as champions- Skarner denies the dunk
1366544597.0,1779,"Best Amumu Countergank Ever: ""I'm helping!"""
1348678694.0,1789,HotshotGG Dodges Malphite Ult and Gets the Kill
1375117950.0,1788,some funny stuff from the lcs
1359090216.0,1780,The great blitzcrank anti-throws
1355003593.0,1785,So this happened to me in a game of league today.
1373964948.0,1783,Dyrus shows emotion
1345715680.0,1779,Skin Concept - Plague Doctor Singed
1357524421.0,1781,Falling off Murderbidge
1372643233.0,1776,CLG vs TSM (spoilers)
1358469515.0,1779,Though I should give this a try... 
1370740613.0,1775,CLG Documentary Released!
1360096618.0,1779,Darius High-Fives Teemo; Epic LoL Flash Animation
1373389595.0,1772,The REAL League of Draven
1375186267.0,1773,Siv HD - Playing 2 Champions at the same Time
1372407583.0,1771,LoL teamfight gone circus
1358883072.0,1772,Team mates unwilling to cooperate.
1352381771.0,1772,Pro tip: Safely warding red
1355218392.0,1776,Why don't items resell for full value for 5 seconds after buying them?
1365952234.0,1770,/r/leagueoflegends Time Capsule
1375638462.0,1767,"Idea: What if Shaco's clone, upon reaching max range from Shaco, performed the Q 'poof' animation as it blinked back to Shaco?"
1373586280.0,1766,Reginald The Shot Caller
1365607062.0,1766,Key Bindings should be locked to accounts not computers.
1374103890.0,1770,Buddy of mine wants to trade 200k IP for a game against Riot staff. Help this get exposure!
1374263452.0,1762,Watercolour Wukong [x-post r/shitty_watercolour]
1367088898.0,1766,My custom LoL launcher
1352936437.0,1768,"Fuck you, Karthus"
1363385333.0,1763,Zac is here!
1370503660.0,1766,"ARAM Players, please"
1369472581.0,1760,ALL STAR DOUBLELIFT PENTAKILL (Video)
1352784189.0,1761,Make Fountain Dive more interesting
1332700747.0,1760,Funny solution to trolls.
1373843719.0,1758,A legendary support skin with ward skins also
1371143711.0,1755,Trick2g's nunu needs nerfing
1374004804.0,1756,League Of Fighters RIOT APPROVED DETAILS INSIDE!!
1361479023.0,1761,"This is getting ridiculous. No, I did not go over the wall."
1357239202.0,1753,League of Legends official replay function coming? Just got an in game survey.
1366299091.0,1757,MadLife's OP thresh play ver. 2
1372678968.0,1753,Walking a voidling
1376235940.0,1752,How about when hovering over the Sightstone all wards placed with it are being highlighted?
1371734044.0,1748,"Remove tier 1 &amp; 2 runes, make them scale on summonerlevel!"
1358174535.0,1755,One of the reasons why I hate to be the support.
1363874351.0,1756,"Account security options are archaic and far behind industry standards, no safeguards to prevent account hijacking."
1373919195.0,1752,Evil Geniuses team additions &amp; restructuring.
1365435475.0,1754,New Way of Selecting Masteries
1376523731.0,1746,Can Forecast Janna have custom camera wards?
1368553059.0,1749,Doublelift = Man of Steel
1363196638.0,1750,What happens when you're trying to contact support about your possibly unjustified ban.
1361118835.0,1747,r/leagueoflegends in 10 years (episode 2)
1364460834.0,1748,It's 2:00 in the morning and it just hit me
1371423354.0,1742,We are team velocity and we need some help getting a team house
1348074848.0,1746,Congratulations to Forellenlord the first 3000 elo player in the world!
1367319496.0,1747,Patch 3.6 is the best thing to happen to LoL in a long time!
1375825395.0,1744,Siv HD's Juke School - CLONE SHUFFLING
1361941036.0,1739,Riot... Enough of this. Kick AFK people in lobby. PLEASE
1368470943.0,1737,Dunkey: G Rated Lissandra
1365601603.0,1742,Isn't it time for minions to receive a visual upgrade?
1364252799.0,1741,WildTurtle to Remain a Starter on TSM - official statement 
1350385487.0,1737,"HUGE informational thread about JUNGLE CHANGES, SEASON 3 ITEM OVERHAUL,  SEASON 3 CHAMPION REMAKES, and SEASON 3 FEATURES."
1376425487.0,1741,Zed Ultimate Skin: Awaken
1340076728.0,1740,Pulsefire Jarvan skin proposal- Imgur
1358959183.0,1738,League of Legends: Epic Race
1371035703.0,1735,Gamebreaking! Do NOT SMART-CAST Nashors Tooth or your game will instantly crash!
1358997244.0,1733,Regarding Thresh's Ultimate
1353407587.0,1732,The ten greatest feelings as a Support
1374773209.0,1738,Adam's Sleepover #1 - Team Curse
1369856948.0,1739,EU-W Server Tribute
1369749971.0,1737,Doublelift AMA post-Allstars
1374934400.0,1740,Amazing Madlife Thresh Hook Mig Blitz Vs Frost Game 1
1371093433.0,1731,Doublelift and THE WORST TEAM IN LCS
1349568615.0,1734,stream off again?!
1367776351.0,1737,I can't believe how much work must have gone into this...LoL Simulator
1367276864.0,1728,League of Soul Calibur V
1375266030.0,1729,Thank you Riot for limiting Boots!
1358358956.0,1730,How 2k elo ranked game are really played!
1370808997.0,1728,Edward and Cop starting strong
1358290283.0,1729,New League System Coming Soon in Ranked
1375448169.0,1731,"Best Error I got so far. Well played Riot, well played."
1369956541.0,1728,Pimp Jax Trailer
1368138070.0,1728,"New Champion: Aartox, NA Reveal"
1361662875.0,1720,"As requested, a list of everything Riot is aware of AKA the ultimate Riot pls thread"
1370352705.0,1726,Tribunal working as intended
1359114210.0,1718,Nerf Irelia
1367178302.0,1719,Froggen instalocking EG vs CW
1349290536.0,1728,Better Summoner Summaries
1371431670.0,1721,Solo queue is 200% less toxic when chat doesn't work during champion select.
1355683267.0,1715,"An idea my friend came up with, and we want to know what the community thinks"
1374047534.0,1716,Boxbox does it again..
1363446699.0,1714,Riotpls scale the pitch of zacs voice with his current HP
1354729954.0,1713,TIL Enigma Item Changer + New Shop = Amazing
1334336415.0,1720,New loading screen idea! (p.s. not my work)
1349909095.0,1720,"30,000 dollar fine for Azubu Frost for rule breaking during World Playoffs"
1369747301.0,1710,One does not simply catch a Shaco
1359565933.0,1718,"CrossPvP, a new PvP.net client... coming Soon™ (Teaser)"
1366608786.0,1712,Bronze plays
1365375669.0,1711,"Spellsy's Support Cards for Sona, Leona, and reworked Karma"
1373556122.0,1710,New Load Screen feedback / idea
1371353025.0,1710,Deep Sea Fizz Idea - Riot pls
1364594950.0,1713,Karma is getting rid of all the other supports one by one.
1374124824.0,1710,I've accidentally clicked the Comic like 1000 times....
1370124150.0,1714,Final 10 Rarest LOL SKins
1363813976.0,1708,"Riot should email summoners when they were on the Tribunal, but were Pardoned."
1357164547.0,1712,Aram queue coming soon!
1351439322.0,1710,Funny Double Fail
1374979472.0,1711,This is the reason why I like normal games at 5 AM
1357538057.0,1707,Ravenous Hydra in Gangplank is now law! 
1370724485.0,1701,IDEA: Janna's tornado indicator for Allies
1368732835.0,1704,I miss taunt skating.
1360997704.0,1700,This kid keeps amazing me (Best Riven NA)
1369375682.0,1709,"""IS THAT IT?"" -Doublelift 2013 (YouTube HD video)"
1362348095.0,1705,Has anyone else gotten to the point they care more about their team not being jerks then winning?
1369616833.0,1703,The end of an era. Official HotshotGG appreciation thread.
1369663774.0,1701,Vi's sister; a theory
1368846066.0,1701,State of the League: LCS NA All-Stars Special
1364509129.0,1696,Pro Kha'zix plays! ^or dumb trynda
1358620851.0,1702,Brilliant xPeke play IEM Katowice vs SK Gaming (VOD)
1370281081.0,1700,Quinn Comic (From the maker of the Diana Comic)
1369600799.0,1693,"I wish LoL had an Champion Elimination mode where, upon death, you had to choose a new unused champion until your next death."
1363106110.0,1693,I'm Deman from Riot Games and Shoutcaster for League Of Legends AMA
1360825295.0,1696,"Flashing Malphite's ult can be a team bonding experience (feat. Onebadbrad, Bischu, Zekent) "
1358571162.0,1692,outplayed fed xerath with cait
1373124985.0,1694,No Nunus Allowed | The NA LCS Infograph - Week 4
1368150319.0,1694,Your average game of League of Legends
1345347476.0,1696,So this ad was in the train to the airport today...
1376542333.0,1694,Press R to Karthus
1340597139.0,1690,"So Yorick, do you have a best buddy among the league?"
1360536780.0,1697,"""Damage Analysis - Rabadon's Deathcap vs. Void Staff"" - by DiffTheEnder @ RoG"
1351018545.0,1689,"I'd like to publicly answer anyone who has ever asked 'why is my AD carry hitting a tank?"""
1372945030.0,1693,Would you like to see less humanoids?
1350581215.0,1690,"Summoners who AFK in Champion Select are still getting Randomed a Champion, and the game still starts unless someone else dodges. Why is this still in the game?"
1376555092.0,1688,Killing time in a custom bots game when suddenly...
1360778312.0,1685,Voyboy just lost LP for winning
1360524531.0,1691,Youtube stream the Best thing happen to LOL esport.
1371765730.0,1689,Alistar Bug Patch 3.8; Bully a lane like never before! [Original Owner]
1348171058.0,1686,Visual Upgrade: Soraka the Starchild
1354297020.0,1682,Easiest prediction of my life
1354227299.0,1687,This is how you flash in a high elo game
1357650816.0,1678,Annoying Graphic Bug on Purple Side - Can't walk close to the wall
1367340892.0,1681,"R.I.P. The Proving Grounds, December 2010 - April 2013"
1364512715.0,1681,Post about Athene abusing Ranked ELO system closed.
1364483986.0,1677,RIOT PLS: Pls don't show the trade sign if the other play doesn't own the champion!
1363112825.0,1676,PhantomL0rd &amp; TheOddOne Familiarizing with the New Pings
1361152365.0,1680,Dyrus definitely doesn't like creeps
1369090612.0,1682,HTML5 PvP.net Client
1362510384.0,1678,Something really awesome that happened during a ranked Soloq yesterday.
1361977151.0,1683,Really awesome Nocturne Graffiti!
