created_utc,score,title
1364311769.0,893,Gift I made for my fiancé: 4 Nations themed tea cup (with secret White Lotus!)
1340492766.0,891,Condescending Lin
1347675154.0,891,Benders love orange mocha frappuchinos!
1339041468.0,888,"Baby, you're my forever girl"
1340462558.0,882,"Oh mighty Korra fans from the U.S., grant us Europeans this wish:"
1343956937.0,885,Typical Azula
1342993342.0,883,Prepare your feels...
1341893028.0,884,This.. Is just so great.
1341406900.0,882,"Happy 4th of July, r/TLA!"
1372450381.0,881,Am I The Only One Who Thought This Was One Of The Most Moving Scenes In Avatar
1345322418.0,884,Aang and Lin by ~SeiraSky on deviantART
1339856532.0,882,"As Requested, Portraits of Azula and Korra"
1337110542.0,877,Tenzin must be so confused...
1369148326.0,877,The Two Sides of Katara
1340467668.0,884,"In retrospect, this ship is really not okay."
1350486456.0,880,Toph Bei Fong: The Runaway
1347396305.0,876,"PancakeBear finished their submission for the BvB art contest. Here it is, it's awesome!"
1342982790.0,882,"Found this gem on Facebook, thought i should share."
1339445043.0,879,Aang's advice for this subreddit
1335295630.0,880,i think we can all identify with this comment
1341782595.0,874,The realistic transformation of Zuko's physique over the course of the series
1355547334.0,880,Confusing Mix Messages Ty Lee
1341015921.0,873,He took evil to a new level...
1340047062.0,870,What everyone here really wants. 
1350872815.0,873,"Katara (By Bryan, himself!)"
1340203333.0,868,Update: Hey guys I want feedback on a tattoo idea
1339761066.0,869,Terrible Quality but i love it
1339153357.0,875,Saw someone who said Jinora looked like Aang with hair. Think she inherited the avatar's genes guys?
1360853955.0,872,"Another testament to the amount of detail/thought put into this show. The current Dalai Lama, Tenzin Gyatso, actually says this commonly in day to day life. "
1339338807.0,874,"So I was playing Pokemon, and I caught a shiny Ponyta- a fire type. The shiny Ponyta has blue flames, so..."
1343341744.0,869,"Avatar, but Magic the Gathering"
1345517012.0,865,So that's why Aang wanted to learn earthbending.
1339821922.0,868,Well its not Spongebob...But it is Horrible timing.
1357843633.0,872,"Day 5, Avatar Aang (bonus pic in comments)"
1343168013.0,869,Some amazing fan art.
1332524486.0,870,People said I was crazy for dating the moon...
1342628341.0,864,The most compelling evidence for Tokka so far.
1337025617.0,868,"""Do you really think friendships can last more than one lifetime?"" -B3E6 (This here made me tearbend)  "
1339111055.0,868,One of the main reason why Suki is one of my favourite female characters ever.
1338685622.0,869,"I can't stop thinking about this: ""Amon..."""
1363703992.0,869,"don't look at the price, just look at the adorableness"
1356818389.0,870,Farewell
1344824616.0,860,Benders meet alchemists 
1339266126.0,863,That's how cool he is.
1340514145.0,860,A New Era Is Upon Us...
1337474108.0,861,Look at what I snagged at a convention today!
1366320764.0,858,Mai in colored pencil
1338421989.0,864,Sokka's a pimp
1345996779.0,863,Avatar Korra [by dCTb]
1342285693.0,859,Mother and Child by ~White-Crow-Crafts on deviantART
1338571288.0,855,Bet you never noticed...
1336561105.0,857,"""Perfect Aang"""
1343238647.0,855,"Marvelous, really. "
1340654517.0,851,What happens when an Avatar doesn't kill a dangerous person
1346121020.0,855,"I can be cool! See, cool!!"
1338705009.0,860,"Analysis of all the flashbacks up to episode 8, with concrete theory on Tarlok"
1361815486.0,853,Uncle Iroh's Motto
1358085738.0,853,"Suki, by [~ladyinwait]"
1339706111.0,857,Any avengers fans?  (x-post from r/Avengers)
1370925929.0,855,Azula on the Iron Throne
1342618585.0,852,Awesome concept for Zuko's daughter by Viria13
1366028562.0,850,From the Waves
1365523224.0,850,Little Katara
1366807052.0,852,Men in Suits
1358316886.0,852,The Cabbage Merchant Hasn't had much luck in Skyrim either...
1344619243.0,847,"~WATER TRIBE~ Updated my magnum opus GIF to be smoother and have the right lighting on Katara and Sokka as they leave, and cut off the end with Lin. (Take ""small"" out of the URL to see the updated full version)"
1345080478.0,847,The only time anyone ever felt bad for Azula. 
1341635242.0,851,This made me smile...
1341436247.0,851,Surprised nobody has made this yet.
1341158892.0,846,Waiting for Season 2
1340210686.0,842,"Next weekI'm moving 1000 miles away from my best friend, he just texted me this:"
1376592217.0,846,LoK Season 2 official release date - Sept 13 - just posted on Bryan Konietzko's blog!
1365645006.0,842,Korra Book 1 Back Cover
1342557549.0,846,What happened soon after the finale...
1333469181.0,842,Clearly the look of someone who shouldn't be a firebender but is.
1341847442.0,848,The Five Stages of Grief to Off-Season
1340598738.0,849,[Spoilers: Any and ALL.] Final Avatar Family Tree. All future updates will be the same url for easy/accurate linking. Enjoy!
1340207392.0,846,"For the whole world to see, the revamped Voyeur Sato: Ultimate pervert edition."
1348672944.0,840,Avatar Kyoshi
1359481530.0,838,Home at last
1366844314.0,840,Girlfriend got me this as a 1 year anniversary gift!
1360160783.0,840,"The Gaang, by *Akimiya [x-post from /r/BendingWallpapers]"
1339636697.0,840,I feel so bad for making this but... here is Horribly inappropriate joke Amon
1374579714.0,844,"It's not mine, and it's probably a repost, but I just saw this and it made me chuckle. Thought you guys would like it."
1355933431.0,839,Azula in Earth Kingdom
1342804816.0,839,Sibling Rivalry.
1339195474.0,838,Their rivalry is still going strong.
1366728393.0,837,My friend and I got into a little earth-bending duel...and yes I am aware of our terrible form
1349250792.0,838,"So I found this, and I don't know why but the more I watch it the more funnier it gets."
1336934469.0,834,"Inappropriate Timing Spongebob, A:TLA Edition"
1334447338.0,838,My favorite new theory.
1344003928.0,837,Awesome Avatar/Harry Potter crossover by Viria
1339873253.0,833,"Like Mother, Like Daughter."
1334977064.0,839,"Forget kittens, Foofoocuddlypoops belongs on the front page of r/aww."
1334525913.0,835,Gotta bend it all!
1368636520.0,841,"This is the most beautiful firebending art I have ever seen, and it is now my background. (Not my work, by Ninjatic on DeviantArt)"
1352708746.0,833,Amon knew that there was No Church in the Wild. 
1339287428.0,835,Korra gets in touch with the wrong Aang
1339491885.0,834,Toph Beifong fanart by UiCha on deviantArt.
1349024363.0,838,Been having these 4 images cycle on my desktop for more than a year now.
1343083877.0,832,Best crossover I've ever seen
1344272315.0,834,All they had left was woman size t-shirts. My friend didn't seem to mind.
1343684117.0,836,It Occurred to Me that Each Avatar's Greatest (Emotional) Strength is Also Their Greatest Weakness.
1336347905.0,833,Did anyone else think this reference was the best part of Episode 5?
1341123206.0,831,One of my favorite dialogue from ATLA
1344107782.0,832,Assuming Rohan turns out to be a bender...
1340585235.0,829,How Bei Fong's show affection...
1357867663.0,835,"Throughout the whole franchise, we've never seen Lin's father..."
1339273297.0,828,I made this for future wild theories.
1342585680.0,828,googlebending
1375019253.0,826,Awesome Yue Cosplay!
1349855760.0,828,I get chills everytime I watch this
1340684495.0,828,Tarrlok doesn't appreciate Amon's sense of humor
1339942191.0,829,"Yes, Tenzin's bending was completely badass in Ep.10, but I'm still waiting to see this move"
1340756231.0,833,"I was going to draw a genderbent Korra, but then I realized..."
1336637345.0,827,Some things never get old
1359573897.0,826,The mother of metalbending
1369358434.0,824,Nick pls
1368474819.0,824,Family tree
1340332886.0,819,I met Zuko/General Iroh today!
1339879159.0,822,I have a similar reaction when some of my friends drive
1339380041.0,828,Just ONE little thing I didn't like about the latest episode. [SPOILER]
1340026078.0,826,Bad Chemistry Joke Amon [SPOILER]
1338813581.0,827,"I am going back through TLA, by far my favorite part in the whole series!"
1340386587.0,824,"I would just like to point out how terrifying this must've been for Toph: No control over your own body, AND disconnected from your means of ""sight""."
1352399859.0,823,"Bandit, Sifu, Chief"
1348416037.0,822,I'm watching you too...
1364926287.0,819,How reddit was yesterday
1342569960.0,813,Nice to see credit being given where credit is due!
1340402533.0,812,"Oh, Amon..."
1340119409.0,815,Do the Creep
1361499868.0,819,Dropped this bombshell in college lit. discussion. Professor commented on my eloquence.
1340945756.0,821,Korra abuses her newfound abilities (Spoilers for finale)
1336742012.0,817,"Korra, this isn't what you think!"
1340111752.0,816,This show is art. (Some of my favorite screen transitions/shots)
1361351337.0,813,Sons or Daughters?
1348709420.0,816,I may have freaked out about this a little more than I should have.
1347128512.0,814, Disguise level: Team Rocket
1343580654.0,816,I found Tenzin's baby picture!
