created_utc,score,title
1339564290.0,2652,Firebending?
1335228205.0,2634,Water Tribe! (Credit to @thisusernameismeta)
1350313891.0,2615,The most precious cosplay pair from SDCC
1374261361.0,2533,Official Book 2 Trailer Released
1340304211.0,2522,My small attempt at an Earthbender vs. Waterbender fight.
1351733736.0,2494,My math teacher is awesome
1355071092.0,2401,"""I missed this."""
1356014688.0,2393,Legend of Korra wins Best Animated Series of 2012!!
1341451594.0,2358,Smooth Exit
1339696443.0,2320,Mama Toph
1339361004.0,2308,"Oh, Aang, you're such a troll."
1342844279.0,2231,"Reddit, let's take today to remember the original General Iroh and renowned voice actor Mako Iwamatsu, who six years ago died of esophageal cancer. He was a man of many talents, and made Iroh one of the greatest characters in the Avatar universe. Rest in peace. "
1340161334.0,2214,The Problems Just Pile On (Spoiler)
1342409774.0,2186,NO BENDING!
1374070652.0,2183,My wisdom
1339961604.0,2186,I was editing a LoK image in Photoshop.... and I made a horrible mistake
1369659847.0,2168,Toph's dad looks pretty familiar.
1355176401.0,2143,One of Iroh's best quotes
1350409072.0,2127,This was emailed to me and I think it speaks volumes. 
1361247966.0,2105,Daniel Radcliff is one of us
1334718884.0,2093,Tattoos are forever
1351780256.0,2082,My 4-year-old wanted to be Aang.  We didn't want to be left out.
1349622624.0,2074,Zuko Pro-Bending
1368394207.0,2045,"Myself as Aang. Posted this on /r/cosplay, found out this reddit existed. Enjoy!"
1362584219.0,2041,This is easily the best Facebook birthday wish I ever got.
1358875215.0,2027,I hated both of these movies.
1374703054.0,2027,This is the first time I've drawn Azula. I hope I did it justice..
1342033699.0,1992,EW says Korra is getting 26 more episodes (not including the second season).
1375369298.0,1986,When the Airbenders nearly went extinct...
1372020663.0,1982,Todays beach pic - Tragedy
1360108592.0,1979,From Dante's AMA
1350237487.0,1973,Appa Pumpkins! 
1359944917.0,1965,Well Valentine's Day is coming up.....so
1336963201.0,1955,"Saw this one on tumblr, thought it was pretty great."
1354741176.0,1952,"Scalded My Face Last Night, Somehow Not Upset - Thought This Reddit Would Appreciate"
1363638331.0,1943,I'm Aang.
1340475898.0,1938,I believe this was everyone's reaction [Finale Spoiler]
1376361150.0,1936,"I made a gif of Sokka for /r/upvotegifs, thought you all might enjoy."
1361377701.0,1927,Interesting little picture I came across..
1335711246.0,1928,My wife spent a year and a half making me this reversible double sided Avatar blanket :)
1368990489.0,1918,Master of All Four Elements by friedChicken365
1375058912.0,1914,Why everyone needs to read the official Last Airbender comics (from THE PROMISE)
1349475283.0,1913,Air Nomad...
1361641942.0,1909,"Avatar premiered 8 years ago today, happy birthday!!!"
1340956026.0,1893,I found this on Tumblr a while ago. Best cosplay ever? 
1349109717.0,1884,/co/'s carefully thought out and completely objective opinion of Mako. 
1349716162.0,1886,Poor Toph.
1340665065.0,1888,"Went to Starbucks today, friend said that his name was Mako. Barista smiled but then didn't ask me for my name. I was confused until..."
1347062477.0,1876,Brave Soldier Boy
1337553868.0,1873,One of the many reasons why I love Iroh.
1356572651.0,1863,Baby Lion Turtle
1371630983.0,1863,Wanted to post something special for today
1362943804.0,1861,Past and Future
1354909069.0,1848,ATLA and War
1356290382.0,1846,Oh Iroh.
1355966079.0,1834,"Found in r/funny, it belongs here instead."
1343636646.0,1832,A resident of Kyoshi argues with the corner of a house and loses
1337633463.0,1831,Can This be a Thing Now?
1369854301.0,1818,Why this episode is one of my favorites.
1342224433.0,1820,Full Older Gaang from SDCC poster. Hot glorious damn!
1353783065.0,1814,Wisdom 
1368047614.0,1804,Real life Cave of Two Lovers (x-post from r/EarthPorn)
1366638805.0,1797,Can we get some background on this guy?
1368800586.0,1793,Sozin's Comet is coming!
1340396647.0,1793,"This is, by far, the best 'Koh is Amon' theory I've seen "
1367156597.0,1785,So last night I was surprising my girlfriend with flowers after work....and got dumped.
1339991728.0,1784,How this subreddit acts sometimes.
1365112275.0,1776,"Not completely accurate, but heres my Kyoshi Warrior inspired face paint (x-post from r/cosplay)"
1365467896.0,1768,I started making upvote gifs and thought you guys would appreciate this!
1353195237.0,1763,"To the Avatar ""Confusion"" means ""let's kiss now!"""
1347826987.0,1766,The best feeling
1354821198.0,1765,Found this poster on campus today
1350738274.0,1760,Bonding time . . .
1366220063.0,1758,Any fans of Lindsey Stirling? I really hope she does this.
1347212333.0,1756,How I picture Reddit over the last day
1346017247.0,1751,In Honor of Neil Armstrong
1338150461.0,1750,"In honor of No LOK saturday, i made a short animated bending fight for fun. "
1352153701.0,1741,Leaves from the Vine
1344980845.0,1744,I've never really forgiven Master Pakku
1341530070.0,1733,I'd watch it.
1370709823.0,1734,Best recap-everything-before-the-finale' episode ever.
1356211739.0,1733,take my money
1341757270.0,1733,Coming This Summer
1359741017.0,1729,"I was watching Planet Hulk, and the child red king seemed kind of familiar..."
1342373052.0,1725,The last panel really makes this for me.
1364517862.0,1725,Suit yourself!
1349269531.0,1721,I posted my cosplay a few weeks ago and you guys told me to smile. So I totally Ty Lee-ed up my personality and smiled! 
1357370194.0,1715,The level of detail in this show just blows me away. Check out Aang's hands in The Guru.
1357191211.0,1714,Whenever I see a TLA reference outside of this subreddit
1370129256.0,1709,Bad Joke Amon
1351347810.0,1711,Hipster Katara
1350186638.0,1710,Gangnam Style
1340024046.0,1705,The GAang all grown up.
1358015329.0,1705,My First Teacher
1368200272.0,1697,How It Feels Waiting For LOK Season 2 to Arrive
1375580942.0,1698,Why Avatar isn't just a kids show.
1362354102.0,1693,This is just kind of adorable...
1340513097.0,1692,Korra you just cant go around asking things like that!
1338389710.0,1685,All we need is a fifth person in the Avatarmobile
1350839062.0,1684,How awesome would this show be?
1375909138.0,1680,Disney Princess Avatars [x-post from r/Disney]
1342488397.0,1681,This can only end well
1351449424.0,1673,could not be more proud of my friends costume choices.
1337741548.0,1669,Korra gets her revenge.
1354188038.0,1666,Avatar Aang in minecraft. (Xpost from r/minecraft)
1344367809.0,1668,Nickelodeon storyboard artist draws General Iroh and Uncle Iroh having tea (x-post from /r/IAmA)
1370609610.0,1664,"My friend's neighbor has cancer, and since he is going through chemo right now he is bald. My friend's younger sister had the great idea of doing this to him."
1346577939.0,1664,I think this drawing by sillythings deserves more attention
1367717377.0,1664,r/photoshopbattles Creates A Masterpiece
1348109811.0,1663,Azula's opinion on Flamin Hot Cheetos
1343831774.0,1650,I didn't want to think about it.
1346337835.0,1654,When I notice a typo in my post right after pushing submit
1340764524.0,1646,"Color Schemes: I love how each season has locations and colors corresponding to each chapter's respective element, especially in each season finale "
1335140915.0,1648,We miss you Aang. 
1373744942.0,1643,"I am Jeremy Zuckerman, LoK &amp; ATLA composer, and I'll be hosting an AMA on July 16, 12pm PST in /r/IAMA!"
1341165018.0,1638,Parenthood.
1337603788.0,1643,Avatar Pabu
1338363442.0,1636,"Hey, r/TheLastAirBender, you are today's Sub Reddit Of The Day! Congrats!"
1360863067.0,1640,One of my Co-workers owns this. Holy Crap.
1375199756.0,1640,Excited Tenzin
1340690939.0,1632,That's weird... [SPOILER]
1340097803.0,1626,proud of you
1352548704.0,1629,Most under look relationship in ATLA
1366573784.0,1628,This is how adult Aang meditates
1337314406.0,1628,I was watching The Simpsons when...
1364155784.0,1619,My Desktop (x-post from r/funny)
1344492459.0,1623,"Had Sokka never said this, the Fire Nation would have won the war."
1339035335.0,1621,No Church in the Wild
1373944282.0,1623,Katara and Aang years later by sherbeeee
1364418875.0,1625,"Just realized that even though it took a few months, Sokka eventually broke his old habit!"
1372353869.0,1614,"I always thought the landscape in Avatar looked familiar, this can't be a coincidence!"
1342570221.0,1616,So I made a wallpaper featuring a few famous benders... (x-post from r/futurama)
1340558528.0,1617,No more bad jokes
1350744187.0,1606,How can you be enjoying this? 
1364918397.0,1614,I found this image to be very.. heartwarming.
1367020583.0,1607,Sokka never changes
1340486942.0,1610,Season 1: An Alternate Ending [SPOILER]
1345142043.0,1608,Amazing Korra fan art. Absolutely stunning.
1354287092.0,1605,I Rise With The Moon
1356121740.0,1599,Bryan Konietzko posted this on his tumblr
1357104293.0,1601,"I found this, and it was painful, yet hilarious."
1357005261.0,1595,"Seriously, this must have occurred to Aang at some point..."
1351092745.0,1585,"This guys whole car was painted like Appa. Sorry for the bad pictures, I was trying not to wreck. "
1341226540.0,1587,Sozin and Roku in The Avatar and the Firelord
1342719703.0,1586,I just realized this while rewatching the Southern Air Temple. Gyatso must've been a serious boss.
1351887803.0,1580,Legend of Tron
1372834280.0,1583,Bryan Konietzko's amazing response to people complaining about a lack dark skin tone representation in Aang's kids
1347565182.0,1573,DAADDYY!!
1366137021.0,1575,Cheif Bei Fong cosplay
1335418200.0,1568,Amon on Sokka's love life
1364745915.0,1572,"I made some easter eggs too, though a bit more minimal."
1365025614.0,1564,Anyone else think Piandao should have had more screen time?
1356663183.0,1567,iRoh
1359790893.0,1566,"Came across this, made me chuckle"
1344031280.0,1568,First fan art I dare post publicly. Hope you like it r/tla (as a thanks for keeping my Korra withdrawal in check!) :D
1333496516.0,1564,The Avatar's mating stance
1340565602.0,1566,"Look at your firebender, now back to Iroh"
1340686255.0,1558,"By all accounts, it doesn't make sense."
1359897669.0,1554,This kind of thing happens a lot.
1359384682.0,1563,"This is my dog Appa. I taught him the command ""yip yip"". I hope you approve. Also, this is my first submission. "
1353360638.0,1558,Zuko approves this 
1334788175.0,1556,An artist's idea of the Gaang in their prime
1371446421.0,1553,"Happy Father's Day, in recognition of the show's strongest father figure"
1346253947.0,1560,Prince Zuko is basically Mr. Crocker from The Fairly OddParents
1342146417.0,1554,BE THE LEAF - by gagbagchen
1374872346.0,1552,Baby Bolin and Pabu
1341679833.0,1549,Aang and his forever girl
1340997861.0,1547,Suki's Edge
1360382944.0,1532,Legend Of Korra meets Pokemon
1350003329.0,1540,I love my friends: The Fresh Prince of Bel-Airbending [fb]
1362521839.0,1537,the beginning to the end
1336170368.0,1535,I just completely remade the greatest GIF ever - now with color correction and 100% more Katara!
1361845750.0,1532,Korra Harlem Shake. I died laughing. 
1362955821.0,1534,My thoughts as I changed my clock today.
1343843648.0,1531,Please oh please oh please!
1354531661.0,1525,This was definitely one of my favorite scenes from Korra! 
1349046332.0,1524,My Greatest Fear for Season 2
1355268617.0,1527,Watching Season 1 of Korra again. This is still one of my favorite scenes. 
1342812173.0,1521,"That's deep, Iroh."
1343085448.0,1513,"Its messy, but I was told to try Mai's hairstyle."
1342625294.0,1514,"Two Avatars, One Katara"
1348264977.0,1515,Just a Kid's Show.
1353286467.0,1511,Whenever I watch ATLA with people . . .
1340053674.0,1509,The only ship I'm pulling for. 
1357320774.0,1505,Bruce Willis as the Last Airbender
1373193289.0,1501,"Im a night worker at wal-mart, these just came in :D"
1361731180.0,1500,Awesome Korra art
1344734023.0,1503,Before I die...
1346448374.0,1495,Yue and Neil.
1369278134.0,1497,"I was watching ""Schindler's List"" and thought this was so relevant."
1361104066.0,1497,This hit me right in the feels
1368920753.0,1495,Avatar Aang
1341431561.0,1489,Who comes up with this stuff?!
1352036998.0,1492,I see your Amon's Creed and raise you Assassin Korra.
1372730368.0,1493,Poor Sokka
1375657642.0,1486,"Went to comic con in Boston, found a Katara to my Aang!"
1339524587.0,1490,"So I was in a history museum, and I thought this particular weapon looked familiar..."
1371111961.0,1487,"Future Earth Kingdom (Fangyuan Building in Shenyang, China)"
1351212759.0,1489,Something I found on Deviantart.... Just... Wow.
1364576926.0,1487,I don't remember him being in there... (x-post r/pictureswithpatrick)
1341068162.0,1479,Justice
1363460548.0,1473,My new phone case just came in the mail!
1340896134.0,1480,"Happy Birthday, my son"
1354432948.0,1479,When my friends ask me if I want to watch some avatar
1352319507.0,1474,The four benders.
1359059233.0,1467,Amazing animation of Korra vs a spirit by ~SolKorra
1339026284.0,1468,One of my favorite Toph moments.
1366480769.0,1469,The scene that made me love Ty Lee
1367689303.0,1466,This is why Uncle Iroh was my favorite character.
1349308215.0,1467,"I'm not sure who the artist is, but it made me laugh."
1342541065.0,1466,I had no idea what I was getting into.
1360651150.0,1463,A facial study - Aang and Jinora
1369099395.0,1463,An amazing Azula cosplay
1349563782.0,1456,"In pictures, how Korra mastered the Avatar state."
1375117789.0,1457,As requested: Art Nouveau Avatars Lineup
1344868162.0,1458,Bedtime stories
1336950162.0,1456,"Two can play at that game, Spongebob."
1359138286.0,1458,Legend of Korra student animation
1343921159.0,1459,Where exactly is your scar?
1340337289.0,1451,Zuko yearns for honor...
1341457333.0,1454,Saw this on my facebook...mind=bent.Would love for this to be the second season! (Mild season one TLA spoilers)
1358705036.0,1450,I thought you guys would enjoy these scrolls.
1347375572.0,1450,Legend Of Korra Equalist Glove!
1376166635.0,1443,A crossover of my two favorite animes.
1348758986.0,1442,It's finally finished
1336432423.0,1441,How the Fire Ferrets got their sponsorship
1360014013.0,1441,Dante Basco is doing an AMA tomorrow at 1! Spread the word!! 
1339726071.0,1439,Daddy Aang
1341370926.0,1432,Kristen Stewart visits the Spirit World
1361230341.0,1430,Boomerang ALWAYS comes back
1355857620.0,1431,The Last Thornberry
1370201345.0,1431,"In honor of my cakeday, i'd like to share with you guys/gals one of my favorite Avatar Scenes"
1354223955.0,1426,Way To Be Aang.
1353548129.0,1432,Youtube made me lol
1346199759.0,1430,"Cabbage Man: Innocent merchant, or secretly a complete boss?"
1338972409.0,1430,Is this still a thing?
1369504512.0,1427,If ATLA was a reality
1335450445.0,1428,I received a letter from Amon today
1376233096.0,1425,Kyoshi: The Undiscovered Avatar (Ongoing Fan Comic from Deviantart)
1347911942.0,1427,"Damnit, Toph!"
1345268047.0,1424,"Let's wish a happy 18th birthday to the fantastic voice of Toph, Jessi Flower"
1339772159.0,1421,"Korra is the avatar, so that means..."
1363189726.0,1416,My Mako cosplay for Megacon this weekend here in Florida
1339291853.0,1421,This subreddit every time Korra is in danger
1347975304.0,1421,The Moon. 
1362873849.0,1415,"It wasn't what I expected when my boyfriend started asking my ring size, but it's beautiful and all a girl could ever ask for!"
1340142708.0,1414,A little break
1361478030.0,1422,Just did this for r/photoshopbattles and someone mentioned you all here might like it :D 
1342462261.0,1419,"My friends and I, Bloodbending at SDCC '12"
1375988017.0,1414,Some employee at target dared to place these together.
1365347727.0,1414,TIL Bryan modeled Korra's physique off of internet sensation pole vaulter Allison Stokke.
1360897877.0,1416,I made a downvote gif of Ozai.
1365587154.0,1405,Toph and Daredevil meet.
1341079491.0,1410,I asked a girl out using lines from a certain show... It worked!
1353109634.0,1410,Prince Zuko of the Whale Nation 
1342931645.0,1410,THE BOULDER IS INSECURE ABOUT THIS
1339782830.0,1407,This made me laugh way harder than I should have...
1361888743.0,1411,My school has a new anticheating campaign 
1358457908.0,1407,Angela Song Mueller in now on the Korra crew; this is how she draws... for fun.
1345762835.0,1402,Bad Joke Bolin?
1344182589.0,1408,If only...
1345386674.0,1407,"Earth, Fire, Air, Water ∞"
1341096856.0,1404,The only appropriate casting choice for Toph in the second movie
1351916514.0,1402,Bing: The last search engine
1366895643.0,1399,"""I always tried to tell you that Pai Sho is more than just a game."""
1361570808.0,1398,"I was watching the part where Zuko joins the group, and this is all that I could think about."
1364957818.0,1391,Anyone else think that there's no way this is a coincidence?
1370980535.0,1394,Probably the best reaction to those Nick interview kids
1346080167.0,1392,Oh Sokka ( Avatar Memes FB Page)
1358114550.0,1391,Shadows of the past
1374180183.0,1383,"Wan, the very first Avatar in existence"
1364183299.0,1382,There it is!
1367880327.0,1385,"Re-watching the series, This always saddens me"
1341280925.0,1377,Every time I rewatch the series I catch something new. The attention to detail is astonishing.
1340563027.0,1378,My biggest fear about Season 2...
1355501339.0,1374,Korra visits Aang and Appa in the Spirit World
1346968969.0,1371,This definitely could have caused some problems
1343090297.0,1373,Just a mural my friend and I put in our new apartment
1338056515.0,1373,The waterfall behind Sokka's drawing exists!
1340577454.0,1379,And now for something not Korra-related... I give you the greatest bookmark I have ever owned.
1352234978.0,1370,My vote for president
1367359720.0,1378,"""His Momo-ness"" - My painterly depiction of Momo"
1344359574.0,1367,Boo Hoo Mako.
1357921111.0,1371,My favorite picture of my boyfriend and I. Halloween 2011. 
1362420424.0,1369,I think Macklemore was forgetting someone...
1343230945.0,1369,Dear Nickelodeon:
1367967455.0,1370,This belongs here
1345956523.0,1364,the fact that its an xpost from r/trees only makes it better
1375487874.0,1361,The Masters
1340823449.0,1361,Amon wins a boat ride
1366783695.0,1366,First words
1341672769.0,1362,Is the hole really necessary?  
1360719934.0,1358,I wish there were more times with these two together
1350920539.0,1355,LoK And Mothers...
1342681207.0,1359,Four years ago on this day this happened. Time flies. 
1339459625.0,1357,And not a single fuck was given
1369951124.0,1356,"In honor of my cake day, here's my favorite Katara pic."
1358045971.0,1358,Oh Sokka
1346093843.0,1354,Which is your favorite superhero?
1368501096.0,1346,This is kinda Amazing
1338851434.0,1344,How I feel about this subreddit sometimes...
1358574287.0,1344,I never get tired of Bryan's acting references for the animators
1368143578.0,1347,TLA will stop streaming on Netflix after May 22nd :(
1336692550.0,1345,Korra IRL
1348971682.0,1344,The best and most accurate Lin Beifong cosplay to date
1358945436.0,1340,Iroh is awesome.
1340677648.0,1346,Let's fix this
1339892847.0,1339,Meelo's got himself a new job
1340479340.0,1337,[Spoiler] Being so right never felt so good.
1343266436.0,1335,Sokka and the Spirit World Bathroom. Coincidence?
1346698752.0,1336,The Avatar's Journey
1353945334.0,1328,"""I'm Free"""
1341803947.0,1334,"Toph, you've changed..."
1359343782.0,1329,I made this for you guys
1341770476.0,1330,"If Zuko became a musician, this would be his debut album:"
1339631730.0,1327,King Bumi was doing it way before Bad Joke Amon
1340480686.0,1330,I waited all season for this
1355439375.0,1328,You made him cry :(
1343673448.0,1327,Cartoon Styles of LoK
1350998892.0,1323,My favourite part of The Lost Adventures
1371321874.0,1320,"I enlarged the ""Old Friends"" picture a while back and made it into a wallpaper. (1920x1080)"
1354477968.0,1325,Most of Lin's Thoughts End This Way
1342999955.0,1321,My thoughts (and drawings) about characters before and after their sad endings 
1367209592.0,1319,Inspired by /u/SuperJordan - No Avatar in the Wild Wallpapers [1920 X 1080]
1356366445.0,1323,"Avatar Aang, how you do go on"
1375744893.0,1308,Best Mai cosplay I have ever seen.
1364861860.0,1316,now i REALLY don't remember him being there
1345002156.0,1313,"The results are in for ""Most Evil Villain!"" "
1340899501.0,1317,"Hey guys, found something interesting."
1353624515.0,1307,The Gaang finally sees their movie
1345829367.0,1312,"Together, we will be the strongest subreddit in the entire world! We will dominate the Bronies! "
1345560870.0,1309,Republic City: A humble beginning
1374621506.0,1315,I'm pretty sure the person who captioned this doesn't watch the show
1342791446.0,1310,Zhao Approved
1342051306.0,1312,Its tradition with my friends to name our new houses/apartments after fictional places. Good thing no one I know owns a drill...
1341791697.0,1305,Bolin's downvote brigade.
1358528834.0,1305,Finally got the word I was waiting for on Draw Something
1354045513.0,1302,So my school has a laser engraver. (Back of my phone)
1361033409.0,1298,Firebending sibling rivalry on twitter!
1333932468.0,1300,Good Guy Iroh
1359283516.0,1300,MUFFINBENDING: THE ELEMENT OF TASTINESS!
1365770610.0,1299,Inspired by an earlier submission
1346418516.0,1294,Yakone tells the worst jokes
1343169374.0,1299,So my brother just posted this on my facebook wall.
1340522953.0,1296,"Winner of ""Best Korra Prediction"""
1344477261.0,1294,The last line of Avatar: The Last Airbender
1339293602.0,1293,I wish we saw more of Sokka
1363821448.0,1290,(x-post r/redpandas) Auckland zoo names baby red panda Pabu!
1343774640.0,1286,The ultimate enemy of benders everywhere has finally shown his face....
1341291565.0,1285,Legend of Korra: Ace Attorney
1359677210.0,1289,My favorite character saying my favorite quote.
1363401521.0,1288,Blew my mind when my gf pointed this out to me
1351947541.0,1281,Amon's Creed.
1347288745.0,1287,Young Lin
1342450331.0,1284,Koh's greatest challenge. [Stare down by jesterry]
1344260600.0,1284,Sokka loves his science (congrats to Curiosity) 
1365428285.0,1276,Got Myself A Tattoo
1344313425.0,1284,How did I not notice this?
1338126836.0,1282,Oh so that's what happened (xpost from /gaming)
1353068601.0,1282,Stained Glass art I found.
1368834679.0,1271,Suki's Edge
1362728449.0,1281,Best Bolin Cosplay [Found]
1351269384.0,1274,People from the water tribe will fit right in.
1340731253.0,1277,"To everyone confused about Amon's skin color apparently changing, I offer you this comparison:"
1347152576.0,1275,"I am not Snoo, I am REDDIT LORD"
1344544003.0,1273,No place in the world for you anymore.
1363114856.0,1267,The Sokka/Macklemore Picture Inspired Me. 
1350434697.0,1261,"Childhood, Teens, Adult"
1347641513.0,1269,Avatar meets Teen Titans
1345818421.0,1266,"Moving into college today, and as I'm walking around campus, I see this magnificence."
1341029905.0,1264,LOK discovers shipping by Booter Freak
1335886576.0,1265,Mako=Batman
1343324812.0,1263,My FB just became the coolest of everyone I know
1350699411.0,1262,Fanart: in which Katara is captured in a fire nation raid and raised under Iroh (becoming childhood friends with Zuko).
1346312710.0,1262,The Fire Lord doesn't babysit for certain reasons
1353501293.0,1255,"Damn it Lin, I need those pictures now!"
1346342685.0,1257,Reluctant upvote
1359329233.0,1250,Behind every light is a shadow
1357460995.0,1251,The fire nation capital exists!
1356456103.0,1251,Merry Christmas from Republic City!
1343311132.0,1250,My friend's Sokka cosplay for Otakon
1344647951.0,1249,Found on my Facebook feed
1340454346.0,1245,The Modern Gaang by *viria13
1340484647.0,1249,"No Roku, I know you'd love a callback, but ..."
1335732237.0,1244,Let's get down to business to defeat...Amon.
1355627379.0,1244,Finally got around to framing my water bending scroll.
1370461209.0,1245,You've got to love those random moments
1341242682.0,1245,Pokemon master Korra
1373352544.0,1241,The funniest part of the Serpent's Pass
1369433078.0,1239,Bolin and a street kid
1365810865.0,1240,I have half a mind to send Netflix a sternly worded letter...
1366069574.0,1234,Fabulous.
1353829005.0,1238,Uncle Iroh isn't the only one who gives good advice.
1338651906.0,1236,The only thing Korra fans hate more than Tarrlok right now...
1337464229.0,1242,"Korra, I choose you!"
1372299166.0,1232,Katara and Aang at each other's deathbeds?
1342650875.0,1229,A lot to live up to
1361334208.0,1234,My favourite piece of Avatar fanart. Looking for source.
1342661511.0,1233,The most emo thing Zuko has ever said [FTFY]
1344092781.0,1224,Katara and Sleepy Aang
1333715520.0,1224,"My friend had one huge complaint about LoK, and I find it hard to disagree."
1370909728.0,1226,[Spoilers]Book 2 Preview WITHOUT the annoying kids!
1351334639.0,1224,[x-post adventuretime] Bending Flame Princess
1351512952.0,1223,/co/ discusses Korra
1356883449.0,1225,A little confused . . .
1343161165.0,1219,My friend cosplaying as Mako
1376441517.0,1225,Bolin is so punny
1369773474.0,1223,So this was posted to /r/battlefield_4
1332856430.0,1218,Katara and the White Lotus share a few words.
1335920789.0,1219,wonderful contribution to kataang in my opinion.
1372962483.0,1211,Dad had no idea why I loved the necklace he got me so much...
1352913148.0,1215,Check out my brand new shirt.
1353420573.0,1208,I found a new feels .gif
1346637570.0,1214,Truly amazing picture of the Gaang.
1338766488.0,1208,Aang's been trying to contact Korra for a while now...
1339986401.0,1207,Saddest Father's Day  
1367331857.0,1206,The industrialist's daughter and the Firelord's son
1347729253.0,1206,If it weren't for these meddling kids...
1342896443.0,1202,"Substance, Power, Freedom, Change."
1340484739.0,1206,Was anyone else half expecting to see this?
1342845906.0,1198,Lin and Melon Lord
1340481304.0,1204,And the Award goes to... Tarrlok! He deserves it.
