created_utc,score,title
1349368890.0,1204,[Self] Toph and Tough(ManToph) at Otakon 2012. Me and my GF.
1375237414.0,1199,Naga has all the answers...
1346430743.0,1199,Metalbender Bolin
1343577102.0,1195,One of The Legend of Korra's greatest attributes
1340681044.0,1199,I'm going to hell for this...
1364816151.0,1194,More /r/pokemon shenanigans (x-post)
1360264146.0,1196,"TIL ""Laogai"" means ""reform through labor"" "
1348384016.0,1194,"Lets wish Zachary Tyler Eisen, the voice of Aang, a Happy Birthday!"
1371478879.0,1192,"Searching through my DevArt favorites, this one always makes me giggle."
1370875275.0,1187,Choosing to do what's right. (x-post from r/quotesporn)
1340988727.0,1192,All Grown up. 
1371385557.0,1192,Drew some more Korra fanart
1360461266.0,1190,The image that made me start watching the show
1353248797.0,1190,I'm more of a sunset kind of guy 
1352578231.0,1190,Beifong Family Tradition
1357742087.0,1183,My favourite Zuko moment.
1350659964.0,1180,A Man That Was Simply Ahead Of His Time.
1349775132.0,1183,I rigged it!
1364779666.0,1180,[SPOILER] BOOK 2 RELEASE DATE FINALLY ANNOUNCED!!!
1341269612.0,1186,Aang on promises
1371685441.0,1183,Art at the local sandwich shop where I work
1362759409.0,1180,Agni Kai!
1351284639.0,1180,KORRA?!!
1345503281.0,1181,It took hours to beat the fire lord. 
1362213846.0,1178,Chrome &gt; Avatar (xpost from /r/funny)
1339137254.0,1184,Tenzin's secret's out!
1341580232.0,1175,Most of her thoughts end this way
1337711153.0,1183,Found on Tumblr: The Origin of Lin and Babybending
1359860780.0,1180,When someone tells me Avatar is too childish 
1347132092.0,1174,"""Master Katara"""
1340569470.0,1176,Es muy Bueno!
1366402174.0,1175,I thought you guys and gals might enjoy my skateboards new paint job.
1339253400.0,1177,"""When I was a boy, my father, Avatar Aang, told me the story..."""
1372672451.0,1174,One of my many beefs with the Legend of Korra's finale. [SPOILER LoK Finale]
1346854354.0,1172,Mommy's Impressed. 
1354575570.0,1172,Pro Bending- I spent waaay too long on the background.
1346772375.0,1172,"My girlfriend was supposed to be writing our fantasy football picks on the board. Instead, we got this..."
1334609453.0,1173,"Baby, you're my forever girl."
1348940402.0,1170,Found this while browsing my newsfeed
1353703857.0,1167,"My friend was at a pet store and saw this puppy. I told him to go back, buy it, and name it Appa."
1341543300.0,1170,I don't understand
1353267491.0,1171,Wow. . .
1339002981.0,1167,I was told this needed to be posted here. My step-father as Iroh and me as Zuko from AWA 2010. 
1336848872.0,1171,Eathbending and Metalbending got nothin' on Zuko.
1357569733.0,1163,If Korra was sent to Aperture for training.
1342547035.0,1167,Awesome Sokka cosplay
1372469783.0,1161,[Spoilers] Oooh! A new screenshot from book 2 on Bryans blog!
1358613855.0,1163,So my friends lost a bet and had to become Airbenders...
1349810727.0,1163,Water Bending by ~Antiquity-Dreams
1338312509.0,1163,Extended Short Animated Bending Fight Part 2!
1343445356.0,1159,Mako Irony
1335568157.0,1165,I present to you Sleazy Sokka courtesy random interwebs.
1342396109.0,1160,One of the funniest scenes IMO.
1340285668.0,1158,Bolin pin
1339875404.0,1159,"Too soon, Amon. It will always be too soon."
1356978074.0,1161,Classy Korra
1341332176.0,1158,opps there go all the fucks I give.
1363642366.0,1151,Finally finished my giant lion turtle picture
1359522025.0,1154,Iroh Quotes
1349962698.0,1157,My favorite shirt: Airbender Time!
1371228430.0,1152,"Not mine, but thought you guys would enjoy it. Disney Avatars!"
1341861323.0,1146,Uncle Iroh would be proud!
1362148192.0,1153,Zuko from his younger days (xpost from /r/pics)
1345417715.0,1147,Secret fact
1340909851.0,1150,You think murder-suicide is dark? It gets darker.
1374510184.0,1153,Good Aang and Katara cosplay
1371500394.0,1150,Amazing Toph cosplay by Tophwei on Tumblr
1340476793.0,1151,Amon on the finale
1343489368.0,1149,Re-watching TLA and this really bothered me about Katara. 
1340181591.0,1140,[SPOILER]Oh the Irohny.
1354895248.0,1148,Aavatar Aang
1348595003.0,1149,History repeating itself.
1348319323.0,1143,The... Beifong family?
1343519260.0,1146,"""Great... Now I have to entertain my brother."""
1371152364.0,1145,Aang and Korra
1343132680.0,1144,Old friends playing a game of Pai Sho
1363136319.0,1138,Stunning Toph Cosplay
1343748578.0,1139,One of my favorite jokes out of the original series...
1343681659.0,1142,Mako's Last Line
1339783883.0,1140,Finished The Eathbender vs. Firebender Animated fight. Enjoy.
1345650955.0,1139,"Don't know who the artist is, but I'm loving these pics.  I dub them, ""The Old Meets the New"""
1344910350.0,1139,"Have some amazing fanart, even if you don't appreciate Tyzula!"
1343868570.0,1135,A new perspective
1342199154.0,1140,Legendary
1357247759.0,1140,Master Piandao would approve.
1343064159.0,1135,The mating dance of the Equalist
1342659229.0,1138,Saw this picture on the front page and couldn't resist.
1357599639.0,1132,Mistakes Were Made.
1371922183.0,1137,Todays beach pic - iroh and June
1363027386.0,1128,Seen in a stall after a FIRST competition
1349399309.0,1135,An awesome drawing of Korra my friend made
1363271796.0,1133,"Giant, colourful *Reza Kabir wallpaper, sans watermark, featuring basically everyone."
1340938149.0,1132,Tell me I'm not the only one who thinks this is a great idea.
1353672502.0,1129,My attempt at painting the symbols...
1362092503.0,1130,The Avatar's New Groove 
1344221520.0,1130,10/10 Would Definitely Play
1342286190.0,1123,Check out this Pro-Bending Infographic I made detailing the Fire Ferret's playoff run!
1361465579.0,1128,Another neat little detail in TLA
1369785903.0,1127,My new shirt!
1353449803.0,1122,Water . . . Air . . .
1357156653.0,1122,This is a ship I approve of!
1337791919.0,1125,Outside of the law
1339620589.0,1128,Final Press Art for the Legend of Korra Season Finale.
1360279180.0,1121,Pabu?
1335491515.0,1124,Baby Lin
1363776102.0,1116,"Let's dedicate this to Sokka, for he is not an oaf."
1360957657.0,1120,"Hey, we're in enemy territory now...those are enemy birds"
1346873980.0,1124,Painted Lady
1371824416.0,1119,Todays beach pic - Ty Lee
1338236569.0,1118,"That's rough, buddy."
1337301359.0,1118,My favorite Iroh quote. 
1355361758.0,1117,"Finished Korra today, and I just have to get this feeling out there."
1363737745.0,1114,For old times' sake
1347491238.0,1114,"Azula's Version of ""Call Me Maybe."" No, really."
1374388136.0,1117,My cat got into a fight. We never gave him a name. I know what to name him now.
1360007607.0,1122,How the movie should have been done
1336084438.0,1119,"Pretty sure this crossover's been done, but here's a quick sketch I did."
1361070327.0,1118,Still beter than the Avatar movie
1353859250.0,1117,The Fire family
1340064941.0,1114,So that's why Amon took Tarrlock...
1363902743.0,1110,Been working on an Uncle Iroh character in Skyrim
1369519959.0,1112,The styles behind the benders
1373855415.0,1110,Noticed a familiar face on the Republic City paper currency. It's the little things.
1354224314.0,1113,It's uncanny! 
1353270977.0,1107,Never mind send daughters  
1343536414.0,1109,"I have to admit, this was still one of my favorite moments."
1355105180.0,1110,So... This looks familiar.
1339042108.0,1104,Compiled all the kissers I could find
1361216211.0,1108,Made these a couple months ago out of an old belt and button snaps. Thought /r/TLAb may like them.
1361145403.0,1109,"Made me giggle, thought you guys would like it."
1343653202.0,1100,"Here they are, hot off the presses! Our very own Olympic rings"
1359823298.0,1102,Did anyone notice that Toph's father is Nicholas Cage?
1345881214.0,1098,Toph Cosplay that made its way into my facebook feed
1345102275.0,1102,A bit of insight into the nature of Firebending
1343664295.0,1101,My brother and I discovered the new Avatar. [x-post from waterporn]
1337538235.0,1105,That awkward moment when Toph might be your future mother-in-law...
1347248769.0,1104,GANGNAM STYLE? I think Bolin was born for this...
1357304329.0,1100,Wise words from Guru Pathik
1351866665.0,1099,Equalist Day Job
1341542822.0,1097,Perspective.
1340471842.0,1097,Right in the feels...(SPOILER)
1340468677.0,1094,After watching the series finale I see a common theme...
1367500741.0,1089,"""People say you're beautiful... and you are to me too..."" - Toph"
1372796423.0,1096,Awesome realisitic portrait of Zuko and Mai (not my work)
1352476749.0,1095,MOMO and PABU
1337105846.0,1093,My Korra Cosplay at Ottawa ComicCon (xpost from r/Cosplay)
1350059914.0,1090,"Azula's son, god that poor bastard..."
1373775291.0,1086,Noticed something familiar in the background of this Simpsons episode
1362691764.0,1093,Love is brightest in the dark.
1343364228.0,1086,"My stepdad just got out of the navy and  could never mess around with his hair. He gave us the clippers and said ""have fun."""
1340878888.0,1089,Time for some amazing Korra art 
1339404130.0,1084,Katara doesn't give enough credit sometimes...
1337817477.0,1085,They should make pajamas like these
1354113888.0,1085,This artwork almost makes me think that Zuko &amp; Katara could've worked. Almost. 
1358234998.0,1082,I fell in love with that huge map of the Gaang's travels and had to make a wallpaper of my favorite little family from it:
1347407909.0,1084,Boomerang and Space Sword Chillin in Ember Island
1340303240.0,1082,"Just one more, then I can get back to my life."
1339873657.0,1081,I will have to say that the more I watch Korra and browse this sub...
1357783607.0,1076,Incredible Mai Portrait 
1342825446.0,1082,Younger GAang Meets Older GAang
1362837633.0,1072,Sokka Shopping
1341102947.0,1080,Portalbending
1338908351.0,1077,Go get him for me Aang
1353591800.0,1074,Sokka: Master Warrior of the Southern Water Tribe and Honorary Member of the Order of the White Lotus
1355408845.0,1073,If Toph met Bender...(x-post from r/alternativeart)
1352733734.0,1070,Heaven 
1354689916.0,1073,Bending meets SCIENCE! (Korra spoilers)
1342750181.0,1071,Some Kyoshi make-up I tried my hand at a while back
1340215044.0,1078,Spying Sato spies for the last time.
1344264817.0,1066,"Oh, Kyoshi. You always know what to say"
1344286811.0,1067,The Masters
1341195095.0,1067,The Last Airbender helped me in a way I can't repay
1343412736.0,1069,My favorite quote from Longshot
1364852368.0,1070,Major League Pro Bending
1353888760.0,1066,The Boulder
1335327249.0,1067,Zuko + the Fairy Oddparents?
1366095924.0,1063,The return of Foo Foo Cuddlypoops!
1348615107.0,1059,It's... beautiful
1339374788.0,1064,Saw This LOLed
1338593179.0,1062,To anyone who says Sokka was a bad fighter.
1340336762.0,1060,Quite possibly one of the best Korra/Tahno cosplays I've ever seen.
1335796901.0,1063,"Checkmate, Chi-Blockers."
1368281607.0,1058,The Last Warbender
1340568160.0,1063,Good Guy Amon [finale spoiler]
1340648679.0,1061,"Appa, according to google images"
1366954401.0,1058,The First Avatar: Nubia
1348589768.0,1055,Appa's design was based on the Catbus (My neighbour Totoro)
1340926109.0,1053,This is what I was thinking when Korra first airbent 
1338835208.0,1052,The Face Stealer and his foe...
1373492951.0,1055,Every time there is an LOK sneak peak
1342476449.0,1051,YouTube knows what's up
1340841270.0,1054,A really good drawing of Asami.
1369060430.0,1055,Cosplayed General Iroh at AnimeCentral this weekend. This is now my Facebook timeline picture.
1360513476.0,1051,Apparation Desert Storm
1347346757.0,1051,I hope this isn't a repost
1345331500.0,1053,Hot like my abs!
1342029743.0,1050,Good Guy Zuko.
1374232762.0,1049,On this day five years ago Sozin's Comet aired for the first time.
1364234868.0,1046,Looks like I'm not gonna be talking to this one anymore
1347111500.0,1047,Momo and Toph
1340514935.0,1049,The Reality of Asami
1335385985.0,1049,"I don't know whether you all have seen this or not, but it's quite cool"
1362246078.0,1050,I love toph
1343616603.0,1042,"Toph Beifong, Greatest Earthbender Ever"
1342407052.0,1048,Scumbag Mako
1341520332.0,1045,"Seriously, I feel alone here..."
1336513484.0,1039,Best. Probending Team. Ever.
1346681672.0,1040,Favorite quote from the show
1344821383.0,1042,Sokka...?
1370374034.0,1039,They messed up my yearbook quote...
1354983247.0,1042,Daughter of the Moon 
1337183687.0,1039,Gaang in the Republic City Era/ 1920's
1347189694.0,1039,Noticed a strange out of place Avatar reference in the Simpsons...
1340243014.0,1035,"After finishing TLA, just one unanswered question..."
1375282932.0,1032,Tarrlok is the new Zuko
1341421950.0,1031,"Update: ""asked a girl out using quotes from a certain show-it worked!"" First date went well. "
1374332124.0,1032,"So, I cosplayed as Korra at ComicCon yesterday and got Mike, Bryan, and the whole gang to sign my poster, too!"
1340492183.0,1039,[SPOILER] So how many of you made the right prediction at this moment?
1341696160.0,1036,Team Avatar!
1343380873.0,1033,Thought you guys might like what I've been working on...
1352810987.0,1034,My uncle just passed away over seas. I love you R.I.P
1348533145.0,1031,"In the midst of all the Lin/Tenzin shipping, I thought Tenzin's WIFE deserved a post."
1360534011.0,1031,I made Appa out of clay
1340734716.0,1030,scumbag lee (this really pissed me off)
1341766303.0,1027,Never forget: Katara was f**king hardcore. 
1341672854.0,1028,How Amon Stole Republic City
1349454976.0,1032,Zuko's transformation... :3
1348066524.0,1029,Sokka has got the magic touch
1370042587.0,1032,[Legend of Korra] Part of me dies every time I see this...
1343952419.0,1029,Mr. Wang Fire's at it again
1370748430.0,1022,First footage of Book 2 revealed from a Nick commercial! Here's the slowed down gif since it goes by pretty fast
1358787934.0,1022,I AM MELON LORD
1341000079.0,1026,Some of you are saying that LoK is darker that TLA. Well...
1348594096.0,1030,@_Avatar_Aang just tweeted this. I'm a grown man trying to fight back tears on a bus. The feels man. 
1342708950.0,1030,Happy Birthday Bolin
1339207458.0,1021,"I loved the cultures depicted in TLA, and how they were inspired by real life peoples"
1370817222.0,1020,R.I.P Wang Fire
1343518833.0,1022,You were a good Lieutenant. 
1365962421.0,1018,I was very pleased with how my first tattoo turned out. Sorry that the lighting is bad.
1341113463.0,1019,Sketched Korra at the Laundromat. My memory forgot her awesome armbands :(
1355755594.0,1020,How the LoK fandom feels about the characters: chart form
1361295252.0,1014,Looks like Aang has been sharing his push-up technique!
1344179374.0,1016,Korra's new found Avatar responsibilities
1369745003.0,1020,Avatar Eyes
1371054550.0,1013,I always have to pause and laugh whenever I see this....
1341424969.0,1009,Gimme the ladies
1374048502.0,1011,Earthquake emergency kit
1373418246.0,1011,Incredibly nerdy parallel that I just noticed...
1344701608.0,1005,Giving Tenzin the talk
1340041284.0,1005,"If Rokus dragon helped Aang on his first  journey to the spirit world, will we see Appa on Korras first trip?"
1375551097.0,1013,Lego Aang.
1340466878.0,1010,Asami's father's logic...
1340380926.0,1008,Here it comes!
1358188068.0,1008,Have I ever posted any Aang art like ever?
1370286575.0,1008,A handful of pictures from the Fanime Avatar meetup
1356404296.0,1006,Merry Christmas! 
1346162345.0,1003,Prepare your Momo feels
1342794010.0,1003,If you know what I mean (x-post AdviceAnimals)
1351612344.0,1009,Toph and the badgermole
1338030538.0,1003,Here's a baby dressed as Appa.
1363879508.0,1006,A doodle I did in class today
1340476458.0,1003,Every firebender's reaction to the finale
1369335223.0,1001,Saw this on my drive home.
1355232754.0,995,Awesome Gaang shirt over at TeeTurtle!
1347820366.0,995,I compiled an album of screenshots where something just isn't quite right
1347752330.0,994,"She's so...-squishy-, looking. "
1345053246.0,1003,The Boulder thought its be nice to thank us!
1344017116.0,1003,"Well, I'm off to the Obama rally!"
1354639643.0,992,Echoes 
1340542091.0,997,Too soon?
1357552079.0,989,I remade the keep calm card from YakyPeanut's birthday album in photoshop. I hope you guys enjoy!
1353002400.0,995,"Grey Delisle is a very talented voice actor. In this scene, she plays both Azula and the servant - she is, in effect, banishing herself."
1344122755.0,998,I think we can all agree who is the biggest douche of the series
1341968222.0,994,It's Simple....
1372527094.0,987,"Great license plate, crappy picture"
1340466889.0,990,The real hero of the Finale
1360187467.0,989,An old friend got this for me as a wedding present.
1371517620.0,989,This man has shown true commitment to his job.
1340927626.0,986,Pretty cool cosplay [NSFWish]
1355325335.0,982,"Toph - Older, Bending, and Animated"
1340777543.0,987,How it feels living in Colorado at the moment...
1351695283.0,989,Esteemed - Resisting Arrest
1340475299.0,986,My heart stopped.
1370568954.0,986,"Sorry if it's a repost, but it made me laugh."
1348625160.0,985,Just saw this on Facebook.
1343187373.0,980,"Watching Book 2 with my Taiwanese mother, when this happened..."
1338346789.0,982,When Asami and Mako refused to believe Korra
1338203778.0,976,Lets play a game.....
1371895879.0,980,MY CABBAGES!! - Supanova 2013
1342657771.0,977,Saw this at the mall today..
1358654422.0,977,"Admiral Zhao's opinion of Korra, by [*rufftoon]."
1339869215.0,982,Pema's been through this before. She knows what's up.
1374463499.0,971,Korra has sure grown up
1340826494.0,973,"Hey everybody, guess what! We passed /r/mylittlepony in subscribers this morning.  "
1340472893.0,973,Me at 12:01
1375504990.0,980,You sure got me
1373662288.0,977,"Avatar Kyoshi, my long overdue second piece in the series."
1349906097.0,977,A:tla and LoK: Kickass non-benders united 
1353711421.0,971,"Re-watching the Sozin's Comet finale, amazed by the sheer perfection of every scene. For example."
1343093815.0,972,Mako the fangirl.
1374347430.0,969,I made this wallpaper for those of you with dual monitors.
1367783456.0,969,Cat bending
1362932873.0,970,Was told to post this here (X-Post from Crafts)
1370532308.0,969,"It doesn't matter how great your science, how large your history books, how sacred your spirituality, or how advanced your technology, nothing compares to the pure truth presented by marvelous works of art. The following quote proves A:TLA is the greatest work of art since creation itself."
1346527574.0,969,I just added my submission to the art contest. Here it is!
1337448408.0,966,What Iroh should have said to Zuko and what Tenzin should say to the Council/Avatar
1357503347.0,965,"I thought Iroh bought the monkey, but Sokka ended up with it."
1358795839.0,967,Easiest decision ever
1340634084.0,972,Nickelodeon is oppressing us!
1342727328.0,967,"Hey there, Chief. ;) "
1341864001.0,965,Tenzin of the Hill.
1355796395.0,967,I studied eastern thought for 3 years. How did I miss this!?!
1344604318.0,963,Iroh makes some great faces
1342316056.0,965,What really happened between Korra and Aang [finale spoiler]
1340812942.0,961,Tenzin almost being impaled by stone!
1339345657.0,963,Iroh on the Revolutionary War
1372113317.0,962,Tenzin cosplay manipulation I just finished.
1340734943.0,959,BEST Korra Cosplay to date
1339860895.0,966,[NSFW] This was the best ending possible for today's episode.
1364099834.0,967,Training
1339882965.0,962,No love at all for this moment?
1375889195.0,962,Best birthday present ever!!
1360021811.0,960,So I found something on tumblr! 
1350951260.0,959,Tahno gets his bending back
1341996030.0,960,It's pabulous!
1358362103.0,960,My Korra cosplay from Book two: Spirits. I can't wait for season 2. 
1339452686.0,960,"So, I went on the Avatar: The Legend of Korra's Facebook page today, and I found this comment. ಠ_ಠ"
1342095836.0,962,The Gaang
1336015828.0,958,Lunar disapproval 
1334088497.0,957,I'd like to think that this was how Uncle Iroh bust himself out of prison...
1373734753.0,958,Element Fire
1357659365.0,958,"Like Mother, Like Daughter by [*K-Y-H-U]"
1350766292.0,954,Bryan posted this on his tumblr!
1376533820.0,951,Zuko really hates games
1369186939.0,953,"Amon's Creed, a mix of Assassins Creed and Amon."
1350613973.0,951,"I love this crossover 
CTO"
1345904964.0,947,Noatak and Tarrlok - Nomads
1336592964.0,953,The Dark Side of Iroh
1339871259.0,948,And this is why I love this subreddit.
1368593355.0,948,Very interesting insight avatar Kyoshi
1373293746.0,942,"People seemed to like the last one, so... Suki."
1340677927.0,942,Karma in action
1339913556.0,943,Finally finished. I present: an updated family tree for Avatar. [May have spoilers]
1360796823.0,947,LoK: Graffiti
1340639758.0,946,I wish more young women were as sane as Asami
1356047225.0,939,Seems legit
1369147927.0,939,The Intro to my friend's paper on the Great Depression
1370422662.0,940,My wife is Pure Evil
1351176798.0,937,Bros...
1341512847.0,936,My book two theory. 
1367252046.0,942,DONT mess with the AVATAR
1342978006.0,939,WHAT HAVE YOU DONE (sorry if repost)
1342473401.0,937,What's up with the character wars?
1340478965.0,935,Spongebob. I'm sorry. [SPOILERS]
1338751388.0,938,Picture of the possibilities of each element...
1351410490.0,936,My Avatar Aang costume I made for my friends bday party
1343483613.0,931,Someone special
1342117835.0,937,Possible Season 2 art from Studio Mir's facebook page. Don't know if it's been posted yet...
1375837742.0,931,Made a gif of one of my favourite scenes
1343188675.0,932,Amon's New Victim
1340734535.0,937,Katara doesn't give a shit
1340723101.0,933,Amon faces down the ultimate bender
1360347099.0,937,Would be an awesome wallpaper
1373086306.0,933,Sokka's Drawings
1364477578.0,928,"I made another downvote .gif. This time, it's Azula."
1342581687.0,927,This makes me smile
1363362294.0,928,the feels...
1335362379.0,926,Bolin meets a street kid (fan made comic)
1367337467.0,923,Sokka and I suggest you spend your finals week...
1337693914.0,920,Whoops!
1351044240.0,922,Two of my favorite shows.
1371152276.0,920,One of my favorite quotes...
1339432348.0,927,Aang is one scary mother&amp;@%$er
1352210418.0,922,"A surprisingly credible crossover: Amon Turian, by [*Ius-Iuris]"
1348162648.0,924,Listen to the Melon Lord!
1344447697.0,922,Too much Amon
1341025707.0,924,"Our driveway started to bend, we called these guys to get it equalized"
1349185196.0,925,Getting in Touch with One's Past
1340481534.0,920,I AM IROHMAN
1334032444.0,914,My Toph Cosplay From Sakura-Con
1339458294.0,915,Best Amon theory I've heard so far
1365275325.0,916,Damn it Mako!
1353729926.0,914,My Avatar hat! Some people might think I'm a walking downvote though...
1351544268.0,912,Parent Killing 13: Too Sexy For This Comic
1350567355.0,914,"""Kataang"" always sounded silly to me. This is all I can imagine."
1348438911.0,917,Linzin
1359431809.0,917,Painted Lady Katara speed paint!
1345491284.0,915,Imminent attraction 
1345467443.0,915,Anyone else notice that the Fire Nation itself looks like a sideways flame and the Northern and Southern Water Tribes put together look like the Yin and Yang symbol? 
1341362620.0,912,Nickelodeon approves!
1374779029.0,916,"As requested, I painted Yue."
1344296347.0,911,water tribe swag
1340658252.0,917,[Spoiler] I'M NOT YOUR DAD
1336123753.0,905,Kataang older
1357414903.0,912,bending is too mainstream 
1343021121.0,906,Animal Cruelty
1340488770.0,910,"Dear Nickelodeon,"
1337561858.0,909,I think I've come up with a name for the Lieutenant. What do you think of...
1363304930.0,910,"No matter how many times I watch this episode, I always think Sokka's going to say this..."
1348831667.0,907,Azula: 50 Shades of Grey
1342574520.0,908,I have been taking a lot of college tours lately and I have been asked this a lot
1339874648.0,911,[SPOILER] The most beautiful and painful moment of Episode 10.
1367932976.0,904,"Meanwhile, at the Royal Fire Academy for Girls"
1339892687.0,908,Bad Joke Lin
1339511613.0,903,"As requested, Avatar Aang showing us his Pokemon skills (Gen 1)!"
1343533512.0,900,Now where have I heard that before?
1340761969.0,904,Iroh the Gentleman
1344649421.0,903,The frame in which Korra achieves Popeye arms
1337814784.0,898,First Post on Reddit - Keep Calm and ... 
1337149703.0,908,MY CABBAGE!
1356053318.0,908,My first cosplay -- Korra from the Legend of Korra!
1343226606.0,902,"Happy Toph Appreciation day, /r/thelastairbender!"
1341590711.0,903,"Airbending, Korra? When you can learn… partybending?"
1348879919.0,896,"Procrastinating, so I sketched a Toph!"
1345737138.0,899,Just like Uncle Bumi!
1340807892.0,901,Too soon?
1337562068.0,902,This joke sucks!
1365891983.0,893,Early morning warmups
1339163811.0,896,Cool Picture of Iroh's evolution 
1340508903.0,901,As a non-bender I'd...
1340224417.0,900,How Aang ended up dying
1375789484.0,894,Silly idea I have had in my head ever since I first watched Legend of Korra
1346375772.0,895,Reunited
1342999236.0,896,Zuko - Like a boss.
1337645930.0,892,For those of you complaining about earthbending in LOK
1374971729.0,889,This Asami animation by SandraLVV deserves some praise.
1364662396.0,897,"Something my friend drew, curious for your opinions!"
1372558663.0,890,I waited two hours in line to get a picture with the prince of the fire nation!
1342638562.0,893,Bible-Bending
1340475939.0,894,Definitely my favorite scene from the finale. [SPOILERS]
1365205409.0,894,Bryan Konietzko just posted this Book 2 screen to his tumblr (Korra has some new threads)
1341876964.0,894,This is a beautiful portrait of Korra
1345027123.0,886,Just rewatched Boiling Rock. I noticed this line was terribly creepy.
1337023208.0,889,"Touché, Tenzin..."
1336868526.0,891,Guys?  I think I took this kissing meme a little too far.
1341370795.0,887,the avatar playing cards are finally done (and even a little preview of the next deck)! details in comments
1339344276.0,890,"Rewatching the series, something King Bumi said gave me pause"
1364604816.0,885,In which Zuko repays his debt to Song
