created_utc,score,title
1350430174.0,215,Tsumugi. You don't refer to as less when she looks this elegant. [K-ON!]
1374326399.0,214,Egg-shaped hair clips. [Monogatari series]
1374107427.0,215,"""Nyaaa~"" [Original]"
1373213864.0,218,Tsutsukakushi Tsukiko and Azuki Azuza [Hentai Ouji to Warawarai Neko]
1371481181.0,221,"For this one, the negative space is critical. [Vocaloid]"
1361459293.0,218,Akarin's cheeks are so sweet..[Yuru Yuri]
1354619557.0,219,Miku is ready for winter in one of the prettiest kimonos I've seen so far~ [Vocaloid]
1375842923.0,219,I bet Holo could take her [Spice and Wolf x Oreimo]
1374778051.0,215,A cat-eared assistant [Steins;Gate]
1374212705.0,218,Am I more popular now? [Watamote x Vocaloid]
1373587343.0,216,Mami is not alone. [Madoka Magica]
1373502153.0,214,Nomnomnom!! [Henneko]
1370896436.0,213,"""I missed you, Hentaionii-chan!"" [Hen'Neko]"
1370279790.0,216,Ushio playing with a dango...
1367841637.0,212,"Shameless repost, because most of you were not here 9 months ago.[Original]"
1363780547.0,216,Rikka Takanashi~ [Chuunibyou demo Koi ga Shitai!]
1359665273.0,218,"Look, Look at the Azu-Nyan! (K-On!)"
1352648630.0,219,"When it comes to quality art in the moe sector, this is what I'd call a 10/10 [Original]"
1375593330.0,217,"I'm too tired to write to this one, but have an inspiring [Original] piece, anyways!"
1373651057.0,214,How come we've never seen Tomoyo Sakagami on here before? [Clannad]
1372826223.0,219,Recharging time. [Chuunibyou]
1371989764.0,219,That awkward moment when you look back simultaneously [WataMote]
1371142405.0,216,Madoka had a dream... [Mahou Shoujo Madoka★Magica]
1370788777.0,216,"And now for something completely different [Original] ... I lied, have some simply elegant moe."
1367410394.0,214,Waifu Wednesday to me means more Shinobu [Nusemonogatari]
1362732558.0,218,"""I don't have cat ears but is this good enough?"" [Original]"
1361712821.0,214,"Looks like it is cold and raining.  Girl, you have no time to just be standing there. Go home, you're drunk! [Original]"
1357167218.0,218,Swimsuit Wednesday? (OreImo)
1351432357.0,219,Found some lab coat [Hatsune Miku].
1376338785.0,215,There's a lack of ponytail Haruhi on this subreddit! [The Melancholy of Haruhi Suzumiya]
1370041728.0,215,Ayase wants to ask you a question. She's a bit nervous [Oreimo]
1367275462.0,215,Miku and the gang at the beach [Vocaloid]
1358766265.0,219,I suddenly find myself liking Pepsi more than Coke [Original]
1351180636.0,211,Oh dear... Saya definitely needs a hug. [Puella Magi Madoka Magika]
1375743538.0,210,"Two cute demons: one is a great singer, the other...is still cute. [KamiNomi]"
1372246471.0,212,There is alarmingly low amount of moe art of Misaki [NHK ni Youkoso!]
1371437845.0,215,Misaka Mikoto on a bike is so freakin' adorable! [Raildex]
1368970785.0,213,Notice me! [Madoka]
1368185314.0,214,Nyaa~ [Evangelion]
1364385317.0,216,Rikka Takanashi~ [Chuunibyou demo Koi ga Shitai!]
1361921546.0,214,I'm pretty sure this is not how the story goes...
1376655055.0,212,"It's Friday! You know what Friday needs? That's right, MORE CATGIRLS![Original]"
1375486601.0,215,Madokami spares no expense for the sake of looking regal. [Madoka☆Magica]
1374684787.0,213,My Kouhai can't be this otaku [OreImo]
1374310048.0,216,D-D-D-DROP THE BASS [Original]
1366346529.0,215,I have to admit that this is completely adorable. [Maho Shoujo Madoka Magica]
1358289501.0,213,"Bow down before the Tyrant's Eye, mortal! [Rikka, Chuunibyou]"
1356542756.0,210,I don't see any mistletoe. Do we need mistletoe? [Yuru Yuri]
1345221800.0,212,Kyouko loves to be pet (Madoka Magica)
1373639058.0,213,"Meanwhile, on /r/Yuri- Er, I mean /r/Awwnime..."
1366640064.0,213,Terror of the Deep [Shinryaku! Ika Musume]
1365763493.0,213,Some kittens left out to dry [Acchi Kocchi] x [Chuunibyou]
1355094905.0,210,Ritsu Fashion [K-On!]
1354002078.0,213,Kirino... pigtails... cat ears... fang... midriff... blush... H-...HNNGH...[Ore no Imouto]
1372906316.0,213,"Madoka with her hair untied, a sight to behold! [Madoka Magica]"
1371854595.0,212,In the spirit of the Lisbeth album I'm here to post my favorite picture of her. (Sword Art Online)
1370753117.0,211,"""I was hoping.. um.. maybe.. y-you c-could.. walk me home?"" [Your Diary]"
1369584018.0,211,It's not my fault I'm not Moe! [Watashi ga Motenai no wa dō Kangaetemo Omaera ga Warui!]
1369401456.0,210,We have an anime about girls driving tanks; why can't we have one about girls flying airplanes? [Original]
1368203427.0,208,Megumi is just too moe. [GJ-bu]
1364838948.0,210,Miku's new video is a joy to watch.[Vocaloid]
1356283918.0,211,"Wedding dresses are moe, Chinese dresses are moe, and Luka is moe, so when you combine all three you get mega-moe!"
1355014739.0,209,"Ho-kago Nintendo Time! (Samus from Metroid, Zelda from The Legend of Zelda and Peach from Super Mario)"
1376328404.0,209,Black Hanekawa is love[monogatai]
1369660303.0,212,Story in a giffy [Hyouka]
1368189117.0,212,God I can't get enough of this girls lovely outfits. [Tsukiko from Hentai Ouji]
1367585111.0,208,Which Tsukiko you like best ?[Hentai Ouji to Warawanai Neko]
1365508456.0,209,Kuroneko~ [OreImo]
1363692345.0,210,Mio is such a music nerd |K-On!]
1361644513.0,208,Kirino is the cutest otoku! [Oreimo]
1367341823.0,211,Whenever I'm sad (which is a lot)... I rely on Chitanda to cheer me up [album]
1365888765.0,210,Tsukiko [Hentai Ouji to Warawanai Neko]
1363269831.0,208,旗袍 [Original]
1359425089.0,210,Omg... This show. I am in love. I want more [Kotoura-san]!
1357865641.0,210,Asuna-nyan! (Sword Art Online)
1353272494.0,210,Microsoft giving out free stuff?  [Madobe Nanami/Windows 7]
1375936191.0,207,Plusle and Minun [Madoka / Pokemon cross]
1375662732.0,204,Toshino! What are you doing? (Yuru Yuri)
1374087202.0,204,Did you know? If you hug a vampire she can not attack you [Haganai]
1373672118.0,206,Here's a picture of Tomoko. Am I popular now? [WataMote]
1373312909.0,208,Do it for her.[WataMote]
1370189643.0,208,Crossover of the season right here. Zomg. [Shingeki no Kyojin][Toaru Majutsu no Index II]
1366389647.0,208,Nibutani Shinka (Chuunibyou demo koi ga shitai)
1364430155.0,206,"Kuroneko being neko is cute, right?"
1354467508.0,209,Emi's words of wisdom on the bracket. [Katawa Shoujo]
1348415392.0,210,"Well put, Kirino. (Kirino from OreImo)"
1375152705.0,210,So many Sakurako's! (Yuru Yuri)
1373031900.0,208,Sensei appears to have an admirer. [Original]
1372282621.0,208,"""Why don't we play a game? I just got the new patch."" [Madobe Nanami, OS-Tan]"
1370450141.0,209,This was too good to stay hidden as mere bonus moe.[Hentai Ouji to Warawanai Neko]
1367576489.0,207,Ice Cream moe for the hot summer days [Original]
1364397917.0,207,Kuroneko Nyaa~[OreImo]
1363023169.0,209,"Mikus and they're doing something.  It is embarassing, I can't look.  Please look for me :x [Vocaloid]"
1358045909.0,208,The last thing I expected was to find some moe from [Call of Duty: Modern Warfare 2]
1352390347.0,207,"Despite being knocked out of the Awwnime Bracket, Azunyan continues to be rediculously moe. (Azusa from K-On!)"
1376339582.0,207,"[Infinite Stratos], now with more cat girls."
1375186145.0,205,I never knew Nintendo was capable of such amazing moe! [Fire Emblem Awakening]
1373468472.0,207,Here's my favorite Hanako picture for her Birthday! [Katawa Shoujo]
1372611966.0,208,Not sure if this is considered moe [Dragon Ball Z]
1372513825.0,204,Keep your Sakura Miku well watered so that she'll bloom this nicely. [Vocaloid]
1370267354.0,202,I wish Kantoku was part of our little community. Think about all the moe he could post! [Original]
1369863204.0,209,Chibi Mugi [K-ON!]
1368700936.0,208,My favorite of the Tomodachis [Haganai]
1363232599.0,207,"The quality of the posting today has been immeasurably high. Thus, I give you one of my rarest finds.[TMOHS] "
1362064723.0,204,"He so rarely leaves home without his lab coat, he should do it more often. [Steins;Gate]"
1360156324.0,206,Say ahhhhh... [TMOHS]
1359928008.0,204,Just some forced cuddles (Angel Beats!)
1357930456.0,204,We need our own version of this. [Angel Beats]
1356888447.0,203,Scarf sharing is just as good as umbrella sharing. I don't know if you get double the returns for both though.  Do we?[Original]
1355746962.0,204,"To those who played Borderlands 2, here's a MechroMancer for you :) [Borderlands 2], by Krit"
1355266527.0,207,Our overlord is watching you (Toradora!)
1352835237.0,206,I would watch an anime about these two [original]
1374942444.0,206,New transfer student [Mayo Chiki!]
1374708608.0,205,~mofu mofu~ [Hentai Ouji to Waranai Neko]
1373904028.0,203,Tomoko gets curious [WataMote]
1371424979.0,204,Ruri-chan being angsty~ [OreImo]
1371169118.0,203,"""I'm sorry, I'm late! Where you waiting for me long?"" [Original]"
1370971501.0,203,Sundresses are nice~ [Oreimo]
1369357655.0,207,Overwhelming... [Toradora!]
1369234032.0,205,She's enthralled by your story. [Chuuniboyu]
1368635976.0,205,This scarf looks convenient [Chuunibyou Demo Koi ga Shitai!]
1367805175.0,207,Catgirls are pure concentrated moe. [Original]
1365393534.0,205,I heard there was a lack of Kuroneko here [OreImo]
1364321637.0,204,"Kurisu, what happened?! A banana peel?... It must SERN! [Steins;Gate]"
1362593503.0,204,Your afternoon sugar rush. [K-On!] and [Madoka Magica]
1361611342.0,206,"I'm not the biggest fan of Kyouko, but it's hard to argue with this picture [Madoka]"
1361576911.0,203,[Katawa Shoujo] This is easily one of my proudest moments in gaming: making her smile.
1360779178.0,204,PINK! [Original]
1360360937.0,203,Raise your hand if you want a hug. (Rikka from Chuunibyou)
1372699152.0,204,No Pocky? A candy is fine too. [Original]
1372044657.0,203,Not enough of this series in this sub. [The World God Only Knows]
1371919969.0,200,The Last Hug~ [Madoka]
1370101235.0,200,Yup. More Konata. [Lucky Star]
1367442556.0,200,'Hmm... who are you looking at?' [K-ON!] [GIF]
1353953097.0,206,[Yuru Yuri] day calls for a special [Yuru Yuri] Moment
1350407687.0,206,"Colder weather is on it's way, be sure to wear layers [Original]"
1370103205.0,202,How does this short-haired Miku look like [Vocaloid]
1369949361.0,200,Mugi by the Sea! [K-ON!]
1369107489.0,203,"""Hey, Himawari."" *poke* ""Hey, Himawari."" *poke*""Hey, Himawari."" *poke* [Yuru Yuri]"
1367603517.0,202,"Fukuya, don't ever stop making [Madoka] x Homura doujin."
1366031841.0,202,Ultimate Madokami [Mahou Shoujo Madoka]
1365423675.0,204,Have some Nyadoka! [Mahou Shoujo Madoka Magica]
1362001610.0,203,A heartfelt goodbye [K-On!]
1361232491.0,205,A wedding with fate. (Madoka Magica)
1361195004.0,204,"She seems to like getting a head rub... (Shinobu, Bakemonogatari)"
1359710874.0,205,"On the one hand, I deeply value being in one piece. On the other hand, I love cute girls and routinely make very poor decisions [Minecraft]."
1354309160.0,203,The most precious smile in the world.[ToraDora!]
1349450984.0,201,Azusa looks sleepy c:
1376160704.0,201,More Mio for you. I think this one turned out O[K-On!] ^^
1374429710.0,202,That must be some cold ice cream. [K-On!/Attack on Titan]
1369682765.0,202,We need cheer her up!
1364693236.0,200,"How many have us though ""I need an imouto."" [Oreimo]"
1358475544.0,203,"You guys. Aoyama needs more love, you guys! [Pet Girl of Sakurasou]"
1373553588.0,202,Weighted Companion Potato [Portal 2]
1370222215.0,200,"The trifecta of moe (Oreimo, Nichijou, and K-on!)"
1369627574.0,203,You can't say no to those eyes [HenNeko]
1366581175.0,203,Looking up (Boku wa Tomodachi ga Sukunai)
1362698992.0,202,"No Matter What, It's Master and Servant Forever! [Chuunibyou]"
1362532164.0,198,Mio and Mai from Nichijou 
1360437145.0,203,"""I've tried everything and you still don't notice me...."""
1358263833.0,201,"Would you like to share the umbrella, neko-chan?"
1356623796.0,202,Fresh from pixiv [Angel Beats]
1356341879.0,205,"I'm not sure if it's Nekomimi Monday or Miku Monday, so here's both."
1347639355.0,201,Holo as a waitress. [Spice and Wolf]
1342634805.0,200,"Samus, Zelda and Peach! [Nintendo Girls]"
1340819763.0,201,Those eyes :3
1336753056.0,203,Some moar Moecraft. :3
1376107845.0,200,The mistresses of the night can't be this cute [Chuunibyou / Oreimo]
1375079139.0,200,Now that's some of the most creative moe I've seen. [Original]
1373119855.0,200,Not close enough [Love Live!]
1372350165.0,198,"No computer for moe for the next 4 days, so here's some Maou to say goodbye [Maoyu]"
1372303244.0,198,"I said I would draw my own, and so I did [Yuyushiki]"
1371124066.0,204,Blush [OreImo]
1371093417.0,203,"One image, three national treasures. [OreImo]"
1374462788.0,199,"Love the flower in the hair theme, very summery~ [Original]"
1370536660.0,197,Two cute girls and a baby boar. [Clannad]
1370269422.0,197,We need more Asuna here! [Sword Art Online]
1363878401.0,200,Make sure you take care of it [Vocaloid]
1358348869.0,200,Azunyan gives a gift to Mio [K-On]
1375805044.0,195,Sweatin' to the Kyuubeys. [Madoka Magica]
1371485648.0,197,Let's Dance! To the sound they're playing on the radio...[OreImo]
1370484702.0,196,"I really like Mio, so here's my Mio folder! (Nichijou)"
1368723684.0,198,I basically had the same reaction as the rabbit on the left [Vocaloid]
1360333186.0,199,"The best way to embrace a moegirl: hugging with one hand, head-patting with the other. [Angel Beats]"
1357161112.0,200,:3 [Original]
1353964858.0,195,Looks like someone needs a hug. [K-On!]
1349390426.0,196,Fox-girl Homura (Madoka Magica)
1342011573.0,198,How /r/awwnime is like right now
1367693107.0,200,Where can I buy a mini NekoLuka? [Vocaloid]
1365690267.0,195,Foolish fool who foolishly dreams of foolish dreams... [Ace Attorney]
1363554585.0,197,Homunyans need love and care too! (Madoka and Homura from Mahou Shoujo Madoka★Magica)
1363207865.0,198,An outfit for every time of year [Nichijou]
1360085658.0,198,Madoka wants to be part of Oktoberfest too! [Madoka Magica]
1356439210.0,197,The lovely couple enjoying the day together as always~ [Puella Magi Madoka Magica]
1354767690.0,199,Tsundere is as tsundere does (≧◡≦)
1354716236.0,201,This Nadeko is going to be sold at Winter Comiket as a blanket. I need this. [Bakemonogatari]
1352912588.0,200,"She wants you to sit beside her. [Spice 
and Wolf]"
1346523059.0,197,Did someone ask for more Haruhi? [Haruhi Suzumiya]
1375373922.0,196,Just hug them both at once. [Oreimo]
1375342521.0,195,"What are you looking at, perv [Original]"
1369359318.0,196,Ponytails FTW!! [Bakemonogatari]
1369346363.0,196,Haruhi is 136% adorable. [The Melancholy of Haruhi Suzumiya]
1367506095.0,193,"The warmth. The sincerity. The gentleness. Can you feel it, awwnime? [The Melancholy of Haruhi Suzumiya]"
1364124429.0,196,Kurumi and Shizuku teach us how to cool off on a hot summer day~[Check Mate]
1362139753.0,198,"Accel/LO, sleeping together [To aru majutsu no Index]"
1361049281.0,197,"""Do you... really like my new dress?"" (Misaka, Railgun)"
1358200793.0,192,Holo would fight but she is far too sleepy (Spice and Wolf)
1357824410.0,193,"My favorite, Mashiro Shiina. This sub needs more pet girl!"
1375311045.0,195,Tomoko is number 1 [WataMote]
1373286932.0,196,Play with me![Madoka Magica]
1371345028.0,194,Kuroneko's new school uniform. [OreImo Season 2]
1371161149.0,198,"I don't know about tsun, but there's a fair amount of dere in this [OreImo] album."
1366745784.0,193,"If you liked Kurisu in S;G, you're gonna like [Hataraku Maou-sama!]"
1366143438.0,196,Kuroneko X Kirino (Oreimo)
1365952933.0,199,'You really are cute.' [GJ-Bu]
1363705805.0,198,Sayaka x Kyoko with Glasses [Madoka Magica]
1362092526.0,197,It's time for her ultimate weapon. [Haruhi]
1360693782.0,193,Hmph! [Original]
1359286624.0,193,This wont end well [TMOHS]
1354843095.0,197,"""I have no idea what I'm doing right now."" [K-On!]"
1345540336.0,195,Why Hello there (Original)
1376088932.0,196,I don't even know what to title this. It's just pretty. [Original]
1375119933.0,191,Mashiro is cold [Sakurasou no Pet na Kanojo]
1373550171.0,192,"Headrubs, anyone?"
1366250645.0,194,I just cannot get over how cute she is! [Hyouka]
1358654253.0,195,Thighhighs + Hoodie combination [Original]
1358531702.0,197,They all came to see you! The catch? You can only pick one. [K-on!]
1357493057.0,192,Waiting to deliver her love letter [Amagami SS]
1354900141.0,197,Only barely suppressing the urge to nyan... (Original)
1351964420.0,193,She's waiting for you to pet her [Original]
1347725457.0,193,How about a tsundere cheerleader? [Toradora!] 
1372560861.0,193,She just wants to be normal girl. [Sankarea]
1367675873.0,191,"That fluffy white fur, frills, laces, ZR, dress, flying hair, colors... 10/10 would hug again. [Vocaloid]"
1366496186.0,193,"""Fufu.. nyaaa~!"" [Oreimo]"
1365635633.0,193,Kuroneko and her imouto [OreImo]
1365211898.0,196,Tsundere + tsundere = Love [Yuru Yuri
1363758694.0,194,"Mio? ✔. ""Don't Say Lazy"" outfit? ✔. Adorableness? ✔. [K-On!]"
1361552801.0,193,Moe on a rainy day. [Original]
1361403038.0,195,My very 1st Cakeday! Sharing my most favorite pic with you all to celebrate! [Angel Beats!]
1360460217.0,194,Miku without her twintails! [Vocaloid]
1360287848.0,197,I have a strange love for white hair. [Various]
1353260518.0,197,"I'll have to find a way to post from the afterlife, this image hunting is putting a strain on my heart."
1352932267.0,192,"Ain't no such thing as too much goth loli [Oreimo,Chuunibyou,Haganai]"
1351092033.0,192,Hnnng! [Mahou Shoujo Madoka☆Magica]
1375827141.0,191,Shinka with a tan really looks... [Chuu2]
1374746950.0,193,Habenero-tan and Jalapeno-san
1373745644.0,191,Eyebrows overload
1371242978.0,194,Good afternoon! New [Henneko] episode tomorrow!
1366320722.0,191,Cheerleader Rikka [Chuunibyou demo koi ga shitai!]
1365612856.0,189,More bunny girls? [Kurousaga - mondaiji-tachi ga isekai kara kuru sou desu yo?]
1365524761.0,193,[Touhou] × [Clannad]
1363023387.0,193,"Oh Taiga, I love you"
1347205342.0,192,I don't think you guys would mind some yuri [K-On!]
1376391177.0,192,Waiting for you after school [Original]
1372795028.0,192,Don't cry [WateMote]
1368616139.0,195,It's (almost) Wednesday #4 [Bakemonogatari]
1368589479.0,194,Who needs them anyways? (Spice and Wolf)
1367614124.0,193,Dat fang.[Ore no Imouto]
1365466697.0,188,Thumbs up for moe! (Tamako Market)
1363889921.0,189,So much nekomimi art. Can they join in the fun too? [Madoka Magica]
1362996715.0,189,"You freaking dog, stop staring at me! [Toradora]"
1356648191.0,191,Rikka Takanashi simply one of the most beautiful anime girls
1373912365.0,194,Hyouka in Nichijou's art style is rather lovely. [Hyouka][Nichijou]
1373434665.0,191,For her birthday: Hanako from Katawa Shoujo. Artist: Suriko
1373347605.0,189,"With or without the eyepatch, she's pretty damn cute [Chuunibyou]"
1370358165.0,193,I love adorable catgirls like this! :3 [Original]
1369945958.0,187,"A pretty scene. [Hatsune Miku, Vocaloid]"
1367155536.0,193,Mugi fashion! [K-On!]
1362539590.0,192,Little bit of a cross over here [steins;gate x Chuu2]
1355156690.0,188,"You guys keep saying she's cute without her hairband, but I think Ritsu is adorable either way. [K-On!]"
1347558934.0,189,"Smile for /r/awwnime, like this...
[Steins;Gate x Oreimo]"
1376180323.0,188,Even her hugs are awkward [WataMote]
1375895695.0,189,Tomoko just before her graduation [WataMote]
1369712898.0,191,Witches don't stand a chance! [Bakemonogatari x Madoka★Magica]
1369248171.0,190,My Mahou Shoujo Can't be this Elegant.[Madoka Magica]
1368723734.0,190,Those fierce green eyes...[Soul Eater]
1368357281.0,188,Elegance [Original]
1368347739.0,189,Everyone should start their day with a good dose of Kuroneko. [Oreimo]
1368329761.0,185,Yuno is way too cute [Mirai Nikki]
1368283944.0,187,Oneee-sama~ [Toaru Kagaku no Railgun]
1367088203.0,190,Mio has something for you. (Even thought its a bit late) [K-ON!]
1365274209.0,185,Embarrassed Kuroneko
1365174690.0,188,What team are you rooting for? [Idolm@ster]
1362873896.0,193,At the beach/pool (Hyouka)
1361023725.0,192,Sometimes just a simple smile is enough to make one hhnnnngg. [Yuru Yuri]
1353397488.0,190,Taiga has been extra good so Santa will bring her votes
1375305087.0,189,"Double the fire, double the trouble. [Monogatari Series]"
1374595151.0,190,"""Well, I was wondering if it was cute... It's cute, isn't it?"" [Nisemonogatari]"
1372263390.0,188,Cozy Ami-chan [Toradora]
1371685662.0,189,When Mugis attack! [K-On!/Attack on Titan]
1369423558.0,189,Haruhi is super excited [TMOHS]
1369262723.0,187,Seiyuu/VA jokes are cool [Bakemonogatari x Madoka★Magica]
1368240689.0,188,A day with Rikka is a good day indeed [Chuunibyou]
1367243306.0,185,Any Love for a Blind Girl? [Katawa Shoujo]
1366977406.0,186,Maids~ [K-On!]
1366450526.0,190,"""Ah.. T-Thank you for remembering my b-b-birthday, senpai..."""
1363347292.0,190,I like trains. [Original]
1358614135.0,191,My kind of party! [Puella Magi Madoka Magica]
1347073098.0,188,"I don't want you to upvote this post, but I won't stop you if you do. [Toradora]"
1376122874.0,187,"Elsie, now in maid version~ (x-post from r/ZettaiRyouiki) [TWoGK]"
1375726774.0,188,Oh Mugi. Just can't resist. [K-ON! and Madoka *spoilers*]
1373448915.0,188,"I've posted this before, but since it's her birthday, I had to share it again [Katawa Shoujo]"
1372350103.0,189,Some Kantoku for your Thursday [Hen'Neko]
1369494847.0,189,TOSHINOU KYOUKO! is invulnerable to rain. [Yuru Yuri]
1369137418.0,184,Rikka and Dekomori~ [Chuunibyou demo Koi ga Shitai!]
1368197322.0,185,Please pick her up. Her name is Kanade. [Angel Beats!]
1365006063.0,188,Megane Kuroneko [OreImo]
1360842549.0,187,Best gift for today [Oreimo]
1357682132.0,187,Ponytail Azunyan HNNNNNGGG (Azusa from K-On!)
1354563908.0,187,I won???? [Chuunibyou demo Koi ga Shitai!]
1353717433.0,187,"Okabe said pigtails would look cute. She may disagree, but I don't. [Steins;Gate]"
1353307712.0,187,This is how I spend my free time. [Original]
1376024511.0,188,[K-ON!] Babies
1374533770.0,188,"Food can be cute, too! Here's a pic of meat. [Haganai]"
1373644138.0,185,Shingeki no Mikujin [Vocaloid/Shingeki no Kyojin]
1370870994.0,188,I just had to make this stitch [Oregairu]
1368894052.0,187,Mikasa's eyes stare into your soul.[Shingeki no Kyojin]
1368446313.0,185,"Late for Mother's Day, but still...those feels...[Madoka]"
1368296815.0,183,"""Wait just a little longer, dinner will be ready soon~"" [Original]"
1366746353.0,185,There you go. [K-On!]
1360937191.0,183,Akari is such a naughty girl. [Yuru Yuri]
1360264702.0,185,"If you meet Haruhi on the road, hug her [TMOHS]."
1360054353.0,188,Kirino playing with her hair [Ore no Imouto]
1353461495.0,187,More Minecraft
1350571780.0,184,Hug [Yuru Yuri]
1375809488.0,184,"Panic mode! Post Girls Dead Monster, console cute girls! [Angel Beats!]"
1375160308.0,186,Have a Tsutsukakushi Tsukiko in a maid uniform.
1374836568.0,185,I sense a lack of Yuno in this subreddit
1373330327.0,189,Love as pure as snow[original]
1373276135.0,183,Twirl-a-loli [Little Busters]
1372789111.0,186,"Hope you're enjoying your birthday, Tsumugi!"
1370890940.0,184,She's one of the reasons I wake up every Sunday. [HenNeko]
1367518760.0,186,Curiosity! [Hyouka]
1366990511.0,186,"I like the name Megumi. Not only does it sound exceptionally cute, it's just one of those names that feel so strangely satisfying to pronounce. [Gj-Bu]"
1365016142.0,185,"A little late for Christmas, but... (Nakano Azusa, K-On!)"
1362355027.0,186,Shark in a cup has a potential to become a new thing. [Spice and Wolf]
1359133373.0,189,Hachikuji Mayoi from [Bake/Nisemonogatari]
1352741218.0,182,You'll always be with me no matter what happens.. [Madoka Magica]
1345407157.0,185,Madoka is cute with a ponytail. [Mahou Shoujo Madoka Magica]
1374973308.0,184,A pouting Kirino. [Oreimo]
1374693055.0,188,"""Ok, all together now!"" [K-On!]"
1372446247.0,184,Tsukiko and Azuki~ [Hentai Ouji to Warawanai Neko]
1371598726.0,180,Pokemon trainer Haruhi [TMOHS][Pokemon]
1370134303.0,186,tickle.gif [Henneko]
1369928607.0,184,"It's almost like it moves. Oh wait, it really does move! [Original]"
1369663241.0,184,It's like meeting your idol in normal clothes. You're stunned by the beauty of something so simple that you always expected such extravagance from. [Touhou]
1369320878.0,183,The Student Council President [Yuru Yuri]
1368561074.0,186,*Pout* [HenNeko]
1365629181.0,184,"Dereban, because ""Waifu Wednesday""! [Kokoro Connect]"
1362609918.0,187,Azunyan for Waifu Wednesday (Azusa from K-On!)
1358137023.0,184,"In light of making Holo sad here's her as a maid!
(Spice and Wolf)"
1357846881.0,183,Shinobu is pretty cute. [Monogatari Series]
1356038347.0,184,"Kanade, stop pulling pranks on me! [Angel Beats]"
1349034077.0,183,[found] A catgirl Asuna! (SAO)
1347273300.0,184,I would catch her for sure [Misaka Mikoto]
1336094558.0,187,Engage Nekomimi mode!
1375730627.0,183,"""Here, take my hand.."" [Vocaloid]"
1372976278.0,182,Double Shinobu [-monogatari]
1372428575.0,183,If only they made a show like this [K-on x Lucky Star]
1372359877.0,182,"Wink, wink [Super Sonico]"
1370955017.0,185,Those beautiful eyes that stare into your soul~ [HenNeko]
1370047424.0,182,"Not exactly moe, but I find it cute (Lisbeth especially)"
1368263403.0,181,[Original] Moe is never ending
1359351148.0,182,Signaling for Hugs [Yuru Yuri]
1353859428.0,182,Naps for the nap god [Chuunibyou demo Koi ga Shitai!]
1350741020.0,180,&gt;:O (Angel Beats!)
1339689073.0,185,"Kitty, please, just give them back! [Homura - Mahou Shoujo Madoka Magica]"
1376309071.0,181,"No-Top-Three-Sunday has ended, normal service is resumed. [Vocaloid Vocaloid Vocaloid]"
1370454028.0,185,"""And I don't mind that it's raining, because then the tears won't seem to show."" [Yahari Ore no Seishun Love Comedy wa Machigatteiru]"
1367394998.0,178,It's (almost) Wednesday... again [Bakemonogatari]
1367166091.0,184,Want some feedback? [Oregairu]
1364700185.0,186,Lightning [Final Fantasy XIII by: apt]
