created_utc,score,title
1372010024.0,649,Every time you downvote an awwnime post [Reddit]
1365843001.0,642,These are way too cute. [TMoHS]
1364905523.0,639,This has to be the one the best scenes in [Yuruyuri].
1367852526.0,549,CHU CHU MOTHERFUCKERS [Haiyore! Nyaruko-san] [GIF]
1350240353.0,525,Warning: This might be difficult to watch. [Puella Magi Madoka Magika]
1365070272.0,514,A brief window of opportunity... [Original]
1363298628.0,486,She wants you to sit beside her [Original]
1373248065.0,484,She's a keeper. [Oreimo]
1360851008.0,468,O.O? [K-ON]
1364216145.0,465,My Little Sisters Can't Possibly Be This Cute! [Bioshock]
1348305618.0,461,This is a serious issue
1375415734.0,446,And now for something completely different. [Oreimo]
1376230696.0,431,Reddit-tan teaches you how to upvote... and downvote! [Reddit]
1369584323.0,432,Lissandra's Secret [League of Legends]
1352141768.0,429,Drawing moe is hard work.  Especially when you have to draw someone cuter than yourself! [Original]
1368544990.0,420,'I slipped up and accidentally bought 2 meal tickets...' [Angel Beats]
1364948969.0,421,Kirino found out you browse /r/pantsu [OreImo]
1374248496.0,412,Do...do I need to list ALL the sources [Original]
1366217675.0,410,Play time. [SAO]
1370346548.0,402,If you'd ever confess to Yukko...[Nichijou]
1364848104.0,387,Many of us today.
1361294990.0,390,Off to school! [Original]
1358013661.0,380,Simple and effective. A key to being successfully charming! [Original]
1371701913.0,372,"""Huh? You wanna build a kite with me?"" [Original]"
1364240187.0,380,I hope this subreddit doesn't explode.[Angel beats]
1367670026.0,374,Huge Pokemoe haul [Pokemon]
1363499798.0,369,"Hermione is moe, right? [Harry Potter]"
1363367159.0,368,Art doesn't need to be colorful to stand out and this is a beautiful example why. [Original]
1365334979.0,362,40-year-old woman can be moe. [Denpa Onna to Seishun Otoko]
1374695879.0,362,Stylish [The Melancholy of Haruhi Suzumiya]
1368460625.0,360,Have some full-deredere-mode Touka-san in cheerleading outfit. [Chuunibyou]
1367244218.0,359,"""Dr. Pepper"" The drink of the chosen [Steins;Gate]"
1363910739.0,362,A promise is a promise [Madoka Magica]
1371316000.0,356,I wholesomely approve of Firefox's new mascot! [Spice &amp; Wolf]
1367359815.0,349,I hear she's your type. [Original]
1370823750.0,349,Cute Ymir x Christa Comic Strip [Shingeki no Kyojin]
1366581829.0,348,Everyone likes a dancing loli [Hentai Ouji]
1375747952.0,347,It's a crime against moe that this only got 17 upvotes. [Tsukihi; Monogatari series]
1366390094.0,348,Taking beauty and moe to a whole new level. [Original]
1362928048.0,342,How to correctly carry a moegirl with one arm. [Yuru Yuri]
1348863670.0,346,"If foxgirl=great, and catgirl=great, then FoxgirlxCatgirl=Super great! [Original]"
1374007961.0,349,Eeeeehehehehehehe~ [Madoka Magica]
1362791566.0,344,Made A Wallpaper With The Awwnime Reddit Girl! [Semi-Original?] Enjoy!
1359816463.0,346,You can't resist the fang! [Xpost /r/Oreimo]
1375283581.0,343,"""It's okay Yuri. You might not get posted in awwnime very often, but that doesn't mean they don't like you."" [Angel Beats]"
1359386196.0,337,Baka! I'm not cute at all! [Ore no Imōto ga Konnani Kawaii Wake ga Nai]
1367003486.0,341,Sena and Kobato~
1364660350.0,337,Epic Head Tilt [assorted Kyoani]
1372439289.0,341,I laughed harder than I probably should have at this. (Oreimo)
1369414430.0,332,Azu-nyan
1365955840.0,336,Pivot [Clannad]
1362320182.0,329,"I wish artists could shape reality.  The good ones, that is... [Original]"
1364300468.0,335,Super Magica★Girls. [Madoka★Magica]
1369070006.0,334,If only there was classical art like this [Original]
1376338654.0,330,Misunderstood Sadako [The Ring/Ringu]
1359739082.0,330,It's only awkward if you get caught [Original]
1366824492.0,331,Drunk Nagisa is adorable. [Clannad: After Story]
1366893564.0,322,feh [Vocaloid]
1374777531.0,328,Silica with her hair down! [Sword Art Online]
1375117056.0,327,Hanging out [Shingeki no Kyojin]
1364828385.0,321,Kanade in YuruYuri artstyle. Illustrated by Namori herself. [Angel Beats]
1361116350.0,315,"No eyepatch or contact lenses? Still too cute for words. (Rikka, Chuunibyou)"
1366140576.0,314,Fashionable Tsukiko [Hentai Ouji to Warawanai Neko]
1374385743.0,313,Every time I enter this subreddit
1366474515.0,312,Beek has to be one of my favorite artists. [Hatsune Miku + various other vocaloids]
1365785268.0,316,Super major awesome cool Haruhi. Did I use enough adjectives?[TMoHS]
1355793499.0,312,The early signs of Tsundere 
1359311377.0,310,"""Onii-chan, may I use your computer?"" [Original]"
1374621521.0,312,Just what you need on a bad day~!
1343683078.0,306,This is how I imagine r/awwnime
1361662835.0,305,This is amazing [Mondaiji]
1360594409.0,311,Mugi tries chicken. [K-On! / Tamako Market]
1376075485.0,306,"I'm not a big Haruhi fan myself, but this smile makes me reconsider this [TMoHS]"
1358777146.0,306,"Pepsi is fine and all, but I think we all know what the REAL winner is [Steins;gate]"
1374858012.0,307,Some pretty Kirino today. [Ore no Imouto]
1362149994.0,303,Just because you're not posted often doesn't mean we don't love you! [Angel Beats]
1373428640.0,302,Happy Birthday Hanako [Katawa Shoujo]
1345642288.0,302,Image Macro Amnesty Day. Get them out of your system. [K-ON!]
1375887246.0,300,"Lap pillow, arm pillow, boob pillow, shoulder pillow. [Angel Beats!]"
1375539533.0,299,Some Misaka to match our new banner! [Raildex]
1369835011.0,296,"Happy 10th Anniversary, [Clannad]!"
1375996764.0,303,Now for a slightly different Miku [Vocaloid]
1372707744.0,294,"""I love you"" [OreImo]"
1369913458.0,294,"As promised, here is Tsutsukakushi Tsukiko wearing a hat [Henneko]"
1368636841.0,294,Made this gif a while ago... totally forgot about it [Henneko]
1365633991.0,292,Just Rikka [Chuunibyou]
1357084743.0,295,Rikka's impressed with how awwnime has grown!
1369610845.0,297,She's almost life-sized. [Hyouka]
1362835391.0,290,"Give that bitch a forehead kiss, bitches love forehead kisses. [Puella Magi Madoka Magica]"
1374943589.0,288,"""This is the dumbest cosplay ever...""[Pokemon x Raildex]"
1362494482.0,295,Can you be more kawaii?
1361390539.0,292,"""L-like this, sir?"" [Angel Beats]"
1374329188.0,288,Don't go... [Original]
1370008680.0,291,You really think that I'm cute? [Original]
1344166767.0,291,Be moe? I can't do that..
1374722274.0,286,Best girl! [Final Fantasy XIII]
1374593932.0,288,Will you hug Kanade ? [Angel Beats]
1376660469.0,287,Unexpected gift [Shingeki no Kyojin]
1374533329.0,286,"Some would say, she's not worth the trouble. I'd tell them, just look at that smile. [Haruhi]"
1372352927.0,286,Mami is the loneliest number. [Madoka Magica]
1364743788.0,285,"Looks like some one abandoned this Kuroneko, Won't some one take her home? [Ore no Imōto ga Konna ni Kawaii Wake ga Nai]"
1357833986.0,287,Cuteness~
1354386310.0,282,Dat........ Dat ponytail. [Lucky Star]
1349949461.0,286,Miku with different hairstyles [x-post from /r/vocaloid]
1368204307.0,282,^_^ [K-On!]
1363204762.0,286,Row! Row! Fight the -HNNNG!... [Gurren Lagann (TTGL)]
1374155601.0,288,Let's see how much [Madoka Magica] cuteness we can squeeze into one post
1370574107.0,282,Spicy! [Aiura]
1370204949.0,285,Misaka appears to have misplaced her normal uniform.[Toaru...Index/Railgun]
1361927605.0,284,Taiga's Full Body. [Toradora!]
1370028826.0,280,How do I into phone? [Kore wa Zonbi Desu ka?]
1368990296.0,284,"To celebrate 10k subscribers, the REAL queen of awwnime! [Toradora!]"
1371207668.0,279,White/silver hair is alluring to me. [Original]
1368547659.0,279,"How long have I not posted? That's right, god damn forever. [Vocaloid]"
1375646176.0,279,"""Don't worry sweetheart, Mommy will be back soon"" [Original]"
1370987598.0,275,"Sena is almost perfect, right? [Haganai]"
1375194383.0,279,"Azuki seems to be getting a lot of love, but we all know Tsutsukakushi is the best girl. [HenNeko]"
1375027383.0,277,Sena must be in heavens seeing Kobato in a lovely dress like this [Haganai]
1362070854.0,281,Uhhhhhh............ umm.... mm.... I.. well..... Yes. Definitely Yes. [boku wa tomodachi ga sukunai]
1365297868.0,275,Miku drawn in the style of K-On!~ [Vocaloid]
1356886960.0,275,I stole this because no one had posted it here yet.  Fools![Touhou]
1335626186.0,278,Yes We Nyan!
1376407418.0,278,A greedy Shion-san. [GJ-bu]
1364331966.0,278,Right in the feels. [Angel Beats!]
1354200889.0,272,"Hi!  It's me, Yui Hirasawa!  Please vote for me!  Thank you!  [K-On!]"
1376054699.0,277,Get Chance and Luck! [Angel Beats]
1367880039.0,275,No title could possibly be worthy of this masterpiece. [Madoka Magica]
1352205631.0,277,I &lt;3 Pocky! [Original]
1373475753.0,275,Ice Queen? [Oregairu]
1367105654.0,273,Yes. Yes you are. [HenNeko]
1366305064.0,274,Wavy YuiAzu [K-ON!]
1355716952.0,270,This is kinda embarrassing. [Original]
1375968521.0,269,"""W-would you like half?"" [Original]"
1374056894.0,272,You smiled back on her didn't you? [Oreimo]
1368489694.0,273,Can Monster Girl Monday be a thing? [Original]
1375557368.0,270,Perfection comes in many forms. [Katawa Shoujo]
1372115424.0,272,Lovely My Angel Ayase-tan can't be this restrained. [OreImo]
1369354226.0,273,[K-On] Azunyan with a Ponytail~
1357596593.0,270,They have a day? for me?! on the INTERNET?!?~
1355423360.0,270,So cute I can't stand it... [Ore no Imouto]
1376501763.0,271,A catgirl a day keeps the doctor away. [Puella Magi Madoka Magica]
1367073597.0,271,In a perfect world [Mahou Shoujo Madoka★Magica]
1376697960.0,264,For those that love nutella: It just got better.
1375066903.0,268,"Senpai, I'm embarrassed [Oreimo]"
1366120373.0,269,Gamerneko doesn't need sight to win [OreImo]
1354730628.0,271,"Sleeves just long enough that they cover the wrist and palm, whilst exposing only the fingers. Now THAT is moe. [TDOHS]"
1351521972.0,267,I love sharks! [Hakase from Nichijou]
1372044099.0,263,Kuroneko as Kobato. [Oreimo] [Haganai]
1371585492.0,267,O-Onii-chan...
1371063955.0,267,Rikka's gearing up for her new movie! [Chuunibyou Demo Koi ga Shitai!]
1371507046.0,262,"""Onii-san, stop being such a pervert!"" [OreImo]"
1358357336.0,265,"This one is for the redditor that mentioned ""striped patterns that remind him of Scotland."" Hope he takes a look. [Kantoku]"
1361158401.0,263,"""Q: What's an easy way to get your post removed? A: Visible underwear."" CHALLENGE ACCEPTED. [Madoka]"
1367157565.0,264,"I should be doing homework, but fuck 3D reality, it's much brighter and warmer here [Vocaloid]"
1366925132.0,264,Pretty Much sums up my expression 95% of the time on the Internet (Gj-Bu)
1360001845.0,264,The blinking of a thousand moes [Chuunibyou demo Koi ga Shitai!]
1371753858.0,261,Dress-up Konata continues. [Lucky Star/Yuru Yuri]
1360790856.0,260,She Seems Shy [Original]
1373946835.0,261,Karen Araragi [Monogatari]
1368382573.0,262,Happy Mother's Day! [Toradora]
1368051250.0,257,Nice Kirino pic[Oreimo]
1361807213.0,257,"She also has purple eyes, although they're not as big as Eru's [Original]"
1355969136.0,259,Dekomori is pretty cute with or without her deathly twin tails [Chuunibyou]
1372944609.0,259,The anime is coming out this Monday so this is obligatory [WataMote]
1372686812.0,262,You should have more than two outfits. [Madoka Magica]
1376311227.0,258,Yui! Don't Pet that thing!!
1368120241.0,254,Girls Dead Monster [Angel Beats]
1365022539.0,255,A most curious angel [Hyouka]
1367447190.0,259,K-On! pajama fashion!
1374985002.0,257,...and they all like red. [Sword Art Online]
1373384626.0,255,Somehow even sitting feels naughty now. [Bakemonogatari]
1368035924.0,259,"I'm not tasty at all... Oh wait, what?! [Original]"
1360342702.0,257,"It's 4am and I need to go to sleep, but I felt I owed you guys a post. I think this will do nicely [Spice and Wolf]"
1364039687.0,258,How I wish she could be my character in a game.[Original]
1361899839.0,256,She's determined to make it the best flower drawing ever [Original]
1357952162.0,257,"If angels are so, I already want to die!"
1375451308.0,254,"H-here I just happened to have some cookies spare, i-it's not like I would have baked them for you or anything..[Clannad] [X-post from /r/Tsunderes/]"
1375170857.0,256,"""What do you want to do senpai ?"" [Oreimo]"
1370274366.0,256,"I, for one, welcome our new Goddess [OreImo]"
1372616190.0,254,"I've been playing a lot of [TERA] lately, so here's an elin."
1371756037.0,251,"Maybe - just maybe - it is she who constructs the HTTP request when you enter the URL... [Original, TRON: Legacy]"
1368146225.0,256,Roommates [Madoka Magica]
1346773242.0,252,"Alright, I'll help you if you wear a maid outfit. [Angel Beats!]"
1342927380.0,252,There is a 100% chance you know this one.
1368300445.0,256,"Was going to be a bonus, but I liked this Kuroneko image too much. [Oreimo]"
1355354475.0,254,Kagamin is trying very hard to hide her feelings toward Konata. [Lucky Star]
1353762480.0,255,Getting ready [K-On!]
1342063310.0,251,My blood just condensed into pure sugar. [ToraDora]
1367516351.0,248,Bookish [Original]
1360730218.0,249,"Ritsu - With leggings, sans headband [K-ON!]"
1359208395.0,252,Picachu (pokemon)
1352394459.0,250,"If Taiga wins this whole thing, I might forgive you guys for voting all my other picks out [Toradora!]"
1371577337.0,248,Jumping on the Ayase wagon..[Oriemo]
1370184942.0,246,This subreddit needs more Shiori! [The world God only knows]
1366062458.0,250,Kumin Senpai and her favorite thing. [Chuunibyou demo Koi ga Shitai]
1360224371.0,247,You shall have no other gods before me [TMOHS].
1374184458.0,250,Grrrrr[en Lagann]
1373765048.0,252,"Heterochromia, plushie hug, ♥ necklace, some frills and laces, hair flower, that look on her face... [Original]"
1370448957.0,249,A small album to welcome summer.[Original]
1367980846.0,248,"I know she has her share of critics, but it's hard to hate an all-dere Kirino.[OreImo]"
1356387175.0,247,A [K-On!] prequel would be absolutely amazing
1353171175.0,249,"Okay, so like. They're in [Neon Genesis Evangelion] suits. That works for you all, right? [Puella Magi Madoka Magica]"
1374255862.0,250,Busted. [Ore no Imouto]
1370703702.0,250,"The machine translation is ""Black cat cute, cute is natural."" [Oreimo]"
1368800490.0,249,Sweet Princess [Hentai Ouji to Warawanai Neko]
1361694510.0,250,A ferris wheel ride with a pretty girl~[Original]
1361478065.0,248,It can't rain all the time... [K-On!]
1359245296.0,246,I want a girl with a short skirt and a looooooooooooooong jacket.
1371305895.0,244,Chi-chan is cheering for you [Hyouka]
1369033308.0,248,Aoyama &lt;3 (Sakurasou no pet na kanojo)
1367935840.0,248,"If this was a photo, it would not be so pretty. [Original]"
1363624704.0,247,Old girls can be moe too [Original]
1358437892.0,249,"Oh dear, what a mess. [Original]"
1355682057.0,246,Clothes Exchange [Madoka★Magica]
1374678801.0,248,w-w-why am i not popular? [WataMote]
1373907763.0,242,Sharing music [Original]
1361623833.0,246,"Producing moe is hard work.  Not enough caffeine, clearly. [Original]"
1375303533.0,242,Of course we all love Yuri! [Angel Beats!]
1372876248.0,244,Would... would you still like me... even if I take them off? [Original]
1372524223.0,242,"In awwnime, summer simply means cute girls in sundresses [K-On!]"
1371672695.0,242,Deep and Curious [Hyouka]
1369979932.0,244,Azuki Azusa Best Girl [Henneko]
1360890136.0,243,I-it's not like I wanted to wish you a Happy V-Valentines Day or anything! [Original]
1375723027.0,243,"Qipao Negitoro! [Megurine Luka &amp; Hatsune Miku, Vocaloid]"
1372182150.0,245,Tomboy is my favourite boy [Original]
1369503198.0,243,She's Too Cute!
1368765004.0,241,Ruri is fashionably late for the sundress party [Oreimo]
1375348133.0,239,Handcuff revenge [Ore no Imouto]
1371867831.0,239,1 moe + 1 moe = hnnnnnnng [Haganai x Vocaloid]
1368835265.0,245,Another sundress it seems [Oreimo]
1356093885.0,246,"I have something for you, death~♥ [Chuunibyou]"
1353357849.0,242,Hanako... gun... maid outfit... [Katawa Shoujo]
1375229626.0,238,"You win some, you lose some... [K-ON! / Working!]"
1374501259.0,243,The swim team member that does not swim. [Free!]
1373852494.0,239,Joined Reddit a week ago. I feel like I'm late to the party...[Angel Beats]
1372778147.0,241,"In celebration of Mugi's birthday, some more Moe Crossover! [K-On! x Katawa Shoujo]"
1353430157.0,243,You newbies need more practice in the art of fetching moe. Let me help you with that. [Toradora]
1375801819.0,238,When I said we needed more IA I meant it. [Vocaloid]
1375248469.0,239,[Chuunibyou] Daycare
1374825794.0,238,"Her name is Kiss-Shot Acerola-Orion Heart-Under-Blade, and she likes donuts. [-Monogatari Series]"
1374374116.0,241,Be my wife. [Kiniro Mosaic]
1370065726.0,235,If [Madoka★Magica] was a Slice of life
1369849045.0,242,Drunk moe is dangerous moe [Touhou]
1360494787.0,237,[Super Mario] Girl
1359070585.0,240,I love you. [Inu x Boku SS]
1375625240.0,240,"We're nearly there, follow me [OreImo]"
1374448317.0,235,"She's an ancient pure-blood vampire who enjoys drinking the blood of innocent tomatoes, and spending time with her An-chan. [Haganai]"
1373057060.0,241,Mami's part-time job. [Mahou Shoujo Madoka Magica]
1372990515.0,240,Yui with hair bobbles. [K-On!]
1372544937.0,239,Adorkable lil' otaku (Oreimo)
1371254081.0,239,A young Haruhi. [The Melancholy of Haruhi Suzumiya]
1370542459.0,235,"""Nyaa... am I extremely huggable yet?""[Elsword]"
1369316287.0,237,Yoko needs more love on this subreddit [Gurren Lagann]
1357520538.0,235,I have recently discovered the beauty of Tsumiki [Acchi Kocchi]
1354119975.0,238,Sandwiched [Original]
1346941567.0,240,Dragon x Tiger kiss! [Toradora]
1360388788.0,240,She beat the first boss! [Super Mario Bros.]
1370130835.0,235,"In honor of our new banner and an AMAZING episode, have some Kirineko! [Oreimo]"
1360192222.0,236,Warning: this image will melt your frozen heart. [Mahou Shoujo Madoka★Magica]
1351700739.0,234,"Catgirl Miku, in case the subreddit hasn't exploded yet. [Vocaloid]"
1351667566.0,237,Miku as a foxgirl. I'm afraid the subreddit will explode [Vocaloid]
1374745673.0,232,"""Here, kitty kitty~"" [HenNeko]"
1373466247.0,237,"Happy Birthday, Best Katawa :3 [Katawa Shoujo]"
1364489207.0,234,Shion's Twirl [GJ-bu]
1363636384.0,231,Middle schooler Rikka: Is that explanatory enough for a title? [Chuunibyou demo Koi ga Shitai]
1355531353.0,238,Moe will never die.
1371407434.0,232,There is so much hnng in this picture! [HenNeko]
1370103756.0,233,Then you continue down that stream and meet another lovely girl. This day became amazing. [Ore wa Imouto ga Konnai Kawaii Wake ga Nai]
1365436466.0,233,Reddit = Cats..... Miku + Cats = ?
1364512067.0,232,Konata's so cute! [Lucky Star]
1363633674.0,232,Thank God I'm not a music teacher [Original]
1363120774.0,235,Best part of the opening theme! [Nichijou]
1370902120.0,233,"""Would you like to hear a song?"" [Original]"
1370614874.0,236,Costume swap [mahou shoujo madoka magica]
1368942235.0,233,Kuroneko! [Oreimo]
1368008475.0,230,"[Chuunibyou demo Koi ga Shitai!] is getting a second season, All hail the Queen !"
1366714480.0,235,aaan~ hum~ humuhumuhumuhum~ [Hentai Ouji to Warawanai Neko]
1365922703.0,233,"So, I found this while searching for something else and had to share. [GJ-Bu]"
1363968944.0,231,Night version of the recent Madoka art you all seemed to love so much [Madoka Magica]
1354677643.0,231,Will.. you marry me? (Xpost from /r/oreimo)[Oreimo]
1373555201.0,235,I shall restart the yuri train! [Madoka Magica] - bonus inside
1369013041.0,231,Se...Sempai? [OreImo]
1365265560.0,228,What i-is t-t-this!!! [Monogatari]
1363979781.0,232,"""What are we going to do tomorrow night, Sakurako?"" ""The same thing we do every night, Himawari."""
1360519967.0,230,Luigi never gets any love. [Super Mario]
1335287263.0,233,Aw Taiga...♥
1376588585.0,229,"More Fashion Advice from the Glorious Kantoku [Original, Bonus inside!]"
1375630296.0,232,"""Shh, don't wake her up.. She's so cute when she's sleeping~"" [Original]"
1372327009.0,230,*chu*
1371643408.0,230,I've been waiting here for you [Original]
1367767204.0,227,"Careful, hearts break easy. [Hyouka]"
1366557277.0,229,fabulous [Vocaloid]
1364065802.0,228,Will you accept the charges? [TMoHS]
1363811920.0,230,"Cat-eared Homura, what else can you ask for? [Puella Magi Madoka Magica]"
1353240034.0,232,"I was looking forward to getting lots of karma today, but then I remembered that /r/awwnime doesn't really like Yuri or [K-ON] :-/"
1367684988.0,230,I have to confess: I really like nerdy girls [Original]
1366479219.0,230,Laying Down (Original)
1363463036.0,228,Touko is the best PokeGirl. Just try to prove me wrong [Pokemon]
1375907628.0,224,Dat shirt. [Madoka Magica]
1373730475.0,225,"""I'm sorry I couldn't find a better place or time!"" [Angel Beats]"
1373387379.0,228,Yui Yuigahama [Oregairu]
1370377079.0,227,Hamster-chan! [Gj-bu]
1369742520.0,229,Go ahead and try and tell me that this couple isn't canon [K-ON!]
1363797035.0,228,"Dear /r/awwnime, yesterday I visited my high school math teacher. My sensei, so to say. Do you visit your sensei? [K-On!]"
1361000206.0,227,Don't see much of the [Sailor Moon] girls around here~
1375115164.0,228,She is happy to be with you[Vocaloid]
1372736295.0,229,A couple of cats with intertwined tails. [OreImo x Hen'Neko]
1371489281.0,228,Yesterday I learned I've apparently never posted any [K-ON!].
1370158683.0,226,In a little seaside town...[Original]
1369167720.0,226,Haruhi and her guitar [TMoHS]
1366462684.0,225,"Apparently, today is kuroneko's birthday. [Ore no Imōto ga Konna ni Kawaii Wake ga Nai]"
1365796733.0,227,Hold on... [Hyouka]
1365553556.0,228,"Foxgirl and Zettai Ryouiki, what more could you ask for? [Original]"
1364585882.0,227,"Reimu: ""Does this look good on me?"" [Touhou]"
1355054874.0,231,For my cakeday I present to you: Cake! [K-ON!]
1353145255.0,225,Cat hoodies are adorable [original]
1375396576.0,226,Homura is a good multitasker. [Madoka☆Magica]
1363855673.0,228,"""Like this..?"" [Original]"
1363715971.0,227,No words can describe this... [Vocaloid]
1363290011.0,226,So tiny and cute [Original]
1362443374.0,227,Hissssss (Yuru Yuri)
1372090215.0,223,My little sister can't be this unpopular [WataMote]
1371748727.0,224,"As per /u/TWIGHLIGHT_IS_AWESOME's request, a plethora of Kumin~! [Chuunibyou Demo Koi ga Shitai]"
1370795249.0,226,Mikasa you're looking lovely as usual. [Attack on Titan]
1364839022.0,228,"I don't know what's going on in reddit and I don't know why Azusa is holding a rifle, but damn is she cute. [K-On!]"
1363089220.0,229,"Thanks for brightening my day, now I will brighten yours in 4 simple steps [Touhou]"
1362630468.0,226,Striped Socks (Chuunibyou)
1349316660.0,224,Google (Madoka)
1376095594.0,222,Tsukiko makes a fantastic neko meido~ [HenNeko]
1373984350.0,224,What do you have there? [Vocaloid]
1368296164.0,226,"""Chuuuu-"" *No* [Original]"
1368082000.0,224,Kuroneko and Kirino [Oreimo]
1363596240.0,224,Miku reporting for duty..
1363010508.0,223,Ai means wuv [Oreshura]
1362324238.0,224,Slowly... [Hyouka]
1359491383.0,220,"They're ready to take your order. The restaurant's specialty is hugs. (Ritsu, Mio, Azusa, Tsumugi and Yui from K-On!)"
1374785574.0,221,It's over nyan thousands! [Original]
1368296351.0,223,Kyousuke x Kuroneko ending card.[Oreimo] Additional version in comments.
1363846804.0,225,Is her hair color purple or black? [Original]
1362264536.0,220,nom [GJ-bu]
1361988982.0,222,On the importance of learning Japanese and inconspicuous dangers of Pixiv [Original]
1361036548.0,220,:D [Original]
1359475397.0,220,Kanade with an interestingly different hairstyle and clothing.
1357512439.0,219,Saw this and couldn't stop myself from posting it! [Ore no Imouto]
1376601428.0,221,"What's Better Than a Cat Girl? Two Cat Girls, of course~! [Original]"
1369758601.0,221,"Kagami is treating Konata to a day out, and a box to stand on. [Lucky☆Star]"
1368821874.0,221,Poor Ami [Toradora]
1368528461.0,220,Special service [OreImo]
1367757952.0,223,I hope you've seen all three so you can properly understand the gathering of all three. [Chuunibyou demo koi ga shitai][Tamako Market][Hyouka!]
1364146334.0,225,I like to pretend my Android is a moegirl. [Original]
1352298826.0,221,"In light of today's important vote, I'd like to submit this to confuse the hell out of everyone."
1376436090.0,221,"""But that's... forbidden love!"" [Madoka Magica]"
1373082165.0,219,Titles are hard. [OreImo]
1371825577.0,220,Shinobu loses to no one [Nisemonogatari]
1370650499.0,222,Chibi Potato girl &lt;3 [Shingeki no Kyojin]
1370302933.0,220,"Thanks for the Flair guys! In return, here's some Moe. [Lucky Star]"
1369938041.0,218,Let me show you the dance of my people [Chuunibyou demo Koi ga Shitai!]
1355347639.0,219,"Wake up, Kumin senpai! It's time for [Chunibyou demo koi ga shitai]"
1376567950.0,220,Sena Meat Kashiwazaki~ [Boku wa Tomodachi ga Sukunai]
1375316704.0,218,Kyoko... in a school uniform? And with twintails!? [Madoka Magica]
1373575624.0,221,Won't you take her on a date? [Original]
1369937312.0,220,Ohanami with Kuroneko. Does it get better than this? [Oreimo]
1367167321.0,218,"Come to think of it, I haven't posted Rin in quite a while... [Vocaloid]"
1366286081.0,219,Nyaa~ [K-On!]
1363720776.0,217,I can't stop watching this. [Gj-bu]
1362413798.0,220,"I swear to God, I'm going to pistol-whip the next guy who says ""harem."" [K-ON!]"
1361982550.0,222,Combining French into Japanese culture has always been one of my favorite styles.  Give me some victorian to boot and I'm in love. [Original]
1351618605.0,221,These aren't my glasses. [Original]
1373524789.0,222,YOU'RE THE BEST TOMOKO! [WataMote]
1367256540.0,218,Little Sena-chan [haganai]
1362758130.0,219,Ooh ooh me too! [Hyouka]
1361754625.0,216,Things we think are cool!: Girls in suits!
1361733971.0,218,Yui being Yui [K-On!]
1354548845.0,220,Chitanda in pigtails! [Hyouka]
