created_utc,score,title
1359763211.0,182,Age Switch [Tamako Market]
1357139645.0,182,She looks like a fish. [K-ON]
1353642510.0,180,"""Do you *mind*?!  We're busy here!"" [Yuru Yuri]"
1346867349.0,182,My Little Vampire Can't Be This Cute [Bake/Nisemonogatari]
1376564586.0,183,There is just something about pretty girls with flowers [Original]
1375837000.0,183,My heart has just exploded.
1375583190.0,182,"Though I'm partial to Kuroneko, Ayase still makes me hnng! [Oreimo]"
1373326032.0,184,Some Lisbeth for you all! [Sword Art Online]
1370429582.0,185,It's (almost) Wednesday #7 [Bakemonogatari]
1368372161.0,182,(Un)fortunate experience... [OreImo]
1368040024.0,181,I'm speechless[Vocaloid]
1366661722.0,181,"My first post was Luka, For awwnime's birthday I'll post some Luka too. [Megurine Luka, Vocaloid]"
1362225526.0,183,"Somehow, still a bit too warm. [Original]"
1355355131.0,183,-_- → o.o → :$ → ^_^ [K-On!]
1351004430.0,179,I sacrificed homework time to bring you this [Original]
1349774010.0,181,I think my heart just melted [Acchi Kocchi]
1347899285.0,181,You should always share your pocky [Ga-Rei: Zero]
1376694386.0,183,"Suddenly, you encounter an elf. [Original]"
1374768604.0,182,"""Stupid Marisa!.."" [Touhou]"
1372365770.0,182,I can't wait for season 2 [Chuunibyou demo koi ga shitai]
1371490618.0,180,Manami is pretty cute with long hair. [OreImo]
1370042608.0,178,Assistant is cute when she's sleeping. [Steins;Gate]
1369550316.0,177,"You know, I really like long-hair Haruhi [Melancholy of Haruhi Suzumiya]"
1368686030.0,183,Yuri love is always moe~ [Strawberry Panic]
1366044815.0,177,Azunyan's cosplay for Miku Monday [K-On!] [Vocaloid]
1364065152.0,177,The moe duo! [Sword art online]
1362066393.0,180,A girl in a kimono sitting on a shrine railing at night [Original]
1359158905.0,181,Being sick has its advantages [K-On!]
1357212320.0,179,Sleepy moe is the best moe [Toradora!]
1354068343.0,182,I'll give you this so you don't forget me tomorrow. [Nichijou]
1353572956.0,182,Smells like Yuuta. [Chuunibyou Demo Koi Ga Shitai!]
1351937328.0,182,One of Kantoku's works [Original]
1373765869.0,181,That playful little hair curl. [Original]
1372015716.0,182,Aikawa gives me regular heart attacks[Yuyushiki]
1370523631.0,181,Erio's cute seifuku [Denpa Onna to Seishun Otoko]
1369881819.0,180,"I just discovered the tag ""cheek to cheek"". It's kind of wonderful [Madoka Magica/K-On!]"
1369793359.0,180,"Today i have been a Redditor for 1 year, have some adorable Tsumiki. [Acchi Kocchi]"
1368631525.0,180,"""I wonder if I could steal some yen from that passed out drunk dude..."" Nah, the old lady on the train would totally take you down. [Original]"
1367213881.0,179,It's Monday... Tsukiko wishes you good luck [Henneko]
1366796988.0,180,Since there's no such thing as too much Rika... [Chuunibyou]
1363533555.0,181,Sleeve-moe looks best on Yuki. [The Melancholy of Haruhi Suzumiya]
1363055011.0,177,"I Can't Think of a Title, But I really Want to Hug Her [Yuru Yuri]"
1362411200.0,178,Hi! [Angel Beats]
1358214929.0,179,Cuddling is good for your heart [K-ON!]
1357577282.0,178,So forward... unless.. their other hands! :x [The Idolm@ster]
1357126801.0,175,Nano doesn't get enough love~[Nichijou]
1335314768.0,180,You're dead.
1376323591.0,180,Wise fox [Original]
1376102179.0,178,English Miku's release art is as adorable as ever.
1374246675.0,179,"""Looking for anything particular?"" [Original]"
1370887739.0,177,Of course she's more cheerful than in the actual show. [Madoka Magica]
1370883483.0,177,Eyepatch Hatsune Miku~ [Vocaloid]
1370636567.0,181,W...Woof? [HenNeko]
1369687210.0,179,Doubling up for Miku Monday and Megane Monday if either of those are still things. Which I hope they are. [Vocaloid]
1369336147.0,177,"Ponytails?... I have a weakness for ponytails...[Megurine Luka, Vocaloid]"
1366603600.0,182,"Been saving this one for a while, but I think it's about time to say bye to winter~ [Hen'neko]"
1364649710.0,177,Reimu's sleeves [Touhou]
1363423669.0,178,"Senpai, wait, one more thing... [Original]"
1362416976.0,175,Electromancer Miku! [Vocaloid]
1357302311.0,181,Kinda looks like a cat-suit version for Rei [Evangelion]
1357181600.0,174,Berets are very adorable (Original)
1353026728.0,181,"MOE STACKING! And yes, that theme. [Original]"
1350210359.0,175,Best Witch Ever. Miku is best cosplayer. [Vocaloid]
1336139639.0,176,Pika Yui
1374468973.0,180,"I've been slacking on my Kantoku lately, so have some Kurumi to brighten your day~ [Original]"
1374409614.0,178,Going out to do some shopping [Madoka Magica]
1373893003.0,176,"Harmless and lovable Kyuubey, not-so-harmless but lovable Kyouko. [Madoka Magica]"
1373567835.0,180,Am I popular already? [WataMote]
1372864544.0,177,My Radioactivity Can't Be This Cute! [Original]
1372044451.0,174,"""Oh hey! Did you wanna help us study?"" [Lucky Star]"
1371258945.0,177,[Potato][Potato][Potato][Potato][Potato][Potato][Potato][Potato][Potato][Potato]]Shingeki no Kyojin]
1370703400.0,177,Isn't gap moe amazing? [Hyouka]
1370625885.0,177,I haven't seen any [FLCL] on here for a long time.
1369780064.0,176,Still not pants. [Strike Witches]
1369093881.0,176,Raichu pokemoe [Pokemon]
1368618091.0,179,Kuroneko can't be this cute [OreImo]
1365520748.0,174,"""Click there"" says Chibi Tsukiko [HenNeko]"
1365253176.0,181,Platinum Cute [Monogatari] (x-post r/imouto)
1364556073.0,175,A collection of Shiguma Rika's various looks [Haganai NEXT]
1364386962.0,178,Sometimes all you really need is a hug from someone who cares about you. [K-ON!]
1359587126.0,177,"""Here, let me brush your hair for you!"" [Chuunibyou]"
1359566371.0,181,Just a catgirl going to school. [Original]
1359243295.0,176,Some moe to cure my pain! [Vocaloid]
1358096164.0,176,This little sister can be this cute ! [Tamako Market]
1358086836.0,180,Catgirls are so cute. [Rebuild of Evangelion]
1354123075.0,175,Brace yourselves. Tsundere blushing catgirl headpat Ika Musume.
1353601058.0,178,"Moe time travel, best time travel. (Yui from K-On!)"
1338658927.0,178,Weeee!
1376056884.0,178,"I love her outfit, especially those shorts. [Original]"
1372591720.0,177,Chitanda enjoying some music. [Hyouka]
1371592935.0,176,The most curious detective [Hyouka]
1368180812.0,174,I'm speechless [Vocaloid]
1367953719.0,179,Screenshots are so Underrated! [Chuunibyou demo Koi ga Shitai!]
1367010239.0,179,"""Can I sleep wif you?"" [Original, artist unknown]"
1366901032.0,176,Easily among the best Shion-san artworks I've come across. [Gj-Bu]
1366696111.0,180,Nyan desu ka? [Henneko]
1361294070.0,174,I never knew meat could be so cute (Boku wa Tomodachi ga Sukunai)
1355206182.0,175,"You are the cutest girl in the world(not irl though), Rikka.  Please don't stop wearing fun outfits. [Chuunibyou demo koi ga shitai!]"
1354025338.0,173,Catgirl Miku needs some shut eyes. [Hatsune Miku]
1353793661.0,178,This subreddit needs more yuri. [Original]
1353778547.0,177,Wishing her luck on the finals today. [Steins;Gate]
1353094026.0,173,"Somewhat early, you say? [Ore no Imouto]"
1348443793.0,180,How to roll up a futon [Denpa Onna to Seishun Otoko]
1346251506.0,172,"Welp, I just killed my laptop keyboard. Posting [Miku]."
1345115444.0,179,"I like tsunderes, you know what I am saying? [Toradora]"
1376514563.0,177,I really miss the antics of the Neighbor's Club; I hope we'll get to see more of them animated in the future. [Haganai]
1376495161.0,178,A graceful Shion-san. [GJ-Bu]
1376163098.0,173,Would you like to go for a bike ride? [Original]
1373651994.0,177,"Be gentle with her, OK?"
1371793363.0,174,"""It's not like I'm worried about sun damage but... Well, I'm a girl after all you know ♪"" [Vocaloid]"
1370931040.0,178,Will you take them home? [AngelBeats]
1369762468.0,173,Yukari's pro defense [Yuyushiki]
1369061804.0,175,Kami-sama? [Shingeki no Kyojin]
1367652514.0,174,The moe is strong in this World-line [Steins;Gate]
1366483637.0,176,Another amazing picture at the end of the new [Oreimo] episode~
1363880421.0,177,This subreddit needs more Kanna-chan. [Tamako Market]
1358884271.0,175,What do you think of Rikka? [Chuunibyou]
1358875683.0,177,Of cat ears and lookalikes. [K-On! / Tamako Market]
1349266722.0,174,A smile to warm the coldest winter day. [Katawa Shoujo]
1347466707.0,173,Her first date [Original]
1374934650.0,172,Surprise! [K-on]
1374285077.0,175,Step 1: Put hands in air. Step 2: Wave like you just don't care [Yuru Yuri]
1371956580.0,174,Thank you guys for cheering on me in my entrance exam! I'm fairly sure I did well! [K-On!]
1371049247.0,175,Summer is here [Original]
1370827880.0,176,Ruri performs sun-hat/dress/flower combo. It is lethal. You have been defeated. [Oreimo]
1370729802.0,173,Some more μ's for you.[Love Live]
1369164211.0,170,"Look deep into her eyes. Breathe slowly, in and out. Now you will rest for a bit and think about moe girls or boys, whatever you prefer. And after that, you'll liven up and feel fully refreshed. [Vocaloid]"
1367479504.0,173,"Fang, taiyaki, and cute Kyouko. What more could you ask for? [Madoka Magica]"
1364839694.0,175,"Spring is springing, moeblobs are moeing. [Ore no Imouto]"
1364517068.0,172,Charlotte IS Best Waiffu 
1364185712.0,172,Rika really is gunning for the Best Girl title.[Haganai NEXT]
1362079671.0,175,I wish augmented reality worked this well in real life [Robotic;Notes]
1361639544.0,175,Coffee would be nice... [Original]
1349883187.0,176,Dat evil look of hers makes me HNNNG [Clannad]
1367165660.0,172,This is Asuna [Sword Art Online]
1366113269.0,172,Bunny Azusa~
1364748858.0,175,"Congratulation on graduating, Yurippe [Angel Beats]"
1364471806.0,173,You can rest now~ [GJ-bu]
1357256403.0,173,Kanade + Chibi Kanades = HNNNNGGGGGGGG [Angel Beats]
1356694493.0,172,"Stand in line to trade places with Kirito, one at a time please! [Sword Art Online]"
1356453655.0,174,"Ricchan is best [K-On!], amirite?"
1355853034.0,174,Am I Popular Yet? (It's Not My Fault That I'm Not Popular) 
1355756891.0,173,Let it snow. [Madoka Magica]
1349210949.0,173,She's cute when she gets mad. [Ore no Imuoto]
1348936115.0,177,My bro insisted this wasn't too ecchi for r/awwnime. I think I've lost my ability to tell either way... [Toradora]
1347117762.0,172,21st cake day. Cheers everyone! [Spice &amp; Wolf]
1376597075.0,174,Smiling Shinobu is the best Shinobu [Bakemonogatari]
1375811222.0,174,Librarian [Kami nomi zo Shiru Sekai: Megami-hen]
1374945873.0,174,"Those outfits, omg uniforms be damned this is cute [Puella Magi Madoka Magica] I am a heretic :("
1373552879.0,171,Hand-sized Heroines [Album / Various]
1372655657.0,170,Ayase is sad she has to wait until August for the rest of the episodes. [OreImo]
1372155243.0,173,"I don't even know why I find this moe, I just know that I really, really do! [Original]"
1368909201.0,170,Smile a little bit
1368066900.0,173,I require moar Saori [OreImo]
1367718370.0,172,A Glass of Miku [Vocaloid]
1367694454.0,172,There's no way my little sister can be my girlfriend. [Oreimo]
1367528169.0,172,On a date with Biribiri [Toaru Kagaku no Railgun]
1367188413.0,170,Sisters [OreImo]
1365117080.0,172,She's laughing at your joke. Just what did you tell her? [Vocaloid]
1364245623.0,170,Rikka and Sanae.[Chuunibyou demo Koi ga Shitai!]
1363707258.0,168,"""You could just hand me the Pocky!"" ""But this way is what our fans want!"" [Yuru Yuri]"
1363605477.0,176,Pika miku. If pokemon wasn't good enough already
1357668914.0,171,"Valentine's Day might be over a month away, but this was too cute to wait. [TMoHS]"
1351143922.0,169,Swords can be cute too right? (Oringal)
1351027380.0,172,Holo at an Oktoberfest [Spice &amp; Wolf]
1350884126.0,172,holy shit nope [hatsune miku]
1346702710.0,175,Konata looks like a good chef. [Lucky Star]
1376436959.0,174,Meat! [Original]
1376084107.0,171,One happy family.. even if it was only for a short time [HenNeko]
1375804804.0,174,This wouldn't have happened if we had posted GirlDeMo more often. [Angel Beats]
1372967342.0,173,"""Are you ok?"" [Original]"
1372203069.0,173,Rikka's Confession [Chuunibyou]
1372178087.0,172,"""Do you like fiery redheads, shounen?"" [Haiyore! Nyaruko-san]"
1371068286.0,172,"""Here"" [Steins;Gate]"
1371014301.0,171,"""It's a showdown!"" [HenNeko]"
1367351685.0,174,Tsukiko-chan [HenNeko]
1365365239.0,172,Maybe if we keep posting Holo we'll get a third season [Spice and Wolf]
1363098408.0,175,So many [Kotoura-san]s...! The moe is blinding.
1361975373.0,172,Tsukasa tries cosplay. [Lucky Star]
1361535141.0,172,Even foxgirls have to go to school~ [Original]
1360866131.0,174,Happy forever alone day /r/awwnime [Code Geass]
1352580172.0,175,It seems the awwnime bracket has generated some butthurt. There's no need to denounce other fans people. Everyone has different taste. [TMOHS + Hatsune Miku]
1375384215.0,171,A harem of Madoka's is a good problem to have.[Puella Magi Madoka Magica]
1374533119.0,173,/a/'s best advice ever [ Ika Musume]
1374233894.0,170,Maid -Eru Chitanda-
1373704402.0,173,"Satisfies my love for [Vocaloid]s, nice soft shading and belly buttons."
1373135934.0,172,I'm ready for some Kuuko moe! [Haiyore! Nyaruko-san]
1371851515.0,170,"Even if the Far Eastern Magic Society disbands, at least the gang will have a backup, right? [Chuunibyou Demo Koi ga Shitai!]"
1370208625.0,173,Everyone's favorite otaku! [OreImo]
1369926305.0,170,Celestial chuu~ [Madoka★Magica]
1368717116.0,167,Waifu Thursday because I forgot yesterday! ; A ; [GJ bu]
1367891670.0,171,"""And the winners of the annual cosplay contest are..."" [OreImo x Vocaloid]"
1366566253.0,171,Azuny-attack!! [K-On]
1364785375.0,171,"My favorite character from the best anime, ever [Madoka Magica]"
1362960768.0,172,I hereby declare today Toradora day. Post some goddamn Toradora.
1358175402.0,171,[K-On! / Madoka Magica] cosplay in the other direction.
1353275584.0,170,Any love for Asuna? [Sword Art Online]
1352976909.0,169,"To atone for my repost, here goes more Rikka... for Science!! [Chuunibyou]"
1350724067.0,173,Fox in the forest [original]
1350314125.0,169,"Well, that didn't take long. [Madoka Magica]"
1376522261.0,171,"Apparently it's Kuroneko Time, but I don't think Ruri was ready. [Oreimo]"
1373741858.0,169,Sitting... alone... [WataMote]
1373166194.0,168,Apparently July 7th is also Gahara-san's birthday. I wonder what Araragi-kun got her. [-Monogatari Series]
1372656809.0,170,"""Stupid &lt;love interest&gt;! I-it's not like I'm &lt;doing something affectionate&gt; because I like you or anything!"" [Raildex]"
1371939311.0,171,Ayachi Birthday Moe [MM!] [K-On!] [OreImo]
1371291850.0,168,Skinship is best ship [K-On!]
1369865468.0,172,にゃん～ [Original]
1368125699.0,166,The ark of the covenant's contents couldn't do a better job in melting my face off than the moe within this picture [Haganai]
1365904145.0,172,Taiga Circulation [Toradora]
1365212543.0,168,Awwww.... [Chuunibyou]
1363199094.0,167,Eye contact [Haganai]
1361833689.0,169,Fuwafuwa [Original]
1358794013.0,167,Passion [K-On!]
1358614105.0,172,"Mandatory Moe Sakurasou Saturday, with a little bit of clumsy. [The pet girl of Sakurasou]"
1358070937.0,166,OreImo girls in Qipao[Ore no Imouto]
1357666332.0,169,"Chu~! [Yui &amp; Azusa, K-on!]"
1356308017.0,173,Relaxing with some video games (Original)
1356055475.0,167,"Rikka Takanyashi, anybody? [Chuunibyou]"
1355932272.0,171,Manami + long hair - glasses [OreImo]
1352990670.0,166,"Burn or no burn, don't forget to vote for her tomorrow [Katawa Shoujo]"
1349634932.0,169,Oh my.... (Yuru Yuri)
1346204276.0,171,Did someone say two-piece Tuesday? (K-ON!)
1335106712.0,168,Miku!
1376469742.0,168,"""You've got a little something on your cheek, I'll get it~ ^^"" [Madoka Magica]"
1374987337.0,171,"Azuki Azusa's name, on the other hand, rolls off the tongue [Henneko]"
1374946663.0,167,What? Me? [Original]
1373857049.0,170,So that's what our Shironeko is doing while she's waiting for the final episodes... understandable. [Oreimo]
1373576839.0,167,You know why I like you guys? [Yuru Yuri]
1372388036.0,168,Who is up for turning today's theme into a week long thing? I'm game. [Katawa Shoujo]
1371931489.0,167,"Goodbye, Onii-san. [OreImo Season 2]"
1371035863.0,167,I'll share it with you. [Madoka Magic]
1369278304.0,168,Nom! [Hentai Ouji to Warawanai Neko]
1368397415.0,169,Onward!!! [TMOHS]
1367767461.0,170,What is she up to and where is she?[Original I think!]
1367620147.0,167,This gif from Only_uses_Anime_gif warranted it's own post [Tamako Market]
1367512482.0,167,Just some magical girls [Mahou Shoujo Madoka★Magica]
1367328143.0,171,Lost in thought.. [Angel Beats]
1367266794.0,169,"I'm walkin' my own road, care to join me? [K-On!]"
1365884965.0,169,Kuroneko in a hat. [OreImo Season 2]
1363147781.0,171,Humanized Wooper (Pokemon)
1362859317.0,169,Moe Police. Were here to ask you a few questions!
1362834759.0,167,"The secret to looking good no matter who you are is a good smile. PRACTICE IN THE MIRROR, DAMN IT! [Vocaloid]"
1362366380.0,170,"I was thinking, ""We could use some more [original] up in here."" So I did it myself..."
1361740597.0,172,Kyou brought you some lunch. [Clannad]
1361440909.0,165,I went hunting for some Kyou. I found a lot. [Clannad]
1360770673.0,169,Hugs!!!!!!!!!!!!!!![TMoHS/LS]
1359831730.0,167,"""Don't tell anyone, ok?"" [Original]"
1358711146.0,164,I refuse. [Vocaloid]
1358697485.0,164,Chuunibyou? Check. Yuri? Check. Do I win?
1357993946.0,172,"Seconded, Rin for Caturday! [Vocaloid]"
1357419048.0,171,My favourite magical girl [Puella Magi Madoka Magica]
1353208555.0,165,"Glasses, braids, and [Madoka Magica]! Moe overload~"
1353103383.0,168,Chibi Neko Girls. 
1352040788.0,168,And I'm Home [Madoka Magica]
