created_utc,score,title
1356820018.0,10502,Text Me.
1359521244.0,8664,He lifts
1358463041.0,8254,u look sexy
1356443083.0,8102,"Found this boy on Facebook, I cringed so hard"
1360872423.0,8002,"Meet ""Ahmed Angel"" the king of cringe."
1359609287.0,7704,"I feel like an asshole posting this, but... This is her only tattoo... and it's her boyfriend's name."
1356373865.0,6952,Oh goodness I have a mix of cringe and rage because of this
1357520121.0,6929,"Can we report this guy on youtube, please? [not cringe, but important]"
1358645236.0,6851,Friend calls a guy out for faking relationship
1362714144.0,6730,A Beautiful Transformation
1359564981.0,6634,what an awesome girlfriend! oh wait...
1359099767.0,6521,"""Omg what if i went to the school dance dressed as batman. Wouldnt that be epic lolz?"""
1361309758.0,6256,I am ready for a girlfriend
1362158719.0,5989,By far the best OkCupid picture 
1360710474.0,5739,"""what's up"" in Arabic..."
1358942197.0,5660,"Mary-Kate Olsen with her 42 year old French boyfriend, Olivier Sarkozy..."
1357089583.0,5638,"""Yes, I added you because you're a female gamer, 'tis an awesome thing to see!"""
1358722036.0,5519,This kid. Don't be this kid.
1359222462.0,5487,You probably have a big crush on me!
1356912292.0,5425,Got a problem? SOLVE IT.©
1359984486.0,5410,Taking the need for attention a little too far
1357675800.0,5364,Suddenly Fedora....
1355707595.0,5348,Guy posing with a can of rockstar for a selfie 
1358179436.0,5061,Girl posts pic of herself crying to facebook.
1357360699.0,4999,*trolling*
1353378477.0,4997,Kid uses thesaurus to try and sound intelligent.
1362599417.0,4974,The most private thing you are willing to admit
1360367201.0,4929,"My boyfriend has never really used the Internet before so he doesn't really understand what really goes on. This is his attempt at a meme, later recalling it as ""hysterical"" and ""I'm surprised you didn't laugh. "
1365463128.0,4919,"I love this subreddit, but seriously guys..."
1362345168.0,4902,love is in the air &lt;3
1361766991.0,4901,Kid thinks he can advertise on 4Chan by pretending to be people subscribing to his YouTube channel. 
1361484887.0,4848,Twisted fucking psychopath
1365453646.0,4788,"Somehow, they all manage manage to get left hanging (x-post from r/Hockey)"
1359322177.0,4767,The irony
1362066076.0,4764,"She pastes her ""best face"" into other pictures"
1355666649.0,4708,A 9gag post with more than 46k likes called 'Shit 9Gaggers say'
1362089441.0,4670,Found this cringe-ridden 'Urban Fashion' amateur photoshoot album on facebook. 
1361142384.0,4660,Kid posts to what he thinks is an anonymous confessions page.
1363043476.0,4665,My high school sweetheart posted her new tattoo to FB. Guess I dodged a bullet...
1361104202.0,4537,She had surgery after a bad accident
1362110530.0,4533,"An obvious fake text with over 10,000 likes on Facebook"
1360933372.0,4516,Congratulations! [FB]
1361731639.0,4490,Ryan Seacrest trying to high five a blind guy. 
1363644261.0,4419,He's trying to pick up girls on a memorial page for a girl who passed away in my hometown.
1360530347.0,4415,I LOVED YOU! &lt;/3
1363026029.0,4400,twerked her pad off.
1358473933.0,4401,"Girl will have sex with a virgin if he gets 1m ""likes"""
1364220457.0,4395,"[X-Post from creepyPMs] Guy follows up on my opinion of his ""accidentally sent"" nude photo."
1361404012.0,4240,"Britney Spears has a dog, Hannah, who also happens to have a Twitter account"
1358599916.0,4205,A friend found this on a dating site
1360008576.0,4093,Overly attached boyfriend
1362528675.0,4094,"This guy collects unemployment, has two kids with two women, and is on food stamps. "
1371350596.0,3996,Girl sends herself an ask intending to be anonymous
1361440214.0,3943,"I seen my pic a few times on reddit, just thought I would stop by and say hi."
1361481785.0,3933,Sex motorcycle
1356762153.0,3901,"Sprite, I swear to god..."
1357921137.0,3873,My guy friend found out I am a redditor. (xpost from /r/funny) 
1361942051.0,3808,"It was supposed to say Ana, butt..."
1362941840.0,3785,Genealogy Cringe
1362751972.0,3744,"Old classmate... Modeling is her ""working progress."""
1362422465.0,3737,Guy unknowingly gets frisky with transexual at a club. Cringeface in 4th pic.  
1362946726.0,3684,Girl on my facebook got a new tattoo!........
1359825583.0,3637,cm back
1361199303.0,3631,cringeworthy photo shoot
1361371516.0,3622,Stepping up the cringe. 
1358346338.0,3608,I made this t-shirt 1 year and half ago and I realize now that is the most cringe-worth thing that I've ever done
1373825410.0,3580,"He tried to translate his last name to Russian using google translate.. instead of ""Botrokoff"" it says ""no translation""..."
1363848450.0,3564,"My hometown tattoo shop does the absolute worst tattoos you'll ever see. I'm talking ""how could someone pay for something this awful?"" bad. To prove it, here's an album of 50+ of the worst of the worst pulled from their facebook albums. Prepare to be amazed:"
1355741999.0,3564,Kid hits on girl via Facebook
1359344279.0,3513,Your intellectual superior
1361709277.0,3470,"A guy in his mid 20s messages me regularly, this was his latest attempt at chatting me up."
1371421682.0,3472,"Pinterest cringe: those aren't names, they're nonsense syllables."
1362877332.0,3461,"yea it has meaning, but thanks"
1361911796.0,3416,The scariest/cringiest 4-panel I've seen thus far.
1370635585.0,3369,"As a concert vender, I'm embarrassed that I make money from this."
1364941591.0,3363,"memes arent this thing you can just fucking learn over nite you idiot, ive been making them since like 2011"
1367351563.0,3353,Someone rape me
1371729964.0,3338,Thank god she jumped straight to judgmental mode.
1367692587.0,3317,OP Makes Sure People Know He's Cool
1361821129.0,3318,Everyday this happens
1360863083.0,3313,The white background was particularly thoughtful... (X-Post from r/facepalm)
1365954484.0,3304,"Grandma: the mother of your mom, your second mom, a teacher, the best cooker, and a person you can call as a friend. ❤"
1373217145.0,3291,Spoiled 24-year-old neckbeard goes ballistic on Facebook because he got an iPhone 5 for his birthday.
1362666552.0,3297,Hilariously fake text conversation that came up on my facebook. It's like people don't even try to make these believable anymore.
1363782424.0,3289,Wingman level: Dad
1363375164.0,3226,Just laying down and having a nap with Justin
1366598863.0,3224,"When no one acknowledges my coworker's status updates, he blames others for hacking his account"
1360454563.0,3221,Girl walks into Gamestop
1373408062.0,3207,How to buzzkill an engagement
1360335485.0,3204,Totally NOT shopped
1365426844.0,3193,"I went out out on one date with a man I met on match.com At the end of date, he told me he loved me and he broke down in tears when I told him it wasn't going to work out. Later that night, he sent me a facebook message. I didn't reply. Months later..."
1369374048.0,3176,Selfie guy on the train.
1357398074.0,3172,Morgan lost her wallet.
1369765144.0,3170,Quantum mechanics
1362093229.0,3162,Well kids... It was a briefly popular song when I was young.
1362575666.0,3153,I don't want you to suck my dick 
1358778335.0,3149,"My friend is a waitress at a club, this guy handed her ""his card"" "
1359422471.0,3130,The le mobile.
1361612319.0,3110,YouTube comments cringe
1357778241.0,3088,Enjoy an entire album of 4-panel cringe!
1367793357.0,3066,ilerminaty
1366497514.0,3049,That's his real hair.
1362022092.0,3031,"Justin Bieber, the ultimate cringe "
1370006919.0,3023,"A very elitist adviceanimals moderator and ""memer"""
1355851437.0,3008,White Knighting
1364311929.0,2999,Only nerds will get this! XD
1375453922.0,2989,"DJ Khaled makes up story about how his newest single shut down iTunes servers, and how he gave Apple permission to use stronger servers."
1370895947.0,2996,"Sexy fedora, great glasses and perfect shirt"
1364001991.0,2988,So awkward
1363311068.0,2986,His grape juice and fedora complete the moment.
1359472179.0,2968,No one's smart enough for this guy
1364999313.0,2969,"After a long delay, My friend's profile picture after having previously announced it's event."
1364217439.0,2965,I'll just censor this huge penis of mine... [NSFW]
1368750992.0,2944,I don't... just... why?
1373999500.0,2932,Lyft driver asks a girl out. It doesn't go so well.
1364273760.0,2924,This can't be real...
1368410443.0,2920,I think he might be reading into it a bit much
1364508070.0,2903,Self cringe: me back when i was a little raver. Just hideous
1366152816.0,2902,"""Yup, that's the one! Hold that pose, bro!"""
1360616057.0,2902,"Guyliner, fedora, and a little quip on the pope."
1369673850.0,2891,Not Single
1360034943.0,2885,My girlfriend that attends another school befriended a guy at a party. This was their conversation
1370625112.0,2881,Wow.. Found a real life 'bae caught me slippin..'
1362528191.0,2885,This is my high school English teacher...
1362497316.0,2877,he does this in every picture..
1359193750.0,2875,"""oh ok how like how do you get busy."""
1375123892.0,2875,Perfect time for a selfie.
1364577866.0,2874,I surfed so hard I ended up cringing over 90s celebs
1365783825.0,2871,No lie.
1366670497.0,2874,"""I'm scared to dress up now :'("""
1365863371.0,2864,I'm telling your father about this.
1369713571.0,2854,"My dad left when I was 2, he thinks he's 20.."
1371673261.0,2848,A redditor tries to pick up a recently dumped girl over the internet
1362611495.0,2824,She said no
1363222320.0,2811,How low can you go for likes?
1362685288.0,2809,"Redditor claims Zach Braff tried to dine and dash at a restaurant his sister worked at. Zach Braff shows up, verbally bitch slaps him, and said Redditor backpedals furiously as the downvotes pour in."
1374547231.0,2806,"This guy stalked me for the better part of high school, then posted my number all over 4Chan when I didn't want to date him. Enjoy."
1368461102.0,2812,Flashback cringe
1368202412.0,2800,"Self cringe: the stupidest shirt I own. They don't zip-off, they just... zip."
1362844022.0,2797,"Guy fills ziploc bag with parsley, pretends it's weed, and posts it to facebook. And yes, he got called out."
1370303205.0,2790,The fedora troupe strikes again.
1376150396.0,2783,This is why I'm fucking done trying to meet women online
1373137392.0,2787,Textbook romance?
1370353364.0,2777,We've all been there. right? Right??
1365346869.0,2780,hey asshole remember me? well in less than 24 hours im losing my virginity so suck it
1359914112.0,2785,I bet he thought she was just really wet.
1366829174.0,2772,31 year old coworker gets my # tries to flirt...i'm 19.- x-post from creepypms
1367718975.0,2776,I'M FROM OHIO BITCH
1375061000.0,2770,I thought you might enjoy this
1376415598.0,2759,Runner tries to defend a clearly bullshit claim
1370718752.0,2755,So this guy I know likes to stage facebook statuses to get likes and he recently got called out on it
1367109531.0,2753,Too many hashtags for a funeral
1375898173.0,2752,I organize protests and a man asked on a page I run to be updated on our next protest. I sent him a friend request. His wife was NOT happy
1363131331.0,2726,Guy takes Animorphing to the extreme.
1375093993.0,2727,Best suck ever bbe
1369103536.0,2729,I sure hope he's okay
1368003652.0,2727,People DID say he was going to regret his MDMA tattoo...
1362418386.0,2723,Twice the panels twice the cringe...
1370714981.0,2714,Oh :( well then RIP Nemo
1371173862.0,2710,Cringey Couples Ring set [Etsy]
1371912649.0,2702,A guy at my work drives this. He was born in '95.
1376169186.0,2703,"Girl on my Facebook bragging about being ""famous"" on Reddit."
1373155506.0,2704,"Suit wearin', fedora-lovin' brony posted this on facebook."
1374851720.0,2702,A matter of reflection...
1375934250.0,2696,He won a poetry contest back in the 6th grade. From then on his ego grew.
1372017549.0,2687,Sooo my aunt got a new boyfriend yesterday....
1376064557.0,2689,This girl always brags how much she works
1365079466.0,2685,LACOSTE.
1363652154.0,2686,Cringepics in a nutshell
1374343871.0,2683,"""And no, it's not dirty if you think thats what I mean, you perv."""
1366206440.0,2674,Chains of fate.
1359142295.0,2676,Friend-zone Level Maximum
1358804519.0,2676,"Us gamers, rite? XD"
1375337606.0,2664,Dont ever question the love i have for MY CHILD!
1364064213.0,2650,Self Cringe.  My senior picture.
1363271376.0,2648,Guy uploads picture of wet spot on his bed sheet to Facebook to tell everyone how he made a girl squirt.
1375134262.0,2643,I think you got it wrong..
1372539138.0,2639,He's looking at his phone the entire time
1364241023.0,2628,Young redditor trying too hard.
1360888986.0,2632,Guy lacking social skills tries his luck on facebook
1373999164.0,2625,When I grew up I put away childish things away
1374106932.0,2618,He's my millionaire boo boo
1361997691.0,2612,"Taking ""Daddy's Girl"" too far..."
1376444467.0,2611,"""A message from the moderators of r/TrueCringe"""
1365792307.0,2611,Reminder: You can find cringe pics anywhere on the Internet... even in comments on /r/cringepics
1361193752.0,2616,"My friend got a tattoo of ""I love you"" in her grandmother's handwriting. (x-post r/funny)"
1369625855.0,2606,Someone who I once went to school with posted this to twitter. No words.
1374625814.0,2602,#LEGIT
1374463116.0,2601,Kid attempts to put his family down on Facebook for not attending his play because they were too busy welcoming his sister's child into the world...
1358366005.0,2589,Top 1% of Reddit.
1371573692.0,2586,Look out ladies
1372437531.0,2587,This guy.
1370374380.0,2585,OK Cupid profile
1365526197.0,2584,Incredibly awful and cringeworthy tattoo on a young mothers back of her newborn baby....
1360731206.0,2586,Looks more than it really is...
1367547958.0,2582,So this guy just sent me a friend request on MeetMe.
1374952794.0,2578,"Twitter pornstar stalker. 90,000 tweets, 24/7, all to porn stars."
1370966997.0,2573,"M'lady, may I kiss your hand?"
1365283878.0,2563,"Fedora-wearing Redditor ""trolls"" Rick Santorum by getting him to sign an ""atheist symbol"""
1368057538.0,2558,"""...shirt has been getting me some weird looks."""
1368631162.0,2547,This guy was trying to sell his porno on Facebook....
1364332314.0,2554,"Self-cringe. Just logged into my old Myspace and found these in an album labeled ""Emo Night""."
1374630733.0,2551,"Guy faps into his friend's sister's panties, tries to get out of it."
1361542764.0,2550,Dat Hover Hand *thumbs only edition*
1362323293.0,2539,She's constantly trying to prove this girl is pretty in hopes of getting compliments herself. 
1361526801.0,2541,#Class
1363997431.0,2534,Apparently he doesn't Photoshop any of his pics. I see no reason to not believe him!
1374447715.0,2535,Dude gets a company's logo tattooed on his head for $125
1368012129.0,2526,Not arrogant... just superior...
1366926212.0,2527,Justin Bieber in a designer ski mask and fedora next to a bodyguard in a dual-zipper onesie.
1371983531.0,2529,"So this guy on my FB newsfeed is trying to turn himself into a meme. Ladies and gentlemen of r/cringepics , meet Moe."
1372081969.0,2523,Adventures in OkCupid
1367003959.0,2524,I don't know what to put as a title
1365381023.0,2516,Awkward Mormon missionary hoverhand
1370573734.0,2511,The internet tour guide
1370194457.0,2517,I think he needs more tags.
1366902510.0,2513,The horror! (x/post from ProtectAndServe)
1363743842.0,2518,"""The Friendzone"" clothing line."
1365910724.0,2518,-Tilts head- Sometimes the most cringe comes from the simplest comments.
1372336313.0,2515,Just do it.
1369626808.0,2513,Some girl posted this (The one in orange is her sister)
1368981979.0,2511,;_; She tried to be sexy...
1370133800.0,2509,"They call themselves the ""fedora troupe"""
1367255068.0,2504,Inner Beauty
1366285380.0,2509,Hawaii yay
1360340868.0,2503,Fedora privilege.
1375648205.0,2503,"User in /r/teenagers believes he's ""scored"" at a strip club."
1375147287.0,2504,"Open mouth, insert foot."
1375283681.0,2502,Dude asks a girl out publicly on her latest Facebook photo.
1361752289.0,2493,"My own cringe pic...my ""Christian Rock Band"" from 2001."
1364580605.0,2484,Everything about this made me cringe. Those aren't even capital cities.
1359834396.0,2486,Stop it applejack!!
1366637959.0,2484,Cruising in the Benz.......
1374016692.0,2478,"For years, my cousin has claimed to be friends with Lindsay Lohan. He sent this to me as ""proof."""
1362969062.0,2485,Are you sure you don't want to model?
1373381866.0,2478,2edgy4me
1370449527.0,2481,this girl has about 5 of these around town
1367470033.0,2475,"""Troll"" is so proud of being a douche to Dunkin Donuts employee"
1368558733.0,2467,She will do anything for the art #hardcore
1355960734.0,2464,IM SORRY THAT I CARED
1366404583.0,2463,"New rule: shitty facebook/instagram memes (like 4-panels, for example) are no longer allowed."
1369327998.0,2457,"""Grasps a long tube float"". They are in their mid 20's."
1365446474.0,2458,This guy.. seriously..
1365768103.0,2450,100% enemy
1369166674.0,2451,I give you.. Juggalos of OKCupid!
1362939419.0,2449,This picture makes me really uncomfortable.
1359748392.0,2441,"Don't worry, hacktivists, like myself are on it."
1372291695.0,2436,Found this interesting guy spamming pornstars on Twitter
1369900055.0,2434,Redditor aggressively uses his IQ score in an attempt to win an Internet argument
1373934486.0,2437,That's just how pimps operate....
1366038447.0,2434,remove yor panty
1370282386.0,2428,She tagged herself in this
1373722022.0,2438,"quick, take a picture of me reading my book in a bar..."
1367112361.0,2426,Don't take my picture! (x-post from r/funny)
1367442753.0,2427,I'M SO DEEP
1375404652.0,2414,Redditor tries his luck [Semi-NSFW]
1369789132.0,2417,"""Hey are you ok?"" ""No"" ""What's wrong?"" ""what's right"""
1372067105.0,2415,"No, you'll NEVER regret that choice in life. Ever."
1375916535.0,2417,a+ makeover would recommend
1373285184.0,2416,A feminist I see.
1374689882.0,2413,This classy lady got her welfare card tattooed on her forearm.
1372773483.0,2412,"""Friend"" posts photo of his latest heroin pickup."
1363304154.0,2408,Guy posts a picture of a tattoo he gave himself that looks like a turd.
1363015034.0,2406,Found this on my news feed. Why.
1366813865.0,2400,"guy types ""lol"" 64 times in one convo asking a girl out on facebook"
1363345841.0,2397,"Saw this on r/f7u12, never cringed so hard."
1362304135.0,2406,The Empire State Building
1366563598.0,2396,Just a little rapey
1364056892.0,2394,This guy loves posting memes about himself
1375981652.0,2391,Cute when she wants to be
1363122535.0,2382,Bravery levels are off the charts with this one.
1374443262.0,2384,"And here we go, my facebook delivered (and was soon deleted)"
1371853809.0,2382,A 90s kid describes a 100% TRUE story about an oppressive cashier who tries to force her to buy One Direction CDs. [x-post from /r/ThatHappened]
1365336994.0,2379,Wow you're a hottie.
1360883287.0,2382,Straight as an arrow
1374509805.0,2377,"Man, what a sparkling personality for a dating profile!"
1361219785.0,2377,Too bomb!!
1369234130.0,2371,"I have been sitting on this cringe mine for a while, unsure of whether or not to post his pictures. Then this baby showed up and I knew it was time."
1372256050.0,2369,This just got posed to our secret group on facebook minutes after it happened.
1359947475.0,2373,Pipe of atheism
1375722347.0,2369,First post... I found this picture on my computer. I made it in 2008. I have never been more ashamed of myself.
1370509752.0,2365,"[Self-cringe] When I was nine, my friend and I made a band. 13 years later, I found my ""lyrics book""."
1366727389.0,2366,Karen; a delusional women's journey on Facebook
1369167067.0,2361,D'you think he lit the cigar with the twenty?
1371466281.0,2359,What is your name m'lady?
1371121331.0,2350,"Me n Mah New Leggings, that ""photoshop"""
1361985852.0,2350,Former US VP candidate Paul Ryan's workout photos.
1373621038.0,2351,Est. 1995
1374831640.0,2346,"""Alpha"" asshole takes a girl's phone without asking to deactivate her facebook, and then feels acomplished."
1365193187.0,2350,Gonewild comment cringe. He even included a picture of himself.
1376265838.0,2349,It felt so good to finally catch this guy. He has been stealing my friends statuses for weeks.
1365613178.0,2347,Aspiring tattoo artist cringe
1358276379.0,2343,A female byu student was handed this note by a male classmate last year..
1364487826.0,2342,He calls himself The Plague...
1374370934.0,2344,Congratulate me guys ! Lol
1371017525.0,2340,"""New necklace c: #pentagram"""
1371491943.0,2342,how my child name is to b pronouns!!!!
1361489394.0,2343,Justin Bieber fans are fucking terrifying.
1372359205.0,2338,Friends weight loss post was misinterpreted.
1375810726.0,2328,Why would I want someone that's going to cheat on me x-post from r/unexpected
1372208056.0,2336,Le epic subway troll :)
1375923851.0,2328,"""Who the hell parks next to a Mercedes like this???? Leave your shitbox away from me buddy!!!!!!"""
1367974864.0,2329,"So my girlfriend's male roommate who jokingly calls my girlfriend ""mommy"" that I posted about here yesterday engaged me in a FaceBook conversation."
1365261369.0,2328,I'm linux- virus free. From a facebook friend. And yes he actually put his number on the shirt.
1367846185.0,2322,"She constantly shares cringey ""motivational"" posts on facebook and today she posts this."
1366243537.0,2328,Put a condom in your ear
1374055848.0,2323,Why won't anyone be his girlfriend?
1367897226.0,2324,#Pleasure
1363957998.0,2318,And he never deleted it.
1376478845.0,2319,"Was browsing r/new and found a poorly done meme. This was in the comments, from OP."
1365374308.0,2314,&lt;3 &lt;3 &lt;3
1376002059.0,2317,r/AdviceAnimals has been posting some of the most ridiculously fake stories.
1373940253.0,2315,So this happened to me last weekend...
1374610468.0,2311,Amanda Bynes is so deep...
1370345003.0,2315,Yes... Yes it is...
1371049854.0,2305,His friends don't understand what real music sounds like.
1376401583.0,2306,"""Gangster"" from my home town."
1376178348.0,2306,"Yeah, this totaly happand."
1373320820.0,2302,"Parents, (le)terally worst than the holocaust"
1372960154.0,2300,She had the balls to put this on Facebook
1363445015.0,2297,"Guy says his girlfriend is pregnant. 3 days later he post a picture of his new born ""baby"". And yes he is being completely serious. "
1373845488.0,2294,I dont even...
1369461851.0,2290,"""I do some freelance modeling on the side."""
1367336086.0,2285,Once you go black ..
1373150032.0,2282,Someone tried to post this on r/funny
1376203273.0,2278,(Xpost r/facepalm) I've never seen someone delete a comment of mine so fast before.
1360877885.0,2279,Friend Zone Level: Dumbass
1370713663.0,2282,"""Cool story hoe"""
1369943486.0,2278,This guy just posted this picture on his Facebook
1365873739.0,2277,Downvote someones true heart
1359300895.0,2277,badman
1370565839.0,2272,This is getting out of hand
1363694001.0,2272,'Indie' cringe on Bon Iver video. 236 thumbs
1370727948.0,2270,Found this on the new page of /r/adviceanimals...
1364155990.0,2267,"Someone makes an obviously fake ""test,"" filled with grammatical errors and questions no teacher would ever ask. Fills in ""humorous"" answers, posts it as if it were an actual test that he came up with humorous answers for."
1376264822.0,2265,Attention-seeking FB post goes from bad to worse
1368699162.0,2265,...They've been broken up for quite awhile.
1374287897.0,2262,"""&lt;3 To early to be pregnant"""
1375833307.0,2255,I am so bothered every time I look at this picture. The cringe is unbearable.
1357564666.0,2252,"18 year old kid has birthday party, hires stripper. (the person sitting at the back is his grandmother)"
1371822670.0,2246,"The ""Icy Hot Stuntaz"""
1374629021.0,2253,Asshats at the US Open of Surfing in Huntington Beach
1367327421.0,2252,I can't taint the royal bloodline...
1365264054.0,2247,He's F*%&amp;ing your honor student.
1356364709.0,2251,I wonder how he will feel about this in 10 years.
1372252370.0,2250,"""GUY DISCUSSION! Do you have that odd feeling every so often that our girls are going gay on us?"""
1365119663.0,2242,"Please, don't ever do this."
1371896836.0,2240,Stumbled upon this extremely pathetic guy's comment on fb.
1370063945.0,2243,"The nazi-obsessed, brony loving cringemaster..."
1369558743.0,2245,Ray William Johnson keeps trying
1357111258.0,2244,"I present to you my 7th grade punk rock band ""Shoes Come Untied."" "
1367439992.0,2239,He made his own meme. The cringe is real.
1373037503.0,2235,Apparently she is the queen of Reddit
1369684187.0,2233,Deep words
1367182465.0,2236,[Self-Cringe]: I thought I was so cool walking around my college campus with a trollface on my book bag...
1375579348.0,2236,Facebook guy thinks a status is an invitation. Cringe ensues.
1374670121.0,2236,wow good to know
1376132262.0,2231,Babe hide behind me and push my hips up so I get dat nice figure but careful not to get seen..
1375208057.0,2232,I think I'll ignore this friend request. Sorry about that.
1364094290.0,2235,The Scent of a Real Man
1375742215.0,2230,Guy on Facebook Can't Recognize Blatant Satire
1369237949.0,2223,Blue guy just had to do a kawaii pose.
1374969678.0,2225,A girl that I am mentoring that I sent a friend request to....
1372639446.0,2223,This just grosses me out. So wrong..
1373330616.0,2221,This couple makes these awful comics of each other all the time. They've been going out for a few weeks.
1370922640.0,2216,High school boyfriend.. What was I thinking??
1365227433.0,2220,She is certain she just met a celebrity.
1376443659.0,2218,HEAD PORNSTAR
1374754995.0,2217,"So my nephew calls himself ""Midnight Pain"""
1376525033.0,2220,*eats cookie and purrs softly*
1371261382.0,2216,Instagram... She stood there for a good two mins trying to find the best lighting
1359016706.0,2215,This appeared on my Facebook feed.
