created_utc,score,title
1375560513.0,1781,This guy is 22.
1373925016.0,1782,"""Why are yu on every status checkin?"""
1368992153.0,1780,Birthday wall request (X-post from /r/teenagers)
1371825706.0,1783,Crappy Big Bang Theory t-shirt...
1371505089.0,1781,Apparently the U.K flag now means One Direction...
1359744164.0,1781,Aaron Carter is extremely sexual right now.
1372631691.0,1786,Brother's a 'Juggalo' Here's his christmas card to us.
1370455820.0,1782,Anyone seen some hookers?
1372367485.0,1783,Dammit Grandma!
1370701706.0,1779,Oh.. Ex just sent me this..
1376320137.0,1777,"Some guy messaged me asking for ""friendship"" - Cringe overload."
1374928997.0,1775,I can't believe someone took time out of their day to make this.
1371193357.0,1776,Redditor gets caught lying about the origins of reposted content. Lies some more.
1365365209.0,1776,IT'S CUZ WE'RE /B/ALLERS TROLLOLOLOLOL
1370720816.0,1780,Yikes. What happened to Deryck Whibley from Sum41?
1373830921.0,1770,Some GW cringe...
1366423783.0,1776,The fear in her eyes...
1373357780.0,1767,"Got this creepy PM/Picture combo from an Indian man. Didn't edit it, this is what he sent."
1374331149.0,1772,as seen on /r/fffffffuuuuuuuuuuuu
1370615179.0,1768,Animey and mango
1372865077.0,1766,Drugs? Me?
1374504276.0,1766,Saw this album on r/funny
1373651646.0,1766,"Yep, just like cum"
1359686831.0,1765,"""Debate""-hungry high schoolers have no idea what they're talking about"
1373848230.0,1768,"Holy Mother of Hover Hands, Batman!"
1358118093.0,1766,"""r/cringe army"" -_-"
1374588180.0,1766,Some guy from /r/adviceanimals trying to make himself a meme
1362857032.0,1765,When I think of you
1373030426.0,1759,okcupid juggalettes
1375450970.0,1756,"Lebron James with the ""blank face thinking"" selfie."
1375145610.0,1765,you're not a model just because someone takes your picture
1372353272.0,1756,"As a gay man, even I cringed at this."
1370088250.0,1766,Senior quote... really?
1361401693.0,1765,So brave
1375607113.0,1757,"They flaunted this on facebook. ""He's soooo sweeet! &lt;333333333"""
1364764349.0,1763,girl at /r/adviceanimals is trying to make herself into a meme
1362519547.0,1759,Some middle school cringe. I thought I looked like a young white Biggie &amp; went by the name 3pac
1376391436.0,1762,The dangers of linking your Facebook and SoundCloud accounts
1360193740.0,1755,Cringe in /r/cringepics
1375872749.0,1762,Australian Federal Opposition Leader Tony Abbot kissing a complete stranger
1373657498.0,1755,My nephew just made me cringe so bad...
1360875844.0,1760,One of my Facebook friends has this as his cover photo.
1360691858.0,1753,Fluttershy gives advice on how to talk to girls (x-post /r/bronyhate)
1372335699.0,1756,Guy tells girls at McDonald's where the real nice guys are (x-post from /r/thatHappened)
1366899846.0,1752,"This .gif recently hit the top of /r/funny. ""I AM CAPTAIN REDDIT""."
1374992601.0,1753,Jumping the gun... (Re-posting because I forgot to block out a name)
1369885336.0,1751,[Self Cringe] Me when I first discovered Photoshop.
1369616819.0,1751,"Found on OkCupid, wonder if she gets many dates"
1360614928.0,1752,"My facebook friend can sure ""overclock"" his body"
1373369138.0,1750,"Accepted a brand new co-worker on Facebook. He spent his first day at work complaining about how desperate he is for a girlfriend, ANY girlfriend. I already felt awkward around him but now.."
1362444049.0,1751,Guy has his girlfriend pose with his Honda Integra.
1375735003.0,1749,The heroes the internet needs...
1369669299.0,1751,"Saw this on r/trees... ""No longer will I hide my culture, this is me"""
1364231353.0,1749,"A friend of a friend.  I call this piece of work ""Paraplegic Jesus."""
1374801317.0,1747,Just chillin'
1363189003.0,1746,Deal With Itt
1368282598.0,1739,"""crying so hard that it impairs your driving"""
1376178480.0,1739,A redditor on /adviceanimals is full of pretentious cringe
1365437926.0,1743,Thug lyf
1361664361.0,1742,It doesn't even make sense
1366400156.0,1747,Creepy guys tries to seduce girl with Frank Sinatra.
1374644915.0,1743,This here is the pure stupidity of my classmate...
1363899690.0,1739,He's always talking about how he gets all the bitches. You can probably see why.
1372936774.0,1740,He was HOPING someone would try something.
1362389475.0,1741,Biggest Douchebag of India:Billionaire Yash Birla
1369079488.0,1740,"OP posts joke about people getting laid, user overreacts claiming OP is the one not getting laid, OP defends himself in very cringeworthy manner."
1369506446.0,1740,"A Redditor's beautiful ""Oh God why??"" story."
1366116358.0,1738,A tool you can talk to...?
1361472375.0,1738,Sure it was an accident?
1375812281.0,1739,This shit has 600+ upvotes in r/funny
1370401718.0,1736,Woke up one morning to this delight on my FB newsfeed.
1366853015.0,1737,Am I cool yet guys?
1361379151.0,1738,We still on for this weekend? Saw in /r/creepyPMs and cringed hard.
1371262161.0,1729,Dont mnd the dog...
1369822788.0,1735,Someone save me from this never ending nightmare &lt;3
1376570367.0,1731,Just two cousins having a fight on Facebook
1372666544.0,1735,I don't even..
1376327690.0,1733,"""Metal fan #1 xDD"""
1374629859.0,1735,Debt collector gets his comeuppance
1362586372.0,1729,"This guy at my college is obsessed with the Titanic, made it into a female anime character and photoshops himself standing next to ""her""."
1372034187.0,1730,Redditor wants others to stand in awe of his 20k comment karma
1375750222.0,1730,His awkward moment is better than yours... (x-post from /r/facepalm)
1369149645.0,1728,"""So this guy was doing his essay, 600 words, 4 hours. I must say, he did it like a sir."" [x-post r/funny]"
1363388147.0,1726,What the fuck is wrong with f7u12 new?
1375641269.0,1733,Taste the Rainbow
1363604118.0,1721,"You see guys, sex is like butter"
1364917137.0,1726,Had me Cringing all the way to work.
1375497294.0,1721,this shouldn't be a thing.
1372786944.0,1721,"Redditors ""story"" seems like some sort of fedora wearing, neck beards fantasy land."
1373664612.0,1729,This guys asks every other day if anybody wants to hang out. Today someone finally responded.
1370220931.0,1720,Feminist can't explain herself after she tries to make a rather irrational point.
1368198944.0,1722,"Even in that particular subreddit, this was too cringy"
1373472988.0,1719,"Found on r/thathappened , I'm sure it happened."
1365687099.0,1721,Sexist monocle wearing furry.
1374821091.0,1720,Very few things make me actually cringe. I present to you... a meme-themed drink shop that just opened in my city.
1366315674.0,1718,"""Made my own meme.."""
1365028137.0,1717,Kid doesn't know answer to question on test so he draws the Reddit alien and plugs a subreddit.
1371303162.0,1722,On the front page of reddit's next top cringiest subreddit..... /r/aaaaaatheismmmmmmmmmm
1370388950.0,1716,Are you kidding me?
1363707838.0,1712,"People trying to be their own meme....he calls this one ""Manly Metalhead"""
1363035469.0,1715,Please don't become a trend.
1361140415.0,1716,le epic trolls
1374264640.0,1708,So apparently MyAnimeList is a goldmine of cringe
1366297039.0,1716,He's suffered long enough...
1361465478.0,1709,I cringed so hard. Wedding pictures of a facebook buddy
1375028397.0,1708,Redditor cannot conceivably learn anything more from school he is so smart.
1375711724.0,1708,Haters gonna hate.
1374181532.0,1712,Seems legit
1370796606.0,1709,Big Bang Theory fan reacts to poor review.
1367632552.0,1706,So my friend got a new tattoo (x-post r/pics)
1367955152.0,1712,This guys life is so amazing he feels the need to charge his FB friends to view his profile.
1370869411.0,1710,Gloating over 4 karma ...
1368214613.0,1698,Making it rain on nana.
1364480878.0,1704,"Nice guy, right?"
1356887827.0,1699,Guy tries to impress girl by talking about her laptop and random technical jargon.
1366294662.0,1703,Another person trying to become a meme from r/funny
1371342801.0,1700,"Found something cringeworthy on Facebook a while ago, then I found this subreddit."
1364850775.0,1700,nothin mainstream :p
1369314295.0,1700,"I'm ugly, like please??"
1362947518.0,1698,That's a nice car man...
1373353347.0,1701,u want 2 c a real thug?
1371415900.0,1702,"Sure, THAT'S why you're single."
1374947073.0,1694,"No really guys, it's real this time. Really."
1368825002.0,1694,How the hell does he get his hair to do that?
1358702302.0,1697,"Are rage comics allowed here? Well, regardless, I cringed pretty hard."
1366725835.0,1694,"Torn, you did this..."
1366832589.0,1687,Guy who I went to high school with goes to top party school in the nation. Makes memes of himself like this to remind people he's too cool to party.
1375716926.0,1689,Homemade memes never work
1360547033.0,1688,Congratulations for being born a certain way that you had no control over..
1375799096.0,1689,this girl on my FB is always posting pics of herself. Now she started making motivational memes about figure skating...featuring herself.
1371257659.0,1689,"He calls himself ""Intelligentleman"""
1365100092.0,1690,Every single one of his FB pics are along these lines
1369161904.0,1690,Such a nurd
1370599154.0,1687,The Holy Grail of all Hoverhands
1371596707.0,1687,"He almost broke his finger driving today, guys."
1374759690.0,1685,"Found on Facebook. ""Dyed my hair. Love it!"""
1369680664.0,1683,We to real for dhiss shit...
1361825165.0,1677,Sexy eyes
1374455390.0,1683,That hair
1369519067.0,1681,This guy is in his 20s.[fb]
1375891740.0,1679,OkCupid Cringe.
1375877413.0,1676,"This one was aptly titled; ""Apparently were dogs , so dont make him sick us on ya ass"""
1361997243.0,1680,"He told me on 3 occasions on fb which I ignored, then he told me on WoW... very excited to share"
1375114221.0,1679,Owl City tweets never disappoint...
1371609513.0,1679,A friend sent me this from 9gag
1373497694.0,1681,I loved her.
1371761923.0,1675,#mensrights
1366511147.0,1674,"Meet the ""Big Hair King"" of Cringe"
1366064327.0,1678,#OMG guys look how #sad I am :(
1370187809.0,1676,"Popped up on my news feed, my FB friend's prom pic"
1363996698.0,1678,A guy I work with in the Air Force thinks he's a meme.
1374076924.0,1668,Seriously all you women are lame.
1371062177.0,1671,A woman's precious and delicate flower must be tended to
1364032710.0,1665,He put a whole album of these up on FB
1374084508.0,1674,"Hey all, meet the downtrodden white rapper I graduated with."
1371631545.0,1665,Girl on my friend list gets a tattoo for her birthday. Doesn't really go the way she wanted it to.
1367584942.0,1666,I found this monstrosity on a 'friends' facebook page. The album title was Random Awesomeness
1372773159.0,1664,Badass iPhonecase. [X-post /r/ghettoglamourshots]
1367151874.0,1669,"Ah, high school relationships."
1363464147.0,1668,#fatbitches
1363452291.0,1669,"""You already have."""
1360855851.0,1658,Apparently r/atheism is a cringe goldmine this week. 
1367877084.0,1663,He has tons of these pictures publicly on his Facebook
1367163133.0,1661,Saying you are a meme does not make you a meme.
1364323920.0,1664,cringe gangbang.
1365166789.0,1663,this just popped up on Facebook
1367868414.0,1658,#sipface
1360899237.0,1660,"Holy shit, that subreddit"
1376015532.0,1657,#sufferingfromsuccess
1374523651.0,1661,"was told this belongs here..this chick regularly posts ""stories"" of things happening to her that all equal to: 'omg i'm so hot'"
1365546159.0,1656,His name is 'Lucifer'
1376328477.0,1652,"Found on reddit, I can't even..."
1376583820.0,1655,Just another Facebook attention seeker ...
1364861256.0,1651,Ent Cringe
1371139502.0,1656,"Guy tries to use the Google search bar to ask a girl out, but makes a crucial ""mistake"""
1365966009.0,1653,There is no possible way to describe this man's bravery.
1367448621.0,1650,My cousin recently got a tattoo of what appears to be a bunch of patriotic vaginas.
1375325693.0,1657,"""Ugliest picture ever"" -his mom"
1369318168.0,1651,It's a trending post on r/funny
1361592384.0,1652,So a brony found my Facebook...
1367453971.0,1649,Girl on Facebook said she dyed her hair and got extensions
1366494133.0,1647,Is anyone buying these?
1364861146.0,1649,So this was on my news feed today..
1372343723.0,1648,"I don't always cringe, but when I do..."
1374860436.0,1649,"Seriously, he'll fucking kill you."
1376071604.0,1648,This kind of grossed me out...she lets her dog do this?
1370375724.0,1644,Made me cringe and wince at the same time...
1374960975.0,1648,This is how I asked out a girl over facebook about a year or so ago... I don't know what I was thinking
1373736552.0,1638,Because this totally happened...
1367329912.0,1642,Random cringe I stumbled upon on facebook
1361221645.0,1642,Class is for Men!
1375020616.0,1641,"Philosopher, model, ego the size of a truck."
1367369473.0,1637,This.
1371236155.0,1636,"Feel a little mean but she keeps posting about how shes got ""v lines"" and a ""fit body"" from all her working out and hard work..."
1370339854.0,1633,So it would appear I have these types of folks in my friends list
1362468244.0,1634,I mean seriously /r/atheism? How many awful front page posts can you make?
1368375337.0,1631,Posted in r/atheism... mildly self aggrandizing.
1364660713.0,1631,the root of cringpics
1374510633.0,1631,Facebook friend posted her new tat. I almost fell out of my chair.
1367285912.0,1630,I wonder if they will ever regret this time of their life
1362599424.0,1630,"You wouldn't understand, it's a troll thing."
1367258941.0,1632,"""OMG w/e Soda!"" - cringeworthy advertising from local dairy business"
1363536685.0,1627,One of many cringy pics from the Harlem Shake Facebook page
1368879897.0,1625,"Another friend zone post in r/AdviceAnimals, supposedly posted by a 'girl' as advice from her dad."
1371913204.0,1617,Didn't everyone else see the cringe in this /r/AdviceAnimals post?
1375361695.0,1626,"""How did you chose your children's names?"". This comment was 2edgy4me."
1367683434.0,1616,Self cringe- My old myspace picture
1366214977.0,1615,I'm even taking creatine
1366554966.0,1613,[SELF-CRINGE] Decided to log onto my old myspace and found this beauty.
1361219040.0,1614,My friend and his girlfriend posted this picture. Then her ex-BF commented.
1359348227.0,1617,amazing-relationships-i-miss-them.jpg
1376478170.0,1612,I met him on Xbox about three hours before this. He found out I had a boyfriend.
1365544009.0,1607,"r/cringepics, meet Dylan. Small backstory in comments."
1362238827.0,1610,Lock up your daughter!
1374376985.0,1608,"""My new tattoo"""
1370279090.0,1608,Are we really free?
1367657791.0,1608,"""Yeah, but just think about how much more badass I'll look with my shirt off."""
1364567459.0,1607,My friend just found this on facebook.  I don't even...
1364240911.0,1604,Saw this Cringe gem on facebook
1363512215.0,1608,If you're too fat for your shoes... Well...
1375542713.0,1609,Found at a thrift shop in Tennessee. Makes me just a little less proud to be an American.
1369914018.0,1605,Read the whole status. I promise you won't be disappointed.
1365012160.0,1602,The Infamous Double Hover Hand
1375538832.0,1608,"Yes, he is completely serious. (Facebook OC)"
1369699799.0,1605,"A friend's picture on Facebook seemed familiar, so I made a .gif!"
1372646873.0,1600,Our Childhood &gt; Yours
