created_utc,score,title
1361017926.0,2217,Guy 'grinding' a little to hard for her liking...
1362545029.0,2211,I wrote this in my diary when I was 12. (x-posted in r/blunderyears)
1372827059.0,2210,Lindsay Lohan tweets the saddest/cringe-worthiest reply of all time.
1375632243.0,2201,Why do I even waste my time with ordinary folk?
1372369841.0,2207,"""Went to the doctor's today."""
1372272700.0,2211,Saw this on facebook last night.
1370179282.0,2204,"An act from ""Roleplay Prom"" on Facebook"
1367234393.0,2200,Popped up on my newfeed. Seems legit.
1374250661.0,2198,People I know thought it would be 'cool' to dress like this for the last day of school
1368462270.0,2201,She's proud of her tattoo. Of her face. On her arm.
1373549419.0,2200,Some delicious GW cringe
1370814445.0,2199,Oh honey...
1366521282.0,2198,No likes. No shares. Life sucks.
1371995398.0,2198,"My ""friend"" got ""friendzoned"""
1364659586.0,2199,This guy have some skills at Photoshop
1361668481.0,2192,texts between me and my first crush. 3 years ago.
1367371609.0,2190,Youtube comments on 'Enter Sandman'
1375776034.0,2190,Managed to get this before it was deleted from /r/WTF new
1372130554.0,2193,Speechles
1362762091.0,2187,This has got to be the worst fake text I've ever witnessed
1363544269.0,2191,Self cringe. Just revisited Myspace... I thought I was the shit.
1371421817.0,2186,Saw this on my news feed
1364680221.0,2188,Tears of blood
1370545490.0,2183,"A friend on facebook uploaded this ""gem"""
1365732067.0,2184,These fake text conversations are really starting to hurt
1376093614.0,2184,Facebook drama right now. I have to say I think it's hilarious.
1358430484.0,2174,"""Who likes short shorts?"" or ""Gawd, you just don't get me son! Leave me alone!"""
1375041778.0,2175,Apparently this is what pain does to you..
1367911189.0,2175,Guess who just broke up with Adam (x-post from r/wtf)
1360789053.0,2174,This was posted in /r/atheism.
1371656624.0,2174,Health tips from a muscle man.
1371009353.0,2176,"Amy's Baking Company, a restaurant condemned by Gordon Ramsay and vilified by Reddit and Yelp, is trying to win back that hip demographic."
1368367118.0,2168,Rich guy here
1369307638.0,2167,YouTube uploaded this on to their Facebook. Their new 'trend'
1368697012.0,2167,Guy I met at a party last weekend got a new tattoo....
1368199087.0,2159,"Found this on r/whitepeoplegifs, thought it belonged here"
1362422608.0,2162,"""I'm so random!"""
1375670330.0,2166,HE makes one of these every day.
1369705549.0,2163,Came across this on my newsfeed... She has an entire album like this...
1365036265.0,2165,Perhaps the worst 'shopped transformation in the history of ever.
1363573450.0,2161,xDxD trolled hard
1371649634.0,2160,A lad i went to school with just posted this to Facebook. Atleast he wont regret it.
1370447614.0,2159,She's so edgy.
1370397062.0,2159,"I cringed so hard after this text.. (I was trying to text the girl I like, instead I texted the girl that likes me.) dug it outta my phone today"
1359914221.0,2157,"Family member shared a pic from the ""Mormon Memes"" FB page. Intrigued, I clicked on. Dear god."
1376051293.0,2153,Cringey attention-seeking Facebook status + bonus cringey comment from her Mother
1374520492.0,2154,"Yes, that was the cops fault! They're all bad!"
1371362022.0,2154,"Posted on r/atheismrebooted with the title ""Veterans should wear their battle scars proudly."" Good god."
1368377790.0,2151,Does cringe exist in the animal kingdom?
1365182652.0,2153,Guy I know posted a meme of his to FB
1360872038.0,2153,Proper Literature
1372156662.0,2150,This is the kind of shit I see on the daily...
1363644734.0,2150,This guy...
1369006936.0,2153,"Oh he is going to be alone for good, alright"
1365963263.0,2142,The product of my depression in middle school...
1355010568.0,2144,"One of my facebook friends trying to be funny, cringe ensues"
1368654452.0,2142,this dude's always posting cringey statuses. well looks like he got a Guy Fawkes mask. the caption just makes it worse...
1368480378.0,2147,"""Look guys, I'm gaming in a club!"""
1365079384.0,2138,I think I'll pass..especially for $80
1362943811.0,2142,Don't be jealous
1369585274.0,2135,Went to Owl City's twitter page today. It is a gold mine of cringe
1375371508.0,2134,Probably the worst webcomic I had the misfortune to behold
1374774389.0,2138,I'm not single!
1368394093.0,2137,Dat Romance
1375668312.0,2134,Cringe from Pakistan
1373682820.0,2131,"""Look like brother and sister but fuck like husband and wife."""
1372872873.0,2137,"Too much cringe in this OKCupid profile self-summary. ""No Darkies,"" ""You only touch it in the shower,"" ""No timewasting videogamers..."" Good luck, girl. (x-post /r/okcupid)"
1363745424.0,2128,"Alright, time for me to pay my dues with my own cringe. I confused myself talking to a girl and ended up awkward."
1371697780.0,2134,Everyone remember him from yesterday?
1371345169.0,2122,I am bisexual... remember?
1371866025.0,2123,"Guy in /r/short adds a few inches to his height on his online profile, girl notices on date and wont have sex with him. He tells her off and tries to show off to /r/short by posting the conversation."
1365691000.0,2121,Lil Romeo is going through some hard times now
1364070919.0,2120,I don't even have words...
1374416474.0,2118,AngelFace!
1368534873.0,2120,Drinking before finals #weresosick
1365701401.0,2114,Guy 'finds' himself on 9gag...Sure...
1371034458.0,2117,One of those vegans that hate all meat eaters
1376509989.0,2117,big amen
1373932678.0,2118,"I'm a recovering douche bag :/, this is my most cringe worthy picture of years past, sorry."
1372340935.0,2117,Malt Liquor and Weed and Bitches
1371148655.0,2115,Very cringeworthy Facebook post. They've been dating for a week.
1372991458.0,2114,The things nerds say sometimes...
1368045913.0,2116,"Cosplayer friend submitted this with the caption ""Haters will say this is photoshop"""
1371831168.0,2108,"Yeah, this definitely happened."
1370644295.0,2111,Blood on the Dance Floor's new album artwork
1362773310.0,2111,"She is currently 20 years old, she has been stalking him for several years. He is 16."
1372172651.0,2106,I hate it when my mom texts that...
1369969931.0,2107,Selfie Tattoo.
1367421966.0,2109,"Crazed Big Bang Theory fanatics argue over a ""Bazinga point"""
1373737476.0,2111,Saw this on my Facebook feed (translated)
1370428430.0,2113,Look at that hover
1370891819.0,2102,Edgy chick posted this on facebook.....she is 26.
1365799780.0,2109,"I was looking at some tshirts on the internet, saw this, thought it belonged here."
1370058838.0,2107,"Victims, aren't we all?"
1374892132.0,2109,Could you edit this just a little bit more?
1375655897.0,2101,Boyfriend Application
1374103284.0,2097,"Worst tattoo ever. No, seriously..."
1373301912.0,2096,Don't suck my dick babe
1365531612.0,2099,She has a lot going for her.
1370790216.0,2096,ALL of his posts are like this...
1370470668.0,2094,"Adorable couple goes sky-diving. Oh, to be the instructor."
1375831369.0,2093,"Privately Educated, Rich Family &amp; Has a Cinema in Her House (x-post from /r/facepalm)"
1363522943.0,2094,"On Facebook, the question was 
3+3x3-3+3"
1375896813.0,2088,Found on R/gaming
1371934103.0,2093,Next time on stuff that totally happened...
1370819337.0,2091,How dare you insinuate that I should tolerate such a diabolical insult
1364546385.0,2090,The most cringe-worthiest weeaboo you'll EVER see
1371952771.0,2090,Yess i smoke as u can tell
1374629978.0,2085,"So this guy I don't really know messaged me on facebook, asking me to like his picture..."
1373201787.0,2081,Lock up your daughters the pussyman is in town
1368107062.0,2080,So we have a new employee at work
1367600985.0,2080,[NSFW] Guy trying to show off shoe collection accidentally includes penis in picture
1363712472.0,2081,"My friend tries to describe the hipsters of today, while being one."
1375499381.0,2080,Pulled over swag.
1367699905.0,2078,The mother of handshake fuck ups. It gets worse the longer I watch.
1369850844.0,2072,"[Self Cringe] My first summer at camp, the girls convinced me to dress up as a girl. Mostly because of the hair"
1368728307.0,2082,These crying selfies need to end
1375489679.0,2074,This is a PROFESSIONAL email sent from my store's district manager to the store manager.
1373752919.0,2077,Only 4channers will understand le newfag 9gag tattoo.
1376540659.0,2076,The new faces of Marc Jacob's fashion line. I don't even...
1369168813.0,2072,"A kid known for trying to act smart, and using big words when completely unnecessary or incorrect just posted this to facebook. And yes, he is a redditor."
1367779965.0,2077,My Spanish teacher just put this outside her door
1375618579.0,2069,She posted this on twitter. Why do people do this?
1376232856.0,2069,Facebook delivers. Tech Support Guy
1363880708.0,2066,y are you denying me?
1368313695.0,2071,Don't challenge a 10-year long writer/poet!
1357606167.0,2071,Youtube commenter switches sides as soon as he finds out he's arguing with a girl
1361729534.0,2063,"""I wasn't even flexing or holding my breath, lol"""
1370863932.0,2061,Heed his warning!
1369779327.0,2064,Student representing South Africa in Model U.N.
1372370757.0,2064,Guy I went to highschool with is so random.
1369924989.0,2065,Father compliments his daughter's breasts
1375913179.0,2059,Dangerusly cringeworthy.
1369447996.0,2065,Grandpa cringing
1374536315.0,2057,I bet this gentleman was wearing a fedora while typing this
1373664531.0,2060,This must be a new record.
1376429427.0,2058,One of my cousins is actually trying to pull this shit.
1373600251.0,2054,The Queen of Cringe at it again.
1373484526.0,2054,Guy Insults Girl Who Plays Video Games
1371837114.0,2056,He kept trying all night...
1368576512.0,2061,"Cringepics, I present to you... The Edgiest Man In The World"
1372645567.0,2058,"A real life encounter of a ""nice guy"" and a ""gamer girl"""
1368299146.0,2053,Dear God.
1368046360.0,2047,So sesquipedalian...
1364999565.0,2050,Even pretty girls
1376243364.0,2048,Ready to lose weight :D
1362332121.0,2048,Neckbeard defending his country's pride 
1371494824.0,2043,This 'acceptance speech' shit that people do on here makes me cringe so hard.
1363996999.0,2041,Gold. Mine.
1372563710.0,2041,"Found this on r/funny in new, think someones a little upset"
1361656582.0,2043,Meet Preston.
1376491171.0,2038,This guy just made this his profile photo.
1371699351.0,2039,Family Cringemas
1369830381.0,2042,"[Self Cringe] This was my hair in high school... if you can't tell, I'm a guy."
1375299465.0,2039,"Guy uses Facebook to publicly lay claim to girl he's ""talking"" to (x-post from /r/facepalm)"
1374273456.0,2030,"""Facebook legend"""
1373821126.0,2036,Im not sure if this belongs here or not but I found it on my Facebook feed.
1367681259.0,2035,"Guy posts to r/awesome- ""nice tip from a stranger""- he was the one who gave the tip."
1365576922.0,2032,"You're trying too hard, Progressive. Intentionally bad or not, just...ugh."
1365099638.0,2030,My cousins new boyfriend posted these on facebook.
1376157402.0,2027,Word of advice...
1366939014.0,2026,Newly drafted Lions defensive end Ezekiel Ansah wears 3D movie glasses with his suit to the NFL draft
1365864139.0,2036,I feel like I really hit my peak of coolness back in grade 7
1368661778.0,2024,Girl complains about principal taking her cigarette away at school. [FIXED]
1360403060.0,2029,Stand out from the crowd
1370096499.0,2033,#(girl's name) [NSFW]
1367280059.0,2023,I'm not single!
1360084665.0,2027,Guy on my Facebook makes the same face in EVERY picture.
1374535002.0,2028,How did people get this delusional?
1364897386.0,2027,A poster outside a church where I live...
1365606099.0,2027,"Ladies, hide yo husbands."
1362786437.0,2022,He does this at least once a week..
1371921400.0,2021,This totally happened.
1374780021.0,2018,I don't understand why anybody would ever do this.
1372111918.0,2015,how ironic
1373411811.0,2012,"You've got to be kidding me. My ""friend"" who's a mom is going wayyy too far."
1359598750.0,2019,"""What you get when your new teacher is a Redditor"" (x-post /r/funny)"
1374162258.0,2012,She's 25 and has an album full of her own memes.
1374340729.0,2010,I really wish I was alive during the 40's. Things would be so different for me.
1362423515.0,2003,I mis u so much
1376557452.0,2004,Skrillex's First Album Cover
1372687716.0,2005,I don't think that's Macklemore...
1358787648.0,2002,A boy in my school got a new tattoo
1371518554.0,1998,I don't even know what to say
1374579275.0,1998,"""Mexico is so exotic... We ate lion for lunch!"" [x-post from r/facepalm]"
1369856873.0,2002,"Thank you, Spencer's"
1364755568.0,2002,"He calls himself ""Swan Man"""
1355795150.0,1994,Found this hot stuff on tumblr.
1375315595.0,1995,"""My fave color is ur eyes"""
1374137012.0,1996,You go get her champ
1375944931.0,1995,She forgot that she had a boyfriend..
1373635518.0,1987,A totally fake abortion story that got upvoted in /r/politics
1375625917.0,1998,Club Douche
1372628455.0,1989,This was his cover photo. It's a reddit thing xP
1362680852.0,1989,Super cringe tattoo
1375539584.0,1986,Huge pervert at my school posted this: Fuck buddy try outs.
1372598516.0,1989,Hashtag Yolo Swag Toilet
1362893143.0,1989,We are anonymous. We are neckbeards.
1374078950.0,1982,Sorry im a grammer nazi lol
1369497432.0,1984,So edgy
1373891026.0,1985,I tip my hat to you good Sir...
1367967844.0,1981,I don't even know what to say...
1372881310.0,1981,"my little sister just sent me this - is this how kids ""flirt"" now?"
1366234936.0,1980,"Same face in every photo. Oh yeah, and he wears a back brace, duct taped on, because its cool... And makeup."
1359835515.0,1979,Not sure it has been posted but this guy really likes Timon from Lion King
1368909681.0,1979,"most of you like this because you see boob, not because its art.....most of you sickin me"
1369262312.0,1971,"""This is what awesome feels like"""
1370152532.0,1971,Spinach and Latinos.
1370672748.0,1973,Observe the male lion in his natural habitat (Xpost /r/funny)
1366323584.0,1971,My neighbor and his friends from high school...
1357854747.0,1972,A clear intellectual 
1373746930.0,1967,Who didn't hear about it?
1372753018.0,1970,It's hard being in a gang
1368081769.0,1970,So...this guy brought his My Little Pony plush to his college and set it on display as he read a poem about My Little Pony to his class.
1366483788.0,1967,get on my level of body modification
1364573022.0,1967,Guy makes an obviously fake facebook girlfriend and they chat back and forth online
1368056688.0,1968,Double SWAG =)
1371150300.0,1965,"Posted this to r/pics, they sent me here. This is a picture of me."
1375413197.0,1964,"This was just on my Facebook wall, people are idiots."
1372447419.0,1961,This is a poster about STD's for one of out local Universities. {x/r/FSU]
1369600640.0,1961,Found on my news feed..
1367930234.0,1961,But in your eyes...
1370301324.0,1956,Teen parenting fail
1360893478.0,1960,Decided to take a look at my husbands old myspace page.
1361827324.0,1964,"""I didn't know I was your girlfriend..."""
1363031450.0,1951,FACT!!
1365510593.0,1957,Mama...
1372979965.0,1956,"""Happy 2013th Birthday"""
1371758915.0,1951,The pizza guy thought my friend was cute..
1371167615.0,1955,Bahahaha.... I am a redditor...
1375989826.0,1950,Popped on my feed.
1374706847.0,1944,Facebook Greeting (x-post: /r/funny)
1374154443.0,1949,Facebook has been a delight lately.
1372429485.0,1952,Chainmail and Fedora = Class
1360367673.0,1945,Who do you think you're kidding...?
1364636419.0,1943,Congratulations /r/CringePics! You are the subreddit of the day! :D
1372637933.0,1948,"""for the future girls."""
1373498377.0,1946,The best cure for dry mouth [NSFW]
1365369955.0,1946,"This guy just 'winked' at me on a dating site. Ladies, calm your loins..."
1374692472.0,1944,League of Legends player attempts to get a date
1361642062.0,1945,Found this in the comments of an Advice Animals post.
1374045148.0,1942,He really wants 200 upvotes. You scratch his wee-wee...
1365249372.0,1947,Devan from Best Buy
1375747267.0,1944,"Me and my buddies drunkenly met this guy and he told us to look him up on Facebook. Then, we saw this."
1370082078.0,1941,Bad Boy
1364749043.0,1939,Getting Brave on Easter
1374185642.0,1943,I killed flies and wasps and glued them on my skin for an art project. r/art said it belongs here instead.
1371792262.0,1943,Why
1371794956.0,1932,"So, I got this text that our ""relationship is over."""
1373462127.0,1936,Made by atheists and run by atheists.
1371234109.0,1933,&lt;3
1372888751.0,1929,What /r/cringepics has become.
1364095286.0,1933,My friend turning his facebook profile picture change into an event
1374636020.0,1929,Smooth.
1369185154.0,1926,Merry Christmas
1372819348.0,1932,Can someone explain how...?
1374579650.0,1925,"I am sardonic, concupiscent, and callipygian."
1371652254.0,1928,"""Heat &lt; miami"""
1361378076.0,1931,Someone posted this OC to /r/ImGoingToHellForThis... felt like it belonged here. 
1368246589.0,1925,Showed up in my facebook newsfeed. What in the unholy fuck
1374090377.0,1924,What's your Favorite Position.??
1371655072.0,1928,My new car...
1372705384.0,1931,"Reddit user really needs attention on his ""cakeday"""
1367745552.0,1925,Gotta make sure everyone on Facebook knows you have sex sometimes!
1369079114.0,1922,"So I was on r/new the other day, and saw the birth of this horrible cringe worthy meme named ""lick me Laura"""
1371082227.0,1920,Guy I used to work with posted this picture of him and his girlfriend.
1364164978.0,1921,Found this kind of uncomfortable as a profile pic...
1375712076.0,1921,"So, a guy is proposing to his girlfriend through memes over on r/adviceanimals."
1367609041.0,1921,"Redditor shares his excitement about possibly having a child, /r/atheism neckbeard responds with an essay"
1373597619.0,1915,From G to Gent.
1362903699.0,1919,New best friend
1364248774.0,1917,Laptop webcam selfie in the middle of class..
1364049256.0,1920,Triple threat.
1365575489.0,1914,Aaron Carter came and visited/performed at my school... and took this pic in the cafeteria bathroom
1370046785.0,1911,#Blessed?
1364830944.0,1919,Making my own quotes
1369507044.0,1913,Dave Navarro's current Twitter profile pic
1367063321.0,1910,CA$H MONEY FAME.
1366262339.0,1913,He Must Be Rolling In The Pussy
1372086618.0,1905,"Not Anymore, Sorry Ladies"
1368807284.0,1910,[Self-cringe] Time to remove some stickers.
1359756807.0,1911,just watch the gif
1372539162.0,1908,obviously racist
1369173593.0,1903,What would possess someone to use a tragedy as an excuse for a pensive selfie???
1363653346.0,1900,i love u
1375649502.0,1903,He's acting like he's not going to still be searching for love well after he's 30.
1374092623.0,1899,I don't get why he won't stop texting me this shit.
1375194805.0,1897,My friend died when he was 18 and this girl he hadn't seen since elementary school created a Facebook page in memory of him. This is one of the many posts she posted.
1375170314.0,1897,A true lady's man
1375573933.0,1902,Guide for Bronies on how to draw anatomically correct horses' genitalia [NSFW]
1373561553.0,1899,Totally believable
1373047673.0,1899,New profile pic
1371501338.0,1902,Badasses
1372725148.0,1901,Cringe News Network
1371907712.0,1897,Guy on my newsfeed just graduated wearing this...
1368871291.0,1899,Look how random these guys are... (Update. They found it)
1366321370.0,1896,Found on /r/clopclop They are very serious about this stuff...
1366458384.0,1899,"It's too late to call the ambulance, it's already been 'strangled to death'."
1361204706.0,1897,"Was scrolling through Facebook, happened to find an ex-coworker...also the mother of all Cringe-worthy photo shoots."
1367183174.0,1894,my bad
1361225859.0,1894,Found this on my FB feed. I'll be cringing in hell.
1374663608.0,1899,Non gamers will never understand us...
1374507178.0,1890,"Yes, she was serious"
1363957322.0,1887,"SELF CRINGE -I honestly thought I looked dashing for being an overweight, fedora wearing 16-17 year old. "
1375552186.0,1891,Girl makes cat facebook then comments on her own status
1374934249.0,1892,TRU LUV 4EVA
1372433133.0,1892,I'm in tears too.
1373930573.0,1894,"So this picture of the dead Glee star is going around. (He's Canadian, mind you)."
1375399521.0,1888,Dumb bitches these days
1366405084.0,1889,Self Cringe... The license plate cover from when I got my first car
1363727331.0,1889,This was posted to r/AdviceAnimals
1366566144.0,1883,Will you be my woman?
1375751056.0,1881,Omg when did you meet Drake?
1370804275.0,1882,"Finally found some cringe on FB, he denied all allegations of it being fake which makes it worse."
1366069894.0,1880,Unnecessary comment on a facebook post about the boston bombings
1376239978.0,1878,Putting your cover photo of a random friend isn't weird..............is it?
1375856260.0,1882,"Her pictures are so photoshopped that she looks animated.. Personally know too, sadly."
1371699103.0,1881,"[Self-Cringe] I'm socially awkward when it comes to girls, so this happened."
1370295607.0,1883,RIP great grandma! Then off to prom!
1376300451.0,1875,Justin Bieber still is the cringiest 'artist' ever. Here he is playing the guitar and singing a song in front of his grandmother... NAKED...
1368657271.0,1879,"""You're very beautiful Dina from Ingor"""
1376012860.0,1872,Hand tattoos are usually not a good idea
1367028979.0,1870,My Cousin
1366168200.0,1870,kid tries to be edgy about the Boston bombing
1373902078.0,1871,Someone on Facebook tries to be funny
1368797474.0,1870,So much class
1373791381.0,1869,So this was on my news feed...
1373778137.0,1868,"You're so clever, aren't you?"
1365696181.0,1869,Doing real stuff sucks
1361126018.0,1862,r/funny/new is just a sea of cringe
1374318660.0,1860,Wingman level: Dad
1372743321.0,1860,Don't tell me you don't reddit...
1366834020.0,1867,Comments like this on YouTube. This is from a Queen video.
1376569968.0,1858,"I shit you not, this is a genuine attempt at being ""sexy"" on the Facebook.."
1376466986.0,1863,Requirements for entry into r/truecringe
1374246844.0,1852,There really is no God.
1369149322.0,1861,Face tattoo cringe
1375198636.0,1855,"No need to mention it, I'm sure we could've guessed it"
1371843577.0,1858,"""muh makeup b on point 2day"""
1371052104.0,1850,Oh baby
1376420161.0,1850,Another idiot doesn’t get The Onion’s satire.
1364507634.0,1851,Ex-Boyfriend tries to scare off commenters on girlfriends Facebook bikini picture.
1363958833.0,1853,"Ooh dear, No darling...just no"
1358907174.0,1851,"Most 4 panels make me cringe, especially this one "
1356315660.0,1850,"Guy from my HS asks out a girl, gets rejected, then goes home to make a PUBLIC rage comic about it."
1373301876.0,1848,How long does it take for Twins to be born?
1372780636.0,1843,"""We Pre-Game Harder Than You Party"""
1376516227.0,1841,Dude invited me to model for his horror-themed website knockoff of Suicide Girls...seems super legit.
1363486699.0,1841,That awkward moment when some random girl tells you they want your dick.
1372016264.0,1842,I dont even know what to title this
1359905765.0,1833,The Future of Gaming
1367754092.0,1834,Who says girls can't code?
1363281079.0,1835,looking for a good relation ship
1361052090.0,1834,My friend's new self shot on Facebook (as seen on /r/funny)
1366799384.0,1834,he didnt take the picure
1372124155.0,1832,Full On Man Beard
1358041240.0,1831,What a stud...
1366402787.0,1827,"""Hit the wrong button"""
1372258515.0,1830,#Fedora #Flame-Shirt #Mens-Rights
1363990634.0,1822,Why would you even....
1365025826.0,1828,"Baby Juggalos, gotta start then young."
1370348712.0,1828,She uploads pictures like this all the time..
1363098303.0,1825,This came up on my newsfeed. Easily the worst use of a meme I have ever seen. 
1360273129.0,1825,This was featured in the iFunny 20.
1375054072.0,1820,How is this at the top of /r/funny
1368247841.0,1823,Spotted in Disneyland
1370971299.0,1821,"Fuck off, Starbucks."
1366302829.0,1824,Have you married your pony waifu yet cringepics?
1363572254.0,1820,Nice guys think you're ugly
1360285082.0,1820,Atheism: Because logic is sexy
1366143708.0,1822,I guess he didn't get the memo.
1365882574.0,1824,"When I was 17 I found these goggles and thought they were so funny, I wore them constantly. Add the braces, the weird chin fuzz, I was gods gift to women everywhere."
1359399378.0,1820,My friend just posted this to Instagram. He's 24.
1366206116.0,1822,Wrong time for this t-shirt?
1366332488.0,1814,What was going through this kids mind when he did this?
1373931149.0,1815,Come at me.
1369246304.0,1813,I don't think Obama was going after BB guns
1364396693.0,1816,*what did I do for everyone to hate one me*?
1372952864.0,1814,Brony REALLY wants to get laid
1376179142.0,1815,Don't call her that.
1358554759.0,1812,Screw Obama
1363297639.0,1806,"A hunk asks a girl out, in the classiest way possible"
1373776144.0,1810,WTF is wrong with this generation....
1375830805.0,1804,[Self-cringe] I find out the girl I'm hitting on is gay
1372670853.0,1801,"""you were insulting me"""
1371567058.0,1805,White folk.
1368128404.0,1809,My friend had a band in high school. I give you Imbortir.
1366976430.0,1807,And the wine-glass isn't even the coolest part!
1365689856.0,1805,Friend got a boyfriend.
1364036938.0,1804,Oh my. 
1375015557.0,1799,I think Cher just bangs her head on the keyboard and types random words in
1374084148.0,1795,I proceeded to delete her afterwords.
1371225026.0,1794,just modelin ;)
1372693176.0,1801,"This totally happened, guys."
1364410879.0,1798,"Kissing virgins on their wedding day, kissing."
1359680488.0,1797,Gangnam save. In a local coupon magazine.
1373930313.0,1795,I just died inside when I saw this. Cringe Level: Trayvon
1363643713.0,1793,This is currently on the front page of /r/trees
1356566350.0,1786,This is only the beginning.
1368166442.0,1789,Just hanging with my gf in Paris.
1362448269.0,1784,Pippins Tat
