created_utc,score,title
1364946001.0,1839,MRW my friend is getting yelled at by his parents
1358695173.0,1837,MRW I get PM from someone who is redditor for 2 days
1375564893.0,1838,MRW any time anything works in the lab...
1342542860.0,1836,"Me, reading the 'famous people who should come out already' thread on AskReddit"
1371592443.0,1836,MRW I knew I wouldn't know anybody at my girlfriends sisters graduation but I went because it was catered
1370703214.0,1834,How I feel when linking my sister to reddit content
1369795137.0,1838,MRW when people ask why I laugh at all my own jokes
1352405393.0,1835,When a textbook uses your name in an example 
1341677161.0,1832,When my mediocre post gets upvoted.
1357259009.0,1832,When I'm googling a problem with my computer and I come across a post from 2009 in an obscure forum by a user who had the same question but no one answered it
1352990461.0,1835,How I imagine every college student on the last day of finals week.
1360784334.0,1830,When My college professor openly insults a student during class
1368648148.0,1830,When I'm outside and I see my friend in class
1367404296.0,1832,MRW I got a new laptop
1358181456.0,1829,When youre drunk and notice somebody is taking a photo of you
1350554086.0,1839,When you tell a friend a joke and he repeats the same joke to your group of friends who all laugh at it
1376066858.0,1833,"MFW, as a kid, got caught by my parents sneaking out of the house."
1369855587.0,1836,MRW I see my long-distance girlfriend after almost 7 months.
1374816087.0,1828,MRW my drunk uncle tells racist jokes at Christmas.
1344970784.0,1835,When my girlfriend goes to class and I have the day off
1365000712.0,1825,MRW I overhear my girlfriend's mom bitching about me over the phone
1355718422.0,1824,When I am getting pants fitted and the tailor pokes me with a needle
1346464693.0,1827,"In elementary school when my friend says ""I know who liiiikes youuu"""
1350742211.0,1825,When I smell cookies being made in the kitchen
1365032670.0,1818,How I imagine North Korea's reaction if they press the war button.
1376076121.0,1825,A lot of non-native English speakers' reaction to reddit.
1367647920.0,1825,My sister said her boyfriend loves her so much he's not attracted to other girls anymore
1368313526.0,1821,MRW I learned the cheerleader who dumped me in high school gained 120 pounds.
1357993401.0,1823,After demolishing a friends high score on the first try.
1350303482.0,1821,"Whenever someone with ""swag"" tell me I dress poorly."
1362326742.0,1823,When my phone rings and I'm in the shower. 
1351594846.0,1815,MRW a foreign girl tells me she's only attracted to me for my Australian accent
1355413734.0,1818,When my girlfriend is having computer problems
1367976519.0,1815,I'm a Christian. My microwave stops working and my atheist friend tells me to use prayer power
1364677569.0,1818,"MRW It gets to the chorus of ""Let The Bodies Hit The Floor"""
