created_utc,score,title
1366899611.0,2396,"My GF's reaction, when I suggested anal..."
1365071640.0,2402,"Telling my wife about the situation in North Korea and she said, ""Wait, the USA doesn't have nukes, do we?"""
1366723305.0,2393,After spending some time at r/MaleFashionAdvice
1371587818.0,2388,MRW my six year old cousin challenged me to Mario Kart.
1368522835.0,2390,MRW my mom tells me that my friend and I would be an excellent pair.
1372115327.0,2384,When a girl wants to stay over but insists on sleeping on the couch
1375186821.0,2384,When I upvote someone whose post I've once downvoted before
1371311248.0,2384,When I go into the office kitchen and there's an unopened box of donuts.
1355582483.0,2383,When my friend cussed out and broke up with his bitch of a girlfriend in front of all our friends at a party. 
1353165425.0,2381,When a guy asks me if I'm freaky.
1372907269.0,2375,Continuing to browse porn right after I finish
1369319319.0,2381,MRW when the Doctor told me I dislocated my jaw
1368439399.0,2373,MRW I see another low frame rate gif from tumblr
1367166361.0,2378,My cat's face when I get a new couch.
1374498917.0,2371,MRW I watch the cooking network.
1365878527.0,2367,Leaving a job that you hated on your last day.
1373073115.0,2371,when im hanging with my best friend and his gf and get third wheel status
1373032477.0,2372,When someone asks if I have gum.
1361370658.0,2369,When my friend said she's never bought pepper spray because she doesn't like spicy food
1360288644.0,2370,"When I send a flirty text to a girl I like and she replies with just ""lol"""
1343873169.0,2366,"Seeing an Olympic swimmer remove their swimming cap, only to reveal a second swimming cap."
1372844179.0,2367,How I feel with only one week left at my job.
1362747758.0,2370,MRW I was told my company will be making a Harlem Shake video.
1370973883.0,2371,When I was five and my mom made me leave my friend's house
1368924810.0,2363,When Bing says people prefer them to Google
1354039304.0,2363,How I feel after my first month without a girlfriend in three years
1375370988.0,2366,"My name is Richard Brown, MRW when people point out that makes me ""Dick Brown"""
1374496609.0,2362,My reaction when i hear the RoboCop remake is going to be PG-13.
1370529803.0,2359,MRW my friends make fun of me for not owning a smartphone
1373639497.0,2366,MRW Someone says I've had too much coffee this morning
1367193120.0,2361,When someone asks me what I did with my time before Reddit
1347295062.0,2369,When my family says I've put on some weight
1375577300.0,2360,MRW my girlfriend's mom asked her 15 year old son if he masturbates.
1373485998.0,2359,MRW my girlfriend says she wants to hang out but doesn't want to spend too much money.
1370558625.0,2355,MRW in elementary school when my class got a pizza party because I brought in the most box tops
1368884330.0,2356,MRW I think I have a unique post and do a quick search to see if it's original.
1352804394.0,2360,My reaction when I tell someone that I'll get off the internet soon
1372081753.0,2356,When a reaction gif doesn't make sense
1364588244.0,2350,Being the first down vote on a new post.
1363874505.0,2355,When someone lectures me about what's in my food
1333428412.0,2352,When people ask how i get reaction gifs so quickly on facebook.
1371867033.0,2347,"MRW, as a grown man hitting a firefly while driving and having to watch the glowy stuff slowly fade."
1369840008.0,2351,When I accidentally click a horrifying WTF link
1367523863.0,2346,When I saw that people are still submitting to /r/orangered and /r/periwinkle
1364066343.0,2342,When my ex wanted to get back together after breaking my heart
1335439856.0,2345,The EXACT face I make when Words with Friends accepts a word I made up.
1375443525.0,2343,MRW checking my phone when I wake up
1374692091.0,2343,MRW I'm deciding on having a second bowl of cereal
1371052861.0,2343,when I sign back into reddit and there's nothing new on the front page
1375898719.0,2340,MRW It's my first day at a new job and no one has assigned me anything to do.
1370461681.0,2338,MFW the waitress is approaching with my food.
1362472794.0,2340,MRW my dentist asks me if I've been flossing regularly
1363016153.0,2339,[OC] The Hot Girl In Class Has Laptop Troubles
1368815118.0,2334,Whenever my wait staff talks back to me
1376440890.0,2334,MRW my friends start to notice my sister is maturing.
1366682672.0,2332,MRW the Subway worker adds too much sauce
1367070959.0,2333,When I'm drunk and try to order food
1354606420.0,2338,When a girl tells me to cover my eyes while changing...
1365965053.0,2335,Recognizing someone in r/gonewild
1370217839.0,2327,MRW the parents have company over and I want to get into the kitchen.
1367436653.0,2334,MRW I was left alone with my ex's parents for the first time and they proceeded to tell me she was a pathological liar/thief/drug addict and to run away as fast as I can.
1372429158.0,2330,Our reaction when me and other male nursing students see a vaginal birth [x-post /r/StudentNurse]
1372334367.0,2335,"MRW when I ask my 3-yo ""ARE YOU PEEING IN THE BATH?"" and he replies ""not anymore."""
1360696496.0,2326,When someone asks me why I'm on Reddit so much
1375326133.0,2325,How I felt the first time I tried female hair products
1371692103.0,2321,MRW I went on my friend's Reddit account and seen all of his Confession Bear memes.
1371560683.0,2321,"When I created a gif, closed out of Photoshop, and realized I didn't trim the end correctly"
1371503146.0,2308,MFW my 15 year old sister says she's going to move out when she turns 18.
1375329888.0,2315,MR after hearing that the U.S. wouldn't torture Snowden if he turned himself in.
1369013631.0,2314,MRW when I took Bings challenge to find proof it is better than Google.
1368845850.0,2313,"When a video title says ""try not to laugh"""
1363464260.0,2309,MRW I see my ex at a party
1373253731.0,2312,MRW the guy I like says I'm pretty
1359573490.0,2308,When the professor remembers to move the cursor off the screen while showing a video
1356052053.0,2304,When I'm at my S.O.'s work party and she introduces me to her coworkers BF who doesn't know anyone either...
1355753043.0,2306,When my dog isn't being cute for /r/aww
1368195516.0,2308,MFW I'm named as Prom Queen
1367613803.0,2305,MRW a freshman tried to argue with our evolutionary genetics professor by using bible quotes.
1376049949.0,2305,When me and my friends are trying to make plans.
1366034506.0,2307,MRW I realize it's Monday again
1372475912.0,2308,MRW I bring up politics at a family party.
1374412321.0,2306,My reaction to getting in trouble for screwing up a task I was improperly trained for at work
1357433276.0,2306,Finally bought a new computer
1347636248.0,2305,When my waiter forgets to add some drinks I ordered on to the bill
1374285451.0,2302,MRW the guy needing directions heads the opposite way I just pointed to
1363345403.0,2297,MRW my roomate asked me why I ate an entire box of Cookie Crisp for dinner
1332711305.0,2293,When someone makes me laugh when I am in a bad mood. 
1376063683.0,2292,MRW I post a gif I made and someone reuses it with a much better title.
1365016343.0,2289,"One step up from lurking b/c I finally made an account, but I still feel like this..."
1360113238.0,2294,When you go to bed and then realise you have an assignment due tomorrow
1363181930.0,2295,Reddit's Reaction Whenever I Post
1369747698.0,2291,"MRW my brother did something bad in front of my parents, and didn't get in trouble."
1375406048.0,2289,When i see a fat dude at the gym working his ass off
1369257104.0,2295,My Dad whenever my sister says she's having boyfriend problems
1372941234.0,2288,MR as a Brit browsing reddit on the 4th of July
1374494478.0,2289,MRW I go out to eat with my friends but I'm the only one who gets drunk.
1369104053.0,2292,MRW my girlfriend says I shouldn't have eaten a tube of cinnamon rolls for dinner.
1368044521.0,2287,"How I Feel When I Turn On My Car On A Hot Day, And The Heater Blasts In My Face"
1367357620.0,2287,MRW I got my first blowjob
1361794811.0,2291,When I upvote a comment that is really clever but has few upvotes.
1366807369.0,2285,Trying to stay awake in class after pulling an all-nighter
1360008971.0,2292,When the teacher asks me a question in class on Monday morning
1353335203.0,2283,When Grandma asks me to say grace at family dinner.
1366894445.0,2284,MRW I say something embarrassing to a crush.
1349188579.0,2277,"I thought I had a good voice, so I recorded myself singing my favourite song."
1353767133.0,2277,When I tell people that my bed is too soft.
1334424248.0,2278,On Facebook for my birthday.
1366574655.0,2272,MFW I see two thirteen year olds making out at the mall
1344936955.0,2269,Becoming a MOD for a small subreddit.
1372375742.0,2277,My reaction after submitting my own OC on Reddit [OC]
1362324502.0,2270,When I upgraded to 15 mbps internet after living on 3 mbps for the last decade
1360680468.0,2274,After walking around the Renaissance Faire in Arizona for 30 minutes
1356198317.0,2268,When Amazon says my package won't arrive on time due to inclement weather.
1363186428.0,2272,"When I told my son he could watch a movie before bed, and he chose The Return of the King extended edition"
1329098282.0,2264,When a bunch of gifs on r/reactiongifs aren't reactions.
1371151937.0,2267,My cats reaction when I come home from work
1355180090.0,2265,When my brother and I are done unloading the groceries
1361537938.0,2261,When im introducing my first GF to my friends
1361090786.0,2261,"When I try to get my girlfriend in the mood, and she's not having it"
1358951337.0,2265,How I feel being the only white guy on the school basketball team.
1368796566.0,2260,MRW I'm at a 4-way stop with 3 other cars...
1367709559.0,2259,When your friends hate your pregnant girlfriend.
1359162440.0,2262,After upgrading to iTunes 10
1351434647.0,2256,"Whenever I come back on Reddit, and something I've done has been hugely downvoted (x-post /r/communitygifs)"
1354234223.0,2261,When a website says I have to login to comment.
1364389281.0,2260,When my ex-girlfriend gives me a booty call
1365098949.0,2253,MRW I click a risky link that turns to be good in r/FiftyFifty
1349349759.0,2259,"Mitt Romney: ""I’m gonna stop the subsidy to PBS..."""
1373638971.0,2249,"MRW I was a kid, and Mom said it was okay to sleepover at a friend's house."
1373345139.0,2255,When a gif I spent almost 2 hours making gets immediately downvoted [OC]
1353369988.0,2248,When my brother starts to bring up politics at Thanksgiving dinner
1374779238.0,2245,When class has ended but the professor is still talking...
1343612469.0,2251,when a hot girl makes eye contact with me
1364327832.0,2241,Whenever the teacher makes a small mistake on the board
1357562160.0,2247,MRW my mom says I look cool
1373245037.0,2247,MRW I saw that Miley Cyrus was Maxim's 2013 #1 hottest girl...
1371081839.0,2238,MRW I hit the jackpot on a game at Dave and Busters and everyone is watching me collect tickets
1369586629.0,2244,MRW someone wants to open a bottle of sake at my mexican-themed birthday party
1352856986.0,2242,When my SO tries to cheer me up with food
1341578263.0,2242,When I see my little brother playing with my old toys
1348835854.0,2240,How Zach Braff must feel now that he's initiated a flood of entries to r/gonewild
1365872849.0,2242,So I Read 50 Fifty Shades of Grey...
1375652603.0,2239,MRW being at girls house for the first time and clogging the toilet with no plunger in the bathroom.
1371679027.0,2237,"My dad's reaction when my sister and her bf go downstairs, and he realizes there isn't even a TV down there anymore. Just a couch."
1344351129.0,2236,Right when I'm about to fall asleep
1373290226.0,2236,MRW i'm redditing at work and I look over to my coworkers screen and he is on the same page I am.
1365000672.0,2235,That unexpected graphic sex scene during a movie with your parents
1357932003.0,2231,When I look at the board notes in class after spacing out for five minutes
1351094663.0,2225,When my only Friday class gets canceled.
1361641273.0,2229,My friend and I's reaction when our buddy came to my house at 3am to tell us he finally hooked up with the girl he's been after for months
1376490259.0,2229,MRW my roommate has me proof-read her doctorate thesis
1365887659.0,2224,"MRW It is 100 degrees in my car, and I accidentally turn on the heater instead of the AC"
1354213166.0,2222,How I felt when I looked through my husbands internet history...
1365798272.0,2222,MRW my mom said we have some unused fireworks in the basement
1363821624.0,2225,MRW my friend makes a racist joke towards me
1355107233.0,2228,When I have a booger I can't get rid of...
1363548647.0,2223,When I made my girlfriend squirt for the first time
1368105673.0,2219,MRW my girlfirend stops talking and i realize i havn't been listening
1361838303.0,2218,MRW my wife says that we are going to the mall to buy me new clothes.
1361541735.0,2219,When my favorite song comes on
1362350663.0,2218,Sitting in class after lunch
1342179129.0,2216,"""On reddiquette"""
1367934077.0,2222,"When me, my Fiancee' and her friends played the drinking game 'I Never' and I was the only one who drank to having a threesome."
1344786369.0,2216,When Bob Ross adds something new to the painting
1369183786.0,2217,How I feel when my black friends say I can dance
1372423733.0,2215,MRW I decide to pick up the tab.
1363317283.0,2213,Whenever my post goes from 1 to 0 instantly
1366575185.0,2212,"Me, posting anything to reddit. Ever."
1364741272.0,2203,"MRW I come home from college and I can't get inside, and then I remember my parents moved. (X-post from gifs)"
1364995182.0,2205,"When I was in college: ""Sure, I'll take your flyer."""
1368541203.0,2201,My dogs reaction when I leave the gate open
1357406545.0,2197,When I'm on my way home and my phone battery is at 1%
1376333797.0,2198,"MRW my girlfriend says ""Do whatever you want to me."""
1375047229.0,2194,When someone calls or texts me on the weekend
1368974177.0,2200,MRW I studied all night long for a test and it gets cancelled
1366939803.0,2194,MRW I've been growing my hair out (longest it's ever been) and someone comments on how nice it looks.
1357274653.0,2191,When I pretend to understand what I have just been told
1372256901.0,2196,MRW Rockstar has announced vehicle customization will return to GTA 5.
1372551973.0,2188,Kim and Kanye's baby once he learns to internet.
1370267551.0,2195,MFW a hot girl looks at me in a party
1368702995.0,2193,MRW When I downvote somebody.
1360947032.0,2193,My entire friend group when we heard Harrison Ford was coming back to play Han Solo in Episode VII
1344516681.0,2195,"Every time I'm out to eat and a waitress comes back to my table to ask, ""How is everything?"""
1373380882.0,2186,MRW my friend tells me he's thinking of buying the entire James Bond collection in Blu-ray
1372255477.0,2192,When I get into a club underaged
1376534893.0,2188,MRW a crappy employee reapplied two weeks after quitting.
1360765935.0,2183,When a celebrity responds to your AMA question
1360170645.0,2188,When redditors use their girlfriends for karma
1358603639.0,2190,Sleeping in Cold Weather
1373725735.0,2185,"When my wife tried reddit for the first time and asked ""How do I submit something directly to the front page?"""
1374712356.0,2187,MRW I find a good pornstar I haven't seen before
1354544016.0,2182,When I completely make something up that turns out to be true
1373844654.0,2179,My friend's reaction when I wake up from being blackout drunk
1367678413.0,2180,My reaction at the end of Toy Story 3
1369941156.0,2177,My friend is a long time redditor. His reaction when I told him I made a reddit account [OC]
1364308238.0,2178,When Grandma asked how I knew so much about computers
1370810063.0,2175,My gardner when he saw me walk in with a girl when my parents weren't home.
1354801344.0,2169,When my wife says we should order pizza
1375828755.0,2165,MRW My Fiancee yells at the dog for farting when it was me. [OC]
1366234412.0,2171,When my stomach starts to churn after days of constipation.
1360456590.0,2170,"When the parents of the kids i was babysitting returned early, after I helped myself to food..."
1352471989.0,2170,MFW I'm on crack
1361117390.0,2165,MRW I wake up and smell bacon
1353290717.0,2172,When a non gentleman insults me. 
1365424854.0,2168,MRW I'm looking at the longest piece of licorice in the world
1367015612.0,2167,Reddit's reaction when they find out OP is a woman
1372591876.0,2164,MRW I try to help a random Redditor and then find out that he claims to be a sociopath who likes manipulating people. [Links in comments]
1365011896.0,2171,When a hot girl I have been ignoring all night asks me to walk her home
1361456535.0,2165,When I get home and immediately notice that my Wifi is not working
1360411523.0,2166,Every time I open a reactiongifs post and it's this gif again...
1357057304.0,2163,When my post to a smaller subreddit makes it to the top of my front page
1368541407.0,2161,"MRW my boyfriend told me Facebook was better than Reddit because it ""filtered out all the bad memes."""
1356355827.0,2162,When I shut down my computer and suddenly realize a download was running.
1366811377.0,2167,"MRW as an Australian, I see Australia all over the front page."
1356890293.0,2165,"As a RES user, when I see someone in the comments section with a +5 or greater next to their name"
1368050570.0,2164,When a 9/10 took our virgin friend's hand and dragged him out of the party
1373983055.0,2161,When I found out the NSA was recording phone calls
1376057133.0,2162,MRW I see a girl looking at me in the corner of my eye
1371175234.0,2158,MRW my 5 year old sister asks me if banging someone is the same as hanging with someone.
1368191911.0,2159,When my office phone rings at 4:59 on a Friday.
1370526432.0,2158,After watching Adventure Time for five minutes
1357318553.0,2156,Reading my friends' political posts on Facebook. 
1359295044.0,2161,my coworkers and me when an office email goes out saying there's free food in the kitchen
1363788441.0,2160,MRW my wife accuses me of getting too drunk at a party
1346889905.0,2157,When my girlfriend is on my computer and I've forgotten to delete my History
1369067452.0,2156,MRW the shy girl next to me at work goes on about all the dudes she hooked up with this weekend.
1366941633.0,2152,MRW the person I am arguing with has a completely valid point.
1352343649.0,2148,When my zoology teacher shows a video of an octopus battling a shark
1374894054.0,2150,When I go grocery shopping hungry and then see the total
1370006760.0,2150,Finding out my new co-worker is also a redditor
1369318345.0,2151,After being on /r/gaming a few days after the Xbox reveal
1370752946.0,2149,MRW I see a girl with yoga pants on.
1369520804.0,2153,MRW I get in a pool and my nuts touches the water for the first time
1366989329.0,2147,MRW I was gifted gold for a heavily downvoted comment
1348330161.0,2144,"When I'm pretending to listen to someone, then I realize they've asked me a question"
1367144075.0,2149,MRW my friend tells me that he quit drinking
1365345881.0,2152,When I'm leaving IHOP and the waiter says there's all you can eat pancakes in 3 hours
1345735812.0,2151,MFW I see a friend of mine randomly in public
1374974479.0,2146,MRW I rewatch a Game of Thrones spoiler with a friend who hasn't seen it.
1368784074.0,2145,every time I go on reddit.
1361727425.0,2143,MRW I have the munchies and run into a cop at Taco Bell 
1375567453.0,2144,"MRW when my adult child still living at home goes out for ""ice cream"" at 2:00 AM"
1376490403.0,2144,MRW my roommate asks if we should get 100 mbps internet on his expense because he got a raise
1363182733.0,2141,When you realize the girl you're hitting on has a boyfriend
1356447567.0,2142,Going back to school after New Years
1349483838.0,2143,When I see my friend trying to get a girl
1364134389.0,2142,When someone calls me the most butch gay guy they know. 
1334843768.0,2142,When I'm losing an argument.
1333993687.0,2137,When somebody offers a witty insight
1369845926.0,2136,MFW I saw a girl's top come off on a waterslide
1337953574.0,2140,"Whenever I see a ""This was on the pizza box"" post"
1373165380.0,2129,"When a hot girl comes on the bus, and the only free spot is next to me."
1369668234.0,2127,Walking into school after buying new clothes
1372168323.0,2130,MRW my friend declares he wants to give his cheating ex a second chance.
1370622195.0,2131,Just broke up with my girlfriend because she cheated on me. MRW my buddy asks who she fucked
1368971910.0,2129,I just got uninvited to a party because too many people were going
1374086886.0,2130,MRW I read that r/atheism is no longer a default subreddit
1368190273.0,2126,Every college students' reaction when you ask them what they learned a week after finals.
1360548663.0,2128,When my post gets downvoted to hell in the first five minutes.
1376273494.0,2122,MRW I try to trap a cockroach that then starts to fly.
1375148265.0,2123,MRW my girlfriend tells me not to cum yet
1376492094.0,2118,MRW I found out an In-N-Out AND a Dunkin' Donuts is finally being built in my city.
1357515161.0,2118,when i did well on a test that i cheated on
1366647011.0,2118,"MRW a girl I picked up at the bar wakes up in my bed the morning after and asks ""Did we have sex?"" ... [SFW][OC]"
1373326782.0,2117,When a girl asks me to dance at a club
1372627441.0,2121,"MRW I hold the door open for some girls and say hello, and they give nasty looks like they're all that."
1367930292.0,2117,MRW a friend is playing a band I told them about.
1366373963.0,2119,MRW I realize I have work in one hour and I've stayed up all night listening to the police scanner following the shootout in Watertown and the manhunt for the Boston Marathon bombers.
1370193647.0,2117,MRW I see a good comment at 0
1353419285.0,2122,When I try to cook something for Thanksgiving dinner
1340215238.0,2118,"When my wife's crazy friend comes over, and acts like she owns the place."
1363790391.0,2113,The first time I saw someone take out drugs at a party [OC]
1361000853.0,2116,When one of my posts don't do so well
1359943237.0,2113,When I make a pun completely on accident
1357155058.0,2116,How I feel when the barber shampoos my hair for me.
1351353990.0,2110,When my girlfriend asks if I would stay with her if she got pregnant. 
1350229377.0,2108,MFW while reading r/gonewild comments...
1375023908.0,2109,When someone tells me making GIFs is a waste of time [OC]
1367374100.0,2114,MRW people don't loop their gifs
1360786664.0,2104,Trying to level up Blocking in Skyrim
1367598433.0,2103,When my buddy asked what sex with a yoga instructor was like
1360162615.0,2108,"I´m from a German speaking country that has a  dialect that does not have two seperate words for smell and taste, so we just say taste. This is how people from Germany react when I tell them that something tastes just like my grandfather:"
1374320769.0,2103,"MRW i get a single upvote, as a new redditor."
1373820356.0,2104,"MRW I upvote something when it has 10 upvotes, only to see it on the front page with 2000 later that day"
1363719548.0,2106,MRW I found out Google is adding a gif search.
1356627151.0,2101,Me after seeing all the gift posts having received nothing for christmas.
1376073579.0,2098,MRW I suddenly remember I have ice cream in the freezer
1371483109.0,2102,"My reaction during the fight scenes in ""Man of Steel"""
1354304114.0,2096,Visiting Reddit every 20 minutes at work
1367330670.0,2094,mfw my younger cousin asked if ghosts were real
1359536645.0,2100,How I feel when I accidently click a WTF link. 
1355265200.0,2098,Whenever I find an excuse to get out of the dorms
1360757827.0,2094,As a non-American everytime someone tries to explain the rules of NFL
1370439732.0,2087,MRW After having a rough day and my wife cooked bacon for dinner
1357829088.0,2089,MRW when I read about conspiracy theories alone...
1359502935.0,2081,When someone gets upvotes on /r/whitepeople gifs.
1368205761.0,2086,MRW I am sober at a party
1368024509.0,2082,MRW my neighbor's dogs won't shut up barking whenever I'm outside.
1375967680.0,2080,MRW after I click 'submit'
1365858743.0,2084,After my hands have been down my pants
1374847621.0,2076,MRW my friends and I try to go out to parties at night and end up just getting food and going back home.
1372944425.0,2080,MRW my girlfriend and I are watching another couple fight.
1357684197.0,2083,When I pull out to not orgasm yet
1371055377.0,2080,When I get an email from Myspace saying that an old acquaintance has a new profile
1370697887.0,2076,Reacting to some posts in r/wtf
1368558487.0,2077,My response whenever someone asks me how my final exams went.
1359278180.0,2082,MRW My friend added Tabasco sauce to my Ramen Noodles 
1345482978.0,2075,When a /r/reactiongifs mod points out that my gif was not a reaction gif
1372438084.0,2078,MRW I get downvoted in the Batman subreddit for saying I like Batman more than Superman.
1367785681.0,2081,When my ex-girlfriend freaked out upon hearing that I am gay.
1373222269.0,2072,MRW I try to get my friend to watch a show I love
1361923747.0,2073,When I remembered that I have an essay due tomorrow which I haven't started
1372097641.0,2069,MRW I heard that Snowden is being charged with spying for exposing the NSA's spying
1365383058.0,2063,When I am too old to play in the ball pit
1376303483.0,2068,MRW I went into work at 5am today only to find out it was supposed to be 5pm.
1363095485.0,2067,After reading r/GetMotivated
1347468128.0,2070,When a post in r/wtf actually horrifies me
1370829151.0,2063,MRW my boss is watching me as I work on a project (I'm a graphic designer)
1363626841.0,2067,"When I see the ""guitar guy"" at a party trying to pick up girls. "
1359237745.0,2061,MRW I wear any mask on Halloween
1352907058.0,2070,When my 4 year old says I make the best scrambled eggs in the world...
1346682300.0,2068,When my teacher lectures too fast
