created_utc,score,title
1356646689.0,7951,When the computer freezes while watching porn and you can hear someone approaching
1371406982.0,5564,When my nephew tells me he wants to be a dinosaur fighting ninja when he grows up
1352810949.0,4925,"When my local news show said ""The pictures have since been removed from the internet"""
1354543315.0,4671,When my girlfriend says someone looks good in a bikini in her magazine.
1363043068.0,4638,MRW I realize my friends made plans without me
1360339237.0,4640,When we ask my married friend to come to the pub with us
1349273785.0,4317,Talking to my mom on the phone.
1352153636.0,4260,When I pass someone walking into the bathroom I just shit in...
1355974023.0,4254,When a website tells me I'm already a registered member.
1352830505.0,4216,When I'm drunk at a party and someone introduces them self to me.
1355874624.0,4173,when I have gone to bed but I forgot to piss
1361550813.0,4164,"Trying to teach my daughter a joke, but she keeps repeating what I say"
1355370751.0,4064,When I've just finished a 100 problem multiple choice test and I notice I only have 99 bubbles filled in
1370646794.0,3925,"I graduated today, MRW I walked out the door for the last time"
1352471753.0,3918,When I see a fight break out in the hood
1362078463.0,3913,When Google Maps isn't working and my wife asks me if I know where I'm going
1353686295.0,3908,When someone in traffic passes me to become stuck behind the same car I was.
1344483238.0,3886,When I spot Super Smash Bros being played at a party
1365656874.0,3803,When my ex asks if I'm single
1366241741.0,3785,Farting when no one else is home
1344863834.0,3773,When I'm sleeping over at a friends place and their parents start fighting during dinner
1357174554.0,3774,When I meet a woman and she's wearing the same perfume as my first girlfriend. 
1357739231.0,3736,When someone's comment sets me up perfectly for a reaction gif
1346316275.0,3712,How I felt when Obama used the Not Bad meme that I made last year. 
1339760737.0,3703,when someone posts a gif that loops right
1351419164.0,3647,When someone asks me to do something right after I sit down. 
1368108143.0,3607,"Looking for a movie at my house to watch with my little nephew, and he says ""What is Jurassic Park?"""
1359741015.0,3603,When I see a deleted comment with 212 downvotes.
1334606783.0,3553,When I see a funny post with only a few upvotes
1353938666.0,3548,When my boss says that I can leave work early if I want to
1361236488.0,3537,MFW I'm at a party and I overhear a group proposing a Mario Kart tourney
1365487414.0,3529,"When I'm walking with my lesbian friend, and a ridiculously hot girl is across the street."
1355237659.0,3509,When my two-year-old turned on my iPad and reset it to factory default
1358438523.0,3500,"When my boss calls me into his office and asks, ""What is this website called Reddit?"""
1351167893.0,3482,"When my wife and I hosted her lesbian friend for dinner, and they started talking about her sex life"
1348768882.0,3481,JK Rowling's reaction to negative reviews of her new (non-Harry Potter) book
1370622843.0,3470,When I hear my German Shepherd whimper as I walk out the front door.
1358265102.0,3427,When my 7AM Professor ends up being hilarious.
1364405597.0,3410,When I'm one of the only ones who actually BYOB to a party
1355795837.0,3400,When my friend's keep asking me why i don't want to go out and I've run out of BS excuses.
1358235085.0,3384,When I come back from buying another beer and my buddy is talking to a hot girl
1354887597.0,3379,About to get some sleep before work after gaming all night... and the sun comes up
1337021399.0,3349,Meeting a redditor in real life
1362708020.0,3310,"MRW I figured out what ""MRW"" meant."
1350253127.0,3297,How I feel upvoting in r/science.
1361404003.0,3301,MRW I dilute a solution
1366292077.0,3279,Browsing all the posts in /r/reactiongifs
1350827146.0,3248,"When a girl at a party asks for a cigarette, and I'm the only smoker. "
1362531777.0,3233,"MRW I hear people say that once they're 18, their parents won't be able to tell them what to do anymore."
1355320175.0,3228,"Showed my parents some gifs, and they asked me if anything else is on Reddit"
1351774746.0,3209,When we're arguing and my wife says it's getting late
1360847712.0,3207,"When people text me, ""Happy Valentine's Day!"""
1363727657.0,3137,How I feel driving by my old high school after graduating in 2004.
1366391453.0,3128,"MRW I learn the Boston Marathon suspects are Muslim, after all."
1346967694.0,3126,When my 14 year old asked if she could go to an outdoor rave with her friends. [OC]
1362954051.0,3109,My dad's reaction when we stayed at a fancy hotel
1353066421.0,3097,When I fail a test I really studied for
1363284859.0,3093,When I walk into the kitchen and see my dogs going after the trash can
1352735949.0,3098,When my professor briefly has their desktop on screen before loading the power point
1359473814.0,3089,When my son says he wants mommy to tuck him instead.
1358949621.0,3099,Coming home to a slow cooked roast to realize the crock-pot was never plugged in
1365712332.0,3095,When a chick flick makes me laugh
1362504336.0,3084,"When I try to register, and the website says I already have"
1366473148.0,3069,When i fall asleep on the bus and miss my stop
1365385457.0,3073,After my wife spends 25 minutes in the same aisle at Walgreens...
1336911433.0,3077,"When your friend introduces you to someone for the first time, and then leaves to take a phone call..."
1363125695.0,3067,"MRW my brother starts a sentence with ""Yesterday on reddit..."""
1366512726.0,3064,"When I accidentally liked a girl's bikini picture from the ""Hawaii 2009"" album."
1354338000.0,3061,How I feel about the new water heater that my landlord just installed
1374360719.0,3061,MRW I tell a bad joke and am waiting for a reaction
1350391291.0,3043,When the GIF is the same size as the thumbnail
1369144310.0,3050,MRW my wife is getting undressed and I'm late for work.
1367945116.0,3041,Every time I try to go shopping
1357786525.0,3036,My cat's reaction to a fart
1354483932.0,3032,My reaction upon discovering that I misspelled my e-mail address on the résumé I've been sending out for the past 4 months
1370962285.0,3029,MFW the gif loops perfectly.
1368561668.0,3024,MRW i went to my buddies comedy act and one of the jokes was about me
1373547836.0,3013,When my GF and I get paid on the same day
1367463964.0,3010,Found out I'm lactose intolerant. First trip to Five Guys when the cashier asked if I wanted cheese on my burger.
1356232124.0,3010,When she says she's a squirter.
1350328643.0,2990,when girls on r/gonewild say that can't find any guys to have sex with them
1345220395.0,2988,"as a black guy, seeing a tasty looking watermelon at a white friend's barbecue."
1355836360.0,2984,When I see someone else pulled over by the police on the highway...
1353204812.0,2978,When I'm the first one to show up at a party
1361960817.0,2980,The sun is shining and it's 5.8 °C (42.4 °F) in Finland
1357923417.0,2976,Walked in on my roommate jerking off
1357483161.0,2981,When I log back into Reddit and see that a comment I posted spawned a huge argument
1361636474.0,2974,"As an Android user, getting sent a message with emojis in it."
1369233522.0,2975,"When I finished eating a frozen dinner and realized the box said ""family size"""
1348578715.0,2969,When I run into my boss on the weekend. 
1351715099.0,2961,"As a bassist, whenever a band leader tells me to be funkier"
1360507827.0,2960,When a girl says have you noticed anything different?
1358899484.0,2955,MRW someone asks my sister why she's vegan...
1343240318.0,2960,After I learned how to make large well compressed gifs [OC] 
1355538310.0,2954,How I imagine the mods of /r/funny
1361305286.0,2935,When my friend's son kept finding Waldo within a few seconds. 
1373213350.0,2926,MRW my team wins right when I join the game
1364770550.0,2931,Louisville's bench reacts to Kevin Ware's leg injury.
1360191918.0,2919,"When my brother asked me, ""How do I submit something to the front page?"""
1343050833.0,2902,After marathoning through a TV series in a few days and realizing you now have to wait a WEEK between each new episode.
1360591992.0,2887,MFW I realize nobody is listening to me.
1370296818.0,2891,MRW Remembering a year old password
1369569587.0,2895,"When my friend proudly presented his finished PhD project to me, which is on a subject I know nothing about"
1352509850.0,2891,Every time I open the fridge.
1371825018.0,2887,MRW when my most upvoted post is in /r/Depression
1352270726.0,2878,"To America, from the Rest of the World"
1373452091.0,2880,"When I tell my friends I am going to get another drink, while already drunk..."
1359727116.0,2869,"Getting in the back of the car with my brother, and his girlfriend said, ""Careful, it's tight back there."""
1366821752.0,2863,When I meet a morning person.
1375055769.0,2863,How I deal with breakups
1366419063.0,2850,/u/JPDeathBlade after they finally caught suspect #2
1355924318.0,2850,"When my crush rejects me because ""she could never date a computer nerd"""
1351619408.0,2847,Whenever I listen to Metal with a car full of kids that only listen to rap.
1375660436.0,2834,MRW the government reports they've suddenly intercepted a dangerous message from Al Qaeda after receiving backlash from the NSA leaks.
1370716041.0,2835,MRW my girlfriend realized - after hours of arguing - that the thing I did to piss her off actually happened in a dream she had
1369137019.0,2829,MRW My most disruptive student storms out of my classroom after asking her to put her phone away.
1361058707.0,2812,when my roommate told me to get out of bed
1355499433.0,2804,When my mom asks why I'm looking at pictures of cats at 4am
1367863277.0,2812,My reaction during the ride to the movie theater when all my friends are nonchalant about being late.
1356281206.0,2810,When people stand in the aisle immediately after the plane lands
1372184113.0,2811,MRW I see guys trying to pick up girls on r/gonewild
1345317200.0,2809,When I have to register to view a website
1373511346.0,2805,MRW a program I pirated wants to update
1365172810.0,2801,When a friend says her boyfriend doesn't masturbate
1365365111.0,2798,MRW I take an exam online and it reminds me that I'm not allowed to use my book or notes.
1359468687.0,2793,When a comedian tells a joke that all men are cheaters in front of my girlfriend.
1374757342.0,2792,"Ordering at the drive-thru for my family, and the guy keeps asking ""Does that complete your order?"" after every item"
1358381814.0,2783,When my already tall gf gets out of the car wearing 6 inch platforms
1374209533.0,2781,My 7 year old's reaction when I ask if she's ready for bed
1365686955.0,2775,When you don't know anyone at a party and one of your friends finally walks in
1366146890.0,2767,When you're in middle school and you hear your teacher say a dirty word
1375451812.0,2754,MRW the pizza took an hour to deliver
1369392711.0,2758,MRW my friend told me his gf was moving in and he'd never have to wank one himself again
1374135229.0,2748,When I see the waiter walk by with someone else's food that looks better than mine
1371235672.0,2749,got in a car accident. my gay work buddy's reaction when I told him I got rear ended last night
1366039864.0,2741,MRW I return from a bathroom break to my Calculus lecture and see the board.
1372218726.0,2739,As a Wii U owner in r/gaming. [OC]
1371654265.0,2731,"MRW I ask my 2 year old what her favorite thing to play is and her answer is ""togedder"""
1359060952.0,2732,Every time I use my smart phone to win an argument
1355401415.0,2733,My reaction at 7am the morning after my upstairs neighbours had been playing ridiculously loud music until 3am.
1360244496.0,2730,When my kids got old enough to start asking me questions
1367844703.0,2727,Went running yesterday for the first time in a long time. MRW I woke up this morning
1368282824.0,2720,Waking up early and remembering it's the weekend.
1364309481.0,2726,"When my wife, who wants to get pregnant, comes home after a night shift while ovulating. "
1375450584.0,2717,When someone reposts a gif I made and gets more upvotes.
1375978779.0,2719,MRW I walk into an exam I'm actually prepared for
1352264568.0,2717,"As an Obama voter in Texas, this is how I'm watching my Facebook stream right now."
1339579020.0,2709,When I'm drunk and about to miss the last bus home.
1370142267.0,2695,What it's like having a balcony
1351209598.0,2693,When my kids get back from trick-or-treating
1348070151.0,2689,"As a science student, MFW I tell my friends about some cool new research."
1343511965.0,2687,I'm from Sweden. This is my face when people on reddit complains about the heat
1371347556.0,2691,When one of my posts causes a huge argument in the comments section
1344587535.0,2684,When on a date she casually mentions that she has a boyfriend
1368386595.0,2687,When my friends make fun of me for hooking up with an ugly girl
1368611211.0,2679,"MRW I see that I got a 94 on my final, but it turns out that it was out of 200 points."
1365599902.0,2678,When my drunk friends find out I have a Kinect.
1368366159.0,2673,MRW i hit my pinky toe in the doorway
1368723490.0,2667,MFW my girlfriend says I'm doing a great job during foreplay
1367095603.0,2667,When I overcook the steak.
1372519628.0,2664,MRW my boss asks me if I have any plans over the weekend
1352059196.0,2663,When my friend asked me how to get out of the friend zone. 
1369748978.0,2661,When I call for late night chinese and the place is still open
1356477595.0,2663,When I make eye contact with the only other person in church who's head isn't bowed in prayer
1374167964.0,2661,MRW the predictive text on my phone doesn't suggest the swear words I'm obviously going for
1333823395.0,2661,Watching my parents try to use a computer
1354999879.0,2653,When finals are over
1374598535.0,2652,"As a beardless man, MRW I browse r/beardporn"
1364479474.0,2652,When the morning coffee hits the stomach
1367244432.0,2643,When my boss asked who turned the water in his toilet into jello
1373402801.0,2639,MRW My husband says he has a surprise for me.
1373929658.0,2643,When I spray a bug twice with insecticide and it's still alive...
1370532491.0,2641,When someone told me that Reddit needs more Indiana Jones gifs
1362019210.0,2636,"When my boss came into my office and said, ""The megabyte I downloaded off of Facebook gave my Norton a virus."""
1370088183.0,2639,When my friends and I are nervously waiting in line at McDonalds at 10:59 AM and outta nowhere an employee switches the breakfast menu to the lunch menu.
1361594798.0,2637,When a friend writes something sexual on a girl's facebook picture
1355493534.0,2631,"There was a meteor shower last night, but I missed it because of bad weather"
1341775257.0,2630,"When I see ""thumbs up if reddit sent u"" on YouTube in the comments"
1374634556.0,2627,when i'm showing someone something i thought was funny and waiting for their reaction
1369962787.0,2627,MRW i heard grumpy cat is getting a movie
1345066960.0,2624,My father just walked in on me (31) and my brother (22) arguing over which pokemon is strongest
1374154607.0,2627,my family's reaction when they found out I won 5k on a lottery ticket.
1363946873.0,2618,MRW it's finals week and I slept through my alarm.
1373852835.0,2617,MRW My girlfriend says most men don't masturbate
1362674873.0,2624,Clicking on links after being on Reddit over a year
1375814358.0,2612,MRW I heard Chris Brown wants to quit music
1371463285.0,2609,When I found out my boyfriend has a fake reddit account just to comment on his main account's posts
1354748033.0,2615,MFW I click on a link and it is a huge page of words
1376187405.0,2611,Whenever I see an unruly child get hurt doing the very thing their parents told them not to do.
1373308855.0,2607,MRW I learned Mexico has passed the US as the fattest country
1362146174.0,2608,When it's friday
1369335297.0,2607,MRW when I see the sun in England
1365561149.0,2611,MRW my Five year old son says his favorite part of camping is laying in the tent and talking to me before bed.
1372861467.0,2587,"When a girl talked shit about my wife in Spanish, in front of my white-looking, Spanish speaking wife"
1354423660.0,2583,When I check my phone in the middle of the night.
1373366172.0,2587,When youre running late for the movie and your friend insists on getting food/drinks
1370053516.0,2582,MRW when I'm working at Subway and I hear a kid say they want to work here when they grow up
1358863977.0,2587,Girlfriend hated her job so I got her an interview at my office. She received an offer today.
1363387423.0,2577,"MRW my wife's parents are spending the night, and she doesn't want to have sex in case they overhear."
1373288530.0,2574,At the Golden Corral corporate offices today
1375491162.0,2568,MRW I insult someone in a comment and get upvotes.
1374955752.0,2570,MRW I went to a club sober for the first time
1376027833.0,2568,MRW My roommate and I wake up to find that my mother has come over and has made us both breakfast.
1375878675.0,2573,"MRW Obama tells Jay Leno ""We don't have a domestic spying program"""
1374450606.0,2565,MRW I open the camera on my phone and its switched to front facing
1370612872.0,2569,"Being older than most of reddits target population, MRW I make a comment based off my experience and get down voted in to oblivion."
1369485655.0,2568,MRW when another couple (jokingly) offers me and my girlfriend group sex
1348672094.0,2565,"When someone swerves into my lane in their Mercedes when I'm commuting in my $1,200 truck"
1373980886.0,2560,MRW My friend goes back to his cheating ex for the third time
1369864591.0,2567,When I overhear someone talking about me.
1374329950.0,2562,When I heard Schindler's List was being auctioned off on e-bay
1370526447.0,2555,MRW I'm waiting in line for free food at work.
1366167359.0,2553,When i found out Canada banned members of the Westboro baptist Church from entering the country
1374239751.0,2549,"Heard my daughter tell her friend, ""My favorite color is blue, like Obi-Wan's lightsaber."""
1370396287.0,2549,When I breeze through an online test
1375622387.0,2552,MRW I play any board game ever
1374554526.0,2552,When the first wipe after a massive dump comes up clean
1354836160.0,2549,Teachers during Exam week
1354258585.0,2547,When my Mom asks me if I am high.
1341441150.0,2543,When someone asks me for directions
1366126925.0,2544,"In a library restroom stall, and someone in the next stall slipped a note under the wall that said ""Here for the 1:00?"""
1361285554.0,2537,"Whenever someone posts ""Look who I ran into today"""
1365263212.0,2533,In high school when someone would text me Real Sex was on HBO
1362400792.0,2536,"When my wife says ""Private browsing is for like buying secret gifts and stuff, right?"""
1371753270.0,2539,"When somone says ""she's beautiful"" about my male dog"
1374780239.0,2534,When I accidentally knee my boyfriend in the balls in between sex positions
1364287943.0,2536,A Border Collie's reaction to going in for the kiss. 
1362928018.0,2532,Living downstairs in an apartment my whole life
1374065806.0,2527,MRW my brazilian friend takes me out to a salsa dance night with his latin friends.
1348229265.0,2530,How I feel when I realize that I've slept an hour through my alarm.
1371985197.0,2524,MRW I turn off the lights in the basement
1364651800.0,2522,When I see my ex at a party and told me she made a mistake dumping me
1354629432.0,2523,When my brother tags me in a Nickelback concert photo on Facebook
1376241052.0,2521,"MRW someone replies to my comment with ""you deserve gold for this."""
1375795725.0,2522,When I bought the right thing on my wife's shopping list.
1334796631.0,2524,When the top comment is a hilarious and clever reply
1375724342.0,2522,MRW I'm on Reddit and stumble across someone I know IRL.
1366740099.0,2520,When N.Korea ask for aid..
1363441804.0,2524,"When I went for a ride along with my cousin, who is a cop, and he gets called to a shooting"
1358275097.0,2518,When a Word document I haven't saved in over an hour stops responding.
1364911698.0,2518,When my roommate broke up with his girlfriend by sending a text
1362053675.0,2516,"Every time someone post a ""when you see it"" image."
1371126452.0,2514,I forgot the one item I meant to buy from the Grocery Store
1364220676.0,2510,When all my classes get cancelled today...except my 8:30 AM.
1363588700.0,2507,When the annoying child who's been kicking the back of my seat on the plane is now trying to eat his meal.
1373767011.0,2506,"1 day after getting paid from my job, MRW I sit down, pay all the bills, and look at what I have left for gas and food"
1359665677.0,2500,What it's like as a sober guy amongst my stoned friends.
1369914501.0,2503,MRW when we had a 'family' computer.
1373981606.0,2498,MRW my friends can't think of anything to do [OC]
1365767427.0,2504,Trying to kiss my wife romantically after a night of drinking
1375390615.0,2497,MFW I make a comment that starts a huge argument
1366311775.0,2501,MRW I drive by my childhood home and see a new family playing in the front yard
1375238001.0,2492,MRW my ex (of 4 years) phones me to tell me she has a new boyfriend
1375709227.0,2491,When I call in sick to work and then run into my boss on the golf course
1369269589.0,2495,When I'm doing math homework and the answer is a whole number.
1355076207.0,2494,"When I'm asked why I don't like to go ""party"" or ""clubbin"""
1372686466.0,2488,MRW my boss says I get a 10 cent raise every six months.
1352566394.0,2488,After masturbating to morally questionable material.
1368991083.0,2487,"Introduced my girlfriend to Game of thrones, She just told me Eddard Stark is her favourite character..."
1372793803.0,2490,MRW I'm in the car and my girlfriend is driving
1353976149.0,2475,"Oh god, oh god, who did I piss off!?"
1374778268.0,2472,"after a month of 12-hour shifts to save for our summer vacation, my girlfriend complains I never do anything for her"
1361910654.0,2468,Ctrl + shift + N
1375196653.0,2471,MRW my mother nags me about a mess in my own apartment
1364954033.0,2469,"My buddy took three shots in a row, then walked straight back to the girl who just rejected him."
1360819694.0,2470,when my parents ask about life after college
1371217204.0,2461,MRW something goes wrong at work but I'm too afraid to ask for help
1365436271.0,2454,MRW Reddit dislikes a gif that took an hour to make.
1361994754.0,2454,MRW the waitress tries to stack another dirty plate on her pile [OC]
1373737157.0,2457,MRW when my mother offered to take a blacklight in my room to figure out where the cat pissed
1373395690.0,2455,"MRW my friend who's new to Reddit says ""I love it because everything is so original! It's never the same site twice!"""
1373809978.0,2455,MRW my GF tells me to turn around since she's changing
1353850539.0,2458,When my sister complains about my Game of Thrones marathons
1363987340.0,2456,"MRW I typed ""boobs"" into Google's new animated image search"
1368460783.0,2454,MRW the first time a girl took off her clothes in front of me and asked if I wanted to have some fun.
1375283109.0,2447,"MRW When I taught my little sister how to use reddit, and then I remembered all the things reddit has taught me."
1336394454.0,2448,When my uncle tells a massively inappropriate joke in front of the rest of the family...
1369524196.0,2449,MRW When people are yelling outside
1368478195.0,2449,MRW I met my buddy's twin for the first time... (I didn't know he had a twin)
1363893506.0,2453,When my roommates ask me not to fart near them.
1376332380.0,2445,MRW when someone insults me after an argument's over.
1376579607.0,2454,MRW someone asks me what i did this summer
1375099530.0,2443,MRW everyone on reddit wants to start a revolution
1367964588.0,2446,MRW a 76% grade got me an A
1364178056.0,2443,When you both go in for the kiss at the same time. 
1376486669.0,2446,When we all post something on reactiongifs.
1366242685.0,2437,When my girlfriend asks if I want a blowjob.
1375878280.0,2434,MRW people tell me 8-bit music is lame and childish.
1370487196.0,2439,MRW I just killed 3 spiders in a row in my room
1368460102.0,2440,"MRW I order 10/10 heat at a Thai restaurant and the waiter says ""Are you sure?""."
1375378588.0,2437,"MRW I overhear someone say ""doughnuts"" and ""breakroom"" in the same sentence"
1370048878.0,2437,When I go out to eat on my birthday and they sing to me
1352698240.0,2436,MRW I see my karma grow by 1
1365280645.0,2435,MFW my period is over.
1361694121.0,2437,Anytime I read the comments to my posts
1344270409.0,2431,If /r/subredditoftheday won Subreddit of the Day.
1374105765.0,2428,When I'm on my last card in Uno and my friends think they have screwed me over by changing the color.
1360738239.0,2423,My daughter's reaction when I tell her to brush her teeth and go to bed.
1376307597.0,2424,My reaction after getting 2 hours of sleep on Sunday and going to the office on Monday...
1372684633.0,2418,When my wife asked what I want for my birthday
1374688799.0,2417,When I'm losing an argument and I'm asked if I have anything else to say [OC]
1371557644.0,2409,MRW I get my grades back from last semester
1371055016.0,2410,How I imagine Microsoft is reacting to Sony
1369677678.0,2404,"I've known my brothers username for months now. This is me in a nutshell, leaving him secret upvotes."
1371918595.0,2409,MRW my grandma tells me Im the favorite in front of my sister.
1347914595.0,2406,getting cut off by a prius...
1365089425.0,2405,MRW my 10 year old sister asked me what a VCR was
1352657270.0,2401,MRW I see all these Papa John's posts and have no idea what's happening
1344013966.0,2404,"As an Asian, when I once petted a stranger's dog and he jokingly said, 'Don't eat him!'"
1376146221.0,2396,When my girlfriend comes home early and catches me masturbating
1371937710.0,2400,When I overhear someone suggest a Star Wars marathon.
