created_utc,score,title
1375935278.0,2060,When I hear a dead baby joke
1370466214.0,2064,MRW I spent 3 hours downloading a movie to find out it was dubbed to German
1363880529.0,2064,Whenever I change my Facebook profile photo
1376118342.0,2063,When my friend came back from using my bathroom and I didn't hear my sink run.
1370129251.0,2059,The first thing I do when I go over to my friend's house and see her cat.
1368329988.0,2062,When I'm home alone and I hear a noise
1362183912.0,2063,MRW when Girlfriend texts that she is bored
1349105889.0,2058,As a self conscious female browsing /r/EmmaWatson.
1365122033.0,2059,MRW porn sites ask me if I want to share on facebook.
1362318715.0,2065,MFW I team kill a friend
1358284088.0,2058,My reaction every time I visit /r/todayilearned
1338406492.0,2060,"When someone says, ""I don't want to talk about it."""
1375188250.0,2057,MRW My girlfriend asks me to dance when the music sucks
1367791500.0,2059,When the teacher wishes good luck to the students before an exam
1368734465.0,2061,"MRW Gillian Anderson replies to my comment about being my first crush with ""I'll be your second crush"""
1358651309.0,2061,When I realize I'm 55 pages deep on reddit.
1366850951.0,2054,When I'm with friends and our favorite song comes on
1365213915.0,2053,"MRW I see a clever post, but the person is obviously karma whoring."
1374019330.0,2051,MRW I Discovered /r/ThingsThatBlowUp
1361032520.0,2050,"Realizing after I left the house, that I might have left my porn open."
1373900934.0,2052,MRW I find out my friend's wedding will have an open bar
1334151891.0,2050,Getting free stuff at conventions
1375128461.0,2044,MRW my friend says he wants to go to blockbuster to go rent a movie
1368226022.0,2046,MRW when I found out I could get a free cheeseburger with a student ID at McDonalds.
1366471592.0,2050,As a Taco Bell employee pulling a 12 hour shift today
1364561593.0,2048,When I see what you did there
1343831544.0,2048,My reaction when somebody knocks on the door late for a party
1371616362.0,2040,When I walk out of a bathroom at a crowded party after a fresh deuce
1370042225.0,2040,How I feel when a gif is too small to see
1365771314.0,2047,MR to using adderrall for the first time
1354716049.0,2043,When they put bacon on my sandwich at no extra charge
1330052362.0,2038,When you don't like a popular post
1359907960.0,2040,When my boyfriend is fingering me.
1369698967.0,2041,MRW my parents' new puppy is playing with our deceased family dog's toys.
1351979669.0,2038,Finishing a 9 hour shift after being unemployed for 2 years.
1359306960.0,2040,Saw my friend about to hook up with their crazy ex at a party
1356447506.0,2040,MFW I get a gift I won't use
1352291807.0,2037,"As a European who stayed up to follow the election, this was my reaction when it was clear that Obama had won"
1366809956.0,2041,When I began to reddit.
1358355013.0,2037,Forgetting my mom likes to talk too much on the phone.
1356399588.0,2042,My brother when I told him Santa doesn't come until you're asleep
1355639561.0,2039,"When I'm on my computer and it freezes briefly, then resumes like nothing happened."
1361761358.0,2040,"My friend pushed me into asking my crush out. She replies with ""can't we just have sex without being in a relationship?"""
1365952298.0,2035,When I hear something interesting on TV while making out with my girlfriend
1362842874.0,2034,MRW when skinny people say they're fat
1357992802.0,2035,When I see a family member just about to use my computer
1363543268.0,2032,MRW I type my password in the username bar
1362786028.0,2031,MRW I finally got a mechanical keyboard
1356299104.0,2036,when my ex wants to get back together
1358198177.0,2032,When my girlfriend told me not to embarrass her in front of her friends.
1375096820.0,2029,When my rich friend brags about having an easy life
1374865327.0,2032,MRW I have been driving for 5 hours with the same car next to me but then they take the off ramp
1340783998.0,2031,How I feel clearing my browser history after fapping
1361891803.0,2029,MRW I spot a security camera in a store
1354580681.0,2029,MRW I logged on and saw my link karma at 1999...
1375980458.0,2030,MRW I clicked on a random Japanese porn vid without reading the description first
1363212191.0,2030,MRW I'm taking a huge crap and finally finish.
1359428456.0,2024,Being called OP for the first time
1360274300.0,2028,When a site thinks I'll pay $50 for a font.
1350706034.0,2022,When no one believed I was right until they looked it up
1337669173.0,2025,When I get caught watching porn
1372283305.0,2025,"When I make it to charger, but the laptop just died"
1360765947.0,2020,When my wife insists that we can go see Beautiful Creatures instead of the new Die Hard on Valentine's day
1375299812.0,2020,MRW I became a moderator of a sub with 50000+ members
1372338179.0,2018,My reaction to most things on Reddit as I get older
1372004674.0,2024,MRW I'm told to socialize.
1375104465.0,2017,"as a black man with a white wife, MRW I overheard her on the phone making black jokes with her mom"
1369393628.0,2017,Getting a drunk phone call from an ex...
1363971452.0,2020,When I drop my pen on the floor during class.
1361199483.0,2023,"MRW I find a good reaction gif, but someone posted the same gif, in reverse, before me."
1346093569.0,2017,"DO I LOOK LIKE I CARE - made this last week cos 
there's just not enough gangnam style gifs out there."
1359985033.0,2018,When you realize it's more than a fart
1359925502.0,2012,"When my friends new gf told me to wait outside her car while she went into a store becuase ""I can't trust you yet"""
1369994939.0,2021,MRW I rip a nasty egg fart near my friends
1364517444.0,2015,When my grammy says I look handsome
1355678879.0,2016,Walking out of the cubicle in a busy public toilet after taking a massive dump
1374522903.0,2013,MRW my dad is lecturing me on the phone
1355152702.0,2010,When a picture link doesn't work with HoverZoom or RES
1371559776.0,2013,MFW I reflect on what porn I've been watching after I'm done...
1359387930.0,2016,What I told my parents when I realized I wasn't attractive
1366667230.0,2016,"MRW, as a working professional, I see all the gifs about writing essays and taking tests"
1363544150.0,2005,When i'm about to upvote someone and then see [-54] next to their username 
1329840191.0,2011,Everyone in my class when I'm late.
1370446717.0,2013,MRW the girl next door answers the door in a towel
1360410064.0,2010,"Sampling my housemate's ""cooking"""
1371058306.0,2006,/r/conspiracy's reaction the the news about prism
1370873926.0,2008,"MRW I see the price of console games, as a PC gamer"
1351889726.0,2008,When asked if the sex was good (when it wasn't)
1352054373.0,2010,When a girl likes my profile picture
1373241954.0,2005,MRW I unlocked my phone with my penis.
1366207936.0,2008,MFW something I submit to Reddit gets down voted to hell so I decide to delete it.
1372854190.0,2005,MRW my mom says I'm too old to play with toys
1375019022.0,2004,MFW Explaining to a friend why he shouldn't drink-drive
1376177985.0,2001,MRW I watch my wife open the freezer for ice cream and I know there's none left
1367887672.0,2001,To all the other college students finished with final exams
1370278019.0,2000,"MRW I tell my bratty friend I want to get a cat, but then she reminds me that she would never be able to come over because she's deathly allergic. [OC]"
1366716568.0,2003,When I try to figure out if a girl likes me through texting
1374244009.0,2002,"MRW class is about to end and someone asks, ""Are you going to check the homework?"""
1351265041.0,2000,When I'm getting ready to masturbate on another lonely Friday night
1369793626.0,1993,MRW I'm in bed and I hear a strange noise.
1358805763.0,1992,Scrolling down r/WTF
1354873578.0,2000,When the interviewer asks where I see myself in five years
1344924706.0,1995,When I'm flirting with a girl across the room and somebody walks into my line of sight.
1376310599.0,1997,When someone calls to my house and I pretend I'm not home
1372773030.0,1999,"Watching a movie at my friend's place, and his girlfriend said, ""They should make something like Netflix, but for books."""
1367590035.0,1997,When I told my son we were going to get him a puppy.
1354166486.0,1997,"As a fairly unattractive female, when my male friends start talking about hot chicks they know/want to bang"
1360638560.0,2000,MRW the university I recently graduated from calls asking for a donation
1359320373.0,1994,When I finally bought a phone with a front-facing camera.
1369226833.0,1995,as a PC gamer watching all the xbox drama
1359825851.0,1992,Immediately regretting a text I send
1358123114.0,1989,"When someone posts something that makes me laugh, but it's a repost"
1354095324.0,1994,what i wanna say when I see girls with too much make-up
1375876212.0,1992,MRW my mum asks what the capital of Africa is.
1362581691.0,1989,Whenever I read/hear about anything MIT does
1359634145.0,1994,Walking into a party wearing new clothes
1352955183.0,1993,Scraping the ice off my car
1362660945.0,1991,MRW I walk in to my house to see my room-mate doing the dishes
1356925632.0,1982,When something on r/WTF completely repulses me [OP]
1365794502.0,1988,MRW my boss mentions that occasional weed smoking isn't a bad thing
1334883490.0,1981,"Recommending a show to a friend, then seeing them like the show page on Facebook the next day."
1375964107.0,1989,MRW my friends gf made food for the guys
1363372980.0,1982,"MFW ""When you see it"" posts"
1362672685.0,1981,MRW i quit my shitty job and manager asked me to stay
1374933547.0,1983,MRW my alarm goes off on a Saturday morning [OC]
1374853236.0,1979,MRW my sister says she has better musical tastes than me because her music often plays on the radio.
1371077427.0,1984,When friends are talking to me while I'm gaming.
1376174814.0,1984,MRW I realize I'm 800 posts deep into the front page.
1369240709.0,1980,"When my trainer said I'm allowed a ""cheat day""."
1364770587.0,1979,MRW I just now saw the replay of Kevin Ware's broken leg.
1336087630.0,1976,When I leave a movie theater in the daytime.
1375575411.0,1975,"When my friend messages me on steam, and I'm in the middle of an intense game."
1372520095.0,1975,MRW I Finish Assembling Ikea Furniture
1342446260.0,1971,"My mom, walking in on my ""private time"" when I was a teen"
1357231896.0,1975,"Just found out that I can never eat seafood, and red meat again after having multiple kidney stones"
1345631144.0,1978,Seeing the same stranger twice in one day
1368023956.0,1975,"Everyone leaves the party, except the one you're flirting with"
1364700678.0,1976,After putting paint on my face for a sports game and my team loses
1366153204.0,1972,When I realized it wasn't a fart.
1353680508.0,1969,MRW my friends tell me about what I did when I was drunk the night before
1354893127.0,1968,When my dad comes over with 2 six packs of beer.
1362201685.0,1962,"MRW I see all these ""Friday"" posts, as a person that works on Saturday"
1357718706.0,1964,When I see my little brother on /r/spacedicks
1338684111.0,1970,Whenever me and my best friend get into a fight
1375542564.0,1968,MRW I keep losing in candy crush
1357250501.0,1964,Whenever I read /r/mildlyinteresting
1359847371.0,1969,When I forget about the pizza in the oven.
1367059181.0,1964,When my jam comes on in a club.
1376354063.0,1960,When someone tells me they hate the sound of people cracking their neck
1366598519.0,1959,MRW someone tries to open their pack of gum discreetly and I see it
1360628347.0,1953,When I make a joke about how I'm not doing anything for Valentines Day
1375807820.0,1958,MRW My ex-girlfriend says she misses me
1370190980.0,1957,MRW I got an A on the exam that I cheated on.
1359559186.0,1954,MRW I heard Daft Punk was releasing a new album this Spring
1357224053.0,1956,[OC] For when shit is about to hit the fan. 
1364839876.0,1954,After 10 minutes on Reddit today
1376364200.0,1954,My two year olds reaction after she got shots to her both legs.
1366065111.0,1955,MRW when my brother stepped on the wrong floorboard while we were sneaking outside
1367635410.0,1953,High schoolers reaction when someone else in the room mentions they have gum
1364231385.0,1953,When the prof says 'So that will definitely be on the exam'
1370920054.0,1949,When someone got called a butthead in the 2nd grade.
1369772960.0,1955,When my ex told me she was pregnant shortly after we broke up.
1354374444.0,1953,Receiving the first bonus check of my professional career.
1348580814.0,1954,When my high school bully serves me my egg McMuffin
1336699055.0,1958,When I realized I've spent a year of my life putzing around on reddit...
1372992438.0,1945,My drunk reaction when my friend asked me what I'm doing this 4th of July
1366909340.0,1950,MFW someone asks to borrow my cell phone to make a call but then starts going through my texts.
1349016539.0,1951,"Gave my cousin an old external hard drive, but kept my iTunes folder on it so she could have all my music. Weeks later I'm on iTunes and see that there was some porn in my Movies library."
1341402048.0,1951,When my gay brother-in-law compliments me on my clothes. 
1350574726.0,1950,When someone calls me a nerd. 
1374244981.0,1951,When I work in retail and a customer makes a complaint at me about something that is out of my control
1362856520.0,1948,When a female celebrity stumbles upon their subreddit
1367191657.0,1946,What I feel like doing almost every day
1367889765.0,1942,MRW when my manager told me that clocking in more than five minutes early will count as a tardy.
1366839610.0,1953,Bumping into anybody I graduated with
1375106481.0,1945,When my friend asked me if I know anything about making gifs
1370354681.0,1940,MRW my buddy asks me if I'm free Sunday to watch the football game when my girlfriend already plans to drag me to her parents.
1353420638.0,1944,When I wake my kids up in the morning for school
1361219645.0,1941,MFW I miss the bus because it was early
1348495563.0,1944,When my chemistry professor starts a fire and he can't put it out.
1343177477.0,1947,When I''m drunk at a party and I look in the mirror. 
1370117921.0,1943,MRW I tried to make my own gif
1360077689.0,1946,When my wife asked why I didn't kill the spider yet.
1375740828.0,1944,MRW when my boss asks why I am so hard on the new guys.
1356319581.0,1947,How I react when I am home alone and hear noises outside of my window.
1352028013.0,1939,Reddit's reaction to Emma Watson gifs
1330971978.0,1944,When somebody points at something on my computer by touching it with their greesy finger.
1355450708.0,1940,The first time I ate a girl out
1365252196.0,1940,MRW I'm at a fancy restaurant after eating at home all month
1349718048.0,1939,How I imagine my boyfriend of two months this morning after drunkenly asking me to move in with him last night.
1367328861.0,1935,Americans' reaction every four years after the presidential election.
1353537654.0,1936,"When my girlfriend said ""Incognito mode? That's for like buying presents and stuff."""
1372377383.0,1940,MRW I made it through four yellow lights in a row
1362270255.0,1932,When I see good OC getting downvoted
1367282998.0,1932,"When I message someone on facebook and I see that they read it, but chose not to reply [OC]"
1363781287.0,1935,"MRW, as a shorter male, I'm reading a woman's dating profile and she looks perfect until I get to the line that says ""Must be six foot or over"""
1365942769.0,1933,MRW clothes come off in Game of Thrones
1353000814.0,1937,Every time I go to reddit
1347555039.0,1934,0 bothers given. 
1356705273.0,1932,When someone hits my ankle with a shopping cart
1369665393.0,1929,"As a guy who doesn't usually go to parties, this always happens whenever I go to one"
1368632068.0,1935,My reaction after I ate two packet of Oreos
1364531374.0,1927,MRW my 10 year old sister said she wanted to check out a website called 4Chan.
1375151979.0,1929,MRW I started having sex with a guy that knew what he was doing
1368303147.0,1933,When I go out for dinner and the food finally arrives...
1357010317.0,1927,My comment karma just jumped from -1 to 1.
1354585074.0,1930,"I introduced my friend to Reddit, and he said he will get to the front page on his first post. My response:"
1372270265.0,1927,"When I found out that my little sister shot a guy, (with the .380 I bought her), who tried to rape her when she left a major outlet mall."
1339008816.0,1925,Whenever I try to play with any cat
1373575721.0,1922,MRW my dad wants to go clothes shopping with me and pay for it
1359850033.0,1924,MRW I need to dry my hands but there aren't any towels left.
1372159146.0,1930,Every Republican on Reddit for the past week...
1335974990.0,1924,How I feel playing video games with my brother who is 10 years younger than me.
1360166885.0,1922,"MRW someone calls me a ""low life"""
1346266039.0,1922,"When boss starts typing ""www."" in Google search"
1360898432.0,1923,Just got back from my Valentines dinner date.
1369400757.0,1921,When I'm drunk and my cat sits on my lap
1367164235.0,1914,MRW I wake up from a dream where i'm falling
1357898089.0,1917,When I'm asked to hold a baby
1370832752.0,1916,"When my ex sees me with my hotter, more recent girlfriend"
1367420375.0,1918,When my sister thought she had gotten me in trouble but our parents said they didn't care.
1349224135.0,1914,MFW When someone says wiener instead of hot dog
1363480195.0,1909,MRW my crush arrives at the pool party
1362429463.0,1912,"When I overhear someone beginning a sentence with ""So I saw on Reddit..."""
1353267211.0,1915,"Working in a movie theatre with the name ""Jacob"" this weekend"
1373677195.0,1912,MRW a kid at my work said my hair made me look like Merida (from the movie Brave)
1372906640.0,1907,MRW my sister slapped my brother for saying YOLO in public.
1363050982.0,1915,Whenever I laugh at something on Reddit
1376399264.0,1909,mrw I remember my ex's Netflix password
1375411003.0,1906,MRW I am about to knock on my bf's door.
1356015071.0,1913,When I've spent 2 hours getting the baby to sleep and someone starts to obnoxiously honk their car right outside
1366507672.0,1908,When I rewatch Game of Thrones with people who haven't seen it yet
1357136313.0,1908,Returning to work after the four-day weekend
1345003342.0,1907,When a friend tells me I can eat the rest of their food
1336420630.0,1903,When the teacher of my 8AM class makes eye contact with me..
1365963760.0,1901,MRW I finally have a successful post
1348876131.0,1904,"Whenever someone just replies ""Fuck You"" on my comment or post"
1372023865.0,1906,MRW my best friends make plans and don't invite me.
1358474281.0,1904,All of our reactions when we played with Play-Doh as children
1370526297.0,1904,MRW I go to a Chinese restaurant and realize it's a buffet
1366979260.0,1905,When the doctor asks how many sexual partners I've had in the past year
1358771364.0,1906,When you're at a house party and the cops arrive
1369635400.0,1896,MRW we finally got my friends car unstuck from the mud after trying for hours in the rain
1366209974.0,1897,When my freshmen friends say they love being 'independent'
1365620028.0,1902,"I was just dumped for a mutual friend, I have two essays, a research paper, and a study of music in Buddhism due on Friday, and my parents are getting separated two days before my birthday."
1350770963.0,1903,"When I'm on my period and my boyfriend buys me fruit instead of ice cream cause it's ""healthier""."
1360446040.0,1902,When I'm drunk and someone asks me if I'm drunk
1348167047.0,1899,"How I felt this morning after my wife said, ""you make a good housewife"" after I cooked her breakfast and cleaned the dishes."
1376332834.0,1896,When I see dat ass
1368546807.0,1899,When pizza gets delivered to your house and nobody ordered it...
1363052881.0,1894,When i see a bitch ass move
1356701323.0,1890,Getting good headphones for Christmas and hearing all the details I've been missing in my music
1374887561.0,1891,MRW I answer the phone and it's my best friend [OC]
1365953057.0,1894,When my boyfriend apologizes for shooting on my face.
1359218108.0,1887,When I find my roommate masturbating in the closet
1354938313.0,1889,Whenever I see a chubby person out for a run
1368125907.0,1891,MRW I gently pet my sleeping cat and he instantly responds by getting up and leaving the room.
1367073794.0,1892,MFW I'm introduced to someone new while I'm high
1361149133.0,1889,How I feel browsing r/funny
1353594701.0,1885,Did someone say Anal? (SFW)
1376190524.0,1885,MRW my little brother tells me he doesn't masturbate because it's gay.
1360109669.0,1885,Getting a flirty text after months of being single
1359244898.0,1885,When someone wants to sit next to me on the bus
1349899316.0,1882,When i show my friend the darker side of the internet
1372296798.0,1887,MRW my girlfriend says meet me under the covers.
1364258751.0,1881,MRW I'm making popcorn and it starts to pop
1363520801.0,1884,When I'm on Facebook
1353448188.0,1883,When my friend's sister turned 18.
1372029981.0,1887,"""Aren't you glad you'll spend two weeks with just your family and no Internet access?"""
1371792582.0,1880,"When my friends tell me, ""You have a gif for everything!"""
1351013478.0,1883,As an Arab when I see a thread about the Middle East.
1356102037.0,1887,When my post immediately goes to 0...
1376474928.0,1882,Listening to metal with odd time changes
1376067587.0,1879,"MRW I told my friend to Google search Christina Hendricks and he responded with ""Ew, her boobs are bigger than my head"""
1364499940.0,1879,MRW I see boobs on the front page
1372608269.0,1880,Getting stoned before doing housework
1373121072.0,1877,MRW my ex shows up at a party with her new guy who then dumps her in front of everybody
1375435570.0,1876,MRW I see this GIF reposted for the millionth time
1373243437.0,1874,MRW When I can customize armor colors in video games.
1372255628.0,1875,MRW the first time a girl asked me to go down on her
1359036750.0,1871,"Me, when my roommate's ex-girlfriend calls."
1358523754.0,1875,When a gif takes forever to load
1369221758.0,1877,"MRW the creator of the GIF said it's pronounced ""JIF"""
1355535090.0,1868,When my friend and I see each other out in public.
1349375811.0,1872,When I check my notes after a test
1373846079.0,1874,MRW I check the shipping status on a package
1362501575.0,1873,"When I'm drunk and overhear someone say ""I wanna have sex"""
1358002173.0,1870,MRW My friends tell me I'm too drunk
1356298442.0,1871,When it takes me a while to get the joke
1360889366.0,1871,"When I'm fighting with my SO and she's says ""You're not funny and you never have been!"""
1366587205.0,1868,MFW I'm visiting a friend and there's an electric toothbrush on her night stand.
1375975106.0,1865,MRW a girl invites me to her room to study
1372169936.0,1865,"Took my little nephew to the store, and he asked the cashier, ""How did you get so fat?"""
1370270173.0,1864,Whenever I hang out with my extroverted brother...
1365524022.0,1860,When I tell a Hitler joke around my Jewish friends
1360614105.0,1861,When my friend tells me news that I already saw on reddit...
1365095473.0,1867,My girlfriend is bi. She is leaving for another girl.
1371690937.0,1862,When I saw a guy at a bar turn down a really drunk girl for sex when he realized she was engaged
1365340797.0,1868,After multiple alcoholic beverages.
1341267079.0,1865,Whenever I'm on a quick escalator
1354913373.0,1860,When my teacher says only one student failed the final exam.
1364587225.0,1860,Whenever I'm playing with an open snapple bottle.
1354451699.0,1855,My reaction to most of the replies I get
1373430807.0,1859,MRW my girlfriend sticks her finger up my ass during sex
1368651742.0,1857,Every girl's reaction when their man says no
1374846510.0,1860,MRW our coworker convinces us all to go out for buffalo wings for lunch and then proceeds to order a burger.
1366249863.0,1859,MRW I accidentally delete an entire unsaved essay and use ctrl+z to bring it back
1355866919.0,1859,"When you're having a conversation with someone, and you can tell that everything they are saying is a lie"
1343441044.0,1858,When I look at the alarm clock and I see that I still have one hour more to sleep 
1365542167.0,1852,I've decided to try my hand at making reaction gifs...
1352048486.0,1859,"""you are doing that too much. try again in 9 minutes."""
1350491901.0,1859,In elementary school when I was asked if I liked this girl.
1374592844.0,1857,MRW I see a GIF that I made being used by others and making the front page
1359516451.0,1852,MRW reading through old chats on Facebook
1370006563.0,1854,MRW someone tells me they haven't seen The Fifth Element.
1375575110.0,1853,MRW I reveal I am a woman on Reddit
1364654503.0,1852,When my mother showed me the 2003 Nokia phone she just bought
1361335579.0,1850,MRW I will never be famous on YouTube
1352409010.0,1853,When my vet told me that I had a very happy and healthy kitty 
1373293522.0,1851,MRW my gf asks what I want
1367173788.0,1847,MRW My drunken friend is acting like an idiot and my other friends try to get him to calm down.
1368643917.0,1846,MRW someone says being gay is a choice
1359861172.0,1843,As soon as you get home from an event that required you to dress up
1375270402.0,1851,MRW I'm at a concert and recognize a song halfway through [OC]
1354980274.0,1840,When a friend is stuck in a video game and I ask him to let me try...and beat it the first time.
1346769223.0,1842,When I get to class early and it's just me and the teacher
1363705150.0,1844,When i walk behind a girl wearing yoga pants.
1361491287.0,1846,When a girl tells me she likes 'bad boys'
1373425052.0,1843,MRW I see this gif after I haven't seen it in a while
1356311796.0,1845,"When my mom called some burnt cookies ""nigger cakes"""
1331081882.0,1845,This is me when I overhear someone talking about reddit
1371736260.0,1844,MRW I get my first paycheck from my new office job
