created_utc,score,title
1362652066.0,1036,TV4 in Sweden will start an E-sport  show. TV4 is the second biggest tv channel in Sweden.
1360843983.0,1029,The 98% 
1314372302.0,1040,An alternative to the baneling kill counter.
1314291469.0,1038,Starcraft invades valencia
1368867893.0,1033,StarCrafts Season 2 Episode 4: Core Values
1339707112.0,1033,I don't think they could have found better pictures for this!
1314549776.0,1032,So I have idras f4 key after he slammed his headset and I tried to give it back and he looked at it and walked away...
1311205371.0,1030,My work is doing it wrong...
1308984604.0,1026,Slayers`BoxeR gives BW Pro-gamer Yellow SC2 as retirement gift
1373824931.0,1029,"Ladies and gentlemen, an AI vs AI game has actually been casted"
1354879120.0,1031,And casters shall never miss (or have to search) for a nuke again!
1363479795.0,1030,Too much money earned in one picture
1358283982.0,1032,"why play BW custom maps in sc2, when you can play sc2 custom maps in BW?"
1340528578.0,1026,"Totalbiscuit calls out EG during Real Talk, making some very good points about their team house set-up."
1336213266.0,1027,WTF?! DAT CROWD AT IRON SQUID!
1354942575.0,1030,Unholy alliance at proleague
1375235224.0,1026,#supportCNesports
1339301217.0,1024,[s] MarineKing takes down Stephano in one of the best series so far at MLG Anaheim.
1367095466.0,1026,Naniwa after proxy gating Jaedong
1348408096.0,1027,"Idea, make the siege tank range indicators coloured."
1348758549.0,1027,"By Request, I am Genna Bain, Owner of Axiom. AMA!"
1333752144.0,1028,"ST_Legend is by FAR the best IN-game observer, Give him all your love!"
1367399841.0,1026,"Suggestion: ""Ladder Map Pool"" as a category in custom games?"
1358641564.0,1023,StarCrafts episode 22 Phoenix Down - YouTube
1347371619.0,1020,As requested Sir Scoots with his Dirty Money Upvotes
1338299752.0,1022,Day 9 and Khaldor Have An Interesting Conversation
1322894978.0,1019,"Dear NASL, I have worked in professional sports broadcasting"
1374331301.0,1022,StarCrafts Season 2 Episode 11 Power Overwhelming
1336827608.0,1024,Thanks for the birthday heart attack Hotbid..
1325283124.0,1020,Adding to the million replay ideas- It would be cool if we could watch replays from this perspective
1369009447.0,1015,Huk miss choosed zerg and his opponent ask him if he's idra then huk acted like it
1362157546.0,1020,"Bogey spotted over Federation Square in Melbourne, Australia."
1327966447.0,1020,How interested would /r/starcraft be in a website like this?
1352158361.0,1021,TvZ - Give Tanks hold fire
1365795525.0,1023,Baby Abathur
1336436786.0,1020,"As an American, I think this is how decisions are made about Starcraft"
1345707723.0,1021,"KeSPA has failed us, players won't be in GSL Code A Qualifiers"
1339835104.0,1014,"Husky learns that making polls with ""your own suggestion"" is a bad idea"
1332174269.0,1019,If you LOVED the Red Bull Lan and the Lone Star Clash-- Let the Sponsors Know!
1325767133.0,1012,Homestory Cup 4 - Starcraft 2 Survival Guide
1353759735.0,1021,Grubby's reaction when he won from MC
1346840316.0,1019,Reddit status: TOLD
1340217401.0,1016,"After TLO, IdrA. Please keep telling him."
1339866822.0,1018,Just wanted to say thanks again to the Dream Hack Admins for providing free HD streaming Quality.
1335381923.0,1018,"TSL 4 announced, to be sponsored by Razer!"
1347737959.0,1016,Thorzain's biggest fan
1329103157.0,1012,Forever Alone Bronze
1374241209.0,1013,"Watching DreamHack, when suddenly..."
1375730302.0,1011,"A little ""motivation""."
1346169070.0,1016,"Blizzard has put in 504,600$ in WCS + 104 Paid trips!(Not including the WorldFinals)"
1367325674.0,1013,"PSA: AllianceNaniwa is not real Naniwa, cut off his hands please"
1314320672.0,1014,We're on the way to MLG Raleigh and my friend gets this from his mom
1309844352.0,1014,Destiny's Four Infestor Hit Squad 
1326446066.0,1007,M.U.L.E efficiency
1374503244.0,1010,My friend drew me a picture of a baneling bust for my birthday.
1318775010.0,1009,Looks like he never left...
1366837886.0,1009,MIND TIME WITH ARTOSIS
1336795162.0,1004,"GIGABYTE doesn't want Destiny to cast for them, due to 3 emails to the company calling him a racist."
1330433243.0,1013,Definition of a nerd-baller
1356354038.0,1007,Stumbled across this on wolf's facebook page...
1338093296.0,1002,John The Mother Fucking Translator
1337799453.0,1009,r/Starcraft I am offering 1 hour lessons by donation to help with my dog's surgery. Masters Terran.
1320671466.0,1006,Day9 plays Amnesia: ILLUSTRATED!
1351857097.0,1002,Was pleased to see that Blizzard is spreading the word of eSports through loading screens.
1372205881.0,1010,SeleCT's reaction to IdrA rage
1320736067.0,1007,A reminder of the beautiful side of the game: The Emperor and the Dream
1375554052.0,1004,Idra and Khaldor are the kind of casting team that will make me keep watching a tournament even after my players have been eliminated.
1370338848.0,1001,TLO and Stephano in the same WCS group - the trash talk has begun!
1366142294.0,1009,Not another hype-movie about Thorzain and HerO
1357955889.0,997,Khaldor speaks out against r/Starcraft hate towards Goswser. I also think you guys were pretty harsh on him
1341411152.0,1000,[s] Khaldor approves Naniwa's victory
1371749868.0,1004,Best casting team ever
1370053032.0,1000,SeleCT gets GM after being back for only 7 days!
1362444770.0,1000,IPL6 canceled
1350148224.0,999,The irony is strong with Stephano...
1372617090.0,997,MLG Sign Guy
1361120352.0,1000,"FYI, your oppenents league is shown at the loading screen before the match starts."
1363011332.0,1000,"Dustin ""the Rock"" Browder, Signed my rock."
1331071934.0,1000,I blame blizzard for making my friend say this.
1327711469.0,998,Timing
1320600568.0,998,So I got my brother to do the fusion core dance on national tv
1346593471.0,1003,Stephanos epic comeback/hold against a stream sniper
1368647350.0,995,Naniwa BM
1340006606.0,995,Cleaned an old keyboard because my daughter wanted to be like her dad. She ran to place it in front of the TV that was playing the GESL and started spamming the keys. Proud dad is proud. :)
1353171793.0,996,It would be so cool if Day[9] and Tasteless would cast Lucifron vs Vortix!
1362742858.0,997,Glorious delivery just came to the store!
1333284529.0,991,Player reactions to IEM banning Koreans from their tournaments
1316788829.0,993,We can do it !
1315669163.0,988,Stream Viewers Guide to Enjoyable Stream Watching
1366561960.0,993,The Paradox of Universe Creator &amp; God
1353207126.0,995,Day9 and Tasteless casting together - Finally!
1322421222.0,992,I create Trading Card Games for my own amusement - Here's a Starcraft concept!
1320245591.0,993,Brood War - A huge introductory post
1321628887.0,992,[MLG Providence] Starcraft 2 Survival Guide
1333912511.0,990,Here's Dragon after he revealed he went to a strip show.
1316295335.0,994,Zerg Parody
1376552834.0,992,Its Khaldor's Birthday
1366925474.0,992,Suppy to Demuslim
1336955359.0,991,This is just idiotic.  There has to be a better way.  
1336402655.0,993,Jumping Jacks
1334353238.0,988,HuK vs. Naniwa Incredible Micro Duel from MLG Winter Arena LR7
1369005552.0,992,[Temp0] Unit Rap Battles Of Starcraft: Marine Vs Hellbat
1327911706.0,993,Look who I saw when skating in Seoul!
1327324051.0,990,All Starcraft has done for me is make me realize how fucking stupid I am
1350167172.0,982,My Epic Pumpkin
1337426042.0,988,[s] LG-IMMVP wins 2012 GSL Code S Finals 4-3 over ST_Squirtle!
1317789324.0,987,Intel's response to the SC2 community on reddit
1305320574.0,987,"Yeah, he's going Zerg"
1368140350.0,991,"Wow, TL. Harsh."
1361772943.0,980,Squirtle joins LG-IM
1326202124.0,985,Oh Stephano...
1355651980.0,980,Epic as fuck speech about Steve the Stalker
1345913955.0,982,Gay[4] Day[9]
1343730181.0,987,RaceSwap: Terran Roach
1332042196.0,983,"Thanks Red Bull, couldn't say it better myself."
1325106848.0,983,"Sometimes you get a screenshot that belongs on the 
inside flap of the game box."
1349931699.0,984,Please come back SotG
1342408573.0,982,[s] NASL 3 finals
1303706038.0,984,DAE think spectators/replays should be able to do this? [mockup]
1356420136.0,977,EG-TL comes back from 0-3 to win 4-3 vs 8th Team in Proleague!!
1342996687.0,979,"[s] Liquid`Taeja beats SayerS Alicia 4-2 to win MLG 
Summer Arena 2012!"
1342373211.0,979,"Hi /r/starcraft, a message from /r/tribes"
1357103208.0,984,MajOr to KeSPA Team 8
1336903861.0,977,The. Beard. Has. Gone!
1327542448.0,979,How the forums will read the community questions on balance.
1320501645.0,975,This is highly relevant to today's front page.
1342556687.0,978,The Energy Drink for Zergs
1308197884.0,983,Beats playing TvT
1374904769.0,981,This is how Khaldor does the first person APM video
1361966640.0,979,KT_Flash dominates SKRain 2-0 to advance to Code S!
1360540254.0,975,Grubby had some fun with IdrA
1308240657.0,975,This picture gets me every time.
1345814139.0,978,"After ESF's threat of boycotting OSL, KeSPA decided to participate GSL Season 5 | ESFI World"
1344501696.0,978,Starcraft football
1308195556.0,975,"I'm ""Husky"", AMAA"
1325603459.0,971,"Found this on my hotel bed, I guess my housekeeper is a starcraft fan!"
1353206841.0,974,Wish granted! The brothers will cast the brothers!
1330160177.0,970,In honor of TotalBiscuit's new image.
1351340349.0,970, StarCrafts Halloween Special by CarbotAnimations
1350158122.0,965,TLO special tactics
1339354522.0,968,New Heart of the Swarm unit I'm most excited about.
1363306037.0,972,Newegg Sponsors compLexity Gaming
1334127735.0,965,Thanks for pointing this out Huk
1332541705.0,970,MLG - Please get Stephano vs Polt in OB Round 5 on Main Stage
1330548889.0,967,Twitch.tv actually delivered
1323722460.0,969,Starcraft 2 for the Holidays
1367698488.0,961,"someone just hacked all my accounts, people need to know"
1344976765.0,967,Apology from IPL and a promise moving forward
1321449419.0,967,My work got me a leaving present :D
1372640781.0,963,[MLG Spring Championship 2013] Grand Final Results
1368237332.0,965,Couldn't help but hear this when reading r/science.
1349894904.0,972,Protoss Identity: Power and Cost
1348988276.0,965,I believe
1337496574.0,965,Tastosis last night during the vortex
1335843379.0,964,Question about decision making by Polt.
1311782565.0,961,Starcraft decals giveaway - details in comments
1357981426.0,965,"Welcome to Proleague, Stephano"
1354339914.0,963,[s]Ryung telling it like it is
1326068896.0,966,"Congrats to oGs.MC, Homestory Cup 4 Champion after sweeping StarTale.Sound 4-0"
1365950808.0,964,"The chat that comes after a pause when GM player ""Revolver"" looses in the WCS qualifier"
1352643137.0,966,TIL That Probes mine 18% faster than SCVs in Brood War
1332268988.0,968,Stephano and iNcontroL exchanging formalities on ladder
1363623666.0,965,David Kim: HoTS Thoughts 3/18/2013
1324661011.0,964,Please help convince eSports websites to move their hosting + domains off GoDaddy.com (they are supporting SOPA)
1312400319.0,962,New Fragrance for Men!
1366660752.0,962,Support NASL staying in Starcraft 2 e-sports scene
1333508490.0,955,"[FIXED] ""So i just won a game on ladder by dueling a guy in guitar solos..."""
1331951085.0,960,Idra Doesn't Give A Fuck
1324598996.0,965,Everything is OP
1369500141.0,960,This is where the WCS Season 1Finals will be held in Korea
1357979746.0,963,You do not GL HF in ProLeague
1361887303.0,956,Soulkey weakness
1349646941.0,957,StarCraft 2 for $9.98 at Best Buy through Price Matching from Toys R Us!
1371813282.0,957,Good guy Ryung
1320076289.0,957,Prize money in Starcraft 2
1318463630.0,957,Problem Blizzard? 
1314582197.0,958,*Update* Idras F4 key now in possession of it's rightful owner...Trimaster.
1366609548.0,959,Can we keep the MLG management separate from the MLG casters? Axeltoss and Axslav did great this weekend
1324411372.0,952,It's Season 5... press it.
1323131851.0,957,In the Spirit of the Season
1374532740.0,952,Remember this rule? Blizzard logic.
1353722990.0,952,They are called what now?
1333092961.0,948,"""TaeJa"" - Stupid nick? :D"
1345797333.0,955,"ESPORTS Federation players agree to boycott OSL - Mvp, Nestea, DRG, MKP, MC, PartinG, SeeD out, Oz still in."
1329415644.0,952,What I wake up to most mornings
1365448993.0,949,The full story: Blizzard purchasing IGNProLeague technology and assets
1342488080.0,951,Kicked out of Slayers house &amp; down to the B team; MMA wants to move to a foreign team
1340645057.0,954,Why I would like to host the NASL Season 3 Finals
1347273824.0,952,"Blizzard should implement a ""zoom out"" function for observers."
1324268732.0,948,Destiny partied Kim Jong Il to death
1368583409.0,949,"Blizzard's David Kim, InControl, and Nony on State of the Game this Friday!"
1331874665.0,951,This is a major problem with /r/starcraft on a relatively small scale.
1325969608.0,948,MarineKingPrime in scooby doo :O
1325542857.0,945,White-Ra Demonstrates how to Multitask
1321309051.0,948,Happy birthday White-Ra
1365448688.0,944,Blizzard buys IPL
1359187041.0,945,"[SPL] Well, this is awkward..."
1347815613.0,945,Somehow I don't think Stephano would..
1334462738.0,949,:)
1333627329.0,946,Another very underused tactic for improving
1363941138.0,943,ARTOSIS'S ABOMINATION OF A STREAM
1363037154.0,949,Carbot version of the Hots Trailer
1331576985.0,945,Patch 1.5 is Coming!
1343046446.0,943,Was walking through Stockholm when I saw this.
1337892322.0,947,And the MLG Spring Championship’s 8 KeSPA Players Are…
1360679587.0,947,"Happy Birthday to the King, LGIMMVP."
1333954387.0,938,"[s] Fnatic's aLive wins IPL 4! Defeating players including DRG, GanZi, PuMa, TAiLS, PartinG, Polt, MKP, Nestea, and Squirtle, going 30-11 overall!"
1320979260.0,946,True immortals
1369649539.0,944,"Popularity of StarCraft, League of Legends and Broodwar in Korea"
1346008984.0,937,"Rather than give that other MLG Raleigh article so much attention and views, let's give this writer the views for writing a much better article in the first place!"
1325638757.0,944,yep...
1318280953.0,943,How Idra gets women
1312072578.0,941,Most mannered player in Esports - Gimix
1334012496.0,934,CatsPajamas wants to know if we want an AMA with him. Let's show him we do!!
1325439353.0,943,No comment
1323127260.0,937,I know the feeling...
1314628437.0,942,What America really needs to solve the economic crisis.
1324400945.0,935,TotalBiscuit Sings Santa Baby as promised
1341042579.0,936,5000 Lego pieces Starcraft Siege Tank
1328449501.0,939,A bit of whimsy on my Cake Day...
1326686140.0,933,How Blizzard Killed a Tournament
1318370481.0,939,Well if he brought back Arrested Development...
1375357951.0,933,"A major, yet overlooked, new feature in 2.0.10 - Map Symmetry in the editor."
1325802511.0,934,Team Liquid no longer registered with GoDaddy!
1313096804.0,939,"Blizz, please change Toss upgrade art/colors"
1358797671.0,934,"Brood Lord plushie I made a friend for Christmas, thought you guys might like it! [x-post from r/somethingimade]"
1352356672.0,933,Gom using TwitchTV(for the free streams) is fantastic
1341648238.0,939,Day[9] in Makeup!
1335917315.0,939,The most important event in the history of competitive SC2 is about to take place. Info and updates in this thread.
1371114548.0,935,Innovation vs Soulkey WCS KR Game 1 Recap
1361474786.0,929,Poor zerglings
1348187288.0,927,And now he's no longer in Plat
1342027416.0,932,Something I was thinking would be quite nice for a long time.
1335116438.0,933,Geoff Robinson appreciation thread!
1328829498.0,934,"As requested, my first overlay for redditors (link inside)"
1319213307.0,932,"As requested, my brother just sent me pics of the new Terran and Protoss units from Blizzcon as well!"
1353861863.0,934,"Blizzard, we want this guy for Legacy of the Void!"
1346095521.0,937,Startale chooses SC2 over LoL. FruitDealer and Startale's LoL team disbands to focus mainly on SC2.
1355725334.0,934,HotS bronze player 'adlp' switching to Zerg after maining Protoss for 2 years.
1354957269.0,928,HuK's thoughts on Xel'Naga Watch Towers
1334399656.0,931,How to win on NA with Google Translate
1328517466.0,930,I will sponsor and cast a showmatch between erika and ScottyJamoka! 25$ for the winner!
1319774228.0,932,Kid from The Office really needs to work on his macro
1299673055.0,928,Artosis' NASL Application video - please vote for me! (Link in the video description).
1328561288.0,931,a plea to incontrol 
1372972606.0,930,"150k subscribers, glad to see the community growing :)"
1351300448.0,929,Minerals/Gas in resources lost tab. Anyone else?
1329823298.0,925,Looks like July is the evil twin of Leenock
1300961529.0,930,I had forgotten about this gem.  Good ol Tasteless.
1370506953.0,929,SeleCT's Bunker SCV Micro
1365279972.0,929,Blizzard pls give us High Models on Low Shaders like in WoL!
1354999994.0,926,StarCrafts NASL Season 4 Grand Finals Promo
1328859443.0,924,What I always think when I hear...
1345884971.0,922,Wait is he.... is he happy?
1336181242.0,931,ZvP in a nutshell
1335542391.0,926,Google; promoting eSports one step at a time
1322553632.0,926,"Jim Raynor personalized his Wikipedia page, just click on the voice sample! "
1322333087.0,926,"Seriously, don't boo the street fighter gamers"
1370869444.0,928,Baneling....BALLLOOOOONNNSS XD
1323163248.0,926,Good luck have fun!
1366502690.0,926,CatZ's loses to a known hacker in the WCS NA. T_T wtf.
1340064600.0,924,"Now that DHS2012 is over, how about we tell Swedish television we liked what they did?"
1334153392.0,926,PvZ with White-Ra
1369937049.0,924,LucifroN &amp; VortiX join mousesports to form strongest StarCraft II division in franchise history
1344082281.0,924,[s] JangBi LAST BW champion ! JangBi 3-1 Fantasy!!
1322096367.0,924,Nothing counters marines
1317223435.0,927,Always Good For A Surprise
1313628547.0,925,"So we moved offices, and these are our new conference rooms..."
1371852643.0,922,The voice of an angel
1363500611.0,918,Life vs Polt Game 5: an over-the-top casting silliness and a devoted crowd screaming at every bit of action.  Great way to end Day 2.
1332699843.0,921,"Damn, MLG's stream doesn't lie about the ""Low Quality"" Option..."
1315371365.0,921,Day9 will be streaming Diablo 3 beta tomorrow!
1361995617.0,920,GameHeart Overlay 2.0  -  Lots of new features.
1354624917.0,920,[SHOUTOUT] A huge thank you to everyone who contributes to Liquipedia
1375819525.0,916,Stephano sums up his career - His last words to the community
1368484346.0,916,The secret weapon
1359469465.0,919,Temp0 - A.L.I.V.E (Asher Roth - G.R.I.N.D SC2 Remix)
1347804985.0,917,"Good job reddit, good job!"
