created_utc,score,title
1353151731.0,1283,"I made this gif LONG time ago, waiting for the opportunity."
1318546446.0,1276,"My mom is now cooler than I am
	"
1345052405.0,1277,Blizzard announces that they will start inviting people into the HOTS Beta soon!
1373643714.0,1274,"US government officially recognizes League of Legends as a sport on par with NBA,NFL,NHL and LoL pros can get Visas now. Why isn't this happening for Starcraft 2 and how can we make it happen?"
1337560608.0,1273,Everyone misses the first jump...
1318952779.0,1278,"This paralyzed quadriplegic is playing SC2 to raise money for a new seat cushion, but he only has 20 viewers!"
1373037302.0,1272,Did you know that? (scouting trick!)
1352084301.0,1271,Starcraft to Scale (warning: 5200x7000)
1304070700.0,1273,Real Scale Starcraft? I Tried...
1352581559.0,1275,True Building Costs and other Hidden Costs in SC2
1370405167.0,1272,Idra promises to stream for at least 4 hours being over-the-top mannered if Zerg wins the next GSL!
1358949228.0,1265,"Dimaga has finally won the wedding honeymoon trip to UAE. As a thank you gift for supporting him, here are the some more of his wedding pics"
1375179209.0,1267,Maru defeats INnoVation 4-0 in WCS Korea!
1370978023.0,1267,"wow, I didn't even know there was Dreamhack this weekend, HYPE IT UP!"
1360152186.0,1275,The End of An Era
1354446460.0,1271,StarCrafts Episode 16: Shadow Of A Colossus
1346011829.0,1269,This guy.
1366400641.0,1270,DeMusliM's mom just tweeted this
1332641428.0,1263,So I was getting a photo with DeMusliM and this guy photo bombed me! 
1352456429.0,1266,"Idea for tournaments: In the dead space in the in-game UI, instead of player cams, put the first person view of each player."
1341410938.0,1265,"[s] Naniwa advances to Code S round of 8, for the second consecutive season!"
1330304580.0,1266,[s] MarineKingPrime wins MLG Winter Arena!!!
1366791594.0,1263,SHOUTcraft America
1313908879.0,1266,"Official ""Get Day[9] to stream himself playing 
Amnesia!"" rally. "
1313358478.0,1263,How a 4 hour plane ride became a starcraft extravaganza. 
1345131131.0,1262,Jaedong's surround tonight at GSL
1339455462.0,1254,"Dear MLG, I know how to fix your problem with anti-climactic endings. Please someone read this!"
1361815767.0,1259,"Got this awesome gift for my bday from my mother-in-law. A knitted Teamliquid sweater, took her about 3 weeks to knit &lt;3"
1335131260.0,1258,[s] ThorZain defeats Polt 3-1 to win DreamHack Stockholm!
1333850920.0,1253,Can we get LAN yet?
1334609288.0,1256,Starcraft on The Oatmeal
1354170004.0,1251,Lego Infestor
1371495439.0,1251,Props to StarDust for trying to talk in English for his interviews
1364123822.0,1257,Lego Mutalisk
1359332995.0,1258,Anna Prosser updates us with InControl's hospital visit (from Facebook)
1358707457.0,1254,Apollo celebrates
1363545344.0,1250,My freshly infested stream overlay
1351971585.0,1255,That's not very nice Liquipedia. 
1330770920.0,1254,"[s] Congratulations to DRG, GSL Code S Champion!"
1328735672.0,1251,Taiwan Barcraft Poster
1376223708.0,1256,ReDeYe TOP3 control
1337131283.0,1253,"Perhaps you remember me, my name is ROOT"
1342690091.0,1246,All the fucks from Tasteless
1318736819.0,1246,"After all the players left for the day, one remained to practice. "
1325885076.0,1252,HomeStory Cup is so awesome that we've decided to donate an extra $5000 to the prize pool. We &lt;3 ESPORTS!
1320404274.0,1245,Artosis' going to be a dad! ♥
1348436694.0,1253,"[s] Congratulations to Liquid`Taeja, Dreamhack Eizo Valencia champion, for defeating Mill_ForGG in the Finals."
1344848131.0,1251,Quick Match just trolled me...
1316190394.0,1247,Do you macro like a pro?
1368078424.0,1248,IdrA's Perfect Mindset
1314572767.0,1242,"5,000 upvotes for Day[9]"
1364263632.0,1241,"I have a terran friend who loves killing his SCVs, so I made this comic for him."
1374023851.0,1244,The Missile Turret Guy
1361064150.0,1235,Vengeance is complete
1320152267.0,1241,After 60 Ladder Games Today This Moment Finally Arrived!
1371931987.0,1241,"Stephano, doing his thing"
1369477364.0,1233,StarCrafts Season 2: Episode 5: Mine For The Taking
1352033271.0,1240,Words of wisdom from an old man.
1351197636.0,1240,My new T-Shirt arrived today. Nobody at work understood it...
1321904866.0,1239,Not showering is Ruining E-Sports
1355481948.0,1233,StarCraft Logic
1363549523.0,1231,"Dear David Kim, please don't make any balance updates for the next few months, thank you."
1340406582.0,1235,Funniest moment in Liquid Rising 
1339259626.0,1239,Some men just want to watch the world burn...
1331845879.0,1236,"Please hire this man, Blizzard!"
1322124544.0,1233,"Husky visits a sick fan in the hospital and donates 
blood. What a guy!"
1329285394.0,1232,"Ever BM'ed so hard on Ladder that Temp0, Suspense, &amp; iNcontroL made a rap [SONG] about it? "
1347223115.0,1227,[HOTS] White-Ra [P] vs Ourk [T] - Macro PvT with my comments and analis after game Enjoy! also pls subscribe to support me
1362329431.0,1230,Tyler leaves Liquid
1367885639.0,1232,A true American hero! EG.Suppy goes 4-0 in his WCS America group vs 2 Korean Terrans. He is currently the only American in the ro16!
1350777218.0,1226,Carbot Episode 10 Onslaught
1366340247.0,1224,Infested Medic
1363442801.0,1225,Jim Raynor on Women
1338239511.0,1228,Epic New Way to Manner Mule - Masters TvT
1368190080.0,1224,Zoo Zoo Bubble GSL Edition
1351682912.0,1224,"""Coming in the next beta patch will be some added functionality for observers, including the ability to completely mod the interface from top to bottom."""
1365304203.0,1228,"Scarlet, there is no shame in eating corn!"
1353792967.0,1223,[Spoiler] Liquid`HerO 4-0's Liquid`TaeJa to win DreamHack Winter. He is the only Starcraft 2 player with two DreamHack championships to his name.
1308671844.0,1219,So I heard you guys don't like the new maps...
1370066435.0,1223,INnoVation vs. Soulkey begins NOW - get hype for the WCS Korea Grand Finale!
1354246766.0,1221,I have some very exciting news for you guys!
1339470257.0,1226,God approved.
1329138540.0,1223,Happy Valentine's Day /r/starcraft!
1314362671.0,1222,"I am Sen, today is my first time to see Reddit, just want to say hi to everyone! ^^"
1308056435.0,1217,FXOSheth has begun his marathon of gaming for Doctors Without Borders! Come and help a great cause!
1359426718.0,1210,Phoenix Pillow for the Boyfriend. About 2.5 - 3ft from Face to Tail.
1343305977.0,1215,John tweets what the finals stage looks like completed:
1341812141.0,1218,My favourite sign at HSCV.
1355425584.0,1217,"The ""Virtual Jersey"" version of Starboard WIP. A push for better sponsorship ROI in SC2."
1338430874.0,1213,"How about some BW history? Incontrol vs Ret, Blizzcon 2009"
1339577403.0,1209,"Oh shit, the pressure is on this season."
1375986006.0,1211,"If MLG is truly dropping starcraft 2 ,don't forget to cancel your MLG gold membership for those who are subscribed!"
1365577439.0,1211,"My views on WCS/Regional based leagues, region locking and the importance of developing the International Scene."
1345551038.0,1214,Stephano to sign with Evil Geniuses when his Millenium contract ends September 1st
1368244349.0,1209,Idra to do Real Talk with JP tomorrow!
1356105593.0,1211,"Cute handmade ling, overlord and pool from carbot"
1350722711.0,1210,New idea for UI desing
1332696843.0,1209,"Dear MLG, PLEASE stop the ""extended series"" system! When a rematch occurs, we want to enjoy it in its full epicness rather than seeing an already decided game."
1370661049.0,1212,OGN has decided to removed the paywall on the VODs
1359057624.0,1213,New Replay and Resume Features Coming in Heart of the Swarm
1359235018.0,1205,LIFE MAKES AN INCREDIBLE COMEBACK VS DRG TO TAKE THE IRON SQUID 4-3!
1355430781.0,1211,"I love Carbot's videos, so I made myself a zergling plushie!"
1367776522.0,1203,Shoutcraft America Group A is live on Twitch!
1334249160.0,1205,I often do 1 hour speed paints. Here is one of a Speedling run by.
1364206399.0,1205,"This is a Screenshot from my android phone, it Is playable!"
1336848164.0,1202,"Oh, Flash"
1309334101.0,1204,Destiny announces on stream that the producer of Judge Judy wants his case!
1338007976.0,1199,Nestea Trailer
1326307281.0,1200,Here's a Thor made out of Legos.
1365442750.0,1194,Scumbag MaSsan
1351965767.0,1196,"Blizzard, can you bring back this simple feature please?"
1302125125.0,1197,this.. turned out a little weird.
1356691492.0,1194,Stephano participating in the next GSL Code S! 
1327393039.0,1201,"And now that's done, time to never play this game again."
1366667327.0,1195,Apology to the StarCraft Community - How we will improve
1366308345.0,1194,It's funny because it's true.
1333937750.0,1191,"Sponsors! Please use the players you support in your commercials, the Machine commercials have been amazing! "
1343873495.0,1194,This is how I go to sleep every night.
1341509339.0,1194,Did anybody notice what BoxeR is doing in this picture of Jessica (from the wedding series appeared on a magazine)? He IS the Emperor!
1346110845.0,1187,GanZi dancing to Gangnam Style (starts at 1:50)
1363259535.0,1191,New worker status hides nuke dot
1350481550.0,1188,Can't explain how empty i felt inside when i looked up Reddit today.
1321400273.0,1191,Knitted Mutalisk Marionette (x-post from /r/gaming)
1371425486.0,1188,Picture of me and Grubby :)
1363081042.0,1185,The Kerrigan-Raynor family
1336117398.0,1191,"What Dragon did when someone called him ""Mr. Porn"" and he didn't know the meaning...."
1334321039.0,1182,Class Act HD
1329390418.0,1186,The complete original Starcraft 1 campaign has been remade in Starcraft 2
1337030899.0,1191,Skill levels according to 1v1 obs snobs.
1340646317.0,1189,QuanticIllusion's bunker/marine micro - this kid is going places
1358905850.0,1188,That moment when you realize you drew a penis - Axslav on Rules of Engagement
1333370110.0,1186,"Day9 playing a board game with Wil Wheaton, Grant Imahara and Jenna Busch on the new show Table Top"
1375740377.0,1183,GRUBBY WINS 2:1 VS MVP EUROPE DEFENDS
1347818540.0,1184,Grubby removing the huge smile from his face before shaking hands with Nerchio
1322681342.0,1180,Top Ranked Chess Player Getting into Starcraft ! I would greatly appreciate your support! 
1308251647.0,1183,"Some men aren't looking for anything logical, like money. They can't be bought, bullied, reasoned or negotiated with."
1329876619.0,1187,Sheth all-kills EG in IPL Team Arena
1348168986.0,1182,Election Night 2012.  District: Tal Darim Altar
1322328963.0,1186,"Dreamhack you're spoiling us! 1080p, Heart Monitor, Player cams. All COMPLETELY FREE. Kudos."
1325654066.0,1175,Re: Shirt and Artosis
1340551383.0,1178,2GD made Apollo an overlay
1334315674.0,1174,"[s] QuaniticNaNiwa, the only foreigner in code S advances from his group!!! SWEDEN FIGHTING! "
1362352071.0,1173,"Congrats to Chad ""Motherfucking"" Jones (Minigun) for his 3-0 win over Idra, qualifying him for MLG"
1355100052.0,1177,hyun massage gif
1363566908.0,1175,The great face-off
1356801947.0,1179,"Ian, the immortal Immortal"
1346434600.0,1173,I made a streaming application so I could stream startcraft.  Now it's open source and free for everyone
1327437175.0,1168,Update on the 'Drawing Starcraft to Scale' Project...
1357661514.0,1166,100 Reasons why LoL is better than SC2.
1304807066.0,1166,This is John Waite. He's running for city council in my town. Here he is dressed as a Starcraft Marine.
1354749814.0,1173,[HotS] Beta Balance Update #8
1329773434.0,1167,Life was nice for the Colossus before there was war
1351116679.0,1165,ROOT Gaming Team now sponsored by DAS Keyboard!
1350829803.0,1160,Ireland - the last bastion.
1369918686.0,1163,It took my way to long to figure out what numbers next to the player names meant. For those of you who still don't know.
1364309284.0,1165,Dragon shows us how to shut down a proxy pylon
1352667472.0,1165,Hired a graphic designer to make my idea come to life. Look for me and my poster at IPL5/GSL Finals!
1351083580.0,1163,"Yo r/starcraft, i think it is time that we get a [Drama] tag, so i can avoid it if want to."
1335983275.0,1166,Finally someone said it to him!
1365358074.0,1164,"It's not the balance, it's the visual design."
1355109350.0,1166,"Liquid`HerO Wins NASL4, Defeats AZUBU`viOLet 4-2"
1352185171.0,1161,"How are you? I’m MKP.
Thank you, Reddit!!
With a big event, Prime's 2nd live stream is coming!
"
1328738013.0,1161,Then I worked on my TvT
1324126386.0,1161,SlayerS`MMA wins the 2011 GSL Blizzard Cup
1352077641.0,1159,"Startale.Life wins MLG Dallas 4:3 over FXO.Leenock!
"
1338854260.0,1154,Artosis discovers webcam effects 
1341429386.0,1159,Other Games Casted Like Starcraft
1373414671.0,1155,"Announcing StarCraft 2 League Season 1, Powered by D-Link!"
1349443541.0,1155,"Protoss Hero and Void Walker - Concept Art by Phill-
ArtDigital"
1375585326.0,1153,"""Scientific"" statistical win/loss analysis"
1334349729.0,1153,Destiny on the importance of injections
1353275452.0,1153,Day9 and dApollo talking about Mindgames - BWC Finals between games
1367086499.0,1159,iNcontroL appreciation thread
1339493741.0,1151,My take on the MLG player area situation
1310479944.0,1152,"/r/starcraft, I present to you ""One Year Down"": a montage and recap of StarCraft 2's first year as an eSport."
1374613657.0,1149,Team Dignitas welcomes back SeleCT
1346983731.0,1149,Nobody cares if you got GM in HotS beta.
1335750714.0,1147,10 pool
1351671338.0,1155,You want to watch GSL at Twitch and/or Own3d? Then show GOM how much you like it!
1339800796.0,1155,MLG Anaheim 2012 
1329951617.0,1148,I am MrBitter's girlfriend and this is what I wake up to every morning...AMA.
1346898746.0,1149,Story of my HOTS beta so far!
1348814310.0,1149,A Meaningful Promotion
1351093141.0,1150,Mapping out the Metagame - by Artosis
1350994501.0,1141,"This community needs some more positivity, SC2 is awesome!"
1339074592.0,1140,Would pay anything for another one of these.
1369979056.0,1143,Merciful Flash
1347111082.0,1145,I truly believe this quote applies to a lot more than just e-sports.
1364618337.0,1149,Smack Talk Gets Ironic
1354768815.0,1142,New in HotS: AI Builds! 
1353747361.0,1142,Carbot Animations Episode 15 - Attention Seeker
1350494709.0,1141,I still like playing this game.
1373180363.0,1139,I won my first tournament! :D
1336704484.0,1144,"Hi, I'm a hobbyist multimedia artist I designed an All-In-One Battle.net game launcher."
1332111787.0,1139,[s] Grubby reacting to his 2-1 victory over viOLet in Lone Star Clash
1361011417.0,1139,3 years of Starcraft 2 Wings of Liberty
1337423274.0,1142,CALL 911 I NEED MEDICAL ATTENTION!!!!!!! DAT ARCHON TOILET!!!!!
1373717044.0,1138,StarCrafts Season 2 Episode 10 Nucleared
1362483068.0,1132,Good Guy Slivko
1308356714.0,1139,40 Nukes in a single game at MLG Columbus set to 1812 Overture -- Adam Contini (video editor) rules
1371348766.0,1132,The Most Satisfying Pylon I've Ever Built!!!
1335855357.0,1135,The Only Key I Need
1318130803.0,1134,A legend is born.
1356724221.0,1137,Gingerbread Battlecruiser
1314807789.0,1135,Scanner Sweep
1339382809.0,1131,Just the brothers hugging
1332924592.0,1131,Something I realized the other day...
1358315085.0,1129,A conversation between Alex Garfield and EG's sponsors:
1328283920.0,1131,UI still sub-par 2 years later. Why don't we care?
1363185226.0,1133,EG-Liquid name Coach Park as new head coach
1340114767.0,1129,compLexity NaDa Announces Retirement
1333555844.0,1125,"The StarCraft II World Championship Series - 30+ events globally, put on by Blizzard hand-in-hand with partners around the world"
1362988305.0,1128,GOMTV has released all 2011 GSL videos for FREE!
1351379834.0,1125,Just Husky and Day[9]
1351627074.0,1123,[Discussion] Do you know what would be cool? Ranked clan battles like gstl. 
1333379168.0,1117,Listening to Sheth stream...
1362510868.0,1123,"In 24 Hours, We Will Be Hosting an AMA with SC2 Devs on r/IAMA!"
1324635337.0,1117,How does the Immortal know what you've got for Christmas?
1353284104.0,1120,The Surrender of Terran
1333606346.0,1116,"Blizz: If someone messages you, you should be able to respond, regardless of their chat settings."
1361914234.0,1118,White Ra to star in a new film: Skytoss!
1349094877.0,1115,How I feel like a European in r/starcraft
1326754067.0,1116,"3 Months later I decide to check my ""other"" Facebook messages"
1372448988.0,1110,Catz is so cool
1369672597.0,1113,Who's more fabulous?
1326386379.0,1115,State of the Game leaves MLG and returns to being independent 
1368223185.0,1115,IdrA NOT leaving esports :)
1335555922.0,1109,It's my SC2-playing friend's birthday today. Sent him this.
1371148693.0,1114,@RedBull &lt;3 esports
1363372902.0,1111,Kerrigan's strongest ability is...
1351962227.0,1110,Carbot Episode 12.
1320325878.0,1110,The logical next step for /r/sc
1359513991.0,1104,Artosis playing in Code A qualifiers 
1372619902.0,1109,Apollo's and Stephano's little chat after Nani's 4:0 run @MLG
1341781818.0,1111,Thank you Take !
1287462440.0,1112,"Day9 Daily Cancelled Tonight.  After the amazing casts for MLG this weekend, vote this up to let him know we understand he needed a break."
1373946274.0,1108,Spectator Suggestion: Units should briefly glow when an upgrade kicks in
1334959366.0,1111,Patience is a Virtue
1365888179.0,1104,"My girlfriend's amazing birthday gift to me! She has no gaming experience, so knowing that she researched everything to do it makes me feel really special C:"
1361403794.0,1104,"Are you from Toronto? Did you recently give your Reddit user name to a girl? If so, read this."
1370622341.0,1100,"Dear Europe, we listened and bring you Rebroadcasts from OGN (free 720p)"
1362908558.0,1103,Senior Producer requirements at Blizzard
1371912881.0,1105,StarCrafts Season 2 Episode 7 Hellraiser
1356369780.0,1101,Merry Christmas /r/starcraft
1358878731.0,1101,"Blizzard listened to us, ""watch replay"" button coming in the score screen"
1374991067.0,1105,"Today we watched Starcraft played by Koreans casted by a Frenchman, an Australian, and two Brits at a tournament in Shanghai, China organized by A German gaming league and sponsored by an American technology company."
1352550878.0,1100,Tasteless is not having a good time
1323902471.0,1095,"Fuck One, Kill one, Marry one - InControl"
1319394010.0,1098,"A complete list of all multiplayer HOTS changes/additions, now that Blizzcon is over."
1362524301.0,1096,Blizzard stepping it up promoting IEM
1315457169.0,1097,New Match History Idea!!!
1363550887.0,1095,HotS &gt;&gt;&gt;&gt;&gt;&gt;&gt;WoL
1359475361.0,1095,OK r/starcraft. There is something I want to get off my chest about balance whining (hyphen?)
1343778901.0,1090,Does anybody else think this should be in the reverse order?
1339625299.0,1100,100k sick nerd-ballers
1351203403.0,1096,"JP, please run with the most recent SOTG line-up for a little while. It felt like Starcraft."
1330127634.0,1090,"As a zerg player, this is the best feeling ever."
1322484241.0,1093,Just CEO of DreamHack being baller presenting DreamHack Winter Finals!
1348004009.0,1094,Warhound is gone for good and NO new unit planned for Terran =(
1339614446.0,1087,me with pros at mlg anaheim
1320243703.0,1097,"Oh come on, HuK"
1364840052.0,1094,Thank you RotterdaM
1322352446.0,1090,Congratulation to Hero defeating Puma at Dreamhack!
1370117490.0,1094,Long time no see: Good to see you again Bitterdam!
1349825615.0,1092,StarCrafts Episode 8 Roach Poach
1313048307.0,1088,I made post-it notes to help my friend in the gold league.
1350609913.0,1089,New Stats UI in HotS
1343853610.0,1081,Real Talk with Naniwa
1335284712.0,1093,"Red Bull announces $41,000 ""Battlegrounds"" at Austin City Limits in May; 16 players with casters Day[9], djWHEAT, Husky, Rob Simpson"
1332964720.0,1088,Idra's keyboard
1328503264.0,1085,My division leader takes ladder rank super seriously
1296326758.0,1088,I faced a guy named Subway...
1322454269.0,1083,FoxTrot creator Bill Amend is thinking about doing StarCraft 2 commentaries. Let's encourage him!
1368491575.0,1085,Looks like Artosis saw what he had to say about what he had to say about IdrA
1328249121.0,1086,"""I hate you Tasteless."""
1370689279.0,1084,"Shoutout to Chobra, the Korean host and translator at OGN"
1348283373.0,1079,My high school had an activities fair and for the first year ever our SC club got its own spot...
1337098629.0,1081,I was browsing through the Brood War Liquipedia and found this. How the hell...
1330416492.0,1078,Nailed my TvZ.
1359701820.0,1081,Awesome masked ID tournament idea by TB!  Let's make this happen!
1344681473.0,1084,"HAPPY BIRTHDAY TO TASTELESS FROM SYDNEY, AUSTRALIA!"
1353715712.0,1080,Time Magazine is making an All Time Top 100 Video Games list. Lets make sure StarCraft is on it!
1333399449.0,1076,TLO Beard Timeline
1299386485.0,1073,Destiny laddering from Bronze with mass Queens on stream right now on smurf account
1328893718.0,1076,Situation Report: Patch 1.4.3
1356757784.0,1074,[s] Thorzain finishes off STX Soul bringing the series to 4-1 and becomes the first Foreigner to win a Proleague match!
1368557247.0,1078,[WCS EU] TLO First To Advance To RO8!
1365541005.0,1074,Just Zergy Things
1366014797.0,1074,Justice is sweet (or why to never give up until it's 100% over)
1323727757.0,1072,40k viewers tomorrow = Artosis &amp; Day9 vs Incontrol &amp; Tyler 2v2
1337606845.0,1069,"This community never ceases to impress me. 
SignCraft!"
1339346273.0,1065,Great call from a great caster
1321666540.0,1073,NANIWA BEATS NESTEA!!!
1332943745.0,1064,This is where Dreamhack plans to hold their ESPORTS event in 2013 (Gallery inside)
1320347262.0,1065,Reddit versus Team Liquid.
1369577728.0,1065,TLO Goes 3-1 Against Lucifron to move on to Korea!
1359196827.0,1067,"What the fuck is this 
 IRON SQUID hired a LIVE ORCHESTRA"
1345227037.0,1066,Artosis pylon art [From TeamLiquid]
1367799948.0,1063,"Thank you TotalBiscuit, Husky, Maker, And ROOT for an awesome 6 hours of quality StarCraft!"
1349984829.0,1060,Zerg Encroacher
1349154687.0,1062,I figured out a way we can convince Dustin Browder to add neutral supply depots....
1339442073.0,1069,They said we could get a picture if they didn't have to stop walking :)
1331855255.0,1060,I'm a silver-league Protoss. I don't make death balls...
1330965271.0,1062,[FIXED] Lil' Waynes new album cover
1321841209.0,1062,"On behalf of r/starcraft.  Thank you Sundance, and all of the MLG crew for all the awesome content you provided for us in 2011!"
1367089227.0,1062,"Artosis just used the term ""artosis pylon"""
1331282848.0,1067,"Well done Blizzard, finally putting effort into getting people to watch pro tournaments!"
1330785105.0,1061,Best Part of my Saturday
1326070853.0,1061,"Thanks Dennis ""TaKe"" Gehlen and the whole crew for an amazing tournament!"
1348777095.0,1061,Who is the perfect date for Rihanna? 
1354316853.0,1056,Ideas for buffing the Infestor
1340466048.0,1058,Nukes - You're doing it wrong
1353374581.0,1061,You shall not micro!
1315873293.0,1056,"Charity Drive?  lol, more like DESTROY SHETH DRIVE"
1376256199.0,1059,I support Terry.
1326618699.0,1058,Artosis and Artosis Jr. 
1366254243.0,1057,"Hey Totalbiscuit, congrats on reaching platinum. I drew you a picture."
1364095943.0,1056,The number one reason why I feel League is a better game
1346807176.0,1058,Starcraft 2 HoTS Beta is now live!!
1345641871.0,1058,How every stream should look like.
1320299148.0,1057,This sums things up pretty nicely.
1364792832.0,1055,Warhounds are back!
1356215788.0,1049,Snute 4-0's Symbol To Win HomeStory Cup VI With 18-2 Overall Map Record
1336592411.0,1052,An announcement: There will be no more announcements of announcements.
1368059558.0,1050,"Quick, mods are asleep. Post pictures of Suppy"
1329083619.0,1050,I'm recruiting the future of Aiur
1308708154.0,1055,Blizzard's Map Making Philosophy
1347325521.0,1051,Geniuses Falling
1364917566.0,1051,MC Preparing For North Korea Attack
1338118658.0,1051,I've spent 320+ hours organizing a SC2 tournament in my hometown (NL) - now I need your help getting an audience for the finals!
1364002573.0,1047,I love you
1324109155.0,1049,Some terrans might see it as just 50 minerals... 
1316717450.0,1048,Husky Tales - Episode 1
1360449557.0,1048,QXC after getting protoss'd
1356002495.0,1050,CONDUCTOR PARTING.  THE SOUL TRAIN MOTHERFUCKER. 
1337762803.0,1046,IdrA on Naniwa Showmatch...
1333044397.0,1052,Let him
1326941754.0,1046,Day[9] knows how to properly raise awareness of SOPA
1372569355.0,1043,"NBA's Dwight Howard was at MLG to play Call of Duty, and stopped by the StarCraft 2 booths. He could barely fit."
1335039363.0,1050,Stephano Interviews Me &amp; HuK.  Things go awry.
1352058188.0,1046,Life and Flash - the picture tells the story
1346564126.0,1047,IdrA was really excited to see me
1343118374.0,1049,[s] Just Jaedong enjoying SC2
1334069919.0,1044,"Steady as she goes, next stop Grandmasters!"
1339735275.0,1041,"""ROOT is built on hype"" "
1325786099.0,1043,TwitchTV Moves Domains from GoDaddy
1313170983.0,1041,The Cheese Diet
1354845822.0,1038,I will be at Blizzard tomorrow filming an interview about the new Groups feature as well as the future of StarCraft 2. Please post any questions that you would like me to ask during the interview. -Husky
1352653722.0,1042,HOTS... Blizzard... I love the changes so far. Do this and I'll love you forever!
1331513964.0,1046,The main reason I prefer playing on EU over NA.
1370574316.0,1038,Day[9] and Apollo at WCS Finals.
1363375167.0,1037,Redbull really likes starcraft
1326668430.0,1042,Kim Rom(Steelseries) on not sponsoring Grubby anymore.
1316764197.0,1040,If /r/starcraft had its way with match history...
1362762393.0,1039,Zerg Attack -- Humanity Fights Back #SwarmLaunch
1353308129.0,1039,"Meanwhile, here's Dimaga's cute wedding photo. Vote for him and his wife to help him win a honeymoon at UAE (press the orange button which says ""голосовать"", no registration needed)"
1372476093.0,1035,Who Will Win This Round?
