created_utc,score,title
1363063087.0,3595,Hey /r/StarCraft I have some more good news..you are today's Subreddit Of The Day! Congratulations!
1351434599.0,3116,Cold is the void
1358841774.0,2923,Heart of the Swarm Opening Cinematic
1343646371.0,2872,PSY (Gangnam Style) performance at GSL?
1368137723.0,2839,IdrA officially released from EG
1350446305.0,2830,Starcraft 2 will be dead before Legacy of the Void if Blizzard doesn't change its course
1352048726.0,2795,Nanibrows
1362844327.0,2717,Found this in the paper today (Ottawa Citizen)
1358458613.0,2584,Own3d.tv – a beginner’s guide to being an asshole « Destiny
1375817896.0,2523,The farewell of Stephano
1361910391.0,2513,Vengeance Trailer - StarCraft II: Heart of the Swarm
1352219220.0,2402,"The only one to ask for our names, stayed late just to talk with us: No idea how much I respect him ^^"
1368785984.0,2331,I've never won this way before....
1335505157.0,2308,GOOGLE Gets Zerg Rushed!
1356034546.0,2297,Found some old christmas photos ~ 12 years ago.  I wonder if this game will be any good.
1367457405.0,2292,InControl responds intelligently to heckling
1351168847.0,2266,Nydus worm attack! Finally done.
1345683199.0,2239,"KT_Violet, a KeSPA progamer, has passed away after a year-long battle with leukemia."
1354757481.0,2225,The Tyrant Cometh.
1364953745.0,2225,"Fuck Slasher, give me the Karma"
1370990456.0,2223,My best forcefield!
1347092961.0,2203,Rotterdam's Oracle Storm drop
1371643113.0,2182,Words to live by
1361613956.0,2172,Grubby probe micro
1336406773.0,2173,"Blizzard announces HoTS multiplayer replays, reconnect from replay, unranked ladder and global play "
1363109050.0,2169,Can we just say a massive THANK YOU to Blizzard for a very smooth game launch for HotS?
1366485535.0,2154,"Hi reddit, I'd like to humbly ask you to check out a pencil drawing I've been working on for the past 2.5 years... Ironically enough, I've hated this drawing as much as I hate the ingame unit ^^ Dark Templar"
1363651310.0,2125,Just saw this in the ST_Life fanclub on TL
1348569701.0,2112,Starcrafts Episode 6! Hellion of Harass
1369832296.0,2099,Stachetosis
1369688779.0,2087,Game of Thrones intro in Starcraft 2
1368321819.0,2085,"mini-Real Talk with Greg ""IdrA"" Fields - ""I am not going to continue as a competitive player"""
1368414232.0,2076,What Artosis has to say about the IdrA incident [0:30]
1362002655.0,2047,Kindest thing I've had a stranger do for me. I love this community.
1369993968.0,2045,I spent 900+ hours organizing a StarCraft tournament in my home country - now all I need is an audience for the finals tomorrow!
1343946180.0,2036,IMMvp on CNN
1334535502.0,2013,"Thought you guys might enjoy this, I work at the airport this plane just came in from Korea."
1368525725.0,2012,Deep insight from Artosis
1340059486.0,2011,This is Swedish National TV atm..
1353983503.0,1974,Something I made a while ago cause Day[9]'s face is perfect for it.
1347826107.0,1971, BW and SC2 Carrier Mechanics by LiquidNonY
1352299135.0,1956,"Razer products now come with Spyware, require internet, and will stop working when disconnected. "
1363569139.0,1947,"ST.Life takes home MLG Winter Championship 2013, defeating KT.Flash 4-2 in the finals!"
1363541063.0,1943,K9- Casting the Right way.
1351602946.0,1940,"Hello~I’m MKP, Prime needs your support! 
For operation and sponsorship, Prime starts to stream(team &amp; personal)."
1363787110.0,1943,Google knows StarCraft
1372549881.0,1931,Best Sign at MLG ft. HotBid
1365568166.0,1914,#3 On Korean Ladder
1367354569.0,1883,The spoon Terran...
1370361631.0,1885,Spawning has come to StarCraft II
1325696447.0,1885,MLG moves entire network- over 100 domains- off of http://godaddy.com in response to their support of SOPA.
1344303187.0,1872,Liquid Jinro Retires 
1369591689.0,1875,[WCS EU] Stephano Vs ForGG - Super Friendly Fire Widow Mine Hits
1363037432.0,1876,First thing I thought of when I saw the Kerrigan at the Blizzard launch event.
1368459552.0,1868,What Artosis has to say about what Artosis has to say about the IdrA incident
1367933063.0,1859,Took me about 3 years to realize that the Dominion logo displays an arm with a whip...
1351022170.0,1852,Quitting Smoking with SC2 Stream!
1334266907.0,1846,"Hi Reddit, This is HD, &amp; I should have wrote this a long time ago."
1364792037.0,1845,Well played /r/starcraft....well played
1354615706.0,1843,"The GOMtv Crew. They busted their asses for IPL and 
put on a great show. Respect. "
1371490457.0,1835,Sjow beats Life 2-1 in a nail-biting series!!! Biggest upset in Dreamhack history!!!
1360813185.0,1833, Today I met one of the people who made me really love Starcraft: huskystarcraft. And of all places at a local sandwich shop. HE LIVES BY ME.
1304309132.0,1830,"Hi /r/starcraft.  I made ""Warp Prism"" to help me watch multiple casts.  It uses WASD controls to navigate quickly between streams.  Let me know what you think!"
1364759302.0,1832,Happy Easter!
1363071653.0,1824,Heart of the Swarm has officially been launched in every region of the world. Thank you Blizzard for an amazing Worldwide Launch Party.
1364164726.0,1814,Abathur's sandwich
1364063778.0,1812,People still do this?
1342556963.0,1810,Stephano vs Airport security - Looks like professional gaming still has a way to go before it reaches mainstream acceptance.
1361320113.0,1810,Blizzard I love you. No hate you can't respond to anymore!
1363017603.0,1798,So who's excited for the HOTS Singleplayer?
1349176005.0,1797,"StarCrafts - Episode 7: ""Roach Approach"""
1336815320.0,1796,SCII Tactician - The Latest SC2 Casting Innovation!
1376256090.0,1794,Scarlett just posted this on twitter
1349202869.0,1787,"Maru makes an expansion, then defends it"
1361703712.0,1790,Noticed this little shoutout during the Dead Space 3 credits.
1323042065.0,1785,"Search your feelings, you know it to be true."
1342396058.0,1784,My son wanted to meet MC.  Without hesitation this is what the Boss Toss did.
1370076824.0,1774,Congratulations to the winner of WCS Korea Season 1 Grand Final!
1353238543.0,1768,STPartinG becomes the first Blizzard World Champion after defeating CreatorPrime  in a very intense series by 4-2
1372800759.0,1769,HuK's grandpa just sent him this
1347325389.0,1760,[News] Evil Geniuses Documentary: Geniuses Falling
1367094700.0,1761,NANIWA IN THE FINALS OF DREAMHACK OPEN
1334417817.0,1762,Greatest Will Cheese Fail Ever! (Must See)
1336752686.0,1763,GOD playing sc2 !!!!
1340278573.0,1755,Stephano drunk and arrested after the last DreamHack
1371505602.0,1759,The similarity is kind of funny...
1366887363.0,1741,"GSL WCS KR, Code S, Group B - Life, Parting, Innovation and Flash. Prepare your pants people."
1366967540.0,1738,"The Starcraft Home Screen Right Now, GJ Blizzard"
1348429647.0,1730,What DreamHack really wants from us...
1334274991.0,1729,"By request, terran's being destroyed by baneling. 1 hour speed paint again."
1366915163.0,1734,"This would be cool, no? Maybe one day... I got faith."
1357821572.0,1732,Huk advances to Code S!
1336592428.0,1721,Thor is Here. (thorzain.evilgeniuses.net)
1365152247.0,1716,I switched to Protoss recently... my Terran friend got me this keyboard for my birthday.
1350277766.0,1716,"Geoff Robinson, the silent majority sincerely wants to see you back on State of the Game. You kick ass. So I have elected to stay silent no longer."
1342600326.0,1716,"Real Talk with Nick ""Tasteless"" Plott"
1360004843.0,1710,The Truth About Football
1372021532.0,1705,Red Bull is fucking awesome.
1374730509.0,1711,This little gem was hidden in the dark recesses of TLO's AMA today.
1348678569.0,1706,Blizzard's homage to FruitDealer
1350524237.0,1706,My thoughts on some of the negativity going around.
1358711409.0,1703,Scumbag sentry
1364570054.0,1697,"Twitch.tv, please fix your Android (and iOS?) app! All I can watch is a black screen."
1375879856.0,1692,The photo of Stephano that I will never forget. The Foreign Hope.
1362202628.0,1694,Taylor Swift - I Knew You Were Trouble (Day[9] Edition)
1360078060.0,1694,HuK's response to the latest community feedback towards him
1371572727.0,1692,NASL will run 2013 WCS America Season 2
1348128606.0,1690,Poke.....poke.....poke.....
1363688110.0,1676,Why I want a color-blind mode
1349911038.0,1671,"Dear Blizzard, please make ignoring a person two-way. That is all."
1344292605.0,1672,Inside an Orbital Command Center after a successful M.U.L.E landing
1361987713.0,1670,Why Starcraft is the hardest game
1332774037.0,1668,"I don't always LAN, but when I do..."
1328473102.0,1666,I decided to change my approach to TvP...
1369372197.0,1659,Artosis Warpin
1365879028.0,1655,The most clever 6 pool I have ever seen. Korean ladder
1374684753.0,1656,"Hey, I'm TLO and haven't done one of these in a while so why the hell not. AMA!"
1336033910.0,1654,"great timing, tasteless"
1355343735.0,1641,Walked into chemistry this morning and saw this...
1308336448.0,1641,We can all relate to this kitten.
1363287495.0,1643,The Swarm takes over Buffalo Wild Wings!
1372508260.0,1636,DJWheat collects himself
1365083097.0,1630,Official game is balanced
1357631586.0,1626,Stephano is not a smart man.
1351597963.0,1633,Made a map telling myself not to hold back. The result - Vector.
1368152996.0,1624,Day9 on IdrA's release from EG
1345256239.0,1622,Why I don't like the new Starcraft expansion.
1367102858.0,1624,"Congratulations Leenock, the winner of Dreamhack Stockholm, beating NaNiwa 3-2!"
1344638995.0,1622,Hello. I'm CranK
1339214861.0,1627,Mirror Matchups according to someone with a sign
1366258294.0,1623,This is what happens when a Starcraft enthusiast gets bored
1367066775.0,1623,StarCrafts Season 2 Ep1 GL HF
1352934330.0,1619,It is WhiteRa's 32nd Birthday! Congrats Aleksey!!
1351332063.0,1616,Grubby proselyting to Ricky Gervais
1351706183.0,1614,Baneling costume! (Gaming X-Post)
1363735410.0,1614,It all makes sense now!
1357527899.0,1613,"Terran, fuck yeah"
1319212729.0,1610,My brother just sent me a picture of the new Zerg units from Blizzcon!
1343065336.0,1605,"Would you like to see ""Blizzard seconds"" change to real seconds in HOTS?"
1375990028.0,1603,Let's have a chat.
1350477225.0,1598,Slayers disbands
1357485729.0,1596,This is how my brother and I watch starcraft 
1361556045.0,1589,"""Your workers are under attack"""
1364499776.0,1592,Dragon Translates Idra's BM
1339517948.0,1592,Dustin Browder watches Starcraft
1363461231.0,1586,BOMBER: puts three seeker missiles on his own medivac and flies it over goswsers army
1363565759.0,1578,Life getting his game face on
1374598232.0,1579,Tank grab my tongue!
1349019740.0,1576,"""I believe"" by Pandain remastered"
1318812120.0,1573,Huk wins MLG Orlando 2011!
1370439905.0,1567,MLG Anaheim may host State of the Game's 100th episode if there is enough interest
1372716814.0,1565,I enjoy drawing portraits for the shits and the giggles. Figured you guys might enjoy this one.
1367731969.0,1565,"In 12 hours 30 minutes time, we find out of if people really do want to watch American Starcraft"
1374174330.0,1560,"I'm the idiot that went main stage MLG to get a signature from Day9. Here's my finished, framed mousepad."
1339205646.0,1561,And the rest was history...
1332195578.0,1555,I did it!!
1339855489.0,1555,djWHEAT: The most dedicated man in ESPORTS
1340783805.0,1554,"Today, 6/27, is Day[9]'s Birthday. Thank you Sean. "
1307295078.0,1550,Idra you fucking idiot
1358213590.0,1553,We are Axiom eSports and we have an announcement
1365386067.0,1548,The ultimate guide to securing ANY Skype against DDoS attacks (100% FREE) - EVERY professional should be doing this
1332969433.0,1548,I feel that Polish SC 2 scene doesn't get much appreciation. So here is Nova cosplay appearing on our last Barcraft on Sunday.
1330439549.0,1549,Colonization
1353133888.0,1550,Starcrafts episode 14 the BWC 2012
1353352112.0,1541,An Infestor missing his owner (x-post from r/destiny)
1339612086.0,1544,"Flash meets Unimpressed Flash, is impressed."
1374522272.0,1537,"Blizzard announces they'll be holding each of the WCS S2 Regional finals (NA, EU, KR) on the same weekend. Same time as The International 3."
1363011551.0,1544,Day[9] the poet.
1366664715.0,1533,8 Best American Starcraft Players
1364385695.0,1531,Some people have difficulty telling the borders of Silver &amp; Plat as well as Diamond &amp; Masters apart. How about changing them to this?
1375494847.0,1530,Khaldra
1332720368.0,1529,[s]MarineKingPrime wins MLG Columbus championship 5-2!!!
1322722908.0,1526,"I lost all five placement matches. So I made myself a 
card to celebrate."
1332556931.0,1524,The agony of defeat...
1370487638.0,1523,Spore Crawlers launching Banelings
1372077729.0,1523,TeamLiquid.net's current header image
1365449219.0,1519,Kevin Knocke is the new Online Broadcasting Manager of Blizzard Entertainment
1359987130.0,1518,"I teach English in Seoul, South Korea, and this was a reading passage in the book."
1340161651.0,1509,I want YOU
1374567059.0,1506,GOM Doing their best to repel the Artosis curse
1289858493.0,1507,Day[9]'s Letter to Reddit
1370208392.0,1508,"My interpretation of what a ""Clan Ladder"" system might look like."
1366984204.0,1501,"Oh, Arpollo"
1305389057.0,1508,SlayersCella solves early Zerg scouting issues
1367011269.0,1505,Shoutout to Dreamhack!
1358186539.0,1499,New Heart of the Swarm dances! (Blizzard Dance Contest Update)
1344343511.0,1493,Wow. Just look at how close this game is!
1363882219.0,1499,"Blizzard says thank you for the great launch of Hots(1,1  millions copy sold in 2 days)"
1354402420.0,1496,MC's gift to Stephano
1371085803.0,1487,Playing Starcraft IN a Nexus
1352803263.0,1490,"Heart of the Swarm Released on March 12, now official"
1346344846.0,1483,My buddy claimed he played a 5+ hour ladder match. I doubted him and logged on to check.
1376168213.0,1485,Hamburgers.
1345463727.0,1477,"GOMTV, please, it's time to increase your bitrate."
1374937375.0,1484,That cheeky bastard.
1369097861.0,1482,"Pizza.gg is a scam, I selected iNcontrol but a random dude delivered the pizza"
1359894713.0,1477,Sen style workout
1345342346.0,1479,"""And that's how I beat him with carriers"""
1331935571.0,1477,I illustrated one of my favorite aspects of early game PvT... I hope r/starcraft approves :]
1367265176.0,1475,Hot pickup
1365069908.0,1481,Who else wants to see pros resume old IdrA games he rage quit and see if they can win?
1333220494.0,1473,Flash on LoL
1371509895.0,1471,Stardust is the Dreamhack 2013 champion!
1349732075.0,1471,"Oh, DeMusliM [Fluff]"
1335444284.0,1470,Haters gonna hate
1347689760.0,1464,Cry everytim
1361383388.0,1462,Follow not gay Dragon at...
1299081262.0,1465,"Footage of Artosis, Day9 and Tasteless at WCG USA 2005 "
1374325091.0,1455,Jaedong - Crazy Muta Split!
1340391610.0,1458,"""Liquid Rising"" Documentary Released"
1353438293.0,1455,"MMA and Cella join Team Acer, as player and coach"
1373779676.0,1449,Had a fire alarm during ladder. Came back expecting to see a defeat screen.
1360346130.0,1446,TheGunrun to the rescue
1339114438.0,1455,A reminder to all MLG Anaheim attendees.
1327016168.0,1451,A friend went to watch Dave Chapelle yesterday. He made this joke.
1355932853.0,1449,Tragedy and Video Game Violence - TotalBiscuit refutes the media's accusation that violent games are related to school shootings. SC2 mentioned by CNN as a violent game.
1317418630.0,1448,Sundance: If (MLG) Starcraft were on ESPN2 would you watch it?
1349362778.0,1442,I love Blizz Customer Support
1340762921.0,1440,djWHEAT falling for a screamer gif on stream
1331722864.0,1439,Special Tactics | The Movie Trailer
1348078418.0,1441,Liquid'HayprO Retires
1365175295.0,1438,"I think i'm not alone in wishing the great Artosis, HAPPY BIRTHDAY!"
1330829629.0,1431,Phase 2 of my son's birthday party has begun. (Phase 1 was paintball.)
1365008777.0,1437,"PSA: For those giving away HotS game keys to the community, beware of bots that automatically claim them"
1338488984.0,1433,CBSi just signed every tournament out there OO
1371297610.0,1430,Deal with it
1351184492.0,1431,Heart of the Swarm Preview: Leveling
1351080316.0,1429,SeleCT retires from Starcraft II
1361068866.0,1430,StarCrafts Episode 25 the Uneggspected is out!
1347831635.0,1427,[s] Stephano Wins WCS European Finals in a close series against Vortix.
1352577465.0,1422,Starcrafts Episode 13! by CarbotAnimations Spore Loser
1371729408.0,1425,Words to live by in Korea.
1370797811.0,1418,"""Before I die..."" at my school"
1346277487.0,1421,"Hi again, I'm CranK"
1357270450.0,1414,I made a clay model of pvz in my art class :D
1334748809.0,1415,[S] Q.NaNiWa wins 2-0 over ST.Virus to advance to the Ro8!
1341975430.0,1418,"He got through half of the Daily before this happened. I hope everything works out okay, Sean."
1322907667.0,1416,Can't take that risk again
1363227946.0,1416,HotS Easter Egg/ Something I thought was neat.
1350703564.0,1416,Sons of Starcraft Trailer 
1328807853.0,1415,My boyfriend often describes his IdrA fantasies to me. I'm OK with it.
1368965517.0,1407,Day[9] PVZ Lesson with JP: The Build
1348874935.0,1407,"For SC redditors with children, I hope you enjoyed this as much as I did :)"
1352132716.0,1407,Wouldn't it be cool if: CPU Styles 
1364864214.0,1406,Well THAT's a helpful error message...
1352498598.0,1400,Global Play Coming to StarCraft II
1342401165.0,1400,[s] Stephano wins NASL Season 3: 4-0
1337058698.0,1394,"Still Working on it— Here are over 40 ground units, to scale. Enjoy."
1365196289.0,1399,"I work at a Coffee Shop, why do a caramel swirl when I can do this?"
1356221514.0,1398,New carbot animation!!  Ep19
1367953509.0,1386,Adebisi reassures Stephano before he plays Thorzain at Dreamhack
1365625871.0,1388,Sometimes you can't help but laughing your ass off.
1364694580.0,1392,Grab My Tongue! by atryl
1361452376.0,1388,Wouldn't it be cool if you could unlock the BW music for the races with XP in WoL and HoTs?
1369943445.0,1388,"A ""snaaaaap"" moment from Husky!"
1359803584.0,1383,StarCrafts Episode 23 I Spy
1368449064.0,1384,Idra and TotalBiscuit to cast Shoutcraft America Ro8!!
1350813786.0,1380,"We're not gonna win this, but let's at least keep our dignity. Let's vote!"
1359569823.0,1382,MKP Godmode Micro.  Simply Unbelievable!
1354604965.0,1381,Evil Geniuses and TeamLiquid Announce Proleague Partnership
1354509107.0,1380,"Blizz please make a hero Observer for Legacy of the Void named ""Legend"""
1366319510.0,1374,Flash's reaction to winning
1327483662.0,1379,My T-shirt design for a school project
1354789691.0,1373,Carrier micro has been added into HotS
1331672551.0,1370,Zerg Advice Queen
1348708173.0,1367,"Axiom eSports, headed by TB and wife Jenna, will take in initial player Crank"
1363163871.0,1366,StarCrafts Hots Opening - Carbot
1346054004.0,1364,KESPA Players Allowed to play in GSL Season 4. 
1326585339.0,1361,"I'm drawing every single unit from Starcraft in profile, to scale. Thought you might be interested in my progress so far."
1355616308.0,1357,CarbotAnimations - StarCrafts Episode 18 
1368746462.0,1358,The Rise of IMBAbuilds. The Fall of GosuBuilds.
1372869919.0,1360,"Lol, naniwa in a compilation of celebrities looking at boobs."
1369076702.0,1359,Papa John's is Backing eSports! Get 50% off pizza this weekend and win prizes!
1334936700.0,1355,Unimpressed flash at it again
1334868313.0,1358,Stephano stays for another year of SC2 and is going to Korea!
1324675061.0,1358,Day9 against SOPA and GoDaddy!
1314776484.0,1361,IAmA Day[9] lol.  I'll be doing a live AMA tomorrow instead of a daily.  Post some questions here!
1331658318.0,1356,Summer's next action blockbuster
1367166678.0,1359,Probe Vs SCV
1333325474.0,1353,"Well, I'd have found it amusing..."
1332471182.0,1353,Nerdy and I know it by Nerd Alert
1364070173.0,1348,r/gaming didn't appreciate this as much as I would have hoped...
1358391691.0,1350,Husky knows how to deal with haters 
1339325446.0,1351,CBS Will Broadcast Major League Gaming On TV This Fall
1354588780.0,1346,Dignitas.ODEEs house was devastated by fire. I am asking for your help
1320432501.0,1350,I broke my neck and paralyzed from neck below. My hands work somewhat decently but I havent been able to play SC2 well since. White-Ra just cheered me up and said I need more practise :)
1371769667.0,1345,Red Bull should get some recognition for the eSports coverage on their site! Let's give them some numbers!
1367185268.0,1350,Spent the past week painting this massive creature!
1362604429.0,1344,I have taken Dustin Browder. Ransom note inside.
1372421316.0,1345,My friend sent me pictures of her new Corgling
1344200524.0,1340,CNN is really pressing this E-Sports issue.
1355015317.0,1346,My favorite kind of all in.
1324367421.0,1342,"The ""Lets show Artosis how much we want him to keep streaming like this"" post"
1350645933.0,1343,Allow random people to watch your ladder games. Casual gamer will pop casual boner if this were a feature.
1354558558.0,1341,Major Balance Patch - Heart of the Swarm
1350753789.0,1334,Unimpressed Asian Father - Seconds After Life Wins
1348316497.0,1337,StarCrafts Episode 5! Choked up
1361665233.0,1337,This guy's got his priorities straight
1335056669.0,1334,Came across this Korean father passing the torch at Fry's. 
1368058065.0,1326,Idra's message to all his followers
1339401432.0,1333,"MLG ""Officials"" are assholes. (My experience as a competitor)"
1324562796.0,1331,SlayerS_Boxer is now in Code S!!
1367093484.0,1330,WhiteRa cheering for Naniwa's proxy gates
1373112461.0,1330,"StarCrafts Season 2 Episode 9 ""Undermine the Overmind"""
1353478565.0,1332,Kerrigan Cosplay
1347645909.0,1328,"Carrier has (re)arrived! Also, Warhound out of HotS Beta (for now)"
1319071870.0,1326,HuK defend's CombatEX's unscouted proxy 2 gate with a single gateway and probes.  Top 3 control indeed!
1311117482.0,1329,Would anyone else like to see Day[9] give a TED talk on esports and it's future? 
1364525629.0,1325,It's the little things that Blizzard does
1344548108.0,1330,1.5 interface flaws' analysis (img)
1339680353.0,1325,Found this in the new macbook pro page fine print
1333473460.0,1330,"I am looking for my clan from Brood War, Lostlords. I was ]_ord.Cobra-X"
1367157927.0,1324,"Thank you Dreamhack, sponsors &amp; the players for the free..."
1339378111.0,1327,[s] MVP.DRG wins the MLG Spring Championship 3-1 over SlayerS_Alicia in one of the most thrilling MLG events to date!
1367100009.0,1325,Give it up for Adebisi who's been observing all day and is doing a spectacular job
1359657737.0,1324,One of the best gifs ever.
1366053476.0,1320,"I knew my speedy ""gl hf"" compulsion would pay off one day!"
1354991947.0,1319,"As promised, here is my interview with Dustin Browder asking your questions. Like the interview? Want to see more? Can I do better? Please let me know! -Husky"
1365045797.0,1314,MUST SEE! Incredible Kerrigan Cosplay
1362956057.0,1318,If only CCs could land on lings
1338995939.0,1313,I can't help but feel that this guy is kinda right..
1300921745.0,1320,My Dark Templar Tattoo
1355383874.0,1317,Puppies aint a game
1341587948.0,1313,"TIL Bill Amend the maker of the comic strip ""Foxtrot"" visits r/starcraft"
1352834821.0,1315,"So I'm sure this is really old, but this really surprised me when I finally decided to watch every episode of The Office"
1339187715.0,1314,They're back! StarCraft II: Heart of The Swarm Battle Report 1
1355782228.0,1313,Wishing Team Liquid Sheth well
1373911599.0,1311,"Despite my awful Photoshop skills, it only took 15 minutes to change this"
1343599154.0,1309,This is how all race disputes need to be solved! IdrA vs. WhiteRa
1364057094.0,1309,"Some building fanart— Hatch, CC, Nexus"
1333005724.0,1313,Malware on EvilGeniuses.Net (EG's website). Second attempt at alerting everyone. Details inside.
1345952400.0,1307,A letter to the writer of the MLG Raleigh article. We need to stop the ignorance.
1324325366.0,1307,Day[9] on Forbes 30 under 30. Esports getting out there. 
1375966584.0,1306,No SC2 at MLG Columbus
1359233835.0,1308,Captured the essence of life.
1330203762.0,1304,"LAN support. Blizzard, come on. If we're ever going to have a flawless tournament experience, Battle.net 2.0 has to be as stable as LAN was. Once again, your competition is offline play. "
1352946777.0,1300,Best $1 I have ever spent
1328478901.0,1299,The First PvT Football Match Didn't Go So Well... 
1341755437.0,1301,Just MC enjoying HomeStory Cup V 
1341154783.0,1295,Evolution of a zergling
1366203510.0,1297,That's what It's called Artosis
1329000389.0,1294,Ghosts before the snipe nerf
1369592689.0,1288,Stephano &amp; ForGG Reactions to the Widow Mine
1370829988.0,1291,DeMusliM finds Dragon's bikini image...
1340821956.0,1295,How to spread your Overlords according to DApollo
1348944247.0,1289,Amazing Terran Theme on Guitar!
1343720345.0,1286,I experienced the opposite of epic BM just now... epic GM
1358387958.0,1287,Pink Void
1355258548.0,1289,James 'The Prophet' Harding
1351048296.0,1285,Pro Players need to Stop talking for me. A Casual Gamer’s Opinion.
1362700744.0,1288,StarCrafts Episode 25 Three For All Season 1 Finale
1362732830.0,1285,The real reason Dustin Browder is coming to Australia
1354644685.0,1284,"Wings of Liberty Balance Update -- December 4, 2012"
1362412242.0,1286,Good Guy Artosis
1335920338.0,1282,So someone got banned for this post on TL today...
1358012917.0,1283,StarCrafts Episode 21 the Bane - YouTube
1350724608.0,1288,Life wins GSL CODE S over MVP 4-3!!
1349478298.0,1287,ultralisks eat marines for breakfast
1372927610.0,1279,"""Mindgames"""
1349094711.0,1282,Apollo BM'ing pros on stream
1339168059.0,1281,How To Pick Your Starcraft 2 Race
1351798572.0,1280,"""Unbuildable Plates"" at ramps - Now in HoTS Beta"
1320604656.0,1280,The most satisfying kind of win
1375796885.0,1279,Met the nicest couple for lunch today
1354421696.0,1276,Campaign to get the entire GOM production crew (including Legend/Heavendom) on stage to take a bow before the IPL5 final. 
