title,score
I haven't heard ANYTHING on the Sim City front for a long while. So what is the game like now?,1596
"[Confirmed] Neither PS4 nor Xbox One will support composite or component output (red, white, yellow, etc. TV cables). Keep this in mind if you must play on old TVs for whatever reason.",1593
All PS4 games will be available as digital downloads,1590
Gears of War producer quits Epic for Mass Effect 4,1581
EA to disable purchased copies of Rock Band on iOS,1585
The new generation of games is starting to require something that not all gamers may have: friends who play games.,1577
New Super Smash Bros. Trailer,1584
Nintendo of America will not allow Evolution 2013 to stream SSBM,1574
Flaw/Exploit in Steam's Workshop Discussion/Forums - Allowing mod authors access to 'edit post' and 'PERMANENT USER BAN' powers,1576
"Half-Life 3, Left 4 Dead 3 and Source 2 mailing lists found on Valve project tracker",1575
Steam Greenlight Now Requires Developers to Pay a $100 Dollar Listing Fee (Money Goes to Charity),1572
Assassin's Creed will be annual until players say stop,1568
"""It stops being a game about smacking demons, and turns into a game about shopping."" PC Gamer's Tom Senior on the failure of Diablo 3's Endgame.",1571
GameStop warns Microsoft on rumored used game-blocking console,1569
"Call of Duty “has almost ruined a generation of shooter players,” says Tripwire Interactive - PCGAMER",1564
"Giant Bombcast - remembering our dear friend and colleague, Ryan Davis",1558
"Wargaming ""not happy"" with Xbox LIVE Gold requirement on F2P games",1556
"""Not only did Mega Man Unlimited deceive me completely, it also may very well be one of the best Mega Man games ever made."" Mega Man Unlimited review.",1556
Steam Summer Sale - Day 5,1556
"Update: Humble Bundle, not EA, responsible for lack of Plants Vs Zombies update. Update may be released after all.",1556
"People kept asking which to buy, Chivalry or War of the Roses, so I made this to try and help out",1551
Hideo Kojima is depressed that MGSV won't be as good as GTAV,1543
Eidos executive tells broadband providers they’re holding gaming back,1549
"MERP(Middle Earth Roleplaying) mod for Skyrim(previously oblivion) receives a Cease and Desist order from Warner Bros, 8 years of work goes down the drain.",1542
China confirms foreign game consoles can be sold.,1540
The Valve Employee Handbook,1545
EVE Online: A compilation of the background/news/videos/screenshots from the giant battle last night,1539
"EA hints at SimCity update with offline play, bigger cities, and the rest of the features you want",1535
"Since FTL has recently skyrocketed in popularity, YSK about the modding community. Pilot Serenity, remove the endgame, sector minibosses, and more!",1530
Last of Us Multiplayer censored in all of Europe,1526
"So I played ""The Last Of Us"" for about a half hour at PAX today, here's some thoughts to interested folks",1525
Zero Punctuation: Call of Duty: Black Ops 2,1525
"Adam Sessler on NBC News: ""Don't preorder the next gen consoles quite yet...""",1523
"Regardless of your opinion of the game, this just isn't right. Kotaku posts an article glorifying the hacks used in The War Z, then links to the Artificial Aiming page used to purchase them.",1515
Polygon updates their review of SimCity again- now with a 4/10,1515
Payday:The Heist secret solved.,1512
"Valve statement to a fan site: ""Valve is not exhibiting at E3 this year.""",1509
Rift to go free-to-play from June 12th,1511
"Phil Fish, creator of Fez: ""I really wish people would consider the game for what it is and stop talking about me for a second""",1511
"Skyrim Mod: Tropical Skyrim - Transforms Skyrim into an Tropical climate (think Farcry 3 - but with swords, magic, and dragons)",1507
NVIDIA Announces They Don't Support SOPA,1508
TB's WTF video on WarZ,1510
The WarZ now on steam...with no mention of it still being in alpha or not having all the features on the steam page.,1504
Humble Bundle 5 LIVE Now.,1499
StarCraft 2: Heart of the Swarm opening cinematic - YouTube,1498
Super Smash Bros: 'We Don't Have Time To Bring All Characters Back',1499
Claptrap delivers: PC version of Borderlands 2 gets detailed menu options,1497
"In wasteland 2, every NPC will have their unique worldviews and prejudices, and react to you based on things like party composition, charisma, gender, etc. Some NPCs might refuse to talk to women at all.",1496
"""gamers will see a difference on Day One when they compare third party PS4 games to Xbox One head-to-head. The developer told me the PS4 is 40 percent more powerful than Xbox One and games like Call of Duty Ghosts will be noticeably different out of the gate.""",1484
"Lab Zero asked for $150,000 to make a new Skullgirls character, and fans said ""hell yeah!"" In the process, it exposed a growing disparity between what people think games cost and the truth.",1491
Sony Sacrificed the PlayStation 4 Camera to Beat Microsoft on Price,1488
Xbox One won't allow indies to self-publish games,1485
I invented the swinging in Spider-Man 2. Now I'm making Energy Hook. Ask Me Anything!,1486
Thief 2 and System Shock 2 get brand new massive patches,1482
"Sim City is a complex game and deserves a detailed video, so we made our longest WTF is? yet",1484
Mann vs. Machine - Team Fortress 2 going Co-op,1480
What happens when pirates play a game development simulator and then go bankrupt because of piracy?,1479
System Shock 2 comes to GOG,1475
"Humble THQ Bundle ends; earns $5 million from 885,000 bundles.",1475
"When people bring up Crusader Kings II, many comments talk about how people find the game interesting, but impenetrable. To help with that problem, I made a tutorial series.",1472
"The Last of Us - Sells 1.3 Million Units in the 1st week, biggest launch of 2013 so far",1467
"EA needs to make $300,000,000 (or 5 million copies sold) from DEAD SPACE 3 in order to continue the series. With budgets this ridiculous are beginning to see signs of another video game crash?",1472
EVE online is getting a TV show based on players stories,1468
Sweatshop HD is the latest victim in Apple's war on serious games,1472
New Half-Life 2 world record speedrun (1:27:51) done by the SourceRuns Team.,1470
"People who are still backing the Xbox One over PS4, what are your reasons?",1470
From official PS Video: PSN+ required for online play,1472
PS4 developer: Sony mandates Vita Remote Play for all games,1462
"Warhammer 40,000: Dawn of War GOTY added to the Humble THQ Bundle",1464
Owners of the PC version of Black Ops 2 are getting a Mass Effect 2 disc read error.,1459
Exclusive PS4 First Look Hands-on ( Out of the Glass Box),1464
"Saved game folder locations for over 1,600 PC games.  Nice information to have when backing up or reformatting.",1467
Valve Pushes Out Half-Life For Linux,1462
Gabe Newell: Reflections of a Video Game Maker [xpost from r/gaming and r/dota],1460
SimCity’s Sims Don’t Seem That Smart After All,1455
"Papers, Please manages to make stamping passports a tense and enjoyable, if dark experience.",1457
Nvidia compares PS4 specs to a 'low-end CPU' ,1451
Tom Clancey's The Division announced by Ubisoft,1452
"Square Enix CEO, Yoichi Wada, has resigned.",1447
"Deadpool video game gets an M rating for - among other things - ""large blood-splatter effects... dismemberment... decapitations... jokes amidst the exaggerated acts of violence... the pumping up of an inflatable doll.""",1444
Could /r/games possibly rotate the starting time for the two weekly discussions each week so people in different time zones have a chance for more exposure?,1447
Today is the one-year anniversary of /r/Games's creation - let's talk about the subreddit and how to keep it on track,1440
A complete and comprehensive history of all video game consoles.,1447
Ashens takes a look at the Ouya...,1445
Dishonored Devs Gameplay Walkthrough (April Fools),1442
Tragedy and Video Game Violence,1434
"VG247 goes insane, posts bizarre Borderlands 2 review",1434
GameStop closing stores: Hundreds of locations shutting down in 2013,1431
The Steam Halloween sale is live!,1436
Are you playing games for the wrong reasons? A rare excellent IGN editorial.,1435
"I filmed Transistor at PAX, I'd like you to watch it.",1419
"Natural Selection 2 ""Gorgeous Update"" Trailer",1426
"Gabe Newell talking about how Valve works.  Chris Avellone talking about the dark days of Black Isle and the promise of Kickstarter.  The co-founder of IGN.  The creator of SpaceChem.  Team Meat.  This YouTube channel is churning out great interviews, each amazingly with only a few hundred views.",1422
"19 year-old spends 2,000 hours making a job application for Bethesda.",1415
Dota 2 is now accessible without beta keys (Not in China though),1422
Microsoft Confirms Self Publishing On The Xbox One,1417
Girl scouts introduces a game development badge,1423
New Batman Arkham game confirmed for 2013 by Warner,1417
Wii U eShop lets indie devs set prices and issue free patches,1417
Xbox One Dashboard Created “With Advertising In Mind”,1415
"PlayStation 4 operating system is called ""Orbis OS""; a modified version of FreeBSD 9.0",1418
"As gamers, do we really care if video games are regarded as art, or are we simply seeking validation for our hobby?",1418
New Bioshock Infinite trailer,1407
Microsoft Points phased out in favor of cash in Windows 8,1410
Patrick Klepek of Giantbomb has done a great write up on the Fez II/Phil Fish debacle.,1402
New Deus Ex: HD game is....8-bit.......Happy April Fool's (*sobs*),1407
"G4 ending X-Play, Attack of the Show.",1404
GTA V NOT Coming to PC in Fall after Redacted Statement,1405
"Shocking info on the game ""TheWarZ""",1398
DICE says no to mods in Battlefield 4.,1396
Torment Kickstarter breaks 4 million with 6 hours to go,1393
False Advertising Alert: Guilty Gear on the Vita does NOT have Online play as advertised by the trailer.,1393
Blizzard: “We acknowledge Diablo III needs to be a better game”,1399
Major Nelson responds to some tough DRM and XBone questions from Redditors,1389
"The other day in the ""What the f**k am I even doing anymore?"" thread, I mentioned I had reverse-pickpocketed Enclave power armor onto almost every NPC.  People asked for photos, so here you go!",1397
Kickstarter game collapses after bringing in $123K,1386
How a clever player with a “useless” item almost took down EVE Online’s entire economy,1392
Metal Gear Solid: Ground Zeroes (11 Minutes),1382
"PS4 hasn't won yet, says Sony",1386
"Games journalism is broken. Case in point: Microsoft's completely fabricated ""X-Surface"".",1387
What Bioshock Infinite gets wrong (repost from r/bioshock),1380
Nintendo’s Stock Skyrockets To Highest Value in Two Years,1383
Ex-Valve employee talks about the company's structural problems and the unlikely prospect of any Valve hardware,1387
Steam is coming to Linux,1382
Age Of Empires 2 HD Beta patch fixes nearly everything,1375
Xbox hack brings heavily armed cops to frightened family's home,1375
"""Violence in Video Games Labeling Act"" bipartisan bill seeks to label games in the U.S. with a tobacco-style message that reads ""WARNING: Exposure to violent video games has been linked to aggressive behavior"" on their packaging",1379
Star Citizen preview: the open-world space sim from the creator of Wing Commander | PC Gamer,1374
"Grand Theft Auto V PC Petition Hits 40,000 Signatures",1376
"gog.com black friday sale, pick 5 games for $10",1372
Nintendo of America's response to campaign calling for an end to region-locking,1376
"Correction! EA responds, says that SimCity does NOT require an always-on connection.",1375
The Secret to Curiosity has been revealed,1376
BBC News - 'Computer games keep me mentally active',1367
Destructoid: Sony's PS Plus humiliates the console game industry ,1370
"Surgeon Simulator Devs Confirm that the ""ARG"" had nothing to do with Valve",1363
Zero Punctuation: Dishonored,1362
Vivendi group Hide all Activision-Blizzard benefits in Bermuda to escape paying Taxes. (Big scandal in France).,1360
Can we not turn this subreddit into a Kickstarter Billboard?,1362
"Port Report: Metro: Last Light on PC - FOV locked to 70, aim assist enabled with no menu option, basic graphics quality settings, DX9 performance boost",1364
Naughty Dog reveals The Last of Us alternate ending image,1359
Dota 2 - The Beta Is Over,1362
New GTA V screen shots.,1357
"Prothean character on ME3 disk, available by changing a few lines of text.",1365
GTA 5 for PC listed on Amazon.,1352
Facebook and Zynga to end close relationship,1359
Battlefield 2142: ex-DICE producer asks if studio ‘has the balls’ to return to future setting,1353
"Valve Update Steam's Account Policy, You Can Now Access Your Games While Banned",1351
Battlefield 4 17 Minute Gameplay Trailer,1350
Halo is officially off the MLG Circuit for the first time since MLG's creation 10 years ago.,1348
"DirectX 11.1 exclusive to Windows 8, Microsoft confirms",1344
"Rock, Paper, Shotgun: “E3′s Press Events Do Not Represent The Gaming I Know”",1338
Saints Row 4 info: You play as the Super powered United States President and stave off an alien invasion,1342
"EVE Online Producers Declare Player’s Attempt to Destroy Game’s Economy ""Fucking Brilliant""",1342
State of Decay refused classification by the Australian Classification Board due to the depiction of drug use.,1340
Makers of Avenger controllers take money and run,1330
Skyrim Dragonborn DLC official trailer,1326
New Borderlands 2 Wimoweh Trailer,1326
Valve showed something secret at GDC. It made people very excited.,1325
Should you preorder videogames? [Totalbiscuit],1331
Duke Nukem 3D: Atomic Edition - Free on GOG to start their Winter Sale,1329
Sega is refashioning itself as a PC game maker,1322
Totalbiscuit on Mass Effect 3's controversial day-one DLC.,1327
Amazon UK: Wii U Sales Rank Jumps 875% Following Microsoft’s Xbox One Reveal,1324
Microsoft replacing Xbox Live voice chat with Skype,1325
"A warning, to avoid Prototype 2 for PC.",1319
Half-Life 2 VR head and gun tracking mod for the Oculus Rift. ,1315
EA Shares Lowest Since 1999,1311
Bioshock: Infinite PC won't require GFWL,1308
Titanfall runs on source engine and may not be native 1080p on Xbox One,1311
[Rumor] New leaked information from MS conference,1313
Saints Row IV - War for Humanity,1306
Steam Linux sale,1307
Dark Souls 2 CONFIRMED for March 2014,1308
"Connecticut town holds good ol' fashioned book burning... errr, ""drive"" to collect and destroy violent video games",1307
So did Microsoft just spin a downclocked esram based on pure bs?,1299
"EA CFO backs off ""microtransactions in all games"" statement",1304
What do you guys think are some of the best gaming levels of this generation? *Spoilers probably*,1300
IGN reveals that new Bethesda game will be survival horror from Resident Evil creator Shinji Mikami,1299
"Dishonored:People would just walk around. They didn’t know what to do. They didn’t even go upstairs because a guard told them they couldn’t. They’d say ‘Okay, I can’t go upstairs.’ They wouldn’t do anything,” explained Arkane’s Julien Roby",1299
"Natural Selection 2 adds female marines, for free",1299
Valve introduces Steam Trading Cards,1295
"1Up, Gamespy and UGO Going Bye-bye",1297
Oculus Rift + Razer Hydra = Ultimate immersion. [GDC],1294
Star Wars: Knights of the Old Republic II finally available on Steam.,1295
[Meta] Is it okay to keep on posting sensationalist garbage all of the time?,1290
"Sony announces Crossbuy: Buy a PS3 game, get the Vita version free - so far includes PlayStation All-Stars, Sly Cooper and Ratchet &amp; Clank QForce",1291
Minecraft Survival: Wasted Potential?,1285
Tera Online goes F2P,1291
Ever been put off buying a game because of its expansive DLC catalogue?,1281
A lot of people are confused as to which games are launch titles and which are exclusives. Here is a complete list of games confirmed as such.,1280
"Weekly Rock Band DLC releases will be ending April 2, 2013. It was a great 5+ year run.",1277
History of GTA (45 min. documentary by GamerSpawn),1277
Wii Fit Trainer a playable character in Super Smash Bros,1279
Microsoft: Next Xbox will work even when your Internet doesn’t,1276
"Tim Schafer: ""Excited about announcing something new tomorrow! Not a sequel or a port. Something NEW. I might even put on new underwear.""",1272
Meet the Pyro,1267
"Ps4 will require Plus to play online multiplayer, similar to Xbox live. Will cost $5 a month and still offer the current Plus benefits like free games",1265
"Kerbal Space Program ""Build Fly Dream"" Fan Trailer - Watch in 1080p if you can, and stick around past the 2min mark (it picks up) [Xpost from /r/KerbalSpaceProgram]",1267
"Road Rash influenced game, ""Road Redemption"" now on kickstarter. Chains, lead pipes, guns and motorcycles",1267
Steam version of Final Fantasy 7 leaked,1261
A Photo Retrospective of the Games Developers Claim Zynga Has Cloned,1265
This is what top-level COD competition ***ing looks like you ************s,1264
An Introduction to The Elder Scrolls Online - New Trailer,1261
EA kills its controversial Online Pass program,1264
Is it fair to ask if Valve has failed in terms of Half Life Episodes?,1258
Kevin Conroy WILL Be Voicing Batman In Batman Arkham Origins – Dallas Comic-Con,1260
Dark Souls 2 - 12 Minutes of Gameplay,1255
AngryJoe: Major Nelson XB1 Interview,1260
"Microsoft were NOT using Xbox One Devkits at E3, They Were Running On Windows 7 With Nvidia GTX Cards",1258
"""Ouya isn't a viable gaming platform, or a good console, or even a nice TV interface."" -- The Verge review of the Ouya",1257
"Steam Database shows Fez, Dyad, Halo 3 and plenty of entries",1255
Cave Story has been ported to the Dreamcast,1251
"Brian Fargo's ""Kick It Forward"", a proposal for Kickstarter devs to contribute 5% of their profits back to new Kickstarters",1254
"Someone, cut through the constant joking for me: is there any concrete evidence that either Half-life 3 or Half-life 2: Episode 3 is under development?",1250
Steambox is Linux based. Launching this year.,1248
Unity Engine Offers iOS and Android Development Free Indefinitely Now,1241
US Official Killed in Libya Was a Senior EVE Online Player,1243
"DayZ standalone release this year, says Dean Hall. ""And it's going to be cheap""",1242
What is the most disturbing event you have seen in a video game?,1237
Bethesda replaces Elder Scrolls website with tribute to Adam Adamowicz,1232
16 new games Greenlit for Steam.,1234
GameStop handing out flyers to tell customers about Xbox One's restrictions,1235
Steam Summer Sale - Day 4,1237
Ubisoft: 'We want to improve our relationship with PC gamers',1231
"IMHO, FTL : Faster than Light is seriously nerdy fun. Command a starship, set it on fire, get your crew eaten by spiders, die a lot.",1232
Wind Waker tech and texture analysis,1230
Never knew that there was so much behind the camera logic in Super Mario Bros 3,1226
"Gabe receives apology from Paul, Gabe doesn't care",1226
"Forgotten but not Abandoned, Bad Company 2 returns with Server &amp; Mod Tools",1226
Watch A Fox Reporter Demolish A Hackneyed Anti-Game Argument,1223
Bioshock Infinite has sold 3.7 million units to date,1222
"SimCity Boss's ""Straight Answers"" Seem Pretty Wiggly",1223
"Insane Torchlight II Mod Adds New Class, Monsters, Raids | Rock, Paper, Shotgun",1224
Why I think Battlefield 3 is inferior to BF:BC2,1224
"Kerbal Space Program, a game which was using the distribution method popularized by Minecraft and promising alpha purchasers ""all future updates for free"" has now come out and stated it intends to release an expansion pack that it will charge alpha purchasers for. Do you consider this fair?",1216
Valve is opening a new office in San Francisco,1222
Why is DoTA 2 so insanely popular?,1215
PC gaming's 10 biggest hard drive hogs. 70 gigs for one game?,1219
New Zealand will get uncensored Saints Row 4,1214
John Carmack comments in /r/linux to explain why he thinks that there isn't a business case for official Linux support for games and emulation is the proper approach,1212
Microsoft's family sharing plan was only 60 minute demos confirmed by the mighty CBoaT,1210
Aliens: Colonial Marines 3/10 in Eurogamer,1211
"Valve giving all Portal 2 owners a 75% off coupon for Portal 2. Also, the Perpetual Testing Initiative is going co-op",1212
"NY Times: ""While studies have found no connection between video games and gun violence, the case of Medal of Honor Warfighter illustrates how the firearms and video game industries have quietly forged a mutually beneficial marketing relationship.""",1208
Valve's TF2 revenues increased 12x after becoming F2P,1211
"EVE Online player loses ship and cargo valued over $6,000",1203
Tech Demo of what a Crash Bandicoot remake would look like,1200
Humble THQ Bundle nets over $3.3 million (and counting),1202
SimCity Gameplay Strategy Video #1,1206
"Edge of Space - Kickstarter promised a DRM-free game, Steam Version has always-online DRM",1199
Steam Summer Sale - Day 9,1198
The War Z Security Alert - Database hacked,1199
A trailer for the Angry Video Game Nerd: The Movie has been released.,1196
Tekken producer would consider quitting rather than charging players for DLC characters,1190
FTL: Faster Than Light 40% off ($6) - DRM-free download (Win/Mac/Linux) and Steam key,1191
Bethesda publishes first screenshots of Skyrim DLC Dragonborn,1191
"Half-Life 2, Episode One &amp; Episode Two now on Linux!",1182
CLANG -- a very promising swordfighting game,1186
"/r/Games will hit 200,000 subscribers in a few days. Let's talk about some ideas for improving the comments here.",1189
"Exclusive interview: Valve's Gabe Newell on Steam Box, biometrics, and the future of gaming | The Verge",1181
Brütal Legend Officially Coming to PC,1180
Dark Souls 2 announced at VGAs,1180
Total War: ROME II - Find a Way Trailer,1175
Portal 2 Perpetual Testing Initiative DLC Trailer,1171
"EA Updates Origin Account Policy, You Can Now Access Your Games While Banned
",1180
Cd Projekt founders have been awarded an Order of Polonia Restituta by Polish president,1175
Here’s what I used to make the FTL soundtrack,1176
"Square Enix: Tomb Raider, Sleeping Dogs, &amp; Hitman all broke even, sequels implied",1175
"EA never called Dead Space “too scary,” but the misleading headlines are the story of the day",1172
"Far Cry 3: Blood Dragon sells over half a million, exceeds expectations",1173
Steam Autumn Sale 2012: Deepest Discounts,1168
Zero Punctuation: Next Gen Buyer's Guide,1167
EA has 'no games in development for Wii U',1173
"EU Court Ruling Allows for Re-sale of Used Games by End-Users (YOU!)
",1173
"Mortal Kombat 9 PC sales are ""way, way above expectations""",1156
Steam Summer Sale - Day 11,1158
PSA - For those that ordered Sim City on Amazon with CAGROCKS,1166
"Oddworld: New 'n' Tasty! will launch on PlayStation 3, PS Vita, PlayStation 4, Wii U, PC, Mac and Linux. ""There's one party that's making it very clear they're not interested.""",1159
"(EVE Online) TEST Alliance Please Ignore withdraws from the Honey Badger Coalition, war declared.",1160
First Screenshots from the standalone version of DayZ,1157
/r/games is becoming about as substantive as /r/gaming...,1155
"Riot Games bans Progamer from competing in major tournaments for a year due to ""in-game harassment, verbal abuse, offensive language and negative attitude"".",1155
"Valve removes sex-themed game from Greenlight, citing ""objectionable content"". War and torture themes still just dandy.",1156
Bohemia Interactive unveil plans for ArmA 3 in 2013. Price set at $33 USD for Full game + Alpha/Beta Tests.,1156
New Dark Souls-esque game by From Software will be a PS4 exclusive. Possibly Demon's Souls 2 under a different name.,1148
"Crytek decides to hire ex-Vigil team as ""Crytek USA"" after a single meeting",1147
"Nintendo: ""By the end of the year, we will launch a system where you can purchase [content] from your computer or smartphone through strict account management.""",1149
Wasteland 2 - Early gameplay footage,1147
An Indie game called Overgrowth that has an amazing combat system,1145
Plants Vs Zombies 2 first details -- It's free-to-sodding-play,1145
"Far Cry 3 Blood Dragon - Reveal Trailer ""Mark IV style Motherfucker""",1142
"Humble Bundle V has broken the $5,000,000 mark! :D",1145
Stop Making Horrible Console Ports - A Guide | PC Gamer,1142
Steam Summer Sale - Day 10,1135
"Final Fantasy XIV is in beta again, and this time... it's actually an impressively good game.",1140
Dark Souls: Prepare to Die Edition coming to PC in August,1139
Valve: If Steam Sales Didn't Work we Wouldn't Run Them,1130
AMD on the PS4: We gave it the hardware Nvidia couldn't,1131
"Black Mesa Source: ""We have now kicked off our social-media campaign towards our first release!"" - 8 New Gameplay Screenshots Released",1136
Crusader Kings II: The Old Gods EXTREME Release Trailer,1139
"Wil Wheaton, Sean ""Day9"" Plot, Grant Imahara and Jenna Busch play Small World tabletop game in Wil Wheatons new show ""tabletop""(30 min)",1131
PlayStation 4's Price and Policies Humiliate Microsoft's Xbox One at E3 - Forbes article,1127
Dota 2 community raises The International 3 prize pot by $1 Million with compendium purchases,1135
"Adam Sessler reviews BioShock Infinite. ""It is one of the most remarkable creative feats I have experienced.""",1132
My son gave me a playstation 3 for my birthday.,1134
Bioshock Infinite does not support multiple saved games. Thought some of you would like to know.,1129
"Skyrim is the UK's Christmas number 1, and the first non-EA or Activision game in 8 years to be at the top at Christmas.",1129
SimCity Reviews Paint a Grim Picture of the Future’s Meaningless Game Reviews,1125
"Your biggest ""What the f**k am I even doing anymore?"" moments when playing a video game?",1123
"Who's buying all these niche simulation games, anyway? We found out",1121
Leaked Elder Scrolls Online Gameplay,1118
