title,score
Ocarina of Time warp glitch that allows you to fight Ganon as child Link discovered 14 years after original release,1121
"Bioshock Infinite to have ""1999 mode""",1120
"Retailers leak Xbox1's trade In program: No re-licensing fee, publishers get a cut of the profit.",1121
Steam should have a Tip Jar,1119
Gearbox Software acquire Homeworld franchise,1115
EA pulls paid version of Tetris for iPad to make way for a new paid version of Tetris for iPad: no upgrade path available,1116
"PS4 Games Were Running on Dev Kits, Not High-End PCs",1115
PS3 surpasses Xbox360 in number of worldwide consoles shipped. ,1116
Peter Dinklage is voicing AI companion 'Ghost' in Bungie's new game Destiny.,1117
Shelter - Early Gameplay Footage,1109
The Last of Us Red Band Trailer,1114
"The Last of Us NEW GAMEPLAY! Infected Details, Story, Crafting, and MORE! Adam Sessler Interview",1117
New Terraria content may be coming to PC,1107
Steam Adds First Software Application - GameMaker,1102
"""IGN is a vapid, grating display of advertisements wrapped around a rotten core of review-score prostitution""",1105
/r/Games content and moderation survey,1103
"Epic's Tim Sweeney: ""You're not seeing console gamers giving up on console games and moving to mobile"" -- there's just lots more new players who enjoy mobile games.",1111
Castle Crashers is Coming to Steam!,1108
"Super Hexagon dev yet to be paid by Google, account supposedly suspended for asking why. (x-post from r/Android)",1103
"Torment: Tides of Numenera Kickstarter goes live, inXile looking to raise $900K for thematic successor to Planescape: Torment",1100
PSA: Don't buy Torchlight II through the demo prompt if you want it on Steam,1102
"The PA Report - The Kinect is mandatory, and can’t be turned off: Welcome your new motion sensing, Xbox One overlord",1101
Nvidia announces Project Shield handheld gaming system with 5-inch multitouch display | The Verge,1104
"/r/Games is now the 50th largest subreddit, time for a community/rules discussion",1101
"How Valve “devalued” video games, and why that’s great news for developers and players",1096
Witcher 3 is 50 hours long: new previews offer fresh details,1098
"Can we stop with the ""I'm about to start playing x. What should I expect?"" posts?",1098
I'd just like to say thanks to Square Enix and Crystal Dynamics for a great PC version of Tomb Raider.,1095
Skyward Sword looks pretty damn beautiful on the PC,1100
"Warzone 2100 is one of the best and most immersing RTS games I've ever played, and the developer went under and made it open source.  If you're a fan of the RTS genre, I encourage you to give it a chance.",1089
The tale of a StarCraft 2 Modder,1094
Eurogamer officially responds: Lost Humanity 18 Aftermath,1096
"""Complaint Denied: Nintendo loses dispute over WiiU.com domain name""",1088
Elder Kings: A mod that transforms Crusader Kings II from Medieval Europe to Tamriel,1086
Zero Punctuation: Top 5 of 2012,1092
Is anyone else not a huge fan of the current paradigm of pre-ordering games?,1092
Wii U Pro Controller,1088
"Sony also found that 90 percent of Vita owners play Vita “on a regular basis,” marked as once a week or more. But the craziest stat? The average Vita owner uses the handheld 18.7 hours every week.",1088
Sony on Vita: “it’s a PS4 in your pocket. Gamers will tell us how it’ll evolve by how they use it”,1085
The Witcher 3: Wild Hunt confirmed for PlayStation 4 in 2014,1088
EVE Online player loses most expensive ship to date in combat,1083
Rooster Teeth Contributor 'Knuckles Dawson' reported missing,1084
"Why no one can stop Sun Woo Lee, the new king of Street Fighter",1082
Dishonored customers in Eastern Europe are being screwed over,1087
"Claptrap loves PC gamers (Borderlands 2 PC version 
update)",1079
"I hated Civ 5 at release, but with its expansions it's become a good game. What other games are vastly improved by their expansions?",1083
"State of /r/Games: 300,000 subscribers, new moderators, E3, etc.",1084
Shadowrun Returns First Look - 20 minutes of Alpha Gameplay Footage,1083
Borderlands 2 - An Introduction to Borderlands by Sir Hammerlock,1076
Torchlight II reaches two million copies sold,1073
EA wins worst company in America 2012.,1079
"Mass Effect fans send Bioware hundreds of blue, green, and red cupcakes - that all taste the same",1076
"Subscription-based Xbox 720 priced at $300, with $500 standard model?",1077
What games have you regretted buying the most this year?,1072
Kickstarter scam project Mythic: Story of Gods. Growing awareness.,1077
"Sir, You Are Being Hunted gameplay video #1",1073
Saints Row 4 debut trailer,1073
Zero Punctuation: Medal of Honor: Warfighter &amp; Doom 3: BFG Edition,1075
"Banning E3 booth babes isn’t good manners, it’s good business",1078
Guy who wins Curiosity downloaded the game for the first time an hour before he won.,1065
A nice little writeup on why Xbox emulation is still in its infancy after a decade of development.,1068
Review: Resident Evil 6  - Destructoid gave it a 3.0,1074
80% of ign viewers think that the ps4 won e3.,1064
Black Mesa wins ModDB's Mod of the Year 2012 award.,1070
Introducing r/lowendgaming - a subreddit for PC gamers who want to get the most out of their lower end hardware. Help populate it!,1067
Zynga reaches a new low.,1072
Zero Punctuation - DayZ,1071
How I helped destroy Star Wars Galaxies ,1066
I was shocked to read multiplayer is on the decline &amp; single player only games are on the rise.,1066
SW:KOTOR II is on Steam flash sale for $2.49.  Download the Sith Lords Restored Content Mod linked here and it's a terrific game.,1062
Max Payne 3 will not use GFWL,1064
"Hey r/games, I'm the creator of QWOP and I'm trying to revive local PC multiplayer with my new Kickstarter project.",1058
"The Penny Arcade Report launches with featured Gabe Newell interview; Kotaku takes photo of bearded Newell, removes the watermark and reduces a 5,000 word interview to a story about Gabe's beard",1058
"Telltale's new game ""The Wolf Among Us"" Debut Trailer",1055
"Lets Reboot Unreal: ""I want a sprawling exotic landscape of sky puncturing mountains, forgotten temples and crashed space-hulks. It should demand exploration in the way that only a non-linear game can, and be more about survival and escape.""",1060
World of Warcraft subscribers drop to 7.7 Million,1056
"Treyarch screws Black Ops II preorders over by making the preorder bonus, Nuketown 2025, unavailable in public playlists only 6 days after the games release.",1049
Bad messaging by Nintendo: CNN thinks the WiiU is a controller,1051
"SimCity's New ""Glassbox"" Engine. I'm Impressed.",1055
Heavy Rain composer passes away aged 56,1048
Anonymous threatens to take down PSN due to Sony’s support for SOPA,1043
Windows 8 Marketplace will no carry games rated above PEGI 16 or ESRB Mature,1047
The Making Of: Final Fantasy VI,1041
Steam Day 7 deals posted early by accident,1050
Single Player Matters: Why Not All Games Need to Be 'Social',1042
"Norwegian mass murderer Anders Breivik Testifies About Gaming, Press Ignores The Facts",1040
Star Citizens ships have a lot of detail,1042
"""I paid for a game on my console, so it's okay if I pirate it for the PC."" How do you feel about such an attitude?",1044
BioWare giving away free copies of Mass Effect Trilogy for Black Ops II owners getting an install error,1048
"For a long time I've felt that Steam should have a ""Low PC Requirements"" category.",1041
"Bill proposed that will allow circumvention of DRM for personal uses, including DMCA modification for this purpose.",1042
Black Mesa Source RELEASE DATE set for September 14th!,1043
Adam Sessler on the Xbox One policy reversal,1039
Nintendo Financials Reveal Dire Wii U Sales,1035
"Ubisoft claims to have endured 93-95% piracy on PC, shifting to F2P because of this.",1036
"There won't ever be an iOS version of Hotline Miami ""Controls would suck.""",1035
Half of Destructoid's readers block ads. Now what?,1034
Black Mesa mod finds its way onto BBC News,1036
Charlie Brooker on sniping games; an interesting and hilarious read,1028
Dwarf Fortress makes me happy.,1031
Steam now has an official App,1028
PC version of Ultra Street Fighter 4 dropping GFWL for Steamworks,1027
Violent games bill dies without a vote ,1032
"Blizzard: Diablo III lacking ""long-term sustainable end-game""",1032
"Xbox One controllers will be $59.99 each, without charging kit. Charging kits, headsets, and controllers appear in the Microsoft Store.",1030
"OnLive rumored to close service, entire staff reportedly laid off",1025
I just released my game Crayon Physics Deluxe for the iPad. And it's free for the next 24 hours,1024
Introducing: Valve Pipeline,1026
"Crysis 3 Review - Guardian: ""Crysis 3 shows how far the series has moved from the original's fabulous ambition, and makes you wonder exactly when Crytek stopped trying to make amazing FPS games – ones that pushed the important boundaries – and settled for pretty average.""",1027
"200,000 subscribers! Time to experiment with some changes to try to keep the subreddit on track",1019
Beta signups are open for Elder Scrolls Online,1022
"Journo plays through L.A. Noire with his dad, who grew up there in the 1940s",1025
Humble Bundle Adds $1 Minimum for Redeeming Steam Keys,1014
Xbox One PR document leaked,1019
"Bro-sie the Riveter, an awesome way of proving a point about gender equality in gaming.",1020
XBOX ONE vs PS4 Memory Subsystems Compared,1020
Study finds that 85% quit social games after one day,1019
Dota 2 is now available for Mac and Linux,1010
Xbox One: Microsoft's shocking discovery that gamers aren't data,1013
System Shock 2 now released on GOG - $9.99,1019
"Notch on Steam ""I worry about the PC as a gaming platform becoming owned by a single entity that takes 30% of all PC games sold.""",1017
"The Witcher 3 Revealed in February Game Informer Issue; Open World, CD RED Engine 3, coming to PC and next-gen consoles, Geralt has a beard! ",1016
Steam’d Penguins | Valve,1007
"Ubisoft originally never had Vaas in Far Cry 3's story. They were so impressed with Michael Mando's audition for another character that they created Vaas and based him off Mando's physical appearance, motions, etc. (@0:43)",1005
Valve taking action against cross-border gifters.,1015
Steam Summer Sale - Day 3,1009
Holy shit! New Jurassic park game/mod for the HL2 engine. And it doesn't look like shit! ,1010
"Alan Wake PC earns enough in 48 hours to cover all development costs. Developers, listen, this is how you make a PC port.",1009
For those interested there have been two major developments in N64 emulation lately,1011
I think it's time we have a serious awards show,1004
E3 Day 1 In Pictures,1005
LPT: Buy games on sale on steam ALWAYS a gifts unless you're gonna play them right away.,1009
Steam Sale 2009 vs. 2012: A Comparison of Two Sales,1002
"Concept art of what Assassins Creed looked like back in 2004, when it was originally a sequel to Prince of Persia. [crosspost /r/gaming]",1001
"xkcd giant ""world"" comic now a game !!",997
Notch tweets that he'd be willing to fund psychonauts 2,1001
Deadly Premonition: The Director's Cut on Steam Greenlight,998
GLaDOS’ Voice In The Pacific Rim Trailer Was A Valve Approved Cameo (x-post from r/gamernews),999
Full Jedi Academy and Jedi Outcast Source code released! - Mod DB,993
EA/Maxis Sue Zynga for Copyright Infringement,995
Black Mesa Greenlit,985
"EA kills free Battlfield 3 servers, pushes paid ones",988
Official /r/Games EA E3 conference thread,989
"Since the announcement of the Steambox, the internet has been full of rumours and speculation as to its function and purpose. One of the more popular theories, in my opinion the most convincing, is that it will be a Modular Gaming PC, and I'd like to explain how it would work and why it makes sense.",990
"After 70 days awaiting trial, jailed ArmA 3 devs refused bail",988
Valve's Gabe Newell Is The Newest Video Game Billionaire,987
Star Citizen hits astronomical $15 million crowdfunding goal,983
"BioWare: ""calling the next game Mass Effect 4 is a disservice"" ",987
Sony tells Eurogamer: PlayStation 4 will not block used games ,990
Origin adds Twitch streaming and ability to add non-Origin games (and stream them),986
Steam Security Issue (cross-post /r/gaming),986
"Gearbox is watching Diablo 3's RMAH ""with great interest,"" but says a Borderlands 2 RMAH is ""unlikely"" because getting good drops is too important to the fun.",982
Journey's soundtrack has been nominated for a Grammy. Look under Best Score Soundtrack For Visual Media.,982
Arma 3 Screenshots from Gamescon 2012,980
Dead Space 3 for PC will be a direct console port with no extra features like higher resolution textures or DX11 support.,978
Amnesia Developer Thomas Grip's Thoughts on The Last of Us,978
"Guild Wars 2 release date announced: August 28th, 2012",982
"After three years, I finally beat Solitaire in a needlessly difficult way.",979
BioWare Announces Mass Effect 3: Extended Cut,976
"Ubisoft: I Am Alive cancelled on the PC cause ""so few people are paying for PC games"" and ""there's so much pirating""",980
Face Off: Should single-player games always be playable offline? | PC Gamer,974
PS4 runs cooler and weighs less than the PS3 (revealed by FCC report),979
"EA turns EA LA/Danger Close into DICE LA, will work on Star Wars IP",970
"PS4's GPU 50% more powerful, unified and faster memory more convenient for developers but also more expensive to produce.",979
Valve's Gabe Newell on reported layoffs: 'We aren't canceling any projects',975
Kavinsky to star as a radio DJ in GTA V on the in-game Nightride station.,976
Wiki aiming to list every single PC game issue and fix,975
Valve contacted Japanese developers to bring their games to Steam,975
Plants vs Zombies creator laid off | Shacknews.com,970
The Psychology Behind Steam's Summer Sale,967
Update coming to Terraria including new biomes!,967
Watch Dogs is targeting PC as lead platform,972
This is what is wrong with the press industry surrounding games today. Good on him though.,971
"Ragnar Tornquist just officially announced the Sequel to ""The Longest Journey"" and ""Dreamfall"" on Twitter",968
Batman: Arkham Origins Official Teaser Trailer.,962
Frostbite 3 and Unreal Engine 4 won't support Wii U.,966
"According to this post, family sharing in the Xbox would've basically been a one hour demo",970
"Schafer says Psychonauts 2 will cost $13 million to fund. “Yeah, I can do that,” says Notch",969
"New Dishonored gameplay trailer. My goodness, this looks awesome.",963
With games like Train Simulator being... somewhat popular. Wouldn't a Spaceship Simulator be incredibly popular?,962
PS4 DualShock4 light can be turned off by developers.,956
GreenManGaming offers 30% off voucher to Australians on games that are price gouged,964
Batman: Arkham Origins multiplayer revealed,950
"FTL: Faster Than Light is 50 percent off today. It's one of the best indie games I have ever played, so I'd advise all of you to take a look.",954
"So now that the Wii U is at some Best Buys, how many of you have played it and what do you think?",949
"For fans of the S.T.A.L.K.E.R. games that are unaware, some of the original developers are creating a spiritual successor called Survarium.",951
"Diablo 3 on the PlayStation 3 isn’t just functional, it’s far better than its PC brother",952
"THQ files for Chapter 11, Assets will be purchased",954
Gunpoint: A game about rewiring things and punching people,950
Microsoft Pulls a Complete Reversal on Xbox One DRM Policies,948
WARNING: The Last of Us has an autosave glitch which blocks saves [X-post from /r/thelastofus].,949
Zero Punctuation - Far Cry 3,948
Diablo® III Open Beta Weekend,952
Rockstar has confirmed that the gameplay footage from the new GTA V trailer was captured on PS3,948
Don't let the media get away with gamer profiling. Speak up if you see lazy journalism- worked for me! ,941
"Sid Meier's Alpha Centauri on sale on GOG for under three bucks-- if you have never played this game, you should.",942
"Clueless Gamer: Conan O'Brien Reviews ""Tomb Raider""",940
Attention needs to be drawn to the current situation with Worms Revolution on 360. ,942
"10 years after NS1 was released, Natural Selection 2 is finally released today - Launch Trailer",944
"Weekly /r/Games Discussion - What have you been playing, and what do you think of it?",937
"Microsoft Responds: Xbox One's DRM, Always-Online, and Focus on TV/Games - Adam Sessler Interview",945
Used game sales will cost extra licensing fee on Xbox One.,933
Why your next generation console should be a PC,940
"Giant Bomb Quick Look: Kerbal Space Program. Oh God, my sides. Giant Bomb at their best.",939
World of Warcraft server outages ongoing following an exploit that is being compared to the Corrupted Blood incident.,940
Footage of Mega Man Xover being played on an iPad. It's important to see how far franchises can fall.,937
"One of the most enjoyable top 10 lists I've seen: 10 WEIRD Super Mario Bros. Game Genie Codes
      ",934
"Why you shouldn't let up on Blizzard, even if they don't deserve it",943
"It's time for games to offer us solid food: ""The youth excuse is over now. Video games are roughly as old as I am, and while I fully intend to continue to be ludicrously immature for the rest of my life, I also find room for greater depths, meaningful experience, tragedy and love, joy and envy.""",938
Graphics vs. Aesthetics,940
"Nintendo on Thursday posted its first annual loss since becoming a public company, blaming a soaring yen and price cuts on its consoles for sinking it $530 million into the red.",930
Age of Empires 2 (very likely) coming to Steam.,936
"TIL a game designer purposefully trolled his 50,000 paying customers in order to take a jab at the concept of games that have no challenge other than clicking on an object and collecting points, such as Farmville. Even after he purposefully destroyed his own product, people continued to play it. ",938
Respawn Confirms That TitanFall Is NOT A Windows 8 Exclusive Title,926
"Rumor: Valve’s New IP Leaked, Titled ‘Stars of Barathrum’, Concept Art Inside",935
Link to the Past Successor Announced for 3DS,928
Civilization Online (MMO) announced,929
Australian IT Pricing Inquiry Concludes High Games Prices Can’t be Justified,931
"G4 Is No More; Will Be Rebranded in 2013 as Less Geek, More GQ ",930
Thanks Ryan - Dave Snider on Ryan Davis' passing,927
"EA: ""DRM is a failed dead-end strategy""",924
Ea announce free PC downloads for SimCity owners,923
"Black Mesa Interview - ""You still see companies look at this [modding] as competition, sue and shut-down these projects, ignore or drop support for people to mod their games.  It doesn’t make any sense.""",922
Grand Theft Auto V Official Cover Art,928
History of DRM &amp; Copy Protection in Computer Games ,917
"PayPal refused to hand over Lab Zero Games' Skullgirls crowdfunding cash, leaving it unable to pay staff",916
"Rock Band's final song will be Don McLean's ""American Pie""",923
Obsidian joining Wasteland 2 if the Kickstarter reaches $2.1 million,918
An Exciting List Of PC Games For 2012,921
"Blizzard fixes AH gold dupe, ban or rollback accounts and donates proceeds to charity.",914
Valve and SuperGiant team up for a Bastion Narrator Announcer for Dota 2!,919
Homeworld meets Rainbow 6 in new indie game from ex-Bungie Dev.,917
Bioshock Infinite - Columbia: A Modern Day Icarus? Part 2,919
Steam posts 100%+ growth for 7th consecutive year,920
Zynga Shuts Down PetVille And 10 Other Titles To Cut Costs  |  TechCrunch,911
'Veteran Battlefield devs' working on Star Wars: Battlefront,915
'Tamagotchi' to be revived as mobile app for Android and iOS,909
Destiny ViDoc - Pathways Out of Darkness,917
"Is it just me, or is there an oversaturation of retro-styled new games?",912
"""Game Australia"" Preorder Customers, Blizzard has your back!",917
"CD Projekt – Pirated games are not lost sales, DRM is “a lot” for legitimate users to put up with",917
"""Standards are important. They are hard to live up to, sure, but that's the point of them. The trouble with games journalism is that there are no standards.""",912
"CD Projekt's ""triple-A RPG"" teaser image",914
"Jack Tretton interview ""Why Sony did the opposite of Microsoft on used games """,913
"Weekly /r/Games Discussion - What have you been playing, and what do you think of it?",911
73 percent of Ouya owners haven’t paid for a single game,909
"Let's talk about ""horror levels"" in non-horror games",911
SimCity | Disaster Trailer,911
"Steam version of Spelunky (8/8 release) contains a new ""Daily Challenge"" mode: same dungeon for all players, but can only be played once. Changes every 24 hours.",909
"SimCity reboot announced, official site up. Trailer, game info, devblog, other stuff. Multiplayer, apparently.",908
"PS4 will support ""cross-game chat"" (Party Chat) [PDF - 2nd page]",906
"InFlux doesn't have a demo; Developers say to ""Pirate it and then buy it""",907
XCOM: Enemy Unknown -- The Full Game! -- Announced for iOS,899
Runescape puts botters on trial in Botany Bay and lets players decide their fate,908
"Rumor: Final Fantasy XV to be Open World, same director of FF6/9, in development for four years (x-post from /r/jrpg)",903
Microsoft: 'Keep your 360 if you want to play XBLA games',903
Indie game developer Chloe Sagal Commits Suicide on Twitch.TV,905
"In light of more Battlefront 3 footage leaked - I was QA on Battlefront 3 at FRD (plus Haze, Crysis 3 and Homefront 2) AMA!",898
"Misogyny, Sexism, And Why RPS Isn’t Shutting Up",902
"""Assassin's Creed IV: Black Flag"" World Premiere Trailer (HD)",897
Mount &amp; Blade devs announce pirate-themed RPG Caribbean,902
"Former Xbox 360 exec: The $1 billion lost in red-ringing 360s was ""the most painful thing in my life""",903
The Problem With BioWare's Mass Effect 3 Day-One DLC And The Importance Of Building Brand Trust - Forbes,900
Garry’s Mod has earned nearly $22 million over seven years,901
Rab Florence on Peter Molyneux's Kickstarter,903
Nintendo Wii U release date is November 18th,896
"STOP IT: Put Save Games In ONE Place | Rock, Paper, Shotgun",902
Microsoft investing $1 billion into Xbox One games,899
"Now that the PS4 stream is over, can we have separate posts again? It's impossible to have much a conversation about specifics in a 4000 comment thread. ",893
EVO 2013: Finals Day is LIVE [tournament info inside],892
Super Mario Sunshine hacked into Super Mario Galaxy 2!,892
"""This game requires Aeria Ignite"" -- hell no it doesn't.",892
Steam Summer Sale - Day 6,890
Routine - First Alpha Gameplay [4:16],893
Nintendo confirms German law to blame for Europe-wide Wii U eShop 18+ content restrictions,892
Silicon Knights Ordered to Destroy all Software with Unreal Engine Code,887
The Elder Scrolls V Skyrim: Hearthfire - Official Trailer,895
Update (son gave me a PS3),892
"Mass Effect designer ""defends"" their day-one DLC, From Ashes. ""Stop thinking you're a producer and telling us when and where we should be building our content.""",893
I am the Reporter looking to represent /r/Games at E3 and possibly more! Here's a quick look at who I am. I'm doing an AMA in about 4 hours so stay tuned!,887
Some good mods for Star wars battlefront 2 for people who are going to buy it on the steam sale or already have it.,892
Morrowind Overhaul Released,885
"Let’s Not Pre-Order Games Any More, Eh?",884
"PS4 Thief capped at 30fps, producer suggests - 60fps 'not a necessity' [x-post from r/ps4]",885
The Castle Story Kickstarter has started!,892
How to change FOV in Dishonored,886
This Week in Gaming: February 3 - 9,886
Fallout free on GOG.com for 48 hours,883
Why games need color blind modes — this is how SimCity looks with simulated color blindness,879
"EA announces financial results: PC beating PS3, The Old Republic losing subscribers.",880
Xbox One Game Recording Features Is Only For Gold Members,876
Sony execs refuse bonuses for second successive year,880
History needs software pirates - because nobody else is preserving our digital heritage,883
The International 3 - Afterthoughts,883
"What games exist in the same universe as another's, but only provide subtle hints as evidence?",880
Eurogamer bans booth babes from future Expos,879
"The War Z, after much controversy, is back on Steam as of Feb. 26, 2013. (x-post from /r/gaming)",875
Preview: Civilization V: Brave New World.,880
Blizzard's swear filter banned 'homosexual' and 'transsexual' but let through 'faggot',882
"Rock paper shotgun on hitman absolution, sad reading.",879
"Psychiatrists in Breivik trial: ""In our opinion, to sit 
alone in your room playing video games is not 
normal for a man in his 20's""",876
~ WARNING: DO NOT CRAFT ANY MORE COAL ~ They've run out of third party games.,879
Kojima looking for a studio to remake Metal Gear Solid using Fox Engine,873
"With the spike of interest in EVE, here's a long but compelling account of the story of how a single turncoat brought about the downfall of the most powerful entity in the game.",876
New procedurally-generated voxel-based engine is like Minecraft with modern graphics. Prepare to have your mind blown. [X-Post from r/gaming],872
"Several famous gaming and Internet personalities (Notch, Day[9], Tay Zonday, The Yogscast, cArn etc.) as well as developers from Valve, Bethesda and Gearbox come together for a match of TF2 for charity. Three random donors will get to join the match. Donations close in 11 hours.",872
EA: no Steam-like discounts on Origin. EA: Steam-like discounts on Origin.,874
Australian Classification Board - Re-classification review announced for the computer game ‘Saints Row IV’,870
EA giving out free PC game download to SimCity owners,869
"GTAV has regenerating health. ""while regenerating health, another series first, encourages ballsy play"".",866
"I just got this e-mail from Crytek, they are having some security problem, you should change your password.",868
