title,score
IGN defends EA/Bioware - Labels Gamers as 'Entitled',861
"Metal Gear Solid 5 will allow 'user-generated missions,' Kojima says",865
SpyParty just hit 999 closed beta players. Here's why you should care about the game.,864
Zero Punctuation: Deadpool,867
"Microsoft will ""aggressively challenge"" any government attempt to spy through Kinect",869
DICE to offer a console command to turn off color grading in Battlefield 3,861
"$220 Million Battleship Flop Sinks Not Only Universal Pictures, But Activision Game",863
Mirror's Edge 2 - Announcement trailer E3,863
"Games for Windows Live is dying! Over the last few years it's been dropped like a bad habit by 2K, Bethesda, Eidos/Square Enix, THQ, Rockstar, SEGA, EA, and Codemasters. Only Capcom, Warner Bros, and Namco Bandai still use it.",858
Favourite Urban Legends In Video Games?,863
Arma 3 will require Steam,857
Total War: Rome II - Battle of Teutoburg Forest Walkthrough,860
"Valve announces new Steam Community content with ""Hub"" pages for each game",851
PC sets the pace at E3,851
Thought: Do We Own Our Steam Games?,847
"If the price of a new video game dropped back to $49.99, would there be a better chance of you picking up the game on release day?",854
Battlefield 1942 now available for free on Origin in celebration of the 10th anniversary of the Battlefield series,850
"Russian Borderlands 2 Is All Fixed | Rock, Paper, Shotgun",847
"Because Reddit always seems to want a sequel to Mirror's Edge, here's a game on Steam Greenlight that wants to do the whole first person parkour thing too.",845
Arma 2 PvP video narrated by the player. It's an interesting look into an Arma 2 game session. Many people own Arma 2 now but maybe haven't tried anything but DayZ. Take a look.,841
"Star Wars Galaxies Emu - An FAQ, Information and How to Acquire. (I made a post about the SWG EMU yesterday and wanted to create this to answer and further questions for it.)",848
"Garry’s Mod creator responds to Gmod Kickstarter, prepared to fight in court",849
PSA: SimCitys launch,846
Can we have a legit pros vs. cons list of the Xbox One vs. the PS4?,847
"Shadowrun Returns released tomorrow, available for pre-purchase on Steam now.",845
Gaming Made Me: Fallout 2,844
MLG not planning to use StarCraft 2 at the next event,842
"TotalBiscuit confirms SEGA has removed copyright strikes on his account, wants the same treatment and apologies for smaller channels",841
Official /r/Games Ubisoft E3 conference thread,838
Stardock makes an awesome gesture.,842
Steam Summer Sale - Day 7,841
Screenshots of Shinji Mikami's return to survival horror: The Evil Within,838
Just Cause 2 Multiplayer mod back in development,839
DICE is looking to get in touch with a person who is able to implement VR-support (Oculus) into Frostbite-engine,836
A visual representation as to why developers should ALWAYS include the ability to mod a game. Graph of concurrent players in Arma 2 OA since it's release.,839
The Piston is just one of 'multiple' prototypes Valve is showing off at CES 2013,840
"Improved Steam Analyzer: visualize time, % played, money, and friend's statistics",837
The Witcher 3: Wild Hunt - Debut Gameplay Trailer,834
You can now redeem a Steam key for KSP if you already bought the game from their shop,840
"Effectively immediately, all items in Tribes: Ascend require half the XP to unlock, addressing one of the largest complaints against the game.",837
Diablo III gets release date - 15th May.,836
Kerbal Space Program's lead developer HarvesteR clears up debate about DLC and expansions,829
World of Warcraft and it's massive growing pile of unused content.,829
Far Cry 3 Blood Dragon: The Cyber War | Live Action Short,831
What's your GOTY so far?,828
"EA stock drops, CEO John Riccitiello thinks investors are confused about gaming",832
Longest Day of the Year Sale at GoG,829
Gabe Says Valve’s Business Grew “50%” In The Last Year,825
Halo 4 - E3 2012 Gameplay Demo [HD],829
"""I have approximately 70 messages on Xbox Live right now and half of them are, 'I'm going to kill you' and 'I'm going to find you and destroy you' and I haven't worked (at Microsoft) in two years."" - Plague of game dev harassment erodes industry, spurs support groups",830
Gamespot reviews Ride to Hell: Retribution. It's the only game besides Big Rigs: Over the Road Racing to recieve their lowest possible score of 1.0/10.,826
Dark Souls PC coming to Steam,825
"Mega Man Creator Wants Japan to Admit Failure - “Man, Japan is over. We’re done. Our game industry is finished”",827
How SOPA Affects Gamers: SOPA Will Pass Unless You Help,823
"It's been six months since Skyrim was released, what's your opinion on the game now after the hype has died down? ",824
Sonic 2 HD does NOT contain a keylogger. Here is what happened.,826
"Anonymous Zynga employee talks about the stock drop, and what it's like working at Zynga.",830
Valve Could Be Working on a Console,826
Tom Clancy's The Division - E3 Gameplay reveal,826
Three Naughty Dogs are doing an AMA right now; come and ask us about The Last of Us!,824
"UPDATE: PS4 does NOT reserve 4GB for games ""Absolutely false""- Brian Provinciano",823
Almost 1 hour of Star Wars Battlefront 3 footage,824
"PlayStation Plus: Battlefield 3 Free for Members, Summer Blast Discounts",820
"Sakurai: No Plans for Smash Bros. DLC, Tripping Removed",822
Valve investigating Steam The War Z forum over allegations of unfair bans.,817
"TotalBiscuit: ""I will black out both my YT channels, livestream and cynicalbrit.com with a static anti-SOPA message for 24 hours on the 18th of this month.""",818
"Is the video game being called ""The best game of the year"" Anti-American and Anti-Conservative? -- Surprising read from Glenn Beck's website.",822
Age of Empires 2 HD will not have offline LAN functionality,818
"Everyone is rallying against SimCity right now, meanwhile God of War Ascension is being plagued by bugs and some players have been locked out of the game entirely",816
Elder Scrolls Online announced - An MMO set in the world of Skyrim.,816
Xbox One allows families to share Live Gold status on one console with Home Gold,818
"The Humble Double Fine Bundle - Pay what you want for Costume Quest, Psychonauts, and Stacking. Beat the average to get Brutal Legend!",820
"Humble Indie Bundle 4 Includes Jamestown, Bit.Trip Runner, Shank, SMB, Gratuitous Space Battles and Cave Story+",814
"Creative Assembly confirms Total War: Rome II for PC in 2013, first screenshots",821
Gamewise is scraping information from Giantbomb without permission to build a competing service,816
Team Fortress 2 is going to have a major update soon,809
PC Gamer does a First Look on The Witcher 3,814
"OMGPOP CEO calls developer who walked away from Zynga deal a ""failure""",817
EA's SimCity to require always-on internet connection,818
Mirror's Edge and modern publishers,818
"Detailed tech demo of PlayStation 4, PlayStation 4 Eye, and DualShock 4",809
