title,score
Official PlayStation Used Game Instructional Video,3923
Rockstar has made official Spotify and iTunes playlists for every radio station in GTA history.,3764
One of the best screenshot comparisons I've ever seen: GTA 4 vs. GTA 5,3364
"SimCity modder removes always online forced disconnects, possible to play game offline forever.",3314
Disney Closes Game Publisher LucasArts,3239
"PS4 will cost $399, require no online checks, used games system will stay the same",3226
"SimCity Is Inherently Broken, Let's Not Let This Go",3099
GTA V gameplay trailer,3097
Microsoft to Pull Complete Reversal on Xbox One DRM Policies,3047
Ryan Davis of Giantbomb has passed away.,2971
Gabe Newell Officially Confirms That A Next-Gen Valve Engine Is In Development,2964
"Bleszinski on Piracy: ""I, for one, would rather convert these gamers into paying customers as opposed to spending federal money to track these gamers down, arrest them, intimidate them, or pass laws that could potentially limit internet freedom"" [ECGC Keynote]",2933
Steam Summer Sale - Day 1,2881
The War Z no longer purchasable through Steam,2864
"Hi, I'm Garry Newman - creator of Garry's Mod - AMA!",2864
A little heist game called Monaco came out on Steam today. I made that thing. Kinda proud.,2861
"THQ Shuts Down, Studios Sold Off",2798
Lead SimCity developers leave EA to form indie studio,2791
EA CEO John Riccitiello resigns.,2783
PS4 Grabs 95% Of Consumer Votes After Amazon Ends Poll Early,2755
"Gabe Newell ""One of the things we learned pretty early on is 'Don't ever, ever try to lie to the internet - because they will catch you.'""",2752
Thought I'd play a bit more SimCity before bed... immediately regretting my purchase,2715
"Rock, Paper, Shotgun: The Power Of Silence: Why The SimCity Story Went Away",2718
Torchlight is FREE on GOG.com for the next 48 hours,2700
Since you guys requested it - here is the complete and comprehensive history of handheld gaming consoles,2699
"Popular competitive gaming league ESEA admins caught installing Bitcoin miners on player's computers without consent, stole $3,602 dollars",2685
EA re-releases Fifa 12 on the Wii as Fifa 13,2678
"Of all people, Rush Limbaugh just defended video games saying ""I don't know much about video games, but I guarantee that they weren't a large influence on the shooter"" (in reference to the Connecticut shootings). ",2669
"Wheelchair-bound gamer banned from Twitch.tv after he mistakenly shows he faked disability; he made $20,000 in donations",2672
Robert Florence just stepped down from Eurogamer because of his column yesterday blasting games journalists and their relationship to PR.,2640
"Australian Redditors: Since the PS4 is CONFIRMED to be region free, you can buy the American PS4 on amazon for $399 and they will ship it to you for $15 dollars. Amazon has confirmed that they will do this. You can email them and ask, they will say yes. (self.Games)",2630
Supergiant Games (creators of Bastion) next game,2617
"Nintendo is mass ""claiming"" gameplay videos on YouTube",2618
Amazon.com pulls SimCity download version from their store citing server issues,2607
"Games Workshop trademark bullying goes thermonuclear: now they say you can't use ""space marine"" in science fiction",2596
Free-to-play games won't require PlayStation Plus for online multiplayer.,2595
Bioshock Infinite DLC 1 - Burial at Sea Trailer,2590
Bohemia Interactive Developers are free on bail!,2577
Notch earned $101 million USD from Minecraft in 2012,2574
Damned: A randomized online competitive/co-op horror game in which 1 player hunts down the other 4 who are trying to escape from a hotel,2571
Humble THQ Bundle Released,2560
Microsoft no longer charges developers to patch Xbox 360 games.,2544
Age of Empires II HD arriving on Steam April 9,2538
Humble Bundle Origin Bundle,2532
"DayZ set to arrive on PS4, but could skip Xbox One due to publishing and patching restrictions",2527
WarZ Patch: Unleash the True Moneywhoring.,2518
"EA suspends SimCity marketing campaigns, asks affiliates to 'stop actively promoting' game",2519
"Here in Russia and the CIS, we're getting our own version of Borderlands 2. No one told us about that when we preordered. /r/gaming, help us raise awareness.",2518
"The Witcher 3 is DRM-free - ""If someone wants to pirate the game, he will.""",2502
Would /r/Games like having their very own journalist at E3?,2502
"Adam Sessler Reviews ""The Last of Us""",2493
"Hey /r/Games, I said I'd make any game for you in a week and you voted for a game about Terrorist Bears from Hell. Here it is!",2492
Zero Punctuation: SimCity,2491
"""Microsoft's confused, boring reveal event angered the core audience and worried business commentators.""",2475
PSA: Infestation: Survivor Stories is literally just The WarZ with a different name.,2470
Official /r/games PlayStation 2013 Event thread,2455
"Ubisoft got hacked. Usernames, email addresses and encrypted passwords were stolen from their account database. Time to change your passwords!",2440
"Nintendo: If you're worried about used game sales, make better games",2437
"Mirror's Edge 2 is open-world, says EA exec.",2433
"New gameplay video for ""Banished"" - a city building game with a focus on survival",2397
"Nintendo finds out about Zelda Twilight Princess Fan Reorchestration and instead of shutting it down, they co-produce it",2393
"Original programmer of Madden (1988) wins lawsuit against EA, verdict awards $11 million.",2391
"Hackers crack Ubisoft's uPlay security, able to download games for free",2394
EA Sports responds to a hilarious bug in NHL 13 with their own video,2388
Microsoft to segregate players with 'bad reputation' on Xbox One Live,2377
"Witcher 3 DLCs on PC will be free, on consoles the price depends on platformholders",2376
Bungie keen on bringing Destiny to PC,2371
"Oculus Rift cover shooter is so realistic, players warned not to lean on virtual objects [x-post /r/oculus]",2374
"WARNING: Russian users can use an exploit to shut down most of your account functions for 9 weeks, Steam reps confirm.",2372
"Cary Walkin, a chartered accountant who has no professional game development experience, made an RPG entirely in Microsoft Excel 2007. Arena.Xlsm has over 1000 weapon variants, over 2000 enemy variants, 31 different spells, four different endings, and procedurally generated dungeons.",2367
Star Wars Battlefront E3 Announcement Trailer 2013,2364
"Susan Williams, the millionaire who got $20,000 on Kickstarter to send her 9-year-old to a $1k programming camp, just released a private video update. Her daughter shows 0 interest in making a game, doesn't care about getting $20,000, and just surfs the web on her laptop the whole time",2364
Official /r/Games Sony E3 conference thread.,2353
"Reminder: Buy FTL from the developer's site. Same price as Steam, larger cut to the devs, and you get a Steam key or DRM-Free version.",2355
Wow. Zynga laid off 100 employees during Apple event to avoid bad press...,2354
"Shigeru Miyamoto: Games, like a physical toy, should remain the property of their owner",2356
"Payday 2 becomes profitable before launch, Covered by Pre-orders",2351
"[Editorial] Let’s Be Honest, Xbox Live Gold Has Become a Huge Ripoff",2314
I made a subreddit called /r/GamesTheMovie. It's strictly for YouTube videos that meld all the cutscenes (and occasionally gameplay) of games into a movie like experience.,2312
Xbox One will not be Backwards Compatible,2309
Cyberpunk 2077 Teaser Trailer - YouTube,2303
"Ubisoft asks PC gamers to show interest about The Division, petition almost hits its initial goal",2295
Federal judge allows suit against Gamestop Corp. to proceed in regards to deceiving and overcharging on used games,2295
Skyrim Mod: Falskaar - A Huge Mod for Skyrim with 20+ hours of new gameplay (released),2293
"""What game designers in general often seem to ignore is that when players are presented a goal, their first inclination is to devise the most efficient (not necessarily the most fun) means of reaching that goal.""",2291
GOG.com Interview - “DRM solves piracy like a bag of concrete solves hunger.”,2291
"CD Projekt Red: ""There is no place for multiplayer in so strongly a story-driven game as The Witcher 3""",2282
Microsoft kills game ownership and expects us to smile,2276
Zynga Shuts Down OMGPOP One Year After Acquiring It For $200M,2271
"My Internet connection is fine, Microsoft. I’m worried about yours [PA Report]",2274
"""The War Z"" trademark suspended for being too similar to ""World War Z"", game will likely have to be renamed",2254
Final Fantasy VII on Steam!,2237
Ken Levine confirms Bioshock Infinite won’t have a multiplayer mode,2215
Minecraft Beats Call of Duty to Become Most Played Game on Xbox Live,2210
"""The Kinect camera is capable of scanning a room and using its facial recognition software to detect foreign users. If Kinect detects someone it does not recognize, it then audibly asks this person to identify themselves. Once this is done, the Kinect saves the information to the console""",2202
Metro: Last Light $5 for Hard Mode?! - Angry Joe rant,2198
"Warren Spector: “Hey, if we didn’t overcharge for our product — guess what — people wouldn’t have to buy used games”",2199
So I've spent the last few years making a MMO war/city building game. It's completely free without any pay to win junk. Just finished some major updates and need more players/feedback.,2176
Ben Cousins: Mirror's Edge 2 is in production,2178
This might get buried under the E3 news: Valve has paid out over $10M to 400 contributors and partners who created content for TF2,2173
"""Microsoft Creative Director Adam Orth No Longer With Microsoft"" (Game Informer)",2171
The GTA V Multiplayer reveal is here.,2176
"Xbox One: Details on Connectivity, Licensing and Privacy Features",2166
Deleted Tweet from Borderlands 2 writer reveals next DLC,2157
Penny Arcade Report: EA's Real Racing 3 contains over $500 of in-app payments to get the full game. [x-post from r/androidgaming],2158
Is the entire MOBA community just too toxic for casual players?,2154
"""Playstation 4 can still be enjoyed old school without an Internet connection at all""",2148
Singleplayer and Multiplayer should be rated separately,2140
New study finds no link between violent games and anti-social behaviour,2133
John Carmack Joins Oculus as CTO,2133
"So you know that Kickstarter for the girl who wants to go to ""RPG camp""? The mom is a multi-millionaire. ",2124
A TL;Dr version of steams rules (Takes ~5  minutes),2127
"Gabe Newell says living room PCs preloaded with Steam are coming, Valve will offer its own | The Verge",2123
Saints Row IV refused classification in Australia,2104
Batman: Arkham Origins -- Official Trailer,2107
PC gaming market grew 8% in 2012,2113
Aliens: Colonial Marines - How it SHOULD have looked? Demo/final game side by side comparison. You have to see this to believe the bait and switch. ,2103
SimCity could be made to work Offline - RPS,2101
NRA blames video games and hollywood movies for gun violence during press conference today.,2095
Grand Theft Auto V: Official Trailer #3,2093
"Top World of Warcraft raiding guild quits; ""We’ve basically been killing ourselves off slowly since day 1.""",2084
Monopoly released 3 days ago on steam. It has no LAN or online multiplayer. What is even the point of making Monopoly without online multiplayer in this day and age?,2085
"EverQuest Next is Real, and it's Amazing",2075
"Deus Ex movie will be a cyberpunk film, not video game film",2067
GTA V delayed to September 2013,2071
Current XBOX Live outage renders most things useless.,2072
"GTA V Coming to PC ""this fall"", Says Nvidia",2070
Zynga loses $15.8M and nearly half its daily users for this past quarter.,2065
Microsoft's Entertainment Head Don Mattrick Leaving for Top Zynga Job,2058
Characters in Cyberpunk 2077 will speak in multiple languages. Players will be able to buy translation implants.,2068
I got a bit of validation as an adult gamer yesterday.,2060
Duck Tales Remastered - Announcement Trailer [HD],2058
I asked Steam Support what happens to my games if Valve goes out of business.,2053
PS4 is now the #1 top selling console on Amazon,2048
Super Mario Bros Crossover is heading into version 3.0 and presents itself with new trailer. Looks fantastic!,2040
"Ex-Rooster Teeth (David ""Knuckles Dawson"" Dreger) contributer found dead in West Vancouver",2039
PS4 Store will ask if you'd like to download multiplayer or single-player first when you download a game,2037
"IGN.com has zero news coverage of SOPA. It did not even report on Notch's stance of the bill, nor the positions taken by Epic Games, Red 5 Studios, and other game developers in opposition. The reason: IGN is property of News Corp, which is one of SOPA's largest backers. ",2033
"Day Z's incredible success: ""But I can predict one thing: the companies that do not support modding will never have a zombie mod sell hundreds of thousands of extra copies of their game.""",2024
"GameStop Stops PS4 Pre-Orders, as ""Unlimited"" Supply Runs Dry",2025
"Saints Row IV main voice actors revealed, which includes Neil Patrick Harris.",2007
Twitch.tv partnering with Steam,2000
Zero Punctuation: E3 2013,1999
"So Bioshock Infinite's review embargo broke, here are the reviews.",1997
Xbox One will still function if Kinect is not plugged in.,1995
Black Mesa Source Released,1988
Steam Workshop item creators can now give a cut of their sales to third parties that helped them make their items - and it comes out of Valve's share.,1986
SEGA starts quietly removing YouTube users' videos... and gets entire accounts banned,1984
Ubisoft Scrapping Always-On DRM For PC Games,1981
"Sony handing out free PS4 devkits ""like candy"", funding indie development through back-end Pub Fund",1971
"The US Governement approves the League of Legends LCS as a real sport on par with NBA, NFL, NHL so pro's get visas now",1967
"Sony: ""All told, we’re planning to showcase more than 40 games across PS4, PS3 and PS Vita.""",1966
An industry that needs Xbox One DRM is a failed industry,1960
The PS4 currently has 48 games officially announced for the console and E3 isn't until Monday.,1961
THQ is giving out METRO 2033 on Facebook,1960
Rockstar targets Max Payne 3 multiplayer cheaters by placing them in games with only other confirmed cheaters.,1953
E3 Day 0 In Pictures,1946
PlayStation Plus Won’t Be Required to Record and Stream Video of Games on PS4,1953
The Humble Indie Bundle 8 is out,1951
NYU: Killing used games and lowering prices by 33% would improve game profitability by 19%.,1940
Mowing the Astroturf,1945
"Activision Blizzard buys back $8.2 billion in shares from Vivendi, now publicly owned.",1935
World of Warcraft loses 1.3 million subscribers over three months,1932
Steam's Big Picture,1937
"2000+ Man fight going on in EVE Online, Honey Badger Coalition (Reddit) vs Cluster Fuck Coalition (Something Awful). Dozens of thousands of dollars worth of internet spaceships on the line.",1924
New Bioshock Infinite teaser: Columbia: A Modern Day Icarus?,1921
This is why Kinect is a bad idea for television. [Responds to voice commands from the TV show],1917
Valve wants to integrate Blender into Steam games modding [x post from r/blender],1906
PS4's digital library lets you play your games anywhere &amp; on anyone's console,1909
Why you shouldn’t trust our SimCity “review”,1910
VIDEO: Adam Sessler Today On FoxNews.com Discussing Video Game Violence.,1896
"Most games are too short – that's why they get traded in, says Just Cause Creator",1893
"Polygon re-rates their SimCity review, dropping it from a 9.5 to an 8.0, citing connectivity issues",1891
"Maxis claims responsibility for SimCity screw-up: ""EA does not force design upon us.""",1884
"SOE president John Smedley: ""People that don't play games have no business in this business""",1876
'Mass Effect' Facebook Page Attacked Because Misidentified Shooting Suspect Liked It,1879
"The Witcher 3 received 49 awards at E3, including “Best Game of E3”, “Best RPG of E3” and “Editor's Choice”",1872
"Microsoft Studios' creative director Adam Orth on always-online ""Those people should definitely get with the times and get the internet. It's awesome.""",1867
"Regarding the ""[Warning: /r/all]"" flair",1864
Adam Sessler calls out G4 over the reasons for his termination,1867
Civilization V: Brave New World announced - expands culture and diplomacy | News,1861
"Thirteen years after its release, a new sidequest is discovered in Final Fantasy IX (neogaf thread)",1849
"What does one full year ($50) of PlayStation Plus look like? [Note: These are just the complimentary games, not the features or discounts.]",1841
NCAA doesn't renew contract with EA for NCAA Football games.,1837
"Heavy Rain cost €16.7 million to make and made Sony ""more than €100 million""",1843
"I recently realized this: I almost never play in pickup groups in online games because I'm afraid of ruining people's fun by being a ""noob"".",1835
Does anyone else feel Steam could use more specific genre/subgenres to help people find games?,1839
Experiment: Comment scores in /r/Games will now be hidden initially,1842
Game Informer Australia's response to fans reactions.,1840
Watch Dogs looks incredible.,1831
Modern Military Shooters in a nutshell,1829
Mirror's Edge 2 announced!,1825
"Xbox One Price $499 in America, €499/£429 in Europe (around $660)",1822
Permadeath in an MMORPG,1819
"Battlefield 4 won't use motion controls because they are a 'gimmick,' says DICE exec producer.",1822
GTA series may go sci-fi if Rockstar has “something to say”,1818
China making plans to end ban on video game consoles,1814
ZombieU will feature no respawns as such. Rather one bite turns your character into a zombie. You then take over a new character back at the start and you must go kill your zombie self to get your equipment back. ,1821
"Oculus Rift, reactions/in-game footage",1810
Pokémon Generations - Fanmade 3D Action/Adventure/RPG Game First Impressions,1814
The Steam Holiday Sale is live!,1808
"Developing for PS4 is ""a really pleasant surprise,"" says Ubisoft Montreal",1811
The Elder Scrolls Anthology announced for PC. Every single TES game and five maps in one bundle.,1807
Bioware founders Greg Zeschuk and Ray Muzyka leave the company.,1806
Street Fighter X Mega Man reveal trailer,1799
For those that are going back to SimCity 4 since they won't be buying the new one - here's an awesome list of great mods along with some guides.,1799
"""Papers, please"" releasing this summer, costs 10 dollars.",1791
DO NOT UPDATE YOUR PS3s! ( New Firmware = Brick),1788
Next Xbox to be revealed May 21,1787
Microsoft: No Xbox One in Japan this Year: “Tier 2 Country”,1787
The power difference between the PS4 &amp; Xbox One,1785
"Was told to resubbit this to /r/games- xbox forums user lists lots of information about the issues with xbox one WITH sources, lots of info.",1776
7 Minutes of Saints Row IV Gameplay,1771
"Saints Row IV Censored-for-Australia Edition, can't co-op with non-AU, 360 version region locked.",1767
EA makes it to the top 4 in The Consumerist's Worst Company in America bracket,1763
PS4 shipping with a bundled headset. They're getting serious about competing with the qaulity of Xbox live.,1759
"Reddit, in what ways have you played a game wrong?",1767
How two Valve engineers walked away with the company's augmented reality glasses,1754
Official /R/Games Next Gen-Xbox Thread,1759
Should more games have the option of New Game+ ?,1755
Sony sends Notch a golden PSone as VIP invitation to E3 event,1754
Kingdom Hearts 3 PS4 Trailer - Finally!,1746
GTA V Online Gameplay to be revealed Thursday,1752
Fez 2 Cancelled,1744
The War Z terms and conditions copy\pasted from League of Legends,1741
Tomb Raider sequel for next-gen confirmed by Square CEO,1734
Cliff Bleszinski leaves Epic,1734
"Jason Rubin, President of THQ, tweeted that THQ is looking into possibly porting games to Linux.",1734
DayZ standalone announced.,1732
"If Metro: Last Light Ranger Mode is ""the way it was meant to be played"" why isn't it included for all players?",1728
"When pirates outnumber paying customers 10 to 1, online games die very quickly",1733
"Ken Levine: ""The First Half"" of BioShock Infinite's 'Burial at Sea' Part 1 DLC Won't Feature Combat",1724
Mirror's Edge 2 listed on Amazon.de,1732
Final Fantasy XIV not coming to XBox 360 or XBone because Microsoft won't support cross platform play,1727
Valve giving free copies of Portal 2 to schools who want to use it to teach physics and critical-thinking,1718
"/r/Tribes now considering banning HiRez employees from the sub, due to insulting comments by APC and Bart (two HiRez employees) along with the attempt to make /r/Tribes the official Tribes Forum for HiRez.",1717
"Former Valve employee working on game where you can play as either the protesters or the police in a game described as ""A playable documentary""",1714
Kiefer Sutherland is Snake's new voice actor for Metal Gear Solid 5: The Phantom Pain,1717
Activision Blizzard secretly watermarking World of Warcraft users.,1710
"Kanye West stars in unauthorized video game, Kanye Quest 3030: Rapper must defeat enemies using croissants in new Japanese role-playing game",1703
"PSA: The Last of Us has suffered a leak exposing all of the games cut scene names and as such, a large portion of the plot. Be wary of spoilers.",1709
"""E3 for the People"" - Nintendo partners with Best Buy to allow the general public to play games featured at E3 in select Best Buy stores around the nation.",1708
"Saints Row IV Super Dangerous Wad Wad Edition announced, exclusive to GAME. Includes Commander in Chief edition, Virgin Galactic Space Flight, Plastic Surgery, Trip to Washington DC and Dubai etc.(not a joke)",1699
EA’s future games will all feature microtransactions,1701
Jay Wilson (Diablo 3 game director) steps down from Diablo 3,1704
The Free-To-Play ARPG 'Path of Exile' is going into open beta in 22 hours!,1702
Saints Row 4 has been refused classification again due to drug use related to incentives and rewards.,1705
Blizzard: Battle.net Hacked,1700
Valve to automatically offer all finalists of the 2013 Independent Games Festival a distribution agreement for Steam.,1701
“Skyrim Was Generic” Says Witcher 3 Game Director [xpost/gamernews],1695
"BioShock Infinite delayed a month to March 2013 for ""extra polish and bug fixing""",1693
The Angry Video Game Nerd's YouTube account has been terminated for reasons unknown. Anyone know why?,1690
Gearbox releasing remakes of Homeworld and Homeworld 2 for PC,1691
Official /r/Games Nintendo E3 Conference Thread,1690
"Steam releases new Early Access feature, let's users buy games still in development",1687
"DayZ Standalone Dev Update -  New screenshots, engine/graphics changes, customization",1690
"Gabe Newell: Piracy is a ""Non-issue"" to Valve; Providing better Services Will Result in More Sales",1687
Everything we *know* about the PS4 as of today.,1688
EVE Online: How exactly a war can cost multiple thousands of REAL dollars. (LONG),1687
Could we start using the term 'Expansion Pack' again?,1682
Bungie: “Xbox Live wouldn’t have made it” without Halo,1679
Steam Summer Sale Day 01: 2012/07/12,1673
Avoiding Bioshock Infinite Spoilers? Don't read the Kotaku review.,1676
Ex- Banjo-Kazooie devs attempt to rally support for a spiritual sequel ,1678
Nintendo Power magazine to cease publication,1669
Age of Mythology is not dead.,1676
The Walt Disney Company and EA Announce Multi-Year Star Wars Games Agreement,1673
"IGN links banned from all of reddit for vote cheating, IGN staff attempts to blame mods.",1665
"GTA V PC petition nets 200,000+ signatures",1667
Steam Summer Sale - Day 2,1663
First screenshot from Project Eternity,1666
"Full-scale Earth simulated in game engine. If you are looking for a project to support, this is the one.",1659
Hideo Kojima Feels He Needs to Do Better on Metal Gear Solid V After Seeing Ubisoft’s The Division,1660
"I just had one of the best gaming experiences of my life, and I was role playing as Hitler the entire time.",1662
Own3d (game streaming website) controversy.,1659
"'Atari Dump' Will Be Excavated, After Nearly 30 Years",1651
"PS4: ""number of developers joining has increased from 126 to 505"" since Feb 2013",1659
"This is why people hate always online games: Darkspore Delisted From Steam, Plagued With Game Breaking Issues",1650
Major update before we get started with /r/Games E3 coverage!,1657
The short-lived experiment with hiding the downvote arrow is over - it was a complete failure.,1649
Super Smash Bros is Back for EVO,1648
"Video games don't create violence in society, they reflect it",1649
Official /r/Games Microsoft E3 conference thread,1639
This comes directly from Xbox's Twitter. It's confirmed that Xbox One WILL NOT WORK in any country outside of the 21 Listed Here,1645
Dean Hall comes out of seclusion with a DayZ Standalone development update,1642
Zelda: Wind Waker HD Announced for this Fall,1632
"How Valve hires, how it fires, and how much it pays",1634
The quest for Shadow of the Colossus' last big secret,1625
"The PA Report - EA earned hatred with poor games, lack of vision, and contempt for the audience, not homophobia",1620
EA is severing licensing ties to gun manufacturers - and simultaneously asserting that it has the right to continue to feature branded guns without a license.,1614
Battlefield 4: Official Frostbite 3 Feature Video,1618
Double Fine launches Kickstarter for new IP Massive Chalice,1612
"SimCity 3/5 on Giant Bomb, ""feels more like a really thoughtfully designed multiplayer mode for a larger, single-player capable game""",1613
"Riot bans two more pro-gamers from competing in LoL tournaments for a year due to ""Offensive Language, Verbal Abuse, and Negative Attitude"".",1607
Dishonored - New Bethesda game trailer,1598
PS4 will be $399.,1591
