title,score
I never knew revenge so petty could feel so good. ,4826
"Run-over Another Snowman, Jackass—I can build these all day.",4463
I have a coupon I'd like to use.,4289
Black Friday parking brings out the worst in people . . .,4063
Old people are masters of petty revenge.,3800
Evil elementary school girl,3539
The Douche who would like an interview.,3526
Guy gets petty with rude cashier (X-post from /r/Ireland),3506
"""Do you have any proof?""",3474
My boyfriend didn't keep his promise.,3209
Old People Restaurant Scam,3085
"Here, have a parking ticket!",3091
Scumbag loses most of his friends and a job opportunity. Revenge is sweet.,2864
Job Interview Revenge,2847
Me and a motel,2745
Revenge on a rude and obnoxious parent,2734
"Really, I just wanted to get to the restroom.",2675
"""You should be paying ME to talk to YOU!""",2655
Very Petty Revenge on Bratty Child in Waiting Room,2602
"""It's OK ladies, this round is on me!""",2563
He got what was coming for him.,2560
College Party Throwers vs. Weekend Campers,2464
Lying about heart problems?,2457
Neighbor kids kicked my cat and broke a couple ribs,2293
Petty revenge on a girl yelling at me for helping with her luggage.,2291
Noisy neighbors? Fire the bass canon!,2193
Don't fuck with an Australian. Mate.,2169
Petty Revenge at the Strip Club,2146
I can't go to lunch at 12:30? You sure about that?,2141
Enjoy your first class seat lady...,2084
Threaten to sue me over your adult movie rental charges at a hotel? Be prepared to pay.,2059
I destroyed my nasty stepsister's ability to show off her wedding.,2062
Update: Remember that illegally parked ferrari?,2054
Strand my girlfriend? Enjoy your hike.,2039
Mind the door,2033
DONT TOUCH MY CAKE,2025
Super Bass... how about super evicted.,1985
I don't like people who only talk to me when they need something...,1992
Almost push me onto the tracks? Be 15 minutes late,1984
Steal my lunch? You're in for more than you expected.,1906
A story about how an entire island got revenge on two guys harassing a girl with downs syndrome,1896
Revenge on a gas thief.,1888
Don't Honk II,1885
"Ask me to buy cigarettes for you illegally, then rat me out to my manager? I'll do you one better",1869
"Roommate left me on my own seriously ill, new friend totally got revenge for me.",1871
Bully my cousin at her father's funeral? Eat gravel.,1845
"""Want to cheat off my exam? Sure, take a look.""",1835
Don't bitch about people sitting next to you in another language,1828
Cut in front of me in line? I choose your drink.,1810
You don't ignore a man with unlimited patience.,1808
In Which OP is accosted by a Racist Old Lady.,1796
u/thenewaddition's wife criticises his lasagna and responds with the best petty revenge I've seen.,1790
"Enjoy your ""GAINZ""!",1788
"The tale of the Entitled Princess, the Vengeful Wage Slave, and the Fake I.D. (Longish but worth it in abundance)",1775
"Oh, you can't get your car alarm to stop going off at all hours of the night? Let me help you.",1775
Nigerian Scammers,1763
The pettiest of revenges on a stranger on the train,1755
"Neighbor kept threatening to tow my friends car and file trespassing charges against them, so I took care of it for them",1745
I'm a manager at a valet company; some asshole constantly parks illegally in my lot...,1740
No Sausage rolls for Mrs Meanie,1722
Don't park in my driveway (2 incidents),1716
Outlook Rules,1696
Oh you want to jump the queue do you?,1697
Stolen Computer? I will find you,1673
Thanks for the full tank,1652
Extortion doesn't pay,1637
McDonalds Employee gets revenge,1636
My roommate kept turning the router off while I was playing vidya...,1588
I was told this should be submitted here...,1580
The punishment fit the crime.,1565
"Scream at me, get a $250 fine.",1561
What to do with too many automatic emails?,1547
Nearly run me down? I'll make sure you don't drive away.,1544
Did not want me to use his ink,1542
My police officer aunt gets her food tampered with because of the mere fact that she is a police officer. Revenge ensues.,1532
Don't tip me? Don't get laid.,1522
"Oh, I'll just put this there then.",1520
"Not petty, but industrial strength revenge. Do not fuck with men with nailguns and plywood. [Long]",1511
"If you want to be treated as an adult, maybe start by setting an alarmclock.",1503
"FIL will never say my son looks ""gay"" again.",1493
A trip to Amsterdam gave me some petty revenge on my neighbors.,1479
"""Busy. Sorry.""",1466
Douchebag customer gets put in place,1461
"Guy endangers my life, then decides to call me a ""Faggot"" and spit on me...",1457
Cheat on me? I'll ruin your ID Photo.,1447
Racist girls on a coach lose their bags,1433
Fuck with my little sister? Fail your class.,1428
You wanna call me 5 times in a row?,1431
Petty revenge was all over her face,1429
Brat on the Bus,1424
Steal my parking space and ignore me? Miss your meeting.,1417
Don't cheat on your wife before an important career meeting.,1422
I asked you nicely not to park there,1413
Enjoy your broken Snickers bar!,1405
High school librarian is a bitch.,1400
Delayed revenge on a HS teacher,1398
I was a freelancer who didn't get paid for his work. See if you can guess what alteration I made to the site.,1400
Enjoy your handmade gifts,1390
"""Put your smaller carry-on under the seat in front of you.""",1391
Non-roommates from hell,1381
Big Brother Is Watching,1372
"Thank you 7-11, for being the instrument of my petty revenge",1365
Doctor Douchebag Ph.D,1353
Well played Mr. Snowden,1352
"Go out of your way not to sit next to me, don't get registered",1351
Two dishes best served cold.,1338
"Oh, you require a doctors note for me to call in? No problem...",1339
"I don't mean to be a badass, it just comes naturally.",1337
Time to be petty a the revolving door,1329
"Mistake me for the valet and be rude to me, have a nice walk home.",1319
I got a lady's Mercedes towed today because she was parked in a pizza delivery driver's spot for over two hours,1317
"Well, what the hell would you have done?",1315
Gym Shower Revenge,1301
We just want to give you the best possible service. (x-post from /r/TalesFromRetail),1301
"Verbally abuse me based on my appearance, get fined by the cops.",1297
Bob is dead!,1298
My long-standing petty revenge,1282
Sucker punched this little shit for egging my house twice.,1286
A little bus story.,1280
I've never felt more satisfied.,1268
Justice at the DMV.,1270
"Put it where it is supposed to go, or go crazy.",1261
Petty Revenge Gods granted me...a jar of Vicks.,1259
That was the day my mom learned soap is not food,1260
My dad taught me how to deal with people that steal your parking spot,1257
Noisy kid on bus. Spoilt his fun.,1248
My dad is the reason a group of teenagers are afraid to go into the woods at night..,1245
"He ain't here, he's dead...",1238
Rural Revenge,1235
And that's how you get someone to quit bumming your tobacco.,1237
No gig for you!,1222
You think I'm your butler? Have fun sleeping in the hall.,1228
"Asshole landlord tried to get cute with me over a bedbug problem, didn't count on me being as unethical as he was.",1214
I spent 10 minutes this evening composing a post when my cat walked across the keyboard and,1219
Sorry Princess.,1214
Got the pettiest revenge on a customer. But it was worth it.,1202
You think you can cut me in line because you are a hot chick?,1204
Douchebag revenge.,1203
Rude customer in a rush is forced to wait for her damn door knocker,1192
"Oh, you want to pay with pennies, eh?",1183
I don't take no for an answer when I'm right.,1179
He broke the cardinal rule: don't mess with people who handle your food,1177
Math: The Best Way to Get Rid of a Roommate,1170
Speeding through a school zone to get to your nails appointment? That's a no-no.,1173
"Earphones next time, bud (NSFW text)",1165
My dog's petty revenge,1158
How I got revenge on violent drug dealers which eventually lead to there arrest.,1160
Petty Revenge against school bully.,1156
"Not exactly 'revenge' because I wasn't trying, but instant karma to be sure.",1157
Got to kick out a litigious Bitch.,1150
Ex-ski-uuuuuse me!,1145
"I'm sorry, but its for your own good.",1136
Swift hand of Busjustice--BUSTICE,1141
Who “P”-ed in the pool?,1138
The only girl in the welding shop.,1136
Mess with my movie experience? Get shut down.,1135
The gasps behind the glass doors,1132
You want to make bitchy comments? I'll shut you down.,1118
Eat my pizza rolls will you?,1111
Ruin my yawn? You forget who you're married to?,1105
Leave my motorcycle alone.,1107
Dicks don't deserve my parking spot,1101
You have NO IDEA how far I'll go to get my revenge,1101
Pizza delivery revenge,1098
Petty revenge on my own kid,1099
Employer refuses to change workvans bald tires,1098
"Hot, sweaty taco lady earns visit from health department.",1094
"She Wouldn't Fetch the Mail, So I Got Revenge",1093
Server Etiquette Is Actually Your Job,1093
colleague gets what's coming to her...,1086
By any other name,1082
Don't steal a betrayed 15 year old's baked goods.,1084
Shoplifter gets whats coming,1076
Ex Contacts me i Send the Letter to her Husband,1079
"Xpost from TalesFromRetail. I was told you guys would like ""The first time I got back at a customer""",1080
Security guard gave me a warning ticket I called the cops.,1080
Try getting THAT out of your carpet,1075
You have made a huge mistake.,1065
"Great revenge against a cheap, scamming boss.",1059
Don't threaten to rape my friend.,1059
Contract work scam countered,1060
Damn double parker again,1050
A Child's Revenge (x-post r/funny),1051
Won't let me park in the driveway anymore or have any pets? No wi-fi for you !,1046
Awesome HR guy tricks our terrible company into giving me a bunch of money,1043
My two-year-old daughter gets to bounce wherever she wants.,1044
You volunteered me to babysit on my day off?,1042
Overprivileged Soccer Moms,1029
Take away a day of my honeymoon? I'll make you buy everyone breakfast. (long but good),1035
Don't drive like an asshole if your car stands out,1024
Made an asshole gamer ragequit,1023
And this is why you do not reward bad behavior.,1022
Don't try to scam free shit out of me.,1020
"Schedules are extremely important to you? Me, too!",1010
You want your $20? Here's your *bleep*ing $20.,1013
Be nice to your pizza delivery driver,1016
Idiot on a roller coaster gets what's coming to him,1014
"Don't be a dick, I'll make you fat.",1013
No one insults my Grandma and gets away with it,1015
Are you seriously going to give me a fine because my wooden shed is the color of wood?,1007
The departures lounge cunt.,1003
Don't Park in Handicap Spots If You're Not Disabled or Karma Double Slam,990
I still look back on this and laugh. I felt so proud of myself.,995
Highschoolers.,992
Petty Revenge to a co-worker gone bad.,991
"If you're gonna blast music in the early morning hours, don't use WEP.",992
Message my ex on my Facebook account? I'll fight fire with fire.,987
"She called me a bitch! In my own home, no less!",979
"Revenge over a car door ""ding""",983
Green Bean Revenge,984
Ruin my solo? I'll ruin your rating,981
Two tales of very petty revenge against bad drivers at my security gate.,963
White Pants,967
A Father's Revenge,962
Petty Revenge on an entitled little brat at a birthday party...,963
Finally found the perfect revenge for a bitchy ex,966
Another petty revenge on a bratty waiting room kid.,962
Being a dick? Get off the plane. You're not flying. ,958
Redefinition of Pillow Fight.,956
You're a horny guy on Omegle? I want to play a game...,955
One of my prouder moments.,953
Punk 2 inches from my car.,959
You own the restaurant and demand that I tip you for terrible service? Let me introduce you to my little copper friend.,949
My acting experience comes in handy.,952
So sorry I tried to help out with the dishes!,951
Petty revenge on an Aunt who disregards my college while not being all that educated herself,949
"Yes, No, or @@&amp;$!",947
Accidental non-petty revenge.,950
Revenge as a barista,945
Revenge on an unexpected new roommate.,946
"Terrible driver, terrible parent",944
"Wrong number four times in a row? You can't hit ""redial"" and get someone else...",935
"Dude who dumped me for ""lying""",940
You Don't Deserve :),931
Don't Flip off a Good Samaritan,926
My petty revenge on the Lipstick Bountyhunters,928
Enlisted Craigslist to get back at slob of a roomate,929
[X-POST from TalesFromTechSupport] The Only Acceptable Use of 'I don't feel like it.',923
Turning wrong numbers into profit!!,919
Two can play the high-beams game.,917
"Don't shoplift on my shift, bitch",915
"Got fired. Had last, very petty laugh.",914
Your lawn is so nice. It'd be shame if...,912
Don't hit my girlfriend....,909
My personal account with a private school that had corporal punishment.,909
My father is an asshole I truely admire,900
Douchebag waiter gets his comeuppance,905
"Friend gets robbed, tracks the guy down",903
Girl was rude about a train seat [CHIVALRY DENIED] Punishment: fart to the GRILL,906
Cheating gf,899
Take that you old hag!,895
Petty revenge on gas pump thief,899
Radio Station revenge,897
Petty Revenge on the Fried Chicken Store Next Door,893
Almost killed walking landfill roommate with chili,887
Here's one from my dad when he used to work as a pizza delivery man.,885
Cheating girlfriend - Ruining her image revenge,881
Elevator Etiquette,885
"Verizon store, annoying children, and my last nerve",871
My new work boots are making me very happy.,869
So you got a new cat...,868
Revenge against lying to and betraying a loyal customer.,867
"I tried to apologize, he brought this on himself.",862
Feed your volunteers.,865
"Be rude to me, and I will force you to be polite.",861
The 16 year-old douche with no idea of flight etiquette.,860
Petty revenge in the movie theatre.,858
Sweet revenge on brat child,852
Annoying kid shot a water gun at me...,850
"Sweet, Sweet Revenge",854
It took almost twenty years for this one...,848
sweet sweet drunk revenge,848
Fuck me out of 70 dollars will you?,851
"Flatmate ate all of my pistachios, so I made a treasure hunt for him",845
Don't mess with the people who will be near your car.,841
Neighbor's dog won't shut up,840
Woman Took More Than 5 Minutes to Order in Drive-Thru...,834
"Mess with my feelings, I'll mess with your underage clubbing.",837
"Bleach my clothes? You just got devastated from 5000 miles away, bitch.",824
Revenge on bitchy waitress.,828
Bus Driver Revenge,824
Make a snide comment and act superior? Prepare to get owned in front of the whole store...,817
Annoying prostitute,820
Classmate revenge,822
"Don't start shit, won't be shit",816
I'm sorry but I'm busy buying books,821
Revenge from a fast food worker,815
Train ride revenge on perverted old man,821
Get your own ice,814
Nursery school parents seem to think that birthdays are for sending shit home with other people's kids. Ooh. Idea.,817
Teacher humiliates my prematurely born little brother in art class. Wrong kid to pick on.,812
Make his orders take 10 times longer,819
Wet Laundry,816
"Women can't pump gas? Let's see you try, then",808
Get ready to look FABULOUS!,812
Don't be a brat.,807
Burn in Helvetica,805
"Yes, I'd like fries with that",799
"Oh, were you on a diet? My bad.",802
I'm pretty petty around subways,793
My sweet petty revenge on a 9 year old.,797
Shopping cart justice (x-post from r/TalesFromRetail,793
"I hope I made your ears bleed, bitch.",795
This belongs here.,787
Rude Lady Gets Ugly Mug,788
...And now your pie shall be naked.,787
Anti-Semitic lunch stealer gets what's coming.,783
Wake up call,785
Use headphones on the bus,785
I feel pretty good about this one.,780
How dare you assault my beloved family pet...,785
The pettiest of revenges,775
"I'm sorry, say that again? ",773
High beams highway revenge,774
Waiting on tables and a group of punkass kids screws me over on the bill. One forgets his iPhone...,775
"i have to drop everything to let you in 5 times a day, you get soaked",772
You get the grade you earned,769
Rich People Who Expect Other People to Acquiesce to Them,768
Thief got the tables turned on him,765
Pass everyone on the shoulder? Not if I can help it.,767
Treat me like your personal slave? Enjoy sitting in the dark.,762
"Finally got sweet, hilarious revenge on a recurring thief.",760
Revenge on a Cowboy Coder.,762
Why he doesn't copy off me anymore.,761
Hateful nun and awesome English professor,756
Waste my time? Your laptop will smell fruity!,764
former employer sent a voided check,761
Dare to Steal my Dryer? ,754
Revenge on a homophobic Grandma.,754
Revenge on overbearing manager,753
You think I'm stupid enough to fall for your scam? Part 2,744
Don't whistle at me.,742
Sweaty money is gross,741
Broke the news to my Ex Mother-In-Law!,744
"I'm not passive aggressive, honest. (Smoothie Edition)",737
Office warfare? Don't start if you can't finish.,740
Douchebag driver of the day. ,737
You think I'm stupid enough to fall for your scam? You have noooooo idea.,732
Keep us up late? Well you get to wake up early.,731
"If you cheat, don't tell the TA...",728
Enjoy the glitter.,727
You don't look disabled. Let me help disable you.,728
Don't throw the controller,724
Rich Sorority Girl Learns a Life Lesson,718
Don't mess with a web designer,721
Post office prick,720
Entitled and rude on the phone? Now your whole family knows you were snooping around.,714
Petty revenge at the movies,709
Walmart Parking Lot,704
A little revenge on my ex via his attorney(s) ,709
Don't mess with your night employees!,704
"""Bittersweet"" Revenge.",707
Blockbuster Douche,704
"No sir, I cannot fit into a 1 inch gap between our cars.",708
I Hope You Freeze.,700
Petty retail revenge,691
You want to race? How about a ticket instead.,692
How I got revenge against a compulsive cheater,684
Steal from another team? Now you can't swim.,685
"In my second year of primary school a kid lied to a teacher to get me in trouble: The lie backfired and blossomed in to sweet, beautiful justice. My playground now, bitch!",678
Child Rebel.,682
Don't fuck with your grocer.,685
"Don't play ""chicken"" with me you little shit...",680
"Roommate ate my Hot Pockets, so I moved out.",674
You've Won a TV,673
"Act like a spoiled princess, and I'll make sure you look like one.",678
Boyfriend's Petty Revenge ,674
My buddy's experience at the gas station. (FB) (X-Post from r/funny),675
My waitress decided to call me Jackie Chan to some of her co workers thinking I was out of earshot.(x-post from /r/pics),669
Do the Dew,674
"Old Lady Tries to Insult ""Skinhead""",672
Karma doesn't go that way.,669
IP Company kept giving out my phone number,668
I tell Mr. Awkward McInteruptingface what I think,663
Petty revenge on the ex,666
How's that diet?,664
Exposed English Professor for unmitigated bullshit,664
Free Leftovers? Nope!,665
I threw a dead rat embeebed with formaldehyde at my neighbor's barbecue grill...,661
It's been a long time since I rock and rolled,665
Killing 'em with kindness.,657
Where is my fucking Cumin????,665
No free liquor for drunk bitches.,663
"night is for sleep, day is for work",661
A sister's revenge,652
annoying high school kids don't get to go to a concert,652
My movie theatre revenge,654
Petty revenge on neighbour,653
"Steal a bag of beef jerky? That's your lunch, then",655
I can drive like an asshole too,652
How many hail marys for this one?,651
Punch me again. Go ahead. Do it.,646
"Park in my driveway, then blatantly ignore me when I show up? Enjoy not sleeping tonight!",648
No ID? Then you're an adult.,649
Road rage in the rain.,638
High school revenge on racist bullies,642
A cop's awesome petty revenge,638
Dont keep texting the wrong #,636
Dad gets back at idiot dog owner,630
"Talk shit, I'll ground you.",631
"Your laundry is done, and so is your revenge",629
"20,000 Penny Payback",629
Be mindful of the people who clean up after you.,630
"""Well, you kind of deserved it...""",628
Mom's revenge on me. ,629
Don't be a prick to me or my girls,626
Truck beds are not trashcans.,624
One night at the carnival...,625
Take 2 handicapped spaces? You must be handicapped.,625
"Simple, immediate, and deliciously petty",621
"Oh, your client parked in my driveway? That's ok, your board meeting is about to ROCK",624
Beware the Wrath of Short People!,623
Good luck spending my paycheque on blow,617
Evil drive-through woman,613
Don't you ever take advantage of Aunt Jane.,618
Don't spit on people who know where you live,617
"Bed, Bath and BEYOND UNREASONABLE",615
Bitchy pregnant co worker revenge!,611
Buying a grill at walmart,619
"Petty Revenge against my cat. (Pet-ty, get it?)",608
Don't Lie to Police - They Will Find Out.,611
The Weirdest Revenge Kiss of Her Life?,610
The Great Craigslist Runaround of 2012,604
"Want to block my walkways with your bikes, eh?",609
"Girlfriend broke up with me, accused me of rape...",604
Don't start rumors about me.,609
"Don't like unloading your bar at the gym, huh? That's a damn shame.",606
Snap crackle POP.,604
Made my OCD boss think I put my piss in his face.,609
"If you don't want to pay for it, you ain't using it. ",610
What I did when my ex cheated,606
Finally felt like alpha dog!,602
Good luck finding a parking,606
break-up with my sister on facebook and then try to watch stuff on my netflix...oh wait arrested development is...oh can't watch. Sucker.,609
Ruined mom's date with cat food,600
"""Microsoft"" wanted to fix my computer.",601
my most successful burn on a past house mate. (ad placed in the local paper) he got about 20 quality replies that day.,600
Stupid Girl at a Concert,599
"Oh, you are going to exclude everyone else from your communication, right in front of us? OK. Prepare for some petty equality.",597
A big thanks to Brezzo for our new revengeful alien!,594
Steal my school supplies?  I think not!,594
"Be an annoying customer, don't get the slice you want.",598
Don't be rude to the interns.,595
Being an asshole doesn't mean you're entitled to get your drink before me.,596
Hope you got towed.,590
You obviously don't understand how Amazon.com works. (Alternatively: Enjoy losing business!),589
Steal my Work? Good luck failing!,590
Roommate didn't pay gas bill and continually lied,588
Please don't self-serve.,584
Revenge on a bitchy customer.,592
"35 MPH Revenge, best served with a side of flashing lights",585
Cut my loud neighbors power. Oh yes.,587
Schoolkids ruined our first anniversary so we got our revenge.  ,581
Evil mother gets what she deserves. ,585
My car is JUST small enough to teach this lady not to take up two spots [x-post from r/pics],577
"Funny, I don't see a sign that says that...",582
Instant man-made karma,580
Don't mess with a man and his two kids on their night out.. ,580
Not all neighbors are Mr. Rogers,585
Petty train station revenge,583
Bottled water isn't free,575
You want coffee? I'll give you coffee.,574
Why you don't laugh at another man's car,574
"If you're in a band and you hire a lighting company to do one of your shows, don't say you spent all your money on beer and can't pay for lighting right before you go on.",573
I'm not buying the cat.,573
IN-N-OUT Revenge,572
How a plumber deals with a bad customer,566
"An oldy but a goody. Landlord of doom tried to take us on, and FAILED!!!",572
Beer Thief,563
Don't be a dick to a customer who is minding her own business,562
City folks have no idea what they're doing? BURN BITCH.,564
Make snide remarks and be a whiny bitch all day...prepare to walk home,557
Prom Revenge,557
Illegal parking problem solved.,560
Tiny girl thinks she can slip by unnoticed . . .,552
Give me the finger? Cause a car accident.,551
Petty Revenge on Crazy Roommate,558
DirecTV kept sending me unwanted boxes,550
"Don't be rude to me, brat. ",552
Pizza revenge,554
Boss treats me like shit for years? He ain't getting no new fridge!,551
"I prefer my quesadillas without dried leaves, jerk.",554
Go ahead talk on your phone (x-post from r/talesfromretail),546
Random guy let the air out of my tires (x-post from r/JusticePorn,549
Get angry at my campers for having special needs…enjoy an uncomfortable shower,549
"Enjoy your drive, asshole.",549
The joys of customer service..,548
The 3 Seconds You Tried to Save Turned into a 15 Second Delay,551
"Enjoy your premium margarita, blended with an extra shot of your own fingernails.",547
Don't park in my spot!,550
Want to exploit me for months ? I'll make you ruin your workstation,544
Fear the Cashier,544
Queen of entitlement gets put in her place,543
"Cry wolf long enough, and you're going to get bit.",535
The Girl Who Cried Framed!,537
Businessman think he's too good for the rest of us,528
Not so mice revenge on crappy landlords,531
Buy me cheap food?,534
"Take my phone charger, I hope your phone dies.",532
"If you make me the Bad Guy, don't gripe about what happens next.",525
"Don't have time to do your choirs, let me make some time for you!",520
Park like shit? good luck getting out...,528
Billy Connolly Joke Theft,526
"Revenge on GF Cheating On Deployed Soldier (Not me, but good)",519
Cuss me out and act like an idiot in public? That's fine...,526
Petty revenge on jerk at the restaurant I work at,527
Try to skip an emergency leave soldier? Not on my watch.,522
"You almost hit me, and then expect me to help you?",515
"Here, let me get that for you.",517
The change game,518
Wheely chair revenge,519
Annoying brother-in-law,517
"They called me a faggot, I was bored and needed a little adrenaline rush.",516
"Block my garage, will ya?",522
Home Brewed Soda,515
Cold medicine *yoink*,516
"Brat child running wild? Enjoy the dark,you little sh*t! (long read)",512
Ill teach him to scare the living s*** out of me.,513
Don't mess with the photo guy.,513
Cadbury Egg.,507
The penny gumball machine,506
I do the dishes,513
Craigslist bully/lowballer left in the cold.,508
Extra Hot wanker,504
"Act like a primadonna? Fine, I'll just cut your head off",504
Getting revenge on my step-mom.,505
"They're called ""people movers"" for a reason!",498
