title,score
Airport line cutter sweet sweet petty revenge from 12 year old me.,497
Revenge on a condescending English teacher.,506
Eat the brownies that I was saving for my staff? I'll make you eat my rancid pie.,499
Stranger Insulted Me,499
Car Door Revenge,500
Don't piss off the person making your dinner,498
Obnoxious campers shit themselves in fear.,500
"""Yeah, I think we're legit enemies forever, now.""",491
"""Piping"" up for the Neighbourhood",495
"Don't Stiff Your Caddie, but thanks for all the free lunches!",488
If you're gonna be a huge D-Bag then look forward to getting hundreds of creepy texts and calls soliciting sex.,489
Get off my account,493
Tailgating texan buckles after tasting road revenge,490
"Arrested, bitch!",486
Kid is a dick to me,487
Don't piss your make-up artist off right before your wedding photoshoot,487
Roller coaster revenge,487
Petty Revenge at loud moviegoers,489
My genius little brother's petty revenge,489
My elderly auntie's dog poo revenge,482
My yard is not your dog's toilet.,480
Just say thank you next time...,479
"""An instrument of destruction""",479
How I made a kid fail 5 straight tests as he tried to copy off me.,478
Defusing False Claims of Racism,474
Nail salon revenge...,477
Sex? But I need the loo!,478
Don't expect me to pay for your fault....,481
So you don't tip but your a regular are you? Xpost from /talesfromthepizzaguy,474
I married on the date of my Ex girlfriends birthday,475
Why are you even yelling at me?,481
Coffee Shop WoW,475
Don't treat your IT department like crap.,479
The day my co-worker tricked my manager into punching a 12 year old in the face (x-post from /r/talesfromretail),474
Don't piss off the delivery driver!!!,477
Neighbors threw water at me from above.,474
Have fun getting your handbag out from under my ass,474
Drunken kids sit in my stairwell; get wet bums,476
"Oops, I upset my Brother's Routine",470
Petty revenge against an internet thief,476
"Nice throw, shame I've got butterfingers...",467
"""The Parking Lot is My Kid's Backyard""",467
"Block my view, making me fall and playing victim? Enjoy the rest of your concert staring at the back of someone's head.",468
passive agressive parking flyer.,466
Cut the line for Iron Man 3? Enjoy watching it in the first row.,463
Hit by a car?  Best friend to the rescue!,469
I just withdrew from a class to avoid failing an assignment tomorrow morning that four other people are counting on me finishing. [X-post from /r/confession],465
"""Two in one year? What's wrong with you?""",466
"Be a douche, you can't have your 20 minutes back.",465
Hacked at school,463
I hope that gum landed in your hair,463
"No matter how you slice it, this was a pretty crummy thing to do... I'm sure this'll get a good rise!",455
My boss's petty revenge,464
Don't pretend you're going to drive through my car unless you're prepared to do it.,460
"Talk on your cell, don't acknowledge me and hold up my line? You pay twice.",456
Grown man threatening a teen? Enjoy your destroyed groceries.,460
Please stop blowing your horn so your grand kid can walk 3 feet to your car.,458
Petty Pitcher Putdown,463
Snotty project manager,458
Revenge on tourists,455
B*tch boxes me in at gas station and gets verbally assaulted by a guy who I'd just helped,456
I told you not to leave the windows open...,458
Get off my network and clean your shit.,451
"Rent-A-Cop ""Wigs"" out over non-helmeted bicyclist",452
Trapped,451
Make me wait? Have a taste of your own medicine.,446
County fair petty revenges,444
Cut in line? Good luck shoplifting!,451
Learn some queue etiquette,443
3 hour lunch breaks for a juicehead mortgage broker...,448
You took the last cupcake? I'm going to get your hopes up and then crush them.,452
"Bananas, Bikes, and Anchovies",450
If you tailgate me don't be surprised when I try to teach you a lesson,444
Rude customer gets owned,446
"Try to run me over will you,?",443
4chan's Anon takes it to the next level (x-post /r/funny),448
Relentlessly Right: Humiliating the teacher who could never be wrong.,448
You like my booze? here...try -this-.,447
I don't even like poetry!,448
Don't mess with your pizza man.,446
"""What are you gonna do lady, call the cops?"" YEP!",442
Traffic Cop Revenge,438
Black Tail,438
Hit me I stab your beer.,443
"Fuck you, your girlfriend, and Elmo.",439
Unwelcome guests,438
Petty revenge isn't supposed to be nice,439
Pissing off piano teachers,435
"So it took a couple years, but I got them.",435
"Stay out of my code, fuckface.",439
Park over the line? Take a lap.,434
"Try to do the ""Microsoft Technical Support"" scam on somebody that repairs computers for a living?",436
Revenge of the Krispy Kremes.,435
As petty as they get,430
Park in a disabled space... feel the wrath of a granddad with a wife in a walker.,434
Sorry I hit your car,426
Terrible roommates don't deserve to play with my cat,429
"Have a Stinky Ass, Dickheads",430
Perhaps you'd like to see how awful I can be?,435
Black Paint lasts Forever,431
Turn the lights off when I poo will you?,430
Relentless woman's group,425
"Just 3 short? Aww, too bad. Maybe if your grandmother was nice, I would have been too.",422
My dad accidentally modified his car to get petty revenge on tailgaters.,420
My poetry lacks 'depth' and 'clarity' you say?,425
Revenge is a dish best served glittery,426
9 year olds petty revenge against me in retaliation of my pettiness to her,427
Don't be an asshole,420
"“No way! It was her mistake, not mine! It’s my $20!”",421
Kitty Revenge,420
Petty chili revenge on a chilly day.,421
Sax Player wants to play not nice with the drummer. :D,419
Hit and Run,422
Homophobe Gets A Taste of Intolerance ,423
Revenge on newspaper stealing neighbors,416
Not all retail workers are idiots.,420
Haha I inconvenienced you and cost you $15!,416
Rude cop gets what's coming to him,419
It's my last day at my terrible job. Figured you guys would enjoy this the most.,412
"Accidentally told the recipient of my incoming revenge, didn't matter!",415
I was told you guys would like this.. (xpost r/talesfromretail),415
Door-banging bitch gets a spicy surprise,415
Keep your homophobia to yourself.,418
Don't piss off your landscaper...,417
Step-mom treated me like shit for most of my childhood. And then asked for forgiveness when I was an adult. She received none.,413
A Tom &amp; Jerry Kid gets her revenge.,418
Blast music with obscenities in public? Enjoy your shitty new music selection.,412
18 months and petty revenge is still going strong.,410
"I hope you like your chicken extra dry, bitch!",410
Two epic stories or a girl fighting against her bullies,410
Gloriously petty revenge on a racist roommate ,407
Don't fuck around when I'm eating a good steak.,405
Bilingual advantage during trip through the Alps,408
Enjoy your drink!,407
14 year old me was pretty petty.,410
Made a bully mad by ignoring him,403
Annoying obese kid learned not to mess with staff.,401
My day at the bus stop.,401
Batter up!,399
I hope you don't need to use this printer any time in the next hour,399
You never know who you might cut off in traffic.,401
Sweet bike lock vengeance,407
Better Living Through Chemistry OR Notes to You.,406
Petty train revenge,401
Bathroom Revenge,401
"Enjoy your night, crazy lady.",395
Caught my coworker... red-handed,401
Soda fountain revenge,403
Inadvertent Petty Revenge.,398
"Don't be rude to your flight attendants, either, please.",392
Revenge against a high school bully,402
"Its a fuckin newspaper, lady",398
A guy called my GF a bitch...,395
Don't screw with people who handle your food... Why is this a difficult concept?,389
Teachs you not to eat my steak.,399
Petty Revenge Against an Asshole Father-in-law.,395
My father doesn't leave the bread open/unwrapped anymore.,392
Cutting in line for the ferry.,397
My mother's husband got what he deserved,392
How to sass out your bullying bus driver.,394
Aaaaaaannndddd SNAP!,391
My day in court,392
Obnoxious Dumbass Tourist Teen Gets Naked on Beach in Cannes and Gets Some Sweet Revenge,391
Star Trek Revenge,386
"Parking Attendant Revenge 3, Return of the...  Attendant... (I got nothing for the name...)",386
Mean Girl Grade School Classmate Revenge - Mormon Edition,385
Next time do your own homework.,390
The stolen ID,382
How my dad dealt with student neighbours who parked in our yard.,384
Rude old lady revenge,388
"Me: ""Give Me all my money, Im switching bank"" Bank: ""THAT WILL TAKE HOURS""",386
Going to be a bitch for no reason? Fuck your drink.,382
Nobody likes a copy cat (short one),388
Why couldn't he get his own lube? (NSFW),384
Bent Quarter Revenge,385
Kicked the ex off my works wifi network w/ unexpected benefits.,387
Petty revenge on my older sister.,385
Nosey Co-Worker Revenge,383
No earphones for you,384
Pregnancy Doesn't give you an excuse to be the biggest asshole on the plane.,382
"So petty, but so satisfying.",381
You disrespect my friend and expect me to help you?,381
I thought this was too petty for /r/pettyrevenge...until I got the email,382
How's that for an expensive drink?,386
"Ruin the movie, my buddy will ruin your social life.",382
Boss can't admit he can't speak English. I gave him a little English demo to piss him off.,379
So I live in an HOA and there's a condo commando who hates everyone...,376
Jerk neighbor tried to make us tear down our shed,375
I pretend not to speak the language to get gloriously petty revenge on a salesbitch.,378
Bully steals my lunch? Bully get hoisted with his own petard!,383
You don't want to use my bags? I don't want to buy your stuff.,380
"Drive off without me at 3.30am bus driver, I'll catch you and you can have all my change!",377
Biological warfare!,378
"Treat the cashier like crap, will you?",377
Teacher gets what she wants.,377
Three generations of petty revenge,374
Enjoy my super lactose intolerance fart,379
One year of revenge,375
Oh? You wanted a chocolate shake?,375
i canceled their print jobs,375
Treat me like a servant? Enjoy your long car ride!,373
You don't help me out after I help you keep your job? I'll make you lose it!,372
"""I.. I thought I deleted all that!""",370
Stealing my software? I hope you aren't easily offended...,367
Ebay revenge.,376
Oh you're gonna throw me out of the Army for being fat? Where's the paperwork?,372
I found out who was stealing my gasoline ,369
Leave me cold and I'll wipe your raids,366
Well deserved lip infection.,371
petty no kitty,369
"I tried to be nice, but you just had to push it.",373
"Hit me with your car, get in a fender bender",367
No more puppy for you.,371
"On the ex-girlfriend who admitted that she cheated on me, but really, ""it was all my fault anyway""",367
Bitches lose their drugs because I kept saying no and they didn't stop.,363
Loud neighbours having sex.,365
Loud music? Well f**k your nameplate then!,367
"The rules apply to everyone, not everyone but you.",373
"Yell at me for smoking, while I'm nowhere near anyone or any non-smoking zones? Don't park illegally.",370
Don't bring dogs to the cemetery.,372
I buy you dinner and you flip out when I accidentally use your shampoo?,358
Scare me with office prank? I can scare you more!,360
You bring a stripper home? No sleep for you!,367
Petty Facebook revenge,359
"Oh, you have a ""300"" watt Pioneer stereo, with ""big"" speakers... How cute...",366
"Sometimes, I really hate musicians.",364
Gym goddess learns how to use a bike,358
Don't attempt to steal our strawberries.,360
Squatters? Not on my watch!,366
Nobody drinks my beer and gets away with it...,364
Act like a punk and I'll make you walk to the bus.,366
Don't hit the party person,364
Enjoy your hand-crafted Hate-Mug.,359
My friend is brilliant. He has a wingnut employer who runs his business like a tyrant. He's taken to teaching him quotes from famous dictators.,364
Paid with prayers.,357
Chemistry Teacher Revenge,359
A most masterful cock-block.,363
Don't talk shit to me,359
I'll just take my full break this time.,353
Petty Revenge on a dirty roommate,354
You asked for it.,356
Months-long parking struggle resolved with a tow truck,362
A story my dad told me,359
dads petty car revenge.,356
Magically delicious revenge,359
Video game justice,357
The first time I ever got back at my bullies.,355
bad parenting ruining your meal?,353
/r/talesfromretail demanded that I repost this comment here,354
"White supremacist hits on me, I lie and tell him I am Jewish.",351
Don't mess with a girl and her ponies.,354
Use my the laundry detergent? Smell like fish,354
Gas station revenge,352
Stressed Lady on the subways stairs.,350
Crazy history teacher has a mailbox.,352
Splash me? Enjoy your flat tire.,349
Eye for a Roommates Eye,353
Bitch.,349
Chronicles of the housemate's ex,350
Fake herpes revenge. ,344
My SO kept laughing through a film I was really enjoying,352
Rude and smelly lottery counter receives my reveng,348
Cheat on me and stick me with the bill? I don't think so.,348
Cut my solo short? Nah.,349
Cockblocked,351
Why do fat people always drive tiny cars?,349
One thing after another,346
ELEVATOR: You want to waste my time? I'll waste yours.,348
Ticket Office Revenge,350
Revenge at a concert,343
The Roman Foot Stomp,347
Shoot me will you?,342
Do the Dew,343
"Cart Returns, the place where you return your cart dumbass.",345
Petty Revenge on an obnoxious car driver,344
New Phone,338
Parking Attendant Revenge,347
"Double Petty Revenge - Apple Dealer Owner's Daughter gets owned in front of customers, Son gets owned in front of the dad...",339
Hair messages in the shower,341
Steal girlfriend's phone? Get house trashed.,340
My petty revenge on a racist client,340
Crazy neighbors petty revenge falls apart,338
No diploma for you!,340
Petty revenge of a fly,340
don't take my bands money!,333
"Just made things really ""uncomfortable"" for my ""family""",343
My Final Shift.,344
"If there is a reason that I will be going to hell, this parking lot revenge will be why.",341
Vote up if...just kidding.... Japanese lesbian revenge. ,337
I gave her some tongue.,336
"Bastard deserved it, but then again... don't they all?",337
Enjoy the bing search engine.,337
"Unpleasant soccer parent embarrasses my uncle, gets mired in petty.",331
Toothpick revenge...,329
"I showed my friend this page, I think he gets it",336
Hammurabi would be proud,336
Don't think that just because you're in your car sitting 15' in front of me that I can't completely ruin your conversation.,331
Revenge is a dish best served with sprinkles.,336
You Decided To Call The Police On Me? Because Of A Halloween Costume?!,333
"Be a jerk upstairs neighbor, get your car towed.",337
Revenge served Red,328
Garage revenge I knew nothing about. Initially.,336
"Getting back at a egotistical, know-it-all, wannabe computer-nerd",330
Preemptive revenge planning ruins douchebag's hopes of stealing credit for work.,330
a cashier's petty revenge,330
"Simple, yet effective.",335
That's what you get for you snide ass jokes.,325
"Ok, fine, I'm gone then.",335
Don't mess with a tired graduate student,325
Annoying drunk girls get served some petty revenge.,332
"""Hurry-the-fuck-up-with-my-fries Bitch!""",329
Living well is the best revenge...,326
night is for sleep day is for work (update),326
Am I still a Failure?,330
Accidental Revenge on Jerk Chemistry Teacher,326
"So this revenge sort of took care of itself, I was merely a witness...",328
Don't litter around me.,328
Shitbag ex-gf won't leave my life - commence Operation: Enable,330
"This didn't happen to me, but it's a great little story from elementary school of a teachers revenge against a parent who parked in the teachers only parking lot.",325
Petty revenge at a Catan game,327
You like it hot?,329
Shrink wrap revenge.,329
"Yes, I have the power to make you suck even worse at golf.",319
Moocher gets a serving of his own creation,325
"At a concert, the girls behind me WOULD NOT SHUT UP. ",329
Take that,322
Don't be an asshole to my best friend.,322
I hope you enjoy your elevator ride.,327
Asparagus is my secret weapon,323
Idiot Fake Handicap (warning - rant),329
Lord of the (dead) Flies.,320
"Motorbike tried to cut me up, - on his ass",324
Ice cold petty revenge. ,322
Backpack moron gets takeaway,326
Kitchen wipes are extra absorbent!,319
"Oh, I've got a tip for you alright...",324
Dorm revenge,326
"Temp agency recruiter treats me like shit as a temp employee for her firm, awkwardness ensues when she later tries to schmooze me and my boss at my new permanent job",321
Dry toast,322
Scantron Petty Revenge,320
No bill for you!,322
Another Dog Poop Revenge Story,326
Control your Kids or I scar them for life.,322
Craigslist Scam,320
Learn from your mistakes,320
Gesturing while I take your order? Lemme drop your debit card underneath your car in our enclosed drive-thru...,314
I didn't even have to do anything!,315
Yeah I broke you sandal on purpose. Fuck you rude transit bitch,315
Don't butt in line bitch,315
The Bird is the Word.,321
"Eat lava, line-cutter",318
Lesson in common courtesy ,312
The tale of my cheesy meatballs and the bitch. (x-post from talesfromretail),312
"Take THAT, MIL- revenge via unwitting family pet",314
Don't be a bitch to trainees. ,311
Comfy in your rocking chair?,316
"""No, play my song next!!!!""",314
"Enjoy your empty pond, asshat",312
Wanna be a jackass in class? Now you're the jackass who watches iCarly.,314
STEAL FROM ME?! It'll come back to you...at your wedding.,312
"Spoiled bitch pulls my hair, gets kicked out.",315
"Have fun finding another job, bitch.",312
My sister's been being a bitch lately,312
Handful of Change,310
Don't be a bitch on the dancefloor. ,313
Dog park revenge,316
Paying my phone bill...with REVENGE!,312
Unintentional Revenge on Arrogant Teacher,313
Revenge on a horrible teacher,309
Irritating Elevator Passenger,309
"Guy wasn't going to let me out of my driveway, I made him wait at the lights as punishment.",304
"In a hurry to catch your movie, are you?",303
Elevator Revenge,309
Mom took my larger TV. Enjoy walking.,312
Lines of Coke with the Boss's Daughter,309
Wealthy speeders wreck their cars on new speedbumps I forgot to warn them about.,309
Some revenges in my restaurant,310
Rude flier gets a ruder awakening.,307
You interrupt me and I'm gonna make you feel like an idiot,308
Revenge where it hurts,307
I think someone is currently petty revenging the shit out of me...,306
Revenge is a dish best served cold,307
If the shoe fits...,310
"Aunt Tries to Steal Kid, Total Freeze Out",308
"So, you think there's nothing I can do, huh?",311
"I hope you enjoy losing your data, jerk!",306
Berate me at work? Take that bitch!!,306
"Take that, you bitchy waffle waitress.",304
Revenge of the Hippie,302
Only our department can't have a coffee pot? I don't think so.,305
So there was a douche on the road....,300
"Yes, we know you were texting, your face was the only one glowing. ",305
"When telling a teacher doesn't work, learn the system and make it work to your advantage.",300
Someone suggested that you guys might enjoy this. (X-post r/askreddit),304
Cutting in Line? You'll Just Have to Wait,300
"Jerk cuts me off and then drives very slowly, jerk later falls into my clutches!",301
"Pizza with extra revenge, hold the mushrooms",298
13-year-old brother gets shutdown.,300
You Shouldn't Have Let Your Alarm Go Off for Two Hours,301
Protracted Revenge -OR- Full Circle,300
You don't mess with the person who cooks.,295
Leading by example,300
Petty revenge on a racist online-forum,301
You use my eyeshadow? Have two pink eyes.,296
Birth of the Unplug Ninja,299
"Oh, you can do that too?",294
Spitting kid gets his comeuppance! ,297
I prefer my petty revenge subtle.  (Picture in comments),295
Wreck my Sundays?,295
"Dude, stop yelling at the TV.",299
Enjoy your bananas...IF YOU CAN,301
Old ladies and their purses,298
"Sweet, petty, dorm hall revenge",294
Revenge at the Bar,299
Neighbor vs neighbor.,297
"Oh, you missed the train? Maybe you should have moved faster (or at all) when I said ""excuse me.""",294
"I may be your red-headed step-child, but now I'm smarter than you.",295
She will now think of her son when she has sex with her boyfriend.,296
"Huge asshole tastes my asshole, for 16 months.",296
"""Welcome to the biggest party of the year! Oh, and you're on trash duty.""",294
"Shove me out of the way, will yah?",294
Who's afraid of the big bad hot sauce?,295
Revenge on the lake.,291
(Traffic) Cone Wars,293
How does that pavement taste?,293
I Brew Petty Revenge Daily...,293
Master of YOUR Domain.,289
I will not let you pass! Neither will he btw,290
my first act of petty revenge,291
Petty revenge on loud roommate,292
Milkshake,289
Sneaky neighbor puts up a fence on new homeowner's property.,288
That's What You Get for Being Petty,289
Revenge at snarky comment at gym,292
Hope your insurance covers shopping carts.,291
Perfect Use For Random Keys,287
Don't treat your rental car like shit.,290
Superglue.,289
"This probably won't matter to other people, but it meant a lot to me",288
Another reason to not park like an asshole,286
Gas Station Revenge on a Self-Entitled Man,288
Park your fucking bikes somewhere else,290
Parking revenge,286
Poopie Toothbrush: Petty revenge on my own kid,288
Clog my toilet? Have fun getting to work with no keys.,284
"You were a complete bitch to my fiancé? Here, have fun puking!",288
Steal someone's prized possession? Good luck finding all your stuff.,287
"I need my sleep, so please PLEASE stop waking me up.",287
Pizza Delivery Girl Petty Revenge,283
Petty revenge on a bully driver,286
Douchekid at the Park,286
My gf said it was childish. She may be right.,283
"Flatmate thought he could sneakily use my computer, so I made him a new facebook banner.",286
I won't help you calm your children if you get exasperated when I'm being accommodating. ,284
Petty Bed Revenge,288
"If you let your dog attack a child and say the child was ""provoking it"", you're going to have a bad time.",288
death by ghost peppers,288
Announcement: PettyRevenge is text-only now!,284
Revenge over eviction notice.,285
A kindergartener's revenge,282
Thus shall be done to him that ruins the showers of other men.,284
"Violate traffic etiquette?  NOPE.  Here, I'll help you take that exit you're trying to avoid.",284
From 30 minutes or less to 2 hours or more,281
Water Cup Revenge,279
Karma is going to get you,286
Drive safe motherfucker,285
How I made half my Senior Class shit themselves (Very satisfying petty revenge),282
Cold Feet and Frustration for You!,283
Ultimate petty revenge after four hours wait...,282
Juvenile Revenge,281
Honking at me because you're a bad driver? Have a speeding ticket.,280
Don't mess with IT,284
"I'm rubber, you're glue. Whatever you say bounces off of me and punches you in the face",277
