title,score
"Scumbag Bed, after my alarm goes off in the morning",2396
Cee-Lo-Green was banned from my town's festival last Saturday after extreme use of foul language...,2394
To the girl in my apartment building...,2397
Don't know what to get her for Valentines day? ,2394
Extreme Senior Citizen,2393
First Day on the Internet Kid sees a picture he likes,2390
"Since we are doing past Presidents, here is Eisenhower dishing out some truth.",2390
I found out why Gamestop didn't hire me.,2391
She literally told me this 1 week after his death ...,2389
Scumbag Steve showed up to my party last night,2384
A true 10 Guy,2387
Tried out some Mallard Advice,2385
He will. He will do it. ,2385
"Well, that was inappropriate.",2392
This has to be my professors motive. I can't tell what is real and what isn't anymore.,2387
"Extremely advanced GGG, happened today twice.",2389
"Trust is something that should stay forever, even if the relationship doesn't.",2389
God damn customer service,2392
Whenever the national anthem is played before sports,2387
Trying to buy my first car when I know very little about them,2380
I'm a college instructor and a student said this to me during my office hours today. Tragic.,2387
Scumbag Cheese,2379
Reddit's Theme Song,2387
"With All This Talk About Rush and Sharpton, Redditors Need to Consider this Lesson",2384
On a Friday in an IT call center. These are my current thoughts.,2387
Hip Grandpa,2389
helpful reminder,2379
The absolute worst thing during a play.,2379
This always happens at the worst possible time.,2378
Actual Advice Mallard,2383
Nobody's Perfect,2377
"What one of my ""friends"" said when I found my expensive missing headphones, which he repeatedly told me he hadn't seen, in his backpack which he left in my car in which I give him rides to school because his car was impounded.",2373
"When I saw ""Obama considering ending NSA surveillance""",2381
Close call,2377
my cousin is a special kind of stupid,2375
10 Guy Snoop,2376
Took me a year to realize this.,2378
And he cussed me up and down as I walked back to my car still carrying the food.,2377
Scumbag Congress,2376
Scumbag Music Industry,2372
Every time I go to my favorite restaurant,2372
Did someone say how to be a child star? The gold standard...,2372
Since mallard is giving parenting advice today,2369
Misunderstood IT Guy,2377
My friend has his fair share 10 Guy moments,2370
I had never used Chrome at work before the new job I started today. Chrome auto-sync...you son of a bitch.,2372
"After a little over a year on Reddit, I just realized this.",2370
Good Guy Cop: Saved my interview,2370
Thank you Genie for all your noble deeds in my teenage years,2368
That book cost $220 and it was good for all 4 courses of which I've completed 2,2372
Good Guy Obama,2368
"It's your responsibility as the employer; nobody wants to be ""that guy""",2373
"This happened to me last night. Went after work, and realized too late why I didn't recognize anyone till my wife called to inform where the hell was I",2369
How i feel after having 3 unsuccessful months on OKcupid,2372
So this is actually happening just down the street from my place,2367
The wonders of college engineering exams,2366
"As a liberal who can't defend any of the Obama administrations recent headlines, this is all I can say.",2371
The NSA Remembers,2362
"Perhaps obvious to some, this bit of relationship advice occurred to me recently.",2368
"Whenever someone tells me they've had the worst ex, I just smile to myself and listen.",2365
"GG Parking Lot Attendant. Seriously, the best way my day could have started.",2369
Every time I meet someone new. Every. Single. Time.,2367
I caught myself saying this to my bf this morning,2365
"Had a scumbag roommate who did this, hoping I wouldn't read the description on the ticket",2368
Shout out to all my fellow outdoor labor workers,2362
First Day on Internet Kid hits on GoneWild girls,2370
we talked or hung out every other day since the second grade until this happened...,2361
"They lost, but we won big!",2361
My (former)Boss is really a great guy..,2359
I should probably go find a real girlfriend,2363
Convenience karma?,2362
The Queen on the election.,2362
"My friend who lives in Sandwich MA made this
",2361
Scumbag Browser,2360
As an American....,2361
My friends brother is this guy now. Bag of f*cking d!cks.,2355
I should have known better,2363
Me to my four-year-old son.,2359
It's the little things,2358
"Whenever someone posts a ""when you see it"" post.",2363
He's 27,2356
This was my dad after his DIY automatic screen door closer video went viral last night,2354
To the person that stole my bicycle today. ..,2358
"Self-destructive?  Nahh, worth it!",2359
Sexual Picard,2361
"You are the One, Reddit.",2364
I asked my girlfriend what she wanted for Christmas.,2359
Just a paranoid quirk I have,2350
"I, for one, am shocked at the allegations against Golden Corral.",2353
I haven't shaved in 4 months. I'm rethinking that decision now after this little exchange at McDonalds...,2359
i don't know why other girls think this works,2356
I've only seen them in cartoons.,2351
"Wife texts me: ""Expect some jerky on our road trip today!""",2353
I hear a lot of people complain about their in-laws. Mine are actually pretty great.,2352
I just get so excited,2350
Watched a couple of kids asking a GameStop employee to price match Skylanders Giants with Target.com (free shipping and $20 cheaper). Made me laugh when they actually said this upon refusal.,2350
"It's a small success, but it makes me happy",2348
Good Guy Teacher gave us a break after 4 years of robbery,2351
Sums up my experience getting an arts degree,2352
"This disturbs me, especially when there is a two for one sale.",2349
Good Guy Boss,2349
My dad just said this to me...,2355
Household Magician,2351
No more ignoring the law when it is inconvenient.,2350
I wouldn't want her any other way,2357
James Bond Logic,2347
Why can't all online stores do this:,2353
Every time I see pictures of myself,2355
Had to wait for everyone to leave the bathroom,2350
This super sweet guy at Dairy Queen made my day!,2352
I just can't help it,2347
Visiting my folks ... This always happens,2354
Just trying to help the wife with some laundry,2347
As someone who has been collecting coins for 25 years,2343
"Watched The Matrix, it all makes sense now",2349
As A Canadian...,2342
Every morning when I'm hustling my kids to get ready for school and my daughter asks me to say please...,2342
"One at a time, ONE at a time!",2345
We don't see enough Good Guy Bosses on the front page or in real life so after this happened today I had to share,2349
In response to the duck giving advice on getting an IT job,2340
After seeing all the heartwarming posts to people's mothers on facebook,2349
How I feel when I'm home alone at night...,2348
I remember doing this as a kid. Blank CD logic. ,2345
After overhearing a conversation at a bar.,2346
But I thought I was safe!,2344
"Seriously, parents. Your kids need to be able to trust you, too.",2340
Good Guy Rick,2346
Business cat on overtime,2338
My friend is so high he's starting to scare me,2343
This happened to a friend of my family,2344
Second World Problems,2340
As a father of two young girls,2340
Thank you Good Guy Customer,2341
"As a frequent flyer, is this too much to ask?",2340
To the guy who found 400 bucks cleaning his room,2341
"As an unattractive male, these are the words I live by...",2331
A lot of young ladies at the mall yesterday...,2335
Good guy coworker last night,2337
This popped into my head earlier today.  I'm not proud.,2341
Playing video games late at night,2334
I've heard my dad say this numerous times in my life,2336
"After looking for a job for over a year, when someone tells me they work a boring office job....",2335
Thats my boy!,2334
"Oh, and then I laughed like an idiot.",2337
"Realized this about my redditing ""habits"" while at work today",2331
I got ready 5 minutes faster than usual this morning...[Fixed],2337
"Whenever YouTube tells me, ""This video is not available in your country or domain.""",2333
Scumbag online job application ,2343
Why I hate Works Cited pages,2338
you know that err...,2336
"As a manager in retail, I deal with a lot of unreasonable customers.  This was a complaint I had tonight.",2333
Best Ice Cream Sandwhich I've Every Had,2337
"My friend announced the birth of her niece yesterday. Suddenly, I felt very old when realizing this:",2331
I literally just bought money,2333
To the cop who pulled me over on I-90 in New York between the PA border and Buffalo,2335
My husband said this on the morning after our wedding,2337
I hate iTunes.,2332
I guess it only costs 20$ to lose a friend.,2338
This happened to a friend of mine... I lost all respect for her...,2332
I was so scared,2327
So my kids don't get addicted to Reddit I caught myself thinking this.,2330
His reaction was just as awkward.,2334
Currently dealing with this. Sick of it.,2326
This is my mexican friend,2327
I couldn't agree more with Red Forman...,2333
"It's a dirty trick, but it has worked every time...",2329
....or trucking and aliens.,2328
Going through my music library on shuffle ..,2330
Bad Luck Lincoln,2327
"As an older gamer, this stupidity annoys me.",2329
"Oh, CNN and Your Misplaced Priorities (Captain Hindsight)",2327
Good Guy Arizona,2325
Childhood Confession Chunk,2325
Just happened to my friend who happens to be a canadian in america.,2328
I was told this at 3 different stores. Am I the only one who showers all year round?,2320
I learned my lesson this morning. In the most horrible way.,2324
"After years of being financially responsible, I can finally afford a new car and not a used one. Today I encountered this asshole.",2319
Good Guy Alton Brown,2319
Welcome to Your 30's,2329
Baby Godfather in Montreal,2327
Those were the days **FIXED How it really was..**,2320
As a female in Scotland with tattoos...,2319
Scumbag Housefly [Fixed],2327
Printer is running out of ink,2321
My New Job in NYC Starts Tomorrow!,2321
"Seriously, just be brutally honest; I don't judge you for smoking, drinking or being overweight. I'm not your Mum",2322
ADHD kid,2319
This happened to me a few years ago...super awkward. ,2321
When Ice Cube gets made fun of for not being gangsta anymore,2323
How I feel going there for the first time since childhood,2323
Whenever I eat chips in a quiet room,2322
"A hermit here in Maine committed over 1,000 burglaries to live in the woods alone for 27 years. Every 'victim' right now:",2321
Scumbag soup,2321
A more realistic boss for reddit,2319
All I can think about during movies like transformers that have mass city destruction,2319
My friend said this to me today. Probably the best justification for being lazy I have ever heard.,2325
If Business kid were a 90's kid,2320
My boss and his associates during my graphic design internship,2318
First World Problems - The Travel Mug,2320
Bit of advice for small store owners,2319
Scumbag Rioters..,2313
I just saw a commercial for Myspace.,2319
Old Economy Steve,2316
Heard my friend say this to her boyfriend the other day...,2317
Meet my cousin,2317
After going on a George Carlin stand-up bender...,2312
"She came in last week, remembered me, he gave a raise and a promotion.",2317
Asked for half credit.  Got a reasonable response.,2319
"How I feel when I see these kids with ""swag"" ...",2321
"Why Luke, why?",2314
Heard the convenience store clerk say this after a transaction with a good looking member of the opposite sex.,2320
Overheard today at the Apple store. I don't understand parenting these days.,2312
"In light of the new Papa John Hate, I present:
The law of reddit hatred conservation",2311
My girlfriend said this today... I don't understand,2314
This man made my 6-hour plane ride much easier.,2315
"As an IT guy, this is always in the back of my mind when all is quiet...",2315
Thank you lady!!! And yes it is in fact 110 degrees,2319
Are you really going to ask for more money?,2317
My reaction after watching Funniest Home Videos last night,2313
"As someone trying to be healthier, this confused me",2313
I hate trying to play this off,2317
"Remove the top half, and Boromir becomes First World Courage Wolf",2309
This is why my scumbag brother-in-law is never invited back to my home.,2311
I wonder...,2311
Minnesota problems,2313
My g.f nearly gave me a heart attack...does she not know what this phrase usually means?!,2309
I think I lost a great guy,2305
It was his 21st birthday..,2311
I've already explained this 5 times to her,2311
"I told my girlfriend the garbage disposal was broken and she said ""Maybe there's a spoon in there.""",2306
some girls from high school are on their second kid already,2309
Met this guy last night.,2304
Being an adult gamer.,2314
"Facebook's actual response to the ""copyright notice""[FIXED]",2315
Good guy boss: self-employment edition,2308
I find myself stuck in this dilemma,2308
My friend momentarily forgot what an Oven was called,2316
I'm posting this from the office.,2304
When my husband suddenly stops snoring,2303
Dominatrix with OAG,2306
after watching the entire batman trilogy today,2304
The epitome of a first world problem.,2306
I was trying to be nice.,2311
PJs,2309
My roommate's big mistake,2308
Good Guy Winrar,2309
Your sister stories are cute. Throwaway because I don't even want anyone to know I'm related to someone like this.,2308
Happened to someone I know..,2304
Good Guy Joe Kittinger,2304
After seeing the Amber Alert for a missing 16-year old girl all over the freeways and on the internet...,2305
I miss this guy,2301
16 years later edition - Everytime I do laundry as a dad with 2 girls,2306
Dear autocorrect...,2312
While we're on the subject of Jenny McCarthy,2307
I was happy when he finally got fired.,2305
I love Netflix but this really irks me,2304
As someone who has to stay up all night to maintain a graveyard sleep schedule even on days off:,2307
Every time I take a test,2299
How I feel as a Canadian waking up on Canada Day morning.,2306
First date advice from a duck,2304
This should be illegal.,2301
"If this doesn't make the front page, repost it until it does.",2299
The title 'Hero' has a much broader definition than most people know.,2301
He didn't even have a ring...,2299
"My IT buddy, happened yesterday.",2297
Doing my duty as a son,2302
This is probably true for many people..,2297
Sad Vader Went Over His New Employee Packet,2306
"For the freshmen that are about to head to college, you've been warned.",2304
The Peanut Butter Game,2299
This has always pissed me off.,2297
"I congratulated him, and then he started crying.",2304
So... this is a problem,2292
Converting Wraith,2292
What if...?,2304
I work as a male housekeeper. I was chewed out by a female guest today because I apparently wasn't supposed to see them.,2300
The longest 15 seconds of my life,2293
how i fell as a 41 year old new to reddit,2296
After seeing all of the Scumbag Steves on the front page today,2293
The fuck else am I supposed to do?,2301
After switching to contact lenses from years of wearing glasses,2294
Scumbag University,2300
Unimpressed Astronaut,2295
She thought there was a schedule,2299
My Asian mother just told me this..Thanks,2293
"Unfortunately, he's also my boss, so everyone at work knows",2294
Scumbag Congress &amp; PRISM,2297
"It stunned me when he actually said, ""its just a game, bro, who cares.""",2294
The waitress just rolled her eyes and tried to ignore him.,2300
My pops is GGG,2289
As you get older....,2289
"Whenever I get the 404 screen saying that I ""broke Reddit.""",2296
Meet my friend,2293
My scumbag brother,2286
"As a metalhead that frequently attends local gigs, this guy is vital.",2298
Girls have plenty of awkward moments during sex too.,2288
"Anyone who is home for the summer, and lives in a small town will especially understand.",2291
there's a reason no one likes you,2294
"As someone who didn't grow up around a lot of black people, this was me last night at a party.",2292
"The sun is out on my way to work this morning, when suddenly... ",2289
Who else does this?,2296
When my wife asks me how is it that I am always in the mood when she is,2295
A kid in my class's actual excuse for why he had to reschedule a test,2290
"Hey, Java...",2291
I heard my uncle drop this one last night,2289
When my friends say they hate one race because of their job. This is what I learned in just 3 weeks of working retail,2288
By a redditor for reddit. I'd appreciate your Feedback!,2288
What is this? 1996??,2287
Women can be awkward too.,2284
I will never help you again.,2292
Still my favorite professor to this day,2290
What my grandmother said after hearing my cousin was dating outside our race.,2289
Didn't realize how insecure I was until this happened.,2291
Bargain!,2287
Thought about this on my anniversary a couple of weeks ago...,2290
I'm just trying to get healthier.,2293
"I have a cousin who really believes this, and I'll let him keep believing it",2291
Had an epiphany while taking my final today,2289
I got to work today and realized I didn't have my wallet.,2285
This one of the busiest weeks of the year for dog shelters,2285
"Quit smoking 5 days ago and have been experiencing horrible cold symptoms, intense leg cramping, constipation, and insomnia",2287
Tis the season,2287
My Apologies to Gays and Farmers.,2287
Good Guy Matt Lillard.,2289
After hearing all this race talk about the trial,2280
Hey. Sony.,2281
How I feel after celebrating my five year anniversary with the same employer,2287
I should have known it was too good to be true.,2284
This just happened.,2286
"As a cashier saying the same things over and over, this thought popped in my head.",2284
"A year after being introduced to reddit, this is all that can be said",2285
"My little sister dropped her iPhone in a creek and broke it, so I lent her my old flip phone. 15 minutes later she ran into my room with this:",2285
How I feel when I play against young gamers online as an adult.,2284
James Bond Logic,2289
Heard this from a girl I work with.,2279
30 year old realization about my college career.,2283
Feels good,2283
"After 30 minutes of wandering around Best Buy, I had a thought. Worked like a charm.",2283
Browsing on mobile gets tricky sometimes...,2285
My secret for great customer service,2283
I already work harder for them,2283
My sister told me this after she said she didn't want kids of her own,2282
Did you hear the creator of McAfee is wanted for murder?,2285
As a man approaching 30....,2281
So yesterday I received an email from my work about upcoming employee training,2284
"Welcome to Bizarro Reddit, where up is down and 2+2=banana",2282
I work as a janitor at a high school. Fuck this kid.,2281
They must be so proud...,2279
"My brother, ladies and gentlemen",2279
good guy security guard,2282
When the girl at my work wears revealing shirts...,2279
Youtube's automatic captioning feature.,2280
Upon Graduating College,2276
"Happened to me today, I just turned and left.",2280
I wish I would see more Good Intentions Axe Murderer,2281
"Thank you, stranger",2278
This happens way too often,2280
"3 years after graduation, still one of my scariest dreams....",2278
Good Guy Soviet Union,2281
Whenever I take hot showers in the summer,2274
I heard you like fire and cops,2275
I should do the dishes.,2274
"Soon, our time will come..",2272
First time at concert kid: me when I was 14,2271
Ultimate first world tragedy,2275
This happened yesterday on my first day.,2270
When my professor told me I would have to get a 99% on the final to pass the class...,2274
After three years of lifting weights,2276
I'll never understand,2275
I literally found out this morning.,2271
Using gas station bathrooms,2269
I'm starting to subscribe to smaller subs and am beginning to notice this.,2268
Upon learning Usain Bolt's peak running speed is 27.8mph...,2271
"$200 fine, 20% increase in our car insurance, and my wife was in a bad mood for 3 days.",2271
My nephew dropped this one on me yesterday,2267
Just happened...,2268
One of many unfavorable opinions.,2274
"Myself, and a few other dog owners there, did not understand this persons thinking.",2269
"Screw the confession bear, why should I feel bad?",2267
Ad execs should write this down.,2271
Discovered this by accident and it works like a charm.,2269
Good Guy IT Guy,2264
Amazon summer sale,2266
I'll make sure to grill an extra steak for him next time!,2261
Good Guy Taxi Driver [Fixed],2268
How I feel after being turned down from 20+ jobs these past few weeks.,2271
Bad Luck Brianna/Brenda,2271
Scumbag Adobe Reader,2267
Realized this while thinking about past relationships.,2262
In response to Obama considering ending NSA surveillance,2269
One of the MANY reasons I feel like the luckiest girl in the world,2268
It looks like Al-Qaeda is attempting kill Canadians now.,2264
Probably the most selfless act my girlfriend has ever done for me!,2268
former 28k owners know this. [fixed],2269
Turns out confidence can backfire.,2263
Whenever I feel any abdomen pain,2262
"Needless to say, I'm a little excited to study abroad there next semester.",2266
When my new girlfriend said she was into role-playing,2269
History Channel is at it again.,2260
"Lucky Americans, unlucky Canadians. Over here in Australia....",2261
North Korea's weapons arsenal,2261
Bad Luck NASA,2263
As the father of a baby,2261
Her mom's maiden name and my grandma's maiden name are the same. Why.,2262
The Epitome of Scumbag Girlfriend???,2261
"How I feel looking through the ""for sale"" section of Craigslist.",2258
Most Interesting Man,2266
A friend randomly said this the other night after sitting quietly for almost an hour,2263
"Seriously, enough.",2263
Good guy company - it's just nice to atleast know,2262
This literally just happened to me. Fml.,2256
So I've been getting overpaid by about £20 a week recently...,2262
"I'll just go ""fuck myself""",2264
How I Feel Applying For Jobs Lately,2259
My reaction when i see people with 6 digit karma,2260
Now Romney knows our pain.,2258
These are the worst kind of people,2258
Business Cat,2255
Our Good Guy boss dropped this on us at the end of work yesterday.,2262
When I saw my girlfriend's 411 charges on our phone bill,2258
"They always have a bio that reads ""looking for that special someone to share my life with""",2261
Finally offered an interview for my dream job then this happened.....,2256
"Massive argument with SO over money (we're struggling), missed breakfast, and was 15mins late for work... just when I thought it can't get any worse... this happened...",2262
As a northerner living in the south...,2262
Every time North Korea releases another propaganda film,2257
My rule for jeans,2254
After 1.5 years in Europe.,2260
I think they were worried about the salty language,2258
As someone redditing in the UK...,2256
Polar Bear Patiently Waiting (fixed),2260
Not my finest moment,2256
How did this even happen today?,2255
As a european shopping in the USA,2254
How my 36 year old self feels after spending too much time reading all the teen/20s angst around here,2251
Good Guy Lego,2258
To some members of my family and some of my in-laws. It's getting a bit ridiculous.,2257
When you have a shy guest over.,2258
my roommate is the worst,2256
Condescending Jupiter,2255
True for All of Us...except these people,2257
8th grade me wanted the words back immediately,2256
I really hope she didn't hear me...,2256
Good Guy Wikipedia,2256
My mom doesn't understand that Google changes the logo regularly,2254
How to spot a pyramid scheme...,2254
After three seasons of Game of Thrones...,2252
"As unbelievable as it is, an ex-coworker actually did this.",2256
I work at a hotel front desk and someone just asked me the U.S. telephone country code.,2256
My boss actually said this to an Asian customer last night,2256
Large Albums on Reddit,2251
I have never known boredom like this.,2255
Every time I read anything posted on AskReddit,2248
"In honor of Father's Day, this is the crap my neighbor's wife used to pull when they were still married",2252
It seems like there are a lot of Steves at weddings...,2255
"My 77 year old Grandpa refuses to turn on his central air conditioning, even during this extreme heat. This is his reasoning.",2249
Perspective,2254
Can't believe that this shit still happens.,2256
Helped out my roommate with his homework recently.,2250
I just don't understand,2252
Good guy Pitbull does it again.,2250
Scumbag Steve,2248
They thought they were so sneaky...,2250
I'm kind of a nerd and the girl I was just partnered with for our chemistry project was overly excited when we were paired together.,2254
I've been on a strict diet for the last few months. Just had a piece of pizza...,2251
I got ready 5 minutes faster than usual this morning...,2254
Good Guy Spider (happened in my dorm),2251
Guess Everyone Forgot,2252
Wasn't expecting this from my older brother.,2245
"Sincerely, as a mobile user",2253
First world problems in the kitchen...,2249
Good Guy Blue Moon...,2250
Realized this too late,2247
Scumbag Stacy,2246
This really is perfect. Sometimes procrastination pays off.,2251
Another programmer chiming in.,2248
"Ridiculous CNN Reporting. Seriously, CNN? These are the words you choose to use???",2244
Good Guy Local Pizza Shop Owner: The unsung hero of the pizza battle,2250
I cant tell anymore,2243
Scumbag Wired.com,2246
For the prisoner in Wales who thinks his life sentence is inhumane...,2245
Not a proud day for me,2246
My dad (a landlord) just had this complete asshat move out of one of his properties. Makes me furious!,2249
More people should understand this.,2250
Skip dvd previews,2239
Female Celebrities,2239
My cousin just laid this one on me. ,2236
"As a pizza delivery driver, my reaction when I read today about every other driver stealing money.",2248
Not all New Yorkers are douche bags.,2246
I didnt know what else to do...,2244
This always happens at the worst possible time. [Fixed],2239
