title,score
Every time I talk on the phone,7866
If you ever feel dumb,7813
My new party trick,7220
Senior Discount,6641
Come on Facebook...,6515
Following the Obama AMA,6421
How I feel after having my data cap upped from 200MB to 5GB,6037
A solution.,5909
My buddy found out he was adopted in our class today.,5879
It just might save your life one day,5830
My little cousin dropped this when all the adults were talking forever on Christmas morning,5417
Indian Yo-Mama Joke,5391
My friends recently convinced me to purchase Minecraft.,5282
Bulldog Owner Problems,5144
"To all of the people squawking about the NSA, and the XBOX1 'spy' console, and the huge server farm holding our entire country's digital histories...",5119
I told my girlfriend that I didn't want to have sex because I was too tired. So right before we got it on she said this.,5056
Let me introduce my brother.,4967
Coworker turned my creeper shot into a work of art.,4793
"Oh duck. You poor, naive duck.",4793
When my parents come over and tell me to clean.,4796
My girlfriend's family pampers their cats like real people. This is how I picture them living.,4704
Success Gorilla,4663
Random gay guy just made my day a little bit better with this one,4558
Asked grandpa what he did his senior year of high school...,4530
"If you ever do home improvement projects, you will appreciate this minor victory...",4535
Good Guy Cops,4518
As a South Korean...,4438
What running Imgur must feel like.,4414
It's the most wonderful time of the year,4397
I hate these websites.,4333
Realized this after shopping yesterday,4257
Seriously? 75 seconds?,4256
If you work in a restaurant you know this feeling,4255
Good Guy CEO of Costco,4188
I work with this girl,4185
Can we please get our priorities in order?,4141
Today was the first day I got hours off in about 8 months,4126
As someone who is fairly new this is how I feel about my budding Reddit addiction...,4125
I figured out the internet,4099
I don't think you get it Beats...,4049
Bad Joke Eel,4039
WE'RE DOOMED! (x-post from funny),4012
Scumbag Brain... seriously...,3946
Good Guy Brother on father's day.,3885
Nature valley bars,3872
People in the meme.,3821
What I think when a car going the speed limit holds up traffic in the fast lane...,3802
Just had to turn down an all expense paid business trip to Sydney...,3789
How I feel when I arrive at work in the morning. ,3747
When an unseen ad starts playing music in one of my tabs.,3734
My Grandfather actually said this when we talked about going hiking this morning,3715
Actual Advice Mallard on sappy songs and chick flicks,3704
Zen Master Orangutan,3686
It happens more than you think,3676
The wonders of test taking in College,3677
Going to a bar in your 30's,3670
"Good Guy Wikipedia (seriously, give them a few bucks)",3633
Newton's third law of reddit,3617
Let's be realistic about this..,3601
Troubled Rebellious Asian,3578
I think we've definitely nailed it so far,3573
"Don't know who else to tell. As an overweight guy who has gone through a lot of bullying, Certain things were my comfort.",3569
Skeptical Third World Kid on Hurricane Sandy,3572
If it is worrying you... [Fixed],3531
pirate cat ,3529
The opening caption of the premier of the new season of Futurama,3527
A disturbing trend on most websites (Fixed),3511
My plans for the night,3488
Quickmeme is banned reddit-wide. More inside.,3478
Living in a small city is a pain in the ass,3475
Almost had to learn the hard way,3464
I laugh on the inside every time...,3457
Just got emailed this requirement from a potential employer,3444
Good Guy Canada,3433
Am I the only one who notices this?,3408
The Third Wheel,3407
The greatest discovery I have made in my college career.,3395
This North Korea situation,3389
Scumbag Susan G Komen,3358
I drive a car that I bought for $500 dollars 6 years ago. This success is dedicated to all of us who drive shitty cars.,3353
Uncooked Squid,3347
Germany's Circumcision Ban,3339
Probably the most truthful thing ever posted on my university's meme page,3336
It's not the length of the vector...,3335
IAm Bad Luck Brian AMA,3328
Scumbag Steve gets his Girlfriend pregnant.,3313
When my wife suddenly stops snoring,3313
The Most Irritating Software in the World,3298
"Advice Mallard on Dating, works the other way around too",3283
"Just found this out about a friend, makes me glad to know him",3285
My experience with Reddit lately,3285
Good Guy Little Caesars: Winner of the Pizza Dispute,3265
Good Guy VLC Player,3272
Good Guy Mike,3246
"I somehow miss this guy, he was so useful",3224
Boyfriend pulled this one on me today...,3221
"i never met my father, and was raised by my mother. shes the strongest person i know, so i celebrate fathers day differently.",3218
Every single time...,3206
Girl at this party pointed out that my zipper was open. Didn't realize my fail till the next day,3197
When I found out kids want Furbys for Christmas ,3192
What my husband said to me while we were both incredibly stoned and having sex:,3189
Reddit recently,3193
I just found out that my boss is sending me to Russia for three months.,3193
Good Guy Rock,3194
Medical Joke,3165
Today I had to fire our intern for being absolutely useless at every task. During the conversation she drops this on me with full sincerity,3166
How I feel seeing fellow motorists commuting to work during the Hurricane.,3164
Every time I go out drinking...,3124
Good Guy......Everybody,3127
I die a little inside,3105
As an American lately.....,3102
The worst Steve I know,3081
Truly a Good Guy Santa,3076
They planned this all along,3062
They Say 1 out of 3 People Cheat in a Relationship,3061
"Good Guy Teacher, I owe my diploma to him",3061
I tried lip reading the animated Picard meme. I think I nailed it.,3063
Me right now,3057
Everyday of my life.,3046
Paranoid Parrot Strikes Again,3047
Seen more than one couple try this one...,3037
years from now,3034
I quit my job today. I always knew my boss was a good guy... and this was his response.,3021
Stuck behind an annoying driver,3015
How I judge who deserves an upvote..,3002
Tech Impaired Duck,2997
As a camp counselor...,2991
"Thinking back, I can't believe how stupid this teacher was.",2985
Happened to me earlier ,2983
"I've seen a few ""got caught masturbating"" posts today",2984
When I don't go on Reddit for a few days...,2974
Before it's too late,2973
Good Guy VLC Player,2966
So I let the guy who opened the door for me skip ahead in line and he does this.. Never been so out Canadianed in my life!,2965
It happens far too often,2966
Good Guy Meteorite,2952
My little brother just told me this.,2958
"And then I said,",2942
"And I suppose she calls oral ""sucky""?",2953
My family's concerns for me always seemed misplaced.,2946
How did I not realize this before?,2924
"As an IT professional, I despise these people.",2925
"When I was 8 years old, my dad walked out me, never to been seen or heard from again. On this holiday, I try to have a sense of humor about the whole thing.",2927
Scumbag /r/politics Mod,2921
got an essay due? i'm sure someone's done this before...,2907
Scumbag Reddit and the removal of Overly Attached Girlfriends IAmA,2907
"Every episode of this show, ever",2914
Good Girl Aisha made me feel special,2910
Every news station in Boston right now...,2890
I feel like the world should know - Good Guy Costco,2893
Whenever I'm talking to my 6 year old cousin,2879
Good 10 Guy Greg G10GG,2885
Living with 5 roommates doesn't mean I can't dream.,2881
This actually works!,2873
This happened to me today during a seminar on sexual assault and rape,2860
Why I don't trust pool bars.,2853
"It took me years, but I finally just call the man 'dad' rather than by his first name.",2844
Gave her a nod anyway.,2840
The best thing about watching a TV series online,2832
"Jeez, kid. You're only 10.",2824
I'm on her account now because she's passed out on Vicodin. Give her some karma!   ,2820
Chris Hansen Raptor takes on Instagram,2818
Thank God for Good Guy Greg,2826
10 Goat ,2808
My ultra-conservative dad recently helped a young gay couple move in...,2792
My mom did this last night.,2794
Friend had this revelation after a party last weekend,2793
My boss found out part of the frame rusted out on my Jeep and that I don't have money to fix or replace it...,2791
Scumbag Printer,2786
Every time the tornado siren stops.,2783
Watching tutorials on Youtube,2779
As a 21 year old living on my own for 2 years now I wonder this everyday.,2774
The least used feature of Windows. Ever.,2769
"After 3 years on Reddit, this is sorta how I feel",2777
"Lookin' at you, CNN...",2776
Every Damn Time,2776
Just found out about this GGG in my neighborhood,2768
Masturbating Spider-man everywhere,2773
As someone who doesn't smoke that works in the kitchen.,2757
Hail to these PC problem life sivers,2759
 Well North Korea is still looking to nuke us. I'm not sure if Rodman was totally honest with Kim Jong-un.,2758
"What always happens at these ""town hall"" style debates",2755
[Album] I figured I might as well get a head start on the inevitable and just turn everything into bear memes.,2762
Scumbag Gillette,2757
Bad Luck Brian,2750
I was channelsurfing last night and Thor was on. After watching the entire movie this dawned on me.,2749
Posting Scumbag Stacy/Steve memes about your ex hoping they'll see,2745
"With respect to iPhone5, This weekend...",2746
How Reddit *WISHES* GoneWild Works (SFW),2745
My problem with universities,2739
I can't be the only one thinking this about Sandy,2741
How I feel without a nice computer.,2741
After my girlfriend returned early from her cancelled girls' night out and told me to get ready to go out....,2732
This guy at the DMV office while getting my license,2735
When I use the reddit search bar,2732
Story of my adult life,2726
The Most Interesting Post in the whole reddit,2721
Good Guy Motorola,2713
"LOL, poor Alaska.",2714
I just heard a co-worker admit he does this. A true GGG of parenting.,2719
Stereotypical Black Father,2709
Why we ultimately went back to Netflix.,2711
Scumbag Sun (Every Fucking Time),2710
To everyone celebrating the defeat of CISPA,2712
Scumbag University,2700
Saw this on the news today. ,2703
For those of us with shitty internet connections.,2695
Insanely Scumbag Elementary School [story link in comments],2693
"As a father working 2 jobs, supporting his wife (stay-at-home mom) and 3 kiddos, this is all I really want for Father's Day.",2702
Every gif I ever watch.,2697
My friends dropped glow sticks into a waterfall. Long Exposure Photography [Fixed],2696
Bad Luck Bus Driver,2695
How I feel at my new job.,2684
First World Problems,2682
HEY MICROSOFT WORD,2683
How I feel wearing contacts after 15 years of glasses,2684
Really made me respect my boss so much more. Not only as an employer but as a parent.,2686
Every time,2681
Overheard a kid no older than 10 say this to his parents while at a restaurant...,2680
For a non-franchise Pizza Place this is devastating,2686
"I'm hungry and my refrigerator is full, but...",2676
Good Guy Doctor,2674
First World Problems,2672
Phone app developers need to understand this,2675
Most Annoying Feature on YouTube!,2677
"My husband last night: Good Guy, Bad Luck, Scumbag 10 Guy.",2670
A Teacher Friend Just Texted Me to Let Me Know Why They're Still at School at 10PM,2674
The wife and I went to try out a new pub last night and this happened...,2672
What an age we live in!,2677
Whenever i think about the war on drugs.,2674
After I received my first paycheck,2667
Presidents' Day,2666
As a Hairy Man,2671
"As a Panamanian, how I feel about the recent missile seize",2662
There's no reason for this!,2659
I just did this,2657
Was filling out a job application,2662
It's been a tough week for the supreme leader.,2655
I don't see enough Bachelor Frog here.,2655
Every time I show my Kansas I.D when visiting a different state.,2655
I fell in love at the gym today,2650
Something girls never understand in the summertime.,2641
"My daughter is 4, we're just not ready for that conversation...",2643
I can't tell if I'm a heartless asshole or not,2643
"Seriously, every other form of technology has dropped in price drastically.",2647
Life on break when trying to be productive...,2644
"My wife, and all her female friends nowadays.",2632
Even though I am sad he said no... I feel this is a Good Guy Viggo move.,2637
Grandpa said this to me while working on farm.,2638
A Sad Day On My Couch,2632
It was not a pool party,2624
sexy time iguana,2624
My check engine light turned off today...,2622
Cat takes his boat out,2624
Best day of work I've had in weeks.,2617
In capitalist America,2620
Futurama Fry on Obama,2617
GGG Neighbor,2612
Happy Christmas?  Merry Holidays?,2610
What I find when searching for a job...,2605
Enough cash in the checking account to either order a pizza or buy toilet paper. Crisis averted. ,2602
Forever Torrenting.,2598
friend said this... technically she's right,2601
Actual Advice on Rental Cars (from a 3+ year employee),2599
"""It's right there... no there... right where my finger is, cat.""",2598
Sometimes the universe just has to remind you who you are,2592
Every time I'm asked to download a toolbar.,2599
Bachelor Frog On Cooking,2598
As someone who has recently started their first full time job this was a shock,2591
"In Britain we have something called ""Sun Guilt"" [x-post from britishproblems]",2593
Jim Gaffigan,2592
"This is an actual meme we have in Egypt (translated from Arabic). 
Salafist Logic.",2595
Misunderstood Mr. Krabs,2586
"Since it is Good Guy Cop Day, here's mine...a GGC who didn't just take my report and blow it off after I left...",2588
Clearly I was a mess beforehand.,2585
First word parental gaming problems,2584
Lazy College Senior on HW,2585
"Seriously, it depresses the shit out of me.",2580
I'm lucky my wife ever married me.,2583
I don't understand these water balloon tactics,2583
Scumbag Brain goes to school,2583
Scumbag Website,2570
There ARE good cops out there. They're just lonely.,2571
My mom really loves the socially awkward penguin meme. So for her birthday last night:,2571
Overheard on a patio.,2573
Every single time.,2567
The logic I use when watching a movie with multiple main characters in the same dangerous situation,2575
While carrying a girl after she hurt her ankle hiking.,2565
Good Guy Law Professor.,2566
First World Celebrity Problems,2570
"It's really what Facebook was designed for, guys...",2561
Realized this when driving into work today.,2573
This was my friends uncle,2561
My brother started asking me about 4chan. He then said this - Imgur,2556
No one has ever checked.,2560
"As someone who moved to the rural Midwest from Los Angeles, this happens a lot.",2564
My dad asked me this the other day...,2557
Stuck in the car on a road trip when this conversation began.,2550
The dilemma of living within earshot of a playground...,2552
"If it WAS a date, I'd at least have gotten that fleeting self-esteem boost",2551
I also deliver pizzas.,2554
My first thought when reading all the midnight comments in Australia.,2540
This is what the new Red Bull free fall makes me think of,2546
Happened to me on vacation.,2545
Neither would I.,2539
Governments and corporations have always hated the people who expose their seedy underbelly,2536
Office Thoughts,2539
This guy saved my mom a lot of money..,2535
Since we're giving advice to college freshmen,2534
WHY DID YOU BOTHER HAVING ME TYPE IT IN?,2537
Flying with Air Snape.,2536
Got mine back this way.,2537
My BEST friend's little sister told me she wants to lose her virginity to me before she leaves for college.,2535
The priest was clueless,2527
My finest moment as a college student.,2530
Me just a moment ago.,2530
I think about this too much.,2527
"My friend couldn't think of the word ""feather.""",2523
Bill Clinton shares his wisdom,2519
"AT&amp;T didn't ground the wire while installing my internet. As a result, a lightning storm destroyed my modem and computer. They admit it's their fault, but refuse compensation.",2521
Every time I turn on the radio taking the kids to school...,2523
Scumbag notebook.,2522
As a guy dating in his late 60s,2519
That syncing feeling,2519
What my cousin said when I asked him about his trip to Miami from California,2517
"As an exhibitionist, here's my request to the NSA.",2524
So this happened at the grocery store yesterday... I'm sure some of you can relate.,2512
Northeast: Reporting for duty,2514
I wish someone had given me this piece of advice a long time ago. [Actual Advice Mallard],2513
"When Reddit doesn't let me post until later because ""your posts have not been doing well recently""",2518
Overheard this girl today ,2514
You finally remembered…,2514
Lucky Americans don't know about Scumbag Canadian Netflix,2514
My friend tried to surprise his girlfriend last weekend. It didn't go as planned.,2506
My landlord said this to me today,2516
I can't believe this guy. My best friend basically donated his computer to help his cousin out.,2513
0 new threats detected,2508
As a guy Dating in his Late 20s,2515
I work for a gas station and filled in for a no call no show last night. While there we got robbed. As he was yelling at us for the money all I could think about was this.,2508
It's my daughters 8th birthday. There are 6 girls sleeping over...,2505
Since I really can't do anything to affect the risk of North Korea starting nuclear war... I might as well do something productive.,2512
As a senior in college...,2505
The more downvotes it has the more I wanna know what it said.,2504
A guy said this to my identical twin friends,2499
This happens way too often...,2498
My dog just did this. I am a proud owner.,2495
Just put them all on one page!,2503
My mom just said this,2493
I had one job :(,2488
My university kept telling me it could help me get a job...,2492
An act of kindness that surely didn't go unnoticed.,2491
"As a single girl new to the area, i was pleasantly surprised to find this discovery at my doorstep after a night of drinking",2490
Just want to take a moment to celebrate #1.,2489
It went as expected.,2482
"Me, using Spotify for Christmas music around family",2489
I thought it was pretty self-explanatory,2489
Bad Luck Lobster,2488
Scumbag Microwave,2489
The guy in front of the checkout line didn't have enough funds.,2483
Over educated problems,2487
I think this meme is all too underrated. ,2485
"Pool staff are not child care, they are there to run a pool!",2483
My roommate shouldn't watch daytime news.,2486
"So I wanted to quit my job early to have time off before my new job, when my boss pulled this...",2482
How I feel as an American the last few years,2475
Kids today will never know this 90's problem [fixed],2482
Scumbag genes,2481
Someone gave me reddit Gold for correctly identifying a Star Trek episode.,2479
Scumbag Cameron,2486
When buying concert tickets to your favorite show..,2475
"You're not being polite if you don't, you're just creating confusion and increasing the chance of an accident",2477
"Having 3 day weekends all summer, this is how I feel when my girlfriend has work early on a Saturday.",2483
Was reliving my childhood when I noticed Scumbag Ms. Frizzle,2473
What this meme has become,2473
As someone with three dogs,2472
The essence of programming,2479
Girlfriend dropped this unexpected one this morning...,2477
My reaction when I heard about Prism.,2471
Know this from having to do it far too many times at work.,2471
Guy next to me said this today,2475
Good Guy Neil--Never felt so good so good!,2471
What reddit should do for april fools day,2470
"I don't know what it is, but I want it.",2468
My friend's conclusion about learning English as a 2nd language,2471
STOP LISTENING TO THE DUCK,2465
"I had to listen to my step mom bitch the whole week, I couldn't believe she was actually getting upset at people for this.",2466
"I told her to ""just pay it forward someday.""",2467
As an American who can remember past last Thursday,2457
I don't want your lotion.,2459
Scumbag UK,2459
Scumbag bank of america [fixed],2458
Best of luck to the guy who proposed to his girlfriend. Hope it doesn't go like this.,2456
Boss sprung this on me on the first day...,2454
I recently watched Galaxy Quest again and I always thought she looked hot in it but I didn't know this,2461
The NSA is spying on us?,2456
Romney's loss is another country's gain,2467
YouTube has been pissing me off lately,2453
Whenever someone asks me which Korea I come from,2460
People who live in heavily wooded areas will know this pain.,2459
"I got laid off last night, out of nowhere, but BLB turned into GGG...",2452
I was witness to this today,2455
"Here's my shot at it, blank inside.",2454
It's happening right now! I can't believe it!,2459
Best audit ever. ,2452
"It's summer vacation, so I watch this show most mornings. I've seen all of the stories before.",2458
anyone else in the midwest thinking this?,2451
"This is a universal constant, no matter what game, movie, or TV show you're looking at.",2447
"As a small business owner, this has kept me successful for 12 years.",2455
Just noticed this when the next episode of South Park jumped to the 40 second mark,2452
Living with 4 other roommates is not productive...,2447
The NSA reaction to Montana's anti-spy law...,2453
Good Guy Employer,2448
Confession Bear,2450
Confused Jackie Chan,2445
"Thank you Reddit, who says you're a waste of time",2443
Tired of your shit YouTube.,2447
"To the mom who got mad at me for ""saving seats"" after my wife and kids got up to get a drink of water.",2445
When my food is served within three minutes of ordering...,2447
Someone said this to a Native American kid when he told us he was a navajo.,2448
I was stunned by their arrogance.,2445
"Some fuckwad hit-and-run driver is going to have a bad, bad day tomorrow.",2446
Vindicated Dale,2445
Good Guy Teacher,2438
oh well,2444
Raptor Claw?,2439
Good Guy IT Guy,2443
Happens all the time,2442
So this just happened...,2441
Why I will never work retail again.,2441
Why do they try so hard to keep it secret!?,2444
What this made me think of,2438
Heyyyyy dad...,2433
Even if you tell them not to tell anybody,2437
Good Guy Triple Amputee,2433
"My roommate thinks he's a GGG, but I know better - and yes he's a redditor",2432
When I asked my grandfather if he was a boyscout,2438
my girlfriend has been out of the country for five weeks now.,2436
Its especially satisfying when its her mother calling,2430
My thought after seeing the New York 1944 picture on the front page...,2434
I met Scumbag Steve today at the DMV.,2427
Snowden took Mark Twain's advice,2430
It seemed selfish on a friends big day,2436
This happened at a bar I work at. I was stunned.,2431
"So, I finally checked out the 2013 Maxim Hot 100 List",2430
"Skype, you keep using that word...",2437
My friend dealing with a GGG,2433
Every time there is a death in a TV show,2433
Awesome Armstrong,2433
Good Guy Potential Employer,2428
Good advice from someone who does this all the time.,2430
"As the anxious new guy, this is one of the kindest things anyone has ever done for me",2430
To the engaged couple,2489
"Thin walls, 6AM",2431
What my Grandpa said to my Grandma when they were on vacation last week.,2427
Happened to my brother last night. He bought the guy drinks while apologizing profusely.,2426
all the time,2425
I didn't ask for it but I'll take it!,2421
I don't think they've noticed,2421
Shopping websites do this all the time,2424
When learning to speak French..,2422
Cancelled my AT&amp;T service. They actually said this.,2419
Thanks a lot Ed Snowden. Thanks... a lot.,2421
"When my dental hygienist starts flossing my teeth and says, ""When is the last time you flossed?""",2424
I work overnight at a gas station. This is how people react when they walk in and I'm mopping the floor.,2421
my brother's first grade teacher said this to my mother with a straight face,2419
Observed this grand scenario happen on my campus,2414
Every time I see people do math with a pen,2414
some advice i've picked up over the years,2415
"NSA won't like reading this, but the role reversal is hilarious",2411
Damn right it's nice to meet me!,2414
"Been doing this for years, never thought of it like this until this morning. ",2419
Dr. Seuss for karma whores.,2407
Socially awkward penguin gets a haircut,2417
Optimistic Otter - Thank you RES,2410
Old people don't really get the internet.,2411
Work is so much less stressful this way,2408
After watching myself on a video project I had to do for class...,2412
"As an actual ER doc working at a major trauma center, I've seen too many abrasions and concussions not to share this piece of advice.",2408
I do this all the time at work!,2410
Applying for jobs online,2412
I just really have to prepare... ,2411
As a college student living paycheck to paycheck,2407
I feel so dirty,2407
First thing I thought after seeing this picture,2404
"As a parent, I would like to thank all the Good Guy Gregs out there.",2404
90% of gifs on Reddit,2404
Whenever I'm making plans with friends or a date,2406
Now we really know what is going on Shurtugal929,2399
Advice from a paramedic [FIXED BY ATTORNEY],2407
Storytelling dog,2399
I don't open success kid links any more.  I assume it's just this.,2400
Being the niceguy (girl) doesn't pay off at all,2399
This is how I feel as a 30 year old bartender.,2400
The irony is certainly not lost on me,2403
Basically every restaurant in a reality show...,2406
After the events of today.,2400
Good Guy Aaron Paul on his AMA,2398
After working out for 10 minutes,2397
"To the lady who yelled at me for saying ""what the fuck"" in front of her son yesterday at the beach.",2399
Not too sure this is the right meme but here goes nothing..,2399
As a middle aged man after 3 months on Reddit,2397
God Fucking Dammit...,2401
My reaction to the last Dorner development,2398
Samuel L. Jackson,2398
This scenario has always worried me when I go out boating on the 4th of July.,2392
I think you've confused me.,2393
