title,score
Friend of mine got his Snapcaster altered by Eric Klug,586
So I found this in one of my grandfather's super religious books.  Apparently we're a cult.,583
"Spoilers, day 2",577
Another example of deep flavor text (and awesome card art),585
All twenty FTV:20 cards spoiled!,571
Counterspell Alter,575
Magic: The Gathering Turn Structure Cheat Sheet [PDF],582
New spoiler from PAX East--Shadowborn Apostle,575
Got a laugh from the SCG Open Top 8 profiles ,575
The Temptation Is Overwhelming.,577
"Hey Kyle, you're awesome.",577
Cute Prerelease combo i had last week...,576
Rockin' alt art for Dance of The Dead,573
Wanted: Spoiler assistance TONIGHT,570
"Sydney, Australia had a PTQ today. It was the worst-run PTQ I have ever heard of or attended.",569
I have put todays DGM spoilers in an album if it helps anybody.,567
"Holy shit, just thought of this. Totally fun for a control deck!",572
So I won my first game in draft like this :D,571
I just noticed something cool- these two cards are both done by the same artist.,569
"Emracool, the Aeons Hip",573
"I was at GP Charlotte, traded from a foil Guildgate to a heavily played Savannah",573
"Photoshopped my boyfriend a ""Counter-Top"" playmat",575
"As a Magic beginner I had a hard time understanding when and how Standard changed, so I just made WhatsInStandard.com. Hope it can help someone out.",568
"My new favorite foil proxy: Kiki-Jiki, he who breaks mirror",565
[GTC] All Gatecrash spoilers for 1/2,566
M14 Spoiler - Goblin Diplomats,567
My favorite Liz Nugent comic.,572
"Traveled 6 hours for a ptq, looks like some old friends left a present for us at the hotel",569
This is how we did combos in '94 [fixed],563
May's FNM promo is... Judge's Familiar!,561
My friend's decided to make me a guide to help my play my deck at pre-release.,558
Friend of mine collects Magic dice. He says there is only a single dice he is missing as of now.,559
This got pulled in a DGM pack at prerelease. Anybody have any idea what it's for?,564
Thespian's Stage,562
Fuller art island,567
I got a wonderful addition to my collection today!,566
I started painting some cards back in January. These are some of my favorites so far... (imgur album),561
29 More Magic 2014 Cards,560
The updated version of my Priority Chart I made earlier.,560
Received one of my reddit trade thread trades today. Couldn't of been more satisfied.,560
Still into bad combos? Here's a hilarious one.,564
I think it's interesting that we inadvertently made the black equivalent of Primeval Bounty.,557
"Full art repainted majestic Azami, Lady of Scrolls. My latest alter for an EDH general.",560
Not so bad(?) Standard Combo,557
Possible Gatecrash leak from craigslist,553
Playing Magic in the Middle East and Wizard of the Coast has really made the end of my deployment enjoyable.,554
The morning of the largest Magic tournament ever held.,554
POWER Mat,557
"""Shipping Accident""",551
"So if WotC has blocked Cockatrice and is still around, does it mean WotC is a wall creature?",552
"Maybe I'm late to this party, but has anyone else noticed the Planeswalker symbol in the Omniscience art?",548
"Sinker announced as ""Dragon's Maze""",555
"For my cake day, I give you a magic card my gf made me...despite never seeing the game played before.",550
"I didn't realize I had this infinite combo in my Grimgrin zombie EDH until I dropped this on the field last night. ""I guess I win""",553
Cheesiest card box ever...,558
Let your geek flag fly.,557
"Tutor Tuesday, August 06, 2013. Ask /r/magictcg your questions. Upvote for visibility.",550
Gamers United - An Apology,555
That Guy has Sat There for Awhile,548
My room can play Magic now :),550
Magic-themed Settlers of Catan board,548
A few months ago I posted an idea I had for a playmat. Well today it arrived in all its glory!,549
Counterflux!,547
My new playmat just came in today. . .LANA!,547
"Went there on a whim. Not sure what I was expecting, but I liked it.",552
I wanted to visualise how the various formats' card pool sizes compare. Maybe you'll find this interesting too...,549
I collect Grizzly Bears and Phantasmal Bears what cards do you collect?,549
Just wait.....,541
Blue/Black Pre-release combo won me 3 games.,542
"Just a theory, but has this combination been recognized already? Two standard legal cards, both cheap.",548
"Couldnt cope seeing this in my LGS, best art ever.",547
I grew up next to a Magic: The Gathering artist (Lars Grant-West). One of my most prized possessions: an oil painting of childhood me riding a triceratops. [crosspost],542
Phyrexian business meeting,548
[GTC] All Gatecrash spoilers for 1/10,542
More Sliver Spoilers,540
Friends wife made a Talrand deck.  Here are her Drake tokens.,541
"Everyone going to Vegas for the Grand Prix, remember, not everything stays in Vegas. Please use protection.",541
Visual guide to a few popular Legacy Combos,546
Watching the new Venture Bros. ep when suddenly...,539
I would like to take a second to recognize the return of a sorely missed limited friend in M14.,539
RtR Spoiler: Desecration Demon,541
My Favorite Casual Combo,542
"Word got around at my LCS that Selesnya and Gruul were ""The OP guilds"" so everyone chose one of those. I won yesterday because of this little guy.",536
My favorite alter Longlegs of the Law.,541
Oops I did it..,537
Tales From The Pit #526,535
Travis Woo just casually attacked his opponent with a couple Pack Rats last night. Here is one of them...,537
The Guilds of Ravnica Will Destroy Each Other (Hidden in Flavor text of the Guildgates).,532
"In response to Emracool, I present the best alter I've found. Nicool Brolas.",536
"After finding out his catholic school has banned MTG, mainly because of the murder card, my brother went to school with this.",533
So...Vegeta was in Ice Age.,532
"My favorite foreign translation, in foil! - Wurmspiralmaschine! Even the rules text is badass.",537
"Today's ""Latest Developments"" listed quite a few humorous playtest names for Gatecrash cards, but one made me laugh harder than the rest.",536
"To help pay for our first house, I told my wife I'd sell some Magic Land.  Magic land for real land.",534
New Cockatrice server is up!,537
Tutor Tuesday! As /r/magicTCG anything! Upvote for visibility.,532
Time Walk opened in Grand Prix Charlotte SCG Gold Rush,532
I just realized this sweet combo with Zameck Guildmage,534
I won my LGS's modern tournament today!,534
My plans for the new card Omniscience from M13...,528
Real-life Burnwillow [xpost from /r/BotanicalPorn],527
Possible future split card names,530
Renounce the Guilds,527
The ORIGINAL panoramic land art.,527
This is the first time i encountered this on tappedout and I love it. ,528
$10 At the flea market yielded an amazing Sunday (they we're all sealed),529
Gamers United - Warning,528
"Coming back to MTG after a while, I found I needed a Guild and Shard visual guide when reading about decks...",528
"I always saw this in the art, thought I'd help others.",524
"It's been fun guys, time to pass it on.",524
Bad Standard turn 4 win,528
"Today is my birthday, and instead of buying me a gift, my mom went two states away to get my old collection of cards from when I was a kid. All of these are circa 1999.",526
Vengevine 3-D Alter Progression and final result. 8 Venges + 1 Foil Venge (Commission created by serrot_29 MTGS),520
A while back /u/spoonsandswords suggested a type of dual land. Think I improved the design enough?,519
Reddit's official Modern Master's Preview: AEther Vial,527
"For my cake day: My Kaalia deck completed in higher resolution, transparent PNGs, &amp; 100% error free (I hope)!",527
[DGM] Notion Thief - Dimir Rare Creature Spoiled,574
"Tried a new LGS for the prerelease, found this on the bathroom wall.",526
Got this alter for my Birthday.  2 of my favorite things :D,524
"This thrift store didn't have 15lbs of cards, but I only wanted these 6oz anyway...",517
"Adjust the mouths, move the eyebrows, add a few accessories, and BAM crisis averted.",526
Why do epic things happen only when I am playing at 3am?,525
I really hope you don't have a bolt,513
Can't wait to hear this until rotation in October...,512
[GTC] All Gatecrash spoilers for 12/31,512
"I hope this isn't too spammy, but I thought y'all might enjoy my new playmat image",517
ANNOUNCEMENT: Flair coming soon,517
Noticed this last night: Crucible of Worlds is a direct reference visually to NASA's Toroidal Colonies from the 1970's!,512
Came up with this card at work today. What do people think in terms of balance and the 'keyword'?,514
Played against the coolest 12 year old in round 6 of a PTQ,518
Bad standard combo go BOOM!,515
Remember the E's and the A's... Trying to help a common problem.,515
Team USA getting eliminated by Chinese Taipei with a top-decked Bonfire at the World Magic Cup.,517
When my opponent miracles Bonfire,511
Just got this in the mail from my MTG obsessed brother.,513
"My first alter! Just a swamp. I'm not quite happy with the reflection, but it will do for now.",513
"If you forget that you play and buy Magic cards, occasionally you will get an email like this and find it terrifying.",511
Hand-knitted Fblthp Doll,515
Where the design for Emmara Tandris *really* came from.,513
DGM gave us the perfect 7 drop for Momir!,510
My Return to Ravnica thrift store find.,512
Does anyone else's room look like this?,513
Emmara Solved,509
I wish Fat Packs still came with books like this.,509
So THIS happened at FNM last week..,507
PSA: Duel Lands and Dual Lands,509
"If you do this, FUCK YOU.",510
Someone had one at FNM. I got to hold it.,508
"Greatness, and Whiteness, at any cost.",512
All New Theros Art from SDCC,502
How to lose friends in EDH,511
Magic Tournament Strategies for playing aggressive decks from back in 1994,505
Elesh Norn Alter,501
My lgs got a bus for traveling to events.,509
I saw the hand made 3D life counter one too many times and decided to try my hand at them. Went craft crazy for a few days.,499
Brothers Birthday Gift (Story in Comments) /Boozecube,507
"Sophie's Choice: A fun casual deck where you present choices to your opponent, and they all suck.",504
What do you guys think of this Sealed Pool?,499
I lost my job at a trading card company unexpected this week. It's my birthday. My (now former) FNM players had made this. Uh! Right in my feels.,505
Uncut sheet of cards from long ago,499
Charlie and the Avacyn PreRelease.,500
[DGM SPOILER] Lavinia of the Tenth,495
We had a newcomer at FNM. Yes those are goblin tokens.,506
Premiered my newest playmat at SCG Minneapolis,499
Easiest Alter Ever: Swamp + Sharpie,503
"Jace, the Mind Sculptor CONFIRMED for From The Vaults: 20",498
"The art of Teysa, Envoy of Ghosts",500
Tried to make my son's 11th birthday the best ever...,498
These make every card better O.O,503
I made some travel posters for some planes,498
Nerdiest costume(s) ever.,496
Nothing is safe from Japan.,495
Pretty bad turn 3 Nivix Cyclops kill,493
Finally after weeks of frustration and the weirdest dimensions imaginable.,495
"I saw a lot of questions about priority yesterday, so I thought I'd make this chart to show when players have priority.",495
The FNM promo for March is... Farseek! ,494
[GTC] All Gatecrash spoilers for 1/14,497
[GTC] GPAC Spoiler - Assemble the Legion,496
"Prossh, Skyraider of Kher",489
[DGM] All Dragon's Maze spoilers for 4/17,491
My bathroom is a little scary. ,488
I stared at this for far too long.,490
For my cakeday I give you some real world influences in MTG!,489
April's giveaway Should be a Doozy :-),492
A couple proxies I've made for people's generals. They are mostly for one person who is a big LoL player,488
I can't be the only one who sees Blanka,490
"My latest.. Gisela, Energy Blade of Goldnight!",489
"Liliana of the Dark Realms, M13 spoiler",484
Star City Games Logic,483
A dedicated player,492
These bad boys won me the midnight pre-release,489
My new zoomed-out Boros Guildgate (with initial sketch),483
Not exactly a card art comparison but I've always thought it was neat,490
Wizards Once Again Put Out a Great Video,483
The cutest flavor text in Magic,481
Brad Nelson,481
"Littlefinger, Gotta be the best alter I've seen in a long time!",479
"Garruk, Caller of Beasts spoiled with SDCC variant",485
Googly eyes make everything better,483
"At the pre-release, this struck me while remembering my old boros deck.",483
[GTC] All Gatecrash spoilers for 1/16,484
Just turned some newer cards Alpha-style. Which cards should I change next?,481
guy came into our LGS with this. he got it out of a box of 4th he bought. was curious as to how much it'd be worth.,482
"Finished this 3D life counter yesterday, thought r/magicTCG might like it. As an aside, the primary art is a Nezumi Bone-Reader.",480
Someone at my M13 prerelease actually did it.,478
Tales From The Pit #528,478
"Been working on making ""shadowbox"" Magic cards.  What does /r/magicTCG think? :3",478
10 Tricky Plays Every Standard Player Should Know,477
"Finally, one of my friends plays against me",482
My Friday Night,479
Anyone else notice Tom Martell's bracelet?,480
This makes me want some back story on the flavor text.,480
My friend is the local Boros charm dealer...,480
So I went out with friends and came home to this made by my brother,474
Cheap Mono-Green Standard Turn 4 Win,476
"[PSA] Game On in Chattanooga, TN, robbed of an estimated 25k in product.",477
"So, this exists. Why does this exist?",478
"My friend pointed this out, and now it's all I can see when I look at Duskmantle Seer. ",481
So I managed to cast Worldspine Wurm in draft...,481
[RtR] All Return to Ravnica spoilers for 9/4,471
Made Bolas horns to run my Midnight Prerelease in,482
Kresh 3D alter for EDH,478
Friday night magic at the fire department..where you playing at tonight?,480
Some Friendly Advice to Would-Be Spikes.,471
I've Completed My Magic Cube. Now What?,474
I feel like tcgplayer.com should remove companies who do this just to raise the mid price of a card. Can anyone show them this?,477
"Vintage, A primer",477
I humbly submit: The most RADICAL card art of all time.,474
Great Scott !!,477
Are creatures too strong right now?,475
The 11 Modern Masters Cards You'd Be Crazy Not to Draft,472
[State of the subreddit] Would the mods PLEASE stop ignoring posts that violate the global rules of Reddit?,467
[RtR] All Return to Ravnica spoilers for 9/6,473
[GTC] All Gatecrash spoilers for 1/17,473
Friend went to SCG Baltimore. He's been doing this all weekend.,468
Some card names are reason enough to play them together,470
[GTC] All Gatecrash spoilers for 1/9,465
"AMA with Brian Kibler, Magic Pro Player and Game Designer",465
"If core sets are designed for new players, basic lands should be printed like this.",464
[GTC] All Gatecrash spoilers for 1/3,468
This is why I love Wizards and their Customer Support.,464
I posted from the fire department a picture of us playing Friday night and we were gifted boxes from the coast :) THANK YOU Wotc_Worth,462
Just received my new piece of pimp for my EDH deck!! Work done by Cat Clinton Alters.,466
Art from token cards,460
I noticed the zhur-taa swine art is what is causing the gridlock in the gridlock art  (sorry if this has been noticed before),460
[GTC] All Gatecrash spoilers for 1/15,466
How Nerds Recruit,466
"I collect Sanctuary Cats and Black Cats, and noticed that TCG player had both for two cents each. I regret nothing. ",462
Awesome map of Innistrad,462
"RtR spoiler: Selesnya, Izzet, Golgari and Rakdos Keyrunes",466
[RTR] Detention Sphere (O-Ring meets Maelstrom Pulse),468
"Fabio, Lord of Innistrad.",464
Elspeth Ascended - possible Theros spoiler?,463
So someone posted a Pytahgorean Tree on r/math the other day and after staring at it a while something occured to me...,467
Real-life Grafdigger's Cage. ,464
Found this looking for the geist of saint traft. Thought you guys would enjoy it,459
It's a conspiracy...,457
How I feel after spending my food money on Magic.,467
Bought a booster box from a local Walmart for 4$. Somebody pinch me.,458
Official Nomination for Emmara as the Most Poorly Designed Card of the Set.,456
Somebody notify the creator of Drakewing Krasis he has a prize to fetch...,463
Gatecrash Card Obsolescence Chart,460
Does anyone feel like this has turned into more of a MTG Arts and Crafts place? ,464
Noah's Guide to Dealing with Artists at Events,465
I am a Tournament Organizer for 6 years and during that time I have watched 3 stores close.  I'd like to talk to you a bit about that.,458
Dammit Wizards.,460
I think the MTGO crowd is getting a reputation. (x-post from /r/webcomics),462
Did this in my modern masters draft.,457
[M14] Scavenging Ooze Promo Art,462
A work in progress,462
I made a DS game cover for a class a few years ago. Some of my friends believed it was real.,457
"Played in my 1st 4player EDH game last night. This 3 card combo I didn't even realize was in in my $40 deck, won on turn 3...",460
It's no Phyrexian Tower but dammit I wanted to alter it.,453
Notice how the giant fist on Wear is crushing a Street Sweeper?,451
Fiance altered a Tarmogoyf. Just blows my mind.,458
"My store kept all the judge promos, and then proceeded to sell them.",456
TIL every single Magic card contains a printing error.,454
"My custom Sliver Queen, made in October, suddenly relevant again!",459
Some misprinted gatecrash boosters,453
Altered Mox Emerald ,448
1st wedding anniversary gift to me from my wife - our favorite places we visited during our first year together. a total surprise.,450
"Damage, What's that?",456
Alive and Well Painted Alter,449
Vermont is Enchanting [x-post from r/pics],451
Anyone else notice this combo? (also considering adding in Pandemonium),453
Obligatory M14 artist's proof post,447
My view on the current standard meta game.,445
"Hold up, lemme just get this hotpocket out of the mircrowave.",452
AMA with Jon Finkel,452
"PSA: Dropping from a tournament before sealed-pool swap is not theft, is not a DQ.",454
My dog hates magic,453
"Today was my last day at WotC, and after 11 months, this is some of what I ended with.",451
The wonderful thing about Slivers....,449
Real life Pillar of Flame,443
Unpacking my order... announcing Sorin vs. Goblin Arsonist!,447
The follow-up to that Horrible Snapcaster,446
"Stonehorn Dignitary, meet Conjurer's Closet",442
Huntmaster of the Feels,442
Dancing Mark Rosewater Gif,450
Another Mailday.. And I'm giving some away,446
Looks like she didn't enjoy being in the Spotlight...,440
What I see when I look at Hydrosurge...,438
Dies to Doomblade: Magic End Game,440
As promised: Here is a goat equipped with Batterskull.,445
"I bought an Innistrad fatpack today, this is the best thing I pulled. ",445
For a second I thought they were the same guy,443
Something you may have never seen before,440
Alternate art: Worldslayer in the style of mirrodin swords,440
[DGM] What we can tell Dragon's Maze just from Render Silent.,443
Pat Chapin addresses hate speech and Magic (WARNING: Triggers and adult language),439
"I've been spending my break playing Dark Souls, and I think I found Ravnica O_O",448
So my brother is getting married what does reddit think of his bachelor party draft?,444
"Last night we played EDH til the early hours of the morning.. the Ulamog player looked like a sleeping Lazav, Dimir Mastermind by the end of it.",435
My summed up experience of cockatrice,440
I won a complete foil set of Gatecrash at PAX East. What do I do with all this shiny?,442
Interesting comparative between card arts I noticed while going through my Innistrad rares.,439
My friend told me about the set coming out after Gatecrash and I was so excited that I went and made some promo art!,441
"Inventive approaches to custom decks; or, ""Amusing things I found at the Shanghai fake market""",441
First round of Zendikar style foil duals!,442
"Went 0-4 at my second FNM, then this guy came along....",441
Suggestion to WotC: consider leaving blank space on the marketing card to make it a flex token.,444
Gatecrash: An Infographic by James Arnold,442
Not your standard FNM prize I won tonight. Much cooler in my opinion.,440
Last night's paint: It was Talrand's turn,437
Bad extended mill combo,436
Return to Ravnica Card Obsolescence Chart,444
Just got my new playmat in. Can't wait to play it tonight with my favorite deck.,437
I think I found where set symbols are born.,436
Gift of Orzhova 3D Alter,437
This is what happens when someone starts humming Queen at FNM. ,432
LSV did a fantastic commentating at the World Championship!,436
"Went to the world cup qualifiers on Saturday, didnt finish top 32 but i did go home with this lovely work of art.",434
Lost to this last night...,438
"It took me 15 years to put this collection together, but damned if it wasn't worth it",440
"So I finally figured out what was on Melissa DeTora's card sleeves at Pro Tour Gatecrash
",438
My first thoughts after seeing Goblin Scrapper...,436
PV and Chapin discuss Magic and the Electoral College,437
A pair of altered Force of Will's side by side.,434
"Being primarily a green EDH player, I will bow my head...",433
"An accurate representation of Jace, the Mind Sculptor. ",431
One of my favorite casual formats: Duel Deck Battles,435
"Since we're showing off cool signatures, this is how Wayne Reynolds signed my Doubling Season",435
"X-Men, Mutants, and Friends - Magic: The Gathering Style",435
Deathrite Nommin',430
In light of the recent rule change...,431
Visual Guide to the EDH Ban List,432
Turn 4 bad combo? Pshaw. Here's a turn 3 Modern win.,430
Got some shots. Girlfriend didn't understand why the rest of us all cheered when we got them.,436
I wasted more time on this than I care to admit. ,428
You Make the Card is Back! Straight from dailymtg.com,426
Another bad combo that I came across while playing with a friend.,434
I see your two cows and raise you /tg/'s explanation.,425
My new Game of Thrones playmat &amp; card sleeves!,427
"Was bored, made this double screen Ravnica Guilds wallpaper",432
This bad combo happened by accident last night during a 3 way game of EDH. I top-decked the second card after my friend played the first one.,430
Finally got around to completing my souvenir for the RTR block.,425
"It's a Saturday night, I have no date, a 2 liter bottle of Shasta, and a new playmat. ",431
[GTC] All Gatecrash spoilers for 1/11,425
Judge promo Swords to Plowshares,428
I just couldn't help it.,423
Why Commander is different from all other formats,429
My custom playmat from inkedplaymats.com ,426
I got Aaron Forsythe to fix my cards at PAX AUS,426
My most recent hand drawn playmats,424
"DJ Yav Man, breakin' it down!",426
Making sure the GF doesn't find the ring.,428
It's official. No Thoughtseize in M14.,422
I got a good chuckle when I saw this ad on an MtG site!,423
These make all old deck boxes better O.O,425
"Not quite amazing, but this two-card ""combo"" has caught more than a few people off-guard.",421
Coolest. Mat. Ever. I'm so glad I was able to get one of these.,419
Wood-burned key-chains I made by hand,419
Altered Adventure Time Command Tower!,422
A custom playmat variant of the custom playmat posted earlier,424
"Was making a joke expansion with some friends using MSE, wound up making this",420
Saw this at FNM tonight. Very clever and simple idea when using Cavern of Souls,421
"From the person who cosplayed a female Jace, Lilliana of the Veil.",422
Seems like everybody's still adjusting to the new Legend rule.,419
[RtR] All Return to Ravnica spoilers for 9/12,419
"Just a question, dont upvote.",428
RIP Quinton Hoover,424
I'm the guy who bought 127 Sanctuary Cats because they were cheap. Someone wanted to see them once they got shipped. Here they are! :),426
[RtR] All Return to Ravnica spoilers for 9/7,424
Jesus plays Magic: the Gathering,419
Finn's Sword of Fire and Ice - Klug Alters,424
"Does anyone else really appreciate WotC's use of simple, primary colors for the RTR block's packaging? It really makes the set stand out to me",420
[RtR] All Return to Ravnica spoilers for 9/13,423
"While everyone else is casting their Worldfires with Keldon Marauders, this is the only thing I want to do with it",415
Instant /r/magicTCG Karma,423
My friend just posted this on facebook...,419
MaRo confirms: Theros is not Australia,415
Altered Grim Tutors,418
"With Gatecrash on the horizon, I made sure to pick up a full set of these standard staples",415
All current promo unlock codes for DOTP2013,416
[Duels 2014]Kalonian Tusker,412
Dragon's Maze planeswalker spoiler,416
This had to be done...,414
Saw this guy in on the way home from work. Instantly made my day better.,416
Got bored with the same old 3D card alters. Decided to make a REAL 3D token.,458
Coincidence?,415
Pulled this out of my memories box at my parents. RIP Quinton Hoover,409
Found these at my local dollar store... Should make for an interesting draft!,413
Enjoy Terese Nielsen art?  This is now hanging up in my living room.,416
Me and my friend went to a car boot sale and got 4 Magic the Gathering Portal gift boxes from '97 for 1 pound each.,413
Jan van der Vegt doing his first Modo Power Cube - Are you serious?!,408
All the Multiverse's a stage. (Thanks CardKitty),411
The clock that won me so many games this weekend.,416
Bloodbraid and Seething Song Banned in Modern,408
[GTC] All spoilers for 1/18,413
My Urza's Tower Spindown holders arrived!,412
"All ten Guildgates, new artworks",407
God-awful EDH Combo,410
Think if I mail this to wizards of the coast they would honor it even though it is expired. (Was part of the stuff my neighbor sent me.) ,410
Exclusive Preview for Reddit: Revenge of the Hunted,410
Serra Ascendant errata'd in Duels 2013,410
I just noticed something about the art for Conjured Currency....,412
Dryad Arbor by Brad Rigney,409
[GTC] All Gatecrash spoilers for 1/7,406
Liliana of the Grail,409
"While visiting Door County, WI I took some pictures and made some personalized lands",400
LSV reviews M14 - White,404
