title,score
A combo that everyone should play at the Prerelease this weekend,2653
ESPN employee wants to ask: Would You Want to See M:tG on ESPN again?,2161
"Someone at my school made this, and is displayed in the art hall.",1952
[GTC] ALL OF GATECRASH IS NOW SPOILED! I AM FREE!,1800
Got married this weekend. Had to wait for the woman to get ready...,1752
I thought you guys would like to see how we managed to help my blind friend play for the first time.,1711
"Friend just posted this on my FB wall, we're buying matching ones.",1659
"For every 50 upvotes this post gets, RFG will be giving away ROUND CORNERED SLEEVES to a random commenter ",1595
Magic Floor (will delete if repost),1593
Just got these in the mail!,1593
This is what happens when you name your daughter after a Planeswalker,1586
I'm fine with never getting a good pull again,1575
And now you see that all of the shock lands are vagina euphemisms.,1557
Forest.,1523
It's not a combo. It's not even good. But if you want your opponent to call a judge over every match...,1484
Enhance!,1481
I played this card on my girlfriend today and I didn't loose. You guys like?,1462
You know you're at a Magic tournament when...,1457
So my cousin made a pokemon version of mtg... it's freaking awesome. Still a work in progress,1450
Two dudes who play Magic every single lunch in my office's atrium,1453
"I think you guys like this card's artwork, so here is the foil version",1423
"A ""Two Cows"" way of understanding the guilds of Ravnica",1423
"Found this combo in a thread in /tg, pretty hilarious",1390
Neil Patrick Harris posted this today.,1367
The Best Possible Opening Hand in Magic?,1367
3D printing success: Urza's Tower d20/life holder,1360
How to look like a genius...,1341
Liliana Vess cosplay at GP San Jose- told her to look for this on reddit!  Let's make sure she sees it :),1332
"Not many people know about this, but here is some sweet tech for the Prerelease tonight.",1335
I want to do a custom mat for y'all. Here are some sketches I did this morning. Any preference?,1288
I fart in your general direction.,1282
"If magic were an Olympic sport, this would be its logo",1286
Quick question. Don't upvote.,1283
"Finally found a good Standard use for ""Search the City"".",1277
"Almost 3 years ago, my wife played this card on me during a duel.",1274
Random toy store in Wyoming happened to have every single set in stock.,1263
"I traded cards with a fellow Redditor, and got an extra card I wasn't expecting.",1233
The elitism shown in this subreddit damages the entire game.,1219
MtG in Workaholics,1213
Saw this card at my local FNM and I almost cried,1184
Dragons Maze spoiler,1165
My dentist needs a new graphic designer. Totally ripped off WotC,1165
Chandra vs Jace at my LGS...,1158
Boyfriend gave me something really cool for my birthday!,1153
"Monty Python's Black Knight, mechanically accurate. [FIXED]",1133
My nephew finally wrote home from camp... (xpost from /r/funny),1115
[DGM] All Dragon's Maze spoilers for 4/8,1123
Come to my table,1105
Just one creature type away,1097
Check out this sweet three card combo,1099
Tried to find the original; couldn't so I remade it in my style. How I envision the various formats.,1095
"Hey Hasbro/Wizards, MTGO sucks. Fix it instead of suing.",1092
"Tamiyo the Moonsage cosplay WIP by Lyz Brickley, had to share!",1076
Here's your friendly reminder for this coming weekend,1073
Behold: the Hand of the Magus (seizure warning?),1065
I love it when flavor text recalls previous flavor text.,1058
New spoiled M14 card: Awaken the Ancient,1055
I'll keep,1043
Found this pack with an awesome promo card! ,1037
"Reddit's Exclusive Dragon's Maze Preview: Exava, Rakdos Blood Witch",1039
Tragic Slip,1037
:),1035
"Newbie first night out playing at local shop - surprised by the ""regulars""",1040
Flavor text also used to be very corny...,1031
Does anyone else's desk end up looking like this?,1034
Just came across this awesome picture of two best friends playing Magic and I wanted to share it :3,1027
"My cards got hit in a flood, and WotC helped me restart my collection.",1021
I made a reference image for dual land slang names.,1018
What if Bob Ross made basic land cards?,1010
Liliana of the Veil,1014
Announcing Duel Decks: Jace vs. Jace - Legendary Personality Disorder,1005
"Earlier, there was a thread about a bad mtg parent. Here's the opposite side of the spectrum: This Dad comes to every FNM with his 2 very young sons and sits the whole night out with them so they can enjoy their hobby. Here's a pic of his getting some shut eye next to his son in the final round. ",1005
What I assumed they wanted Aurelia's Fury to say.,998
For the guy who hates Razor Boomerang,991
"The choice is clear this election, Dominaria...",991
Magic Parenting (x-post webcomcis),986
Driving home from the card shop when suddenly...,986
I like my lgs. They're awesome,982
It's the little things that I like,977
Competitive Magic in a nut shell,980
DRAGON'S MAZE MYTHIC LAND LEAKED!,978
"I have a really, really bad combo for you guys. Like ten cards bad.",976
The Fifty *Real* Rules of Magic,971
Hakuna matata thrag ,958
You Try And Host a Respectable Tribal Wars Tourney... ,962
My friend and I went to FNM the other night and saw someone play this combo. ,963
TimeVaultGames.com Revised Dual Giveaway + 10% Reddit Discount,958
"Now that the spoilers are done, it's time for InterwebCeleb to eat that card.",966
My husband learned to play magic while in basic. This is what they had to work with.,958
I want this as a playmat!,958
"Zoom on Overgrown Tomb, discover human figures at the bottom, get a new sense of scale",952
I'm a glassworker and I designed and sandblasted my own Magic table. What do you think? (Fixed),956
I took my cards on vacation with me last week. A few people actually stopped to watch!,954
"My friend used to play a REAL deck, now he likes them dirty creatures... Maybe these words from Jon Finkel will change his mind!",948
It was obvious that I needed to hang these like this.,949
Story on how magic saved me from my drug addiction.,944
Finally got things settled in the new apartment. These are my favorite part of the living room.,942
"Little does M14 know, it's substantially buffing my legacy antelope deck. Soon, I will be unstoppable...",943
"Yes, I will sign your Magic cards.",938
Multiplayer Russian Roulette,928
"Googled ""Terastodon"", and was not disappointed.",926
Lost at GPCalgary: an SD card with irreplaceable footage,929
Can't wait to try this awesome Vorel combo.,920
Zendikar dual lands anyone?,921
Totally Lost,911
So this happened 2 hours into our EDH game yesterday...,909
Some say Lotleth Troll isn't powerful enough...,900
"It's a bit worse for wear, but I finally caught my unicorn.",901
Detain Tokens at prerelease,904
"AMA with Mark Rosewater, Head Designer of Magic: The Gathering",903
"With all this sexy planeswalker art flying around, I decided to put my talents to good use.",900
"Found deck at Cool Stuff Games Maitland, Florida",898
Look at what i got for my b-day.,903
"Just browsing Google Image search and I found the most beautiful ""alter"" I've ever seen. (will delete if repost)",899
Last summer I spent some time building a tribute to my favorite card.,903
"My friend told me I needed matching sleeves/dice/play mat/etc. to look ""pro."" I took his advice. I think I nailed it.",892
A small collection of fatpack boxes. What happened wizards?,897
Just discovered the related flavor text of these two cards,895
I've wanted this for 10 years and finally got it,894
My custom Sliver playmat has arrived!,887
Nerdiest chandelier I've ever seen...I love it. ,892
Reddit's Exclusive Gatecrash Preview Card: Foundry Champion!,883
"This past weekend was my first time being a guest artist at a Magic tournament. Exhausting, but really fun.",889
This sign should be in every single LGS. It also shouldn't have to exist.,879
I think I found my new favorite place to go after FNM,877
O'Reilly Factor: Rakdos is the devil,882
Visual guide to the modern banlist,880
Bungie just posted this,871
Just got my Sign in Blood back from Howard Lyon,874
So i bought a local game store's entire old magic inventory...,870
Possible new Goat archetype in M13?,873
The Worst Standard Combo Ever,866
Saw a card that reminded me of a celebrity. Then I was intrigued and looked for more dopplegangers.,861
FIXED: Two dudes who play Magic every single lunch in my office's atrium,863
OH YEAH.,861
You Shall Not Pass,862
"Bought my girlfriend an event deck, dragon shields, and a deck box for her birthday. Wrapped it in this...",859
Illustrated guide to post-Gatecrash standard Goblins.,855
New Motivation Strategy,858
Funny Non-Standard Infinite Saprolings,847
Visual guide to a few popular Modern Combos,845
Omg... Silence lockdown in standard,845
I also painted the new Giant Growth from RtR,841
"Coworker left me this while I was on vacation, I've never seen this card before!",836
Gift of Orzhova,843
3D token hinged and used as a dice box.,836
Gatecrash Spoiler - Dimir,837
"With all these new sliver spoilers, I think now is the perfect time for me to try and sneak my own slivers into my EDH deck. Think anyone will notice?",841
"Dear Wizards, this is all I want for Chandra in M14",840
Would you guys be interested in hand drawn mats from yours truly?,836
Got this awesome set of shot glasses from my Secret Santa this year. Drunken EDH is best EDH.,831
"Co-worker drops this on my desk and says, ""Alright man, box break, my desk, five minutes.""",831
My advent calendar,833
Ten Thousand Titans,824
The worst part about MtG jokes is the limited audience. The best part is the joke.,825
"Dear Jennifer, you are the best. I am gonna sign the hell out of these cards.",820
"So, I work as a delivery driver and last night I got this really wicked tip",829
My fiancé needed an angel token..........,821
Real Life RUG Land(If it existed),814
check out my sweet alter of give//take,814
"With the new legendary rules, I hope this will be the mana fixing we get in Theros.",809
My theory behind the Emmara 'fiasco',813
Zoomed out Izzet Guildgate,807
An open letter to people who post shitty combos.,806
Seems legit...,803
How to tell if your opponent is holding a split card:,809
Because I was bored: All 10 Shocklands redone with old borders and old art style.,802
"Boros Guildgate, from start to finish",808
What goes on through the players' minds when they play DD: Sorin vs. Tibalt...,805
"Legendary Rules Change on July 13th, July 29th on MTGO",799
So this happened to me during a Modern Masters draft last night...,797
[GTC SPOILER] Glaring Spotlight,797
Awesome Thalia alter my friend is working on,798
"My Girlfriend doesn't like roses, so I decided to make her a Black Lotus instead.",803
My painting for Frenzied Tilling,798
I altered a plains to look like the windows XP background in photoshop.,796
Just received this custom playmat I designed.  Used it at a PTQ and everyone loved it!,789
Life is a Game (Magic the Gathering version) (x-post  r/wallpapers),792
My first ever card alter,792
"As a janitor I clean rooms in a dormitory, look what I found far in the corner under a radiator!",790
Elmer the elk can't catch a break,785
I heard you guys were trying to break Cipher,778
"All I kept thinking was ""Reddit Saved Us"" Thank You.",773
My son has been asking all day... Now it's time...,777
"I'm not very talented. I can't paint or make cool Magic briefcases, so I do this in my spare time: My EDH deck.",771
Reddit's Exclusive Preview: Dryad Militant,777
Genious!,772
Pro MTG Comic #254: Maro finishes a long day of work,774
[DGM] All Dragon's Maze spoilers for 4/9,769
Turn 2 Standard Win (on the draw),765
"""Finally, a weapon the Boros can't confiscate!""",764
Played my first M13 sealed on MTGO yesterday.  I went 3-1 with this combo.,766
I just don't see what all the fuss is about.,762
If there were a land that could produce all five colors of mana...,768
Some paintings I did for Return to Ravnica,763
"Andrew, Please read this! Reddit, please help!",762
Score one for the good guys!,759
So this showed up at work today... Happy holidays from Wizards!,760
Flavor Text of the Day,758
Magic artist here. Some Sharpie alters I've done at tournaments and conventions.,755
"magic suitcase is on the front page?? I have been wanting to share for a while. presenting: the magic briefcase. time: 8 hrs, cost: $90.",758
Check out the alternate Japanese Art for Armada Wurm!,753
cockatrice down due to a legal dispute,751
"Me and my friend started playing magic, i think we're addicted.",755
At Warped Tour I just won this Chandra deck.,753
"If your Axebane Stag or Stonefare Crocodile ever go missing, you know who to go to, Jace Ventura, Pet Detective",752
"Last night, I faced what may have been my most enraging and humiliating defeat ever at an FNM, at the hands of... of this.",755
"So, my friend got his Lilliana of the Veil's signed and altered by Steve Argyle at a Grand Prix this weekend. I think he did pretty well.",754
Christmas Spoiler 3: Firemane Avenger,746
Every Time I See Korozda Guildmage...,749
[DGM] Blue's Cluestone,743
Is this the ultimate blocker?  Opponent is denying it can block all of his 12 creatures.,743
LGS was giving these out to random matches during the dragon's maze prerelease. Other stores should take notice,742
My new painting for Tin Street Market,737
"Our Halloween, post-trick or treating.",740
"I know it's an awful card, but here's the process for creating Encroaching Wastes",743
Malignus Bad Standard Combo,738
"One of my roommates said MTG gifts weren't allowed in our Secret Santa...so we added 1,000 Aquus Steeds to his gift.",738
The future of Fblthp,734
My brother takes his coast guard exam very seriously.,732
"How many Cards Have ""Thriller"" in their Art?",733
A Before/After situation. I chuckled.,724
"Sam Pardee combo'd for life gain and stated his life was 300,000,000,000,000. Not bad production team.",732
"Somehow, I accidentally grabbed someone's Master Biomancer at the 2PM pre-release at Comic Town in Columbus. Upvote for visibility please.",733
The proper way to lose a match like a gentleman.,725
How to properly topdeck Bonfire.,727
"With the intimidation factor of my new playmat alone, I can't possibly lose at Game Day this weekend!",721
Posing as one of my Favorite Cards,723
It gets better every year,719
"Got a package in the mail from Dan Frazier yesterday, my cube just got infinitely more pimp",718
I also combo'd out in Modern Master's draft last night.,716
I woke up this morning to find this on my bathroom mirror...,721
My Favorite Fusion Thanks to Wizards,716
"User flair is here!  Also, a quick word about our relationship with Wizards and our moderation policies.  Please upvote to the top!",717
This is how I feel about a certain product that Wizards will be releasing soon,714
"Taiwanese game store owner slyly hands this to me, saying ""sssshhhhh."" I love this shop.",713
Reddit's Exclusive Magic 2014 Preview: Strionic Resonator!,711
"Just noticed this and thought it was neat: The other guild charms are all physically carved or emblazoned onto something, but the Dimir charm isn't actually there. It's created by lighting and negative space between structures.",716
So at Comic-Con just now MaRo said that the community needs to demonstrate support for another Un set - let's do just that!,713
"I made a set of pixel art Ravnica iPhone 5 wallpapers, enjoy!",713
It's now a Bonfire of those Damned Gifs!,712
One of my favourite Angle tokens,714
Don't know whether this is too evil of a combo to play in my EDH playgroup...,712
Awesome sign in my LGS bathroom,711
"Not exactly the next Noah Bradley, but I did a Zendikar-themed painting and wanted to share it.",707
I found these while unpacking. I don't play any more but I figured you'd all appreciate the pic.,712
Steve Argyle's (Artist of Liliana) Workstation.,709
"Teysa, Envoy of Ghosts - Official Full Art!",704
Just found these… used them as counters/tokens a while ago.,705
Guide to naming red direct damage spells,706
Goyf reprint announced!,706
[DGM] All Dragon's Maze spoilers for 4/15,699
Cracked a gatecrash card at FNM tonight.,707
Previously on Lost...,701
"My attempt at a Magic The Gathering ""land"" card.",698
New Gatecrash spoiler from the Mothership: Fathom Mage,687
"Since many of you are looking for it, here is a hi-res art of Debt to the Deathless",691
Best Millstone art or best Millstone art?,691
So the main goal for my Platoon in Afghanistan is to get super big in the gym. I thought you guys would might appreciate the highest rank on our little chart we have..,691
"The Magic Invitational Tournament, last held in 2007, gave the winner the rare opportunity to design a card. Here are all the winners of these tournaments and their respective cards.",689
"I couldn't afford John Avon's lithograph's for my boyfriend this xmas, so I busted out my old acrylics. He loves them, so I thought I might share my hard work here.",687
"Wood-burned rendition of Clint Cearley's Geist-honored Monk, just finished this morning",690
Gallery of the MTG deck box that I just finished.,686
[DGM] All Dragon's Maze spoilers for 4/10,683
Do the Newbies a favor--don't cheat.,685
Was drafting Shadowmoor block when...,684
"TappedOut's annoying, but humorous April Fools joke",678
Fblthp gets lost in Noah's land.,680
Flavor text taught me my first combo!,675
[M14?] I know I said I was quitting: Shadowborn Demon spoiler,671
You know you've been studying too much when. . .,672
I made a simple tool to find out the names of colour combinations!,671
"Gaming Underground (High Point, NC) robbed last night. The back door was literally ripped off. All singles and some sealed m14 stolen. We believe this was a targeted attack. Please keep an eye out.",672
"For Father's Day, my son made me a Magic card. It's the best one ever.",671
"Saw post about Cancel. Remembered a friend made this alter, and it sums up what I feel about the card",674
Gatecrash Spoiler for December 17th,668
I had this combo out during a casual EDH game last night.  Made me giggle.,674
"Sure it'd be a bit cheesy, but damn do I want sleeves that look like this.",674
My friend just did this sweet alter!,668
"Some tokens I ""altered"" for my buddy a while ago.",673
"One of my favorite blocks is Time Spiral, purely based on the references to older sets. Lately I've found that these subtleties are lost on many players, so I've thrown together a gallery that calls out these allusions in text, art, and flavor. Enjoy!",665
New M14 Spoiler: Dark Prophecy,663
The 'Ask /r/magicTCG Anything Thread' - Beginners encouraged to ask questions here!,670
"Well, Google Gets It...",670
"Possible Malek, Izzet Paragon spoiler. Seen on /tg/",667
A pictorial summary of the constructed formats,667
"Devour Flesh, some may consider it...unacceptable",661
How to Design a Dimir Card.,665
AMA with Luis Scott-Vargas,665
My friend laughed at me after I showed him this combo at my prerelease. He was still laughing after I won 3-1.,660
[DGM] Entire set released!,664
I blame you for this Reddit,663
Hornet Queen,663
I decided to make some Minecraft basic lands,661
"Well, guess it's time to sign your cards",652
20 years of Magic in one draft.,651
Found some dual lands for $2 (X-post from r/ThriftStoreHauls),652
My best friend proposed to her boyfriend on stage at geek girl con. This was her ring!,648
"""Etiquette is important."" Just got taught an important lesson in MTGO. Really glad I started playing online!",646
Most helpful and informative Amazon review for a deck box that I can think of.,644
Made my buddy a christmas gift. Combines our 2 favorite things,648
"Avacyn, Angel of Hope finally spoiled!!",641
[DGM] All Dragon's Maze spoilers for 4/11,644
"A friend tried typing this to me in our work IM, but he typed it into a national tech support room, this picture was posted within a minute or two in response.",643
"According to flavor, these two creatures are evenly matched in single combat. Anyone else have an amusing comparison?",646
The best attacker/blocker I know...,643
"A guy I know was wanting to play Magic with some friends but only had ""older crap cards"". He asked me to help build a deck. This is 14 of the first 30 cards I pulled from his box.",637
DANGER ZONE!!!!!!!!,645
Been seeing a lot of questions about dealing with AEtherling lately. So I wrote a guide.,634
Can this please be a real sliver in m14?,644
Foil rtr Misprint,642
If Krenko's Command had been printed in Lorwyn...,637
[M14] Witchstalker - meet the new Great Sable Stag,636
It's finally done. CardSplice - Fast Card Detection,635
What I thought of when I saw the new duel decks,633
Swagtusk,633
Sketches &amp; painting for Strionic Resonator (aka the Tuning Fork),633
I love you MagicTCG Secret Santa,628
Easiest Alter Ever: Swamp + Sharpie [Fixed],633
Let's see if my professor notices a theme going on here..,633
Sometimes i just want to know how they come up with stuff like this.,634
"Attempting to get my playgroup into EDH, I commissioned them all commanders as Christmas Presents.",635
m14 Prerelease: Sliver Sanity Check. I've made this mistake an embarrassing number of times.,632
Altered Alex Grey Animar - Klug Alters ,630
Kibler owns commentor criticizing his G/R Worlds deck choices,629
I manage a small ice cream store owned by my childhood friend. He created a flavor name with a little shout out to our favorite game :),622
Delver Alter,627
Posted on my roommate's wall today. Somehow he didn't think it was hilarious.,627
"My friend was bored, waiting for an opponent, with many dice available to him, when I look over and see this.",626
"Shocklands were too expensive, decided to improvise.",622
Dragon's Maze Card Obsolescence Chart,624
I couldn't find any more Searing Spears.,624
Standard format in a nutshell,623
"Dear WOTC, please get LSV to do commentary at the World Championship",626
Izzet themed deck box.,623
It's here. My exclusive playmat just for y'all.,619
Semi-Comprehensive Collection of Magic Polyptychs and Diptychs (as well as other related art).,615
Huntmaster of the Fells went undercover in Catan,625
[DGM] All spoilers for 4/12,618
Updated Zendikar-style Alpha Lands,618
I improved my tool for finding the names of colour combinations!,619
Drinking and drafting,615
I crochet. My husband plays Magic. I crocheted him individual Magic deck holders.,622
Forest Art my friend made,615
Reddit's exclusive Dark Ascension Preview: Beguiler of Wills!,622
My wife made a box for her Selesnya deck.,616
"Forget Timmy, Johnny and Spike... this weekend I want to encourage you all to be a ""Max""",611
Bird of Paradise [x-post from /aww],618
"Did someone find a lost deck?  Upvote for visability please, thanks.",613
[GTC] All Gatecrash spoilers for 1/8,610
The Great Debate.,612
Why I love r/MagicTCG,614
"In the middle of a match, this guy asked me if my deck was pauper.",610
Mission Accomplished! ,613
Things improved for Mr. Whiskers,612
Marvel in awe of my majestic knight token,612
Just in time for FNM!,607
I had the privilege of playing against this beauty last night. He played it purr-fectly.,614
"A list of the Modern Decks under $5. (From the ""What's the best modern deck you can make for under $5?"" thread.)",609
I made the Reddit MTG aliens into Planeswalkers. Would we want to use them?,610
My friend just got a surprise in his Sorin vs. Tibalt deck.,609
This is how I went 4-0 at my prerelease,606
[DGM] All Dragon's Maze spoilers for 4/16,607
This was all I could see when I saw Massive Raid.,604
Where is Nicol Bolas during all this?,610
"Every card is worth something to someone. Well, almost every card.",605
So this guy at my FNM has TNMT alters of Sakura Tribe Elder,603
[DGM] Savageborn Hydra,685
Remember that guy who found an RTR card in an M13 pack? Well he sent it to WOTC and got this back.,601
Rhox Face Melter ,600
Gotta love the Twitter banter among Magic PROs,599
Noticed this in the parking lot on my way out of work today,599
Double check booster packs before buying...,597
"Before any more spoiled cards get called fake because their full name isn't in the card text, please look at these real cards. (The cards still could be fake, I'm just saying that isn't the reason.)",597
"No underestimating here! For a turn two play, this got me turn 5 wins at prerelease.",597
"I won a magic game day last weekend, this huge mouse pad I got is pretty awesome",600
Recently turned 30; my wife got me this awesome cake.,593
I'm really good friends with Magic artist Steve Argyle. He let me pose for a card! Here's me with an alter of it he did for me! (Chosen/Servant of Markov),592
My wife handmade me this awesome leather binder for my MTG cards for fathers day.,594
"I opened up a box this weekend, and these two lovers were holding hands",589
"Pretty expensive, but this was my favorite combo that I had in my draft.",590
"""Mana Shield"" Cosplay at Megacon",590
I've been accumulating Myr (my favorite creature type) Artwork. This is my collection so far.,590
TSG expelled from channelfireball,592
Here is my custom made Magic playing card deck.,588
[RtR] All Return to Ravnica spoilers for 9/5,589
My brother and I stumbled upon this while going through our land cards...,589
"I had artist Steve Argyle alter a playset of Deathrite Shamans for me at the SCG Open in SLC. He asked what I was into other than magic. I said ""cute things"" and this was the result. I can't be more pleased.",587
"Cannot unsee, Council of the Absolute",588
Beautiful panoramic basic lands from Kamigawa,590
Haven't played MTG in 3 years. Here is the combo I ran at my summer camp.,583
All I could think of when I saw the front page...,581
"Last night's fresh paint.. Frostani, Selesnya's Voice!",583
"What I hope we get out of Dragon's Maze's Guildgates (Warning, MSPaint)",584
"I see your 20 playsets of Seance and raise you 526 playsets of Worldslayer.  Because, Worldslayer.",581
We Have a PR Problem,582
A Planeswalker New Years,583
