title,score
"All I could think when I first saw Voice of Resurgence. Either way, you're spending $30.",406
The only Beta Black Lotus in perfect condition is now for sale.,407
I am pleased this exists,404
the basic land game?,405
"To support a friend in his sobriety, our circle started playing MTG again.  Rather than a bottle, this is my (late) Christmas present to him this year.",398
[RtR] All Return to Ravnica spoilers for 9/10,405
Front page of my home paper,401
Altered my first Modern Masters card today. Here's an extended art Bridge from Below.,408
"Jace, Architect of Thought",402
"Finished my Star Wars set, drafted it for the first time last week... thoughts?",402
The Five Stages of Commander Grief,400
[M14] Leaked Starter Deck cards,407
Someone pulled a Gatecrash card during draft tonight!,407
"Just finished individually wrapping sixteen single cards for my girlfriend, whose Omnath deck is gonna get some sweet new tech each night of Hannukah :-D",401
"I don't know about bad standard combos, but I'm looking forward to this one in Commander.",404
M13 Core Set Card Obsolescence Chart,397
Threat Control (Bad Combo),399
How to piss off EDH players,394
My buddy presells every set on eBay. Here's 65 cases worth of rares and mythics.,401
Two years ago my wife quit MTG cold turkey.  When I came home from work today I found that she had relapsed. ,403
I've never seen another one like it. My first deckbox.,401
How I feel after a 6 player edh game,400
One of the guys in my play group got a birthday cake! Pretty epic.,398
Santa Chandra: altered Chandra the Firebrand ,401
"My girlfriends favourite creature type is Wurms, so I've made her a set of full art alters for christmas (This is my first time altering magic cards)",399
[RtR] All Return to Ravnica spoilers for 9/11,399
"My friend collects foil Leviathans, this is one of the 
cooler things I've seen.  Any collectors out there 
want to share their collections?",395
Twenty Things That Were Going To Kill Magic : Daily MTG : Magic: The Gathering,394
A Small PSA: Just because Sun Titan is in the new Duel Decks does NOT mean the Titans are coming back,403
"As a kid, this was the first combo I figured out myself before I even realized Magic could be a game of combos, a true milestone in my time with this game.",400
"Transcendent Master wallpaper by SadCritters, 1366x768",393
All About Fblthp,398
Planeswalkers,400
$12 at thrift store for 15lbs of MTG cards...,398
I was playing Duels 2013 when Ajani decided he was done playing games,400
"Dear Wizards, Standard is far too expensive right now. Here's why, in my humble opinion.",398
"I make chainmail jewelry, and I thought I would try some MtG inspired pieces.",396
Painted Island Alter,399
My friend is playing in the SCG Open this weekend and asked me to make him some tokens...,395
The fruits of my labor today. My first Planeswalker alter! Ajani Vengeant!,394
"At your pre-release, make sure the prize pool is *at least* two booster packs of Dragon's Maze for each player in the event. This is not optional. If your store refuses to do this, report them.",391
An Izzet Banner I made [MTG Arts and Crafts],394
[DGM] All Dragon's Maze spoilers for 4/19,425
"So I've been optimizing my Ghave deck, and my friends are starting to hate me because I'll usually combo off in some weird way. Here was my win last night.",396
"At GP Charlotte, Terese Nielsen raffled this adorable altered Force of Will away; I got lucky :)",395
Look at the full art i just picked up,396
"Bought a collection, got these thrown in for free. Guys, I'm going to go pro.",391
Ravnica D&amp;D Alignment Chart,394
A little revenge for my director after she teased me about playing Magic.,391
Gif of a Klug Alter,391
Finally got a picture with the guy who got me into Magic! :),396
"We've had all these graphs about the guilds, so I spent some time in Paint to tell you guys everything you need to know about Return to Ravnica",391
Has anyone used those new RtR symbols to make a guild-diagram yet? (Excuse my MS Paint),388
"Ding dong, Extended's dead.",389
So the M14 lands are here at GP Vegas with a new Land Station Box!,392
My friend's cockatoo got hold of Aurelia...,392
"Since this is not a subreddit for beginner questions, or learning about gameplay, or deckbuilding - where is a person supposed to go for those things?",391
"[EDH] I just finished a 6-year-long-project, one EDH deck for each color combo",392
"So, DGM will have zoomed-out Guildgate art?",391
"I wanted to share with you guys a deck my friend has been playing with for almost a decade. His cards have  been through the laundry, carried in his pocket, left out in the rain, thrown out a couple of times, and had numerous liquids spilled on it. We call it 'The Sponge'.",390
My favorite part about Autocardanywhere...,391
Why I love owning a Magic shop,392
Common Dual Lands? Yes please,390
"Hey r/magictcg, let's talk about memes.",394
"Got hungry during M14 prerelease. Luckily, we ate here.",388
Reddit get's credit for finding the guild gate message first!,387
Had a casual draft with some friends who last played years ago.  They used these out to track their life totals...,387
Why You're Probably Playing Dryad Militant Wrong,386
My trading binder.,391
Modern Masters Card Image Gallery : Wizards of the Coast,387
Custom Tokens,383
Just watching some pros play MTG,383
"Judging by her 1st anniversary present for me, my wife is getting to know me very well. I love her so much...",384
[DGM] Nivix Cyclops turn 4 win,380
The most self-interested way to vote in YMTC4.,384
Randomly found this revised swamp in my collection a few days ago,388
I learned something new today...,381
Magic Cards as Bookmarks,388
"(Update, Stolen Cards) OMG, r/MagicTCG - You Are AWESOME!!",381
A comparison of Innistrad and Avacyn Restored lands.,382
"I wanted to thank the LEGACY #SCGMA player ""Avery"" who found my foiled out RUG DELVER deck. I never got a chance to personally thank him. Please vote up so I can find him!",378
[M14] SPOILER: Colossal Whale,383
"So some friends of mine wanted to buy some intro decks and play them this weekend, mine ended up being almost entirely miscut ",382
Found this while browsing trademarks for WOTC. Possible name to the next set?,384
Old Magic stuff from the early days,381
New DGM images (including better quality champions/gates),384
Snapcaster Mage - Izzet League Member?,380
"Got a Spanish Jace, this is the result",383
"Thanks, Channel Fireball!",382
I think this is my favorite comment on Gatherer.,383
"Reminder - Support your LGS, before it's too late.",379
Which card(s) do you completely despise for whatever reason? Here's mine.,385
My friend made this,380
A girl in my LGS painted a Restoration Angel on the wall. This is her work.,378
Selesnya in Real Life,381
"Hey Reddit MTGers, Check out my new trophy!",384
Flavor text used to be pretty deep.,379
So i met Lucas Graciano yesterday and asked him to alter my vexing devil,375
"Congratulations /r/magictcg! You're the subreddit of the day for November 18, 2011!",377
TIL that six of the ten guilds of Ravnica had new symbols in RTR.,379
The Magic Knight!,379
A fellow redditor commissioned me to recreate my Gisela wielding the Halo energy swords but never paid - Anyone else interested? (or interested in any custom work?),380
When I saw the Website I knew exactly what I wanted to make. (site in comments),382
Check out this MTG necklace I made! What you all think?,378
I painted the new art for Kjeldoran Outpost,383
"I got this custom made 3D goat token life counter done and shipped to me free of charge. ChaosKnight127, you're my hero. ",377
I made a deck box for each guild. Going to give them away at Prerelease this weekend. (Link to printable pdfs in comments.),374
4chan explaining MtG to outsiders,380
"Sifting through a box of 10K cards a friend found on the street. My heart skipped, then broke. Troll Level: Sharpie",376
"PSA: Rotation occurs September 27th, 2013. INN block and M13 leave standard on that day.",375
One of my friends went to a PTQ recently. Apparently this is legal.,372
DIY beautiful foil tokens,376
No combo could be as bad as this,370
It was my 21st birthday last week. I think you guys might love my cake.,374
You guys seemed to like my Esper shirt the other day. Here's one I made a while back!,376
"My chocobo bird token, was so excited about it the paint isn't even dry yet.",375
Spoilers: How did this go? Would you like me to continue to DGM?,376
Guild Inspired Icecream flavors at DGM Prerelease,375
"Back in the day I worked at a game store, we sold magic during the alpha/beta/unlimited releases. Recently found a box with some old cards.",373
"Ready for Gatecrash tonight, to uphold the laws!",372
I've got too much [clap clap] time on my hands.,373
Shocklands will be available in packs Dragon's Maze,375
I think I may have just found my new favorite card,374
This is definitely one of my favorite things about magic,368
[GTC] All Gatecrash spoilers for 1/4,371
What's a Street Date?,370
How to lose friends fast.,369
I made 30 custom magic cards based on popular memes I've seen around reddit with your help!  These are those cards...,371
[DGM] All Dragon's Maze spoilers for 4/18,423
Something I found while browsing through my cards. Just thought some of you guys might find it interesting.,374
I painted Spelltwine for m13,370
My local WalMart just got Ravinca guilds shirts!,372
"Shipping alone was going to be $37. Instead, I picked up a $4 shirt and some bleach.",368
Reddit! Look!,368
My best friend's girlfriend painted him this for his birthday.,366
MaRo lays out Theros,368
Just finished my largest commission order to date! (*phew!*) Thank you r/MagicTCG users for providing me with so much work!,368
[PSA] Stop downvoting comments because you disagree with them. Upvote relevant discussion even if you disagree.This is one of the worst subreddits for people getting downvoted for voicing an opinion that is contrary to what most people think.,372
I made a BMO deckbox,367
Turn 3?  Whatever! Here's a turn 1 (bad) combo win in Modern.,368
Probably my most awkward moment on MTGO,362
"Inspired by recent googly-eyed magic card post, My tokens",366
An Inconvenient Truth,365
New Custom Playmat,370
My girlfriend set me up a draft party for my 30th. Here's some snacks and my beer cake: ),365
Isn't the point of spoiler roundups that we don't have to post 10+ spoilers in separate posts in one day?,364
Vizkopa Guildmage (Mythicspoiler.com),364
So this just happened. [Fluff],370
"By far, the Worst Standard Combo.",360
My new painting for Volcanic Island,364
I got bored while making a Call of Cthulhu game. Took a break by turning gods into magic cards. What do you guys think?,363
What's the funniest flavor text you have ever seen? I'll start us off with this.,368
Real life Caw-Blade (x-post WTF),364
Misconceptions: FNMs... not actually serious business.,367
We get boats in Theros?!,367
Live-redditing the MTG Panel at PAX East: Friends is Theros,366
"Everyone seems to think the new from FtV art is Mother of Runes, but it could be . . .",357
Draw me like one of your Ravnican girls,368
"1,000,000 Magic: The Gathering Cards",367
M13 Spoiler: Master of the Pearl Trident,359
Altered P9 Set - Klug Alters,367
The Goggles ...They Do Nothing,358
"My buddy is getting into magic, so i made him a deck and this as well. Merry Christmas Mike!",365
I was looking up rules on evolve when someone took it a little too literally,357
I've never had a large supply of lands. This was very helpful.,357
Our newest Level 3 Magic Judge is redditor Ubernostrum! (with added bonus!),360
"Which card that you own makes you say, ""What the fuck..."" above all the others? Here's mine:",357
"While we are on Worldfire combos, how is this for sadistic?",360
Painted Island Alter (M11),359
Steve Argyle sets some guidelines for mtg conventions,359
My Gatecrash draft strategy,361
My mom finally found my birthday present she lost 11 years ago. I figured Reddit would appreciate it.,360
It's my 21st birthday. My best friend's girlfriend made me these.,360
If you don't stop this from resolving...(lost to this twice in one weekend),364
"Gideon, Champion of Hippos (EDH Combo)",362
"Noticed this while drafting M13 last night...someone find out what plane this is, quick!",358
"Passing the Jace Test: Past, Present, and Future",353
More Theros artworks,359
Fuller art lands - complete cycle,357
Over in /r/askreddit...,353
Enchiridion deck box ,358
"”Somewhere, a nerd is very sad.”",351
