title,score
Cried during Lion King? You don't know true pain.,2813
"Oh man, I loved how these completely destroyed my tongue.",2700
It's the leaning tower of Cheeza!,2515
How many of you were forced to play these in elementary?,2379
Motherfuckin' Street Sharks,2351
Never in my life have I ever wanted to actually taste a leaf other than when I watched this movie as a kid.,2236
I used to read these every night,2182
Anyone remember this guy?,2137
"Before Wikipedia, I had this. ",2125
I liked to play with the sliding part,2114
Who remembers these tattoo choker necklaces? So popular in the 90's...,2070
I still remember how they smelled. ,2066
Yes. Yes you did.,2056
Anyone else remember balance birds?,2034
My favorite thing from school...,2023
The three Eds Grown Up. Awesome Artwork,2011
These guys. ,1977
"This needs to be out back on tv, now.",1970
Some somber nostalgia,1963
"Jurassic Park Dinosaurs WITH the ""dino damage wound""",1928
Velcro Ball Catch,1913
Does anyone remember this book?,1889
This was one of my favorite Saturday morning cartoons.,1884
This game...,1851
These things,1849
Words of wisdom from Mr. Rogers,1847
Found this at Goodwill yesterday and had to bring it home,1802
"When I was a kid, this was the coolest thing ever...",1795
Who remembers this amazing movie?,1787
"The only reason I know what a ""stoop"" is.",1772
Friend was cleaning out his room for college and found his old art box. Right in the childhood.,1744
"Everyone grab your calculator from the back of the class, it's math time",1745
Watching these guys race each other.,1736
Orange VHS tapes! ,1701
Seemed like every waiting room had one...,1686
The Fishing Toy,1674
Anybody else remember Dinoasaur Egg Oatmeal from their childhood? (90s),1665
Who remembers this?!,1656
Who remembers these three?,1645
These swings.,1633
These were the best,1630
The most useful accessory there was.,1630
Prometheus and Bob,1622
Sweet sweet 90's nutrition,1603
Thought r/nostalgia would appreciate this,1598
Today is my actual birthday and I'll be reading a book I haven't touched in 22 years. Who else had this book???,1578
Gateway cow boxes,1563
Little gold books were always my favorites. ,1559
Who here remembers this guy?,1559
Nobody knows what the hell I'm talking about when I mention this show.,1550
Water go down the hole,1518
This made grocery shopping look like fun.,1517
I used to love this shit,1494
This was the fucking shit.,1481
Bear Grylls has nothing on this dude,1480
"Did anyone else have inflatable furniture?
",1472
So much fun 'til you lose all the rings ,1460
"This image alone should spark some ""fond"" memories",1453
iPad for us 80's kids,1461
Everyone I knew had at least one of these.,1450
Remember Bill?,1428
I wanted to climb this so badly as a kid!,1425
Manly tears :'(,1417
"Remember ""smoking"" these?",1418
The only game you needed.,1400
Any 90's kids remember this old music player?,1404
These guys were the pinnacle of comedy when I was a child.,1400
Back in my day cereal came in cool shapes,1399
"Did anyone else play ""Brain Quest"" as a kid?",1398
"Just went to say goodbye to an old neighborhood friend, thanks for the good times Blockbuster. ",1389
Use to read this every night as a kid,1375
Ain't even mad my parents raised me nerdy,1362
"Don't remember what it's about, but I do remember the cover",1356
Dat VHS Sleeve,1347
Anyone have one of these as a kid?,1343
Astronaut ice cream: the best thing in the science museum gift shop.,1313
Probably the greatest toy to be offered at Burger King,1305
Taking it back a few more years of my life than usual.,1300
Playing with a computer as kid.,1289
Does reddit remember blo pens?,1286
"I was jealous of anyone who had these, I thought they were awesome.",1289
Does anyone remember who took you on crazy adventures?,1283
I still have a few of the men...,1280
Who else hated it when this came on?,1265
4 Color Click Pens,1268
Teenage Mutant Ninja Turtles 90's toys,1263
me and my dad found windows 95,1258
That Smell,1262
"Skidamarink a-dink, a-dink, Skidamarink a-doo, I love you",1253
"Everyone remembers Bill Nye, but does anyone remember Beakman's World?",1251
Awesome underrated show,1244
My GF painted this. How many references can you spot?,1242
Stumbled upon this in my house today. McDonald's Transformer from the late 80's. Remember these? [X-post from /r/pics],1235
My first iPod ,1227
She was the true face of evil. ,1224
"So here I am, doing everything I can...",1222
Pattern blocks! We still use them in elementary schools.,1224
Woogity woogity woogity,1211
Anyone else agree?,1211
One of my best gifts ever as a kid,1200
I used to spend hours talking to this guy.,1198
brown was awful.,1203
"I'll love you forever, I'll like you for always, as long as I'm living, my baby you'll be.",1195
Road Rash! This game was the best!,1187
This is gonna blow your minds...,1186
The epitome of the 90's/my first celebrity encounter.,1185
Who remembers these guys?,1183
"Just watched a VHS tape, that voice is never leaving my head",1186
I figured you '80s/'90s kids might appreciate this: The Land Before Time!,1183
"Don't mind me, just picking things up with my DINOSAUR.",1176
skinamarinky dinky dink. anyone remember this?,1179
this movie made me super paranoid ,1173
This man taught me all my pickup lines...perhaps that's why I'm still single...,1168
Remember this guy?,1164
Been watching a lot of Boy Meets World episodes lately.  This is by far my favorite George Feeny quote. ,1166
"No one I talk to remembers this show, but it got me going in robotics. Please tell me someone here knows what I am talking about:",1167
"Sticky hands, one throw and they're dirty",1153
Dat Nostalgia,1146
Fruit String Thing.,1145
90s McDonalds nostalgia courtesy of Facebook,1148
These had a lifespan of about 7 minutes when I was a kid,1137
Who needs a smart phone when they've got this!?!,1141
Overhead Projectors,1141
I found my old balance bird,1138
The best feeling ever,1139
Who else remembers this little guy?,1127
See Through Phone,1120
Pierre Escargot ,1119
"""Here, kids.  Drink this, then run around in circles 'til you pass out.""",1106
The pinnacle of my youth art aspirations.,1108
Seinfeld always had it right,1103
I can't believe this was a real show,1103
I LOVED this movie as a child,1102
Pulling the cords on these bitches was sooo satisfying,1095
Everyone had one of these pencil cases! ,1095
Fuck this douche.,1097
"Before any of us had internet, there was this...",1093
When was the last time you ate dirt? My g/f is awesome.,1082
Dat new feel...,1087
A friend reminded me of these last night... Flintstones Push-Up ice cream,1079
This little fella single-handedly eliminated boredom on night time car trips.,1081
Who else remembers face?,1076
This was the pinnacle moment of my life... Only downhill from there...,1070
Did anyone love this back in 2000?,1079
Before there was texting,1074
"The weirdest gum ever, but man was it good.",1074
These were awesome!,1063
Always looked forward to playing with these in math,1065
"Cool Spot, the old 7-up mascot, was a badass.",1063
My dessert everyday in elementary school.,1066
Textbook Covers,1056
Anyone old enough to remember these guys?,1048
Still My Favourite Game Of All Time...,1045
Look what's back!,1049
"Scary Stories to Tell in the Dark... it wasn't the stories that gave me nightmares, it was the artwork.",1044
Cleaning my desk drawer when i found this little gem,1038
I was moving and stumbled across these childhood memories.,1043
Making these into superheroes,1040
Dat. Smell.,1033
"Had a conversation with my little sister, and realized she never had one these. I went right to the store for ingredients to fulfill her childhood.",1029
Found at Goodwill. Hope it gives my kids nightmares as it did for me,1034
The best memory of my childhood as a gamer :),1026
The most fun I ever had for 25 cents.,1025
Officer Big Mac from the old McDonald's playground,1018
These are way better than what they have out now,1019
Stoop kid's afraid to leave his stoop.,1020
VVVVVVWWWEEEEEEENNNNNNNN,1014
So I came home to visit my family since I was away at college. This was sitting on my bed.,1010
Who remembers this awesome place?,1017
Perhaps the greatest movie of the 90s,1010
Never thought this sweet nectar would touch my taste buds again,1005
Who else thought these were the coolest thing as a kid,1009
"COME ON, I JUST WANT TO WATCH THE MOVIE ALREADY.",1003
A childhood favorite ,1001
Still kicks my ass...,1003
Will It Connect?!,998
This. Show.,988
I loved this movie growing up!,991
"When I saw this, I knew it was time to change the channel",986
I found this bad boy in a thrift shop.,981
All of our moms had THIS cookbook,985
My grandmother read this to me and my sister every time we visited. Caps for Sale,975
"IMO, these were better than Kool-Aid Bursts.  Mainly because each bottle had a different face on it.",976
As a guy I still loved this show,980
"""and Jenny's head fell off""",966
Marvin's Magic Drawing Board,967
Used to love this gum,966
The show we all watched when we were too sick to go to school.,962
A drugstore favorite of mine when I was a boy. PARATROOPERS!,959
One of my favorite movies as a child,956
Do kids still use these at school?,959
All the guys will remember...,950
The Super Nintendo was released 23 years ago.,947
"Pepper Ann, much too cool for seventh grade!",944
This was my favorite toy growing up,947
Holy crap... remember Face?,944
"We all know Bill Nye, but who remembers Beakman?",942
"Did anyone else want to go to ""Scenic Timmy's Bathroom"" for Cosmo-con",941
"""You guys wanna see a dead body?""",946
Loved how it lifted up out of the ground when we would swing too high!,942
The Mouse and the Motorcycle. I still remember his helmet was made out of half of a ping pong ball. ,943
Fisher Price Roller Skates,941
desk toys!,935
Because 90's kids are worth it too!,932
The commercial for this came on all the damn time.,928
Whipper Snappers,930
Was digging through my closet when I found my old Nickelodeon windbreaker.,929
Mother. Fucking. Cheez Balls.,926
"For the girls of my generation, I bring back to you, the original Polly Pocket. ",932
Kids these days have no clue what this means,927
PICTURE DAY!,925
These fucking guys. ,918
"""These, are the Prometheus and Bob tapes""",914
Any love for Samurai jack?,921
This was definitely the most frustrating thing in my childhood.,912
Yak Bak,908
While we're talking about McDonalds...,913
Reliving my childhood a bit today.,907
I just realized kids these days will never know the joys of continuously blinding or shocking their friends with a disposable camera,902
Rarely has clay made something more beautiful...,906
1991: Friday night meant watching TGIF and eating one of these.,898
This book.,899
I had this toy when I was little. 30 years have gone by and it hasn't changed one bit.,895
These freakin things.,895
Youtube has changed quite a bit hasn't it?,897
This.  I am introducing this classic to my son today.,890
My favorite candy of my childhood.,898
I couldn't believe batteries could do this!,888
The Waterful Ring Toss!!,883
"Max look, it's the leaning tower of...",876
The warning label spacemaker forgot to put on their products.,876
Gonna take pollution down to zero!,877
"I hated these things in school, too much pressure for a first grader!",876
Since Halloween is coming soon,878
Plastic Jumping Frogs!,869
Remember the Discovery Zone?,874
I always wanted this...,872
Admit it - you secretly hated these two ,874
just gonna leave this here...,870
"Found this on my bookshelf, anyone else have this as a kid?",868
This S thing,868
I feel like only a few will remember,866
Witch Hands,865
Who loves orange soda??.. this guy I met today does!!,860
"If that ain't hip hop, I don't know what is.",862
"If this gif doesn't bring back memories, then I fear for your childhood. (Or teenhood, or whatever-hood) [x-post from r/gifs]",856
Chalk Zone...,856
Used to run to every one of these in the store,849
Anyone else have this?,841
Loved making as many faces as possible!,848
As a middle aged subscriber to this subreddit,849
Netflix adds nostalgia to its library!,844
I work at a donation center and someone just donated this shirt...,838
Remember this awesome show from PBS?,844
"As a dog-person, the only cat I ever liked",839
"Chicka Chicka Boom Boom, Will There Be Enough Room?",840
Remember the feeling opening your first pack?,839
Thirsty?,830
My father wrapped and gave these back to me this past Christmas.  ,829
Super van city!,831
Bravo ,835
Burger King Kids Club,834
Just found my entire childhood in my basement...,831
The Honeycomb Monster,827
Any love for these guys?,832
I gave my friends my change to watch him eat.,829
Nothing beat one of these on a hot summer day.,828
I think Alex had a worse day...,827
"Before Libraries used computers, this is how we found books",821
Best jelly jars ever.,819
"This is going pretty far back, who else remembers Teeny Little Super Guy?",813
Big pimpin Ooze,810
"It's Friday, and you know what that means!",808
This book!,804
The best part of elementary school,806
What ever happened to Whistle Pops?,804
Anyone remember Reboot?,804
This game.,806
I learned how to hate at a young age because of this bitch right here.,794
Found this picture of me with a Street Shark at a Toys R Us opening,798
"Little Critter, my favorite childhood book series.",793
You haven't truly lived until you've tried these. ,794
Hiding in these as a kid. ,791
Flintstones Vitamins,788
best 80's toy for a kid who couldn't wait to drive ,785
Does anyone else remember playing with these Little People?,784
90's Gas Prices,780
dat orange,773
Enjoy,772
Plastic treasure chests.,770
The only instrument everyone can say they played.,767
My college English professor read this in class the other day.,771
Action League...NOW!,761
The WB Frog,763
"The original ""My friends Sister"" ",759
who else had this rug and loved it??,756
Most of reddit is probably too young to remember this early Nickelodeon cornerstone.,758
"Maybe not a cool as the Rugrats shirt, but I also found a nostalgic shirt at a donation center",753
Land Before Time puppets from Pizza Hut,758
I used to love putting this on my hands just so I could peel it off. ,747
Whenever I went to my friends house.,752
Repairman man man man!,747
"Out of serious curiosity, did anyone else watch this show? Nobody I know watched it.",747
I had so many worksheets covered in these,752
My favorite TV show growing up. ,751
Who remembers sucking on these?,746
Just a reminder of what you forgot about.,745
You guys jealous of my Pepsi Blue?,751
It really was a simpler time... (x-post r/funny),748
It's been 12 years since Apple released the first iPod.,743
My Favorite was Black Cherry,741
Anti-Skip Protection,742
Painful thumb memory,744
Gaming in 1997 [x-post from /r/gaming],740
I love Google Doodles...and today their tribute to Maurice Sendak for what would be his 85th Birthday!,736
Bart Simpson's Guide To Life - A Wee Handbook For The Perplexed,737
Anyone else remember reading this?,732
"Hey, No peeking!! Nostalgia Overload.",734
My First Experience With Photography...,728
I will be so happy if all of you remember these,734
I feel like I'm the only one who remembers this McDonalds mascot/campaign...,727
the only good part of going to the doctors as a kid...,728
DOES ANYBODY REMEMBER THIS SHOW!?,728
Anyone remember Amelia Bedelia?,720
"Childhood in one post, same for anyone else?",720
"Discovery Zone (Yeah Yeah) It's fun-believable fitness for kids!
",720
One of the first books I can remember,720
Remember this guy?,719
Anticipation!,721
Did anyone else used to love Ernest?,723
How hilarious were these two...,719
The poor kid's copy machine,715
He took the last can of Who Hash... whatever that is.,714
The big white books were always my favorite,715
"Does anybody remember ""Animorphs""?",711
"If you played with this, you had a great childhood.",708
Anyone remember this book? Read it all the time as a kid.,708
blank check anyone?,711
Worms 'n dirt- found at a local diner,707
Anyone else who was even more excited when this guy was involved in a Darkwing Duck Episode?,708
While visiting my grandma I found a stored late 90's computer with all the shareware game goodness from my childhood,702
Agro Crag!!!,701
Lite Brite,700
Pretty sure everyone had this,703
No one I know remembers this show.,697
This was almost 20 years ago...,701
rediscovered these today while cleaning the kitchen...and almost 20 years later they still work!,698
"I love Pee-Wee Herman, but this haunted my nightmares for years.",702
This was texting before texting was texting. It with old myspace was a deadly combination.,699
Hot Shot Basketball/Baseball,695
Chip's Challenge,693
Remember these guys?,693
I used to drink Ovaltine and watch this every Friday,695
I'm not ashamed to admit I had this in the 90s. ,695
Magnetic fish game. ,692
i wanted these soooo badly when i was in middle school.,689
This was a necessity if you ever wanted to win the battle where I grew up.,688
Ouch bubble gum,686
Lookin' for something in the closet and I found this bad boy....,692
My girlfriend just brought me one of these. Haven't had one in over 15 years!,683
Before there was Halo...,688
These things,684
Everyone had at least one,685
And now some Vital Information for your everyday life,687
"nothing says ""the 90s"" like balancing birds",683
Does anyone else remember Road Rash?!,678
This was the math game I played as a kid.,681
One of the unsung heroes of my childhood. ,674
Ralph!,683
"I had so many of these planes as a kid. They never lasted very long, but as kindergartener, their simple construction amused me.",674
Sniz and Fondue,678
THROWBACK,671
Who remembers using a spoon to open this lid?,674
"Well I see your LITTLE GIANTS, and I'm all in, with THIS",675
I had dozens of the empty little bottles,668
I still can't watch this movie because of this part,666
The Teacher from the Black Lagoon series!,664
The scariest thing ever for Cartoon Network fans to face [X/post from /r/cartoons],665
Goodbye MSN messenger!,662
Who remembers drinking one of these?,664
Dic,664
Windows 95,661
I loved this show for some reason...,661
Remember Robie? from r/pics,658
I had always been fascinated with this show. Not sure why..,661
Did anyone else read this as a kid?,655
"It's not that old, but I still miss him",660
Lets. Get. Dangerous.,653
Children of the early 80s will remember seeing these everywhere.,651
My mom hated these...,653
This show.,646
Anyone have this record player?,652
Dial M for Monkey!,644
"A spoonful of bubblegum, helps the medicine go down.",642
I thought of these today,639
Something we definitely all miss,645
YOU HAVE THE WRONG NUMBER!,640
"Run, run, as fast as you can.",640
"Yahooligans, anyone?",645
The Best Disney Sequal Ever Made,639
One of my favorite scary story books as a kid,639
Heaven for the suburban child,636
These,634
Rewinding VHS tapes became so fun with this!,637
Think Big,638
Let's Get It On!,637
"Back in my day, we had printers for our Game Boys!",633
Anyone else's 1st instrument?,629
Slap Bracelets,628
Wishbone was one of the first shows I remember watching as a kid,625
This show was just perfection ,632
I haven't gone one Christmas without watching this one. Not since it first came out.,622
The most refreshing drink of my childhood,627
"Freakazoid!!!
",629
This used to be my favorite show.,625
I can still smell them...,621
These,619
My first driving lesson,619
I was practically the Mozart of these.,626
Anyone remember poo-chi's?  I saw something similar in a magazine and it brought back memories.,624
Holes.,621
American Gladiators: Assault ,621
It stinks!,618
No Korn shirt is complete without one of these.,616
This was the shit back in the day.,617
Miss doing that,619
I used to treat these as if they were prescription medication.,616
"Shit, where's a payphone??",613
My fiance found his old pogs in his dads garage.,615
This was one of the books that defined my childhood.  I know I can't be the only one.,617
Frisbees in the mail,612
Who remembers these?,619
One of my favorite computer games growing up. Dig Dug,614
Where did these go?,611
Who had one of these bad boys?,608
remember these ,608
These things,609
"Zoobooks, anyone?",614
The only reason I waited for the ice cream man.,617
"In 3rd grade, having one of these bad boys was comparable to owning a Maserati;  The Four Color Pen.",610
You guys can appreciate this right?,605
Cow and Chicken!,605
When cereal box prizes were actually awesome (and practical!)...,609
Anyone remember this show from FoxKids?,600
I remembers,602
Why oh why do these still not exist?!,591
Whoa! Almost forgot I had one of these! To me it was the 90's step between paper notes and the smart phone.,591
Flubber dance,597
"Don't worry, I'm a doctor!  ;)",591
Just realized I haven't eaten puppy chow since middle school...SO good,593
Bristle Blocks: one of my earliest memories,597
Bill!Bill!BillBill!Bill!Bill!,595
Good ol' MySpace notifications,594
The original Grand Theft Auto,593
Meanwhile in the 90's...,590
These books.,584
"I see your Handi-Snacks, and present to you the perfect counterpart",590
What I'm chewing on today at work.,584
Matchbox Powertrack,582
Jackie Chan Adventures,582
My favorite book to use for book reports,589
Anyone else remember when the internet looked like this?,582
A true game of skill.,583
Supermarket Sweep! ,585
Can anyone else relate?,584
Nickelodeon Magazine PLEASE,580
Everyone remembers this one,582
Killer Tofu!,575
Surge. Coca-Cola's 90s attempt to compete with Mountain Dew,576
I was just cleaning out my attic and I found a bunch of these.,576
These happy milk cartons.,579
Went to Barnes&amp;noble and saw this... ,575
not my picture but i remember having a shit ton of these as a kid,579
Humongous Entertainment games!,579
"Pagemaster, movie from my youth. My two year old just watched it for the first time with me. He loved it.",570
The disgusting candy this thing made... Oh the 90's.,575
Paper Bag Book Covers,576
I took this thing EVERYWHERE.,570
Greatest movie ever when I was 12,571
I always dreamed of going here when I was a kid.,579
I remember playing this with friends,573
"Yeah, he was definitely a stoner.",568
Every. Saturday. Morning.,571
Was looking through some old boxes when I came across this gem,574
Not pony tails or cotton tails...,566
"my parents were close friends of Shari Lewis and her husband, and when he passed away he gave her one of the lambchop puppets they used on television",570
This is how I prefer to remember Macaulay Culkin.,565
This used to scare me...who am I kidding?...probably still does.,569
This show was my whole childhood. [fixed],569
One of my favorite Christmas movies as a kid,568
Totally forgot about this show.,569
Do they still make sticky hands?,565
I couldn't stop playing with this. Such a good quality toy,567
Phew!,561
"Yes, but did you go to multiple McDonalds to get this?",561
Any love for Flintstones Push Pops?,567
"oh god, the nostalgic feels!",562
One of the greatest books,566
Don't Break the Ice!,568
Driving down the highway when suddenly ,564
Anyone else remember Gullah Gullah island? ,565
This was my favourite cartoon in the 90s!,567
I know I wasn't the only one that played this. ,561
I barely remember this cartoon,559
Mike Mulligan and His Steam Shovel,565
At least one kid on the block owned one of these,559
I had almost all of these books.,561
This has been my parents' tv for 29 years. It was replaced today. This picture has not been altered in any way.,561
Scent of nail polisher remover made me remember this.  How was anyone allowed to market this to kids,557
I always loved it when this guy came on before a show.,561
NSFW ,550
The Poky Little Puppy was a great story,554
Anyone else get excited when they got color changing spoons in their cereal box??,557
I used to love this show,545
Game of Zords,548
Oreo O's.,544
My favorite book when I was growing up.,548
"If you got slimed, you were awesome.",540
Milo &amp; Otis,547
School Nostalgia At Its Finest,537
These things.,542
such high hopes back then...,532
Do you still have these in your kitchen cabinet? ,534
Fun Snaps! I would see these on the sidewalk everywhere.,535
Talkboy,526
"I hate to be contradictory, but THESE were the best thing on a sizzling summer's eve.",532
This badass was my childhood,525
What's the story Wishbone?,527
Fun Dip,528
"My first car, the miles I put on that thing! Anyone else?",529
"Found this at the library. Gonna force my little brother to sit and read it with me, because it's epic awesomeness.",526
"🎶Muppet Babies, we make our dreams come true 🎶 🎶Muppet Babies, we'll do the same for you🎶 Kermit: When your world looks kinda weird and you wish that you weren't there Piggy: Just close your eyes and make believe and you can be anywhere!",528
You know you did a good job on your school work if you got a scratch and sniff sticker.,522
Echo Mike,524
Pound Puppies anyone? ,526
Oh Quailman you're my hero!,521
I accidentally led so many of these little fuckers to their deaths :(,522
Right in the feels.,521
Before mario kart there was muppet babies Mcdonalds toys.,521
"As a kid, this place used to be nightmare fuel. What happened?",518
"Anyone else eat their weight in these as a kid? These are still, by far, the best cheese snacks ever. Better than Cheetos.",520
Found these today,519
I used to run around and throw these at girls during recess.,520
I really miss this ad campaign,512
Anyone remember playing this game as a kid?,509
Loved these as a kid! Always in the freezer.,510
Stinky Cheese Man,509
That one minute of music.,511
Anyone else have a RoboPup?,512
"I don't know how popular this show was, but I miss it!",511
"Stone by day, warriors by night, we were betrayed by the humans we had sworn to protect, frozen in stone by a magic spell for a thousand years.",512
rectangle pizza.,505
Our early days as pirates..,505
Whatever this thing was called,509
you know it's true,507
Anybody?,502
