title,score
Orange Nickelodeon VHS tapes,504
God I loved this game TMNT,502
This is the cartoon I grew up on,498
My dad broke out the old slot car set to show my little sister. Played for hours.,501
Wave Race 64 anyone?,499
How to turn into a Rock Star,497
The cast of Full House reunite for the show's 25th anniversary.,497
I ran into this little guy at work. Remember this? ,495
"Four pieces of cardboard, processed yellow slop, and a small red stick to tie it all together.",493
Ladies.,491
"Old school paint, never forget. [FIXED]",496
Younger generations will never know the feeling.,495
"It might have been before my time, but does anyone still remember these two awesome guys?",489
"Lemony Snicket's ""A Series of Unfortunate Events""",489
Please bring these back!,490
Another one everyone played with,486
The corn looked like the most delicious food ever as a kid...,489
How to please a woman [X-Post from r/funny],487
That Zoboomafeel,483
"""discontinued for being too delicious""",486
"Summer time, is everyone ready for their nostalgic mouth destroying treats?",484
Words to live by,482
Did you guys know Slip N' Slides now have a barrier at the end? I guess we're the last generation to fly into the bushes after a particularly slippy slide.,486
The other king of the playground,482
Coming soon to own on VIDEO and DVD...,484
Who remembers these?,489
Bump In The Night!,479
Anyone remember this glorious cheesy bastard?,483
the hell happened to kudos bars?? they were delicious,474
"Oh, the things I would do just to have these back on the shelves ",475
An American Tail!,475
The Big Green,477
How games used to be played,474
"Go, Dexter's Family Go!",473
Still my favorite animated film. I used to cry watching this as a child.,479
Who else played with these? ,479
Reading these was the best,473
Weinerville was always a bit weird,471
Nugget Buddies. (xpost r/mcnuggets),474
Eureekas Castle,471
I Think Everyone Who Had it Once Wants it Back!,475
This screen,471
Loved this Rug,471
My go to squeeze juice in 4th grade,468
Who else read this whole series?,467
"Found this little gem while cleaning at work today. Complete with ""rubber nipple fetish"" add-ons. It's mine now!",469
You probably remember this logo.,461
My mom was throwing old stuff out and asked me if I wanted to keep this. HELL YES!,462
Anyone else have this?,464
The smell after using these,467
I see you Duck Tales and raise you....,461
Topanga's Boyfriend,463
The earliest Lego sets I remember,459
As long as I'm living my baby you'll be.,464
Does anyone remember Discovery Zone?,461
The Twilight of my elementary school days,459
I'd buy you...but you'd just run out of flavor within 12 seconds and that would lead to ultimate disappointment.,459
AIM was my life during my early adolescent days,455
Watched this movie just about every day.,454
The golden age of Nintendo Power!,453
Rediscovered these guys recently. I wish I had all of them,451
Right in the nostlalgia!,457
This show.,457
So I was Christmas shopping today and suddenly...,453
"I slept for 2 hours last night, and, not being able to go back to sleep after waking up, I look to see what's on, when suddenly I find this.",453
The most terrifying moments of my childhood...,450
"In my early years, this was once my favorite toy",451
You wanted one,454
"“Expect everything, I always say, and the unexpected never happens.”",448
My dad &amp; I loved this show,452
"Im so glad this moment happened, even if I wasnt born yet to see it. Vincent Price gets bitten by vampire Kermit (1976)!",449
Rodents revenge,450
in 1998/1999 my friends and I used to drink this stuff like a college kid drinks alcohol.,442
"I can't buy Trix anymore, because they're just little balls. Remember when they looked like this?",450
Remember this fucker?,441
Mighty Ducks sliding pucks,443
I loved gambling when I was 8 years old.,446
No other Cheetos product has managed to fill the void...,442
I learned to tinker at a young age,446
Don't you all freak out at once.,440
I must have made dozens of these things when I was at home with chickenpox...,439
The commercials were so intense!,444
Guys! Pocket Critters keychains!,445
The Trail,443
Who read this in elementary school?,439
I played this last night for the first time in 13 years,434
Who remembers where this map is for?,437
This is what I grew up with,437
The Nintendo seal of quality during the 90's [x-post r/gaming],433
Who remembers this?,430
One of the greatest games for SNES.,432
Who read her books as a kid?,432
My mother just brought home a pack of these and it brought me way back.,430
How else were you supposed to beat Teenage Mutant Ninja Turtles?,432
This game right here is a significant proportion of my childhood,428
What the 90s meant for me,432
Anyone else remember waiting for their movies to rewind in one of these. ,431
80's kids might remember this one,431
"For then love of pizza, I happily read.",435
this movie was a classic in a classic.,425
I can hear it now,425
This smell [FIXED] (when opened),430
Mom told me to come get my TV Tray or she will throw it out.,424
"I was already an adult, and working nights, but I would stay up late on Saturday mornings to catch this.",427
Much too cool for seventh grade,421
Bonkers?,429
"If this isn't some major nostalgia, I don't know what is",427
Pass the Pigs,427
Anyone remember these cool guys?,423
One of my favorite cartoons growing up ,426
After elementary school I'm surprised I still have fingers.,424
Best Dessert Ever,426
i miss this guy,427
My favorite show growing up.,425
These always made me feel so smart...,421
"I miss you, 1994. ",419
Who else had a huge collection of gel pens?? ,420
This is who I hung out with every day after school.,426
"Used to love this movie as a kid! Fern gully, or as i call it nowadays, Avatar 1.",418
"I choked so many of these down, thinking it would make me look cool :sigh:",418
Nothing better during Little League Baseball,415
"Once a week in Elementary School, we had computer lab. Once a week, I ran from Troggles.",415
Did anyone else have this sword as a kid?,422
What the hell was this little critter anyways?,414
Kids today will never even know of these,421
Gold-Plated BK Pokemon Cards. You know you loved these things.,414
I accidentally led so many of these little fuckers to their deaths (fixed),414
The Pagemaster,413
These moments made me the man I am today,417
Anyone ever play/remember Cool Spot?,418
Would play this for hours. ,412
My sister gave me these when I was 6. I loved her for it but my parents not so much.,413
I always preferred these books to Where's Waldo,410
Rampage (N64),409
"All That: Pierre Escargot, anyone?",413
Anyone remeber Slim Goodbody?,413
What I wouldn't do to drink fire again..,412
Sailor Moon - The show a lot of guys (including myself) were watching in the mid '90s,416
Mouse Balls,408
before there was DLC,413
Check this out!  Found it while cleaning my room.,411
Best day ever,413
"Before you we're allowed to watch The Crocodile Hunter, you watched these devilish rogues.",410
Loved these,410
Found this in my local library,412
"If you do not remember this show, you were not a 90's kid, you were a 90's baby and this was on after your bedtime. Sorry. [FIXED]",412
This book used to be the bomb.,409
Boyfriend told me he had never heard of this book.  Jaws were dropped.  Hopefully Reddit is familiar with it.,407
"Anybody else used to get excited in elementary school, when you got your Scholastic book order form?",401
Spirographs!! oh man.,405
The only thing the Internet was good for when I was 11,408
"If you got a Happy meal anywhere between 88'-96' , you may have played with some of these.",404
how many times did you check this out at the school library as a kid?,403
Stand out.,406
$9.99 at Target. I think I might. ,400
if it wasn't nighttime i'd just cup one of these in my hands,404
Many lunches were had with this.,404
A Collection of Nostalgic Start-Up Sounds,400
When this guy showed up you knew it was going to be a great episode. ,399
S,398
My childhood in one meal. I am so happy to eat it again after all those years !,399
Glo Worms!,403
"For something so simple, these entertained me for hours as a kid.",396
Spent all my coin on this one in the arcade,399
The Secret of NIMH,394
Every kid had Fisher Price toys.,399
Aww here it goes,395
My favorite movie as a kid,397
Anybody else still have theirs?,396
The best way to wake up...,390
Anyone remember this great movie?,395
Does anybody else miss Sprite Remix?,394
My Favorite Toy as a 4 Year Old,396
Anyone else remember when this was how you pirated a movie?,394
I always rooted for the Blue Barracudas,394
11th Birthday Cake. (I'm 27 Now),395
Anyone? (:,391
The bravest appliances I've known,392
This was the first TV I ever had in my bedroom.,397
I still miss the Scholastic book club,386
So pretty. So addicting.,392
"Maybe if I save up, one day I can afford to buy one of these!",387
"Sit, Ubu, Sit...",392
The things I remember creating with these...,389
Sixth grade English flash back,387
Did anyone else read this series?,391
Does anyone remember a time when computers couldn't turn themselves off?,389
The Berenstain Bears,382
This was the real hardcore shit.,383
This show just dropped off the TV guide.,386
My first digital camera,380
My first crush,381
Action League NOW!,380
The only reason I became a teacher was to try to be this guy.,383
My brother with his birthday gift in 1983. Aw yeah. ,380
"Instead of Gameboy, I had this",380
Did anybody else use this sunscreen?,380
One of my favorite shooter arcade games back in the day,384
This was as far as I got into playing sports as a kid,378
Any love for this show?,377
KaBlam!,377
Go Home Roger!,381
I just found my wallet from the 6th grade (1991). ,383
"For the boys of my generation, I bring back to you, Mighty Max.",378
The only reason I know anything about Jewish holidays...,385
What the hell is this guy?,377
This always made it seem like the browser was working extra hard to surf the information superhighway!,380
How many of you guys remember this cartoon?,375
Bought these yesterday at Big Lots,376
Motherfucking BOX GHOST,382
Did anyone else love this movie?,375
This girl was out of this world,373
mcdonaldland cookies,378
If you played games you remember this.,372
Where have these little mouthgasms gone?:(,373
these things....,372
Those gum drop eyes were ~5 times harder than diamond.,374
One of the first games I remember playing.,375
Every dentist office?,370
"Kids now get a huge ""playplace"", but this is really all we needed.",376
This guy... you know what I mean?,375
This book made me reevaluate what I had been taught about pigs.,372
Anyone else remember spending hours with these things?,367
Library Book Pockets,369
Still the best screensaver ever,372
Remember Her?,368
Repair Man Man Man Man,370
The best part about summer.....still!,370
We all learned in these. Don't even pretend you didn't.,367
How many times have you seen that bear fly that plane through that crevice?,367
The best part,366
"Some of you had the Orange Box, I had this sweet combo deal!",367
Every day... after school.  ,364
YOU GET CAUGHT UP IN THE.. ,363
Deathtraps on your feet.,364
Hopefully 90's Kids Will Remember This,365
Anyone remember Crazy bones?,364
"Today at work.  
Loved this game as a kid.  Even more fun bigger!",370
"""Hello, snotface!"" Any love for Drop Dead Fred?",370
Only the best book series of all time,367
I'm glad I grew up with this version of Batman,370
Surly i'm not the only one who had this.,369
anyone else remember this amazing movie?,365
Scandalous!,362
One of my favorite ad campaigns as a kid.,362
Vital Information,364
Anyone else loved this show?!,367
What I miss most is the way the store smelled,360
I miss this design.,360
Prometheus and Bob (x-post from r/funny),363
My Mom Used To Rent This VHS For Me ALL The Time,360
Let's not forget this childhood favorite ,358
Remember watching this tv show as a kid?,356
"Mini Piano, Anybody?",356
True 90s,360
Carpets worst enemy,362
Trying to watch porn when I was 12,360
Anybody else remember this game?,361
Best book at in the elementary library,360
The new ones just don't taste the same,360
Just try not to hit the ceiling fan...,360
There's no way I can be the only one...,358
Name that house!,353
I found this in Goodwill yesterday. It was brand new in the box. Circa 1997. (X-post form r/images),355
Scholastic book fairs. One of the best days of the school year.,355
I found this gem at my cousin's house,356
Trick bubble gum,356
"Ah, the good ol' innocent days...",351
"Sweet baby Jesus, they're back",353
Who else had one of these awesome rugs as a kid? ,355
Mighty Max-- Polly Pocket for Boys (and cool girls),345
My First Mobile Phone,347
This drink concept used to blow me away,350
Disney Sunday Night Movies,352
He threw me in the big litter box...,348
"If you had this, you were fucking cool",349
The new coupon dispensers don't have anything on these bad boys.,350
Little Critter,346
"Saw your TalkBoy post, lets not forget the competition!",344
for Ages 5 to 137,349
I used to love when I went to the library for this reason. ,343
i would kill for one of these right now...,348
This game,341
Best part about computer class.,344
Before there was black ops,348
I thought they stopped making these...,347
If you remember this movie you had an awesome childhood.,349
"If you remember waiting for this, you're probably awesome. [x-post /r/pics]",344
13 Dead End Drive,344
Who remembers these two? Anyone?,341
Had completely forgotten about my favorite toy castle,343
Always excited when mom packed these for lunch,344
This event supposedly happened two years ago...,340
Indoor Recess,341
Remember Life with Louie?,345
Rugrats,341
"""Watch where you're going--ya fool! A ha ha ha ha ha!""",335
Biker Mice from Mars! ,342
pop it open with a spoon,340
Highlights magazine was a childhood staple. Who can forget Goofus and Gallant?!,336
Anyone else remember Bedknobs and Broomsticks?,338
"I've found where all these amazing, but violent, sugary sons of bitches have been hiding.",339
"That ""S"" thing we all drew in elementary school.  ",336
You can't tell a hero by his size...,337
I always pissed my parents off with this.,337
Brings me back every time.,337
Who else remembers these from math class?,333
This show was amazing.,335
Best Word Book Ever,332
Remember wanting one of these on every pencil you had.,333
This game.,332
"Whenever I have a bad day, I can't help but remember Grover had it worse...",330
Before my concerns were bills and women...,332
My pen of choice back in the day.,333
"Candy Cigarettes, product of my childhood
X-post from /r/pics",331
The Rescuers (Disney Film),334
One of my favorite movies as a kid- The Indian in the Cupboard,334
"This fuggin guy. I've asked so many people, and no one remembers him.",332
One of the hardest games of my childhood.,332
In case I needed verification that I'm an adult.,330
Still in box,330
The standard by which every girl I've ever met has been judged. ,327
How Silly!,335
I always wanted to chill with dinosaurs ,330
Quite possibly the greatest children's book of all time,326
This guy was insane.,328
Who wants to see this guy again? ,324
"You had nintendo and gameboy, as a kid in a third world country, I had these 5",333
Can't believe I still have these.,324
Ahh.. real monsters (Found this while going through some old shyt),329
I'll see your Goosebumps and raise you...,327
"hands down, my favorite toy as a kid. and i finally made it to nursing school",329
Dino-mite!,324
The tan M&amp;M's were my favorites. I still hold a grudge against the blue ones.,325
Zoboomafoo still airs on PBS. My younger sister was watching it and I realized how much I loved the show.,324
Was browsing Netflix when I stumbled on this; this show needs a ReBoot!,321
CRAZY BONES,319
Anybody remember this?? I posted it in /r/pics before I found this subreddit.,321
"""Red, green!"" ",324
Anyone else?,322
Did anyone else have one of these?,324
Aye-yi-yi-yi-yi!,322
My fridge is better than yours (x-post),320
How to be the coolest kid at the lunch table.,316
I used to spend hours playing this... And really want to play it again,315
"Since we're on the topic of awesome books, I submit one of my personal favorite series - Wayside School!",319
"Games went until dark, or until someone left half their knee skin on the street.",319
Don't Break the Ice!,320
"Being a heavyweight as a kid, this was always in the VCR",316
"Saw this on Twitter, one of my favorite cereals!!",315
Stoop kid afraid to leave his stoop,321
Anyone read these in kinder?,319
One of the most haunting scenes from my childhood.,318
Always seeing these bad boys at the waiting rooms.,313
If you remember this guy your childhood was awesome.,317
The mother load at Costco,319
Anyone else remember this book?,322
Anyone remember Marble Run?,313
I am the only person out of my friends that remembers the Big Bad Beetleborgs. ,316
These things were so much fun. ,315
This brings me back to riding bikes.,316
Thanks Boomerang!,310
"Seeing the ""Thin Ice"" game earlier reminded me of the hours my sisters and I used to spend on this game. ",315
Caller ID box,312
No LAN party was complete without,317
The only time I feel comfortable having my movie interrupted.,316
The perfect ice cream,314
This movie ,312
I KO'd my sisters with these,314
Gelly Roll Pens,314
Happy Valentines Day to my first love,311
Those talking toilets man,307
Tech Deck,311
Anyone remember homies?,310
I drank these things all the time,316
These books occupied so much of my time as a kid.,310
Anybody Have Any Garbanzo Beans?,306
Forgot how much I loved these! Bart Simpson where are you when we need you!,313
Anybody else remember this horrifying movie?,306
I miss this from MTV. Don't judge. ,306
Who remembers these guys?,303
Don't let your marble be the one that breaks the ice!,308
Who else remembers these?,309
Anybody read this book in elementary school?,302
I want this back. ,307
These things,305
Who remembers Snood?,298
"If I live to be 100, I'll still vividly remember the sound.",304
The greatest present I ever received.  ,304
Anyone else play this series of PC games?,305
Did anyone else watch this show?,308
"I'm sorry, but THIS looked like the most delicious food ever as a kid...",299
Who remembers this cool dude?,303
Who remembers this gem of a book?,301
Before it's time,301
best 30 seconds ever,306
This show made me want to be a pilot,300
Found some nostalgia on the new American Dad (x-post from r/funny,308
"""Long ago in a distant land I, Aku, the shape-shifting Master of Darkness, unleashed an unspeakable evil!""",301
Street sharks!,305
Gotta love those sublte jokes on Rocko's Modern Life...,302
Used to love this show,303
My favorite book as a kid....,299
Randomly remembered the mighty ducks,298
Nickelodeon Magazine PLEASE,302
"Who else remembers ""killer tofu"" by the beets on Doug?",298
The first time a book gave me the creeps. The Scary Stories Trilogy.,295
"Old school paint, never forget.",299
Anybody else remember this guy?,296
one of my favorite cartoons,296
That high-pitched whine,302
I had a few of these growing up,298
I'd like to reintroduce you to Henry and June.,295
I have been offered a lot of money for this.,300
Ishboo was a horrible house guest. ,301
No title needed.,292
Annoying parents everywhere since the early 90's..,293
"""Nobody better lay a finger on my Butterfinger."" I loved these commercials as a kid.",297
Wonder ball,298
I'm pretty sure we all just recorded our farts over and over...,290
Staying up a little later just to see this. It always cracked me up.,290
NOW I'M ANGRYYYY,293
Anyone remember Sir Didymus?,285
Big League Chew,295
Anybody remember this great cereal?,290
"Balance Birds, Anyone?",289
Big Willie Style [1997],293
Saturday Night Nickelodeon.... Big Orange Couch...,292
I loved going into this place.,287
My favorite game show as a child. ,293
If You Park Like This....,288
Windows 98 screen saver,291
I could've looked at these all day,286
The Dad Phone,287
My grandpa and I used to play this game all the time.,289
kids of the 90s nostalgia at it's finest,288
Angela Anaconda,281
It's O.K. to Be Smart!,286
These things,286
3D Doritos FTW,287
Book Fairs,287
I miss elementary school :(,288
"No one ever remembers this show. I was hoping r/nostaligia would. Big Wolf On Campus, anyone?",284
"I met one of my childhood heroes tonight. ""Did I do that??""",285
