created_utc,score,title
1347903462.0,3342,DAE like sleeping with a fan blowing on them but being burried under the covers?
1359495368.0,3317,"DAE really love pre-tornado, windy, apocalyptic-feeling weather?"
1344646758.0,2617,DAE think the elderly should have to take periodic driving tests to insure they can still safely drive?
1308710105.0,2607,DAE practice fictitious arguments in their head in order to be prepared in case the imagined situation manifests itself for real some day?
1339459775.0,2592,DAE (when reading a book) find themselves lost in thought and then catch themselves still scanning down the pages as if they were reading
1352833457.0,2547,"DAE feel guilty when a repairman is over and you're not helping him/her, even though the reason you're paying them is to do a job you don't want to do?"
1347605894.0,2545,DAE forget to listen to the other person's name when introducing yourself?
1359410670.0,2519,"DAE sometimes get halfway through writing a comment or reply, only to say ""eh, screw it."" and just move on?"
1358275293.0,2471,"DAE wear the same pair of jeans, like, everyday?"
1361297513.0,2400,"DAE still think of 1990 as 10 years ago, 1980 as 20 years ago, etc.?"
1340584294.0,2404,DAE sleep better when they hear rain or know its raining out?
1365753507.0,2380,DAE hate when books are adapted into movies and then reprinted with images from the movie on the cover?
1363395574.0,2334,"DAE get annoyed when an announcer says ""I can't hear you"" in an attempt to get an audience to cheer louder"
1345993862.0,2214,DAE enjoy being outside during severe weather?
1348468888.0,2203,DAE hate watching a character in a TV show or movie go through an embarrassing or humiliating situation?
1359757598.0,2193,"DAE, when hearing a strange noise at home, look at the cat/dog to see how they react before deciding if it's worth investigating?"
1353876832.0,2188,DAE try to hold your breath and exhale silently when you're out of breath and the person you're with isn't? 
1366587238.0,2175,"DAE wet their toothbrush, put toothpaste on it, then wet it again?"
1366987513.0,2181,"DAE really like bacon, but can't stand this stupid ""bacon craze"" where arbitrary products forcefully incorporate bacon?"
1366035096.0,2132,"DAE: Procrastinate about getting into the shower because it seems like so much effort, only to find they are unwilling to get out of the awesomeness that is a shower once they are in?"
1360982213.0,2122,DAE absolutely hate the sound of their own voice on a recording such as a video?
1339684638.0,2038,DAE refuse to accept the 'jiff' is the intended pronunciation of gif?
1321647521.0,2012,"DAE think there should be a ""general life"" class in high school that covers everything from protecting your online image and information to how a credit card works?"
1333357703.0,1994,"DAE believe Coke (or any other soft drink) always 
tastes better when you drink it out of a glass bottle?"
1352132074.0,1995,"DAE press the clear button in the calculator more than once, when 1 would be enough???"
1373904740.0,1987,DAE think it is rude when a company interviews for a job and does not send notification that you are no longer in consideration for the position?
1338264717.0,1975,"DAE have to sleep with a blanket, regardless of the temperature?"
1375197052.0,1911,"DAE ever look at their dog with a sudden clarity and think ""There's a large, fanged mammal walking around my house that gets sad when I go to work""?"
1345658799.0,1907,"DAE click on the ""Did you mean ________?"" link on google, even though google has already loaded those results?"
1356899385.0,1897,"DAE feel strangely sympathetic for inanimate objects when they get crticized, thrown away, or abused?"
1356100886.0,1891,DAE get embarrassed when opening presents in front of other people?
1342111983.0,1874,DAE wonder how many random people have photos with you in the background?
1373720984.0,1868,DAE feel like a pretty motherfucker when looking into the mirror but look like absolute shit when it comes to pictures
1361652885.0,1858,"DAE set their alarm earlier than they would normally, with the full intent to hit the snooze alarm multiple times?"
1291047055.0,1850,"DAE do the 3 tap check... The tap to see if your wallet, keys and phone are in your pockets?"
1359911460.0,1833,DAE love the sound of rain against your window when you're trying to sleep?
1344180997.0,1824,DAE wet the toothbrush then put toothpaste on it then wet it again before brushing their teeth
1351799021.0,1811,DAE feel unnerved when you finally see a photo of a radio personality you've listened to for a long time but never seen...and they look absolutely nothing like your mental picture?
1353513989.0,1802,DAE feel weird saying their name out loud?
1348934026.0,1802,"DAE feel awkward when walking behind a lone woman at night, worried that she's worrying that you might attack her?"
1367374397.0,1786,DAE lay awake at night cringing at all the stupid embarassing shit you've done recently?
1372375241.0,1770,"DAE love a good, loud thunderstorm?"
1359125274.0,1766,DAE wish for a blizzard so you can be stuck in your house for awhile?
1361776620.0,1736,DAE experience the strong need to turn the radio down when they don't know where they are?
1297787722.0,1738,DAE hate it when they re-do book covers with the movie poster from the movie made from that book?
1342810037.0,1730,"DAE prefer the rainy, overcast days to sunny ones?"
1313829593.0,1728,"As a child, DAE instantly zero-in on an object in a cartoon that was not part of the static background and think ""That is a thing that will do something"". "
1314241087.0,1728,"DAE prefer to just take a lousy parking
spot and walk rather than spend extra time
looking for a ""better"" spot?"
1336410271.0,1706,"DAE consider cars near them on long road trips as traveling companions, then feel sad when they or you leave the highway?"
1364516725.0,1705,DAE Collect as much shower water in there crossed arms as possible to make a big splash on the shower floor?
1367756594.0,1694,DAE hate being forced to go to the mobile version of a website on a smartphone when you want to go to the normal site?
1290355751.0,1675,DAE still think 1990 was 10 years ago.
1366321087.0,1661,DAE occasionally touch their back pocket in public to make sure you haven't been pick-pocketed?
1370142268.0,1664,DAE prefer their mobile reddit settings to be on night mode permanently?
1372464453.0,1661,DAE Wish they could re-start life but keep their memories and intelligence?
1361983421.0,1642,DAE love it when someone speeds by you on the road and then you both end up at the same stop light?
1363013828.0,1635,DAE imagine the couple having sex when they announce they're expecting a baby?
1373210851.0,1629,DAE find it easier to converse on the phone when pacing around the room?
1337091368.0,1618,DAE obsess over having the optimum speed on their windshield wipers for the amount of rain coming down?
1294753441.0,1626,"DAE make it a point to spell out ""are"", ""you"", ""why"", etc. in text messages?"
1327250832.0,1611,DAE wish there was an apologetic car horn for when you cut someone off etc?
1374203007.0,1607,DAE ignore random noises at night as long as the dog ignores them too?
1342894022.0,1598,DAE wiki a movie after watching it to get a better understanding?
1364926496.0,1605,DAE sleep with a fan on just for the sound?
1345397443.0,1567,DAE hate checking their bank account balance? 
1363086982.0,1568,Does Anybody Else think that listening to music in the car while driving is much more enjoyable and intense than at home?
1298212225.0,1561,DAE want to see Bear Grylls and Les Stroud retrace the Lewis &amp; Clark trail only using 1804 technology?
1309624325.0,1558,"DAE save the most appealing piece of food for the last bite, to make sure that's the last flavor you taste?"
1347817519.0,1562,DAE prefer a cold bed to a warm bed?
1321297353.0,1541,DAE Sing along in their head when they leave a room with music and see if they are still in sync when they return?
1343428143.0,1526,"DAE get lonely, but often wish you were alone when you're with other people?"
1364841906.0,1516,DAE hate these Reddit April Fool's jokes?
1365330869.0,1508,DAE often smile at the dog instead of the owner when they walk by?
1280611746.0,1508,"DAE do the three pocket check (phone, keys, wallet) before leaving anywhere at all?"
1367206764.0,1489,DAE think Sunday night is more depressing than Monday morning?
1364206940.0,1486,DAE wish they could at least watch what happens to humanity after you die?
1300980725.0,1488,"DAE love animals, but hate P.E.T.A.?"
1364453042.0,1479,"DAE look down at their keyboards to see how closely placed letters are in order to judge whether or not a spelling mistake in someone else's post or comment is ""reasonable""?"
1360268002.0,1472,DAE go a little crazy when an asterisk is placed next to a word but the explanation that is typically at the bottom of the page is nowhere* to be found?
1291751551.0,1477,DAE still spell out Wednesday like wed/nes/day in their head when writing it?
1375598521.0,1461,"DAE start to post something on facebook then think ""who cares about what I have to say or what is happening in my life"" and not post it.?"
1334158946.0,1462,DAE randomly notice a singer's sharp intake of breath before a line...and then can't help but notice it every time for the remainder of the song?
1364326718.0,1463,DAE get really grossed out when people let dogs lick their mouths?
1317998700.0,1457,DAE feel like they're the only person who is aware of their surroundings/other people and actively try not to be a dick/in the way?
1294242075.0,1453,"DAE think it's even more offensive to change ""nigger"" to ""slave"" in the new edition of Huck Finn?"
1298036558.0,1452,DAE get overwhelmed with the amount of things to do and consequently choose to do nothing?
1364053682.0,1445,DAE find it impossible to sleep with their socks on?
1335922640.0,1448,"DAE occasionally try to move things with their mind ""just in case?"""
1324943470.0,1444,"DAE look at EVERYTHING (e.g. other programs open, taskbar icons, time) when somebody sends you a screenshot"
1310129446.0,1445,DAE get unreasonably excited when it's raining heavily?
1365121700.0,1436,DAE change the date when writing papers to several days prior to make it look like you didn't procrastinate until the night before its due?
1363195226.0,1431,DAE ever think about how easy it would be to just crash into another car while you're driving?
1330292953.0,1427,"DEA still get immense satisfaction from picking their nose, even as an adult?"
1326228612.0,1420,DAE listen to songs and imagine them as part of the soundtrack for the movie they'll probably never make?
1358105496.0,1422,"DAE help out your waiter/waitress cleaning the table?   ie stacking dishes, cleaning your own god damn mess"
1368366347.0,1416,DAE hate taking a dump at someone elses house?
1368042393.0,1411,"DAE think soda tastes different between cans, 20oz bottles and liters?"
1355411128.0,1409,DAE really like seeing their own breath in the cold?
1374773145.0,1408,"DAE go above and beyond when doing something for someone else, but do things half-assed if it's for yourself?"
1369596614.0,1407,DAE absolutely fucking hate being robbed from a good sneeze?
1373115012.0,1405,DAE pretend to cough or sniff just to let the person know your on the toilet
1289447318.0,1404,"DAE feel like being labeled a ""smart kid"" set them up for a lot of disappointment and/or failure in life?"
1297354822.0,1406,DAE love learning but hate studying?
1354321904.0,1402,"DAE feel like they get a ""car buddy"" with another car after allowing them to merge or pass and you're close to each other for the next few miles?  "
1300204047.0,1397,DAE think Ken Jennings should take over hosting Jeopardy once Alex Trebek is done with the show?
1370529166.0,1393,DAE obsessively check to make sure alarms are set for the right time?
1361847771.0,1398,DAE like the sound of their own footsteps when they wear dress shoes?
1341722552.0,1402,DAE over the age of 13 still pick their nose?
1304540497.0,1399,DAE just like to sit down at a public place and watch and marvel at the way humans interact with each other?
1370787163.0,1395,DAE feel really quite scared and anxious about calling or receiving phone calls?
1308602453.0,1378,"DAE hate DVD menus that have footage of the film 
playing in the background?"
1348785578.0,1380,DAE enjoy staying naked after a shower when no one's around?
1322551847.0,1371,"DAE make very weird faces at little kids when their mothers aren't looking, just because it feels like the right thing to do?"
1318530263.0,1372,DAE always eat their daily contacts after using them?
1288278486.0,1374,DAE think that old people should have to retake a driver's test?
1361472116.0,1372,DAE really want to know what English sounds like to people who don't understand it and is really annoyed that they'll never know?
1360606355.0,1375,DAE get infuriated when their friend is using his/her phone all the time and not socially interacting with you?
1334852877.0,1367,DAE find most animal babies cute but think human babies are ugly?
1326824958.0,1368,"DAE attempt to doodle when they're bored, but once it turns out badly, scribble over it entirely so no one else can see how bad it was?"
1324002697.0,1361,DAE Write false dates on projects so that teachers don't think that you're a procrastinator? 
1300434329.0,1356,"DAE ever accidentally hit the ""insert"" key while typing a word document when you were younger, then spend three hours trying to figure out why every time you typed a character, it deleted the previous one?"
1300759652.0,1353,DAE have to sleep with a blanket no matter how hot it is?
1337703939.0,1354,"DAE, when typing passwords, delete everything after a mistake even though you KNOW a single backspace would suffice?"
1280344049.0,1352,DAE still think that the 90s were 10 years ago?
1361239450.0,1350,DAE suddenly remember being (even mildly) mean/shitty to someone in the past and then spend way longer than they should feeling bad about it?
1359323501.0,1342,"DAE have a hard time sleeping and tell themselves if i fall alseep now i can get 7 hours of sleep, if i fall asleep now i can get 6 hours and so on."
1349463955.0,1341,DAE get happy when turn signals with different blinking patterns on different cars get in sync?
1339839152.0,1333,DAE use the condensation from their glass of water as a lazy way to clean your hand?
1376058301.0,1332,"DAE ever get a random overwhelming feeling of deep sadness/loneliness for a brief moment, even if you're perfectly content at the time?"
1333894727.0,1337,DAE suddenly become aware that they are a person?
1335530689.0,1327,"DAE Go through periods of not listening to music at all, and then suddenly listening/discovering music again?"
1344421214.0,1332,DAE go back and read text conversations they had with the person they like?
1316102982.0,1329,Does anyone else practice arguments in their head incase anyone starts one with you?
1334655721.0,1329,DAE like the smell of unleaded gasoline?
1362698843.0,1317,DAE spread their buttcheeks out on the toilet seat to reduce asscrack poop residue when taking a dump? (sorta NSFW)
1342474815.0,1316,DEA feel irritated watching people look something up on the internet because they feel like they could do it quicker and more efficiently 
1292899726.0,1310,"DAE think iTunes is a bloated, clumsy piece of crap?"
1320853568.0,1311,DAE like to have an extra sheet of paper under the sheet you must write on so you can write better?
1284645983.0,1311,"DAE listen to their music player on shuffle but end up skipping 99% of the songs, trying to find the perfect one?"
1314788225.0,1308,DAE Think mothers making their new born children Facebook pages is grossly inappropriate? 
1291566501.0,1304,"DAE see an interesting Reddit headline and get interested only to see that it's a Youtube video and go ""eh, fuck it""?"
1360488216.0,1298,DAE find it strangely satisfying when you manage to walk through a closing door without touching it?
1358449896.0,1296,DAE start reading articles online and stop about 1/3 through because I loose patience and/or attention? I do this about 95% of the time and I feel bad doing it.
1363879188.0,1296,DAE find it hard to eat breakfast due to simply not being hungry?
1371561809.0,1287,"DAE have these weird fucked up dreams where you meet someone, fall in love, fight, live and love...And then you wake up and you're genuinely upset that she isn't real?"
1360686123.0,1287,"DAE hit the clear key on the calculator multiple times, as if to clear everything even though it clears it the first time? "
1306572711.0,1284,"DAE, while reading on a computer, feel the need to constantly scroll in order to keep the text at the top of the screen?"
1365185488.0,1270,"DAE Find that, in a completely non-sexual way, having your hand on your testicles is comforting?"
1349272577.0,1269,DAE have that feeling that you get when you can't wait for the week to be over to get to the weekend.. But its not for the weekend. It doesn't go away and feels as though your whole life is just one long work week waiting for something?
1371094024.0,1266,"DAE Look up a word they already know just out of curiosity at what the dictionary says or to gain the exact ""flavour"" of it's meaning?"
1350494031.0,1257,DAE constantly touch their facial hair?
1356798311.0,1257,DAE like to randomly put their arm up in the air while in bed?
1348693705.0,1255,"DAE happen to, when lying down on your side, get random tears off only one eye?"
1295208488.0,1257,DAE frequently get struck by sudden vivid memories of some random embarrassing thing you've said or done in the past?
1305428274.0,1258,DAE Wish they could go on a police chase without the risk of arrest just to see if they could get away?
1316021110.0,1245,DAE have trouble eating for like the first hour and a half that they are awake?
1344532344.0,1241,"DAE not trust bodywash/shampoo that have been 
combined into one?"
1358977253.0,1238,DAE stare at a word you know is spelled right long enough to make it look odd or incorrect. 
1366831917.0,1236,"DAE ever know somebody is lying, but not call them on it because you feel it will create an awkward situation?"
1370442124.0,1235,DAE get paranoid that people are timing how long they spend in the bathroom?
1341499700.0,1233,"DAE Google quotes, metaphors and lyrics to make sure they're correct before repeating them?"
1288194838.0,1227,DAE prefer to keep their shoes perma-tied and just force them on and off as needed?
1374070611.0,1222,"DAE when walking by bushes, plants or trees pluck off one leaf or branch... just because?"
1296833739.0,1221,"DAE like being left alone, but hate feeling lonely?"
1352927352.0,1223,DAE pretend they're in a post-apocalyptic world when they're driving their car late at night and no one else is on the road?
1285002733.0,1223,"DAE think that ""Ok Go"" is just a mediocre band which tries to make up for that fact with crazy videos?"
1356338951.0,1223,DAE Just like to lay on the floor?
1353348524.0,1220,DAE seem to have way weirder or more vivid dreams while taking naps rather than while sleeping at night?
1360432813.0,1222,DAE feel weird saying the name of someone with the same name as yourself? 
1297727566.0,1215,"DAE say,""thank you"" every time the waiter refills your water?"
1335200958.0,1212,"DAE get sudden realizations of how ""futuristic"" the world has become?"
1297575832.0,1218,DAE forget the names of people you just met within 5 seconds?
1343774425.0,1213,DAE ever struggle to sleep when you have to wake up early the next morning?
1361401612.0,1214,DAE skip right past video posts?
1300818894.0,1209,DAE wipe their cellphone screens so that all the smudge lines go in the same direction?
1308546318.0,1207,"DAE have a fine relationship with their parents, but not take mother's and father's day very seriously? "
1368573272.0,1203,"DAE have songs they always skip when it comes on, but never delete them?"
1337799478.0,1202,DAE Absolutely HAVE to have album art for every single album on their iPod?
1301121777.0,1189,DAE never watch TV anymore thanks to their computer?
1368116906.0,1187,DAE listen to one particular song over and over again for about a week and than get sick of it?
1364589868.0,1190,DAE get pissed at people who treat fast food workers like dirt?
1294343191.0,1181,"IAE fully grown and reasonably intelligent, but STILL has to recite the surrounding subsection of the alphabet in order to figure out what letter comes before certain other letters? "
1373579941.0,1181,"DAE like to say really awful things to their pets, but in a really friendly tone?"
1296088131.0,1185,"DAE open the door for anyone, male or female, just because it's the nice thing to do?"
1358023065.0,1178,DAE get goosebumps from good singers?
1327599442.0,1171,DAE feel completely robbed when you're about to sneeze then can't?
1351037804.0,1171,DAE get immense satisfaction when they can see the dirt getting washed off their hands?
1340992111.0,1171,DAE have a strange impulse to touch/drag a hand along the walls while walking down a hallway?
1362414950.0,1170,DAE both want friends and don't want friends at the same time?
1340290921.0,1163,DAE sometimes mix up real life with what happened to you in a dream?
1289926282.0,1161,"DAE still ""push ride"" the grocery cart on the way to their car like they did when they were a kid, even though they are ""grownups""?"
1376513503.0,1153,DAE avoid eating the very bottom tip of the banana?
1296314708.0,1161,DAE think that Wikipedia is one of mankind's greatest achievements of the past 100 years? 
1334759350.0,1152,DAE get super pissed when someone assumes you're sad because you're quiet?
1284531652.0,1158,Does anyone else often wear the same pair of shorts/pants for over 3 days in a row?
1371342727.0,1158,DAE stare at actors stomachs who die in movies to see if their breathing?
1314497471.0,1153,DAE rehearse totally trivial interactions in their head ahead of time?
1302450555.0,1148,DAE masturbate simply because there's nothing better to do? 
1301494013.0,1150,DAE prefer to read a news article on a story rather than watch a video about the story?
1374656923.0,1146,DAE hate watching embarrassing moments on movies or media to the point where they can't watch?
1357887501.0,1144,DAE look up the definition of a word they already know to help them gain a better understanding of it?
1268575237.0,1146,DAE use Google search as a spellchecker?
1372221814.0,1142,DAE have memories you can't remember were actual reality or a dream?
1375659787.0,1149,DAE enjoy solitude and make up weird excuses to get out of plans but simultaneously have FOMO (fear of missing out)?
1285450716.0,1140,"DOE Open a bunch of Reddit pages in multiple tabs, then forget the titles and wonder why they are staring at a picture of a goat?"
1369229790.0,1142,"DAE get annoyed when they're looking for information, find something that sounds great, and it ends up being a YouTube video instead of an article?"
1361053125.0,1146,DAE instinctively grab their wallets after they bump into strangers?
1363586835.0,1146,DAE feel wierd walking into and out of a store without buying anything because you think the owner thinks you stole something?
1338749316.0,1139,DAE hate trying on clothes?
1335027790.0,1139,DAE Smell Books?
1357698102.0,1136,"DAE make it really cold in you bedroom before you go to bed, just so you can wrap yourself in covers and feel so good?"
1340814263.0,1136,DAE feel like a sucker for being a hard reliable worker?
1334533809.0,1132,"IAE not addicted to the internet because you can easily go on vacation or otherwise be away from it for a long time without caring, but still spend hours per day online because there is nothing else to do?"
1302617656.0,1131,DAE feel nervous around Police even though you haven't done anything wrong?
1363556042.0,1125,DAE hate the sounds of people eating and drinking?
1333561028.0,1128,DAE find warm toilet seats disgusting?
1295982952.0,1135,DAE hate when songs use police siren noises?
1262879251.0,1125,"DAE not comment on 'DAE' posts, but just up or downvote depending on if they do or don't?"
1337959434.0,1129,"DAE, get paranoid when they eat chips thinking everyone can hear the crunch of the chips?"
1296934484.0,1127,DAE habitually play with the battery covers on the back of remotes?
1354838606.0,1129,DAE pause a video when it is getting really awkward or embarrassing for someone in the video because you feel their humiliation?
1341151027.0,1127,"DAE find the ""slapping"" sound of flip-flops annoying"
1289794237.0,1125,DAE repeatedly open and close the battery cover on the TV remote for no reason while holding the said remote?
1309015383.0,1109,"DAE Have fake conversations in their head, but still move their lips and perform the body actions?"
1342037468.0,1116,Does anybody else hate people that don't peel off stickers and protective films from appliances such as laptops and mobile phone displays?
1365860042.0,1106,"DAE keep their stomach sucked in so often, it feels strange to ""let go?"""
1265229736.0,1109,DAE forget a person's name seconds after meeting them?
1346677036.0,1109,"DAE fear that after developing a positive habit, such as working out or attending night school, that missing a single appointment, for whatever reason, might lead to quitting altogether?"
1339899200.0,1110,"DAE always feel that they look good/okay from the front, but absolutely stupid from the side?"
1369425589.0,1107,DAE hate wearing socks while sleeping at night.
1340683021.0,1111,DAE get pissed when someone constantly reminds you to do something?
1338096817.0,1108,DAE like the 'scent' of cold air?
1264588448.0,1094,DAE prefer to carry 10 grocery bags in each hand than make two trips?
1371766510.0,1091,DAE *ALWAYS* just miss the AMAs you want to participate in?
1351967893.0,1089,DAE obsessively plan and rehearse what they're going to order when in line at a fast food restaurant?
