created_utc,score,title
1286403311.0,841,"DAE think that the whole ""I like it on the_____"" thing with women's purses spreading on facebook is idiotic and immature."
1284252628.0,836,DAE have a neutral facial expression that people often perceive as sad or angry looking?
1267128759.0,843,DAE avoid wearing clothes that excessively show off the brand name because you don't want to feel like a walking billboard.
1327121748.0,839,"DAE, when eating Doritos, check for the side with the most flavoring on it and put it on their tongue?"
1313700201.0,836,DAE find it hard to not say anything when you overhear people you don't know very well talking about a subject you have a keen interest in?
1306842606.0,844,DAE find that the only time they're motivated to work is when they should be sleeping?
1365082162.0,837,DAE Have thoughts that are laid out very eloquently but fumble your words when you try to relay them verbally?
1294709472.0,837,DAE take their pants off as soon as they get home from work?
1345223797.0,836,DAE Miss the winter when it's summer and miss the summer in the winter?
1343582876.0,839,DAE refuse to eat something because they have thrown it up in the past?
1294418372.0,836,DAE think that the worst part of winter is getting out of the shower?
1375792873.0,838,DAE love playing around with the options menu on ANY device?
1353724827.0,834,"DAE lock their eyes on to one specific place (a section of a wall, lamp, etc.) and have to force themselves to stop staring?"
1302710996.0,833,HAE never been caught masturbating?
1334337210.0,835,"DAE Hold their breath IRL when movie characters go underwater (swimming, being held underwater, tricky escape, etc) just to test the realism? "
1369718947.0,828,DAE wish for a rainy day as an excuse to do nothing?
1290008989.0,827,DAE not know how to whistle with your fingers?
1335798395.0,829,DAE fear they will die without making a contribution to humanity?
1357321663.0,829,DAE write papers single-spaced and then double-space them when they're done?
1337654643.0,822,DAE Love the smell of a lit match?
1301751693.0,820,DAE feel ashamed about specific instances of bad behavior from when you were a child?
1303055546.0,821,"DAE ""not get"" anime? "
1361384634.0,820,DAE only eat two meals a day?  (ie lunch and dinner or breakfast and dinner etc)
1344983747.0,821,DAE think that fake breasts are disgusting?
1341919650.0,823,Does anybody else move their butt muscles to the rhythm of the song whilst they lie in bed and listen to music?
1369881635.0,825,DAE wake up in the middle of the night and completely rethink your life and make a bunch of plans to make it better but then do nothing about it when you're awake?
1345729818.0,814,"DAE Go to sleep on a long car journey, but then wake up seconds before you arrive home without external interference?"
1371472092.0,817,DAE wonder at the end of a horror movie (especially paranormal/supernatural ones) how on earth the victims are going to explain things to the police?
1365396058.0,820,"DAE find themselves dozing off whilst watching a movie at home, but the when giving in and shutting off the movie to sleep, find themselves now wide awake?"
1367934723.0,813,"DAE press the ""already clear"" button on their calculator way more than once?"
1362932586.0,820,DAE hate it when they try picking their nose and push the boogie back and then can never find it?
1296404456.0,812,DAE change the dates on their homework to look like better students?
1301677742.0,820,"DAE always think they are going to hear ""Ice Ice Baby,"" but it ends up being ""Under Pressure"" by Queen?"
1367154368.0,814,DAE have a bunch of empty water glasses at their bedside?
1363268283.0,816,DAE really dislike encountering a warm toilet seat at work?
1333730886.0,813,"DAE not flush the toilet at night, because it's just too loud?"
1326324114.0,811,DAE click on a post's comments just to see if the inevitable joke is indeed at the top? 
1288828831.0,806,DAE immediately check the keyboard after seeing a person's typo in order to determine the distance between the actual key pressed and the key the person probably meant to hit?
1335866951.0,815,DAE think that cereals are a lot tastier when you don't eat them for breakfast? 
1296221366.0,811,DAE cross their sevens when writing?
1294523420.0,809,"DAE not give a damn about karma, upvoting anyone else, the whole euphonious idea of the ""reddit"" community, the Reddit alien, narwhals, and just comes here for the news, funny stuff, and general updates on the internet?"
1364571981.0,807,DAE mentally say Feb-ru-ary and Wed-nes-day when spelling february and wednesday?
1369343632.0,805,DAE have a friend who serves as a nucleus to your social group? And when s/he is unavailable your socialization plummets?
1318643905.0,808,HAE fallen in love with a girl in a dream?
1297866148.0,805,DAE get worried because they genuinely cannot think of a realistic job situation that wouldn't make them miserable getting out of bed for the next 30+ years?
1362765126.0,807,DAE stress sometimes about 'wasting their youth'?
1356023011.0,804,DAE watch only a handful of television channels even though you are paying for a shitload that you will never watch?
1343663501.0,807,"DAE fear helping somebody with their computer because they will make you their new ""IT"" guy?"
1271695492.0,802,DAE think large weddings are just stupid and cost too much money?
1316655284.0,800,DAE get really annoyed whenever you read a top comment on a youtube video and it's a reply to a comment you can never find?
1296734175.0,801,DAE think 'Band of Brothers' is the best goddamn WWII series ever? - I like to think of it as an epic 13 hour movie...
1278976712.0,800,DAE fucking love storms?
1352215808.0,801,"DAE get anxious at drive-thrus about holding up the person behind you for any length of time after you receive your stuff, and feel pressured to drive off before even rolling the window back up?"
1291849993.0,800,DAE NEVER use the shift key on the right side of the keyboard?
1365440890.0,799,DAE Feel like they're the only person on reddit who ISN'T funny?
1350394385.0,794,DAE get the feeling that they're holding something fragile after copying something to the clipboard that you don't intend to use immediately?
1264485372.0,802,"DAE remember ""parachute day"" in elementary school P.E.?"
1367594126.0,797,"DAE just hit ""end"" on cell calls where the signal is shit, then just tell the other person the call dropped?"
1315888717.0,800,DAE just suddenly shudder sometimes for no apparent reason?
1375121721.0,795,DAE subconsciously mimic someones accent or how they talk?
1299485216.0,801,DAE greatly prefer brunettes to blondes?
1336007661.0,795,DAE think that rage comics are getting progressively less funny?
1362121242.0,799,"DAE have a fear of heights, but specifically because you are terrified something will overcome you and spontaneously you will jump?"
1345302839.0,796,DAE automatically assume someone you haven't met is good looking?
1299523378.0,796,DAE have a hard time falling asleep while wearing socks?
1372879823.0,799,"DAE say a text message in their head as they are typing and reword it before sending if the ""tone"" isn't right?"
1366725713.0,794,DAE get annoyed when people say i could care less?
1344128746.0,792,DAE save napkins from fast food restaurants in their car like in their glovebox or center console?
1299906433.0,793,"DAE save the ""best bite"" of their meal for last?"
1285890974.0,797,DAE rely heavily on user reviews for products before they buy something but never leave your own reviews? 
1343490524.0,794,DAE like to be left alone while eating?
1337000529.0,791,"DAE think of the Fresh Prince as the real Will Smith, and of all his other characters as fakes? "
1326462894.0,794,DAE feel really awkward holding your arms down at your sides when you're standing somewhere?
1296159224.0,791,DAE think that Jeff Dunham is not funny at all?
1313933974.0,790,DAE actually enjoy the taste of (some) tap water over bottled water?
1282734622.0,788,DAE find it completely irrational to make your bed every morning?
1364191182.0,793,"DAE Really want to have a social life but when you do actually hang out with somebody, You realize that you would rather be alone?"
1295363429.0,793,DAE get really really angry when the ad on a video plays perfectly but the video takes forever to load??
1298120590.0,784,"DAE make ""potions"" when they were little..."
1343841467.0,787,"DAE, after seeing a bug, feel like there are bugs crawling all over your skin?"
1328997101.0,790,"Weirdest thing ever but DAE think of one particular road in their mind when they hear the joke ""why did the chicken cross the road?"""
1321236832.0,789,DAE ever get really hungry but instead of getting food just continue to suffer in hunger because you're too lazy to get up from your seat?
1312461374.0,788,DAE meet a cute girl for the first time and immediately envision an entire detailed future in which she is your girlfriend?
1303222713.0,781,HAE never played Portal?
1371832221.0,783,DAE dream up a fantasy life with the new person that you just met?
1306966549.0,786,DAE feel anxious when they're about to check their voicemail?
1305200898.0,786,DAE have pencil tips stuck somewhere in their body?
1293982770.0,780,DAE hate more than anything pooping after a shower?
1298247613.0,780,"DAE wake up in the middle of the night realizing that they are in dire need of urinating, then spend about 30 minutes to an hour lying on their bed contemplating whether or not it'll be worth getting up?"
1293665591.0,777,"DAE Hate saying ""bye"" to groups of people and would rather sneak out the room unnoticed like a ninja?"
1339267613.0,782,"DAE gnaw or chew the inside of their mouth? Below lip,cheeks ect."
1291002658.0,785,"DAE refrain from doing something fun (like watching a movie) because it will take too long and you have work, but you end up procrastinating for that amount of time anyway?"
1288541998.0,783,"DAE have no problem at all with gay people but still call their friends ""Fag"" as insult?"
1358705510.0,784,"DAE remember that there is potassium in bananas from the movie ""Honey, We Shrunk Ourselves""?"
1337890719.0,780,DAE get scared for other people when you can tell they're about to get yelled at?
1360882618.0,777,DAE get REALLY irritated when people complain about money while you watch them buy expensive things they don't need?
1266305525.0,782,"DAE without fail, try to plug a USB cord in the wrong way the first time every time?"
1339605699.0,783,DAE Almost never wash their car?
1339000905.0,775,DAE habitually make weird faces at themselves in a mirror?
1374534872.0,777,DAE find it satisfying when containers stack into each other?
1359597966.0,776,DAE eat the crust off Pop-Tarts before they eat the center?
1335594826.0,777,"DAE make a point to talk to less popular people, because you know how it feels to be the outcast?"
1296785552.0,777,DAE prefer text based smilies way more then emoticons?
1361723786.0,779,"DAE look at walls, carpets, or anything with a certain texture and visualize different objects/faces/animals in it?"
1333648988.0,777,DAE find themselves playing with small children like you play with dogs?
1283379324.0,778,DAE hope Reddit doesn't get TOO big?
1360674238.0,772,"DAE forget the passwords of their most visited sites, becasue you are always automatically logged in?"
1347287667.0,770,DAE hate to eat with long sleeves shirts?
1295510939.0,774,DAE use a Google search as spell check?
1266191529.0,772,DAE hate it when women shave off their eyebrows and then paint them back on?
1303677347.0,772,DAE write out a full comment on facebook only to delete it because you realize that you don't want to talk to that person?
1285872002.0,774,DAE feel the need to be extra nice to the cashier when the customer before you was a total d*ck?
1345925218.0,771,"DAE feel little to no sadness for strangers that die, but feel absolutely sick when it comes to animal abuse or animals dying a particularly horrible death?"
1274401283.0,768,DAE always need a blanket covering them somehow in bed despite how warm the room is?
1308465184.0,766,DAE with an email account more than 5 years old not have a single unread message in their Inbox? 
1350581418.0,766,DAE get really shy and nervous when they try to  sing at their best in front of others but has no problem purposely singing bad in front of others. 
1351531421.0,766,DAE get extreme satisfaction when they actually drip sweat after a workout?
1292152438.0,762,DAE Stay up late for absolutely no reason at all?
1362961822.0,767,DAE find it easier to sleep when they're slightly chilly?
1362483531.0,767,DAE type up a comment only to delete it and not post it?
1322670554.0,765,DAE Use their hand to start covering up the page when they get to a really good part of a book?
1302892274.0,765,DAE think girls with glasses are super sexy?
1292010406.0,764,Wondering how many of us wear glasses/contacts.
1358610078.0,762,DAE feel really inefficient at wiping themselves after pooping?
1318858771.0,759,DAE feel weird/embarassed when pronouncing their own full name?
1373840846.0,760,DAE get depressed after a fun night out?
1357532352.0,762,"DAE make up excuses to yourself in the morning when trying to wake up, and imagine yourself getting up(almost like a dream) and feel satisfied but don't actually leave your bed, until you're like ""shit I gotta get up right now fuck you brain!""?"
1266492227.0,758,"DAE think the current system throwing all ""criminals"", violent and non-violent, under one roof and expecting them to walk out better citizens is horribly outdated and in need of heavy reform?"
1320168911.0,758,DAE prefer brownies from the center of the pan rather than the sides/corners?
1325713824.0,754,"DAE Hold their breath when the characters in movies 
have to?"
1317926593.0,756,"DAE Wish Netflix offered a way to set up a playlist of your TV shows, like making a personal TV Channel"
1340893131.0,754,DAE think sharing pregnancy photos on Facebook is weird?
1333997044.0,758,DAE never hear what someone says when they first start talking to you?  Wtf is wrong with me?
1324310916.0,761,DAE take hours before they finally feel awake and energetic?
1370027553.0,754,"DAE talk to themselves mostly in their head, but sometimes mouth out, speak, or gesture only parts of what they're saying in their head?"
1307295213.0,762,DAE not have the attention span for TV anymore?
1289572768.0,761,DAE really dislike fake boobs?
1359053975.0,757,"HAE been told ''careful the plate is hot'', but you still touch it just to see how hot it is?"
1342176484.0,754,DAE shiver when remembering an awkward thing you said or done?
1344051101.0,757,DAE feel perfectly fine speeding when you're driving. But feel completely unsafe if sitting in the passenger seat of a car going the same speed?
1320255093.0,756,DAE automatically look at the top of cars (especially at night) in your rearview mirror to make sure it's not a cop?
1286236480.0,749,DAE think girls seem more attractive once you figure out they're smart
1357134908.0,759,DAE create music in their heads to the beats of their steps while walking?
1340332141.0,751,"DAE go on a short trip (3 or 4 days) and not take a dump, only to find that the exact second you get home you have to take a dump, almost like your anus has GPS built in?"
1332252360.0,753,DAE wonder what evolutionary benefits made a creature look like it does when they see them in a movie?
1304316689.0,749,DAE exclusively use the LEFT shift key?
1341671271.0,753,IAE self conscious about their music when they have to pick which song is playing?  
1308156843.0,748,DAE wish they could defrag their brain?
1285756682.0,755,"DAE feel like a dork when they're waiting for the crosswalk signal to turn to ""walk"", but some badass just walks ahead anyway and leaves you standing in the dust?"
1284924539.0,749,DAE fold their arms in the shower and let watter build up then let go and hear that satisfying plop sound?
1300668422.0,751,DAE think that blonde girls with tanned skin are really unattractive?
1374984660.0,751,"DAE Have phantom phone vibrations in their pocket, only to find out you are holding your phone in your hand?"
1317238631.0,744,DAE play a video game and read the subtitles even though the voice on the tv is saying it loud and clear?
1360234211.0,748,"DAE prefer to listen to the music, rather than the lyrics. "
1358345679.0,743,DAE make 'nose tampons' out of bits of paper tissue when having a cold in bed?
1252143696.0,746,DAE always piss into the toilet so that the pee-stream does not hit the water and bounces off the sides and makes less noise?
1287882489.0,750,"DAE hate having phone conversations in front of other people, no matter how mundane the topic is?"
1365056495.0,741,DAE: Not see a problem with sleeping past noon on days off from work/school?
1344119381.0,742,DAE rearrange the pepperoni on their frozen pizza?
1345466106.0,740,"Sometimes, especially when bored, I will think of the strangest or most inappropriate thing I could do in the situation I am in, then have to really try not to do it. Does Anyone Else do this?"
1325131020.0,736,HAE learned more about English grammar by taking foreign languages classes than actual English classes?
1317786653.0,739,"Does anybody get ""night highs""?"
1297441519.0,747,DAE not know who Mubarak was before the Egyptians started their protests last month?
1317723114.0,740,DAE hate leaving voicemails?
1304249965.0,736,DAE inadvertently say 'what' or 'huh' despite hearing clearly what the other person has to say? 
1287574826.0,739,DAE feel extremely motivated to go out and get shit done but its 4am? and then when you finally go to bed and wake up you have lost all your motivation
1303178285.0,737,"DAE sometimes get the slightest desire to just sell everything, let go of all the shit going on in the world and just live out the rest of your days in a log cabin in the wilderness?"
1287474698.0,743,"DAE skip past a submission, come back to reddit several times throughout the day, and when that submission is still there every time, eventually give in and click it?"
1375464124.0,739,DAE hate celebrating their birthday?
1298594604.0,744,DAE get paranoid that their alarm clock won't work or won't wake you up in the morning?
1286712617.0,737,"DAE hate people who describe themselves as ""Random"""
1299976423.0,739,DAE not care for sports? (guys especially)
1357766402.0,732,DAE feel like a total badass when you switch lanes and don't hit the reflectors on the road?
1294637853.0,740,DAE think women look way better in panties than thongs?
1353216290.0,734,DAE feel like since childhood you've never really felt truly home.
1297180093.0,735,HAE pretended to die in front of their pet to see what they do?
1252249238.0,730,"DAE listen to a song or watch a movie with a friend that you have highly recommended, only to keep looking over at them and hoping beyond hope they like it as much as you do?
"
1314649686.0,734,DAE get really motivated for about 5 minutes after watching a motivational video and then just go back to normal and realise it was a pointless effort?
1285821016.0,736,DAE run their toothbrush under the water AFTER putting toothpaste on it?
1338042005.0,735,DAE open the toilet door slowly in case someone forgot to lock it?
1312897894.0,734,DAE get grossed out by fake finger nails?
1299776694.0,734,DAE Fucking HATE Tyler Perry and his SHITTY TV show on TBS?
1372290190.0,731,DAE wonder if your computer webcam is silently watching you?
1337018648.0,731,DAE walk around (sometimes in an organized pattern) when they talk on the phone?
1327003224.0,728,DAE Have a public restroom that they think of as 'theirs' because seemingly nobody else ever uses it?
1358392237.0,730,DAE constantly draw boxes on the Windows desktop or highlight / unhighlight text in an application using the mouse pointer
1345810498.0,725,DAE feel that once you get a new car you start noticing more of them on the road?
1370681594.0,730,DAE find that the urge to pee gets exponentially stronger the closer you get to the toilet?
1355603251.0,726,DAE compulsively remove the protective plastic from other people's electronics?
1332908016.0,731,DAE tell themselves they will appreciate being normal so much more whenever they are sick/have something wrong with them?
1326940672.0,723,"DAE secretly count how many times a person says ""like"" in conversations or class discussions?"
1344308760.0,725,"DAE put a pillow between their legs when trying to sleep, all because they hate feeling their knees together?"
1263913129.0,721,"DAE realize they're getting bored looking at reddit, then find themselves clicking on their bookmark for reddit again?"
1375548893.0,725,"DAE get these weird dreams between the alarm and the snooze time, and like it?"
1374730386.0,724,DAE make random weird noises when nobody else is around.
1339549595.0,727,DAE have incredible trouble trying to not smile/laugh when being falsely accused of something?
1297697540.0,728,DAE get tired of the musicals in family guy
1270055531.0,719,DAE disregard twist ties on bread bags and just spin the bag in one hand and tuck the end under the loaf?
1311355683.0,721,DAE hate when chat programs turn your emoticons into little animated gifs instead of just keeping them as the symbols you originally typed?
1331304822.0,722,DAE write their notes like this?
1325921263.0,721,"DAE get mad when you upvote something, click on a different link, hit back to return to Reddit, and then the upvote is gone? (does it even happen to anyone else?)"
1300493014.0,715,DAE upvote posts with 0 points just so that person doesn't feel the sting of disappointment when they check on it?
1299168980.0,715,DAE think Sex and the City encourages girls to be materialistic sluts?
1292343606.0,722,DAE prefer Wikipedia over IMDB simply because of IMDB's skin? 
1342630092.0,715,DAE not kill spiders when they find them in the house?
1342539826.0,711,DAE sniff the coffee can or bag every time they make some coffee?
1302187429.0,721,DAE have a difficult time sleeping with socks on? 
1309370559.0,716,"DAE have a coworker who is just shitty enough to make life difficult for everyone, but not quite shitty enough to be fired?  "
1299425758.0,714,DAE think Jimmy Fallon is not funny?
1287187997.0,710,DAE absolutely refuse to buy a book if the cover is the poster of the movie version?
1297967614.0,719,DAE love the smell of rain?
1309485790.0,709,DAE not sleep well if there's something wrong with your computer?
1305649469.0,716,DAE have the urge to contradict someone's argument despite totally agreeing with what he/ she said?
1302141900.0,709,DAE open doors for others just because its nice?
1296905322.0,714,DAE not get laid at all during high school?
1372825997.0,716,"DAE want to dress nicer more often, but never have the chance or occasion to?"
1343870878.0,710,DAE always leave their shoes tied and just slip them on when they go somewhere?
1324249254.0,714,DAE when taking a shower stand in front of the shower head and fill their mouth up all the way with water then spit it out repeatedly?
1372664904.0,716,DAE have/had dreams where you're punching something or someone but it feels very weak?
1301573686.0,712,"DAE constantly check their pockets, to make sure they haven't lost anything?"
1289348968.0,711,WAE not confused by Inception at all?
1351376238.0,711,DAE randomly put their hands in their pants when bored? 
1290570714.0,707,DAE fear losing their civil rights MORE than dying in a fiery terrorist attack?
1301795298.0,709,Anyone else not give shit about NASCAR?
1298503705.0,709,"DAE automatically think less of someone (intellectually) when they use ""your"" &amp; ""you're"" incorrectly?"
1316993144.0,709,DAE think its arrogant to believe that humans beings are the only intelligent life in the universe?
1362663295.0,707,"DAE NEED to sleep with a fan directly pointed at them at night? Even if it is cold outside, you still need a cool breeze to feel comfy?"
1340204805.0,711,"DAE dislike wearing shirts (or other articles) that have places or events on them, especially if you didn't personally go there?"
1266952425.0,704,"DAE go to bed at the end of the day feeling exhausted, but as soon as you lay down, your body is like, ""Just kidding!""?"
1319899040.0,703,"DAE hold their breath when someone walks by and creates that ""person breeze"" because you don't want to risk inhaling a bad odor?"
1375883348.0,704,DAE get paranoid that someone might kill you when you close your eyes in the shower when shampooing?
1292782689.0,703,HAE come to the realization that boxer briefs are the greatest undergarment option for men?
1283933855.0,704,DAE bring all grocery bags inside in ONLY 1 trip ... no exceptions
1342235666.0,707,DAE stare at a single blade on a fan...
1292857445.0,704,DAE not watch TV anymore?
1366067374.0,700,DAE think that in the event of a terror attack all medical care should be free to victims.
1336329306.0,706,DAE rip up their sliced cheese so it will be evenly distributed across their sandwich?
1332281398.0,701,DAE sometimes forget how old they are?
1264676647.0,704,"DidAE as a kid learn cursive, and the teacher stressed how much it would be used in higher grades, but then never use it again?"
1338336773.0,698,DAE sleep in an extremely uncomfortable position because they don't want to mildly inconvenience their cat that fell asleep next to them?
1293411378.0,700,DAE calculate how much time they have spent doing something based on how many songs they heard?
1352780079.0,701,DAE speak aloud random portions of your thoughts when alone? If I were ever under surveillance they'd think I was crazy.
1359968778.0,696,DAE Drop things on their feet before dropping them to the floor to lessen the impact of the fall?
1375938168.0,691,DAE try to find two different cars whose turn signals match up while at red lights?
1351637259.0,696,DAE feel not at all hungry for an hour or so after waking up and have to force breakfast down?
