created_utc,score,title
1314182322.0,1090,"DAE stay marked as ""offline"" for your facebook chat because it's easier than fabricating an excuse as to why you don't feel like talking?"
1290182037.0,1091,DAE 'snipe' a more interesting link into a new tab right before the other link you clicked on loads.
1365520766.0,1087,DAE have to lick the foil lid of the yogurt clean before delving into the rest?
1364104212.0,1083,HAE never broken a bone?
1317331049.0,1088,DAE just delete everything to fix a typo because you type faster than it takes to move your hand to the mouse?
1366640797.0,1089,"DAE Gets pumped up and start making resolutions, but at the middle of the night ?"
1298984953.0,1090,DAE not watch the The Simpsons at all now even though they used to watch it religiously years ago?
1296356587.0,1079,"DAE get ""Awkward Flashbacks"" to things they've said/done?"
1264023424.0,1082,"DAE read ""µTorrent"" as ""You-Torrent"" instead of microtorrent?"
1344868954.0,1079,DAE save their video game before turning off even though they know autosave is on?
1320487547.0,1078,"DAE always feel compelled, as they get up to leave a restaurant, to take one last giant gulp of their beverage?"
1292196959.0,1076,DAE ONLY read the title of the DAE submissions and move on? 
1374935438.0,1077,DAE remove your headphones to check and see if someone else can hear your music?
1341324635.0,1072,DAE ever feel like everyone is secretly mad at them even though you've done nothing wrong and no one has actually said they were upset with you?
1370976019.0,1068,"DAE think ""ASAP"" sounds way more urgent than ""As soon as possible?"""
1368465660.0,1068,DAE Bite the skin around their nail?
1340044531.0,1077,DAE love the smell of coffee but hate the taste?
1372031463.0,1072,DAE Ever remember horribly embarrassing memories randomly?
1364566306.0,1073,DAE prefer half naked sexy people than naked ones?
1313084699.0,1064,"DAE think ""Rage Against the Machine"" is needed now much more than they were in the 90's?"
1368733497.0,1063,Does anybody else feel like an absolute idiot when you text in bed and drop your phone on your face??
1340744064.0,1065,"DAE feel like the ""jack of all trades"" good at most things but never the best at anything."
1351307917.0,1058,DAE look at strangers and think about the problems that person has in their life?
1344268812.0,1065,DAE stop the microwave from beeping at 00:01?
1298689323.0,1060,"DAE get really proud of them self when they draw a perfect ""{"" ?"
1364734090.0,1055,DAE think that cellphones' methods of letting you know the battery is low really does not help the situation?
1302521793.0,1059,DAE get really bummed when they find out a celebrity they admire is a Scientologist ?
1372159957.0,1055,DAE read a book for half a page then completely lose yourself in imagination and lose track of where you were reading?
1354206303.0,1058,DAE like to suck on candy canes until they become a sharp point?
1373642475.0,1057,DAE frequently type half of a comment but then cancel it out of either paranoia of getting downvoted or sheer laziness?
1366205165.0,1053,DAE fucking love to sneeze?!?!
1327856897.0,1060,DAE upvote certain posts not because they like it but because they think it's important that others know/see it?
1370213216.0,1050,DAE get very emotional after watching the series finale of a show? It always feels like my family just died.
1291950824.0,1046,DAE not give a fuck about 3D TVs and 3D Movies besides me?
1353618028.0,1044,DAE sometimes hear their pulse in their pillow when sleeping?
1292447060.0,1047,"DAE use their chin stubble to scratch itches on their hands, arms, and basically wherever it reaches?"
1348335507.0,1042,DAE dream about escaping modern society and living in a lonely forest cabin with a dog and a modest library? 
1325783210.0,1038,"HAE eaten the same thing for breakfast weeks in a row, then suddenly one day it sounds disgusting?"
1270674245.0,1033,DAE love to slowly 'pour' their mother's thin chain necklaces into their palms as a kid?
1336675548.0,1036,Does anyone else feel a twinge of satisfaction when that song playing in your car ends right when you get home?
1373798420.0,1032,DAE think it's annoying and stupid to sing Happy Birthday to someone who isn't a kid?
1373301703.0,1032,"DAE take long showers, but not because they are masturbating?"
1330105271.0,1035,DAE Hit their teeth together to make drum beats in their head? 
1336878268.0,1029,DAE immediately put on pajamas when they get home?
1368961341.0,1027,"DAE click to comment, but upon seeing 1000 comments or even one really informative one, you think ""Eh forget it, somebody said it better."""
1358181885.0,1030,DAE Wish Tic Tacs tasted like their vanilla coating the whole way through?
1374850400.0,1021,"DAE dry off in the shower, instead of getting out and then drying off?"
1368642472.0,1030,DAE ever sit back and realize how trivial your struggles and feelings are since you're one person among 7 billion?
1353083205.0,1021,"DAE put headphones in and forget to play any music?
"
1295102164.0,1026,DAE feel that the best way to watch a movie is to know nothing about it?
1324858424.0,1027,DAE Find it hard to commit to reading long winded and detailed texts on a computer but wouldn't have a problem if the same text was in a book?
1366389254.0,1020,DAE feel that they have both a superiority and inferiority complex?
1312315544.0,1021,DAE want a TinEye for Reddit? I only ask because... I made a site which does that.
1358732179.0,1023,DAE exclusively use vibrate only mode on their phone? I just realized I haven't heard my ringtone in years.
1354509778.0,1019,DAE tear up when yelling/arguing with someone face to face due to the pressure from the other person's emotions and your own even though you aren't sad?
1363626341.0,1015,"DAE go on autopilot while driving and then suddenly ""come to"", not realizing how far you've been driving?"
1293724772.0,1017,"DAE think that high-schools and colleges aren't teaching kids enough street smarts (credit cards, budgeting, tax returns etc.)?"
1297025657.0,1018,DAE think TED Talks Should Air on PBS?
1315409240.0,1015,"DAE love ""Kiss From a Rose"" regardless of what genre you usually listen to?"
1316885455.0,1007,"DAE try to read text in movies really fast in fear of not getting to the end in time, but then it stays on the screen forever?"
1358790457.0,1016,"DAE, when facing a deadline, can only begin working when they realize there is no possible way to finish in time?"
1294595792.0,1013,DAE hear a song they like on the radio and then try to remember a short phrase from the lyrics to google later?
1367271107.0,1005,DAE like to imagine they're one of the last humans left in a post apocalyptic world when they're out alone at night?
1299102420.0,1007,DAE sometimes briefly become acutely and painfully aware of their meaningless existence?
1293269756.0,1011,DAE Meow Back At Their Cat?
1369769696.0,1007,DAE Have to wet their toothbrush before brushing their teeth and if they don't then the whole process is thrown off?
1336364988.0,1009,DAE only like writing on paper if there is another piece of paper underneath it?
1297938465.0,1010,DAE habitually bite the skin off your lips?
1296490178.0,1010,DAE hate when things are alphabetized and everything starting with 'the' is under T?
1295806088.0,1011,DAE ever feel like you've lost a friend after finishing a movie/book/TV show?
1364664792.0,1008,DAE love going into a new hotel room for first time and exploring every part of it?
1332453266.0,1007,DAE feel like the people you've met in person are generally sexier than anybody you'll see in porn or media?
1365605556.0,999,DAE have to make a conscious decision every night to put down their smartphone and go to sleep?
1370619138.0,1000,DAE look at a common word and suddenly realize how weird it is?
1362364905.0,1000,DAE get anxious or depressed on Sunday after 8pm because you know the weekend is ending and the work week is starting again?
1300540866.0,995,DAE get chills when listening to music that they really like?
1362243410.0,998,DAE love heavy comforters but continually wake up due to excessive heat?
1341622217.0,1000,DAE not really pay attention to lyrics in music and just listen because it sounds good?
1336056618.0,998,DAE get annoyed that obituaries usually don't include the cause of death?
1294932110.0,997,DAE find it instantly attractive when a girl has a good vocabulary
1291126632.0,998,DAE hate it when employers demand 2-3 years experience for entry level positions?
1338829591.0,997,DAE (with a penis) prefer masturbating without any lotion? 
1253582289.0,995,"DAE push the stop button on their microwave 1 second before the timer goes off, just so they don't have to hear the annoying beeping?"
1362880876.0,985,DAE like to take naked-naps immediately after showering or bathing?
1347034368.0,988,DAE Have no idea what to say when someone knocks on the bathroom door?
1315162150.0,989,DAE not bother commenting on a post that already has hundreds of comments because its likely yours will be buried?
1369943119.0,983,"DAE Drink from their water bottle just because they have it, even if they're not thirsty"
1359646921.0,986,DAE hate when people walk on the wrong side of the hall or sidewalk?
1375282863.0,983,DAE (ladies) only shave part of their legs depending on the length of pants you're about to wear?
1367333712.0,986,"DAE come across one thing in particular (a word, name, vehicle, hobby, etc.,) which isnt used often, then all of a sudden you see/hear it all over the place?"
1345319326.0,983,"DAE always say ""no thanks"" when someone offers to share their food, even if you actually do want some?"
1345150249.0,985,DAE feel a compulsive urge to clean when they're upset?
1376316075.0,986,DAE find themselves waking up before their alarm and then not being able to fall asleep in anticipation of the alarm going off?
1371707700.0,982,"DAE feel that ""graduation"" from various grades is overkill and should be stopped?"
1356205864.0,979,"DAE love to keep their room very cold, then cower under mountains of blankets to stay warm?"
1302970675.0,982,"DAE, when crossing paths with a disabled person, make a point of acting nonchalantly and worry that they're overdoing it?"
1363705224.0,980,"DAE take a pill for the day and then wonder if you actually took it, or are just imagining things?"
1286751101.0,977,DAE think toasters should be transparent so you can easily check the progress of your bread?
1367499313.0,972,DAE always end up wasting cilantro when you buy it and think that it should coming in MUCH smaller bunches at the grocery store.
1365989216.0,976,"DAE write their entire papers in single line spacing, and then change the entire paper to double line spacing at the end to watch the transformation?"
1314729553.0,974,"DAE get that ""deja vu"" feeling in real life, from something they have seen in a dream?"
1299046365.0,975,DAE automatically hate people who are needlessly rude to customer service or waitstaff? 
1296144017.0,973,DAE fucking LOVE waking up and realizing your shitty dream wasn't real?
1337266620.0,974,DAE pretty much always have music playing in their head?
1340110901.0,971,"DAE click ""Apply"" then ""Ok""?"
1367655482.0,966,DAE bite the skin off the inside of their lips?
1356193122.0,969,"DAE like to squeeze bags of very small items like bird seed, beads, etc?"
1346291229.0,970,"DAE feel a sense of pressure to read quickly when someone shows you something with text (a comic, article, etc.)?"
1322189294.0,966,DAE have this happen to them oftenly: hearing a word for the first time in your life and then hearring it a lot of times after that in random occasions?
1367715536.0,968,"DAE sometimes try and guess the exact time before checking the time, and half the time get it scarily accurate?"
1298548719.0,964,DAE not hate justin bieber but just ignore him?
1362825839.0,965,DAE rub their feet together under the covers when trying to fall asleep?
1304093028.0,967,DAE sometimes worry that you're mentally handicap in some way and the rest of the world is just humoring you?
1365683121.0,964,DAE love the smell of popcorn more than actually eating it?
1304289035.0,964,DAE lose all their typing prowess the moment someone starts watching them type?
1290090282.0,958,DAE wear their pants a few days in a row before putting them in the wash?
1273987045.0,958,"DAE Throw away the package of something you are cooking, only to walk back and get it to check how long it's supposed to cook? Repeatedly?"
1366122639.0,958,DAE get way more annoyed by radio commercials than TV commercials?
1341862944.0,958,"DAE have dreams where you fall love with a girl you know, and afterwards you find yourself emotionally attached to her?"
1289076290.0,957,"DAE close Reddit after browsing it for ages, only to reopen it again in a new tab because you don't know where else to go?"
1299802714.0,954,DAE genuinely enjoy spending time alone?
1364997472.0,950,"DAE focus on a single item amongst thousands (i.e. a blade of grass, a pebble, etc.) and acknowledge its individual existence?"
1355503407.0,950,DAE Feel uncomfortable eating in front of other people sometimes?
1373463742.0,953,DAE hate when people don't believe/won't admit that humans are animals?
1369281332.0,954,DAE put their iPod on shuffle only to skip around until they get the songs they want?
1341236477.0,958,DAE never get hit on until AFTER you entered a relationship?
1316741711.0,955,"DAE after a wash throw that extra sock, with no pair, back into the hamper hoping next time it will even out?"
1368125921.0,954,DAE only read the titles of TIL posts?
1341771905.0,952,DAE find themselves speaking differently depending on which crowd of friends they're hanging out with?
1303027623.0,954,DAE read the wikipedia articles for movies after watching them?
1282821550.0,948,DAE type out proper full words/sentences instead of using shorthands while texting or IMing?
1369664333.0,951,DAE occasionally take off the phone cover to feel what it's like without the cover?
1298880715.0,945,"DAE stare at a dead body in a movie/tv show intently looking for movement, or breathing? "
1366148124.0,947,"DAE masturbate just because they're bored? Not turned on, just bored?"
1355926935.0,952,DAE weirdly space out whenever a waiter begins reciting the specials? 
1354240122.0,945,DAE forget to listen to the other person's name when introducing yourself?
1376242881.0,942,"DAE lay in bed in a position they know they can't fall asleep in, before finally changing to a position they can?"
1352708580.0,936,DAE randomly ever feel like spontaneously kissing whoever is near them?
1367987211.0,943,DAE have so many conversations in their head that they forget what was said in real life?
1368405488.0,933,"DAE listen to their iPod on public transport, look out the window, and pretend they're in a movie, complete with soundtrack?"
1274059745.0,936,"DAE Type out comments, then just kill the tab before submitting and think ""Nobody gives a shit."""
1372528684.0,935,DAE listen to music while imagining you are one of the band members playing live in front of people you'd love to impress?
1317835032.0,938,DAE get mad when clicking on a link thinking it's a story and it's a video
1291707597.0,941,DAE feel like they need to be watching a video/tv episode while they eat at the computer?
1327428210.0,936,"DAE get ridiculed by friends for using precise, accurate language?"
1370361924.0,938,DAE wonder just how many killers they pass on any given day?
1360850776.0,934,DAE deflate a bag as much as possible before sealing it back?
1298739713.0,931,"DAE choose their underwear that day based on the 
likelihood of someone else seeing them?"
1298642532.0,932,DAE hate it when girls act dumb in attempts to be cute?
1373388278.0,932,DAE get super happy when they see a dog with their head out the window and their ears are flapping in the wind?
1340482578.0,937,DAE absolutely hate when crowds clap to the beat of a song at concerts?
1320021941.0,932,DAE get irrationally excited when their hometown is mentioned? 
1295409163.0,927,DAE automatically assume someone knows nothing about computers when they see their only internet browser is IE?
1366772492.0,926,DAE try to grab and hold their pets' tongue when they lick you?
1300929709.0,934,DAE feel incredibly sad when running out of episodes of a new show you get addicted to?
1298992129.0,927,"HAE Thought the ""L"" from ""NSFL"" meant ""life"" instead of ""lunch""?"
1364400529.0,929,DAE blow their nose in the shower?
1327537540.0,927,DAE erase their whole password when you make a mistake?
1346171865.0,922,"DAE get really excited when their favorite song comes on the radio, but you have the song on your phone able to play at any moment."
1328223020.0,923,"HAE found that the worst, most ignorant and childish comments on the internet are in the comments section of their local newspaper?"
1304443495.0,924,"DAE ever think about how easy it would be to fuck shit up, but would never actually do it?"
1267465706.0,922,DAE not give a shit about this Saydrah person and whatever is going on relating to them?
1368269048.0,917,"DAE have a hard time imagining certain married couples having sex, but you know they did because they have children?"
1362589597.0,920,DAE find themselves constantly waking up one minute before their alarms go off?
1360779159.0,921,DAE only remember the phone numbers of people you knew before you got a cell phone?
1338586352.0,918,DAE Meow back to their cats and pretend to have a conversation?
1299685431.0,918,HAE never paid for porn?
1301416726.0,916,DAE hate being spoken to when they just wake up and only want peace and quiet 
1286576728.0,917,"DAE rehearse lengthy, detailed conversations in their head then realize they will never happen?"
1366894762.0,904,"DAE use the same coffee mug for a couple days, just rinsing it out before using it?"
1363750094.0,912,"DAE find themselves saying ""what"" to somebody even though you heard what they said the first time?"
1300628561.0,908,DAE not wash their bed sheets as often as they should?
1289242055.0,906,"When you get a call from a number you don't recognize, do you not answer it and then go Google it?"
1273197734.0,899,"DAE hate when a book is made into a movie and suddenly all of the new (i.e., available) editions of the book use the movie poster for the front cover?"
1298830710.0,900,DAE still have an inconsistent signature?
1338147775.0,899,DAE listen to music but never pay attention to lyrics?
1313598577.0,897,"DAE while driving, consciously try to hit the perfect apex of every turn (like driving a race car) to lose the least amount of speed or fuel?"
1300124932.0,899,DAE think it's weird when people kiss their parents on the mouth?
1354724284.0,902,DAE avoid saying a person's name because you aren't sure if you're pronouncing it correctly? 
1353950596.0,893,"DAE see the future in your dreams, but you only remember the dream when it happens?"
1267295512.0,893,DAE hate it when they click on a link on a news site and find out it's a video instead of text?
1339087410.0,893,DAE tries to complete some task before microwave is over?
1311707405.0,897,DAE find women sexier in lingerie compared to just naked?
1292707821.0,887,"DAE constantly start typing a reply on Reddit, get halfway through and think to yourself ""No one's going to give a shit"" and then cancel it and move on?"
1335975979.0,889,DAE hit shuffle on their music player then keep skipping songs until you find a song you want to listen to?
1352648401.0,890,DAE have a phobia of looking out windows at night?
1302220624.0,886,DAE prefer soft cookies over crispy/hard ones? 
1310054370.0,886,DAE type a whole paper single spaced just for the satisfaction of double spacing it at the end?
1307463809.0,884,DAE put their bedsheets between their legs while they sleep so that your kneecaps won't rub against each other?
1376400702.0,885,DAE Talk to themselves when they are alone?
1369160547.0,888,DAE agree with me that whoever created team building games deserves a special place in hell?
1364144064.0,883,DAE like peeling dried glue off their fingers?
1348881598.0,885,"DAE speed up or slow down when approaching a 4-way stop at the same time as another vehicle to make sure one of you is clearly first, thus avoiding the ""you go, no you go"" situation?"
1292959467.0,883,IAE weirded out by the crusty milk flakes that are sometimes under the lid of plastic milk jugs?
1299583274.0,882,DAE hate showering right before you actually shower but love it while showering?
1359304289.0,879,DAE feel a level of comfort from just holding their junk?
1299360038.0,883,DAE only use the left shift key on their keyboard?
1295392349.0,885,HAE never broken a bone in their life.
1285035654.0,877,DAE not give a shit how far away they have to park when going to the store?
1349869698.0,874,DAE feel anxious if they don't feel useful or productive?
1301599421.0,877,DAE feel like /r/DAE is becoming /r/IdioticQuestionsWithObviousAnswers?
1355751371.0,876,DAE Nap better on the couch than their own bed?
1369540746.0,876,"DAE politely nod and smile the third time someone says something because you still have no idea what they said after saying ""What?"" two times?"
1361115633.0,881,"DAE always have to get ""the perfect mouthful"" at the end of a meal?"
1320323674.0,872,DAE go on random cleaning binges?
1303795619.0,871,HAE watched a movie they haven't seen since they were little and realized they had NO idea what the fuck was goin on when they first saw it?
1302272790.0,872,"DAE hate /r/DoesAnybodyElse because, lately, every submission is fucking stupid and obvious?"
1294794737.0,876,"DAE watch ceiling fans, then focus on one blade and follow it around?"
1358744631.0,874,"DAE hate being told to ""introduce yourself and tell everyone something about you"" to a bunch of strangers?"
1335454373.0,871,"DAE, the second you get comfortable in bed at night, just HAVE to undo the comfort to double check that the alarm is set before you can truly be relaxed?"
1373523559.0,869,"DAE think it's weird to say ""dad and mom"" instead of ""mom and dad""?"
1335716773.0,866,HAE still managed to avoid getting facebook time- line?
1293588013.0,862,DAE hate it when you're surfing Reddit and you feel something on your neck and turn to see that your room-mate has put a spider on there and you jump up to run around flailing and he bitch-slaps you with a potted plant YES DAVE THIS IS DIRECTED AT YOU BITCH
1373049564.0,868,DAE sometimes just hate their friends?
1369013720.0,867,DAE regularly feel like unsubscribing to DAE because the top threads are usually mind-numbingly obvious?
1309980551.0,864,DAE feel a sense of satisfaction when a song finishes at the exact moment you switch off your car engine?
1370890403.0,860,"DAE repeat actions with the opposite side of the body to feel ""balanced?"""
1360081258.0,865,DAE wipe their asses with baby wipes? It's way better.
1300039718.0,866,"HAE forgotten what other things there are to do on the internet, since they joined Reddit?"
1296055428.0,860,DAE still hold open the door for women you don't even know?
1365716552.0,859,"DAE feel that when you're too hot in bed, sticking just one foot out of the covers perfectly regulates your temperature?"
1336750408.0,863,"DAE find it annoying when someone begins their post with things like ""I know this is going to be buried and nobody will ever see it""?"
1336237892.0,856,DAE cringe when someone BITES into an ice pop? 
1338494220.0,859,DAE feel like you are always the one to initiate contact with friends?
1315253471.0,854,DAE suffer from Precordial Catch Syndrome?
1371220149.0,850,"DAE hit the lock button on their car keys multiple times, much more than they need to?"
1299622341.0,854,DAE find it not that fucking difficult to use their damn blinkers?
1282389735.0,858,"DAE reply to everything with ""what?"" only to realize a second later that you did hear them?"
1298906442.0,857,DAE read a whole paragraph and then have to go back and read it all again because you absorbed none of it?
1267040831.0,860,"DAE, just before going to bed, think of what time you're getting up and calculate how many hours of sleep your going to get. (factoring in 15-30 minutes for lying awake in bed before falling asleep)"
1323890870.0,855,DAE often have a hard time understanding people over the phone?
1301081778.0,856,DAE flush a public toilet with their foot?
1347755150.0,849,"DAE seem to have permanent dark smudges under their eyes, no matter how much sleep they get?"
1368312396.0,847,DAE tear random leaves off of bushes and trees that they pass?
1374895009.0,848,DAE pick one blade on a ceiling fan and try to follow it for as many spins as possible before losing it in the blur
1346540220.0,848,"DAE eat parts of their meal in proportion to one another, so that all the food is gone at the same time?"
1297484231.0,848,HAE never bought a ringtone?
1371398871.0,842,DAE put the Do Not Disturb sign up the moment they get to their hotel room and leave it there until they check out?
1301933594.0,843,DAE laugh when people speed in front of you to get to the same red light?
1316503753.0,843,DAE Google search a friend's FB status thinking it's from something because you don't think that person was clever enough to think of it on their own?
1316190765.0,845,DAE used to stick their finger in a cats mouth when it yawns? Boyfriend says I'm crazy.
1268923766.0,847,DAE get phantom phone vibrations? My leg seems to think I'm receiving text messages even when I'm not.
1301248876.0,840,IAE procrastinating while reading this?
1299254563.0,844,"DAE think it would be better if we said, ""Screw it,"" pulled all our forces out of the Middle East, Afghanistan, and wherever else we are right now, and just took care of our own country for once?"
1322017589.0,838,DAE not like eating breakfast or anything in the mornings?
1295620162.0,842,DAE Think 3DTV is not practical and that it will never truly catch on?
