created_utc,score,title
1323308333.0,699,DAE read these and answer yes or no in there head and scroll past
1301324352.0,689,DAE love making breakfast for dinner?
1279816152.0,694,DAE ignore all video links on reddit because you need instant gratification and devoting a few minutes of your complete attention to a video is asking too much of yourself?
1335108096.0,692,Does anyone else remove all of your clothing during a major poop session?
1299860403.0,690,DAE just want to relax and do nothing when they get home from work?
1295919736.0,692,DAE feel that politics in America is more about screwing the other party than improving the country?
1290535236.0,692,(Guys) DAE fucking love cuddling?
1286127638.0,688,DAE watch movies and realize halfway through you still don't know the names of any of the characters? 
1285524483.0,689,DAE hold their breath whenever someone in a movie goes underwater to see if they could last as long as the character?
1282935293.0,687,DAE hate checking their voicemail?
1369001822.0,693,Does anybody else drive by the homes they used to live just to see who lives there now?
1324672031.0,690,DAE wait a small while before replying to a text message sent by the other sex in order to appear less interested/pushy?
1315016895.0,688,"DAE get frustrated with the term ""African American"""
1284092075.0,689,DAE pace around while on the phone?
1261430848.0,686,DAE hate it when their web browser starts playing sound out of nowhere and you have to guess which tab it is from?
1286158845.0,694,DAE hate the 3D movie trend?
1367846828.0,688,"DAE (male) pee sitting down on the toilet in the middle of the night, so that you don't have to turn on the light?"
1364778599.0,693,"DAE like to lay in bed for a few, just after waking up, and sit in that ""half dream, half reality"" state of mind?"
1360777145.0,690,"DAE get really self-conscious when they have to blow their nose in public, in fear of being judged or having some ridiculous catastrophe?"
1302766165.0,685,DAE rip the skin on their lips?
1347146578.0,684,DAE bite the rim off of styrofoam cups? 
1294182921.0,688,DAE think that Lady Gaga would make a great Batman villain? 
1353585110.0,686,"DAE get pissed off at inanimate objects if they aren't doing what you want, even though you know deep down that it's your own fault?"
1340232787.0,683,"DAE find the phrase ""calm down"" to have quite the opposite effect on you in a discussion?"
1317575939.0,685,"DAE not put in the email address in the ""to:"" field of an important email until you're ready to send?"
1296696397.0,684,"DAE like to use Wikipedia, IMDB, or Google to look up things while they are watching it?"
1319777910.0,683,DAE accidentally zone out after asking someone to repeat themselves because you zoned out the first time they said the thing you want them to repeat?
1291127391.0,685,"HAE ever fallen in love in a dream, wake up and then feel sad all day?"
1284037739.0,686,DAE buy as much of their stuff online as they can so that you can get the thrill of having what are basically presents delivered to your door?
1267544856.0,684,DAE hate when you are shopping and you head to the clearance rack and find a nice button up  shirt at a cheap price and you turn it around and there is a horrible tribal print or a skull with guns?
1356654277.0,683,DAE absolutely hate the sound of teeth scraping on silverware?
1288168265.0,683,DAE love sleeping at night with their bedroom freezing cold?
1333469626.0,684,DAE bite and chew the top layer of skin off of their fingertips out of compulsive habit?
1308283044.0,681,"DAE find themselves wanting a movie to be over, even if they're enjoying it?"
1299309813.0,673,DAE Feel really bad for restaurants in their area that get no customers?
1354477675.0,674,DAE get a weird pain in their jaw if they smile while eating something sweet/sour?
1362539806.0,679,DAE stay in the car after reaching your destination to finish listening to a song
1292607203.0,679,"DAE still say ""Oh my god,"" ""Jesus Christ!"" ""God damn it!"" ""Thank god!"" and other associated phrases despite being an atheist?"
1291390268.0,676,"DAE hate the term ""African American""?"
1349811300.0,674,DAE occasionally see clocks tick for one second but it lasts longer than one second?
1324152491.0,675,IAE always obsessed with one thing for a certain amount of time then shortly get sick of it and move onto something else you do frequently?
1338639660.0,671,DEA hear clicks in their ears when they swallow
1302930221.0,670,DAE think that leaving stickers on your hats is fucking retarded.
1295065377.0,675,"DAE loathe the word ""preggers""?"
1368982992.0,675,"DAE get really excited in anticipation of, or during thunderstorms?"
1286974852.0,672,DAE think that turn signals are a massively underused courtesy? 
1373174313.0,675,DAE get really depressed/scared about their future when trying to fall asleep?
1372947248.0,671,DAE look at your fellow passangers on an airplane and wonder what roles everyone would take if you crashed and had to rely on each other to survive?
1336502070.0,670,"DAE not like doing pranks? The water cups in your home, half the up voted stuff on /r/funny... I would feel like a bad person if I did that to a friend. "
1301461939.0,671,DAE always thank their bus driver when they get off the bus?
1366128552.0,666,DAE not remember the dream you had last night until small things throughout your day slowly bring it back?
1342292295.0,672,DAE turn into the biggest pussy around wasps?
1321168003.0,670,DAE sometimes wonder how long it's been since a particular spot on the ground been occupied by a human?
1275881878.0,669,DAE replay embarrassing situations in your head and cringe at your behavior.
1332966501.0,672,"DAE have no problems with drinking tap water from a kitchen sink, but find it gross to drink from a bathroom sink?"
1284777715.0,669,DAE get really annoyed by modern movie trailers because they pretty much show the entire damn movie?
1310443534.0,663,"DAE think the women performers on ""Whose Line is it Anyway"" are not funny at all?"
1281217693.0,673,"DAE have the ability to know if the TV is on, just by the faint buzzing noise?"
1322396071.0,661,DAE have absolutely no idea how to talk to children?
1295035200.0,664,"DAE Feel that typing ""haha"" at the end of a sentence you think is funny is better than saying ""lol""?"
1339766768.0,668,DAE take forever to clean their room because they tend to find a ton of nostalgic stuff?
1309162150.0,663,DAE cringe and suffer embarrassment for characters onscreen in what most would consider comedic situations?
1301862015.0,669,DAE think they would be useless to a police sketch artist?
1335672714.0,662,DAE notice their own accent change when talking to someone with an accent different from there own?
1298373602.0,661,"DAE remember the 90s when we used to say ""NOT"" instead of allowing sarcasm to be implied?  That was really cool of us."
1311029583.0,669,"DAE get jealous while trying to fall asleep without success, when the person next to you immediately starts snoring?"
1340418202.0,661,DAE flirt with a girl/guy once and then imagine your life into the future with them?
1343717519.0,665,DAE Sometimes hear your name being called while alone?
1288700763.0,661,"DAE feel like the most comfortable one feels, all day, is the 15 seconds when you're falling back asleep after hitting the snooze button?"
1333031343.0,659,DAE handwriting change when you use different types of pens/pencils?
1298419051.0,658,"DAE really, REALLY hate underwater Mario levels?"
1363451157.0,660,DAE count how many hours of sleep your going to get before going to bed.
1345172167.0,660,"DAE ""hear"" electronics turn on? Specifically televisions? "
1362060718.0,656,"DAE take way longer in the bathroom than other people, and often wonder how the others do it all so quickly?"
1357835957.0,656,DAE like to sleep with a pillow  on top of their head?
1302045839.0,658,DAE not listen to a single podcast
1296266152.0,652,DAE still think 1980 was 20 years ago?
1371659469.0,657,DAE pick a random car on the highway and try to beat it through a traffic jam?
1342021031.0,655,DAE spend most of their showers thinking about life?
1321823253.0,658,DAE watch movies or TV shows with subtitles/captions on even though you can hear and understand the audio?
1370730087.0,655,DAE have to put their phone back on the home screen before locking it
1367097700.0,654,DAE think sharing earbuds is fucking disgusting?
1300916439.0,659,DAE randomly become overwhelmingly amazed by the weirdness of being alive and sentient?
1314898012.0,654,DAE find some 'flaming' homosexuals a little...obnoxious?
1309201294.0,650,IAE shocked when accidentally turning of Adblock how normal users can endure the Internet?
1285597054.0,650,DAE prefer the studio versions of songs over recordings of live shows?
1309547262.0,651,DAE change their volume to only even numbers or increments of five?
1296579408.0,650,DAE hate when porn has music in the background?
1328053978.0,645,DAE wonder how many famous people in history would have been too busy browsing the internet to make something of themselves?
1300032331.0,652,DAE necessarily skip the BJ part when watching porn?
1370949486.0,651,DAE have weird twitches or body jolts right before they fall asleep?
1345531960.0,642,DAE have handwriting that never seems to stay the same?
1318441455.0,648,"DAE enjoy eating sandwiches with potato chips in them?  Or enjoy non-classical combinations that make a sandwich?  Like peanut butter with onion?  What freaky sandwiches do you make and/or enjoy, Reddit?"
1308329970.0,650,DAE wish that it was harder for people to obtain and *keep* a driver's license in the USA?
1302038517.0,649,DAE squeegee their body off with their hands after showering...?
1299725025.0,645,"DAE think that the term ""African American"" is completely ridiculous?"
1318706593.0,649,DAE take all of their clothes off when they get home from work/school?
1295194006.0,642,DAE Own several pairs of pants but find themselves only ever wearing the same 2 or 3?
1284141261.0,645,"DAE dread taking a shower because they take so damn long, but once you're in the shower you never want to get out?"
1277467323.0,644,DAE not give a shit about IPhones?
1373350811.0,641,"DAE not organise outings cause they feel like they'll be ""responsible"" for the fun of participants?"
1310337192.0,645,HAE never used a fapsock? (Males...and the occasional female)
1269210454.0,649,"DAE always think 1950 if some one says 50 years ago, 1980 for 20 years ago, etc"
1319668863.0,642,"DAE feel bad for the kid that doesn't understand anything in class, but also hates him for holding the class back and spending time going over everything?"
1283979978.0,643,"DAE never click ""I'm feeling lucky"" on Google"
1316295596.0,640,DAE jog across the street when a vehicle has stopped to let you cross?
1289868654.0,641,DAE Compulsively use turn signals even if you're the only car on the road?
1260385815.0,639,DAE always open a link in a new tab?
1368930200.0,644,"DAE love to hang out with people, but don't like to talk?"
1286555698.0,638,DAE look at diamonds/jewelry and see nothing but overpriced shiny rocks?
1313365951.0,639,DAE use headphones as a defense mechanism to avoid talking to strangers?
1306157829.0,639,DAE use the brush on the side of escalators to clean their shoes?
1330981211.0,635,DAE feel like they don't know how to communicate?
1323622639.0,639,Does anyone else regularly experience deja vus in which the experience recalled feels like it contains another deja vu?
1354649185.0,638,DAE count in your head while going up/down stairs
1324402258.0,631,DAE ever see a small business and think that it must be a front for laundering drug money? 
1295753399.0,637,DAE hate sites that won't show shipping costs until the last step of the checkout process?
1287951497.0,628,"DAE see a link and have a good comment, then realize that there are 100+ comments already and give up?"
1287669291.0,632,"DAE feel guilty for not calling a friend in a while, then realize that they haven't made the effort to call either and just say ""fuck it""?"
1329440227.0,628,DAE feel ashamed when they are bored? 
1319680158.0,634,DAE Always try to spell everything right in a text message
1293826420.0,630,DAE think that MTV is absolute trash?
1268328011.0,634,DAE not find MAD TV funny at all?
1301879725.0,626,DAE compulsively disassemble pens?
1327754116.0,630,DAE used to be super shy and are now better?
1260860586.0,629,dae not give two shits about this whole Tiger Woods ordeal?
1286457920.0,632,DAE end up staying up really late without a good reason?
1336831508.0,628,"DAE wish humans didn't need to eat, sleep, or eliminate waste?"
1352417851.0,627,"DAE have trouble sticking to one hobby, and switch 
every month or so?"
1318252660.0,625,"DAE sometimes hear notification-like sounds in music and think someone message them? (Sounds similar to facebook chat notification or Skype, MSN notification sound)"
1312509184.0,629,My birthday is tomorrow. I don't really care. DAE not care about celebrating their birthday?
1289839365.0,626,"DAE still eat and love peanut butter and jelly sandwiches, even though you are an adult?"
1280251330.0,626,DAE feel that printers are almost the least reliable piece of technology ever?
1358687875.0,625,DAE bond with other cars they drive next to during road trips?
1306198691.0,626,HAE had a vivid dream more than 4 years ago that they still remember and think about today?
1265313184.0,626,DAE hate it when someone is watching what your doing on your computer?
1319404909.0,623,DAE imagine what other couples look like having sex?
1314832831.0,621,DAE refuse to hold babies because they are afraid that they are going to drop them?
1308492552.0,629,I just finished the Lord of the Rings for the first time.  It feels like I've just lost a good friend I'll never see again.  DAE experience this after a good book?
1339210917.0,624,DAE find a weird satisfaction with picking the skin off of their lips? 
1319606393.0,618,DAE occasionally grind their teeth softly to make a beat in there mouth?
1300892651.0,624,DAE talk differently depending on who you are speaking to?
1268026394.0,621,"DAE feel absolutely exhausted at 7 pm, then wide awake at 11-12 when they should be going to bed?"
1301936218.0,618,DAE refuse to use texting abbreviations?
1288133000.0,622,"DAE reply with ""What?"" when somebody says something to you, and then instantly realize that you actually DID understand what the person was saying?"
1362331976.0,619,DAE love eating bacon and sausage drizzled/dipped/soaked in syrup?
1288744458.0,622,DAE wish hot sauces printed their Scoville heat rating on the bottle?
1339763635.0,613,DAE feel like the world is out to stop you from reaching your destination when you're running late?
1375505710.0,616,DAE get annoyed when people buy new electronics or things with the plastic film on the screen or whatever and leave it on?
1366274674.0,615,DAE hate it when people tell you that you look really tired?
1362508776.0,611,"DAE take lots of really good notes simply to learn the material, then never refer back to them?"
1277950105.0,616,"DAE actually say ""Yoink!"" out loud when they grab stuff?"
1359381079.0,613,DAE love the sound of dirt being sucked up by the vacuum? 
1356983612.0,614,"DAE find ""New Year's Resolutions"" a bit unnecessary, seeing New Year's as another day, and a resolution shouldn't have to wait until January 1st to be started?"
1299741729.0,617,DAE fuck their boyfriend with a strap-on?
1358798842.0,615,DAE feel like the day is over around 3PM and there's no time left to do anything?
1325611770.0,607,"DAE pop popcorn on the stove top the old fashioned way with just a pot, oil and bagged popcorn? It's so much better than microwave popcorn. "
1306631338.0,613,"DAE keep their ketchup in the refrigerator, but then not have a problem with the warm ketchup at restaurants?"
1300636103.0,613,"DAE loves the way your hair looks after a shower, only to be disappointed when it's dry again?"
1266360890.0,607,DAE not like Anime?
1368799608.0,608,DAE get annoyed when you see the word 'hacked' on every post that is just a suggestion or tip?
1313038300.0,614,"DAE think that TinEye was actually said ""TinyEye"""
1312252950.0,614,DAE hate giving out your email address to people because you've had it forever and now you think it's stupid?
1290836376.0,608,"Men of Reddit, DAE wish all women's clothing stores had seating available? "
1373668969.0,608,"DAE ever say ""ouch"" when something happens but it didn't actually hurt you?"
1362284560.0,609,DAE always browse Reddit in night mode? 
1295884653.0,612,DAE automatically swing their feet like a little kid when sitting in a chair that's too tall for them?
1369829891.0,610,"DAE wake up feeling extremely crappy, even when they haven't done anything to make them feel that way the day/night before?"
1353033032.0,608,DAE feel awkward/irritated when someone walks up behind you while you're on the computer and just stares at your screen?
1343641172.0,606,DAE sometimes lie awake for hours trying to sleep but just keep on thinking &amp; unable to shut your mind off?
1341421514.0,605,"DAE, who lives in America not care that much about celebrating the 4th of July?"
1275453823.0,603,DAE only use the left Shift key?
1374549327.0,604,DAE piss in the side of the toilet so you make less noise?
1269888990.0,606,DAE try to go back to sleep to try to finish their dream?
1343398200.0,609,DAE have dreams where they try to scream but are unable to?
1334426940.0,604,"DAE notice that whenever they say ""excuse me"" to get past someone, they seem to get a negative reaction from the other person?"
1286316529.0,605,DAE think girls seem less attractive once you figure out they smoke?
1341571114.0,599,DAE find it nearly impossible to not pick at your scabs?
1286095514.0,605,"DAE turn the music down when driving so they can ""see better"" when making complex driving decisions?"
1363151234.0,600,DAE sleep/lay with a pillow or blanket inbetween your legs out of pure comfort?
1300304904.0,604,DAE try to put their finger in their dogs mouth when they yawn?
1283705255.0,602,"DAE keep the bills in their wallet in order of value, from smallest at the front to largest at the back?"
1263831710.0,605,DAE actually kind of hate it when salespeople in stores try to help them?
1316374360.0,601,"DAE believe, for some time in their life, that they were the only conscious one among all human beings?"
1327366081.0,597,"DAE wish that video games had an ""I have dogs"" option that would silence in-game barks, doorbells..."
1293035227.0,598,DAE think women look better without makeup?
1316562397.0,599,DAE Have a weird urge to have their spine straightened by being pulled at both ends?
1372148668.0,597,DAE hate when you can taste the smell of the freezer on your ice cubes?
1358865101.0,598,"DAE is good at saving money and making small sacrifices but when you collect enough cash for what you want, you feel really bad about buying it?"
1356484703.0,592,DAE feel like knowing all about the actors and seeing behind the scenes stuff take away from the mystique and enjoyment from watching a movie? 
1303152003.0,595,DAE get that embarrassed feeling for other people when someone does/says something stupid in public?
1285193145.0,594,DAE prefer amateur porn?
1357482509.0,590,DAE like sitting down whenever they take a shower?
1294850379.0,598,"DAE say ""dude"" or ""man"" all the time, especially at work where it's kind of not appropriate?"
1271405776.0,593,"DAE click the ""clear"" button on a calculator multiple times even though only once is necessary "
1334279772.0,590,DAE Not get grossed out by finding hairs in their food?
1322319198.0,597,"DAE think that its ridiculous to answer the phone and hear a recording say ""Please Hold"""
1294076134.0,598,"DAE pronounce FAQ as ""fack?"""
1260258008.0,593,"DAE pronounce ""wed-nes-day"" in their head while spelling out Wednesday?"
1309729790.0,588,DOE feel very hungry if they wake up early but not have the urge to eat for several hours if they wake up past 12?
1327169669.0,593,"DAE wake up every morning with a different, random song stuck in their head?"
1312760084.0,593,"DAE have no idea that the US had a ""credit rating"" until this week?"
1307034207.0,588,DAE think that “Do what you love and the money will follow” is a bunch of bullshit?  I enjoy sitting on my ass and reading comic books. 
1303082594.0,594,"Has anybody else taken a late afternoon nap, and woken up and thought it was the next morning?...."
1302613456.0,588,DAE think music videos can sometimes ruin your mental image of a song?
1330817070.0,590,DAE have that one friend that everybody hates?
1257449292.0,592,"DAE purposefully pee on the side of the toilet bowl instead of in the water, because its quieter?"
1355078754.0,593,DAE like soggy oreos?
1323808072.0,587,DAE Unravel Paperclips habitually?
1272409393.0,589,DAE think parents need to teach their children to cook more?
1345594761.0,588,"Does anyone else own movies on dvd that they never put in, but if the same movie comes on tv you stop and watch it every time?"
1337472917.0,586,DAE like the feeling of mild hunger because it feels like you're losing weight at that moment?
1367538623.0,582,"DAE instinctively pull in their chair whenever someone's about to pass you, even when there's still space?"
1335364311.0,581,"DAE secretly enjoy when automatic doors (elevator, train, subway) shut as a person is running towards them?"
1375727917.0,584,DAE forget to eat ?
1349409913.0,587,Sometimes I sit and try and plan the perfect crime. Does anyone else do this? 
1346935049.0,580,DAE dip the chip straight down into the salsa so as not to get any chunks?
1340936115.0,587,"DAE dislike when people refer to the game as ""paper, rock, scissors,"" instead of ""rock, paper, scissors"""
1293073638.0,585,DAE think it's weird when married couples share email/facebook accounts? 
1292063686.0,583,"DAE never, ever make their bed?"
1283200059.0,583,DAE still pick their nose?
1363313502.0,583,DAE brush their teeth in the shower?
1301288175.0,585,DAE know their theirs/they'res/theres and use them correctly every time?
1295466757.0,583,"DAE wait for the microwave to go down to ""1"" and then hit stop/cancel?"
1277106153.0,584,"DAE still instinctively think of 2000 as the primary base for time measurement (thinking 1980 was 20 years ago, 1970 was 30 years ago etc)?"
1320521659.0,580,DAE dislike the feeling of hand lotion and moisturizer on their skin? 
1303106636.0,581,DAE pee on the side of the toilet to make less noise?
1355680887.0,582,DAE prefer sleeping their significant other's side of the bed because it smells like them?
1311130262.0,584,DAE love Ranch dressing but when you buy a bottle from the store it never tastes as good as it does from restaurants?
1276042846.0,582,DAE (male of course) aim for the inside of the toilet slightly above the water line so to be more quiet in certain situations?
1292097017.0,583,DAE strongly support women's rights but dislike feminists?
1291230310.0,584,DAE look at a word for too long and realize words are weird?
1290450835.0,579,DAE really enjoy broccoli?
1287409113.0,583,IAE grateful Facebook/MySpace/social-networking sites didn't exist during your high school years?
1280127301.0,584,DAE think that Head &amp; Shoulders should come out with a body wash called Knees &amp; Toes?
1276821924.0,582,IAE wearing the same pair of jeans they wore yesterday?
1343542158.0,581,DAE set an alarm an hour to an hour and a half before their actual alarm goes off to prepare yourself to wake up?
1328473314.0,579,DAE shake their leg when they sit down?
1310007254.0,580,"DAE never set their phone to anything but Vibrate, or Max Volume?"
1302381380.0,578,DAE think that cooling lava flows look chewy and delicious?
1288863234.0,576,"DAE often get stuck in a loop when they think about embarassing things, stupid things they did etc. over and over again?"
1368546119.0,580,DAE occasionally sleep where your feet are on the bed just to change things up?
1344366702.0,581,DAE brush their teeth in the shower?
1325640764.0,580,DAE never like any pictures of themselves?
1288017142.0,578,"DAE hate it when you think you've found the perfect parking spot, only to realize that it's just a tiny car hidden behind a larger one?"
1264115791.0,583,"DAE find cute girls to be way more attractive than hot, sexy, pretty, or beautiful girls?"
1372000073.0,574,DAE Enjoy picking off dead skin?
1284621535.0,580,DAE text with correct grammar and punctuation?
1323675911.0,574,DAE think Good Guy Greg actually looks like he could potentially be a real dick instead of a good guy?
1368223562.0,579,"DAE tell your friends some ""lame excuse"" on why you can't go out, but in reality you just don't feel like it or don't want to?"
1339958613.0,575,DAE feel itchy after they spot an insect in the room and see it dissappear later?
1329152482.0,568,"DAE think that if someone from the 1950s were to time travel to present day they'd be pretty surprised/disappointed by the lack of obvious changes?
"
1305582090.0,573,DAE feel kind of sad trying to explain new technology to old people?
1290893069.0,571,"DAE talk to their pet? Not a command or praise, but just a comment or two as if they would understand and respond. Tell them about your day, express your frustration about work, ask them a rhetorical question about life, and so on..."
1354591113.0,573,"DAE constantly see silhouettes of people out of the corner of their eye, even when no one is there?"
1349745223.0,575,DAE have a horrible memory of your own life?
1339157120.0,575,"DAE use a rarely used word in conversation or in an internet post or email, and then immediately go look it up online after the fact to confirm they used it right?"
1308671036.0,573,DAE like their Snickers bars cold as fuck?
1283804339.0,567,DAE hate explaining technical stuff because you never know how much knowledge to assume the other person has?
