created_utc,score,title
1374789287.0,2197,Thank You All.
1354482445.0,1983,"Hi, I'm Barry. I edit Game Grumps. Ask me anything!"
1364234526.0,1857,Special Guest Grant Kirkhope - Guest Grumps
1362611786.0,1816,Holy. Shit.
1374176921.0,1717,A personal message from Danny
1372185415.0,1708,God bless america
1361059258.0,1630,Arin's Wedding Day
1353895493.0,1631,I came here just to make this terrible joke.
1363100569.0,1617,Gamecue has the greatest idea ever seen on Game Grump's history...
1372333905.0,1547,"Farewell Jon, from your Source Filmmaker fans"
1364320790.0,1507,"The ""D"" isn't silent..."
1358626238.0,1485,"Intro for the all new show, Arin &amp; Jon!"
1372197505.0,1479,"For the better part of a year, I've fallen asleep and woken up to Game Grumps. Then this happens."
1373836099.0,1453,How has your pee been recently?
1371427434.0,1446,New Challenger Approaching...
1356997359.0,1444,I'm surprised they didn't make a joke about this.
1374072779.0,1437,Game Gramps Finale!
1360197870.0,1413,Sonic '06 Grumpstats (as of part 56)
1366605644.0,1408,GAME GRUMPS THE MOVIE TRAILER - By GregzillaGT
1358607402.0,1370,"I felt like doing something. Some 3D later, and this happened. Game Grumps ftw :&gt;"
1368162097.0,1361,Seeking the owner of Gamegrumps.com
1363888955.0,1341,"3D Game Grumps Animated - You Don't Know, Jon! - by Esquirebob.  Thanks everyone for being a huge inspiration!  "
1375196488.0,1298,I still see him everywhere..
1355608787.0,1297,Gamegrumps.gif
1362681620.0,1274,"3D Game Grumps Animated.  First of many to come, ya know, if you guys like it."
1359504153.0,1270,Space Ace! - JonTron
1365718226.0,1259,Ladies and Gentlemen...PokeAwesome 2!
1364424922.0,1246,"For the love of God, MAKE THIS HAPPEN!"
1359581520.0,1237,The Game Grumps are having a bit of a disagreement
1357551704.0,1213,"I Made the Kirby/Poppy Bros. Plushies for the Grumps, Here's a Pic :3"
1359338250.0,1215,Saw this on the Royal Rumble WWE PPV!
1369584126.0,1216,NEW 'Hey I'm Grump' &amp; 'Not So Grump' Tees!!
1372184251.0,1188,"I think we need to look on the bright side, We still have the best grump."
1374628357.0,1184,"Guys, I think it's about time."
1372971737.0,1177,"What I imagine every time Arin talks about old Grumps, and doesn't mention Jon.."
1373207789.0,1172,Game Gramps 2
1359424234.0,1172,Too slow
1360710327.0,1165,Made this gif. Hope you enjoy it as much as I do.
1358288100.0,1163,Watched the dead space 3 episode... ended up making this.
1368404799.0,1152,THE LIST - and a open letter from the Grumps.
1372327175.0,1152,Petition: Stop Using Not So Grump
1364935412.0,1132,"Colonial Grumps - Jon (If you like, there will be more)"
1370703266.0,1134,The Game Grumps SEQUEL Trailer - by GregzillaGT
1360724918.0,1127,New UpJons and DownEgos for the subreddit
1373467179.0,1106,Mega Grump art [Mega Man 2 Part 3]
1372182435.0,1095,Jon has left game grumps?
1370982177.0,1085,How to ruin ssb4
1371588886.0,1070,Have you finished those Arins?
1372600942.0,1054,the real reason Jon left
1360368114.0,1064,Jontron and Jacques pixel art! [Source in comments]
1354411314.0,1052,Jon and Arin with Barry. 
1363530514.0,1032,cosplay grumps
1353347962.0,1029,Jon Jafari Portrait
1358859892.0,1024,Well that's settled!
1376110518.0,1023,Message to the Game Grumps Subreddit. Please read.
1354447021.0,995,It was Barry's birthday this Saturday.  So I drew this picture of him editing Game Grumps!  Happy Birthday Barry!
1352139084.0,989,It's Sanic Time
1364591830.0,989,"Look at Aladdin! He's just all, ""I'm gettin' the fuck outta here, see you guys later."""
1361314763.0,983,"""You always know the right things to say"" "
1358472606.0,974,Shadow is President Obama.
1365366072.0,968,Colonial Grumps - Arin (thank you all for the nice comments on the last one ^o^)
1366381446.0,967,Zero Punctuation Grumps
1372634192.0,962,The real reason Jon and Arin split
1354767654.0,953,"My first, and most likely only, contribution to Game Grumps [0:10]"
1359819039.0,957,I was strolling past the fresh food store...
1367526364.0,956,Maybe he's born with it...
1372548834.0,954,"""Hey I'm Ripped!"" ""I'm Also Ripped!"""
1367026179.0,946,"No, Jon."
1372454750.0,948,Steam Train - Fan Made Intro
1352576963.0,950,That's my secret... I'm always grumpy.
1375352545.0,941,So Dan is a pretty cool guy
1364251179.0,940,Good guy Barry
1368220039.0,934,I feel like memos would be so much clearer if they were written this way...
1351929786.0,937,He is now one of us...
1350848088.0,929,"Since JonTron loves that Reese Witherspoon joke, I made one just for him"
1369786756.0,925,(CURRENTLY BEING WORKED ON) screenshot from the Game Grumps Sequel Trailer
1367915843.0,924,A... Arin?
1367600704.0,925,Arin's new Animation
1371498646.0,919,Wild Grumps.
1372185657.0,911,4chan on the recent events
1357690855.0,910,On one of Mortemer's videos
1364839597.0,910,Grep Animated - 100 Star Present - by Barry
1373328898.0,905,Game Gramps 3
1364053275.0,904,I couldn't help but make a Downvote GIF of EsquireBob's newest animation
1373668051.0,899,Game Grumps Animated - Last Hurrah - by GregzillaGT
1372297563.0,901,2nd AMA Request: JonTron
1368380767.0,896,How am I supposed to study when this happens?
1372197190.0,893,The whole Danny situation.
1357592948.0,890,Got this signed by the Grumps at MAGFest! New favorite Pokemon card.
1372309947.0,889,He knew all along..
1355859214.0,873,Inside the Grump Room (Album)
1360107073.0,870,Fascinating.
1364066575.0,864,"The ""Naruto copied Cowboy Bebop"" scene Arin mentioned."
1372380118.0,860,Something I wish everyone would realize (Good Guy Arin)
1375305529.0,860,RIP Shrek Forever After and Sonic 06
1359756164.0,859,"I know they stopped playing Pokemon, but I still made them a Dangasskhan"
1374632541.0,852,I changed the upjons to updans to welcome in the newest grump!
1367416109.0,855,What a lovely family photo
1351097485.0,849,The alliance that will unite the Worlds
1376420001.0,850,Kirby's grumpy yarn
1360704705.0,842,"For the consideration of the mods, I give you: Grumpvotes"
1376492742.0,844,Ross definitely has a keeper when this is their wedding cake.
1373898406.0,834,Profound advice from Danny Sexbang
1375255911.0,841,Dan takes one for the children
1365161921.0,840,The Periodic Table
1372366396.0,830,It's that big
1354233521.0,826,"It was made in MS Paint, it isn't exactly perfect or clever, but here's my idea for a Game Grumps T-shirt."
1375478357.0,826,"Had to ask, Dan is easily my favorite grump!"
1374435050.0,824,Grumpbound - an Earthbound/Mother parody starring the Game Grumps!
1356833414.0,821,Can we get this to happen?
1365662912.0,814,Barry the Editor
1353090227.0,813,Scrapped Box-Art for Sonic 06'
1355750743.0,809,Stop. Stop. Stop. Stop. Stop. Stop. 
1355585115.0,805,I think Arin needs to see this (found in DKC instruction manual) 
1373034498.0,806,DANOUTTADAN!
1372195496.0,800,But... this was not the surprise I wanted :(
1372093470.0,798,This is what happened to Trix [Sonic 06 part 108]
1355360582.0,796,Game Grumps have been helping me get through a hard time! Thanks Jon and Arin!
1376603034.0,796,goddammitross
1355677337.0,789,Christmas Greetings
1372199944.0,785,Please Please Please Please Please Please Please Please Please
1365632496.0,782,That embarrassing picture that Arin doesn't want!
1364706799.0,781,wat.
1357163776.0,783,Game Grumps &amp; Gorillaz Crossover (All credit to: http://guy-with-the-hat.tumblr.com/)
1354059317.0,781,"Jon was right, Crisis City = New York City"
1360775624.0,780,I see your schwartz is as big as mine
1367755655.0,778,"Sometimes, Reddit itself makes me laugh more than its content."
1367874701.0,772,Arin hit 1 million subscribers! (Congratulations Egoraptor!)
1370921846.0,770,On this day in Grump history.
1361871246.0,769,"""You guys send us the weirdest shit. I love you all."" - Jon's Twitter"
1369009996.0,767,Jon gets ready for the day
1374917596.0,764,NOW LOADING
1368810158.0,761,A friend and I got a bit carried away in APB...
1351697856.0,764,"My first inmediate thought when Jon mentioned he ""used to work in a movie theater"" on the last Kirby episode."
1366562739.0,758,NBA Motherfucking Jam - Gam Gish Combobulated
1370985885.0,757,"From Twitter: ""The grump family is at e3!!"""
1360727720.0,757,Sonic '06: Scarier than Silent Hill.
1368130977.0,752,Does Jon make salsa?
1356835520.0,754,Dame Grumps: Photo Manipulation Version
1354734126.0,754,Sonic '06: WHAT IS THIS? - PART 20 - Game Grumps
1370258123.0,751,Jon just posted this gif on twitter.
1357803795.0,748,groomp doodles why cuz why not 
1375776059.0,744,My Game Grumps Portrait Set
1372918229.0,747,This is amazing [Seen on Karate Kid - Game Grumps ]
1374748444.0,740,Ross's rly good at recommending games on his Steam account.
1351389554.0,745,Jon and Arin are basically Pain and Panic from Hercules
1374693249.0,743,"I saw that Pacific Rim video on Polaris, and this begged to be made!"
1352327172.0,738,Cute fanart I found of game grumps and two best friends play
1363799498.0,740,Good advice from Ross
1359329751.0,733,I just don't understand
1364389338.0,730,Motivational quote of the year
1359391570.0,735,QualityTime.avi
1366149631.0,738,CQC
1375461784.0,738,The Perfect Couple!
1363721982.0,728,Grumps reference in DLC Quest
1364167101.0,730,It had to be done. I am so sorry.
1364664201.0,725,I made a gamegrumps animooted WITH GIANT ROBOTS! hope you all enjoy~
1371297894.0,727,Found this on google
1376323453.0,720,Hot Pepper Game Review feat. Egoraptor - Monster Hunter 3 Ultimate
1363488679.0,724,The Last Goofsade
1372702147.0,727,How I feel now after watching the recent GameGrumps episodes
1367632140.0,720,The Reason Barry Never Came in When Arin Called.
1351629120.0,719,"""This cracks me up so bad!"" -- The fabled gif Jon mentioned in the latest episode"
1372924483.0,723,"Well, this is a fine pickle!"
1373069827.0,718,I think you could say I'm handling things rather well lately.
1351095877.0,711,"""Oh man, What should I tell Her?"""
1355837798.0,707,"Jon apparently lived in 1811
(Tweeted by Suzy the goose)"
1362253090.0,709,Egoraptor is officially that guy
1352062715.0,704,"Jon requested a GIF of exited enemy in Mario Land 2, so I made this. (GIF)"
1365098459.0,708,"3D Game Grumps Animated - Dirty Platos - by Esquirebob. Arin, I promise you'll have more screen-time in the next one haha."
1360649883.0,706,My GIF of Shadow spinning forever on a conveyer belt
1373731360.0,695,Game Gramps 4
1359437674.0,700,Arin didn't choose the thug life.
1353690684.0,696,ScribbleGrumps
1351580776.0,687,I'm starting to think that these name puns have...
1356990496.0,687,Made a Gamegrumps animation for you guys - Hope you like it:  Beautiful Little Moment
1356557131.0,685,It's no use!
1356186347.0,687,"Sketch of Jon - (If anyone has a good images of the Grumps, I'm up for doing finished portraits :))"
1358204342.0,687,"Hey I'm sick, I'm not so sick..."
1363029368.0,679,Arin's favorite book.
1353431534.0,678,Grump time! (Fanart)
1357082798.0,674,Arin is upset you guys.
1361715590.0,674,Taylor Swift - I Knew You Were Trouble (Egoraptor Edition)
1354042730.0,675,Game Grump Dogs
1372190577.0,674,So I was rewatching some classic JonTron to take my mind off recent events and... God dammit
1367020318.0,668,"Jon, No"
1371549207.0,666,"The Newest, Most Cutting-Edge Grump Consoles"
1365530140.0,662,WIP Gif of My Upcoming Game Grumps SFM Animated
1373051242.0,659,How the fuck did he know this
1372361503.0,664,Jon's girlfriend asks us all to not be rude/tells us she's not why he left
1361760128.0,661,ECCH Grumps - The Game Grumps Supercut No One Was Asking For
1349395160.0,666,New Game Grumps promo art.
1373395215.0,662,The Horrible Truth about Arin's Demise
1355706563.0,659,Arin's type
1369861329.0,665,"I don't know if this belongs here, but Arin was talking about a controversial contestant he was with on the show ""Tester"", and I love how he's the only one who doesn't take it too seriously"
1366298170.0,657,"So this is pretty old, but have some edgy kirby-grumps fanart [Mr. Dooter]"
1366405019.0,659,good old Egoraptor
1364117776.0,660,Happy Birthday Jon!
1363576453.0,646,Grumps 2016. I'll be making an Arin one tomorrow. 
1365612132.0,646,"What are you trying to say, YouTube?"
1368467013.0,649,Now I know why Goof Troop is the best series.
1360545245.0,646,What do you guys think?
1367791222.0,648,Someone requested a happy ass Jon gif from scarabee.
1356362837.0,633,"Have a Groompy Grumpmas, man!"
1362419811.0,637,I found egoraptor's spirit animal!
1372184052.0,633,I think this is more than appropriate for how we all feel right now.
1367368358.0,632,"I'm bad with Photoshop, but did anyone else notice this?"
1372187159.0,631,"Mods, I have one tasteful, simple, request"
1356308102.0,630,Hark! I am grump. - I am lesser grump! - And the two of us form the comedy troupe known as the Game Grumps.
1366853530.0,629,Suzy and Arin drawn post-apocalyptic style
1362447690.0,631,Frosted Flakes are GREAT GREAT GREAT!
1359166580.0,624,I turned Jon and Arin into Animorphs
1357276397.0,628,"Me vs Ego, at MAGFest"
1362777590.0,621,"I used the ""Anything goes Pokedex"" to randomly generate the Grumps as Pokemon and got some interesting results..."
1359557599.0,626,"In lieu of Jon winning the crag, I sent him this!"
1372182485.0,624,Ode to Jon - Game Grumps
1368231784.0,623,New contender for the best fan animation - NINE TAILS BABY by CatFatNG
1350762840.0,624,So I was playing tf2...
1375731247.0,624,Does anyone want to see a video editing tutorial series done by Barry?
1363991013.0,625,Oh... okay
1361162542.0,628,Jon &amp; Arin in 50 years
1359081168.0,622,It's Obvious Who Epic Rap Battles of History Should Feature Next.
1358387158.0,619,USA! USA!
1357250975.0,623,BEST OF BARRY!
1360637404.0,624,"Went to Arin's website, typed /flash in the URL to see if it would bring up a list of all his flash movies. I was wrong..."
1351282913.0,616,Everyone in the world makes good fan content.
1366308030.0,620,"3D Game Grumps Animated - Vgun, More Like Vfun! - by Esquirebob"
1366097554.0,616,Barry's home
1365968080.0,614,"My little bro did this grumps fan art on his 3DS, just thought I'd share it for him"
1359689033.0,617,Hey I actually finished a painting for once
1374506587.0,618,Are we still posting our Grump stickers in action?
1372187104.0,613,So... Jon Jafari for next GuestGrumps?
1373999538.0,608,SFM Game Grumps Animated - War Strategies from episode 1 of Civ V
1354487129.0,610,Arin's Request - Real Hedgehog in Sonic Generations
1359194390.0,607,I laughed my ass off at this.
1375812126.0,608,NEW Game Grumps and Steam Train Shirts!!
1375991303.0,606,The best comment on Game Grumps I've ever read
1350274327.0,608,In honor of GameGrumps Goof Troop era.
1357854556.0,602,Jon doesn't like Roller Coasters
1367166846.0,605,All I Keep Thinking While Watching MMX - Good Grump Arin
1365317510.0,599,Bubba Grump
1358026435.0,602,"Since people are showing off their DSs, figured I'd show this off"
1376380018.0,606,Not 100% how to react to this.
1357877631.0,608,Robotnik's flawless escape in Sonic '06
1357779430.0,605,Here's a comic about when my roommate got back from Japan and we got pizza and whiskey and watched Game Grumps.
1358966891.0,601,Game Grumps - Jon is a Butt - YouTube
1361291351.0,600,"Thanks David, thanks for everything...."
1372050588.0,592,"I'm sorry Jon, but I couldn't help myself..."
1353332484.0,593,"Wasn't feeling so good at work, then this guy shows up! (sorry for bad quality)"
1366483438.0,597,"Bioshock Infinite ""It was pretty neat"" -Arin Hanson"
1375005100.0,598,This could push Danny's Skittle addiction over the edge
1370448125.0,597,Game Grumps Animated - War the Musical - by Egoraptor
1362561858.0,587,Mario Party 2 revengence GIVE ME A BREAK
1354577988.0,593,Someone made a Barry Grump face!
1372269726.0,588,Super Mario Bros. 2: Magic Potions - PART 1 - Game Grumps
1372103594.0,590,A Debate That Will Rage On For Decades
1364435160.0,588,Banjon and Karaptor (by miyomo)
1358707793.0,589,Found a pic from one of Arin's family gatherings
1362512359.0,586,"BARRY! YOU'RE FIRED!! Aka, the first in-grump appearance of the great Barry!"
1354872807.0,588,Gamegrumps arent a fan of the new Youtube
1375970535.0,583,"My name is Mr. Wilson and I'm here to say,"
1374601709.0,591,The legend of Danny
1374259706.0,587,Happy Grumpversary!
1366052983.0,582,Its no use
1363829054.0,586,Ego looks so different with short hair.
1359151965.0,583,My physics book somehow reminds me of the Game Grumps...
1350392228.0,585,All Aboard for Game Grumps!
1369454278.0,582,So my friends were at Anime North as the grumps today. They kept calling me Barry and telling me to do things.
1359277746.0,574,Game Grumps Animated - KAKAROT
1354911040.0,578,"Grumps thought he was being dumb, but I interpreted it a little differently..."
1372361658.0,579,Game Grump's second new show!
1372390722.0,576,The Escapist's Five Stages of Grief Grumpified
1371667640.0,575,"Miles and Jordan from Roosterteeth, rockin' some grumps tees"
1365956233.0,576,I'd watch
1369630040.0,578,Barry To Star In Footloose Reboot
1363701333.0,575,"""JonTron is going to be coming back in a big way soon"""
1369334814.0,573,"I'm rewatching all of game grumps, in order of uploaded videos. I just got to Sonic 2006 Part 1."
1372873447.0,572,Ross' opinion on Danny's Karate Kid skills.
1371365883.0,571,I done did a thing.
1370963044.0,578,"Well, Arin's gonna need a new pair of pants (from the new Super Smash Bros)"
1370804826.0,576,"""BaBOOM!!!!"" This ""amv"" won best in show at a convention I went to this past weekend. It was just, beautiful."
1367325713.0,570,"With the mention of the Bill Nye announcer, I thought I'd present you with this."
1362855734.0,574,Drakkhen - Game Grumps
1360516883.0,574,"It took three minutes to make, but I thought you guys would like it.  Happy Valentine's Day."
1365845407.0,573,IT'S NO USE - SFM Game Grumps Animated - By Crazyhalo
1362875765.0,567,If only he knew... (from Egoraptor's old AMA)
1358119789.0,567,It Seems Shaun Hutchinson Won't Mind If We Win....
1368950587.0,569,Second try! I suck at submitting but look who I ran into at work!
1368125277.0,564,My new favorite Grumps moment.
1376522162.0,565,The Legend Of Danny
1356915399.0,570,Player X wins tic-tac-toe
1358897750.0,563,I think this blue dude takes after Jon...
1358098758.0,561,"Come on, 70 votes and we can at least get 2nd!"
1366818498.0,560,So I was walking through NC State's free expression tunnel and I came across this work of art
1361647941.0,559,Top Shop Grumps
1352703474.0,567,"Princess Elise, octopus face."
1372192332.0,560,In honor of an end to an era.
1372578332.0,563,This is officially the most adorable picture I have ever seen
1365023757.0,561,This is what game grumps is all about.
1373544293.0,555,A little late but...
1374364827.0,557,Quote from Zelda Part 11 that cracked my shit up
1360881134.0,555,"Congratulations on 400,000 subscribers, Jon!"
1374508663.0,550,"I AM GREPTAR, HEAR ME GREP"
1352645548.0,559,Game Show Grumps
1371312244.0,550,Saw Jon on the last day of E3 and asked for a picture. He asked if he could kiss me. I don't think I could have been smiling any harder.
1352422348.0,547,"I haven't touched Reddit for months, but I stopped by to post something my friend asked me to draw."
1366550977.0,548,"Watching old Egoraptor video, I think Jon may have edited the annotations."
1357063172.0,547,"Apparently, Arin was in The Boondocks."
1346617672.0,546,Met this grumpy guy at a bar
1365647618.0,547,Barry in a kimono (Tweeted by PBG)
1362354522.0,547,WHAAAAT?! WHAAAAAAAT!?!?!
1358388318.0,548,And we're the...
1373755311.0,549,Grump-Out!! by ~hfbn2
1362172041.0,543,German conjugation
1365908804.0,544,GG Animated - Grant Kirkhope - My first animation in color. Enjoy!
1369444296.0,539,For just 7 asses a month you can save Arin from the goose!
1369162783.0,537,Arch-rival of the Chinless Wonder!
1361143513.0,541,Here is a picture of what Jon was talking about in Incredible crisis part 3
1353913622.0,540,There has to be a shirt or something made out of this situation
1368288372.0,542,"Saw this on the latest RT Life, when fandoms collide..."
1361483968.0,541,Umm... So this happened.
1354826207.0,536,"Yes Jon, it's entirely Arin's fault you lost."
1365418770.0,537,IT'S OVER GAME GRUMPS IS FINISHED
1362803496.0,536,This quote should be on a shirt or something
1360804318.0,540,This would be the scariest game ever....
1373894226.0,536,The Legend Of Spiarmf fan art
1361465165.0,532,HE KNOWS.
1371760305.0,528,Ok real talk
1368474232.0,529,should I fill my sketchbook with drawings of jon?
1364155009.0,538,"Saw this in a thread on /r/music, thought you all might enjoy it as much as I did."
1372959680.0,532,I found a picture of Danny as a teenager.
1357937399.0,525,"Congrats to the Grumps to 500,000 subscribers!"
1362092828.0,527,"""I feel like I'm actually doing something."""
1357352313.0,532,jon 'n' arin love their lil birdies
1350510207.0,529,I made these and sent them to the Grumps. Did I do good?
1375376525.0,523,Super Mario Sunshine: Let's Go Swimming - PART 1 - Game Grumps
1358262324.0,527,EA revealed new boxart for Dead Space 3
1369151330.0,528,Typing of the Grump
1359857552.0,531,"gg, guys"
1359448743.0,527,Its done!  New JonTron Tomorrow!
1351085849.0,525,Jeopardy Nixon v Dixon v... Larry
1371035364.0,524,Samus Arin
1366563935.0,521,"Game-Ass Grumps - Every single ""____-ass ____"" in the history of Game Grumps. Get a snack, this is a long-ass video."
1360956394.0,523,The first thing I thought when I heard about the meteorite in Russia
1352904697.0,529,Contemplative Jon
1373178961.0,526,"TIL Ninja Brian is actually a theoretical physicist who has held research positions at Harvard University, the Center for Theoretical Physics at MIT, the Institute for Advanced Study, and the University of Michigan."
1350689918.0,524,A Whole New Grump
1352606308.0,524,Thats my secret... I'm not so grumpy.
1372300229.0,523,Quick summery of yesterdays events
1357842129.0,521,Jon &amp; Arin meet Panty &amp; Stocking
1349817411.0,514,Every mario party episode
1367996929.0,518,"Whenever I have a great bad idea, I make this face"
1351187275.0,514,Better Drink My Own This
1372904566.0,516,Why Danny Kicks Ass (And Defies The Laws Of AVGN)
1355086144.0,516,To live in the hearts of those we love is never to die
1366671375.0,509,I see your ps vita skin and give you this
1357147719.0,515,Real talk? Enough with the Arin drama already
1375170182.0,513,All Aboard for Steam Train!
1363629726.0,517,Sonic '06: Jon's Mom - PART 78 - Game Grumps
1368316353.0,510,"They may have been joking, but it was true."
1359078086.0,510,To all you that didn't believe Arin bought a gun...
1357590776.0,512,I hope they die and notice this wonderful bit of dialog next time
1345496935.0,506,My exact reaction when finding out that Game Grumps had a subreddit
1375473731.0,510,Game Grumps Animated - Sad Hoshi - by Esquirebob
1362947057.0,513,A song that speaks to multiple generations.
1360688525.0,512,Grep Shirt! ONE WEEK ONLY!
1356002714.0,507,"When I'm Grump
-Sarsion"
1373604018.0,504,One of the best GG animated
1356747111.0,505,Drew the Grumps on Doodle or Die... was not expecting that...
1358540093.0,506,Stop the senseless bloodshed.
1352499794.0,504,"Goodnight, Sweet Prince"
1357361981.0,504,Inside Jon's Head
1358972242.0,498,"Grep: New 1080p Wallpaper! also, thanks Barry!"
1361243538.0,497,Anyone else embarrassed by more zealous Game Grumps fans?
1360101371.0,499,I made this cause it needed to exist
1373397396.0,496,"NO, ARIN!"
1350263835.0,496,"I drew another comic, based off of the latest Mario Party episode (2) ..."
1373586487.0,499,What I imagine tomorrow to look like
1367630474.0,497,"""He's pooping"""
1356135238.0,496,"I wish to partake in the Grumping of some games, good sirrah"
1370846166.0,493,New Wii Game Coming Soon! (From Mario Golf Part 2)
1372714941.0,492,this is a good piece of news.
1359925593.0,490,Saw this and immediately thought of the Grumps 
1353979044.0,493,Egoraptor's Inception/Chocoholic rant reminded me of this other Egoraptor cartoon...
1364851933.0,496,If you were dating JonTron
1373624409.0,488,I have no words...
1367532945.0,488,3D Game Grumps Animated - We'll Always Have Dreamland - by Esquirebob
1360878361.0,488,A friend of mine handed out grump valentines today. This is the one I got.
1357774067.0,495,Since you asked so kindly...
1352467108.0,490,Jontron?
1367116058.0,489,The Circle of Grump
1355719311.0,483,"In light of new facial hair, I updated the grump's logo"
1351229034.0,490,"Jasmine, shut up!"
1371071695.0,480,I think me and Jon hit it off at the anamanaguchi concert last night.
1370572376.0,487,Egoraptor getting some great advice from Adam Sessler
1368102748.0,480,Epic Grumps
1367697580.0,481,Barry confirmed for sexiest Grump
1356056888.0,491,I Also Thought That The Game Grumps Were A Postal Service
1372359992.0,479,The Game Grumps Timeline (OC)
1356352387.0,481,More Suzy the Goose and Arin art please.
1365614034.0,486,The REAL reason why Jacques bit Jon.
1370224692.0,478,(X Post from /r/gaming) I think the Sequelitis argument has failed
1362015601.0,480,"Boo, Jon!"
1360902875.0,485,"Arin, Are You an Anime, Right Now?"
1364169278.0,481,HAPPY BIRTHDAY JON!!!
1359999815.0,486,"Dilly O'Drien fron ""You Don't Know Jack"" wants to thank the Gane Grunts"
1355326506.0,485,Grump-Ass-Clayface (WIP)
1374383443.0,485,It's no use!
1363209586.0,481,"What is it mickey, what do you see"
1375565209.0,484,Pretentious Mike!
1357417276.0,480,JonTron canceled his Q&amp;A after having to leave Game Grumps signing after feeling ill. Let's wish him a fast and speedy recovery.
1352939167.0,479,Day of the Grumpster
1375600636.0,472,"we get it, Dannys a pretty cool guy for replying to his fans so often. but can we please stop for a while?"
1359327677.0,476,Look for my game grumps inspired sign at the royal rumble tonight!
1354147319.0,477,Grumps: the Drawings: the Movie: the Concept Art: the Drawings: Three.
