created_utc,score,title
1351632480.0,475,"""It's like I really just watched an episode"""
1374927117.0,478,"At a shrine in Nara, Japan, I had but one wish to write on my card to granted when hanged."
1372436766.0,479,Seems Like Arin Is Doing Well
1355350898.0,477,Gravity Grumps!
1359420598.0,472,I also have a boombox with a TV in it.
1357598875.0,476,This Comic Reminds Me Of The Grumps
1355781732.0,477,"Elise might look like Tilda Swinton, but you know who Eggman looks like?...."
1375945422.0,480,Good job Steam Train.
1354939155.0,475,Grumps Grumpinated - Gash Gharst
1364001087.0,478,Did some quick sketches of Porcupine Doctor!
1357513486.0,477,Heard it was Arin's birthday today. 
1373136507.0,476,Dan's hands/thumbs really are FUCKING HUGE!
1359220145.0,469,I decided to Grump up my Desktop. I'm scared to look at it now. 
1357646699.0,474,So...... Arin is the male lead of Pokemon X and Y?
1351903795.0,473,What could have been...
1374358842.0,472,Does God have a flan for me? [Legend of Zelda Part 11]
1364760022.0,470,"""Just a Couple of Grumps"" great fanart!"
1361400651.0,473,Grumps in SWAG.MOV 
1371154427.0,469,"Arin, Barry and the gang to octoarms"
1367428030.0,465,Got a complaint?
1354573562.0,467,A GameGrumps animation you may have missed. All credit to Ninavolt2010
1372996537.0,463,Putting Danny's head on Crush
1369317164.0,472,Reading through Ego's old AMA...
1361984873.0,463,"Hey Jon, what 'cha thinking about? "
1351303109.0,470,"Well, that was a load of shit"
1350574598.0,468,Grump Fiction
1373502255.0,459,Happy birthday to Grant Kirkhope!
1373317707.0,464,Game Grumps Animated: Ash Man (Arin &amp; Danny)
1372378635.0,462,Ross tweeted this and Barry retweeted it. Consider my Game Grumps depression gone.
1372200673.0,463,"Found this on the Grump Facebook page. Guy in red has a job at Rodeo Arcade listed in his profile. Rodeo Arcade is the place that does their shirts, obviously this can't be verified 100%."
1370107000.0,467,I was playing Tera with my friend when I saw this NPC
1369897170.0,464,So last month I met Arin at work and he asked if we could get a picture together so he could put it on Twitter. His dad then took another one of us. Nicest people ever!
1372304783.0,466,Only one thing to do now...
1368895109.0,464,"Arin in ""Kojima Changes Snakes Voice"""
1361487726.0,464,Naughty Bear: Right to Bear Arms - PART 2 - Game Grumps
1360279781.0,465,Is there anyone else on this subreddit that would deeply love to seem them play this?
1367862491.0,461,My late Fan Art entry for Cabin in the Attic
1366001555.0,461,"Jon finally acknowledges a blog literally called ""Jontron still hasn't noticed me"""
1363917895.0,461,Arin and Jon are so kawaii!
1353821247.0,465,I'm starting to get worried about Arin...
1350184343.0,465,"I hope this is a repost (searched the url and found nothing) Fuck, I, moves in. (has this sub not seen this?)"
1350179099.0,460,Game Grumps secret to success.
1369094267.0,459,The hero we deserve
1360688748.0,463,Lightsaber Fightsaber - Episode V
1358325306.0,458,Wuzzat? You didn't like the Dead Space review?
1359939787.0,455,"Jon is love, Jon is life"
1360123260.0,459,Bane's life lessons
1350079180.0,462,Doesn't Jon Tron look a bit like Professor Birch?
1376369261.0,454,I made a new Game Grumps Banner
1375418448.0,450,Checked out some of Danny's videos. He is my favorite grump now
1358041811.0,456,How Sonic's story should have ended in '06
1367979796.0,453,Gotta love the diversity in the comments section
1358644088.0,450,"ATTN: John and Arin, please do parodies of each other's channels"
1375909327.0,453,Dennis the Menace - Game Grumps
1375418190.0,451,"F*** the Police, I'm on Vacation!"
1363907960.0,452,Was browsing another site when I found this
1358752692.0,454,I just... I can't.
1368350446.0,452,This was the only card in the deck with this decal on it
1361145612.0,452,ZONEsama on Game Grumps
1355959148.0,452,The day GoomGroomps almost ended :(
1374961396.0,449,Barry the Unicorn
1356630709.0,451,You've wasted so much of my time.
1361038039.0,447,Unflattering Grumpyoncé
1358809446.0,448,Nickelodeon Guts: The Trial of the Century - PART 1 - Game Grumps VS
1374166926.0,445,Mickey Mousecapade - Game Grumps
1367216269.0,452,I manage to finally finish! Thank to all the Lovelies help~
1357474200.0,443,"Happy Birthday Arin!... Wait, Jon ?"
1363743857.0,440,I'm giddy as a school girl.
1351988009.0,444,Tricky-ass fly
1376557997.0,442,"So here's a rather spectacular image of Arin, Ross, Jon &amp; PBG on what appears to be a log flume!"
1367705386.0,446,Giddyup!
1374842489.0,439,If Arin was a seal
1360996163.0,440,If Arin was a woman
1360109261.0,439,Sir Dan's dance
1357943925.0,443,In the not too distant future...
1357740898.0,442,Arin is so photogenic
1360428954.0,441,I found the bird.
1361910479.0,441,Coming Soon...
1365720994.0,433,The last 3 seconds of Pokeawesome 2
1361760960.0,436,Rollin around at the speed of [DIVIDE BY ZERO ERROR]
1361577160.0,440,How well do Arin and Jon get along?
1359913222.0,435,Made some fanart using Garry's mod.
1352506155.0,441,Some shitty-ass parent..
1376159037.0,431,By the year 201X...
1372853777.0,432,"So one of my friends drew this, ahem, dramatisation of me last week...."
1366940655.0,435,"For fuck's sake Jon, READ THE GAME MENUS."
1363440339.0,434,"Congrats to Flannelson! Who just got accepted into the CalArts Character Animation program. With CalArts being one of the biggest animation schools in the world, this is huge. Break a leg Flannelson!"
1361838932.0,434,I made an account just to post this.  Thought I'd share.
1359925446.0,437,Game Grumps Animated - Kirby Ruins Friendships - by Flannelson
1356657644.0,437,One can only dream
1355880409.0,437,You're being timed
1356425197.0,437,Got a copy of Animal Crossing: City Folk today. Had some fun with Nook's errands.
1376346460.0,427,Composition of Danny (Super Castlevania IV ep 4)
1367283870.0,433,"While playing Scribblenauts Unlimited, Never go anywhere without your JonTron!"
1365630084.0,430,"Egoraptor: ""I'm happy to announce that Egoraptor is currently very happy."""
1359569222.0,433,Sistine Chapel Grumps
1351444248.0,433,"I heard how much the guys liked Disney, so I sent them a little present.... "
1370338844.0,430,League of Legends Egoraptor voice-over mod for Ryze
1362007392.0,436,We Jammin!
1359167661.0,428,It was an abomination. 
1375640668.0,430,"Danny, Ninja Brian, and OneyG: Best Pals 5ever"
1368575943.0,435,There is a hidden Vs mode in MISTER MOSQUITO
1358973707.0,427,The Many Jons
1347507635.0,428,"Found this in my physics textbook, nearly peed myself"
1372820572.0,428,His mystical face protects my town. (Animal Crossing: New Leaf)
1352246088.0,429,artistic representation of the comments in the new sonic video
1365265330.0,430,GG Animated: Nut God - I felt like animating this. Enjoy!
1355160667.0,426,IT'S SANIC TIME!!
1352670499.0,427,He better hold R1!
1358560947.0,425,Shadow '06 in a nutshell
1357170652.0,427,My views on the constant Arin VS Sonic Adventure 2 battle
1351180977.0,422,We All Feel Similarly. 
1372198966.0,423,"After a few days of being off my computer, I forgot this was my wallpaper. 'Scuse me while I go cry."
1360727235.0,429,The shampoo is strong with this one....
1356341574.0,419,Which one of you jerks make me momentarily die from reading this?
1355445509.0,421,I made this for the Grumps! It's the Groomp Grammies Logo etched into wood by a laser!
1375285754.0,421,"Me Chinese, me play joke,"
1349723479.0,419,The Grumps
1371398386.0,420,Hotline Grep
1375840780.0,418,"Hey guys, are you filming a commercial?"
1363033782.0,418,Sleepy Jon is a Silly Jon
1358724730.0,416,What scene should I animate first?
1358363064.0,416,"Congratulations Grumps, on Getting 100 000 000 views!"
1357448884.0,420,Jon and his Leprechaun trap. 
1367770843.0,414,jon please
1352679129.0,421,Anyone Else?
1361300936.0,418,Do Not Be So Quick To Judge...
1369873654.0,421,i really like the home decor
1369250508.0,415,"Oops! My hand slipped, here's some fanart."
1361928084.0,416,Nice line up... uhh..
1362072401.0,413,National Maraca Tournament. 
1362450212.0,416,Arin's face is a mystery
1355250094.0,411,Some really talented kids over on the Miiverse...
1376035989.0,414,Gosh Dang Grumpy (Experimenting with a new art style)
1363115402.0,411,"Taking inspiration from Jon's sleepy tweet, I made a Sweet Bro and Hella Jeff styled comic of the Grumps."
1360798406.0,412,Jonfartinginarinsface.gif
1364658345.0,413,She so silly.
1351798870.0,406,FUCKIN BARRY
1372497803.0,411,"Well, at least I got a goodbye hug from Jon at E3."
1363128480.0,411,Real Talk: Just because you don't like a comment doesn't make it spam
1373120727.0,403,I couldn't resist.
1356142991.0,404,"Three fucking like Mormon kids, a jiggling Sonic, and a bald motherfucking eagle. "
1369092686.0,412,Look look I made one too! haha
1365648833.0,412,Best comment I've seen in days
1360164583.0,408,New wallpaper from EpicFaceFist!
1356043261.0,408,I get the best Christmas gifts.
1370186192.0,407,Went to a local gaming convention not expecting much. Found Typing of the Dead on the only Sega Dreamcast there.
1363058503.0,408,CHIN GUESSING GAME
1376425114.0,399,What Egoraptor REALLY thinks the controls for Super Mario Sunshine are
1356483496.0,400,"Look at this Dang ass family, Arin."
1355531837.0,406,Sega President and Sonic 06
1355097243.0,404,Sometimes I just wish Jon and Arin had better observational skills...
1360018620.0,402,Heads up: there's a fake gamegrumps channel on YouTube now: 'gamegrumpsofficial'
1370647443.0,395,Game Grumps Revolution - OUT NOW!!!
1376195160.0,401,Sweet Dan and Hella Arin [Mario Sunshine Ep. 9-10]
1375137548.0,399,Idea for the next Great Steam Train Robbery...
1365345330.0,396,I found a Grep store in Kanazawa this weekend.
1372394378.0,401,Barry confirms that all Game Grumps episodes with Jon have already been uploaded. =(
1373130786.0,396,This is something I felt I had to make. Game Grumps - A tribute to the show and the community.
1354670014.0,392,Dat upload pattern
1353527549.0,401,Geometry 101
1350351390.0,390,He had fun once ...
1370548972.0,395,"Some helpful tips for Jon and Arin playing Stretch Panic [Please Read This, Jon &amp; Arin] (WARNING: HUGE WALLS OF TEXT)"
1355077676.0,395,Biggest Game Grumps Fan Ever Much?
1372185714.0,394,"I like Danny actually, but dat intro's gotta go yo."
1366928429.0,399,How do I diagonal?
1365458526.0,393,Sonic '06: Catharsis - PART 85 - Game Grumps
1363118925.0,392,Nice to see Jon and Arin getting in the habit of finishing games
1376061158.0,397,"Spotted at Papers, Please!"
1375105996.0,397,Danny answered back to this question I messaged to him. So now I bring it over to all of you
1374865447.0,397,FTL - Steam Train
1366306739.0,392,I nearly had a spit take when I stumbled across this on 4chan a long time ago.
1364993939.0,394,Animation from the Tumblr page; Quite well made with good animation.
1361333442.0,392,"Thought I would share
(Sorry, don't know the original artist)"
1359306273.0,397,Saw this and it reminded me of the grumps.
1355190475.0,394,Jon chugging Gatorade 
1351476528.0,391,What I imagined when Jon mentioned Notch following him on twitter and not Arin.
1346532327.0,388,Shit Egoraptor...
1371593742.0,393,I made this thing
1366150879.0,394,Adolf Hitler's Great Nephew (who lives in the US) owns the rights to Mein Kamf and all the proceeds go to the national Jewish Memorial Organization
1361302654.0,389,maybe the best Chrome extension
1354651123.0,395,Thank you.
1354136986.0,395,"Since Jon wasn't creative with his joke, I won't be creative with my fan art."
1361238812.0,391,Grump fans after the latest episode
1358258766.0,393,Dead Space 3 - Game Grumps
1376438295.0,390,You know what's better than Grep?
1361592449.0,394,"I know Jon's a big fan of the Continue show. So, I threw this together."
1374508479.0,390,Game Grumps Animated - Black Bellied Budapest
1354210789.0,391,Found something in Kingdom Hearts...
1351172731.0,389,Welcome to Game Grumps!
1371728373.0,392,Jon hit half a million subscribers overnight! Congratulations Jon!
1370383905.0,387,Gangster Barry and PBG says hi.
1355838864.0,385,Do you even grump?
1352730073.0,388,"I'm gonna get an ass shaped tattoo, with an ass on it, and I'm gonna get it right on my ass."
1366128187.0,392,"I know it's super late, but here's some Grump pics from MagFest"
1365387408.0,390,"I saw Swadloon from Pokemon Black and White, and this was the first thing I thought of."
1372115244.0,392,Fat Tyra
1369858976.0,383,I almost believed this comment was real...
1359260850.0,390,I think the Grumps have been playing a little too much Sonic.
1352758639.0,386,so I drew Arin like Cyndi Lauper...
1365804126.0,387,Zelda A Link to the Past: Groomp's Return - PART 8 - Game Grumps
1363762440.0,390,I laughed so hard at the tag line.
1368062826.0,385,Jon+Arin 4Ever
1359234838.0,379,"Uh, thanks google.  "
1360608855.0,388,Why Youtube?
1360556630.0,383,Game Grumps: The Movie
1368238039.0,380,Heh....wait a sec --
1368042605.0,384,As good of an excuse as any...
1376168634.0,380,"Finished up No Time To Explain and found the name of this handsome, wealthy gentleman in the Kickstarter credits. Thanks to him for helping to fund a great game!"
1372516249.0,386,This has been my phone background for about 7+ months.
1361742528.0,386,Any video after being mentioned by Game Grumps
1353557426.0,380,Something Looks familiar...
1373077508.0,380,"hey lovelies, made a new cartoon! it's kinda rough round the edges oh well lol"
1359538147.0,379,Far out
1365758630.0,375,J-...just no... stop. This is cra-... NO MORE YOUTUBE COMMENTS! (I need a hug...)
1354400251.0,381,Ohh Jon you screen-looker you
1368919122.0,379,"""I don't care if she's 11"" -Jon Jafari"
1363831631.0,381,"Grumps 2016 part 2. vote arin, he promises chins for all"
1359593250.0,381,I made a new downvote gif for you guys...use it wisely.
1358813346.0,374,Game Grumps and Skate 3
1354976196.0,375,I've updated my Facebook quotes. 
1351417855.0,382,"Rather than go with the Jafar joke, I went with this."
1351396902.0,374,High-School JonTron and friends performing their interpretation of Beowulf
1359860285.0,376,"Challenger Approaching: GARSHTOSTILES!
(oc)"
1355434420.0,382,Ar(in high school)
1353381064.0,380,I found this at school.  I must find this person
1357168281.0,369,I found the Don.
1353292219.0,375,I just realized Egoraptors face is the same as Lemons in Lemon 'n Bill
1352140733.0,377,Custom bead sprites of the grumps... wonder if they'd like them??
1349631977.0,374,Game Grumps as Anime Characters [dA]
1367272826.0,369,I've watched the episodes more than once......
1366654144.0,374,oopsy doops
1355282089.0,377,Poster Grumps
1371714312.0,377,Jon in a Nutshell
1369100733.0,369,Was at Toys r us and look what I found.
1373396766.0,366,Civilization V: Brave New World - PART 1 - Steam Train
1372804727.0,373,All you ever need to know about Mr. Sexbang.
1369592796.0,370,It's a Barry dancing! [New Grump Tees Ad]
1359054875.0,367,"Thanks to GameGrumps, I'm finally able to fully appreciate this comic"
1363772319.0,372,Arin has apologized for the lack of content outside of Game Grumps.  
1360633194.0,371,Anyone want this GIF of Shadow from the latest Sonic '06 episode?
1361692433.0,373,I doodled a Jontron
1358085767.0,371,Grumpworld
1356921155.0,374,Jon the Train Wreck
1369700928.0,369,I didn't realize what I had in my fridge was so rare
1360798497.0,372,"Please, no-one show this to either of them."
1357676008.0,372,I think I see what Jon is talking about
1352771046.0,365,7 Asses Shirt!  ONE WEEK ONLY!
1351788999.0,367,"I decided to make some Game Grumps Miis of my own, but based off their logo icons. "
1372186534.0,364,I think we're allowed SOME time to freak out about this new development...
1364498733.0,366,"Now that they can play Genesis games, I feel like sending this game their way..."
1363586965.0,365,Existential Goofy...Kinda Wish The Grumps Would Have Addressed This...
1360340976.0,362,[X-POST from /r/gaming] The grump challenge
1358666486.0,368,Arin's $260 Captain America figure. Its eyes are real as fuck.
1374515408.0,362,Arin's Favorite Picture of Himself (Mentioned In Journey to Silius Part 3)
1373235498.0,366,"CONFIRMED BY JON: Officially states ""I live in New York."""
1367263189.0,366,Ego Man
1363733798.0,365,The Sonic '06 playthrough is longer than The Lord of the Rings Extended Edition Trilogy.
1359487914.0,362,"Only half Persian, Arin... "
1354662874.0,366,Have you ever wondered?
1370304126.0,363,We're Building a Giant Robot For Pacific Rim!
1375322455.0,361,Game Grumps Animated - Tom Crook by AncoPro
1375124140.0,366,I too got a respond from Dan. Really cool guy if you ask me.
1365795007.0,364,It's a metaphor!
1365544936.0,362,Made this when the grumps played one of my favorite games for SNES.
1376335581.0,363,I'd say I'm at least 84% cool.
1375572784.0,363,Danny looks like a young Charles Manson
1362927241.0,358,My First Game Grumps Animation
1357408532.0,362,EGORAPTOR IS CHEATING ON JONTRON
1374158475.0,360,Monsters Grumpiversity
1357280927.0,360,"Arin, Jon, and Barry! Artist credit in comments"
1355264512.0,364,I'm not sure if they noticed this or not... Are there other instances like these?
1351375326.0,363,Mary-Kate and Ashley: Sweet 16 - Licensed to Drive - Game Grumps
1373154072.0,364,I'm officially that guy.
1365792087.0,356,IT'S PARTY TIME
1358602455.0,361,My hand slipped and drew a Jonathon Tronathon
1357519943.0,358,"Jon, Arin and friends at Magfest"
1375931546.0,358,[Dennis the Menace] Side by Side comparison of Mr. Wilson and Saddam Hussein
1372351607.0,360,The amount of people that subscribed to JonTronShow after the announcement.
1360851254.0,360,I'm honestly afraid to post anything here
1356708520.0,354,WARNING: Someone is trying to take people's passwords under the guise of a /r/gamegrumps mod. NEVER TELL ANYBODY YOUR PASSWORD.
1374495916.0,358,Thank you Arin for your art &lt;3
1372765761.0,352,PBG knows too.
1365663622.0,357,I was browsing for porn and...(NSFW)
1356899928.0,357,Just got my hands on this. Still in the plastic. Think the Grumps might want it?
1359135014.0,351,GAME GRUMPS ANIMATED - STASIS THE DRILL - YouTube
1355438358.0,356,SANIC.
1363969680.0,351,Steam Key giveaway (65 games)
1351882508.0,354,Lucky number seven
1355640527.0,356,Arin's dream girl
1354383436.0,352,Game Grumps Animated - Sonic's Big Ass Head
1352422405.0,353,"this way, I can bring the Grumps with me everywhere"
1374978516.0,350,"Damn, Arin. You sexy, girl."
1373178237.0,355,JonTron confirms that he has moved to New York for 'business reasons'
1369845109.0,356,So they totally missed this while they were listening to Jon's phone vibrate. [Typing of the Dead Part 4]
1354653247.0,349,Stationary-ass Baloo GIF (as requested)
1376356516.0,353,EGORAPTOR SEX TAPE LEAKED [NSFW]
1372591818.0,354,Where in the World is Jonathan Jafari?
1365660122.0,350,Suzy and Arin cosplaying as Meryl and Snake
1352640090.0,351,Could you please stop sending so many games?
1352163662.0,349,What I first thought when they said Grumplings...
1372616966.0,346,Jontron did NOT move to New York! [PROOF!]
1371136410.0,349,Paranormal ECHtivity: BARRY INCLUDED
1363561001.0,347,Barry doing math
1355498404.0,350,Arin Leaves - Game Grumps 3D Fan Animation
1350004565.0,349,DK gets some bad news
1363382116.0,346,One grump Down. One more to go. 
1358190126.0,345,Sonic '06: The Shadow Campaign - PART 42 - Game Grumps
1374180181.0,344,Ehh... I don't think Dan is going to be an athlete... [The Legend of Zelda - PART 8]
1372325771.0,345,Sent Dan a message via FB to ultimately say I understand. He replied. Top guy.
1356736231.0,348,Game Grumps Animated - Crime Grumps
1372187045.0,343,People focused on Danny too much in the new intro to realize Arin's highlights
1357997113.0,345,Look at this Dang-Ass Game
1347330877.0,344,"True Friendship (Zombies Ate My Neighbours Pt. 2, 3:22)"
1369589578.0,349,CALL IN NOW! (gif)
1362937936.0,339,I'm really glad he changed his mind on this one!
1353783982.0,348,When I saw the post of someone buying a Giorgio Armani suit at Goodwill for $7.
1352984967.0,338,Dude! Why wasn't Egoraptor at the party?
1375916954.0,341,Is it just me or does Mr. Wilson look like a pedophile Saddam Hussein? [Dennis the Menace]
1366716105.0,344,So I made the Game Grumps Logo in Animal Crossing City Folk
1352855862.0,343,alternatively: The Grumps Brothers 
1376087226.0,341,This is one of my favourite quotes from the show and by Jon so I made this as an ode to Jon leaving
1367451265.0,342,"Fuckin' Larry, man. (From tonight's episode of Jeopardy!)"
1363829818.0,342,"Great idea for charity: What if Arin, Jon, and Barry signed the excess copies of games that people send, sold them on eBay, and then donated the proceeds to Child's Play?"
1358310688.0,345,Max tells it how it is [Dead Space 3 episode]
1373737660.0,342,"Skittles know their consumers. (Megaman 2, Part 10)"
1372183327.0,343,Mike Tyson's Punch-Out!!: Around the World - PART 1 - Game Grumps
1362182383.0,339,8-Bit Grumps!
1354115759.0,339,Game Grumps Animated - I Once Went to an Acropolis
1351032377.0,339,Game Grumps - Rage Quit
1368659900.0,334,Jontron Alarm Clock
1357520633.0,341,Grump Cats!
1373142405.0,336,"Ever wanted to see Little Mac become Little Dan? Here, have some quick sprites of him."
1365306583.0,340,JonTronGuy
1361327601.0,338,r/gamegrumps the past two days.
1351756720.0,334,I tried my face at being Grump for Halloween.  Alas I do not have such luxurious hair.
1369415116.0,339,Suzy does Arin's make-up!
1368843067.0,339,Favorite Jon moment
1361413093.0,337,This needs to be here
1353110622.0,340,In case any of you wanted to know what Jon and Arin's baby would look like...
1376278979.0,331,I wound up drawing Ross today
1370818337.0,338,Game Grumps Season 1 DVD Mock-up
1360613777.0,335,The Majestic Manatee Crayon
1360284122.0,335,"what if alternate universe future old versions of Arin, Barry &amp; Jon?!"
1354062511.0,336,Found Arin
1353211187.0,340,Look at this dang ass cake! : Game Grumps Theme! 
1373251364.0,333,My girlfriend got me some custom made GrumpCakes for my birthday. Nailed it.
1369954986.0,329,I can't stop drawing them.
1357766590.0,334,just jon snooping around 
1354821914.0,334,Looks like the Grumps finally got their revenge on Dr. Eggman.
1373785453.0,333,I'm pressing X as hard as I can!
1366943000.0,336,A Song of ECKH and Fire Book One: A Game of Grumps
1360546726.0,329,My new favorite Grump animation!
1352011769.0,328,Grumps: the Drawings: the Movie: the Concept Art: the Drawings: Two.
1374192647.0,332,Game Grumps - One Year
1359917394.0,335,I was looking for PS2 games when suddenly...
1356693009.0,331,"Soon. -from Mario Party 8, Part 2."
1361477053.0,332,Shrek Grumps
1352576743.0,329,Hey it's game grumps... coming over to play.
1351212131.0,332,Something the Aladdin finale reminded me to do
1363630595.0,330,This made me reconsider Arin's Homelife.
1359703901.0,328,e4io has seen some shit
1356505761.0,331,Holy shit... Joss Whedon is a Game Grumps fan!
1354617104.0,329,I've fixed the dugtrio grump picture.
1353636241.0,328,"Every ""next time on Game Grumps"" gag in one video."
1353230588.0,329,We've Never Slept Together Have We? 
1352159285.0,326,Myth: BUSTED
1351084245.0,331,When Jon and Arin realized how to use copy abilities...
1351471313.0,330,look jon got a gullgull
1374685327.0,329,Journey to Silius: Sad Hoshi - PART 5 - Game Grumps
1374503240.0,323,I feared this day would come
1366318918.0,325,This is what I imagine of what Jon does all day.
1360253622.0,325,Arin mentioned Game Grumps board games in one of his MAGfest panels... Anyone else want to see this?
1352403924.0,331,In case you missed it...
1350949591.0,323,It will never be unseen.
1376095921.0,323,Totally Not So Grumpy (Danny Fanart)
1368476495.0,327,Mr. Grumpsquito
1363571267.0,325,Noticed something on the Grumps' twitter today.
1363054056.0,325,JonTron in high school
1362677006.0,327,"""How dare you..."""
1361653005.0,323,"Youtuber 'Ekruteak' stole my Game Grumps animation, got more views than I did...so please support my original video. Thank you."
1360380477.0,326,In light of Jon's fairly recent rant about new Dante.
1359395779.0,325,A few more Game Grumps Animorphs (now with Barry!)
1354245734.0,328,Saw this on Tumblr. 
1353473930.0,322,Went to a local convention on a whim and ended up hanging out with this guy! I can die happy now.
1375548481.0,319,Most Brutal Metal Scream 2012 (feat. Egoraptor)
1375285343.0,327,I made a Mike Caruba compilation..
1362614814.0,325,"Feels like a bit of a low blow there, Stabby"
1358785342.0,327,Since everyone's making comparisons to Drake &amp; Josh...
1374325152.0,323,Grump Vision: Better than people vision
1368708836.0,323,GASH GHARST
1365209742.0,320,My Super Advantage signed by my 3 favorite grumps
1351206300.0,323,The Disney princesses kissing thing Jon talked about in Aladdin Final Episode
1373437988.0,324,"The Grump Consul of Japan. From Civ V steam train pt 1, a really quick drawing"
1366140878.0,317,"I searched up Nixon, Dixon, and Larry and this shows up."
1353861829.0,325,"Doesn't Arin say ""dude"" alot dood?"
1370135306.0,318,"Went to my local barcade, played Space Ace!...Never doing that AGAIN!"
1359918126.0,323,You Don't Know Jack: Supreme Vitamins - PART 1 - Game Grumps
1357342957.0,316,At magfest w/my wife and a guy who's nooooooot so grump!!!
1356380643.0,325,I think I'll be using this from now on whenever the need comes
1352528951.0,324,Quick caricature of the Grumps
1362851673.0,324,Jon in 60 years. (x-post from /r/wheredidthesodago)
1358639001.0,324,Shadow's such a genius. 
1375824242.0,317,god dammit ross
1358978335.0,319,Sega really dropped the ball on that one. 
1375806484.0,316,Arin Handsome
1373348654.0,320,"Now that things have calmed down, let's laugh at the situation a lil' bit?"
1372470770.0,322,Game Grumps Animated - IT'S NO USE
1369003827.0,321,"Arin ""Egoraptor's"" Lawn Mower Man"
