created_utc,score,title
1357754542.0,320,Arin performs a song at the Sleazy Grump.
1376323805.0,320,Steam Train Robbery [SFM poster]
1374890465.0,320,i made a gif of jon spinning from the xmas shirts video
1353268859.0,322,Arin that's too much spaghetti
1370012411.0,314,Had some fun in mspaint last night
1352708999.0,314,My drawing for game grump fan art day. Figured I'd share with you guys
1369087326.0,313,The Typing of the Dead: Fast Fingers - PART 1 - Game Grumps
1355780249.0,316,Game grumps: What I'm willing to put up with - Sfm - YouTube (one of the best SFM ones I've seen)
1373900594.0,314,Game Grumps Animated: Ashman
1359658925.0,316,Naruto Shippuden Ultimate Ninja Storm Generations: Chakra - PART 2 - Game Grumps VS
1351465308.0,314,"""Erin-Kate and Jane Sweet 16 Licensed to Drive"" just came out for GS7"
1350333715.0,317,Someone stop Thwomp
1368897875.0,313,THX Grumps
1358558311.0,310,Game Grumps Animated: Blue-Backed Robin - YouTube
1358458342.0,314,The Creation of Arin
1371206152.0,314,Grumps Grumpinating; a preview.
1361547926.0,310,"My stepson LOVES the intro to game grumps, so we recorded it. :) He even intoduces his marbles like Jon might, lol."
1357777455.0,310,Whenever I hear Jon singing.
1365704301.0,306,"Uh, Arin? I think you might wanna check on Slippy..."
1361165794.0,307,Sketch: One Piece - Arin's House
1358391476.0,306,Sonic 06's horrible-ass camera. 
1355897996.0,309,"We already have a historical Jon, how about a historical Arin?"
1372316493.0,308,The 5 Stages of Grump Loss
1365125673.0,308,A top secret look at Barry's editing process.
1362487857.0,308,Unconditional love.
1360895493.0,303,Instant wallpaper.
1356797512.0,309,Ego's emotional speech
1353901366.0,310,G.I. JonTron
1357406593.0,309,GameGrumps' MAGfest panel
1376601021.0,302,Welcome back to Drump!
1363016355.0,307,He'll save everyone of us
1361321282.0,302,PLEASE CONTAIN ALL NAUGHTY BEAR DRAMA AND TEARS IN THIS THREAD
1352932262.0,310,Contemplative Face Swap
1352152962.0,308,Weird association my mind makes
1351605099.0,311,PSA: Double meaning name posts will now be removed.
1371166636.0,305,I Re-Made the Paranormal Echtivity Poster.
1370374281.0,303,Not looking good for Sonic Cannon :(
1363902308.0,305,Everybody Hates Jon 
1359092475.0,305,I made a GREP VS logo!
1357142146.0,310,Go to Hell - Sarsion
1354488100.0,303,They both cheated.
1352438628.0,308,I can't believe Arin mentioned my favorite game! I'll always prefer the Japanese version.
1372714783.0,304,"Jon and Barry preform ""Hey Beowolf"""
1357756874.0,305,Arin's gotta fucking draw Jon
1353441992.0,301,Poké Grumps! 
1358730926.0,305,"""What face?"""
1358192961.0,300,"Excuse me, the president of WHAT?"
1355612890.0,304,Tenouttaten Shirt! ONE WEEK ONLY!
1372445586.0,302,Super Game Grumps Vs.
1369366914.0,305,From Glover: 2. Be afraid
1367503853.0,302,Grant Kirkhope will be the composer for the Castle of Illusion remake!
1363807448.0,302,JonTron .gif I made
1356462723.0,307,Merry Christmas from the grumps responsible for the Game Grumps Postal Service.
1366740086.0,306,Bert and Ernie Grumps
1365007441.0,307,"I don't know, Kirk... I just... don't know..."
1364238758.0,298,NO!
1357498779.0,307,"Happy Birthday Arin!... Wait, Barry ?"
1365636351.0,303,thanks barry i mean it for serious
1361437732.0,302,watching breaking bad when...
1359433088.0,301,"""LEGO FEET! KNUCKLES HAS LEGO FEET!"""
1359054246.0,302,Chivalry - Game Grumps VS
1357095184.0,298,I drew a silly doodle for Arin because he was upset and he retweeted it. I think I fangirl'd a bit when I saw.
1354638682.0,297,School Grumps
1353116145.0,299,So I finally posted the Game Grumps animation I did for giggles.  SPAGET!
1350132949.0,300,"I drew this and literally named the file ""Jon is under the couch and Arin can't find him.png"" ..."
1374589174.0,298,I feel we need more pictures of Ross.
1360083266.0,297,Game Grumps - Best of Barry THE SEQUEL
1364646275.0,300,"How'd they miss this? ""For Goof's sake""..."
1359584441.0,296,Game Grumps Amalganimated - YouTube
1356567077.0,295,I love Arin
1372633157.0,296,That One Moment Jon Should've Been Here For
1369592989.0,302,Now that I know Jon and Arin go to the gym
1369189392.0,300,I animated the groomps! Check it out :)
1365635705.0,298,I had to do a double take when I saw this in my textbook
1363778518.0,300,"Barry drew this while drunk, apparently."
1350092103.0,298,"Hey Jon and Ego, apparently some people here may be dicks to you , but there's something you should know"
1362260301.0,298,Jon's reaction to fans not approving of him killing himself constantly in the new Castlevania episode
1354555362.0,299,Grumpy and Sneezy
1368751532.0,294,Once Jon said it... I had to do it!!
1366595817.0,294,New Game Grumps Art by SIR
1358995305.0,297,Game Grumps Remix - Grep Theme Song
1357314264.0,295,Egoraptor's MAGFest panel
1352092732.0,296,Game Grumps Comic: Mr. Dooter
1372400477.0,290,This is a serious time in Jon's life
1371608606.0,297,Developers of A Hat in Time want Game Grumps to play a prototype on the show!
1360280524.0,294,"If I can't be the best, I sure as hell can be the worst!"
1358731926.0,298,Sonic '06: Heart Attack - PART 47 - Game Grumps
1372714352.0,297,I'm liking Danny more day by day.
1359763296.0,292,"WHAT ARE YOU, ADDICTED TO WORKAHOL?"
1375646437.0,291,My brother made me a boopin' ass birthday card!
1369606752.0,291,NOTHING IS HAPPENING (Retweeted by Barry)
1366234973.0,290,You don't know how many years the Coca Cola and Pepsi Co Industries worked to clear that stereotype!
1360388921.0,290, I drew Jacque 
1356932004.0,295,I found Mexican Jon
1352852986.0,297,They will come in swarms.
1352142000.0,291,They should do a Game Grumps Versus with this game 
1372657031.0,288,He died to save us.
1368562463.0,291,Game Grumps Banner
1368508876.0,290,Zan Alda uploaded this on Facebook.
1365980720.0,289,Game Grumps Animated: Plok Talk
1356744607.0,291,"Was playing the new Mario Tennis, when I unlock a familiar item..."
1354801532.0,289,GAME GRUMPS AMINATED
1358792948.0,289,Shadow sure does have a lot of vehicles. 
1372363922.0,285,I just really love Jon's reaction to this whole thing
1370035153.0,287,"Jason David Frank (original Green Ranger, White Ranger, Red Zeo Ranger, Black Dino Ranger, and overall badass) is a grump!"
1365572208.0,289,"Next on National Geographic, Arin Hanson in the wild"
1350181957.0,286,Um... Ego... I think Jon went on your account...
1376435086.0,290,"TIL There is a sequel to Out Of This World called Heart Of The Alien, where you play as Mike Aruba!"
1375391046.0,285,Kirby's Epic Yarn: TOO CUTE - PART 1 - Game Grumps
1375057227.0,283,"""We Did It!"" Steam Train Remix... Just a quickie."
1374513655.0,288,Danny cosplaying as Spike Spiegel (From Journey to Silius Part 3)
1375559167.0,285,"Did You Know Gaming: Pikmin, featuring JonTron"
1372210390.0,286,[OFFICIAL] UNBRIDLED RAGE
1355104076.0,287,"This is what NBA Jam, Big head mode looks like"
1350453332.0,288,"Dame Grumps (Rule 63 if you haven't, like... geez wake up, man)"
1371851836.0,285,Got a little bored so I drew a little something :)
1356219922.0,282,Don't show this to the Grumps. They will never play DK Crash Course again.
1355674422.0,291,Jontron's epicface on his 21st.
1351533341.0,283,When Jon's away from the set of Game Grumps
1372367046.0,284,Mike Tyson's Punch-Out!!: Fists of Fury - PART 2 - Game Grumps
1362271994.0,285,DISCLAIMER:
1351796958.0,287,Arin+Jon=....woah O_O
1376133259.0,281,I think Jon captures how I feel about the current situation of the subreddit.
1374109584.0,281,I paused the Steam Train intro and found Evil Danny in one frame.
1372401294.0,282,"I like to think the passing of ""Not-so-Grump"" went a bit like this."
1372296460.0,286,Some good news.
1361976476.0,282,I was curious if amazon had GG stuff. Now I have no clue what this is.
1355795824.0,281,Sanic needs to move at a speed that some may describe as higher than normal
1372840915.0,284,Game Grumps: The Game
1372383839.0,282,Arin with short hair.
1369757075.0,285,The Grumps at Anime North! (Cosplay)
1368977772.0,281,The Boopinest Gamers
1364267689.0,284,Gray Grant Grumps
1353430066.0,283,Every time I see a new Game Grumps video
1351019769.0,284,"I made this a while ago, thought it should be here."
1349302932.0,282,My new favorite JonTron reaction face.
1369486100.0,277,two videos a day will return on June 11
1359156713.0,283,"Drew some more Grep Grumps, this time with 45% more Arin!"
1356535763.0,278,"Watching Breaking Bad when all of a sudden this appears out of nowhere, made me laugh thinking about the Grumps."
1363318184.0,280,An archive of old Egoraptor drawings.
1361317975.0,279,Smokey Wrestles His Inner Demons
1374441445.0,277,"He puts the ""Bang"" in ""Sexbang"" (Space Quest IV - Part 9)"
1368255335.0,282,SILVER STOP
1362526752.0,277,Game Grumps Logo (in Color and B&amp;W) - Class project of mine. What do you guys think? Worthy enough for the Grumps?
1360842096.0,279,For your Valentine needs.
1358590384.0,280,If they ever have Barry on the show they should do this intro
1357349631.0,283,Sanic O'6
1350244357.0,282,Caught this guy trying to sell bootleg Game Grumps dvds (only kidding)
1366245488.0,277,Hydr-OHGOD.gif
1363738377.0,277,Arin having a good time
1357321506.0,279,"Hey I-I'm...Jon, stop looking at me like that."
1374092856.0,279,Steam Train has always been the most popular
1372951847.0,276,Jon has a girlfriend (from PBG's tumblr)
1362109893.0,281,I think Barry is trying to reconcile with us after breaking the perfect lines...
1360216431.0,273,Game Grumps Animated - Batman Trilogy
1354940148.0,275,[Game Grumps Animated] Kill Yourself
1350491645.0,277,I have this mystery Famicom game I got sent from Japan. Should I send it to Game Grumps?
1369178888.0,276,"""The Westboro Baptist Church, what's his name?"""
1368331632.0,276,Jon plays F-Zero and has a wonderful laugh
1368234896.0,278,How did they not react to this?..
1367627273.0,275,A natural model
1362499630.0,277,Made this for the grumps this morning. 
1355703808.0,278,Robo-ass Godzilla.
1351623669.0,281,How every one of us would react if we see Arin or Jon
1365942216.0,271,Hey.. hey Jon! Jon.. :3 Do it.
1361237351.0,273,Millions are dead. 
1357171690.0,276,YES we get it people are dry boning peach.
1355421723.0,276,"Game Grumps Animated: ""Asymmetrill?!"" by ronnieraccoon"
1372202180.0,276,"So, /r/GameGrumps has gone into lockdown to control everything."
1361495259.0,275,Press X - Destroy Subreddit
1353526457.0,275,"Good God, Barry is psychic!"
1352378777.0,278,"Guys, I think I figured it out"
1351139903.0,274,Jon. We love you. &lt;3
1371161281.0,275,Finally a Game Grumps and Two Best Friends collab
1361901160.0,274,"Made this today, figured you guys would enjoy!"
1359696097.0,273,Ukinojoe draws game grumps during a stream 
