created_utc,score,title
1361498798.0,4757,"Job interview: ""What's your greatest weakness?"""
1355317115.0,4399,Collection of my favorite Latvian Jokes.
1355133891.0,3949,I was telling a girl in the pub about my ability to guess what day a woman was born just by feeling her boobs...
1346082016.0,3939,A 90 year old Holocaust survivor told me this joke.
1341156109.0,3940,"The maid asked for a raise, and the wife was upset."
1341792709.0,3627,Two chemists walk into a bar.
1364905223.0,3602,The 3 Spies
1358729125.0,3444,Good animal joke
1354124302.0,3441,A koala was sitting in a tree smoking a joint...
1350381413.0,3384,"An Englishman, a Frenchman, a ravishing blonde and a homely brunette..."
1349288061.0,3195,"If Al Gore tried his hand as a musician, his album would be called..."
1331568844.0,3203,a man and a woman who had never met before but were both married to other people found themselves assigned to the same sleeping compartment on a trans-continental train.
1367401753.0,3085,"Today, I saw a midget prisoner climbing down a wall. As he turned and sneered at me, I thought: 'that's a little condescending'."
1369067587.0,2964,A man who'd just died is delivered to a local mortuary...
1344009540.0,2935,Are my testicles black?
1348155877.0,2927,Two guys are playing golf.......
1366431489.0,2927,What is the difference between Game of Thrones and Twitter?
1365255291.0,2842,A rancher dies and leaves everything to his wife.
1331811232.0,2774,"A woman awakes during the night to find that her husband is not in bed.....
"
1371398681.0,2722,"If a stork brings white babies, and a blackbird black babies, what bird brings no babies?"
1348501580.0,2723,Why was 6 afraid of 7?
1372949195.0,2711,So there was this professional assassin who charged $1000 a bullet...
1363604226.0,2699,A young woman in New York...
1370744715.0,2685,So a politician dies...
1348751113.0,2674,A bus of ugly people crashes ...
1356323599.0,2644,Alzheimer Joke (Not sure if repost.)
1374669788.0,2604,A man goes to a bar and meets an escort...
1372860670.0,2598,A man takes his wife and his little boy to the circus...
1354190208.0,2589,Honesty
1347835815.0,2576,Four Friends At A Party...
1344426610.0,2576,Jewish sense of humor
1352715114.0,2571,a joke that isn't racist
1373047609.0,2569,A Marine boarded a train on his way home from deployment...
1360170000.0,2555,Dog for sale
1364947983.0,2548,What did Jay-Z call his girlfriend before getting married?
1353000489.0,2532,I cannot tell a lie.
1374590318.0,2525,"Fuck cheesy chat-up lines, we need better break-up lines:"
1370960689.0,2512,A train hits a bus filled with Catholic school girls...
1344895731.0,2487,"At any time, the temptation to sing ""The Lion Sleeps Tonight"" is just a whim away..."
1375808236.0,2476,An old and crusty retired Army Master Sergeant was sitting by himself at a bar [mildly NSFW]
1337950495.0,2466,Blonds and Blind Cowboys
1369145831.0,2445,I always carry a picture of my wife and kids in my wallet.
1360775753.0,2436,How many Dragonball Z characters does it take to screw in a lightbulb?
1348246445.0,2434,George Bush was visiting the queen of England...
1359414110.0,2426,A married couple was in a terrible accident...
1362645950.0,2410,Farting all the time
1370161688.0,2407,"I got a hand job off a blind girl last night. She said ""You've got the biggest dick I've ever put my hands on..."""
1375208983.0,2369,A couple in their 80's
1338812648.0,2366,A husband will only have sex with his wife on one condition
1352028975.0,2362,2 Italian men
1344134615.0,2338,A woman walks into a pet store...
1371026234.0,2333,A Buddhist monk goes to a barber
1349451370.0,2331,I told you I was broke…
1359923017.0,2308,Man sits at a bar and orders five shots...
1373308250.0,2302,The Logical Redneck
1365852291.0,2297,As I was paying for a 15 year old escort I thought...
1367080742.0,2296,Fishing Priest
1358781906.0,2296,Erect your ears for this one
1371808640.0,2288,From my Botswanan friend
1353487256.0,2286,Sadly I think my family are a bunch of racists.
1365435295.0,2280,A very successful lawyer buys a new Ferrari...
1373552036.0,2271,A teacher asks her class
1353948966.0,2266,Why Parents Drink
1334069476.0,2263,Fat Girls
1354802301.0,2264,Found 4 fox cubs
1367573897.0,2239,What did people say when the inventor of the Dry Erase Board showed off his new invention.
1370792625.0,2224,"Haven't seen this joke on here yet, it's my favorite."
1336437621.0,2211,Man's wife is in a coma
1350581672.0,2211,Young boy asks his dad for help with his homework. (NSFW)
1355925724.0,2199,This actually happened to me...
1374176001.0,2192,A Whipping
1375886685.0,2173,Stats joke..
1352116190.0,2158,My dad's favourite joke. Mine too. 
1359477561.0,2155,"An Arab student sends an e-mail to his dad, saying: 
"
1371262791.0,2140,What do Mexicans use to cut their pizza?
1358802154.0,2133,How many guys in the friendzone does it take to change a lightbulb?
1368387219.0,2121,Where do naughty rays of light go?
1355495727.0,2122,research for vaseline
1371346426.0,2117,"If I am ever on life support, unplug me ..."
1356106496.0,2110,So the painters finish painting my home...
1349361104.0,2108,Marry a virgin?
1372168627.0,2104,The other night I was invited out for a night with the 'girls.'
1356452865.0,2095,"Daddy, I fell in love &amp; want to date this awesome girl!"
1350146246.0,2091,"A man and his wife were discussing what they thought their son might be when he grew up.
"
1366807731.0,2087,British Royalty!
1369923248.0,2078,"/r/LatvianJokes, you are Subreddit of the Day! Congratulations!"
1365513501.0,2074,Crotch Massage
1357916020.0,2071,Morning Sex
1370608258.0,2059,Heaven or Hell . . .
1368657710.0,2064,How many guys in the friendzone does it take to change a lightbulb?
1360840461.0,2067,A couple are in bed... 
1372700966.0,2055,"I went for a job interview today and the manager said,""We're looking for someone who is responsible"""
1351771111.0,2042,"""It could be worse!"""
1369224840.0,2046,I just explained Google images to my mum...
1369320299.0,2038,Socrates the philosopher . . .
1359654488.0,2027,Ex-Wife 
1357434178.0,2023,"""Do you have a vagina?"" "
1360378078.0,2017,A taxi passenger tapped the driver on the shoulder to ask him a question...
1375273221.0,2015,I'm holding a charity night for people that can't reach orgasm.
1368729248.0,2013,"""Tell me about the day you died."""
1357862234.0,2001,Why do Jewish men get circumcised as youth.
1366906584.0,1991,Husband comes home after getting fired from the pickle factory...
1374001817.0,1988,When can women make you a millionaire?
1361323987.0,1986,"Ever since my girlfriend got pregnant, a lot has changed..."
1375623497.0,1979,A horny guy went into a whorehouse...
1371133416.0,1968,New Bull
1366555231.0,1970,What would Tiger do?
1368020162.0,1961,A man goes to a restaurant
1365689245.0,1955,So a woman had been in a coma for a few years. . .
1350629726.0,1951,Incorrect usage of the word 'Fuckin' 
1353669749.0,1950,The farmer's new cock
1373835807.0,1945,"A guy sticks his head into a barber shop and asks ""Hey, Buddy! how long before I can get a haircut?"""
1371059815.0,1939,Sex After Death
1351521021.0,1947,two men were walking thier dogs...
1361846104.0,1947,Johnny wanted to have sex 
1345848150.0,1939,Peace'n quiet in Auz
1359253291.0,1943,I'm trying to write a joke about overdosing on cocaine
1364423387.0,1937,I'll have you know that my penis was once in the guinness book of world records...
1366040900.0,1936,Old blonde joke.
1366318335.0,1937,"This farmer has about 200 hens, but no rooster..."
1373199076.0,1930,Natalie
1372536106.0,1933,One afternoon a lawyer was riding in his limousine when he saw two men along the road-side eating grass.
1364054909.0,1926,Three logicians walk into a bar..
1375099550.0,1917,Junior Builder....
1360285969.0,1905,Peanut
1358261622.0,1902,Irish and Muslim on a plane
1370014658.0,1910,A man gets pulled over at a DUI checkpoint...
1338158434.0,1906,A programmer 
1350727796.0,1905,Irish hooker
1375319934.0,1900,Marijuana-Filled Firewood
1369416420.0,1883,classic germans
1368284603.0,1889,A guy falls in love with a very traditional girl..
1366195199.0,1867,Why does Ariel wear seashells?
1373257535.0,1862,Once a DOCTOR and an ENGINEER entered a chocolate store
1373355513.0,1864,A guy dies and gets to the pearly gates
1347025254.0,1857,A Nagging Wife
1369827320.0,1861,Why are there no Irish lawyers?
1376530034.0,1848,My new thesaurus is terrible.
1364238438.0,1842,A drunk staggers out of a bar and runs right into two priests...
1353080786.0,1842,Sick day.
1347464896.0,1845,two women are chatting in the office....
1368456285.0,1844,Two Muslim families move from Afghanistan to the US....
1362586917.0,1832,The costume party (Sorry if this is a repost. Best joke I know.)
1352205505.0,1824,I was in bed last night with my wife
1365942003.0,1818,Guess how old I am?
1351570632.0,1817,Sometimes the forwards from Grandma aren't so bad.
1363289665.0,1811,The Forgotten Pick-Up Line
1361438744.0,1808,Logic lessons.
1354290074.0,1804,After 30 years of marriage...
1362784160.0,1808,Penguin  NSFW
1374072430.0,1796,A magician worked on a cruise ship...
1361024948.0,1800,What do you call a cheap circumcision?
1374442921.0,1797,"Dave cannot make his wife cum, so he goes to the doctor for some advice..."
1375720002.0,1796,"Easy as 1,2,3.....4."
1373643427.0,1788,Paratrooper's First Jump NSFW
1372433725.0,1786,My friends keep telling me to stop impersonating butter.
1371465222.0,1784,They say the way to a man's heart is through his stomach...
1363535342.0,1780,"""Doctor,"" the embarrassed man said"
1357673930.0,1786,So I poured my root beer into a square glass...
1363015390.0,1777,Wearing crocs is like getting a blowjob from a guy...
1376576594.0,1777,How many feminists does it take to screw in a light bulb?
1370425063.0,1772,Aussie Helpline
1367319235.0,1778,A teenage boy is getting ready to take his girlfriend to prom..
1375553107.0,1768,That's how to do it...
1358930421.0,1761,A blonde joke my sub told us. 
1350667563.0,1765,Drunk Irishman
1365125033.0,1756,"The man who invented the ""VELCRO"" died today...."
1374837755.0,1750,The Memory Man
1357138719.0,1745,The cheating wife.
1372081827.0,1748,A nun was sitting in the bath....
1367929341.0,1748,Sharing...
1360702024.0,1740,skipping church
1366662948.0,1743,A man gets audited by the IRS...
1358177378.0,1743,(My favorite joke)Who is best at apprehending criminals? 
1351252753.0,1734,A man goes to buy a motorbike..
1367019784.0,1732,So there's a fly...
1372356972.0,1733,After my prostate exam....
1357225321.0,1733,My love is like a candle...
1375382746.0,1719,The Golden Toilet
1376482180.0,1719,Mother's Day
1354545020.0,1715,We can't have sex.
1376237338.0,1714,I decided to put laxatives in my weed brownies...
1342714907.0,1707,"Ramadhan starts tomorrow, here's a joke"
1369743619.0,1708,A mugger
1344365555.0,1708,What's the biggest advantage of living in Switzerland?
1322629921.0,1708,Guy takes his girlfriend to the prom...
1354031444.0,1704,How can you tell if your girlfriend is getting fat?
1362682642.0,1702,The Jewish way
1364569386.0,1700,Tennis Elbow
1356969825.0,1696,A pirate walks into a bar
1369508374.0,1685,"My favorite joke, and very easy to personalize."
1357519621.0,1688,Jewish tie stand
1366582659.0,1689,A girl was about to jump off a cliff...
1373122974.0,1687,The guys go to the funeral of their life-long pal...
1336746284.0,1681,I met an older woman in a bar last night...
1369015192.0,1676,I dated a girl with a lazy eye once.
1361280223.0,1675,I was blessed with a rather large penis.
1376159955.0,1673,they say penis size is related to shoe size...
1355574111.0,1674,My daughter has reached that age where she is asking embarrassing questions about sex.
1362446299.0,1672,"joke I heard a while ago, not sure if it's been posted (new to reddit)"
1370833182.0,1666,How do you blindfold an Asian woman?
1348664852.0,1673,A little rabbit is running happily through the forest
1335274481.0,1670,Lie Detector
1372036076.0,1667,"A man, getting along in years, finds that he is unable to perform sexually"
1368063912.0,1658,Speechmaking
1363908282.0,1664,My Reddit posts are just like my prostitutes.
1345630966.0,1655,My deaf girlfriend was talking in her sleep last night.
1368888036.0,1653,Truth or Dare [NSFW]
1354981017.0,1657,My buddy tells me he had sex with his GF and her twin the other night.
1348576572.0,1652,husband and wife are waiting at the bus stop..
1365365234.0,1644,If I had 5 dollars in one pocket and 5 dollars in the other what do I have?
1359561993.0,1643,"Our neighbour's dog crapped in our garden, so my wife asked me to get a shovel and throw it over the fence.
"
1355243311.0,1646,Two old men playing golf
1363781711.0,1644,An Arab and a Jew
1370325553.0,1640,"The LAPD, The FBI and The CIA"
1359998381.0,1640,The Ostrich
1369384338.0,1636,What's Whitney Houstons's favourite type of co-ordination?
1365187831.0,1630,"So you like limericks, huh?"
1358342180.0,1634,"A priest, a drunkard, and an engineer are taken to the guillotine..."
1343222742.0,1627,Marketing 101
1340662303.0,1624,The beverage factory
1365767539.0,1619,A policeman pulls over a driver...
1374276641.0,1624,Do u speak English.!
1354672901.0,1621,"An Englishman, a Frenchman, a Spaniard and a German..."
1355763435.0,1617,Wives seem to love this one
1347278585.0,1614,birthday card
1370534128.0,1618,Five old ladies in a car . . .
1350047542.0,1616,So Jane asks Tarzan if he knows what Sex is...
1347201552.0,1619,A married man was having an affair with his associate.
1360508831.0,1615,The mini skirt.
1369621128.0,1609,I was at an ATM yesterday when a little old lady
1364163140.0,1614,The greatest swordsman in the world.
1356595207.0,1609,"So my wife came up to me and said, ""Take off my shirt."""
1351839653.0,1608,My grandfather developed cancer in his early twenties.
1363357897.0,1605,A man walks into a brothel...
1325780475.0,1611,"Apparently, it's no longer politically correct to direct a joke at any racial or ethnic minority, so here goes!:"
1343759648.0,1608,"A pastor, a doctor and an engineer "
1372303296.0,1610,A mother baking in Somalia
1368550391.0,1599,According to my mom this is the first joke I ever told [NSFW text]
1357641082.0,1601,Three Englishmen spot a Welshman alone in a pub...
1349541994.0,1602,I told my friend she drew her eyebrows on too high...
1360945038.0,1604,An English man meets a Chinese woman in his travels...
1343836915.0,1596,Penis jokes! A professor gives his physiology class a spot quiz...
1367757534.0,1590,My friend asked me if I was ready to go to the nudist colony.
1339085302.0,1590,"Probably old, but I got it in email and it made me chuckle."
1359083096.0,1587,What do you call an obese psychic?
1365082579.0,1589,"A guy calls a company and orders their 5-day, 10 lb. weight loss program."
1362155060.0,1589,Blind pilots
1352407267.0,1587,daaaamn guuurrrl are you a smoke detector ...
1370376340.0,1582,Joke my kid made up when he was like 4.... What do you call an angry shopper using bad words?
1352250049.0,1580,My girlfriend told me this one
1375926438.0,1578,Cookies. Possibly NSFW
1346638826.0,1573,Wife just got out the shower...
1374235303.0,1570,Random Drug search
1364386773.0,1573,"How would a Muslim describe Castro's gay, atheist lover?"
1372598829.0,1566,An elderly British gentleman arrived in Paris by plane...
1358875476.0,1569,What should you do if your girlfriend starts smoking?
1356379822.0,1565,A woman is playing golf...
1347645745.0,1570,"An ant, a spider, and a centipede are holding a party."
1376398036.0,1565,It's Saturday morning and John's just about to set off on a round of golf...
1356059657.0,1563,A deeply religious man is trying to book a room at a hotel. 
1364301904.0,1560,"Finally, a smart blonde joke."
1356771103.0,1553,"
""Excuse me,"" I said to the woman sat in front of me on the bus, ""You have some semen on the back of your jacket.""
"
1369570638.0,1553,Funniest joke of all time...according to Wikipedia...thought I share.
1355432750.0,1554,When an Amish sees an elevator for the first time...
1354066846.0,1550,"""Give it to me!"" she yelled"
1368811374.0,1551,So my lesbian neighbours asked me what I wanted for my birthday...
1375164643.0,1546,TIL Jehovah's Witnesses don't celebrate halloween..
1368113407.0,1549,"And The Lord said unto John, ""Come forth and receive eternal life"""
1354371592.0,1544,"Whatever you do, don't step on a duck."
1342540011.0,1536,A joke my russian friend told...
1348619293.0,1540,My boss pulled up to work today in his brand new Lincoln
1363639786.0,1534,2 engineers on a bike
1358509154.0,1530,A British engineer just started his own business in Afghanistan
1363479184.0,1536,What kind of cigarettes do hippies smoke?
1361375566.0,1531,A guy asked a girl in a university library...
1350838317.0,1533,A fly over a stream. [Dirty Joke]
1360231659.0,1527,"The other night, my wife asked me how many women I'd slept with. "
1352496660.0,1528,Double Positives.
1360111041.0,1523,A Horse And A Chicken...
1351108059.0,1522,taxi cab 
1374125263.0,1523,What happens when you mix human DNA with goat DNA?
1364434368.0,1520,Divorce in heaven?
1355974245.0,1512,I accidently swallowed some scrabble tiles
1355855867.0,1512,What does Batman put in his beverages?
1350426746.0,1517,A wife gets naked
1374508215.0,1515,A man walks into a bar with a dog...
1372242482.0,1510,An engineer dies and goes to heaven.
1352466221.0,1506,Why do you never hear a Pterodactyl go to the bathroom?
1373394196.0,1509,"Wife to husband: ""Our son called me a whore!"""
1370899763.0,1501,You put the punch line in the title
1366134603.0,1507,A man stumbles into his house early in the morning...
1376072261.0,1501,A 25-year-old Jewish girl.....
1358092854.0,1499,One soldier
1367662728.0,1501,Why did the sperm cross the road?
1366731617.0,1497,What's the best part about having a hooker die on you?
1343652205.0,1495,I broke up with a Japanese girl last week...
1372504009.0,1493,"A young Swedish woman, old Dutch woman, an Englishman, and an Irishman are riding a train."
1346380153.0,1494,Irish Viagra
1343498881.0,1496,"Just… don’t read these, okay?  If you do read them, don’t fucking complain.(offensive jokes)"
1366981199.0,1489,A tourist in London decides to skip his tour group and explore the city on his own.
1359620526.0,1487,There were two nuns...
1363181009.0,1490,You know what gets me down?
1362200266.0,1482,A little black kid covered himself with baby powder...
1360583238.0,1483,"Maybe the Pope just wants to finally get married.

"
1368917255.0,1480,A Jets fan walks into a bar with his dog.
1363734059.0,1481,My brother has taken being sent to jail really badly.
1374748728.0,1474,Cocaine is never a solution...
1364780123.0,1480,How many Mexicans does it take to...
1354892960.0,1472,What did the woman with dissociative identity disorder tell her psychologist?
1346603151.0,1469,I WON!  I WON!
1348055077.0,1477,"I asked my wife what she wanted for her birthday. She said, ""Nothing would make me happier than diamond earrings."""
1358628339.0,1471,My Favorite Math Joke
1369673492.0,1469,You guys know how the toothbrush was invented in the south?
1359862737.0,1464,Playing Oregon Trail.
1350450754.0,1467,What does a redneck and yeast have in common?
1342969015.0,1468,I just found out that i have two weeks to live
1371991209.0,1463,A bus full of ugly people crashes
1348019660.0,1469,Everyone called me a pedophile
1362545213.0,1464,This is a joke I heard back in 2000
1373707084.0,1457,Ending It All
1337434760.0,1451,I want to share a recent experience about drinking and driving.
1365975375.0,1451,Why is 'dark' spelled with a k and not with c?
1374401597.0,1451,A guy stopped me on the street today and tried to sell me a coffin...
1370454849.0,1449,What do gay horses eat?
1354466666.0,1436,A wife was dying.
1345561874.0,1441,After my joke last week about the Holy Qur'an...
1357320238.0,1440,Redneck First Aid
1363234572.0,1433,The Devil on Sunday
1376126078.0,1436,Who Am I?
1375751935.0,1434,Sex contest (mildly NSFW)
1365301672.0,1428,My hot neighbor wanted to have sex all night long...
1374966085.0,1431,Little Johnny At The Park
1373796553.0,1426,Denise and WHAT?!
1352386715.0,1430,Reflections on the Jonestown massacre of 1978
1360684519.0,1425,Dog sitting
1367351731.0,1420,An Old guy sits at a bar and starts drinking...
1345729528.0,1412,Rodney Dangerfield's One Liners
1370207145.0,1419,An Amish joke.
1367282942.0,1419,A cowboy...
1368784177.0,1418,A cute little girls story
1311172593.0,1414,A good bar joke that always makes women laugh
1367611099.0,1407,Why I fired my secretary today.
1371863346.0,1411,What's the difference between 3 dicks and a joke?
1376015206.0,1408,A teacher was teaching her second grade class about the government
1351027639.0,1407,A rapist and a con artist get caught...
1371622321.0,1401,My sister bet me I couldn't make a car out of spaghetti...
1357304183.0,1409,A little old lady
1357916942.0,1405,The trophy girlfriend
1355661147.0,1398,There was an elderly man who wanted to make his younger wife pregnant...
1351706384.0,1401,A man walked into a bar...
1353497104.0,1391,When the fuck did you get here Harvey?
1371571659.0,1396,Why don't blind people skydive?
1353542364.0,1396,A man walks into a bar and asks:
1370492485.0,1388,A Jewish businessman in America decided to send his son to Israel...
1364483459.0,1390,What's the best dating service in India?
1346772067.0,1388, An angel appears at a faculty meeting...
1363108837.0,1389,A husband calls up a hotel's manager from his room..
1366085719.0,1384,The Hitchhiker.
1361562742.0,1381,New evidence has been found outside the Pistorius home that completely acquits him of his girlfriend's murder.
1351422279.0,1374,The thing I love most about this fall weather is the UGG boots and yoga pants..
1357764106.0,1375,"What starts with e, ends with e, and has one letter in it?"
1346203428.0,1371,A couple wants to have a quickie...
1361194244.0,1370,"My son asked me today, ""Dad, what music did you like growing up?"""
1362846390.0,1369,A man was mending his roof.
1356563811.0,1365,Why can't you trust atoms?
1367157372.0,1362,"Which one is the odd one out; a Crab, a Tuna, a Chinese man run over by a bus or a Lobster?"
1347527473.0,1363,If Iron man and Silver surfer...
1321855140.0,1359,What bounces and makes kids cry?
1373466364.0,1364,What does a guy with 2 right feet wear to the beach?
1356021620.0,1364,Why does the French Army install Rear-view mirrors in their Tanks?
1362926204.0,1361,What happens when Catwoman takes off her suit?
1374931544.0,1359,Harry was waiting for an important buissness partner in a cafe...
1365036791.0,1360,Harold in the Nursing Home. This is my grandma's favourite joke.
1348102305.0,1357,Sven and Ole go to Hell.
1344522391.0,1357,In A Real Pickle
1369261586.0,1356,A man was on a plane...
1364637406.0,1353,In my 4th grade class the cutest girl threw away my love letter..
1362034359.0,1352,"Before Chris Brown did a concert with them, they were just known as ""The Peas""."
1373953511.0,1352,Paddy phones an ambulance because his mate's been hit by a car.
1367849925.0,1353,What kind of STD's do fish get?
1359768220.0,1356,Cell Phone Etiquette
1373597130.0,1342,an irish daughter
1368578963.0,1347,A man goes to his Rabbi
1349704099.0,1342,My girlfriend said she was leaving me due to my obsession with the 60's group The Monkees. I thought she was joking... 
1338926174.0,1351,Why do asian girls have small boobs?
1368223909.0,1342,What does the NFL have in common with Brokeback Mountain?
1360332563.0,1346,Pope VS. Mufti
1346525506.0,1349,Stranded
1370886162.0,1340,Why can't a chicken coop have more than two doors?
1340986539.0,1341,Two married buddies are out drinking one night...
1353368263.0,1340,What do you call a black man selling drugs?
1364828151.0,1341,What is a dilemma?
1327550750.0,1343,My 93 year old grandfather FTW
1350911256.0,1340,Why does Michael J. Fox make the best milkshakes?
1373897925.0,1333,What state has the smallest soft drinks?
1349200046.0,1336,The Polish eye exam.
1366381247.0,1325,I played for a homeless mans funeral
1365626780.0,1334,A crusty old Marine Sergeant Major...
1347804727.0,1321,A die-hard fan was very surprised to see an empty seat at the Superbowl...
1354634931.0,1318,"r/funny told me to post it here. So, a married couple went to the hospital"
1376314949.0,1314,Three priests and their wives die in a plane crash...
1364687497.0,1323,I've been winning egg hunts since before I was even born.
1369476474.0,1317,I was walking into Best Buy...
1348869774.0,1317,What do you get if you insert human DNA into a goat?
1375972291.0,1312,"While in the playground with his friend, Little Johnny noticed that Jimmy was wearing a brand new, shiny watch. . ."
1361659948.0,1310,Skinny Irishman
1344796271.0,1320,Dead Cow
1349013410.0,1308,"The French, the British, and the American are talking about submarines."
1355692450.0,1313,"Accordion to a recent survey, replacing words with the names of musical instruments often goes undetected."
1353778181.0,1308,Why aren't there any Walmarts in Afganistan?
1344967662.0,1305,Tickle me Elmo
1359127422.0,1305,Doctor
1372772600.0,1306,Two high school drop-outs are digging a ditch in the hot summer sun...
1348947908.0,1300,They say that 1 out of a group of 5 guys is gay....
1359387007.0,1297,What do you call a fake noodle?
1346244147.0,1302,"My 6 year old son caught me masturbating this 
morning..."
1349411741.0,1294,To whoever stole my copy of Microsoft Office...
1345906480.0,1302,Two guys.
1367501012.0,1295,Bellboy
1350235547.0,1292,Three nuns were talking...
1369768058.0,1295,How many Firefly fans does it take to change a light bulb?
1372996174.0,1292,A blonde girls first day of kindergarten.
1353442348.0,1294,Make the little things count...
1352772454.0,1286,I posed naked for a magazine today
1369882437.0,1284,Three friends die and go to heaven
