created_utc,score,title
1366296072.0,767,Why did the woman divorce the grape?
1360267790.0,765,So my girlfriend got a new tattoo......
1356885455.0,772,A chemistry lab is a lot like a party...
1358906908.0,763,Cyanide please
1326568135.0,764,A Baptist preacher sits next to a cowboy on a flight...
1349623683.0,770,Dirty Little Matt is sitting in the back of the math class...
1331307788.0,758,Today is International Women's Day. 
1357747428.0,761,Worlds shortest joke...
1352499915.0,757,Because it pisses off r/funny
1322010930.0,751,Tried to change my password to Twilight...
1359488396.0,762,A young boy and a barber
1337769391.0,756,"An Australian, an American and a New Zealander are enjoying some beer in Saudi Arabia.."
1330331381.0,759,3 soldiers receive their payment
1333998168.0,752,A woman brings another man home while her husband is away at work...
1374516313.0,755,"A guy's auditioning as a piano player at an exclusive, high-profile bar..."
1375018228.0,755,Why couldn't anyone hear Hellen Keller scream?
1349791557.0,750,Baby Confusion
1349186964.0,755,What is the difference between an epileptic oyster-shucker &amp; a prostitute with diarrhea?
1338221554.0,746,A young gay man comes out...
1349559092.0,746,The border guard
1341510649.0,746,Hot and Cold
1357273371.0,742,My 2nd Parrot joke!
1341447701.0,744,"Two twins, one boat."
1356962595.0,744,I'm in a band called Missing Cat.
1352561802.0,744,Prom
1342337760.0,749,Why did the semen cross the road?
1355358819.0,744,Some Mexican jokes from a Mexican
1361895751.0,743,White wedding dresses
1351969850.0,736,A very elderly couple...
1356214248.0,745,I think one of my dads might be gay...
1338698863.0,740,6 Moose
1374634137.0,735,Why did the blonde snort splenda?
1351646852.0,737,Read the fine print. [NSFW]
1334175684.0,744,CIA final test
1345077128.0,734,6 patients in a psych ward.
1321493006.0,731,"My grandfather, an 83 year old doctor that still practices, sent me this jokes. Enjoy."
1357693024.0,734,I organized a threesome last night
1346180339.0,734,Tender touching
1344203141.0,739,2 Girls 1 Nerd
1356148485.0,739,"Why men don't write advice columns...
"
1340542037.0,726,What's the difference between a drunk driver and a stoned driver?
1339768319.0,732,A man walks into a bar
1339212534.0,738,"""Captain, I've lost my rifle!"""
1348928300.0,737,Have you guys heard about the new restaurant on the moon?
1356749740.0,729,What do you get when you put 50 lesbians and 50 politicians in a room together?
1356183895.0,726,I know somebody that talks like an owl. 
1337533600.0,729,A mom is driving her 6 year old daughter to her friend's house when...
1372079906.0,725,I like a good long cuddle with my girlfriend after sex.
1361751079.0,726,"""Sex with me is like Shakespeare..."""
1361141042.0,728,"Three men, a philosopher, a mathematician and an idiot, were out riding in the car when it crashed into a tree."
1348459787.0,721,"So there are three men in hell,"
1339301454.0,718,"As an old man was driving down the freeway, his car phone rang."
1356028936.0,718,Why don't midgets ever get accepted into nudist colonies?
1346273857.0,720,"What do Lewinsky, Monroe, and Reddit have in common?"
1355281297.0,719,Did you know it's now politically incorrect to say 'black paint'?
1344860559.0,724,A 75-year-old man walked into a crowded waiting room...
1333561839.0,721,I saw a sign the other day the made me fucking piss my pants...
1370847033.0,719,"Hopefully this isn't a repost, but I love this one."
1369761064.0,713,a woman and her boyfriend
1361919774.0,711,Two women talk about their last night sex
1354628717.0,710,A young soldier is having a cigarette...
1347597932.0,715,A woman is taking a bath...
1332017136.0,711,I felt sorry for the hypnotist I saw last night
1362325715.0,711,The Old Man and the Beaver (long joke)
1347394070.0,717,Whats blue and doesn't weigh much?
1339025202.0,706,A koala is sitting in a tree...
1329307834.0,705,In today's email
1363411941.0,706,An Englishman is having breakfast in  Paris one morning....
1361745197.0,702,A employee didn't show up for work
1347576633.0,707,A Classic!
1343414382.0,705,Occupation
1346423925.0,704,A Scotsman goes into a brothel
1350467410.0,701,Two doctors
1358583681.0,707,This is my dad's (a math major) favourite joke. What's the difference between an Engineer and a Mathematician?
1333098585.0,702,An elderly man walks into a confessional
1352702298.0,703,My mother told me this one...
1322558420.0,698,Give a man a gun and he can rob a bank
1316517477.0,702,Are my testicles black?
1357219702.0,700,A couples dies in a car crash on the way to their wedding...
1354630551.0,697,The Pearly Gates and the Brothers 
1373861948.0,694,May I have a piece of gum?
1361461207.0,690,What kind of cigarettes do hippies smoke?
1342511451.0,686,A young construction worker was bragging...
1331662579.0,692,A large group of Russian soldiers...
1362422582.0,693,Snow wife.
1357479722.0,694,My wife was dying..
1336233676.0,689,The chief of a tribe in Mexico dies.
1364287121.0,694,Paybacktime
1370287069.0,687,A blind man is sitting in a restaurant.
1354719556.0,687,What do you do with 365 used condoms?
1361914218.0,687,I always thought the hole in boxer briefs was a messy idea...
1341054819.0,685,"So Katie Holmes is divorcing Tom Cruise...
"
1368636270.0,688,Gorilla in my tree!
1353102326.0,683,I just went to the Air &amp; Space museum.
1356822366.0,683,A carton of milk and eggs
1339430529.0,678,A tourist is eaten by a python at the zoo.
1337163334.0,681,A guy arrives at the pearly gates of heaven
1336915525.0,681,3 men are in a Soviet Prison
1335328147.0,680,Dating in 1962
1374953099.0,681,A little girl is attending her first wedding...
1354480676.0,678,So I was about to roll a joint with a page from the Qur'an...
1342574071.0,678,Slightly more modern Russian joke
1374804228.0,673,How do you know when a blonde is having a bad day?
1368536002.0,672,What do you call a smart blonde?
1356896088.0,670,What would Michael Jackson be doing if he were alive right now?
1358991954.0,680,How To Get Hired At Walmart
1346696666.0,679,Little boy in custody battle.
1345285342.0,673,What do you call a cow that gives no milk?
1304230019.0,671,When Engineers go to hell...
1375913315.0,673,I drove a girl home...
1375680751.0,671,Humorists of Reddit! I challenge your joke inventing skills! First comment gives the punch line; the reply is the rest of the joke!
1348522183.0,676,In line at Heaven's Gate.
1339895857.0,672,A farmer has three daughters...
1362856049.0,668,Cheating Partner
1355611539.0,666,A collection of jokes I had saved on my PC. Hope you guys enjoy.
1345992268.0,670,Confession (NSFW)
1365027306.0,668,Why does nobody play Uno with Mexicans?
1361807555.0,669,A Governor who was going for a...
1359755974.0,670,How is the porn industry different from every other career?
1355515280.0,668,"To this day, the boy that used to bully me at school still takes my lunch money."
1338341558.0,663,What did Arnold Schwarzenegger say when someone told him to upgrade to Windows 7?
1351686420.0,666,Regretting the compliment...
1337365682.0,672,A rather bad man dies and meets Satan...
1347385990.0,664,A little boy calls his best friend on Christmas day...
1359311970.0,661,A construction worker
1357178687.0,669,Why do you never tease a fat girl with lisp?
1352080243.0,668,They say that penis size is directly related to shoe size. 
1341638701.0,662,"""I'm sorry"" and ""my bad"" mean the same thing..."
1360748165.0,655,Statistician and bomb.
1355247146.0,655,"So, my girlfriend won't let me wear my mood ring anymore..."
1344344409.0,662,Two nuns went on a bike ride...
1365125156.0,657,So there are three couples.
1330689392.0,654,You must be Irish
1349725539.0,652,A man escapes from prison where he has been for 15 years.
1352846139.0,653,Anger Management
1359048940.0,654,A woman walks into a dry cleaner...
1339969327.0,656,2 Guys in a Bar
1331925876.0,649,To all new iPad owners. 
1370386266.0,650,Why do redditors have so many inside jokes?
1350314852.0,654,Want to know how to annoy someone who has OCD?
1335629284.0,651,My wife told me a joke that I actually laughed at.
1371479469.0,649,I once knew a soldier who suffered through both mustard gas and pepper spray.
1359161591.0,648,Golf with the boss
1363654992.0,645,What would it be like to have world with out women??
1360456252.0,648,Old sex life.
