created_utc,score,title
1365627038.0,1289,I got fired from my job as a massage therapist
1347280750.0,1284,why i fired my secretary
1365753755.0,1287,How many Apple users does it take to change a lightbulb?
1364519618.0,1281,There were 3 moles living in a hole...
1359190814.0,1283,"JOB OPPORTUNITY: Riot police officers needed. Interviews are being held tomorrow. Come early....
"
1364613632.0,1283,Sixteen sodiums walk into a bar...
1356524837.0,1282,"A man runs into a doctors office screaming: ""You've gotta help me doc! I'm shrinking!"""
1358530089.0,1278,A man and a woman were sitting beside each other in the first class section of an airplane.. 
1345447543.0,1278,I was on a bus when this girl offered to blow me for $5...
1343092519.0,1279,How /r/Jokes let's it's mods know there is a funny joke to read.
1365718216.0,1276,Never marry a tennis player...
1358701878.0,1278,Cockpit duties
1353722835.0,1274,What's the difference between my porn stash and Call of Duty?
1348786413.0,1270,I recall my first time with a condom...
1376356243.0,1270,A zookeeper was making his rounds one day...
1362323003.0,1268,How is Rihanna's boyfriend and power tools the same? 
1359808212.0,1271,A priest and a pastor... 
1353826865.0,1264,Olympic Condoms
1361973359.0,1268,"How many Congressmen does it take to change a light bulb?
"
1352910088.0,1268,How many 'Nam vets does it take to change a lightbulb?
1355174136.0,1270,Two men sitting at a bar...
1350213372.0,1265,A blonde buys a gun.
1358960115.0,1262,Jesus knows you're here
1367710082.0,1262,I try to tell good jokes...
1349875540.0,1261,I was at a restaurant and my waitress had a black eye
1362094727.0,1257,Did you hear about the guy who's been pickpocketing midget charity workers?
1360075352.0,1260,"A bit dated, but it gave me a chuckle nonetheless. (Blatantly stolen from a grandma email.)"
1344279768.0,1262,Found in my Physics text book.
1358582296.0,1255,Life is like chess...
1365574608.0,1261,A joke from my dad: A man goes to a lawyer to ask a few legal questions...
1348397338.0,1256,"""I own a small allotment..."", So far I'm the only person I've heard laugh at this joke."
1350100572.0,1261,Senior Sex (NSFW)
1374326303.0,1254,Why was six afraid of seven?
1370635256.0,1258,Blonde walks into a...
1361724157.0,1257,A reporter is interviewing Stevie Wonder
1359306052.0,1256,Sex after surgery
1354577058.0,1252,"I am Pierre, French fighter pilot!!"
1356202633.0,1249,A koala wakes up next to a prostitute....
1353337180.0,1243,How do you turn a Fox into an Elephant?
1342633226.0,1249,20 Minutes
1347971330.0,1246,how does every racist joke start?
1374876172.0,1239,Two best friends got married on the same date and...
1351175527.0,1237,"An Englishman, Irishman and a Scotsman apply to join MI6"
1358814857.0,1241,My favorite all-ages joke.
1351001296.0,1240,Joke in honor of mole day
1348345735.0,1241,A Texan walks into a bar in Ireland
1357500799.0,1235,So a black guy walks into a bank
1361617427.0,1237,"""Have a good day, sir"""
1342410533.0,1230,The Hitchhiker
1375493123.0,1233,Blonde Convention
1367160088.0,1228,"Yesterday, I accidentally sent a picture of my dick to everyone in my address book"
1370100677.0,1228,Old man Stumpy and his wife Martha
1363120772.0,1228,Marketing Explained...
1352555297.0,1229,A husband and wife were sitting watching a TV program about psychology....
1362246422.0,1226,Irish Viagra 
1353254627.0,1217,A man was meeting a girlfriend somewhere...
1350783782.0,1225,A woman recently got oak breast implants...
1366641482.0,1216,A Mexican man sneaks across the border to watch his favorite football team play...
1349652659.0,1218,I accidentally sent a picture of my cock to everyone in my address book the other day...
1343755282.0,1218,The exterminator
1362420230.0,1215,Two long time friends are having a beer in a Pittsburgh bar.
1338067290.0,1214,What the difference between American teenage girls and Muslim teenage girls? (offensive be warned)
1344078907.0,1216,A blond girl is on a plane to Dallas...
1360539175.0,1212,Dumbest kid in the world.
1368945319.0,1208,A small Muslim boy is lost in the supermarket...
1367211268.0,1205,"Which doesn't belong: Meat, a Blow Job, Your Wife, An Egg"
1349981806.0,1205,An unemployed man is looking for a job
1373458915.0,1201,A man seeing flashing red and blue lights in his rear-view mirror pulls to the side of the road.
1359837761.0,1203,Why don't Mexicans cross the border in groups of three?
1362263226.0,1199,A guy walks into a bar... (TL;DR) [NSFW]
1341967099.0,1206,The Mafia leader tells his right-hand man to...
1363957971.0,1196,The toilet at my local Police Station has been stolen.
1367821354.0,1192,A father tucks his son in
1356702533.0,1193,Two guys get pulled over...
1350489193.0,1186,"If I ever move to Prague, I'll open a burrito shop. "
1342289777.0,1183,"""Of course I won't laugh,"" said the nurse."
1361925713.0,1177,A police officer pulls a guy over for speeding...
1370735688.0,1177,The Russian Mafia...
1364557830.0,1175,A man went to the doctor complaining about erectile dysfunction...
1354725956.0,1173,How many ladybugs does it take to screw in a light bulb?
1334493185.0,1174,A man escapes from prison
1363084395.0,1179,Did you hear about those new corduroy pillowcases?
1351351051.0,1174,Do I Know You?
1350948820.0,1171,Little Johnny #71
1366010299.0,1171,Jim and Mary.
1368155449.0,1176,I never wanted to believe my husband was stealing from his job as a road worker...
1366292736.0,1172,"My wife shouted upstairs, ""the sun's just come out."""
1345041917.0,1165,I bet my butcher $50 that he couldn't reach the meat on the top shelf.
1353176953.0,1164,I was reading my emails...
1368976507.0,1162,What does Mr. T say when he sees a fat lady at a bar?
1372047159.0,1158,"The husband leans over and asks his wife, 'Do you remember the first time we had sex together over fifty years ago?'"
1360011968.0,1152,"A young guy from North Dakota moves to Florida and goes to a big ""everything under one roof"" department store looking for a job..."
1338570517.0,1153,You must be in management!
1343301811.0,1146,Pre-nup.
1375451532.0,1147,The Sex Shop Fatality.
1348500198.0,1147,"Semper Fi, Motherf*****"
1371729154.0,1151,What happened?
1368537628.0,1151,tiny pianist
1356636891.0,1145,I love walking on the beach with my girlfriend.
1376053092.0,1147,Why do Java Programmers wear glasses?
1370862553.0,1145,Calling in sick...
1364125104.0,1140,A teacher asks her class...
1358346342.0,1140,Me and my recliner...
1361460815.0,1147,Sign language
1352147886.0,1137,I need some Cyanide
1349948144.0,1138,A man kills a deer...
1348315812.0,1137,I'm good friends with 25 letters of the alphabet...
1340278737.0,1140,Guy walks into a bar...
1356273203.0,1136,An Irishman goes to the doctor's surgery ...
1355400708.0,1137,An old lady was tired of her hard life and wanted to commit suicide.
1359038011.0,1130,"A priest, a lawyer and a teacher with his students were on a plane"
1360876831.0,1128,I have a tip for all you lonely ladies on valentine's day..
1341314461.0,1128,Two blind pilots 
1373387498.0,1121,Four surgeons sit around discussing their favorite patients.
1361235137.0,1119,My favourite lawyer joke
1352005836.0,1126,"I submit to you, the only joke I have ever heard my father tell."
1365764664.0,1119,Two silk worms were in a race...
1352653904.0,1122,Corny Peanuts.
1371776432.0,1122,When life hands you melons...
1368364294.0,1124,A rope walked into a bar...
1339601225.0,1123,There's this Pimp and he's got 3 hos
1344226003.0,1122,"A blonde walks into a bank in New York City...
"
1338981987.0,1112,An Irishman visits his doctor after a long illness.
1372661162.0,1117,It's hard to explain puns to kleptomaniacs because they always take things literally.
1363824116.0,1115,So Cinderella was crying...
1346849918.0,1111,The best salesman in the world
1345505039.0,1109,Costume Party
1331731866.0,1114,Naked sunbathing
1349098562.0,1110,Euro-English
1348150588.0,1108,My black friend told me to stop making racist jokes...
1352829676.0,1105,What do you call a nun on a bicycle?
1348878586.0,1106,When Beethoven died...
1344729716.0,1105,Why do Chicken Coops have two doors?
1367777245.0,1101,A preacher is reaching....
1335372563.0,1098,A 2nd grade class just gets in from recess...
1345814693.0,1094,Ed the Chicken
1340209052.0,1094,Driving Home Drunk
1358978803.0,1097,"""So I went to this convention called, ""Ladies Without Legs"", and man..."
1354043434.0,1093,A doctor just recently had sex with one of his patient..
1319741680.0,1097,"A driver was stuck in a traffic jam on the highway outside Washington, DC. Nothing was moving. Suddenly a man knocks on the window.
"
1358035854.0,1093,Two Assholes
1361909924.0,1085,What do you call a potato wearing glasses?
1340564016.0,1083,One day Jane met Tarzan in the jungle...
1345389101.0,1083,Typical Men
1368619959.0,1081,How many paranoids does it take to change a lightbulb?
1355077715.0,1079,The new priest
1335570092.0,1082,A woman is cleaning her 12-year old son's room...
1343922268.0,1080,A gunman walks into a bar.....
1358006078.0,1081,Why did the snowman take his pants off?
1355707661.0,1077,God creates Adam
1349266801.0,1073,I was in a pub...
1359996997.0,1075,The Lone Ranger and his faithful American Indian sidekick Tonto are riding the plains.
1354423114.0,1079,A woman thinks her husband is going deaf.
1353210946.0,1077,What a dumb blonde... wait...
1363600043.0,1066,The Frog
1354759563.0,1070,"Found this joke on yahoo, made me laugh pretty. 
Sorry if it's an old one."
1358373487.0,1066,"A blond, a brunette and a redhead . . . "
1373738883.0,1073,A Proctologist is giving an exam...
1340123747.0,1072,A father is getting his daughter ready for bed...
1363701992.0,1065,There once were two airplane mechanics from New Jersey...
1347750967.0,1059,What does the highest paid WNBA player make?
1353443700.0,1059,A King has a slutty daughter... (NSFW)
1350311203.0,1061,Sometimes I miss my ex.
1346676279.0,1056,Two Priests going on vacation to Hawaii were...
1343011021.0,1053,I can't believe Penn State took the Joe Paterno Statue down.
1371665344.0,1056,If Mary had aborted Jesus...
1368456663.0,1055,A scientist is trying to prove that all blonds are stupid
1360587600.0,1053,Game 7
1371320330.0,1051,How many women does it take to screw in a lightbulb?
1343064248.0,1047,The Husband Store
1349137713.0,1040,Santa's bad day
1346340999.0,1040,The Dentist
1365330300.0,1045,Kinky sex
1364671033.0,1039,I hate being bipolar.
1364206876.0,1033,what do you call a priest who quits to become a lawyer?
1351993321.0,1034,How do you find a blind man at a nudist beach?
1359531179.0,1035,How do you turn lead into gold?
1363865404.0,1031,"The inventor of the Harley-Davidson motorcycle, Arthur Davidson, died and went to heaven.

At the gates, St. Peter told Arthur ""Since you've been such a good man and your motorcycles have changed the world, your reward is, you can hang out with anyone you want to in heaven""...
"
1349049690.0,1034,Sex with a Ghost 
1347894269.0,1032,My Daughter Wanted a Puppy
1344896596.0,1031,"What begins with E, ends with E, and has one letter?"
1350564866.0,1028,The Shredder
1374410750.0,1025,Dialogue Delivery
1332505495.0,1022,A young man moved out from home and into a new apartment complex on his own. He proudly went down to the foyer to put his name on his mailbox.
1358980717.0,1020,My friend told me this joke
1344680168.0,1023,What's the difference between a cat and a comma?
1351088383.0,1020,Starting Early
1347846757.0,1021,Drunk As Hell
1347574122.0,1017,Ballerina
1349804179.0,1017,Fame
1365976207.0,1013,Praise The Lord!
1351616218.0,1012,New Bull
1338299228.0,1008,A woman is pregnant with twins when she gets into a car accident...
1313425490.0,1012,A wife decides to take her husband to a strip club for his birthday
1333641856.0,1004,0 to 200 in 6 seconds
1376358399.0,1006,A young religious couple is about to get married
1366644529.0,1009,Two whales walk into a bar.
1344615266.0,1010,A five year-old kid goes on a trip to the zoo with his Mom
1348431399.0,1004,Three guys in the pub...
1354355122.0,1005,"A guy sticks his head into a barber shop and asks,"
1355621449.0,1001,"In a park there are two nude statues - a man and a woman. God sees that they have been staring longingly at each other for decades, so he decides to make them human."
1363274101.0,1001,Oh johnny..
1347905139.0,998,So I had this really great racist joke.
1340944867.0,1001,How do you tell the difference between a chemistry professor and a politician ?
1326685187.0,1009,A cowboy is sitting in a saloon...
1372823336.0,998,A man walks into a bar......
1343902095.0,1003,Two aliens landed in the Arizona desert..
1343333386.0,996,She LOVES her husband
1368633327.0,1000,Women are like a box of chocolates
1339646308.0,996,Lover's Lane
1370892562.0,991,"Some years ago, in a small coastal Irish community..."
1322513200.0,998,"Seriously though, why can't you put the punchline in the title?"
1360426198.0,992,"""Mr. Smith, I have reviewed this case very carefully,"""
1368332139.0,990,So the church is losing money...
1360763862.0,988,"A friend of mine has been rushed to hospital, after eating a horse-burger."
1361108189.0,981,That rabbi's gone crazy! He's been running around a circumcising all kinds of lettuce...
1357176558.0,984,A 70 Year Old Women Decides To Get Married
1344256301.0,984,God Loves Drunks Too
1371495781.0,976,A factory owner is trying to come up with innovative ideas to save money and therefor save his business from going under.
1357726757.0,977,How does a Welshman find sheep in long grass?
1353899121.0,978,Hard of Hearing Genie
1345791014.0,976,The wine taster
1364752183.0,972,What do you call a cheap circumcision?
1370345941.0,969,Go tell Mrs. Smith . . .
1362368317.0,972,What is a Freudian slip?
1349927152.0,971,No Sex Tonight.
1342796501.0,976,"I went to the store to buy condoms, the cashier asked me if I needed a bag. I told her “No, she’s not that ugly”"
1342168335.0,973,"A crusty old Marine Sergeant Major found himself at a 
gala event hosted by a local liberal arts college."
1341685984.0,974,An Irishman walks into a pub in Dublin
1364863400.0,965,"A redhead tells her blonde sister, ""I slept with a Brazilian..."""
1331103646.0,971,You bastard
1346883374.0,970,Some great one-liners.
1374368452.0,961,Use Your Lifeline
1347652456.0,964,A Jewish man has a son...
1351887856.0,965,Irish Prostitute- An old joke but still good!  
1349759940.0,964,My gay friend's had an 80's themes costume party.
1349518489.0,963,What's orange and sounds like a parrot?
1345209742.0,959,0 to 200 in 6 seconds 
1344862504.0,961,A redditor was on a date.
1329915538.0,959,An Irish boys confession
1354458694.0,966,A trip to the therapist
1315430934.0,958,I never wanted to believe that my Dad was stealing from his job as a road worker.
1354261661.0,961,4 Nuns get in a car accident and die...
1364326847.0,957,"Even as a women, this is funny."
1351951850.0,958,Two goldfish are in a tank...
1374888395.0,959,Blondes At The Bus Stop.
1340703714.0,954,A man come home from work one day...
1362021706.0,955,A hippy with a bicycle that has a broken chain walks on the side of a road.
1358450623.0,950,SEX TIP!!!!
1337068278.0,952,So..the wife and I were in town shopping....
1343715012.0,956,Two Iraqis
1376263072.0,951,A customer walks into a restaurant and notices large sign on the wall:
1366247406.0,946,Bobby buys condoms
1347141171.0,954,What's the difference between iron-man and iron woman?
1362666075.0,946,My dad
1357104872.0,949,"An Engineer Goes To Hell (repost from r/AskReddit, all credit to armaha)"
1339510430.0,948,There's one thing I can't stand when I'm drunk
1358224204.0,946,Nymphomaniac Convention
1350264407.0,943,Claude the hypnotist
1362961382.0,939,I once saw a girl with 12 nipples
1345130618.0,940,That Priceless Look
1339773975.0,943,The Sensitive Man 
1343146994.0,941,A priest and a rabbi are stuck on an elevator.
1373516419.0,935,Two whales
1357816949.0,939,What do you do if a blonde throws a pin at you?
1357391308.0,941,It's so awkward getting a boner during a prostate exam.
1366878025.0,934,Missionaries.
1354327253.0,940,"As blond woman, I've heard them all. But this is my favorite blond joke."
1370435030.0,940,A heroic biker . . .
1340807291.0,936,"A mother, father, and thier young son go to a zoo....."
1341095654.0,931,A lawyer and a blonde woman are sitting next to each other on a long flight. 
1367255244.0,927,Mom's birthday gifts
1342660717.0,926,Bacon Tree
1349825932.0,927,I have you know that my penis was once in the Guinness book of world records...
1361802665.0,923,It makes sense why women hate premature ejaculation so much
1358440417.0,927,The Penguin Joke
1348895238.0,931,A young boy walks into a whore house...
1366843147.0,919,First Blowjob
1350949547.0,917,"I used to be into necrophilia, S&amp;M, and Bestiality...  "
1341875980.0,918,An 85-year-old man was requested by his doctor for a sperm count as part of his physical exam...
1359720852.0,922,How do you get a nun pregnant?
1332083622.0,917,A man tells his wife...
1375054165.0,914,Whats the difference between an onion and a hooker?
1358200634.0,915,A wealthy hospital benefactor was being shown around the hospital.
1356101241.0,908,"A physicist, a statistician, and an accountant all apply for the same position..."
1359575661.0,911,50 Shades of Grey
1372995576.0,915,Chris says to his father.
1370519682.0,907,jerry has a 69
1376437789.0,907,[NSFW] A man goes down on a girl..
1359343358.0,902,"I wanted to have sex with my girlfriend, but she was on her period..."
1334645812.0,906,"I’ve been interrogating the dog for two solid hours.
"
1356252209.0,905,A man with an orange for a head is drinking in a bar...
1372132244.0,900,"""Where do you want this big roll of bubble wrap?"" I asked my boss."
1356838785.0,905,Taking grandson fishing...
1352497822.0,907,I saw this cute homeless girl on the street..
1369059036.0,906,"This is the only joke I really every tell, kinda NSFW, but it kills at parties..."
1349966076.0,904,Headaches
1346159557.0,904,A small boy...
1357051684.0,897,Why do the French make omelettes with only one egg?
1340576709.0,901,"I said to my girlfriend,
""Please get me a newspaper.""
""Don't be silly,""she replied,
""you can borrow my iPad.""
That spider never knew what fucking hit it."
1371323126.0,898,What do men do after orgasm?
1351665166.0,892,The Longest Memory in the World
1329133652.0,896,A Police STOP at 2 AM
1359692733.0,895,Polish Divorce
1365011505.0,894,Difference between computers and woman
1359172090.0,885,Why a fourth time?
1355029331.0,887,Why don't orphans play baseball?
1360943938.0,883,"""The price of doing business at the Vet's office"""
1347366973.0,888,on the eve of our anniversary....
1358470239.0,881,Skippy
1345709517.0,888,Plane Ride
1339991479.0,884,Mama and Papa Bear are getting divorced...
1339694846.0,883,A monastery's bell ringer died and the monks put an ad in the paper for a new one.
1338462963.0,884,Why can't the Tyrannosaurus Rex clap?
1370710402.0,878,You Might be a Redneck Jedi If…
1319196669.0,880,Why did the sperm cross the road?
1358139205.0,879,What's the worst part about locking your keys in your car outside of an abortion clinic?
1340866034.0,876,Half a head of cabbage..
1368026317.0,878,How many lawyers does it take to change a light bulb?
1363445038.0,884,The Pill... (Semi-NSFW)
1356923198.0,876,The Bathtub Test
1367450208.0,877,So a woman walks into a pet store...
1346457279.0,870,Taylor swift waved at a boy yesterday
1358626966.0,868,The Bro Code
1366993969.0,870,An old man is pulled over...
1370040181.0,874,A woman in her twenties sees a large black man walking by and decides to flirt with him. “So is it true what they say about black guys?”
1367501811.0,868,A city boy was getting ready to move to the country...
1365603901.0,868,I got fired from my job at the cemetery yesterday...
1345925661.0,872,A married couple has been stranded on a deserted island for many years.....
1375355194.0,865,"A father put a ten-dollar bill, a bottle of whiskey, and a Bible on the coffee table..."
1364574571.0,873,How many divorced men does it take to change a light bulb?
1334694387.0,867,Bedtime Story.......
1366913127.0,867,Sex &amp; Golf
1356109432.0,864,"After the Great Britain Beer Festival, in London, all the brewery presidents decided to go out for a beer."
1365487406.0,861,"A black guy was pulled over in his Mercedes by the police. It was found that it was his, it was taxed and insured..."
1340031036.0,859,A black man and his son were on a plane..
1361634496.0,851,Wise Italian Grandfather.
1340753296.0,854,Weight loss programs
1369500656.0,855,If Microsoft ever makes a product that doesn't suck...
1347331621.0,851,"Wait, what was my line again??"
1351310675.0,852,Man walks into a brothel...
1349965217.0,853,"A woman goes into Discount Fishing Supplies to buy a rod and reel for her grandson's birthday....
"
1318937198.0,851,A  sexually active woman tells her plastic surgeon....
1353647699.0,846,Drinking and driving
1334678376.0,849,Girls night out
1346757039.0,845,Why do the Scots wear kilts? 
1334275629.0,845,An 85 and 25 year old's wedding night...
1368929507.0,845,Retirement bonus
1341544368.0,843,I threw my girlfriend a surprise bukkake party.
1374551924.0,838,What's the difference between Iron Man and Iron Woman?
1369966837.0,844,What's the difference between your dick and a joke?
1341353437.0,838,I was at my bank today... 
1367353698.0,836,My girlfriend is so ungrateful. Whenever I give her an orgasm...
1351445187.0,837,condoms used correctly
1340140345.0,835,"To whoever stole my Microsoft office, I will find you."
1337607158.0,838,George hears the voice of God
1358714257.0,833,Why was Pavlov's hair so soft?
1347384985.0,832,Two friends are drinking in a bar...
1353595466.0,831,How did the swordsman annoy r/jokes?
1326809456.0,838,"I saw a man at the beach yelling ""Help, shark! Help!""
"
1354210626.0,832,"Two little boys, ages 6 and 8, are excessively mischievous."
1353629988.0,827,"The Boy, The Man, and The Closet"
1372700523.0,831,3 blondes walk into a police station...
1358558693.0,832,What do you call a person that constantly hunts for karma?
1361579577.0,826,"When I was younger, I always felt like I was a man trapped in a woman's body."
1359678168.0,827,I was teaching a bunch of black teenagers about slavery.
1356732250.0,828,Two men are sitting next to each other on an airplane...
1351950098.0,827,I'm one of those people who thinks different races shouldn't mix
1351913392.0,827,Why does Waldo wear stripes?
1358643749.0,819,So two Jewish guys are walking when...
1335966826.0,821,Bus Stop Blonde
1366199559.0,824,Buying Condoms
1339260701.0,827,"Hey guys, I just lost my virginity yesterday!"
1345665279.0,822,A Woman Takes Her Secret Lover Home During The Day While Her Husband Is At Work.
1352857881.0,822,I told my doctor that I recently broke my arm in two places.
1351076319.0,816,Three mice
1370125794.0,818,What do you call five white guys sitting on a bench?
1361452486.0,819,Saving all the seats
1361198117.0,819,"A father and his 6-year-old son are walking down the street, and they come across two dogs having sex..."
1356275131.0,819,So I hear you guys like French jokes.
1367243263.0,814,"De parrot, he is dead"
1356895930.0,816,Lose 20 Lbs. Guaranteed! 
1354242562.0,815,What do you get when you mix a broccoli and a melon?
1347662490.0,813,Two gay men were on a bus trip.
1347711716.0,810,"My Dad's ""Irish Golfer"" Joke."
1356545222.0,808,"A 70 year old, an 80 year old, and a 90 year old are sitting on a park bench..."
1333666548.0,806,Pesky Erection
1343578786.0,805,How do color blind people see porn?
1368470655.0,806,Breasts are like beer...
1368853152.0,807,Two guys go moose hunting.....
1365895998.0,802,"A man is dining in a fancy restaurant, where he sees a gorgeous redhead across the table from him..."
1347408916.0,807,nsfw Wife's New Panties
1332244285.0,805,Cinderella
1359520566.0,806,Joke directed insult
1352602853.0,807,There was a farmer who had three daughters 
1373213122.0,799,10 men are about to become priests
1346022775.0,799,Considerate.
1348664355.0,798,college
1373746124.0,799,A U. S. Navy destroyer stops four Mexicans in a row boat rowing towards California...
1351217378.0,801,"This one's a groaner for sure, but still fun. Happy Halloween!"
1348839771.0,796,An older man walks into a bar...
1373846263.0,798,"""Very little scares me,"" said my new girlfriend"
1360464795.0,797,What do you call a rich Chinese person ?
1360170218.0,797,Halloween at a Hospital.
1355102847.0,795,Why shouldn't you date a tennis player?
1341689539.0,797,When I get a few beers in me I tell a lot of these jokes very fast without pausing for laughter or criticism
1359826082.0,791,"An Englishman, an American, and an Irishman are in a bar..."
1355102099.0,787,"A priest, a rabbi, and a minister..."
1336349878.0,793,Sucks to be this guy...
1353298861.0,793,The best underwear jokes....
1344563060.0,788,A drunk walks into a bar...
1373339237.0,792,What do you call a happy cowboy?
1364991806.0,784,My favourite Haiku
1372684930.0,787,My favorite joke
1337873012.0,784,The Silent Fart
1366975158.0,783,Boudreaux &amp; Thibodeaux
1373921796.0,780,Warm Milk
1372546079.0,781,Ive been told I'm not ambitious enough....
1353647190.0,782,"An old, blind cowboy wanders into an all-girl biker bar by mistake"
1371532181.0,781,A Guy Goes Into A Bar
1358263834.0,774,adam and eve finally figured out the whole sex thing...
1364007681.0,775,How do you spot the blind man at the nudist beach?
1351022450.0,773,I almost got raped in jail
1355818950.0,766,Hellen Keller walks into a bar.
1358435552.0,769,OLD AGE AND TREACHERY WILL OVERCOME YOUTH AND SKILL EVERY TIME!
1348692196.0,769,My girlfriend left a note on the fridge:
1336622595.0,766,I wouldn't be mad. 
1360248213.0,769,Cough Medicine
1321383917.0,767,drunk driving.  
