created_utc,score,title
1363048014.0,3415,Kubrick sneaking a self shot while pretending to take one of Jack Nicholson
1354108698.0,3184,Hotpants 
1353251715.0,2770,Girl with typewriter and a smoke. (x-post from /r/typewriters)
1354295746.0,2731,Leather Clad English Rocker Girl 
1351084589.0,2682,Einstein and his therapist. 
1374291066.0,2614,"My great granddad with his then girlfriend, Amelia Earhart"
1373550761.0,2606,"Found this photo of my grandfather while going through pictures with my grandma for his funeral, amazing."
1360813560.0,2596,My mom was a very cool lady who passed away a few days ago. This is her and Mick Jagger. 
1370000023.0,2545,My grandparents at the beach in the 50s
1369412786.0,2531,Street style in the 1940's
1363281041.0,2524,"My Afghan parents posing in front of a bus in Tehran, Iran. The young girl in the photo was a random bus passenger that wanted to be in the photo."
1369920368.0,2529,1950s style sass.
1367256629.0,2499,We looked good in 1950. Now everybody in this photo is dead but me
1359477712.0,2495,My mother... sometime in the 1970s
1358053660.0,2435,My Grandfather at 4 years old. 
1368628347.0,2421,"Paul Newman in Venice, 1963"
1372196579.0,2420,Patti McGee (first female professional skateboarder)
1371572744.0,2398,A young Arnold Schwarzenegger posing with a glass of cognac in his hand and a girl at his feet
1372624032.0,2364,"[Follow up] On Friday, I posted a picture of my grandmother in Athens in the 1960's. I had requests for more pictures. Here's an album I put together."
1372082047.0,2363,"Mr. James Brown, 1967"
1363541023.0,2356,Jimi Hendrix
1364405957.0,2343,My dad in 1984 trying to transfer files from his Commodore 64 to his first Apple computer
1353163537.0,2293,"High school gym teacher Leonard Skinner, holding the latest album by a band made up of his former students: Lynyrd Skynyrd (1977)"
1353765671.0,2293,Old school London - (1963)  
1366818307.0,2284,The Last Kiss (WWII)
1357591500.0,2271,"My brother, bunking off from school.  London.  1977."
1368464944.0,2233,My aunt was a punk in the 80's. She still leaves all of her fucks at home whenever she goes out.
1370277660.0,2181,Johnny Cash messing around with Bob Dylan [xpost /r/gifs]
1354887228.0,2174,Wonder Woman isn't impressed
1369321164.0,2165,New York Subway in pictures from 70 and 80
1361845514.0,2145,Elijah Wood &amp; Leonardo DiCaprio at the Academy Awards in 1994
1373631523.0,2123,The Notorious B.I.G.
1352008908.0,2116," [ALBUM] High school fashion, LIFE 1969"
1367338615.0,2085,12 year-old Bill Clinton with his sax
1364271888.0,2070,My grandmother kept this photo of my grandfather in her wallet all her life.
1368135516.0,2069,The face of jealousy.
1366962051.0,2059,"New Year's Eve party, c.1960"
1374074810.0,2027,Grandpa's selfie - circa 1913
1367932363.0,1998,Vladimir Putin spying on Reagan as a KGB agent.
1353344834.0,1985,School dance.  1950.
1363869579.0,1976,Elijah Wood &amp; Macaulay Culkin
1373123484.0,1983,Some Rare &amp; Old Photos Of Famous Folks
1361240432.0,1978,My Grandparents were beautiful.
1350834897.0,1977,"1953 - Photobooth, the only place really where photos like this could be both taken and developed safely. (x/post from r/pics)"
1374148681.0,1961,1974 New York Pride: Parents Come Out in Support (x-post r/ainbow)
1370132832.0,1962,"It's 106 miles to Chicago, we got a full tank of gas, half a pack of cigarettes, it's dark... and we're wearing sunglasses...."
1357758984.0,1961,A wolf in sheep's clothing (Xpost r/Graffiti)
1375539114.0,1962,My grandfather in WWII. The epitome of badass
1361306183.0,1955,"My grandfather, drinking with friends after raiding one of Hitler's headquarters. (far right)"
1357181452.0,1956,"Rare vintage photograph of an onna-bugeisha, one of the female warriors of the upper social classes in feudal Japan (emerged before Samurai)"
1358277459.0,1949,"My Grandpa, A member of the Lake County Sojourners(Biker Gang), in 1980. He gave me this photo before he passed"
1372778944.0,1944,"My beautiful grandmother, 1964"
1371834550.0,1942,"Clint Eastwood makes a fan’s life by giving her a kiss while in Durango, Mexico, 1969"
1375108106.0,1943,My father c.1977
1360425900.0,1914,My Grandma and her Dad taking the day off
1376131477.0,1894,Jack Nicholson carrying a picture of himself.
1356014046.0,1876,James Dean and Marilyn Monroe
1373283463.0,1856,"Grace Kelly, 1955"
1373828055.0,1853,"Disneyland, 1961"
1371907935.0,1853,Just playing cards
1362066868.0,1852,Helen Keller meeting Charlie Chaplin. (1919)
1360505702.0,1845,My buddies grandfather and friends in Paris in the 1940s
1353413144.0,1850,"My grandfather, shortly after he emigrated to England, mid-1950s"
1376599377.0,1848,"Showgirls playing chess backstage at the Latin Quarter nightclub - New York, 1958 (via /r/VGB)"
1353848119.0,1841,If you don't buy Drummond sweaters...
1360988100.0,1837,"Young girl on an airplane, 1977"
1362336478.0,1803,JFK was incredibly classy.
1370194038.0,1798,"Polaroids of Debbie Harry, taken by Andy Warhol, 1980"
1365001969.0,1789,Photo Of 19 Year Old Lucille Ball
1376487779.0,1780,"David Bowie and wife Angie taking their baby out for a walk, June 1971."
1375473180.0,1768,Some extremely radical boys in the 1991 Sears catalog
1362493821.0,1768,Lo-fi Tom Waits
1375804886.0,1760,"Two girls at the Hyde Park Music Festival, July 1969"
1368280915.0,1765,"Cuba, September 1959. First day of school"
1358763219.0,1756,Seem to be a lot of bikers from the 70's in here recently. Me in 1977.
1371408888.0,1755,Young Kevin Spacey
1344869831.0,1756,Times Square 1943 In Color
1359287757.0,1732,Can't beat that.
1356351963.0,1734,Sophia Loren (1955)
1370357955.0,1720,Sid Vicious going to see Bowie 1973
1352904680.0,1723,"Steve McQueen and his wife, Neile Adams"
1357310188.0,1721,Jamaican men early 50s
1372941847.0,1714,Robin Williams
1351764298.0,1724,Old school saucy love (1920s)
1359723493.0,1707,Toshiro Mifune
1363177874.0,1677,Eatmore Ice Cream
1355490127.0,1683,We used to leave the house to play video games.
1374512870.0,1675,The Beatles before they were popular.
1364148913.0,1667,"My dad, being....   my dad. I miss him."
1358525550.0,1638,My grandpa might have forgotten to tell me that he has a License to Kill. [x-post from /r/pics]
1374668195.0,1638,A darker haired Brigitte Bardot (possibly NSFW?)
1361627373.0,1625,The original punk chick (Xpost /r/OldSchoolCoolMusic) 
1369482423.0,1623,"Mods in swinging London, 1960s"
1358173789.0,1624,John Lee Hooker
1376303754.0,1623,Somewhere in Tibet. ~late 70s. Dads been gone over a year. But these shorts are immortal!
1355072573.0,1624,College party from the 60s.
1374985139.0,1618,Lego advert from 1981
1360366315.0,1595,The classic lunch counter... 1960s.
1361032051.0,1601,Tony Hawk in the 80s
1360591814.0,1599,"Unknown man with afro, 1973"
1372414889.0,1594,"Natalie Wood, New York, 1961"
1360092546.0,1561,My grandfather was a real looker. My grandparents wedding day.
1371658989.0,1560,Just Freddie being Freddie.
1373485679.0,1561,My grandparents on a date in Coney Island during the 50s.
1356280047.0,1545,Found over 1000 old slides when cleaning out my grandma's house. Favorite one is my grandpa at Hollywood and Vine - 1957
1373373949.0,1547,Keith Richards
1351662260.0,1542,Tattoo parlor in the 1920s (x-post from r/pics)
1376410123.0,1540,"Mercedes-Benz and owner, 1970's"
1363713230.0,1538,A boy showing off his new Mohawk hairdo to his friends.  1951
1374757610.0,1531,Co worker was a double of Liz Taylor. Picture taken when she was 19.
1340299171.0,1529,My grandfather back in 1954
1355775436.0,1531,Beastie Boys meet the Idol
1359563327.0,1517,"Race Day, pretty girl with a Ferrari "
1361897214.0,1513,"Jane Fonda, 1965"
1352130496.0,1499,Monty Python
1370533286.0,1498,The Queen and Princess Margaret
1362412788.0,1493,RIP John Candy. 
1366889148.0,1498,"Hugh and the bunnies, Playboy 1950"
1372326381.0,1490,A young Penn and Teller
1368548839.0,1486,Young Al Pacino
1369837859.0,1473,JFK would have been 96 today
1372942701.0,1468,Young Jessica Walter (Lucille Bluth) (x/post r/arresteddevelopment)
1374355562.0,1457,Brigitte Bardot enjoying the 60s sunshine
1373899487.0,1456,Bob Marley enjoys a beer after a football match
1376056009.0,1455,Paul Newman
1350136000.0,1451,WAY OLD school Cool: Never seen a Civil War era image with a smile like this!
1354547757.0,1448,Stand by Me
1354027922.0,1444,19th Century Japanese Cool
1360305367.0,1443,"My parents, 1981."
1364753658.0,1430,"""Negro boys on Easter morning, 1941, Southside Chicago"" - Russell Lee"
1369004022.0,1424,Summer Vacation
1355246121.0,1424,Old School Attitude
1372014434.0,1417,Led Zeppelin in 1970
1366714332.0,1412,"Sally Halterman, the first woman granted a license to operate a motorcycle in Washington, D.C., 1937."
1353603401.0,1411,Unlikely pinups: Depression-era portrait of a working-class couple 
1352829210.0,1409,"Came across this picture of my granddad. Apparently, he was a total bad-ass."
1362845277.0,1407,Johnny Cash
1361789954.0,1397,"Frank Zappa and his parents, 1971"
1343089879.0,1400,my favorite Marilyn picture   
1371730574.0,1400,"Buddy Holly and Waylon Jennings in NYC photo booth, 1959."
1357391481.0,1400,Debbie Harry [pic]
1365946706.0,1393,Just Colonel Sanders chilling with Alice Cooper
1360253555.0,1393,One of the first viable color photographs
1358421024.0,1393,The Rat Pack
1375034727.0,1394,Full-body tanning back in the day
1356582711.0,1387,Have a photo of my granddad from his days as an Army corporal.  
1371291839.0,1380,My Grandfather is ready to kick-ass and take names and my lovely Grandmom could jumpstart a heart with her smile.
1363474792.0,1376,My late grandmother in 1958. She continued to be this cool until she died.
1356634513.0,1378,"My badass great grandpa, when he was chief of police in Harrisburg, PA"
1357057491.0,1371,My grandma and mom with their grocery getter in 1966.
1364347063.0,1362,My Grandpa circa 1939. He died last week at 99 years old. Tended a farm in Idaho for 60+ years. The hardest working man I have ever known. RIP Grandpa.
1368068919.0,1354,Another young Michael Caine
1366479802.0,1359,"My great-grandfather, looking dapper in 1930's Ireland"
1354726752.0,1352,Dead Kennedys 
1341689192.0,1343,My great great grandfather's med school graduation photo
1365264813.0,1343,Old school photo retouching of Joan Crawford. I've always thought this was so interesting.
1374411930.0,1349,"Helen Mirren long before ""Red"""
1358946395.0,1346,Bruce Springsteen
1356878202.0,1336,"The first Bond girl, Linda Christian, 1945."
1363351688.0,1335,Beware the dog
1375416124.0,1326,My Buddy's Dad in 'Nam. It should be an ad campaign for Budweiser
1372691563.0,1318,"Kira Roessler, bassist for Black Flag, 1984"
1362627701.0,1324,Promotional poster for Queen's vinyl single of Bicycle Race and Fat Bottom Girls (x-post from pics)
1358099306.0,1322,"Astronaut Anna Fisher, May 1985, Life Magazine ©Bryson/Sygma"
1357496186.0,1311,Man riding NYC subway circa 70's
1355710577.0,1312,"Steve-O and Tommy Lee, 1987"
1369232988.0,1313,Priest in New York City. 1970.
1359891559.0,1310,Hunter S. Thompson
1375752661.0,1308,My Mum working at a newsagent stand in the 70's.
1367551823.0,1307,Me and my friends Prom 1990 (xpost from r/pics)
1349146404.0,1305,The Outsiders
1371057066.0,1299,"Clark Gable, Shirley Temple, Mickey Rooney and Judy Garland in 1942 (Found on /r/awesome)"
1356701884.0,1301,Low Pass
1351430175.0,1295,Michael Jackson and Freddie Mercury 
1368776311.0,1298,"The models for ""American Gothic"""
1371485793.0,1292,Johnny Cash Sitting in the Bushes Eating Cake
1358798986.0,1290,"My grandfather in his prime, part of the first generation of surfers in Huntington beach. RIP."
1366770100.0,1292,Farmers in rural Ireland enjoy catching up over a few pints. 1963
1360000321.0,1291,Freddie Mercury
1374885456.0,1285,Girls enjoying themselves on the lake (1971)
1364221793.0,1293,My dad playing Nintendo in the 80's
1366121989.0,1280,My Grandpa stylin' next to his old Ford.
1358353692.0,1283,"Len Dawson, former QB of Chiefs, in locker room during Super Bowl I. (x-post r/nfl)"
1355667576.0,1275,Marilyn in denim
1345642505.0,1273,Young Michael Caine
1370734569.0,1270,Madeline Kahn and Gene Wilder. They were cool.
1357142797.0,1264,Scorsese and De Niro
1349971021.0,1264,Young Elvis looking punk as fuck.
1371345371.0,1258,My grandma back in '89
1365772296.0,1260,Jean Seberg
1370051263.0,1252,Biker chicks then and now
1366032651.0,1245,Otis Redding
1359819422.0,1251,The infinitely surreal Salvador Dali [500x650]
1358614160.0,1240,B-Girl in the South Bronx (1970's)
1351857983.0,1243,Jay Adams
1363611254.0,1239,"Here is my 17 year old Mom in 1962. 5 years later, she was a hippie."
1367501089.0,1236,Lauren Bacall giving her signature look.
1355320594.0,1232,"A windy wedding at Notting Hill, London, 1965."
1365715646.0,1234,Sheriff Bart
1361970904.0,1229,My Pensive Pops in Vietnam 
1357831090.0,1235,Peyton Manning during college at Tennessee
1362223573.0,1217,Bettie Page 
1360675806.0,1216,Bowie
1363927113.0,1214,Monty Python...
1357928700.0,1211,my great-grandpa showing off his new ride (1930s)
1362289005.0,1214,Helen Mirren
1364931205.0,1202,Michael Caine playing dice
1365055541.0,1204,My ridiculously photogenic grandpa.
1373713573.0,1208,"Inmate at Greene County Convict Camp dancing to the music of Piedmont blues guitarist Eugene ""Buddy"" Moss, 1941. [photo by Jack Delano]"
1364696473.0,1198,My Great-Grandpa was the World Heavy Weight wrestling champion of the world from 1945-1949
1359128102.0,1194,Ernest Hemingway posing as a boxer while wearing a fake mustache. 1920.
1365087392.0,1187,"""Sir Michael Caine demonstrating the effect a good suit can have on a beautiful woman"""
1375639445.0,1191,My mom with her 1965 1/2 Corvette (xpost r/thewaywewere)
1370612916.0,1185,"Neil Armstrong Lighting a Cigar, March 1969"
1371120647.0,1188,"Getting Down on the Double Bass. National Rice Festival, Crowley, Louisiana, 1938. [photo by Russell Lee]"
1355409372.0,1176,"Elizabeth Taylor (~late 50s, early 60s)"
1365359901.0,1177,Just MLK Jr. on a payphone with shades on (x-post from r/pics)
1361461111.0,1172,The cast of the original Star Wars trilogy
1375988150.0,1173,Nat King Cole
1370881102.0,1166,Spotted this badass in the wild yesterday... Thought you all would appreciate.
1356201748.0,1167,"I see your badass relatives and up you my dad playing with his 1982 punk rock band ""The Nevar"""
1351006858.0,1169,Deep sea diver
1350399711.0,1164,My dad in the early 70's
1358001716.0,1160,Delta Tau Chi - 1962
1352308235.0,1163,Any love for John Steinbeck out there?
1365601334.0,1155,John Bonham
1360161261.0,1163,Jean Shrimpton
1375302692.0,1155,"Did someone say early, never-before-seen Metallica pictures?"
1364627857.0,1155,"Coney Island Teenagers, 1949"
1372508538.0,1151,Wrestlemania 3 Hulk Hogan vs. Andre the Giant 1987
1362931214.0,1151,Alexander Graham Bell kissing his wife
1363998085.0,1148,Airline stewardess 1968 (X-Post r/pics) Thought this belonged here.
1366389183.0,1141,R.L. Burnside
1364526306.0,1142,"Yes, those are Mountain Lion Kittens"
1361545767.0,1139,Catherine Wilke sunbathing (1980) by Aaron Slims
1350314263.0,1139,Daper Gents in 20s Harlem
1365669574.0,1139,Betty Davis - One of the funkiest women ever
1369064154.0,1136,Cigarette break (1930s)
1372265582.0,1133,50s beach bunnies
1359554169.0,1134,Audrey Hepburn and Grace Kelly. Beauty and Elegance overload. [xpost r/pics]
1352555153.0,1130,"The Obamas. 1996, Chicago. by Mariana Cook"
1374829660.0,1131,Robin Williams &amp; Christopher Reeve
1347007080.0,1118,Bill Clinton and Hillary Rodham enjoying some soccer [Summer 1975]
1359348524.0,1125,"The only picture we have of my great, great grandmother Maria who came through Ellis Island from Italy. "
1353370906.0,1127,My beautiful mother in 1969
1356098298.0,1114,"Jazz musician Chet Baker at the piano, Hollywood, 1954.   Photo credit: William Claxton"
1354476222.0,1114,Testing a bulletproof vest in 1923 (x-post r/photoshopbattles
1367847014.0,1107,Yvonne De Carlo
1359226206.0,1111,Rude girl
1374240296.0,1109,"my parents in the 70s, just hanging out in the backyard"
1375876330.0,1109,It's only Rock and Roll but I like it.
1340813238.0,1103,Dorothy Counts: classy in the face of racism.
1351512632.0,1102,"These are my grandparents on their on their honeymoon in Washington DC, 1956."
1349309991.0,1102,Notorious BIG after graduating kindergarden. Cool as the other side of the pillow. [xpost from /r/hiphopheads]
1362684566.0,1101,"Found this great old photo of my Great Grand Uncle and Great Great Grandfather in Ontario in 1922 (both on the far right). Members of the Wyandot Tribe,hope this is the right sub x"
1354425171.0,1097,"NASA, retro style."
1372871894.0,1095,The Rolling Stones 1967
1367256983.0,1103,Stephen Hawking before he developed ALS (x-post r/pics)
1355140434.0,1092,The Beatles
1355189247.0,1101,Michael Caine
1366289068.0,1094,My grandfather teaching math back in the day
1362996015.0,1089,"From my dads photo archive (late seventies, Norway)."
1365518854.0,1090,Jimi Hendrix enjoying some tea with his Strat.
1369564097.0,1090,cowboy
1364822743.0,1087,Suburbia
1353028872.0,1083,Young Donald Sutherland being awesome
1344767856.0,1091,(1957) Teenagers going on a date  (X-Post From /r/WeAreTeenagers)
1359617445.0,1078,Nina Rindt recording lap times at the 1969 British Grand Prix (x-post /r/F1Porn)
1357676115.0,1068,Classy as fuck. 
1360940428.0,1069,72nd Highlanders during the Crimean War - 1854-'56
1374938419.0,1070,"Ninety miles an hour, girl, is the speed I drive..."
1358684828.0,1063,The Doors
1372478616.0,1067,"I was told you would appreciate this photo. My grandparents worked for National Geographic for almost 30 years. Here's my grandmother in Greece. Not sure of the year, but one can guess from her awesome sense of style!"
1361373842.0,1060,Winston Churchill set to test a Thompson SMG  [1940]
1365563425.0,1059,That's what I'm talkin' about...
1350031939.0,1064,"UT women’s track practice, March 1964."
1343534271.0,1062,Last Kisses Goodbye... ;_;
1360172684.0,1056,Neil Degrasse Tyson in 1980. What a badass.
1352208828.0,1051,Teddy Roosevelt
1372170922.0,1051,"Blondie, Hollywood and Vine, 1978"
1365159103.0,1049,"Ronnie ""The Bren Gun Girl"""
1360872755.0,1054,Raquel Welch (might be a risky work click/no nudity) NSFW
1367591355.0,1056,My dad with 2 dates to one of high school formals. (Early 1960s)
1376170861.0,1049,Grandpa dancing with some redhead
1375691763.0,1051,My god. Mary Astor.
1371237055.0,1044,My mom circa 1985
1355064432.0,1042,Jane Seymour
1359945256.0,1038,John Coltrane
1341322950.0,1029,Princess Yvonne and Prince Alexander of Sayn-Wittgenstein-Sayn in Germany. 1955.
1369117073.0,1028,"Picasso drawing with light taken by Gjon Mili, 1949"
1367691535.0,1028,My Great Grandparents In The 1920s
1351283299.0,1030,Salvidor Dali and Raquel Welch
1345193215.0,1031,"My dad in Antarctica in 1977. Not strictly old school, but I think it's pretty cool."
1359651349.0,1022,Albert Einstein
1356449527.0,1024,Syd Barret
1339947338.0,1017,An American officer and a French partisan during a street fight - 1944
1364878242.0,1024,Veronica Lake
1350780024.0,1015,My grandfather and his Roloflex
1359856573.0,1010,Ellen O'Neal 1976
1375937213.0,1015,Spectacular photo of a young Lucille Ball.
1363107442.0,1004,"Audrey Hepburn in the Congo, 1958"
1364568816.0,1002,"Skateboarding legend, Ellen O'Neal going freestyle (1977)"
1360779360.0,997,Beastie Boys - Early 80s
1370788875.0,996,Steve McQueen rolling around LA in his Jaguar XK-SS in 1963.
1349621401.0,996,"My Great-grandfather. Wrong side of the Mexican Revolution, right side of Cool."
1368205761.0,994,Came across a bunch of pictures of my father back when he worked as a sports photographer/artist in New York.
1355416599.0,988,Bill Fucking Murray!
1352205290.0,988,This really needs to be here (x-post r/pics)
1368394413.0,993,A smile that makes you smile.
1368355524.0,989,"Even though I'm just 25, my grandfather was born in 1891 and fought in WWI. Here is my dad's favorite photo of him in his uniform. [reposting since I wasn't aware of OldSchoolCool before, woops!]"
1356915573.0,992,1940s New York
1376544885.0,982,"Bill Cosby when he played football at Temple, 1962."
1375716885.0,979,"John F. Kennedy has a tea party with his daughter, Caroline. Circa 1960."
1375370084.0,972,My mom looking pretty cool in the 60s
1337431969.0,966,"My grandma and grandpa on their first date, 1957"
1354811245.0,971,"Not tonight, I have a headache."
1372566971.0,966,"Broadway, 1972."
1367434163.0,963,It turns out that I have the same coat that was on Mad Men last week. It belonged to my grandmother.
1367793682.0,960,Girls dancing at the Rolling Stones concert in Hyde Park in 1969
1367162956.0,962,My grandpa on his first date with my grandma in the 50's.
1364908782.0,957,Django Reinhardt
1354195939.0,957,Mae West
1354627432.0,960,Alva '77
1362583405.0,957,Black and White still from Aliens.
1366170776.0,954,Growing up with my two older nerdy brothers was a blast.
1370959846.0,955,My grandparents were some cool cats
1354767505.0,948,The beautiful Rita
1366558265.0,954,"""The Wonder Spot"", 1950's postcard from Wisconsin (link in comments)"
1357245412.0,948,Salvador Dalí and his anteater
1371784612.0,950,Was suggested I share with you guys. My Great Grandma (Left) &amp; my Great Great Grandma (Right) on one of the first Harley Davidson's ever made. Picture dates from around 1905 and it's the first time I've seen them.
1359028146.0,944,Errol Flynn
1375194264.0,941,"Rocking a pompadour, 1966"
1356757074.0,938,Turds of Misery 
1339559814.0,942,My beautiful grandmother died this year. Here's a picture of her and Elvis when she was 19. He even signed the back!
1363419386.0,944,"Unknown Pic from a family album, 1920s (?) Sweden. Sorry for bad quality..."
1353599304.0,936,"Buddy Holly, the original nerd."
1350520823.0,936,Sophia Loren in shorts
1348799795.0,933,"Does my great great grandfather looking classy as hell count as Old School Cool, or is this place just for dead celebs?"
1373938258.0,935,"Hemingway relaxing on his boat with a pina colada, a tommy gun, and his son Jack"
1368902095.0,931,My grandpa just before he went to Vietnam at age 18.
1345569016.0,929,"Johnny Cash at Folsom Prison, 1968"
1373996391.0,927,"Quitting time on the Bay Bridge construction, 1935"
1375469117.0,923,Ernest Hemingway with a shotgun.
1369747592.0,925,"Dean, Bing and the Chairman of the Board"
1369596354.0,922,"Fraternity men at the University of the South, 1940"
1373060213.0,916,Great Grandfather in 30's. Might be a member of the Corleone family.
1346502038.0,922,"A Russian man at leisure, 1900’s."
1373451293.0,918,My brother and I had a band in the 80s.
1367121871.0,915,My Great-Grandfather and Grandfather in 1965
1363244337.0,910,A portrait of my Grandmother Helen at 19
1364038703.0,916,The Band
1363710673.0,919,"David Bowie plays a 12-string guitar in LA, 1971."
1367404110.0,912,Horiyoshi III
1361117120.0,907,Jaco Pastorius
1358594998.0,907,my great-great grandfather chillin with his friends (xpost from r/pics)
1342528981.0,907,Several members of Monty Python in 1976
1367556126.0,904,My grandparents out on a date
1366191006.0,904,Tattooed sailor aboard the USS New Jersey-1944
1356529205.0,907,David and Gary. 
1369183155.0,892,The Stunning Betty Page (Mid 1950's) [NSFW]
1343414657.0,893,Bill Murray and Hunter S. Thompson on a boat
1365887655.0,900,You can almost feel the speed. My dad driving a moped in the 70's.
1355598559.0,893,OldSchool Hockey Players.
1354250224.0,898,Evil
1342454355.0,894,Audrey
1350070289.0,891,Julie Newmar in a Polka Dot Bikini
1370457910.0,893,"""George Bush delivers illegal, but gratifying right hook to opposing ball carrier."" Former President George W. Bush while playing on Yale's rugby team, c. 1966. [x-post /r/HistoryPorn]"
1358238410.0,891,Pineapple Guy
1370946394.0,892,Ringo Starr selfie
1343013436.0,888,My Mum in the 70s. This is one of my favourite photographs of her.
1354024744.0,884,"Actor Oliver Reed died of a heart attack at the age of 61, after downing three bottles of Captain Morgan Jamaica Rum, eight bottles of German beer and several doubles of Famous Grouse whiskey, and beating five Royal Navy sailors at arm-wrestling."
1353968293.0,883,"Johnny Rotten and Joan Jett, 1978"
1355555763.0,886,vintage style
1350907593.0,888,Jumping a motorcycle in 1966 as a schoolboy at Eton (x-post from r/pics)
1364477583.0,880,"An interesting commute, no doubt."
1345127327.0,882,Bo Diddley on a scooter
1356823373.0,882,Betty Brosmer
1350580334.0,877,Rita Hayworth &amp; Marlene Dietrich
1371007250.0,877,Sassy ladies on the town 1960s
1369173081.0,879,Leonard Nimoy [x-post from r/startrek]
1345244708.0,874,Some weird guy with Run DMC
1363445434.0,869,"Michael Caine, you handsome devil."
1363118695.0,872,"[NSFW] Salvadore Dali's ""In Volupta Mors"" shot by Philippe Halsman using live models [1951]"
1359028249.0,873,Michael Caine
1373040285.0,868,Eric Idle and George Harrison on a boating trip.
1358861432.0,866,Britt Ekland
1348251901.0,865,"Winston Churchill in full uniform, age 21 - 1895."
1361725550.0,864,Nurses playing soccer (1940s) 
1373749807.0,857,Elvis in the 1950's
1346761319.0,854,My great great grandfather and his brother at the pool hall they ran in the 20s
1355881022.0,841,My Cherokee great grandmother in 1917. 
1365192948.0,845,Audrey Hepburn
1365470246.0,836,Audrey Hepburn and her pet fawn Pippin
1358886951.0,841,jack nicholson
1353499191.0,841,Today I got my 4-Year Club badge from Reddit!
1344445353.0,839,19 year old Jane Fonda in a 1957 test shoot
1368734643.0,838,Jon Stewart when he was on the William &amp; Mary soccer team
1349002487.0,838,"Yearbook pictures of rock and metal icons. They got cooler with time, I guess."
1341497924.0,834,"Teddy Girl, 1955"
1374579552.0,831,Walter Elias Disney (x-post from pics)
