created_utc,score,title
1374598345.0,828,"Celebrating 100 years of the Hot Dog - Coney Island, 1967"
1362031799.0,821,My first true love.
1357426199.0,824,Another Betty Brosmer
1367656155.0,820,Nuns see no irony laughing at Sixties chick (1968)
1370101000.0,809,Founding fathers of quantum physics
1342696290.0,811,Rita Hayworth was easy on the eyes.
1373329544.0,805,Wilt Chamberlain running highschool track
1360776904.0,803,"Bob, Mick and Peter"
1352054948.0,808,Jane Goodall
1352707662.0,811,A Great Day In Harlem: All The Coolest Jazz Cats In One Place
1357141103.0,803,My dad and friends backpacking in Patagonia - 1981
1371972956.0,805,"My 'Aunt Fred' and his husband Gary, back in 1974."
1343971652.0,809,"The first photo of a person ever taken - Robert Cornelius, 1839."
1352610372.0,801,the chosen few MC
1347589816.0,806,Brighton Swimming Club 1863
1358712479.0,803,Here's my father in the late 70s doing a wheelie up a mountain. Sweet mustache too. (x-post from /r/pics)
1355931593.0,801,"My grandpa, a Navy sailor in WW2"
1347640348.0,805,Cassius Clay dressed like a City Gent.  London.  !963
1344983347.0,800,Freaks and Geeks Cast
1350689839.0,800,My dad's funeral is tomorrow. Here's to the king of anti-cool.
1365426495.0,800,"Great great grand-pops smoking a cigarette, selling coffee in Paris."
1353691875.0,796,Tippi Hedren
1352747008.0,795,britt ekland
1358618053.0,790,A picture of my dad from 1971. I've always thought this would make a good album cover.
1351842888.0,787,Jimi
1346423232.0,792,"Whilst searching for images for /r/oldschoolcool, I came across some guy named geoffe's imgur gallery. Hundreds of thousands of images of old actors, actresses, models, etc. Some images NSFW!"
1354374661.0,787,French actress Liliane Brousse
1341159309.0,790,On the way to Woodstock 69
1368019740.0,779,"Elvis Riding a Triumph Scrambler in the Desert, circa 1960's?"
1364136686.0,784,The Who 1970.
1375597750.0,777,A nineteen year old James Dean...
1356812602.0,771,"Hells Angels riding, 1965 (check that sweet stache)"
1346053535.0,777,The Rat Pack messing around
1367996288.0,770,Elvis with his dad
1368838358.0,767,Old school Batman
1361119860.0,770,Mountain Man
1352361609.0,773,Noam Chomsky
1348931251.0,766,"The New York Times Writers, 1942"
1355961106.0,766,The London Underground in the early 1900's
1345739668.0,768,"Françoise Hardy, circa 1966."
1355162202.0,762,Jessica Walter (mother from Arrested Development)
1345023547.0,764,Inside a 1913 Drug Store. Beautiful details
1359065233.0,762,Bones Brigade '86
1366630015.0,756,Paul Newman and Joanne Woodward
1335701942.0,758,Alan Shepard at Mission Control
1359392317.0,753,Steve McQueen racing the Baja in 1971
1372172592.0,751,In memory of the beautiful Farrah Fawcett
1354972449.0,754,Joan Collins
1352465997.0,752,Carole Lombard
1346197969.0,751,Freddie Mercury and Cats
1360240981.0,750,Janis Joplin
1349276676.0,752,"Playboy Bunny, 1962"
1367097868.0,745,WWII Russian soldier ready for battle
1346690206.0,746,"Akira Kurosawa and Toshiro Mifune in Venice, 1960"
1351599475.0,746,Grace Kelly right after graduating high school
1348451473.0,749,Bruce and Brandon Lee
1353658898.0,744,Linda Ronstadt was a total babe
1348072755.0,744,Friend's dad being an old school badass
1362880891.0,738,My dad and his cousin in 1973! (New York)
1347286690.0,744,"John Wayne, circa 1930."
1367872486.0,737,How about some Bruce Lee.
1351168164.0,738,Vincent Price
1352745351.0,735,Audrey
1343239176.0,736,Bruce Lee is pretty fly
1342398019.0,735,"""Negro boys on Easter morning, 1941, Southside Chicago"" by Russell Lee "
1347816104.0,735,Raquel 'good lord' Welch circa late 1960's
1338570487.0,734,Skateboarding in New York in the 60's
1366411157.0,728,"My grandparents, circa 1958."
1350661016.0,732,Humphrey Bogart
1365333497.0,724,Lemmy from Motörhead and James from Metallica.
1376362690.0,723,Clint Eastwood holding an armadillo
1370695174.0,724,Nina Simone. She put a spell on you.
1353332035.0,720,"Royal Air Force Pilot, 1944"
1359927418.0,719,"To me this car just shouts ""Old School Cool!"" The 1949 Delahaye Type 175 Roadster."
1347889165.0,714,"A pilot at Fairlop airfield in Essex has a haircut during 
a break between sweeps, November 1942."
1374419291.0,715,My dad and my uncles checking out my grandpa's new Cadillac c. 1956
1362155003.0,711,"My dad, circa late 60's/early 70's"
1352658046.0,710,"My grandfather, a different kind of veteran"
1364737590.0,709,"""Find what you love and let it kill you."" Bukowski at the piano"
1349534316.0,708,One of Japan's All-Time Biggest Pro Wrestling Stars: Giant Baba
1358809313.0,706,Barefoot Liz Taylor
1368715860.0,707,James Dean
1355844403.0,705,Joe Strummer
1349794364.0,700,My nan and granddad all loved up in late 1930s 
1367072959.0,703,Paul and Linda McCartney with David Gilmour at the Knebworth Musical Fair in England in 1976 [630x445]
1361154079.0,700,Cash and Dylan
1362760964.0,699,Sonny Stitt
1358477985.0,698,My Gramps in Cuba during the war.
1364992258.0,699,"Norfolk, Virginia, 1972"
1341045257.0,697,Old school villains 
1358784118.0,701,Marianne Weber in 1952 speed testing the R68. In my opinion the coolest photograph of a woman on a bike in the world.
1344261907.0,696,"Rob Zombie, 1983"
1371476088.0,690,"A young woman walks by the drains to pass a street being levelled (Trondheim, 1963)."
1355010040.0,688,Johnny Carson and some old school beauties
1343748311.0,693,Sigourney Weaver
1356402104.0,689,Nancy Sinatra in one of my very favorite pictures of all time. 
1343661403.0,689,"Long before she parachuted into London with James Bond for the Olympics, Queen Elizabeth II welcomed Marilyn Monroe to London in 1956."
1343796233.0,689,Sally Field as Gidget too cute.
1335709500.0,691,Sophia Loren (circa 1953)   
1351172429.0,687,Stanley Kubrick
1369786302.0,682,Marilyn Monroe Gettin Down
1375250274.0,676,[1956] Your 5 megabyte had drive is here! IBM 305 RAMAC
1348853023.0,685,Last week we discovered that my Nana's camera still had undeveloped film in it from 1970. Here are the photos with a small story of the people in them.
1372255112.0,681,"Joan Jett, Santa Monica, 1977"
1353356841.0,674,"My Grandfather, I wish I could've befriended him as an adult back when this photo was taken"
1364303671.0,677,"Andre the Giant, 1967"
1367050621.0,677,"My grandfather, Colonel Warren Leroy Anderson. MIA April 26th, 1966. RIP"
1352986140.0,676,Orson Welles
1362744510.0,672,"Anthony Kiedis, Flea and unknown guy "
1338919227.0,671,Deborah Harry 
1364571689.0,666,"A group of bay area students in street length skirts, 1961"
1347459214.0,670,Michael Caine
1336644135.0,667,Neil deGrasse Tyson
1368391219.0,669,"My grandfather with his car ca 1957. I never got to meet him, but he was apparently a really cool guy."
1352395335.0,663,Ladies... Young Joseph Stalin
1352492872.0,657,"Johnny Cash, the definition of cool"
1374002085.0,657,"Spectators at the launch of Apollo 11, July 16, 1969 [1280x862]"
1371407611.0,659,Vincent Price and Alice Cooper
1354691907.0,656,Tom Waits
1335813907.0,656,I recently found this photo of my great great grandfather taken in 1912. He exuded coolness. 
1367802860.0,650,My uncle
1347988528.0,654,"Anjelica Huston, photographed by Bob Richardson in the early 1970s."
1343845377.0,654,Hunter S. Thompson
1357236948.0,647,Bowie's promotional photoshoot for the Kon-Rads [1963]
1370676710.0,646,"Joey Ramone, David Johansen, Debbie Harry, and Joan Jett"
1360731936.0,650,Tim Curry - The Rocky Horror Picture Show
1340031858.0,640,"Marilyn Monroe and Sammy Davis Jr. on the set of How to Marry a Millionaire, 1953."
1353088320.0,638,"Alain Delon at Cannes, 1961"
1359415615.0,645,I present you Marlon Brando
1352413436.0,637,Allen Ginsberg and Bob Dylan at Jack Kerouac's grave
1342114627.0,637,"Stephen Hawking, 1965"
1369661625.0,639,My grandma wanted to be an actress in the 50's
1351357788.0,638,"I love you, man.  Steve McQueen and John Wayne."
1353694682.0,633,Goldie Hawn
1353728740.0,633,Frank Sinatra and Grace Kelly
1343310844.0,632,"David Bowie looking cool as hell in his mugshot, 1976"
1374960539.0,630,"My Grandmother in the 1950s Drinking a Beer, Wearing My Grandfather's Navy Uniform. We laid her to rest this morning, 1924-2013."
1374571145.0,630,Sesame Street behind the scenes
1372768297.0,621,"A couple on the street on Michigan Avenue, Chicago in July 1975"
1365232594.0,628,Toshiro Mifune at 28.
1367621440.0,623,Gaze of adoration..? RuPaul and his prom date in 1983.
1348606026.0,620,Grace Kelly
1365078883.0,626,"Andre the Giant, Mandy Patinkin and Wallace Shawn"
1370713506.0,619,Kurt Vonnegut and his dog Pumpkin
1366244798.0,613,"James Dean on the family farm. Fairmount, Indiana. 1955"
1351519479.0,617,Jimi on stage
1365841730.0,618,Any love for He-man here? Me and my friend setting up Snake Mountain on the top of a hill in 1985. I am to the right.
1350307070.0,618,Buddy Holly and guitar
1372381167.0,609,Steve McQueen
1345535695.0,615,How about Alice Cooper and Colonel Sanders?
1375180368.0,612,"A hat that is also a radio. (USA, 1931)"
1337350406.0,615,"Madonna hitchhiking naked (NSFW, obviously)"
1343881454.0,607,Audrey with her hair down
1373451433.0,613,"My grandmother - Australia, 1944"
1352209909.0,605,Today is my Reddit cake day. This is me at my equivalent real age. I'm the one in red dungarees. The year was 1987. 
1339851377.0,607,"The Ramones, New York City 1977"
1354628154.0,605,Kurt Vonnegut
1338232931.0,605,My dad. 
1365266956.0,599,Tom Waits.
1358631651.0,602,Probably the most powerful image I've ever seen
1357934887.0,602,My Grandparents in the 1920's.
1366673150.0,598,"Amelia Earhart (Fokker F7), June 14, 1928, Trepassey, Newfoundland"
1366222006.0,601,A boxing match between Roy Campbell and Dick Hyland 1913
1353070889.0,603,Ava Gardner
1345381490.0,601,Peter Sellers
1343357569.0,598,Tim Curry behind the scenes of The Rocky Horror Picture Show
1356971000.0,597,Jack Kerouac
1345983210.0,594,Joan Jett.
1375635124.0,597,"My dad in his high school yearbook, 1973"
1371163358.0,593,My grandfather doing work in the school metal shop.
1369694922.0,603,Ray Manzarek in Thailand while serving in the armed forces in 1962
1350483641.0,595,SRV
1374518302.0,602,Sixties jiving
1370997527.0,598,Debbie Harry as a playboy bunny before she was famous. [sfw]
1367434939.0,598,Do Your Bit!
1349237976.0,597,Paul Newman on a boat
1358471064.0,593,The Andrews Sisters
1351232577.0,594,1911 Packard firetruck ready to roll. (Colorized)
1365607607.0,591,Little Richard [gif]
1359177849.0,591,Harrison Ford in Blade Runner [1982]
1353535458.0,588,"My grandmother in her artist days, 1966"
1354845094.0,583,Look at those eyes! My grandparents on their wedding day.
1347126235.0,591,Vintage Roller Derby (Circa late 40s)
1346088514.0,587,"Pablo Picasso wearing a cow’s head mask on beach, 1949"
1342878253.0,586,The beautiful Suzanne Pleshette!
1345479137.0,588,Alice Cooper and Salvador Dali
1357540391.0,582,The ever so Beautiful Audrey Hepburn
1347075839.0,587,"Sean Connery showing off for Ursula Andress on the set of the James Bond movie ""Dr No"""
1359578892.0,583,A young couple partying hard.
1353372623.0,578,The President of the United States (x-post from r/pics)
1342273587.0,582,"Cycling down the Capitol steps, 1895."
1350564511.0,581,Catherine Bach - The Original Daisy Dukes
1363970604.0,580,Apparently my dad liked the weed....
1347836271.0,575,American soldier in Vietnam with choice of music (xpost from r/vinyl).
1351614708.0,577,Female driver.  c 1945
1362124098.0,573,"My first tv crush, Kelly Bundy aka Christina Applegate."
1344831217.0,576,Atticus Finch
1352252703.0,578,Ernest Hemingway and a dear friend
1337708275.0,574,"Lesbian Couple at a Beatles Concert, October 13, 1964 [from r/actuallesbians]"
1374618694.0,574,My grandparents on their honeymoon cruise. 1957
1342180766.0,572,Sean Connery &amp; Ursula Andress
1355845490.0,567,Hunter S Thompson
1349191679.0,571,'The Birds' star Tippi Hedren
1343933044.0,574,"Boys Dressed Up on Easter Sunday, Harlem, 1982, Bob Adelman"
1337181835.0,570,Hemingway kicking a can of beer
1363666487.0,571,Sly Stone [Date Unknown]
1337009164.0,564,"Hot town, summer in the city..."
1359946672.0,560,Monty Python's Eric Idle
1345070202.0,566,I Miss My Pops. He Always seemed 'Old School Cool' to me!
1371174363.0,562,Ronald Reagan
1354025720.0,557,kentucky 1972
1341072674.0,561,"The incredibly pert Eve Meyer, 1940s "
1348142802.0,553,Tim Curry on the set of RHPS. Effortless cool.
1370985949.0,557,Anna Karina
1348710165.0,551,Andre the Giant and Debbie Harry
1347389519.0,552,James Dean
1350378282.0,549,End of the road. 
1345927242.0,554,Audrey Hepburn in the French Riviera.
1362673793.0,547,Joe Strummer
1363204245.0,550,"High school girls learning auto mechanics, 1927."
1349462769.0,548,"I'll see your mom's old Commodore calculator, and raise you my Singer/Friden EC1118. It's so old it has knobs. :)"
1345698327.0,542,"Winston Churchill, 20 years old, February 1895 (x-post r/historyporn)"
1367600179.0,545,"Alva Skate Team, 1988"
1363471120.0,547,"Cruising around London, 1966"
1365334950.0,545,Soul train
1352048416.0,541,"richard nixon, 1933"
1359611440.0,537,Chivalry.
1357747122.0,536,Beatniks
1350974411.0,535,"My grandfather at Cafe de la Paix, Paris, 1945."
1353364386.0,536,"Future MAD cartoonists Al Jaffee and Will Elder in the high school cafeteria, 1939."
1375738326.0,536,Stevie Nicks
1346908488.0,537,Teetotaling John [gif]
1368205544.0,530,Clint Eastwood. Swoon.
1352742073.0,540,Robert Johnson
1341780602.0,537,Clint Eastwood
1375359596.0,535,my aunts and dad circa 1970. stylin'.
1344707620.0,531,"James Dean, beatnik."
1368442581.0,529,Ikeda Chikugo no kami Nagaoki (1864)
1351188603.0,530,"Raquel Welch, the ‘Kansas City Bomber’, 1972"
1360575775.0,526,70-year-old Ektachrome shots of the U.S. WWII effort
1340096301.0,530,"Granddad, early 1930s"
1364057371.0,536,My dad in the Peace Corps in Cartegena. 1969
1376222455.0,535,"Keith Richards, James Brown &amp; John Belushi"
1372570270.0,528,Tony Hawk 1986
1346254192.0,536,Audrey Hepburn
1375997831.0,529,"My grandfather had serious game, apparently."
1361396563.0,529,"My Grandma Elaine (R.I.P.), in her youth."
1355715041.0,528,My grandfathers self portrait 1927
1355244073.0,526,My Dad Circa 1970 wearing nothing but Jorts
1350319357.0,526,Was suggested to post this here! Here's a photo I found in my late grandmother's photo stash. I believe they're my great-great grandparents.
1348497459.0,527,Car phone cool...
1341593111.0,525,Audrey Hepburn
1374518405.0,526,"Couple drinking beer at inner tube floating party on the Apple River. Somerset, WI - 1941"
1361118321.0,525,The Amazing Django Reinhardt. Rips up the Jazz guitar despite his injured hand.
1359206308.0,520,Steve McQueen
1355354131.0,524,"My step dad and his best friend on the lawn of Kings College, Cambridge (early 60s).  To me, this is the definition of Old School Cool.  "
1356504083.0,519,The coolest man in history - Bruce Lee
1347550155.0,523,The one and only Betty White!! 
1362796146.0,518,Thelonious Monk
1361719219.0,521,Anna Karina
1360070969.0,512,Woody Guthrie
1356723340.0,509,My Mom as a production assistant in her 20's
1356626894.0,515,My Grandpaw was the captain of a mosquito boat in WWII
1360779888.0,512,"Men in party hats, 1930's"
1367857644.0,512,"Japanese college students, Sacramento, California 1942"
1349561832.0,508,My grandfather in 1953. Today I learned my grandfather was cooler than me.
1336405274.0,512,Barack Obama in college
1336354023.0,506,"No iPhones or iPads, Droids, or bottled water-- just ashtrays and attention. (x-post from r/pics a month ago)"
1368974273.0,513,"Jean Paul Belmondo in Jean Luc Godard's film ""Breathless""."
1372843600.0,512,Elvis. Bumper Cars. Nuff' said.
1369623438.0,506,Toyota Celica Liftback
1346326355.0,510,The King of Cool. Steve McQueen. 
1343457392.0,507,Just Albert Einstein in fuzzy slippers.... (x-post from r/pics)
1335955974.0,504,Under Pressure
1343918655.0,499,"Jack Karouac, 1942"
1348576415.0,497,"Orson Welles, 1937 (photographed by the great Cecil Beaton)"
1343131648.0,500,Lauren Bacall is smoking (hot).
1366230251.0,496,Dorothy Lamour with her co-star on the set of Jungle Love
1359942319.0,497,Jim Henson
1355943633.0,502,Drag Racing Grid Girl 
1349877847.0,497,Lauren Bacall with Two Cats
1338817385.0,496,My Grandfather was a train conductor. Just found this great picture on the last page of my Grandparents' wedding album.
1368371858.0,496,"My Dad and Mom: Honeymoon at the Taj Mahal, 1975"
1372754799.0,499,Henry Rollins
1353929590.0,497,My dad in 1965 in Leningrad Military Engineering Academy
1346862091.0,494,Jean-Paul Belmondo and Jean Seberg on the set of À bout de souffle (1960)
1342016042.0,500,Rock and Roll has landed! (1970s) 
1368029920.0,491,Grace Kelly
1357051461.0,497,Debbie Harry warning about the dangers of punk (xpost- r/OldSchoolCoolMusic)
1358116820.0,493,"Chevy Chase, Dan Aykroyd, John Belushi and Lorne Michaels - New York, 1976"
1357233049.0,494,Betty Brosmer
1365989569.0,487,Old school texting....
1374602020.0,494,"My late Grandpa Jerry at the Smokey Mountains, 1969"
1367891885.0,493,My beautiful grandmother modeled in the early 1960s
1353914073.0,490,Young Cher
1351955170.0,493,Gene Tierney
1361686142.0,484,My Grandfather lighting his cigarette
1344177730.0,488,Marilyn Monroe - photographed at her home in 1953.
1342618758.0,493,The Boss is cool... but how about The Chairman of the Board?
1354204333.0,488,Sexploitation: Sweet Sugar
1341649373.0,481,You wash I'll dry.
1360680618.0,486,"The Styrian Oak, Mr. Olympia ~1980"
1351898560.0,483,"Clint Eastwood, 1967"
1345838267.0,489,"Michael Caine and Bob Hoskins, Raymond's Revue Bar, London, 1985"
1357311450.0,480,My grandma told us the football team followed her home from school once... Now I can see why! Here she is circa 1940.
1339395519.0,486,"Seafire pilot on HMS Indomitable, 1943"
1367766502.0,478,My Great Uncle in Milano.
1372511494.0,483,Kate Bush
1370853440.0,479,"Jack and Jackie, on a date"
1365611187.0,477,The Rolling Stones serenading an unknown naked woman
1354656041.0,476,"If old sk8ers can make the cut, here's Rodney Mullen, 'back in the day'..."
1341425349.0,480,My grandfather hangin' the computer room. (Early 1970's)
1349428514.0,474,Was told to post my mom's old school calculator here.
1342930319.0,479,"The Obama's - December, 1989 "
1341219576.0,482,Johnny Cash and Bob Dylan
1344526600.0,478,Lounging around on the set of Star Wars (Xpost r/Moviesinthemaking) 
1359393126.0,474,Lauren Bacall and Marilyn Monroe.. 
1348331591.0,474,Clint Eastwood 1962
1371145069.0,473,Cybill Shepherd
1347922012.0,472,Geronimo's Cadillac (1905)
1367633089.0,474,A hauntingly beautiful photo of the Iconic University of Iowa Hospital's Gothic towers circa 1950. Taken by my Grandfather during his time as Assistant Administrator of the Hospital.
1364098813.0,470,My bad ass Dad holding an Uzi.
1341916562.0,471,Have you ever had a bad time in Levi's? (1970s) 
1340645297.0,470,"I googled 1950s swimsuit and this beautiful image popped up. Inside I have linked to the subsequent search results, which provide a goldmine of absolutely stunning 'vintage beach' photos. "
1358704578.0,468,Martin Luther King playing pool
1347547839.0,468,"My great grand-uncle, Richard Norton, in France during WWI. "
1349884432.0,470,"Commander Bond. Not a photo, I hope you'll forgive me. "
1346649306.0,470,Marilyn Monroe.
1339602748.0,464,"Marlon Brando, a cat and a typewriter"
1372010278.0,466,A Young Hunter S. Thompson
1370457860.0,465,My parents wedding band cir. 1980
1366217042.0,470,"Iggy Pop and his son, mid-1970s"
1335445656.0,470,Haters Gonna Hate [x-post from r/pics]
1340572332.0,463,"Link Wray, inventor of the power chord and the only person to have an instrumental song banned from American radio, 1956"
1373799145.0,461,"My grandparents in London, 1920s/30s"
1362680272.0,460,High school parking lot burnouts. (Xpost from r/autos)
1341402445.0,466,Happy 4th
1339344978.0,462,A Kiss Goodbye (X-post from r/Aww)
1359868773.0,458,Jodie Foster riding a skateboard.
1337546073.0,459,My Great Grandpa and his Tommy Gun
1364667141.0,460,"Girls Rifle Team, circa 1920s"
1357854217.0,456,Sigourney Weaver as a highschool senior
1356898126.0,460,An illicit kiss
1349105094.0,461,Humphrey Bogart
1352441293.0,456,young Mitt Romney 
1373497131.0,460,"Native American couple, 1912"
1364463377.0,455,"Mrs Gloria Richardson pushes a National Guardsman's bayonet aside.  Maryland, 1963 "
1343730878.0,458,French Resistance 1942
1367415844.0,453,Gene Hackman
1347641011.0,455,"Old School? Check. Cool? I think yeah, check."
1374866320.0,451,"My grandfather with my father and aunt, whom he raised on his own. Old school single dad"
1369545268.0,446,Nancy Sinatra
1356174228.0,446,James Brown and Mick Jagger
1368274246.0,446,Tattooers past and present [X-post from r/Tattoos]
1353944480.0,449,Myrna Loy
1370831405.0,450,The President of the United States.
1362929455.0,451,Robert Redford - ca. 1972
1344323308.0,453,Gene Tierney. Such a stunner.
1344019938.0,444,"Liz Taylor, fifteen years old. (1947)"
1342840976.0,449,Neil Armstrong eating breakfast on the day of his launch [x-post r/pics]
1374422313.0,448,Bob Dylan and George Harrison playing tennis (x-post r/tennis)
1339949081.0,446,My great-grandfather in 1960s South Korea.
1335107327.0,447,Deborah Harry circa 1969 xpost [nsfw]
1349463617.0,445,Sean Connery and the Aston Martin DB5
1342399222.0,449, Young Ian McKellen
1375660616.0,447,Youthful Brigitte Bardot
1365858255.0,444,Beatles meet Muhammad Ali
1344644830.0,443,Audrey Hepburn checking on her cookies.
1375710788.0,440,Fred Gwynne (as Herman Munster) enjoying a smoke...
1375229216.0,443,The Playboy Playmate of the Year for 1973 was given a Volvo 1800ES wagon - painted pink! (X-post r/volvo)
1366496053.0,443,Just David Bowie and Tilda Swinton Dressed As Each Other. No Big Deal. [x-post from r/pics]
1351170368.0,435,Because he's the definition of cool.
1373027798.0,437,Elvis &amp; Tom Jones
1373322154.0,437,How you got your hair done in 1960's London
1366341815.0,441,Barbarella
1345638169.0,438,Werner von Braun 
1372250712.0,435,"Bettie Page, sometime in the 1950s"
1359764610.0,433,Run DMC and Weird Al Yankovic
1362890280.0,438,My Dad was 63 years old when I was born in 1982. He served during World War II and died when I was ten. Today would have been his 95th birthday. I miss him like crazy.
1358899286.0,434,Cary Grant in North by Northwest 
1357284649.0,433,(x-post r/pics) Awesome photo of my Great Grandfather (Taken ~1950)
1350160714.0,439,Hippies protesting against Vietnam war  
1349920947.0,437,"My grandmother on her honeymoon.  Prade Ranch, TX, circa 1941"
1337807819.0,429,Amy Winehouse - High School Portrait 
1367587951.0,431,"Self, photobooth 1987"
1352268097.0,434,Just George Carlin being arrested in '72 for being a badass.
1362461582.0,436,Tim Allen (1978)
1355753098.0,432,"My grandparents, 1960s"
1350585973.0,432,Muddy Waters and Howlin' Wolf Bus Tour (x-post from /r/blues)
1342532874.0,432,Claudia Cardinale
1359777407.0,424,"Louis Armstrong, Paul Newman and Duke Ellington"
1355607253.0,426,"Bo Diddley's female guitarist, Norma-Jean Wofford aka The Duchess"
1338489112.0,429,Happy Birthday Mr. No Name.
1373192674.0,421,"Ray Charles. I love The reflection in his glasses, its what he would have seen."
1346595898.0,419,Through Being Cool.  DEVO 1977 NYC
1358705651.0,422,Miss Idaho Potato 1935
1350488153.0,428,The Breakfast Club
1362763289.0,422,The NeverEnding Story - Noah Hathaway and Barret Oliver 
1349091404.0,418,"Usama bin Ladin on a family trip in the small city Kalmar, Sweden 1970. Usama is second from the right."
1366747523.0,424,"Armenian Guerrilla Fighters, 1895"
1357519407.0,424,Beastie Boys chasing Madonna on stage with squirt guns
1342798902.0,421,Carlos Santana 1969
1375518285.0,415,"My 19 year-old grandmother and a friend in Savannah, GA, 1944"
1347752506.0,420,Marlon Brando
1343598673.0,418,Brigitte!
1343054133.0,420,Amelia Earhart
1340867056.0,420,Princess Diana dancing with John Travolta at the White House
1358389104.0,417,"My grandmother, balancing my uncle at the beach (mid 1950's)"
1353327126.0,422,What seems to be the problem officer?
1365389272.0,413,OldSchoolUncool
1362754779.0,415,Johnny Depp eating a cookie
1343695748.0,418,Ron Paul just before leaving for the service
1366557995.0,420,"Twiggy in London Airport, reading a guidebook to Tokyo before boarding plane to Japan, 1967"
1355011947.0,415,Schwinning
1346951842.0,418,"an ordinary morning,...for some"
1342974815.0,413,"Bill Murray and David Letterman, 1982. Check out Dave's hair."
1373054731.0,412,1984: Delivering a dinosaur to the Boston Museum of Science. (Image by Arthur Pollock)
1352396336.0,410,Hunter S. Thompson
1364919572.0,411,Steve Mcqueen
1367769215.0,408,"Certainly, a treasure trove of misinformation. Can't wait to carefully turn it's pages!"
1346149356.0,409,A young Black Sabbath
1352996259.0,411,Young Hunter S. Thompson photographs himself
1348755643.0,408,"Dylan, '66"
1361228483.0,410,"Paul Newman, 1963"
1354925093.0,408,Women fight out of control blazes after the attack on Pearl Harbor (x-post from /r/pics)
1365467472.0,405,Dungeon Mistress with a Computer.
1353949379.0,404,"My dad and his Marine buddies back home, 1952"
1367490017.0,402,My folks. 1961.
1335580561.0,397,Sexy Hippies NSFW
1371232162.0,401,"Artist Yves Klein directing a model, ca. 1960"
1375453468.0,400,"Ramones in Los Angeles, August 1976"
1363114908.0,396,"Two Americans car surfing during a flash flood in Mexico, 1967 (x-post from r/historyporn)"
1351173726.0,397,Grandpa in the Navy
1350747140.0,401,DeNiro in his prime (Taxi Driver)
1348244633.0,399,Frederick Douglass
1343191107.0,401,"my ever so attractive grandparents layin' on the beach, ages 19 and 20; 1952"
1337948265.0,399,"Scandinavians, 1972 "
1357863457.0,400,Jimi Hendrix
1356631458.0,400,"My dad in Germany, May 1975 (x-post from r/pics)"
