created_utc,score,title
1372026782.0,230,"With The New Resource Costs, We NEED The Ability to Deconstruct Vehicles (or unequip MAX) for a Partial Resource Refund."
1361390777.0,228,Found this awesome wallpaper while purging my bookmarks
1354814284.0,227,"Looking at the NEW weapons, can we PLEASE get some new models instead of reskins?"
1368811566.0,231,[Quality of Life] Let us see how many explosives/mines we have currently deployed
1365981511.0,228,"SOE, how about Daft Punk helmets for Vanu? Daft Punk's new album is released by Sony Music Entertainment, give them a call!"
1365803282.0,224,[Suggestion] Let us use the middle of the warpgate to warp vehicles between continents
1365564794.0,232,"From the PTR files, 'Lumifiber Trim' aka Tron Camo"
1363758187.0,230,"[Suggestion] When players log in, take them to the continent select screen instead of spawning them at the warpgate of their last played continent."
1363613190.0,229,Can We Get Advance Notice on Double EXP Weekends in the Future?
1362761989.0,227,"Don't ever call my VS Max ""Bad"" again."
1361756994.0,229,[Suggestion] Allow us to have the full map up on a second monitor.
1342537382.0,230,New Trailer: Death is No Excuse
1368953388.0,230,The moments before death are always the longest.
1355604313.0,228,"Why, oh why, do Medics and Engineers get less EXP for upgrading their tools?"
1354088174.0,228,So Higby answered a ton of our questions about future features for Planetside 2 in a stream today
1372217534.0,230,[QOL] Let us finish typing when we die
1366014490.0,223,Engineer deployable AV turrets are ruining tank battles
1365634271.0,225,Suggestion: Keep the exp notification after ended alert on screen for more than a millisecond
1370921433.0,227,"Welp.. Sony just destroyed E3. Here's to a successful PS4 release, SOE!"
1368189343.0,229,[Suggestion] Make medic's revive (and heal) grenades sticky like the engineer's one
1365564247.0,222,Test client uses absolute tank rotation! (No flipped reverse steering)
1363833001.0,229,[Suggestion] a different shield door and window
1357932831.0,225,Player invulnerability has NO place in Planetside2
1356049248.0,225,"IMHO, hill climbing is unnecessarily frustrating."
1374907180.0,224,When messing with the .ini goes too far
1368368762.0,220,[Suggestion] Infantry would look a lot more varied if our suit slots were visual
1359910317.0,224,Anyone else really enjoyed the past few hours with massive infantry battles?
1358950394.0,224,Stupid Sexy Vanu?  More like Stupid Sexy Planetside! (Chinese Planetside2 Splash Advert)
1356645696.0,224,It would be useful to see the vehicle acquisition timer in the Vehicles tab too.
1376499619.0,225,Can we finally get detailed statistics showing the exact impact of attachments on weapon?
1365617432.0,223,I'm not good at driving sunderers.
1360845061.0,227,Mechs in Planetside 2 [Fan Art]
1354544453.0,224,"[Suggesion] 5000 Daily Double XP, Similar to Rest XP or Daily Quests. "
1371337616.0,220,It's the little tihngs from GM's that make my day.
1365092733.0,219,SMG in the back
1353606676.0,222,The Absolute Basics - Navigating the world (by TotalBiscuit)
1352189895.0,218,I think I'll go take point A
1376178831.0,220,I accepted a 4500SC challenge to beat [QRY]Naterain's reaver with a liberator...I chose to not use a gunner.
1372689663.0,217,MLG/PS2 - We Need New (Unbiased and Informed) Casters for Planetside 2 Casts
1370463101.0,225,"According to Smedley PC and PS4 will not share servers. Also, much improved multithreading also coming to the PC version!"
1357766582.0,220,One of my outfit mates made this awesome recruitment video. I think it really shows off how cool PS2 is.
1353929374.0,217,So I saw this incredible feat of Sunderer driving yesterday...
1351177068.0,221,"How many of you didn't know this function existed? just hold ""Q"" while looking at a friendly.."
1358213453.0,220,"As a sundy driver attempting to take an enemy base, this is the last thing I expected."
1343207759.0,222,Planetside 2 - How To Change Games Forever [VIDEO]
1371736789.0,222,The General Reaction to your Favorites Being Nerfed
1368534011.0,218,When will the loadout selections be changed to their own buttons instead of drop-down? It's awful for quick resupply under fire.
1366650478.0,222,"Great, I got the one that was made in China. How am I supposed to shoot if I have to manually hold the battery in place?"
1361474218.0,221,Planetside 2 Players Site is live
1358863886.0,217,The Sunderer Horn is Overpowered
1358032383.0,217,That Scythe roadkill video really made me want to try out roadkills. It went as expected.
1366035402.0,215,[Suggestion] Put Numbers on Platoon Vehicles
1365635634.0,220,Summarizing legitimate reasons to be upset about today's cert point grants
1359172613.0,219,Won't see this ever again.
1356059154.0,220,Squad repair should apply regardless of whether or not the vehicle is occupied or not
1366300877.0,215,The best thing about GU07 for an Engineer.
1360760566.0,217,Moonlite on /report
1366029397.0,216,"As an air-to-air wannabe, I would kill for this radar."
1363396551.0,217,Still have a massive loss in FPS since GU4.
1376176884.0,211,"How no-deploy zones currently are, How they should actually be"
1369587517.0,216,FNO: Let's actually spotlight outfits.
1364085470.0,215,It needs to be brighter... I can still see the targets.
1360644566.0,213,PhysX enabled with latest beta drivers
1358438108.0,215,MAXes are now invisible to Aircraft IRNV and Thermal
1358225566.0,217,Probably the best looking kill I've ever seen.
1351560011.0,215,I think I can get behind this
1345667317.0,214,Thank You Reddit
1370039415.0,215,[Suggestion] Dont give xp for destroying terminals
1366989136.0,217,[Suggestion] HUD customization
1366333124.0,214,GU07's new minigame: Guess that faction!
1364161291.0,218,[Suggestion] This is a PSA about Planetside 2's compensators
1354884608.0,214,Can we please display Outfit tags on killscreens?
1375983664.0,212,"Time to Kill versus Client Side Hit Detection (help me out, if I got it wrong.)"
1372526883.0,210,Happy Skywhale
1368905122.0,213,"I'd really like a ""buddy"" system where I can easily determine/find newbies and help them find their footing."
1367942098.0,215,Is Every New Item Going to Cost $7+
1366837174.0,213,[Suggestion] Engineer HUD mine count display
1365882034.0,212,"Shouldn't there be a reward for keeping facilities, instead of just capping them?"
1365708845.0,215,*UPDATE* On yesterdays cert grants
1362944438.0,211,Faction Specific Wallpapers @ 1080p
1361139323.0,212,Set Fraps to take screenshots every 10 seconds. It makes for some interesting photos :) 
1353446870.0,213,Make Station Cash Purchase persistent across characters/servers of the same faction
1340644394.0,211,Sign of beta? :p
1370501113.0,213,The Fourth Faction is KILLING this game!! There NEEDS to be restrictions/ at least limitations on the use of multiple accounts on one server.
1369621783.0,209,Heating the pot of water slowly; A compilation of all patch notes pertinent to aircraft.
1363731934.0,209,How to get the horn for 0 Station Cash
1361446549.0,210,[PSA] Don't run in front of an an engineer that is repairing a Max
1360860066.0,211,Amazing Animals of Auraxis
1356725941.0,209,I'd like to see this place make a return in Planetside 2
1374733845.0,211,I still have to quit Planetside 2 via Task Manager because the game freezes when I click logout.
1373414336.0,212,[Suggestion] Make the holo-screen for tank terminals be a Lightning if there's no connected Tech Plant
1373215632.0,208,Anyone else tired of fighting on the same base in a different place?
1370984027.0,208,Have evidence regarding the murder of Higbys hair? Send it to SOE!
1367917888.0,209,Upcoming Bundle - Circle of Life
1367423493.0,208,[Suggestion] NC badly needed faction buff. Entire empire almost unplayable as it due to missing bonus checks.
1367216950.0,211,Why should Flak Maxes Be better then SkyGuard Lightnings?
1363009431.0,207,Indar Dry Brush Camo - My new favorite.
1360629151.0,213,interior views for sunderer and galaxy passangers
1359238142.0,209,After 10 hours of play this is how I react to my own fails.
1357126859.0,215,This happened after I ran over someone in my Scythe. I love that we have options to communicate with opposing factions.
1375848048.0,209,Can we PLEASE fix the issue with decals not appearing on composite armor?
1374012058.0,207,Implants have the Planetside 2 Community Worried as Game Update 13 Rounds The Bend
1367687854.0,208,Now this is a Helmet (and Suit design) I would buy in a heartbeat
1360087318.0,212,Galaxy Combat Drop
1356508270.0,213,Eight Stubborn Bastards
1354861458.0,209,This Should Be A Bannable Offense
1352105805.0,209,"While the changes to sunderer proximity deployment are very positive, as a sunderer driver, it is a major annoyance to not know where I am able to deploy. I suggest that when driving a sunderer, looking at the map shows the area around friendly sunderers where you cannot deploy"
1351881811.0,210,After Amerish we need an urban city environment continent.
1340295493.0,211,This should be a cosmetic option
1375292498.0,213,Amazing adventures of NC soldier
1373929479.0,205,To those who noticed a significant increase in new players
1371867243.0,209,"If my tank costs 450 resources, why can an engineer still destroy it for free with their *infinite ammo* anti-vehicle turret?"
1367861502.0,207,The main reason why I always use the IR/NV scope over the Reflex Sights as a NC player.
1362833101.0,210,"How to solve the infantry farming vehicle problem? Easy, make killing vehicles just as rewarding."
1358350193.0,209,Planetscythe
1355335350.0,210,Game Update#1: Secret Line Dancing Cert!
1354193371.0,211,I wished we had an offline database to browse the weapons/cert options
1352754712.0,209,Anyone else think the new weapon prices are absurd?
1376448446.0,207,"[IDEA] Make boosts usage count against in-game time, not total time passed"
1370442918.0,207,[Suggestion] No Alert XP if you have been logged in to another faction during the alert
1370397417.0,211,"Highby in BCP's streamchat: Talks about ZOE, air balance, ideas for squad spawning in the future. GU10 confirmed for tonight ""assuming it passes it's final QA pass""."
1369309673.0,211,Tried to offer somebody a ride while using the Fury. Something tells me SOE didn't fully think about this feature.
1354363049.0,204,Giraffe Camo Part 2!
1353690214.0,206,Best Death Yet!
1351613628.0,205,I've never heard about Planetside before. This is how I spent my first hours in the game. I'm blown away by the scale and depth.
1374145921.0,210,[Suggestion]Galaxy flares should look like this
1367255274.0,209,Tank Mines request
1360904124.0,208,Nobody told me about the TR &amp; NC alliance...
1354195899.0,203,"Colour Blind Support - UI is really bad, Sony show us some love please - read this!"
1353252455.0,209,Should we send the Dev team a bunch of Cupcakes or something at their office?
1369534735.0,207,"There's a TR on Mattherson going around trying to ""fix"" Reavers"
1367733014.0,208,NC propaganda in the VS! (NS-11C Holo sight)
1366654101.0,210,[Suggestion] Could we get a little *click* sound when our ability (burner/shield/flares/cloak) is full or ready?
1366603955.0,204,We need some more Love on Auraxis
1362865209.0,204,[Idea] - Make loading screens factional specific propaganda!
1355210430.0,205,"PSA: Calm yo beards, SOE ain't gonna ban you if you're innocent."
1370314948.0,209,I kept getting yelled at and told that I was a scummy cheater and wallhacker yet they kept on standing and trying to pull prowlers. I couldn't help myself...
1368598004.0,202,Clegg is persistent... gotta give 'em that. ;)
1367433898.0,206,Believe in Yourself
1361609645.0,203,[Suggestion] Make C4 a universal purchase. 
1357597705.0,204,How to Report a Suspect Player: Dev Instructions Edition
1354379645.0,204,The xp gain for objectives requires major increase.
1352730247.0,208,BuzzCutPsycho recoil compensation rant.
1347360027.0,203,My PS2 battlestation with the map on a projector
1375677170.0,206,"You want an audio pass, TR? I'll give you an audio pass..."
1369444652.0,204,"In honor of Planetside's 10 year anniversary, I present my Vanu-loving cat"
1368611957.0,206,[Suggestion] Include the location and cert metres above the expanded version of the mini-map
1367564257.0,200,TR from 2011
1364908947.0,207,I've wanted something like this for a long time. Finally made a mockup.
1359637910.0,208,[Q] Would everyone like it if i posted what was on sale everyday?
1358468467.0,200,LvlCap Replaced Tobuscus
1356587112.0,207,100 certs does not make you General Patton or Sun Tzu.
1350272045.0,206,We're at War - Planetside 2 Cinematic Machinima
1371649743.0,206,vehicle optic: Night vision nerf / Thermal buff
1360293952.0,205,Why Even Bother Putting Turrets on Tech Plants
1359549754.0,201,PSA: Custom Voice Channels
1359360699.0,204,"LevelCap's Ultimate Empire Showdown Experience - ""SeaNanners had a lot of fun learning the game"" *sigh* [6:43]"
1353472325.0,203,[Request] Can we please get previews for camouflages?
1372811032.0,201,"Remove ""Squad deploy"" before it's too late (MLG)"
1371562346.0,203,When I hear the TR complaining about the Vulcan low efficiency at range.
1370544417.0,200,Thank you [SOE Support] for pimping my ride!
1369102916.0,203,How to fix Air to Air -- Raise the Roof!
1368819915.0,204,"[Suggestion] Change Vanu ammo low sound to something that sounds less ""mechanical clicking"" and more ""battery low"""
1368242118.0,204,Midair Reaver Ram (with a Harasser)
1365922592.0,200,"Thanks, Instant Action."
1362693682.0,203,"TR Helmet, final"
1358471113.0,204,"SoE, can we please remove instant death on an upside down aircraft touching geometry?"
1353376336.0,202,CONNERY IS FOR WINNERS
1349964662.0,203,"We were talking about urban environments around bio-labs, so I did some quick (read:shitty) Photoshop to imagine it."
1373195400.0,200,Harasser cosmetics are unlocked for only 1 faction... yet it is an NS vehicle and they are all completely the same
1372437717.0,203,NS Super Soaker
1367765670.0,201,New Player Experience - Every time you kill a new (BR1-10) player use /t to welcome them to the game and ask if they have any questions.
1365789697.0,201,Higby's vote on the empire specific jumpjet sound of the NC.
1365600738.0,200,This is such a cool feature (PTS)
1356017862.0,201,Engineer Certification Guide
1375055025.0,200,[Suggestion] Can we get Alert XP award added as a line in the chat box?
1370642362.0,199,A VERY big problem that needs to be addressed immediately
1370000087.0,200,SOE please fix Medkits (and other items) not working during high server load. Which is pretty much every day on Mattherson. Example enclosed.
1366907225.0,204,"What happened to ""OUTFIT CUSTOMIZATION"""
1357922317.0,200,The Correct Way To Play A SkyGuard in 42 seconds.  [YouTube]
1355963128.0,200,Something to spend your triple station cash on: Boosts. Because it's double XP from this Friday until January 2nd.
1349726558.0,199,Revising the Auraxium System Without Gutting the Game
1360796026.0,202,[MAX Units] Option to replace both weapons by two MANA-Shields
1356823053.0,195,The Multiplayer Shooter of the Year 2012: PlanetSide 2 | PC Gamer
1355300451.0,199,FYI:  The game isn't supposed to be symmetrically balanced.
1350828869.0,200,TR what are you doing back here?
1373917857.0,199,Suggestion: Add auto-spotting on flashlights within a reasonable distance.
1370905472.0,200,"Vehicles shouldn't be cheap either! Another long image, without a Wizard this time."
1367319313.0,194,This isn't even my final form
1365002425.0,196,The Harasser Buggy
1364058953.0,197,"Protip:  Don't assign the drunkest member of your ""drunk tank"" squad as your bus driver.  He missed the bridge, and we had to tow it out with a Magrider."
1357763789.0,199,[Video]How to cloak properly! Infiltrator cloaking mechanic figured out!
1357753452.0,201,[Suggestion] Share full XP from kills across all players driving/gunning in a vehicle. 
1356039258.0,201,"Petition: Turn Alpha Squad boost into a passive modifier, like the subscriber bonus."
1355022419.0,198,You hate Tankside 2? Here's some help dealing with it.
1372204999.0,199,Higby gives us some numbers on MAX usage and performance post-GU11 (read from bottom to top)
1370236459.0,200,ESF Wallpapers!
1369822788.0,195,"[PTS Data 29-05] Trims, Weapons, MBT guns, Camos, Decals, ..."
1369338339.0,195,"I am going to pistol whip the next son-of-a-bitch who says ""Quality of Life"""
1367127927.0,201,"[Suggestion] More new certs, less new weapons!"
1366761801.0,194,"I'm no artist, but I decided to try and tweak one of the new helmet screenshots Matt Broome posted..."
1365678678.0,198,"Hold your horses, hivemind. Server Rollbacks are not necessary."
1360344528.0,197,Bring back squad central waypoint and squad EXP from PS1.
1359475844.0,193,"Best Assault Rifles GR-22, H-V45, Cycler TRV"
1357516593.0,198,"Please give us a ""requesting gunner"" voice command"
1375225955.0,197,Next time someone doesn't believe you when you say how large a fight can be in Planetside.
1371317917.0,192,Higby: FYI: there are a lot of partial WIP tuning changes on Public Test right now - jumping to conclusions from what's on there is hazardous.
1367559489.0,192,Tried to draw the Core Combat soldier on the box art; I am a terrible artist.. was going O.K until I got to the mouth.
1366855190.0,192,"Objective kills (e.g., generators) should give XP to everyone in the area."
1365420935.0,199,"After a recent Indar alert, the NC formed up ~150-200 MAXes and marched to the TR warpgate"
1363890204.0,196,Final version of the upcoming NC helmet
1354286786.0,195,I feel that the automated base/tower turrets from PS1 should be brought back
1353169584.0,196,"Dear /r/planetside, you said ""make this a thing"" so I, you know, made it a thing. Also, VS held The Crown and therefore won the beta.  Fact."
1348367050.0,193,As a Squad leader I feel like I'm fighting the interface more than the enemy.
1372866042.0,195,New Walker model live! (it spins)
1372126146.0,195,"I feel like the upside down tail looked better, also giving a smaller hitbox to the chunky reaver."
1368802503.0,195,[Quality of Life] - Ammo tracker for drivers
1363354477.0,194,Double XP Weekend!!!!!!!!!!!!!!
1362332754.0,196,Why Nay-Sayers to the Prototype Hex System are Wrong
1358721392.0,197,Never trust Nanners...
1339103723.0,196,Just got back from playing Planetside 2 at E3. My thoughts.
1338919734.0,195,"PlanetSide 2 Empires at War E3 2012 Trailer
      - YouTube"
1368733398.0,198,"[PTS] I see what you did there, SOE"
1365268831.0,193,[Suggestion]Add Squad EXP Bonus for fighting close to squad leader or waypoint.
1364447906.0,193,"SOE, you could earn more of my money if you fixed this longstanding soldier decal issue."
1355383067.0,194,"Whoever was proximity-mic'ing the ice cream truck song while driving their Sundy on Jaegar this evening in our NC convoy, you made my night."
1353491922.0,198,"Cosmetics, other items should transfer between factions and servers"
1372749796.0,194,Phantasm
1367803844.0,195,MAX Units have stolen the role of Vehicles
1357308349.0,192,SOE Please fix this ASAP Its fucking anoying when you wanna get somewhere.
1356202051.0,192,Starting warpgates should rotate when a continent is completely conquered.
1355339163.0,196,"Almost C4'd it, then I noticed the embelm."
1373699003.0,191,"A ""Need a gunner"" shout/Icon above head is borderline required"
1361633491.0,193,"With Orbital Strikes coming, along with Commander-like cosmetics, the Command Rank (certs) needs to be re-worked"
1367485333.0,192,Surprised this isn't posted yet but...GU08 Patch Notes are up!!!
1366065618.0,194,VS lightshow on Mattherson (per request)
1355985253.0,190,Meta-game's effect on player retention. 
1371300690.0,186,"SOE, adding weapon sway to the HS/NV is just ridiculous for a 1x."
1370302134.0,188,Higby: We're going to be adding SCU shield gens back to Biolabs next update
1369595740.0,191,For those NC guys: Vanguard w/ Railgun Primary and Secondary render.
1365280503.0,191,Mountain shooting pistol - Physx glitch
1365115409.0,192,How it feels after GU6.
1364256460.0,191,These hands...
1362977036.0,189,[Suggestion] Show which way the control of the base is going on the map screen
1362379230.0,188,[Suggestion] Ðead lights for ESF and and powerful searchlights for Liberators
1353785005.0,190,I'm the sneakiest man alive! [1:53] (x-post from /r/gaming)
1352301062.0,191,So I reserved my name.
1376314454.0,192,Soldier #395012 Log Entry 01
1373153061.0,189,"Is it me, or are turrets largely a waste of time?"
1368531111.0,188,History Repeats Itself - The 4th Empire
1367521113.0,190,New drop-pod spinning animation is making me sick.
1358770975.0,187,"When it comes to improving the game there is still two things that should be the highest priority, FPS and draw distance for infantry."
1355877929.0,189,I hope we get a real forest continent eventually.
1354384027.0,189,Scythe Reaver Mosquito Setup Guide
1367979387.0,187,"Commissar Cap, in-engine screens"
1366474325.0,189,Elite Flying School
1366421579.0,189,New base capture time is great for allowing resecures but there needs to be an SCU (or alternate solution) at each facility so attackers don't need to babysit defenders inside impenetrable spawn rooms for 10 minutes.
1363632758.0,186,The first cert reset should be free
1359047282.0,192,Make a continent that feels like a Warzone
1355549561.0,185,LA jet pack is NOT fixed and it's infuriating
1353971552.0,187,Medics should not have to re-target a friendly to heal them after a revive.
1353685406.0,188,I posted about how I was broke because of a layoff and how 1000 certs is way to much for rockets. GGG Haithno made my morning...
1352739466.0,188,"""we are pulling out the recoil compensation and putting it back to how it was."""
1375940458.0,188,Allow MAXs to redeploy to WG
1372500772.0,185,So where's this NC 'helmet'?
1369246687.0,186,Why aren't these spikes used for Lockdown mode??
1369212219.0,190,"[WARNING] SOE Will take your money, ban you without a thought and then ignore your appeals"
1366141855.0,188,Dev Team: How are you guys doing?
1361618461.0,184,"So I infiltrated the crown while the oblivious Vanu were defending, and had an old fashioned shooting gallery. And you people say snipers don't help."
1356576341.0,183,So when do we get access to this big guy?
1341606547.0,188,Beta this Month!
1368334631.0,186,"I visited an old friend, it's pretty lonely these days."
1367666861.0,186,"Well, SOE finally fixed the water in bio labs, and it's gorgeous!"
1362310613.0,185,Infantry buff patch is here!
1356992906.0,188,Let's stop starting every self post with PSA unless it's actually a PSA.
1348046987.0,184,"Dear moderators, please make this a thing (Dev flairs)"
1343107761.0,188,Waitside 2
1366997501.0,184,"Hoffman: ""The recon tool for infiltrators will start granting XP soon!"""
1364402156.0,185,Pics of the new holographic NC logo hood ornament
1363875432.0,184,Am I missing account unlock refunds?
1360618248.0,183,"Higby Tweets: ""We're testing out some new infantry render distance settings on Connery / Indar right now. Come help load test!"""
1359832958.0,185,Vanu inspirational Scythe fly by
1373456760.0,183,"With GU12, the Marouder is pretty much a direct upgrade from the Fury, at a 75% lower price."
1371550743.0,185,"[Suggestion] Higby pls, could kills from inside a spawn room award no xp, to encourage pushing out?"
1369089422.0,183,GU 9 and Connery/Helios Merge coming this week
1367317416.0,186,Suggestion: Make nanoweave armor upgrades prevent OHK from shotguns with increasing benefit beyond level 2.
1365806217.0,182,Twitter / mhigby: VS weapons will no longer have damage drop
1361810076.0,182,Five things that SOE should be ashamed that they still haven't fixed from release day.
1357233007.0,184,A few quirks/little known info i've complied so far (more to come).
1354437811.0,186,[Fixed] I think we have enough sunderers
1373045589.0,183,VS MAX to be severely nerfed
1366183127.0,180,Tramell Ray Isaac â€@PS_TRay 5h - all factions will eventually get a model change that matches the lore/history of each faction
1361296190.0,179,Fixed MBT K:D Graph
1359281031.0,181,Higby Confirms: Planetside 2 will not feature players as dinosaurs.
1359161228.0,184,Here is the full album of the propaganda posters I did for my outfit.
1357874189.0,186,Think we should warn Rashnu?
1357782473.0,181,"We have Enemy Activity on the map, so why not Friendly Activity?"
1350355917.0,184,And I thought Battlefield 3 had a lot of tanks
1373542991.0,181,Tried to make Planetside appealing to my niece. She said she liked it...
1370396519.0,181,"[Mod Post] If you message the mods, please remember to include a link (!) to any post/submission you are referencing. Thanks, it helps a lot. Upvotes for visibility if you please."
1369413426.0,185,Lumifiber for NC MAX
1363207511.0,182,"[Suggestion] Allow us to preview camo in the VR, just like upgrades."
1358686703.0,181,10 gifs from my upcoming video (bonus wallpaper!)
1358401358.0,182,Played planetside for the first time today... GREAT game but I have a few questions.
1376014457.0,182,Planetside Castle Crashers
1367541029.0,183,"A2A missiles are broken and bugged, just because you don't like them doesn't mean you should downvote"
1349196561.0,178,Why I am afraid that Planetside 2 is still ahead of its time.
1340326701.0,184,Smedley says announcements on Beta next week.
1369037528.0,177,[VS] Magrider Wallpaper
1368165807.0,180,New Conglomerate Case
1363954986.0,179,Is anyone else getting tired of the new pump action Shotguns?
1362305449.0,179,"[Suggestion] When releasing new items for the full price, permanently lower the price of some of the old items in the same category."
1354604300.0,180,I asplode a Sunderer with tank mines.
1354121250.0,179,"PSA: The numbers at capture points (0/2, 0/6 etc.) represent how many people need to stay there to take the base faster."
1364979731.0,179,GU06 Patch Notes
