created_utc,score,title
1350623527.0,330,The R&amp;D boys may have torqued the engine a bit too much... 
1353710374.0,330,Liberator Pilots get shafted on Certs.
1375136519.0,326,[Suggestion] This mechanic would make the game better.
1371471736.0,329,Wacky Waving Inflatable Arm Flailing Flash Man
1369738662.0,324,TR are getting too creative with their Claymore placement...
1362094405.0,319,New NC Helmet!
1369142166.0,319,We need to bring back the beta night! Night now is to bright.
1367331656.0,319,I can get behind the idea of continental lattice. This would be awesome.
1365723094.0,325,New VS vehicle from today's command center
1369830378.0,323,[Suggestion] Hitting use ability (default F) as Engineer brings up your ammo pack to drop
1367765308.0,319,I feel like we've had this conversation before... crewed vehicles should share equal XP for all occupants - especially the death trap 3rd seat of the Harasser.
1363370194.0,327,I just now realized this...
1353434543.0,326,LINK TO LAUNCHER! 
1366653026.0,318,"SOE, we can see on the minimap deployed ammo packs but -why- can't we see friendly ammo Sundies with a similar icon?"
1358827187.0,322,Made a few wallpapers for myself--decided to share them. Enjoy!
1356533967.0,316,Whatever happened to all the cool conccept... here is the female NC engineer.
1360602004.0,319,"SOE, I can't wait for the buggies. But PLEASE bring these ones back!"
1355501132.0,325,big metal structure is OP
1353577770.0,325,You are losing profits by not enabling purchases cross servers.
1370953644.0,318,PS2 on PS4 - realistic comms edition
1355510147.0,324,(Suggestion) Why not make NV scope crosshairs red or something easier to see?
1369068273.0,319,Why can we see how many enemy occupants are in a vehicle?
1368815090.0,317,[PSA PSA PSA] 50% OFF STATION CASH - DETAILS INSIDE (IMPORTANT)
1368646583.0,319,[Suggestion] Using TIME to address population imbalances
1367583493.0,318,The new drop-pod spinning animation is making you sick? well..
1366594589.0,323,"Center map on squad leader when pressing ""Squad Deploy"". That will give me 10 s to figure out where I'm drop podding."
1358283919.0,319,[Wanted] Vehicle base-chassis cosmetic upgrades (read comment)
1353413359.0,316,IT'S MY CAKEDAY AND PS2 RELEASE DAY. I MADE A PICTURE AND DEMAND KARMA AND JOYGASMS!
1339179970.0,319,"""Fixed up"" one of the PS2 wallpapers in order to curry favor (and karma) from the beta key overlords. "
1376403799.0,321,Hopefully PS2 being release for PS4 will improve this for PC
1358796805.0,315,Hackers are getting out of hand
1364227737.0,321,Almost broke the speed of sound.
1373370908.0,319,So I tried my hand at a Lego Mosquito...
1371932441.0,321,"Please, for the love of all that is holy, fix the available spawn location mechanic"
1367274698.0,316,The true infiltrator update has arrived
1362142122.0,314,A take on fixing the Flow: the Big picture (yet rather simple)
1359633316.0,316,One infil against the zerg
1365839058.0,310,"PS2 physics at their finest - one guy in our tank column hit a small ditch leaving the warpgate, we lost 3-5 tanks."
1358912650.0,315,New Reinforcements Needed Screen Added in Last Hotfix! Off To a Good Start!
1352903133.0,312,"After seeing some of the helmet customizations, I felt like we need more horns and skulls for vehicles"
1352960765.0,310,I give in: Cert gain it too slow. Looking down at your cert points after three hours of harsh fighting feels like a let down. 
1370115608.0,311,A mockup of what I think should be added to bolt-action rifles
1365514568.0,312,Map/Deployment UI Mockup [Imgur Gallery]
1364487723.0,307,"I took some portrait pictures of random planetside 2 players. I call this series ""The Phoenix is not overpowered"""
1362730392.0,313,VS Max New ability
1360428812.0,310,Now this is how one montages...
1355089193.0,313,C4 and related unlockables should unlock for all classes when you unlock them.
1353634630.0,309,Picture of every Camouflage
1353295877.0,310,Thanks for the Beta help guys
1372264755.0,309,A Comprehensive(ish) Guide to Planetside 2 Players.
1359756748.0,314,[suggestion] Corpses which cannot be revived should not get the little skull icon
1355608055.0,308,"Smoke-grenade, Low vs High 'Graphics quality'. Huge difference!"
1374380412.0,303,[Bug] Something that has been bothering me for a very long time.
1367743044.0,307,"New players join the game and leave fast, SOE we need a proper tutorial or something to keep players."
1364523130.0,302,So this was posted on the PS2 Facebook page (when you see it...)
1354739020.0,308,I could not stop laughing at the honest truth behind NC
1354561825.0,305,This would save me a lot of time (see right)
1373407881.0,308,Today is my Cakeday! Here are some things I have made this year!
1358991104.0,300,[MOD POST] Announcing r/REDDITSIDE for all your humor/memes/pictures of giraffes! NOW WITH COMIC SANS. Upvote for visibility! 
1355951430.0,304,Are we ever going to see these bad boys in action? They've been in the game since forever.
1373317104.0,303,This is what you get when you ask an outfit member to edit your clip....
1362919965.0,303,[Suggestion] Make the Warpgate shield color match your faction
1362161360.0,302,Tips for Newbies
1366917439.0,301,Alerts
1363716538.0,302,Mad props to Higby and the PS2 Dev Team
1356073152.0,303,Was wondering why air units were dropping like flies...then I turned around.
1374140546.0,299,What's the difference between NC and Vanu?
1372590708.0,302,"[Hackusation] ""Nah Bro he's just really good."" I present the evidence. You decide."
1359940769.0,302,[Suggestion]Stop making my throw ammo box go back to main gun please. Press F to throw ammo.
1359131352.0,300,ROADMAP
1357158288.0,300,"Meanwhile, In Amerish..."
1368060834.0,297,New NC helmet Concept art: Mat Broome
1369804651.0,296,"SOE, I know I'm likely a minority, but I would really enjoy resource harvesting and ANT driving."
1368574446.0,295,All factions Shemagh and Goggles concepts.
1364669475.0,300,"Recently people have asked for darker nights, this is how the nights could be in the Beta."
1360520354.0,302,Playing as an NC has made me start to wonder
1354786653.0,297,The real Anti-Air patch is here
1370450511.0,302,PS2 coming to Playstation4
1365446000.0,293,Screenshot of the lattice system on Indar (Test Server)
1365355193.0,299,WARNING: Going into VR training will reset your ability slots on all Vehicles and Classes
1354746725.0,298,Double XP Weekend!
1372694736.0,295,Indoor sun reflections (without shadows) is blinding and unrealistic
1364751074.0,297,Look out below
1354033293.0,300,If you do this - fuck you!
1372540503.0,294,PlanetSide 2: Nexus Battle Island Fly Through
1369716092.0,293,"The Lattice spawn system needs a fix, desperately."
1360695517.0,295,For Engineers: Visual Differences between Mineguard and Non-Mineguard Sunderers
1375204872.0,290,HOSSIN ON PTS
1374522765.0,293,"[Friday Night Ops Suggestion] Create an observer that follows a single person. When that person is killed, have it switch to the perspective of the killer. When THAT person is killed, have it switch to the perspective of that person's killer, etc etc."
1370707878.0,296,This is why there will ALWAYS be hacks. GG Facebook
1366071672.0,290,Vanu: We're Men in Tights! [Video]
1363271736.0,292,"Loyalty Pledge to SOE: Keep the game awesome, keep listening to your community, continue to evolve it, and we stay away from Battlefield etc. for many years to come."
1358950199.0,290,2esf1shell: The Sequel: Just When You Thought Only NC Pilots Were Bad
1351810397.0,292,ATV's in a nutshell.
1359160464.0,292,Worst stream ever.
1355133197.0,293,Suggestion: Give EXP for doing AA damage like repairing or healing to encourage players to deter air spam.
1372940152.0,292,Being dead for too long should give a notification that you cannot be revived any more
1370244116.0,290,I got the chance to play Hide and Seek on Esamir with two Vanu players. It was lots of fun.
1369345113.0,292,Double XP this weekend
1359899962.0,288,[Suggestion] Alert sound when the squad/platoon waypoints are changed
1373570320.0,289,"Oye! That's a door! SOE, quit holding out on us!"
1372986160.0,293,Planetside 2 listed 3rd best shooter of all time by PCGamer
1355643699.0,291,Do vehicles really need to spontaneously explode if they flip over?
1375392081.0,286,SOE Plans to nerf ESF reverse maneuver
1373685362.0,285,Please remove the XP cap for hacking/ammo refill/support roles.
1367253438.0,290,Why combat scaling doesn't work very well with insane range weapons.
1358957785.0,288,"SOE, you may want to start merging servers."
1360934119.0,281,[suggestion] Achievement based cosmetic swag (i.e. 300 consoles hacked + 20 hours as Infiltrator = wrist hacking device with holographic screen for you arm)
1356495129.0,286,Luckiest Shot Ever!!
1376018381.0,285,Allow tanks and aircraft to change loadout after spawning?
1375616484.0,285,[Bug] The Tank spawn on Allatum Botany Wing is turned the wrong way.
1370805037.0,286,Current idea of implants implementation presents a toxic precedent
1373510703.0,278,Since GU11 I feel like I'm not the demographic Higby wants in PS2
1368062299.0,283,Was Looking Through My Kill Log. Found These Two Characters There.
1365558184.0,285,We need your help: This week at 5pm PDT we are having a focus tests on Public Test.
1360441197.0,283,I should learn to stop expecting logic here..
1360076019.0,286,"Let's make this Saturday (09Feb2013) ""All Amerish All Day""."
1358010328.0,285,Suggestion: Let anyone on the same team use unattended MANA turrets
1370851052.0,281,[Suggestion] Let MBT drivers see their gunners ammo count.
1368663122.0,283,"New VS Weapon Audio, via Higby"
1360983049.0,282,New TR Helmet Concept (Screencap from FNO)
1363170955.0,280,Full patch notes for GU4 are up!
1359485413.0,281,Unpopular ideas removed from January update
1368019379.0,279,[Mine Overhaul] The way mines work now is dead wrong and something needs to be done about it
1366747222.0,281,"Let us form Companies, and Battalions."
1362958221.0,278,"A very talented member of the Planetside 2 team that has not received enough attention, I believe: Jeff Broadbent, score composer."
1360190189.0,280,"Really, SOE? How can you possibly NOT automatically detect something like this?"
1374596514.0,278,A simple thing about the MAX that always kinda bugged me.
1371181145.0,282,[Suggestion] Vehicle crews should share XP
1371104221.0,280,"It's funny how much they listen to community feedback, here is the new squad listing/squad UI on the PTS"
1361204260.0,280,The bulldog rounds must be really small...
1354208905.0,277,Tank transport via Galaxy - WANT
1353489209.0,278,Please make friends' names stand out in the game world.
1375093091.0,281,"A shitty paint infographic on defensive postioning, or ""get out of the fucking way numbnuts""."
1363231898.0,275,Sneak peek of new hex layout and Public Test Realm
1356859106.0,279,"Warning: Anti-Air Bundle doesn't have an Anti-Air Rocket Launcher, but an Anti-Ground Rocket Launcher."
1374554688.0,281,Please put a two hour timer in for character switching on the same server.
1368376819.0,279,[Suggest] - Bring back full voice macro keyboard hotkeys. V-N-* was critical to coordinated gameplay.
1366306516.0,277,"Empire colours on map are forced, Minimap empire colours are not. This is not a nice change."
1358542277.0,276,[Idea] Allow bases to be upgraded at the cost of resources like in Guild Wars 2. This would fix the metagame issue.  Examples inside
1353884104.0,275,I think defending should give you more XP. Agree or disagree?
1353518272.0,275,Lets Give Big Ups to SOE for Listening and Clear Hard Work (re: weapon trials)
1367614290.0,275,Thank you SOE for caring about your LOYAL customers
1360790115.0,271,"NC Commander Beret [leader hat, Fan-Art]"
1357136352.0,276,What about rotating the warpgates monthly?
1354289780.0,276,Planetside 2: SOE's 3-year plan and future vision.
1340410990.0,274,Oh God.. Please... NO..NOOOOOOOOO!!
1372520725.0,273,[Suggestion] Deployable Wingsuits by Galaxy air drops for tactical insertions.
1365899699.0,276,INCREASE THE RENDER DISTANCE ON AMMO TOWERS
1351353907.0,274,Thank you for flying with us
1369308237.0,271,"[Quality of life/bug fix] When playing as a MAX, make it so that equipment terminals always default to MAX being selected and not LA"
1366648358.0,269,Had to make a crash landing. Platoons of soldiers simply passed me by for several minutes.
1363252414.0,276,Assist XP for vehicle kills need to be fixed!
1376354910.0,276,Burst version guns need their first shot recoil lowered so they actually make sense as a burst weapon.
1366207064.0,269,"[Suggestion] Change V-5 from ""Request Transport"" to ""Request Gunner"" when in a vehicle."
1356040235.0,271,PSA: Triple Station Cash appears ACTIVE NOW
1355006096.0,273,Does this rendering bug occur to anyone else?
1376216715.0,274,I got my lightning stuck
1371367687.0,271,TIL the ACE tool uses the playstation buttons
1368583587.0,272,Okay SOE... open these bad boys up! i want to go underground!
1360680388.0,269,This Beautiful War - Render distance changes on Connery
1375008314.0,270,60 second review that will show you why the Cerberus is a waste of station cash / certs
1372719575.0,271,Pilots bailing and suiciding will give the killer XP in GU13
1364679070.0,272,This is What Your New Players Are Experiencing
1362248914.0,272,So my Scythe got stuck underground.. and in attempt to get it back to the surface...
1360028886.0,272,"As it stands, I do not believe Infiltrator cloaking is ""broken"".  Please take a moment of your time to review my gallery and explanations."
1369217093.0,266,GU09 is here! Today! Feast on these patch notes!
1368138722.0,270,New map changes straight from Higby!
1363461236.0,266,"SOE; Servers are becoming incredibly unstable, and it's starting to drastically affect gameplay."
1356268384.0,268,One Crown
1356608595.0,272,Don't mind me I'm just sweeping up the trash aka Best Use of a Scythe Ever (I wish I had thought of this)
1364352665.0,267,Deconstruct to be disabled and vehicle assist xp to be increased this week!
1360394851.0,267,"Anyone else get a triple load screen where you go through three separate loading bars, one after another, before spawning?"
1359572018.0,270,Picture the Planetside 2 Hacker
1358873034.0,263,Am I the only one that enjoys Planetside 2 without any real problems?
1374785521.0,267,Today I conquered the floating brick of Esamir!
1369759752.0,266,When people would rather see their own vehicles useless than deal with enemy vehicles there is something seriously wrong with the games design.
1361616988.0,268,SOE know where to place their ads.
1374171918.0,265,Rejoice PTS Users! New characters to start with 100k certs instead of 10K!
1368875342.0,266,[Quality Of Life] Underbarrel launcher should not move hotkeys for other weapons
1364251897.0,268,Rocket Fetch (0:15)
1358658429.0,263,"The problem isn't that spawn rooms are camped, it's that spawn rooms must be camped."
1337268528.0,265,"Planetside 2 - Night Ops (Total Biscuit's first PS2 vid!)
 "
1355260031.0,261,"Magriders Are The Best Tanks, Settled Once And For All"
1354334679.0,267,Feature Request: Bring back travel between continents by actually using the warpgates
1350287763.0,261,How FPS affects fire rate
1365981678.0,262,"Why is it that a small, cloaked, buggie with a tiny grenade launcher can wipe out an entire enemy entrenchment 4x as fast as a large, lumbering Main Battle Tank with a 150mm HE cannon?"
1354481056.0,260,Angry Joe reviews Planetside 2
1375384360.0,264,Hossin Full Map [Seriously]
1366227099.0,264,A thank you to the Devs
1354263829.0,259,"A better look at the ""Bastion"" carrier!"
1353844485.0,264,What organised play requires as soon as possible
1374665644.0,260,"Bring back Command Rank. Give platoon/squad leaders a different type of ""command XP"" that they can use to get unique cosmetics, titles, and leadership abilities."
1359285096.0,260,Suggestion: Make the ability key bind ('F') for engineers the ammo pack
1356704160.0,261,Upcoming Engineer AV Turret
1369908457.0,261,This is how lock-down should be used properly. Even the NC couldn't get a foothold
1367852661.0,260,Open Letter to Pro7Sat1Games
1366387519.0,264,Being underpop is not so bad now :D
1353953187.0,258,False advertising.
1339291391.0,261,There he is again! (a little more relevant this time)
1366874673.0,260,The new Interlink Facility put together
1365259473.0,260,One Way To Clear A Room!
1355956328.0,259,"Dear SOE, please bring back vehicle hacking. Because red &amp; black magriders are sexy."
1375554795.0,258,Continental Lattice Concept
1371853850.0,259,"Comparison of NV on Low, Medium and High graphical settings"
1367956100.0,254,Spawn Experiment on the Test Server: Killing the SCU brings down the shields and pain field
1363106035.0,260,[Suggestion] Let me set shield generators as a squad target!
1372163056.0,254,"Dear Terran Republic, please accept this gift."
1366483609.0,255,New Vanu Propaganda Poster
1362196617.0,254,Miller VS Woodman
1359300854.0,257,"Watching this video should be mandatory before creating a ""buff this/nerf this"" thread"
1363037460.0,255,Roadmap - March Preview
1358700988.0,255,2esf1shell
1355773217.0,255,Dear SOE: Days don't work like that...
1353803084.0,253,PSA:  Please do not blow up enemy terminals.
1353779711.0,258,"Devs: Can we make it so that when an ally stands next to a gen that I overloaded, I don't get grief for his death?"
1351014425.0,255,"Forgive command, please."
1364931802.0,259,Queueing Simulator 2013
1362187030.0,256,GU04 Update
1355185084.0,255,"Suggestion: If I become a Max, let the default respawn class be whatever I was before I became a Max"
1346759700.0,252,Join the Mobile Infantry and save the Galaxy. Service guarantees citizenship. Would you like to know more? 
1369262507.0,256,This screenshot of a 300+ person battle sums up the state of aircraft
1366467277.0,251,"Dammit, SOE. Could you please make Instant Action drop us on the same continent?"
1362814154.0,252,please fix the vehicle spawn menu
1374422539.0,251,[QOL] Resources should regenerate when your offline at a slow pace
1357824967.0,248,[Suggestion] Implement a server side clock HH:MM:SS for easier co-ordination.
1355946059.0,255,Two VS infiltrators set out to bring peace to Auraxis... Through friendship and diplomacy.
1353878018.0,253,The elephant in the room. Cert items performance metrics.
1360728285.0,251,"Say goodbye to ARC Bioengineering and NS Salvage Yard - outposts behind warpgates ""will be squashed"""
1358203124.0,250,"Before you go around demanding that something be nerfed or yelling it's ""OP,"" how about taking a moment to understand what you're fighting and *how* to fight it?"
1354552772.0,249,"PLEASE make this setting seperate for Infantry, vehicles and aircraft."
1351173276.0,249,"Finally, you can see what you can spawn at a base from the deployment screen."
1363971627.0,246,Planetside 2 - War Correspondent | Episode 4 (made by me!)
1357067225.0,252,"[Suggestion's] Move infantry decals to helmets, make rank decal default and update automatically."
1356702519.0,247,Upcoming Vanguard Railgun (with new bumper attachment) and Prowler 120mm Quad Cannon
1354112907.0,249,This guy proves that Giraffe Camo is overpowered. 
1353890432.0,247,Beautiful view from my sundy
1373488424.0,248,I am amazed by the amount of players that have no idea the the Amp Stations and Tech Planets have tunnels.
1364564546.0,247,[Suggestion] /apologize to send a tell to the last person you TK'ed
1358590037.0,246,The most awkward PSA ever - I can't believe I even have to say this.  Don't dox people.  Seriously.
1354559694.0,248,"Atomic Ass, engage!"
1370567377.0,244,"Proposed new squad leader cert, resupply pods"
1365000003.0,249,What is 'freedom'? A Terran Republic Re-education
1354041077.0,248,That opportune moment. 
1373788233.0,244,"7/13/13, the day the TR sent the first engineer 100,000m into space [Album in comments]"
1364101797.0,246,A Tender Moment
1358523786.0,248,Weapons Bundle pricing should account for previous purchases!
1354489937.0,249,Feature Request: Vehicular Honking
1353438812.0,245,Updated Outfits with Servers
1368728289.0,243,The most infuriating thing about tanking
1355726222.0,243,New Client with Vehicle Fixes up
1354213196.0,248,"It's easier to run over frendlies, than hostiles"
1368469836.0,245,"From Higby : ""We're going to be buffing the fuel pods a lot, adding a cert line that increases top speed, AB speed, AB fuel, when leveled up."""
1368292637.0,245,"One of those: ""I can't believe it actually worked"" moments...I giggled like a schoolgirl."
1355979954.0,241,Reaver Flare Certs Refunded - +1 SoE
1355672258.0,243,Tippers be warned!
1347469321.0,247,"Quick question, don't upvote."
1374056179.0,244,"Big fight, last 20m of an alert, teetering on the balance, TR vs VS, all of the sudden 4 TR Sunderers get blown up by friendly C4 by different low level TR players. PLEASE STOP 4th FACTION!"
1364303830.0,244,Double XP Weekend and PlanetSide 2 App Coming
1361650944.0,242,Can the new continent not be a square?
1361230720.0,244,Higby's MBT K:D Ratios for the last 30 days
1360096461.0,243,"@mhigby: We just put up a new @Planetside2 client that should resolve the major framerate ""stuttering"" issue"""
1357911790.0,246,Well... Haven't we all tried shooting at generator to destroy it.
1356035213.0,245,"John Smedley: ""The way we see it is that the 90% of players who donâ€™t pay are making the game fun for the 10% that do. So we look at the world in terms of how many people are playing the game, and not in terms of how many are paying."" "
1364704248.0,240,"Oh, so your people need you? Not on my watch."
1357943692.0,244,You have all been flying WRONG - YouTube
1356543636.0,244,"Can we please make it so that when you switch to another class, it automatically uses the last loadout you used on that class, rather than loadout 01?"
1354566195.0,245,PSA: PRESS Q TO SPOT
1368770777.0,242,"[Suggestioin] Shouldn't Heavy Assault's AV Grenades be sticky, because they are anti-vehicle?"
1367518484.0,243,VR STILL unequips loadouts - Not fixed.
1363690918.0,239,I would love to see non-combat stats on my profile.
1363278181.0,236,"higby: yep, we will be fixing up the assist xp."
1360552352.0,244,"No war here, just us plants."
1356566962.0,237,Vanu Sovereignty - All 8 Weapon Optics.
1354576374.0,241,Smed - Hacker from artificialaiming banned
1353789216.0,238,PSA: You do not take fall damage when jumping out of a Galaxy.
1339088789.0,238,Planetside 2 Custom Reddit Design - How do you guys like it?
1365383662.0,243,"Alerts have caused an ENORMOUS change in inter-outfit relations, and have really added a new level to the game"
1361720277.0,237,Planetside 2 - Fixing The Core Gameplay - LevelCap
1376532540.0,238,It has begun... the nerf to Trees...
1374080295.0,237,Grinding to keep yourself competitive in the game is anti-fun (Consumable Implants)
1370606212.0,236,RIP Higby's hair 6.6.2013
1365499551.0,241,"Helios VS: ""What the hell are all these TR liberators doing here!?"" ""That's our air support."""
1359490511.0,239,"Why not bring back the liberator camera from PS1? Tap a key, and it changes to your gunners view, keeping you flying."
1354904303.0,239,Could you please add ammo-towers on the map. Its so time-consuming driving around trying to find a base where you can resupply.
1353857100.0,238,"If this is a helmet option on TR, I'm going to have to change factions..."
1355693644.0,233,"At first glance I thought TR had the most terrifying MAX unit, then I saw this."
1354728494.0,234,Sovrinn's Guide to Becoming the Greatest Combat Medic on the Continent
1344210390.0,237,Beta testing etiquette 
1370014883.0,239,"[Suggestion] Give outfits the option to issue gear and cosmetics to their members, available to members as long as they are part of that outfit."
1366631547.0,236,Biolab Metagame
1359830510.0,238,Is that a... on a... ?
1366759567.0,236,"Sci-Fi Helmets in-game screens, via Matt Broome"
1365040007.0,232,THANK YOU SOE: Great work on the Continent Objectives!
1353825507.0,234,Anyone else think the relative xp gain from objectives and utility roles is too little ?
1350661960.0,236,"November 20 Launch - Things that should (need to) be addressed, if PS2 is to succeed. Post or upvote here."
1374062226.0,234,"The EMP, Flash &amp; Conc protection implant is a game design idiocy"
1371565975.0,235,Suspect in Higby Case: Massive Oversight!
1366811233.0,237,"Dear SOE, Please let me gift items to my friends."
1355963441.0,233,Vehicle Occupancy Information needs to be removed from non-friendlies.
1370295330.0,233,The servers are missing!
1365007874.0,229,Meanwhile in planetside 2
1363223156.0,229,"This update (GU4) was rad, thanks guys!"
1358670249.0,232,[Suggestion] A very minor tweak to the (centralized) HUD that would help a lot
1357743100.0,233,"Regarding warp-gate rotation: ""Essentially one problem in Planetside is staleness - fighting the same enemy from the same direction at the same base every night.""  -from July *2011*!"
1353139384.0,234,Good game all. Whatever empire you played. Beta was great. 
1360972158.0,233,New VS Helmet Concept from Mat Broome. Watch FNO tonight for more!
1376085843.0,231,There's a monster running among base design. A vampire. A nightmare.
1373899882.0,231,[Suggestion] - More Minimap settings
1371741859.0,235,SOE Finally Has An Answer To Banned Players Creating New Accounts
1370448824.0,230,Anti Air nerf confirmed
1367194434.0,231,"Input code ""MLGREPORT"" to get the MLG vehicle and infantry decals, along with free boosts"
1360815916.0,230,[Suggestion] Bring Back the Night
1359171713.0,231,"Ok, So lets have a talk about the SOE UES Event."
1357875108.0,232,Sunderers aren't there just for AMS
1356816983.0,229,Quick mock-up (slight) redesign I made of the Vehicle tab
1363667300.0,229,"""Hey all, @tomslick42 found the bug after working ALL WEEKEND LONG on it. He fixed it.  We're testing the fix now and will get it out ASAP."""
