created_utc,score,title
1360355340.0,1887,My submission for the VS-specific run animation (a short render in Maya)
1355847664.0,1500,This is how I wish I could play Planetside
1353595300.0,1278,Stupid Sexy Vanu
1365696652.0,1225,[suggestion] aircraft launch tunnels
1360787095.0,1138,"Art team, please stop this. These helmets are outlandish and we deserve lore friendly designs. "
1354306603.0,1100,"So, uh, when did SoE because so fantastically fucking awesome?"
1362490685.0,1098,Can we please get a zoom-able minimap? Because this is not helpful.
1368633605.0,1075,I bring a message from 2003..
1367785019.0,1033,"[MAJOR BUG!] The player model and hitboxes are thrown completely off when you crouch. HALF OF YOUR BODY is exposed, when you can't even see the enemy on your screen. IMAGES INSIDE"
1357623268.0,1000,"Hey /r/Planetside, you're Subreddit of the Day! Congrats!"
1360280732.0,966,"Empire-Specific ATVs [3D Models, Fan-Art]"
1355149953.0,923,Anyone else think double XP feels closer to how cert gain should be ALL the time?
1353918300.0,899,The most glaring and game-breaking issue in Planetside 2 that has yet to be addressed by the community or SoE.
1360241616.0,890,EVASIVE MANEUVERS
1355233160.0,892,My mock-up redesign of the Class Customisation screen (with the goal of minimising needless clicks!)
1362515281.0,893,A small suggestion: replace the light assault models when choosing factions with Heavy Assault
1361998499.0,855,Flinch in Planetside 2: why it has to change
1369772038.0,858,"I'm better at illustration than I am at Ps2, so I made this"
1374106984.0,841,Smedly: Back to the drawing board with implants; not coming with GU13.
1359414429.0,828,My single favourite comment from the PS2 Roadmap
1359224945.0,824,The Shot
1370398882.0,809,How an evil Wizard is destroying Planetside 2! An attempt at explaining one of the biggest game breaking issues in the game.
1360063633.0,808,I really worked hard on this Reddit. Hope you like my Beginners Guide to the Sunderer!
1369247251.0,795,"""Indar Tube Map"" - Improving the lattice appearance by using subway map design"
1364843926.0,791,[Sugestion]Replace the scoreboard with a map.
1354199252.0,771,"Make SC purchases account wide, we have some support so far. Lets make this happen"
1362046852.0,770,"[Suggestion] ESF jumpseats, because fun  :D"
1356234437.0,751,Redesigning the Deployment Screen - My attempt at merging it with the Map
1353953300.0,752,Let's compile a grand list of tips and hints for the new players
1367000909.0,742,I heard you Vanu nutjobs would like a more badass look... (xpost from /r/wallpaper)
1358306754.0,739,Can this please be fixed regarding droppods?
1356107357.0,730,There needs to be a reward for standing on capture points. People aren't doing it because it means they cant be near the action where the XP is at.
1374017695.0,726,Can we please scrap the idea of consumable implants?
1357653380.0,729,"He'll, I'd buy it just for the horn upgrade alone!"
1358479219.0,729,Thank You - From LevelCap
1355362123.0,721,Current state of PS2 meta game:
1356907857.0,704,"Since they aren't fixing the underbarrel launcher bugs (broken since day-1), I'm publicly sharing how to get around the bugs and have infinite ammo capacity."
1359124638.0,701,I'm helping(really!)
1356636057.0,704,What if we could enter mines like these and take the fighting indoors?
1361839458.0,695,Short explanation of our banning/suspension policies towards cheaters
1358467904.0,693,LevelCap replacing Tobuscus?
1370456107.0,695,Anyone else like the new lettuce system? I think it's going to work well.
1369638921.0,696,"[Suggestion] Allow buddy focus, at least for pilots!"
1361031246.0,689,Generator repaired
1346552685.0,681,"Planetside 2 - Bigots, homophones, racists, anti-semites and general jerks not welcome."
1363302425.0,680,Peace at last!
1359698535.0,668,"[Suggestion] Show a ""You are being revived!"" message to the dead player the _moment_ a medic starts the revival."
1355955366.0,664,Terran Republic Pin-up Girl.
1360117210.0,658,"Please SOE, make this gun usable one day."
1369533146.0,650,[Suggestion] Tunnel System Visual Revamp
1361712608.0,648,"Confirmed.  SOE is banning hackers for only 3-10 days on first offense and they keep their Name, Battle Rank, stats, certs, unlocks when they get back.  Oh and they get passive cert gain during their ban.  "
1366249541.0,647,Higby just retweeted this amazing Planetside 2 Trailer
1358081193.0,632,15cm of freedom.
1358624575.0,632,LevelCap's Ultimate Empire Showdown....A response to TotalBiscuit's lies and propaganda.
1354022393.0,636,Since the devs took out mobile spawning from Galaxies in beta we decided to make our own :-D
1361394262.0,625,"I'm Getting A Ton Of ""Ghost Blips"""
1355682453.0,628,Powered by Apple Maps
1368932098.0,619,"AJay's Awesome ""The Thread that will save the Galaxy"""
1354959278.0,615,Planetside 2: My White Whale
1361484693.0,607,You done good SoE
1357211141.0,604,This is how I fly a Galaxy.
1349260036.0,606,*Boop*
1371519138.0,591,Higby helps ItZMuRdA propose to his girlfriend via system broadcast (she said yes)
1359060748.0,592,"Our new ""Roadmap"" reddit-style system"
1365493450.0,588,Vanu Helmet paint-overs. I did these after someone mentioned that the Vanu should make you wonder if they're human under their armor.
1375126492.0,587,The Republic does not approve of this.
1356759473.0,579,"Give liberators a HUD icon that shows where the main-gunner is looking. (Visible to both pilot and main gunner, relative to the aircraft-body.)"
1356355612.0,578,"""Lots of people have been asking for numerical stats for weapons instead of the stat bars. We will be doing that in the new year."" -mhigby"
1354098456.0,581,Request: Let us see our respawn timer for vehicles without having to go to the spawn point
1357840773.0,578,Let vehicles refit without having to pull an entirely new one
1370087170.0,568,Outfits at a Glance: Daily Life in PS2
1361375922.0,573,"[Request] A simple change: Player counts in the map, so I know Esamir only has 25 players."
1352407257.0,574,"We are implementing a ""Try before you buy"" system for launch"
1364888195.0,563,[Suggestion] This is a must have - old way is WAY TOO tedious -
1359867137.0,559,"Thank you SOE for the UI improvements, Spawn Room improvements, Base improvements, etc, etc, etc, etc, etc..."
1365182135.0,556,Can we have 200%-500% bonus XP when my faction is outnumbered 5:1 ? Otherwise fighting feels plain unrewarding and pointless.
1355465025.0,556,"Triple Station Cash - December 21, 2012"
1362329324.0,554,A Full Sundy Armed With A Gate Diffuser... We Were Destined for Greatness!
1355825954.0,544,"hey SOE, I'd pay a bunch of smedbucks for this "
1355498726.0,538,Like seagulls at the beach
1358391114.0,544,"[Metagame Design Meeting Idea] Easily Increasing Strategic Flow, adding New Objectives."
1354106170.0,534,Infantry rendering solution hit critical mass last night. This NEEDS to be fixed before ANYTHING else.
1365506228.0,537,[Suggestion] Don't remove the buildings of bases that have been taken out. Let them become ruins.
1362023215.0,537,"Had some downtime waiting on OPs night, decided to make a Lego Reaver"
1353774437.0,533,I.. Will.. Play this game!
1372450545.0,534,Have some silly infantry training Infographics I put together for my outfit a while back.
1373278287.0,529,I would really like to exit PS2 without having to end the system process or getting 'Planetside 2 has stopped working'
1369828884.0,523,Nothing takes the place of ESFs and Smoke Trails
1371231852.0,530,Can we have this back?
1359937893.0,520,One day...
1355853134.0,519,Request:  Have all gunners share XP in aircraft.
1362434608.0,515,Flak Party Massacre
1364804140.0,510,"Welcome our new /r/Planetside Moderator, BuzzCutPsycho"
1371054988.0,517,That just happened.
1361248814.0,509,MAX artwork
1355256464.0,508,Simpsons recreate a Vanu assault
1358772054.0,507,"Who's a good Vanguard? Whosa good tank? You are, oh yes you are!"
1354226259.0,499,Twitter / j_smedley: people keep asking for galaxies ...
1373216077.0,501,Screw it I'm going to say it again. This game is more enjoyable with higher cert gain.
1359575883.0,498,Pictures of the new Tower Changes 
1368306833.0,500,[Suggestion] Give Ammo/Repair Sunderers a unique minimap icon for allies.
1362278559.0,492,New hex prototype from @mhigby
1359183141.0,497,"""Congrats to TR for dominating their foes""....dafuq!?"
1371739075.0,496,A PSA regarding a very particular act of pathetic cowardice.
1368482754.0,493,[Suggestion] The Air Combat Ecosystem - A diagram
1361363658.0,498,Mergers coming before paid transfers
1370973674.0,487,258 Photoshop Layers Later - My Custom Squad Selection Menu 3.0
1370040406.0,487,So uh...this was just posted on the PS2 Facebook page...
1354836460.0,490,You can use Vanguard guns as ramps to get into a Tech Plant
1373315965.0,491,"[Reminder] Best way to display the lattice? Subway-style! (""Indar Tube Map"")"
1362775900.0,487,"These guys were crouch walking around in base with ""Craab people"" playing over and over again from South Park. I don't think I've ever laughed this hard from a video game."
1354663263.0,486,Give Infiltrators EXP Whenever One of Their Hacked Terminals Gets Used
1374759545.0,487,"Medical Applicator, left mouse button for heal, right for revive. Higby pls."
1355340935.0,490,"$6.50 for a horn is a bit ridiculous, PS2 team. "
1361692593.0,479,[Suggestion]Stop swapping my turn keys when im reversing.
1360179693.0,485,"How about double XP on Valentines Day... SOE, we both know where I'm gonna be on V-Day."
1363473517.0,474,"Dear Devs, since the game has been riddled with issues on the Double XP weekend could we have a redo next weekend when its more stable?"
1366937958.0,473,"Every time a weapon's stats are changed, the Nerf Fairy takes a single tear from affected players and puts it in a safe place."
1372368695.0,477,Camouflage in its current state gives the Vanu Sovereignty an IFF advantage.
1363046009.0,476,Just read this in the Planetside 2 rules...
1355258562.0,474,Planetside 2 Vanu Sovereignty Official Trailer
1356216624.0,473,Dear SOE: SHOW US THE NUMBERS
1366614919.0,469,Uhhh..... I'll just leave you two alone...
1357439510.0,470,It's not just a boulder
1368045199.0,461,[Suggestion] Cosmetic changes to the new Hyperion helmet
1367249017.0,470,How to make the Skyguard king of AA without changing a single stat
1360821265.0,469,All this talk of helmets... why can't we just take them off? 
1356943995.0,464,This is how I roll in to a Biolabs zerg.
1367860734.0,464,Further efforts to bring peace to Auraxis... Through friendship and diplomacy.
1360277772.0,465,New Biodome
1369307750.0,463,Thanks SOE UI designers for re-ordering the Harasser!
1355766708.0,456,Accurate representation of Flash afterburner
1353527742.0,454,How to fix the queue-hate
1370672829.0,457,My Everyday in Planetside
1375833222.0,456,Don't award XP for blowing up terminals.
1366501867.0,460,"Many of us who bought 6-month subscriptions at launch will be deciding whether or not to renew next month. For 5 months, priority queueing has been at the mercy of broken continent warp buttons which rarely put you in the queue. Fixing it soon would definitely help SOE retain subscribers."
1366772484.0,454,I hope one day this will be fixed when I exit the game.
1366123044.0,447,Let's make tanks *Awesome* again *without nerfing infantry*
1367138578.0,452,Poor Vanu =(
1363883313.0,451,Not what the Vanu expected when he looked in through the window
1362865641.0,454,"TR Max - ""heavy"" loadout!"
1363729985.0,448,"Saw this at a Higby tweet, can this be our new logo please?"
1367514985.0,448,[Suggestion] Emergency System for SCU Generators
1356230955.0,446,Suggestion: An additional perk for the faction controlling The Crown
1371141082.0,445,[Suggestion] ESF Jumpseats: All credit goes to kaiserpanda
1355578554.0,442,My friend made his own version of the Vanu Sovereignty trailer. He's a Terran Republic kind of guy.
1365640807.0,444,"I don't mind having to enter a queue to get onto a continent, but can we at least fix the problem where I have to click ""Warp"" a hundred times before I can even get in line?"
1351360883.0,445,TotalBiscuits PS2 Critique. 
1359016708.0,444,Suggestion: make all NC guns also guitars
1360098797.0,440,"[Suggestion] Allow a free one-time reset of certification points, and charge station cash for any repeated resets. This seems fair, given that many players regret spending some certs on items lacking detailed descriptions/stats."
1358903107.0,438,Hey guys check out this bridge! [gif]
1356409077.0,443,"Sony, please fix the aircraft HUD color for Vanu or simply make it user selectable. I mean, really, *sky blue*?"
1357312258.0,439,Can we please get rid of support XP cap?
1355176975.0,438,"The current system of cert gain, which is focused almost entirely on kills, is reinforcing the wrong behaviors in this game. By changing the way we gain certs, I feel the game will be a lot more fun and feel a lot less grindy, even if the rate is not changed."
1356480222.0,435,Auraxis's most optimistic Rock
1370810109.0,439,Planetside 2 - BAM! Thats the BAM!
1367173896.0,433,And now I'm stuck with it.
1361901361.0,432,Specific Changes we are making as a result of the banning/suspension thread
1361311829.0,436,"Sony, you opened up too many servers the week of release. Please answer your suffering players as to why none of them have been merged. It deserves an answer."
1354126312.0,430,"Small question about medic applicator, don't upvote"
1371992177.0,429,For all budding ESF pilots I made a helpful map.
1354615928.0,431,"Reddit, yesterday you showed tremendous support for the Platoon Leader Command Center Concept...today, I have something special for you: v2 with a hand-built, PS2-based UI."
1367596156.0,428,"[Suggestion] Make it faster to redeploy to WG, instead of the usual 18 secs"
1358555997.0,425,New spawn room design.
1367201969.0,431,The Ultimate Defense.
1366046791.0,424,This is not dark enough
1371713609.0,431,[Suggestion] Press [Y] or [N] for revive prompts. Just like every other prompt in the game.
1367279205.0,429,"Quick poll: How many of you would like to exactly 0, ZERO, additional One-Hit-Kill weapons added to PS2?"
1363382552.0,426,Tagged
1357101650.0,424,They never saw it coming :D
1355257934.0,424,New Conglomerate Trailer Official PS2
1354457621.0,421,"It's unfortunate that aimbots are already in the game, anyone know where I send videos like this?"
1349005835.0,421,"This subreddit looks terrible, who the hell designed it? Oh wait... I did. Nevermind, here's version 2.0 (WIP)"
1372816021.0,418,Vehicle XP should be shared amongst crew
1371770113.0,418,THE ENCLAVE QUITS
1354261953.0,417,"Wanted: No Grief While Auto-drive Off Vehicle Pad, Vehicle horns, Headlights off by default"
1346860389.0,418,What VS should have as a replacement for Flash.
1356381357.0,420,I asked Smed if he could extend the 3x SC deal as I was getting married and would be on my honeymoon during the sale. This was his response.
1355258248.0,424,Planetside 2 Terran Republic Official Trailer
1370070725.0,415,A three-way fight the other night seemed to progress a little counter-intuitively...
1346690740.0,421,/r/planetside's top beta gameplay issues for September 2012
1368722297.0,415,This dev team is fantastic.
1357776047.0,409,The following is a conversation I had with PlanetSide 2's live help chat. Nothing has been altered. Picture relevant. 
1364574157.0,417,[Suggestion]... Scratch that... [PLEA to SOE]: Enough additions for now. Please work on bug fixes and gameplay polish.
1357413703.0,414,"People forget that PS1 also had a K/D count prominently displayed if you pulled up your stats bar, and it didn't ruin the game.  The issue here is incentive."
1361965697.0,406,How to fix the zerg in 3 easy steps.
1361041398.0,412,"I think the NC are missing some of that ""re-purposed mining equipment"" theme in their armour, besides their MAX unit (which was a loader). Would love to see this helmet concept for the engineer in the future."
1344050640.0,407,CONFIRMED: Planetside 2 will be on Steam!
1361148341.0,405,"""The state of PS2 and what I feel must change."" -BuzzCutPsycho"
1352851862.0,401,Planetside 2 now on Steam.
1367081507.0,398,What a happy Galaxy!
1349105910.0,407,"Um... SOE, Could you please suggest other Usernames."
1354001993.0,402,How to end a Tech Plant stalemate in seconds in Planetside 2 with EPIC OWNAGE and a legit tactic (Warning I almost die laughing)
1366710897.0,399,That's one tricky ribbon to get
1355919739.0,398,"For maximum hilarity, I payed 100 certs for the flashlight attachment on the lasher.  This is how worthless it is. What purpose does this serve again? Screenshots taken at same time."
1354649095.0,398,I think y'all know what to do.
1361225107.0,404,"""Then I turned the corner and I..."""
1359275835.0,393,Fix a2a missles by making them actually viewable on the HUD! My 2 rough mock-ups.
1360460250.0,393,Play opponent's combat theme instead of yours when your base is about to be captured
1366814518.0,393,"[PSA] Do not, under any circumstances, acquire these unlocks. They do absolutely nothing."
1365466666.0,390,I died and got some living corpse bug and decided to go adventure.
1369929315.0,390,Fun and Not Fun
1368109987.0,391,123 part of the world is going to END
1359981474.0,392,"Once again, SOE - could we have full patch notes and no stealth changes ?"
1353435680.0,391,170 free Station Cash
1375910186.0,384,Best Concussion Grenade Ever
1370189387.0,388,How to dodge strikers without flares
1359911472.0,387,"Azure Twilight will NOT use Magriders until Prowlers/Vanguards are fixed. Other Vanu outfits, make the same pledge!"
1356075580.0,390,This would make Flash so ridiculously awesome.
1375105918.0,385,After Staring at this thing for 250+ hours...
1368390543.0,387,It would make me very happy if I could see my hands here.
1349619952.0,385,"Afaik, there's no way to see what a sunderer can provide you with? They should add symbols on em, something like this [img] !"
1343268017.0,387,NEW Cinematic Trailer - Death is No Excuse 
1355542201.0,384,(Suggestion) Introduce a consistent empire colour scheme for the minimap
1364616315.0,378,Buzzcutpsycho Exposed Banned/Suspension?
1353026035.0,379,"Smed: ""We have decided to reduce the time to get weapons via certs by approx. 30% overall"""
1369631674.0,382,Game-breaking Vanguard Issue
1361743103.0,378,[Suggestion] Allow these to be purchased with resources and deployed for cover.
1356294259.0,377,So I put 1000 certs into drifter jets...
1355315070.0,375,Planetside 2 Game Update 1 Patch Notes
1365187375.0,378,Been a platoon leader for a few months. These changes are much needed. Please SOE!
1361566609.0,373,TR Commissar hat via @MBroome1 on Twitter
1359791003.0,376,Game Update 2 02.02.2013 Patch Notes
1358738830.0,379,I regret about 50% of the certs I purchase. 
1372074219.0,375,The other side or why your faction doesn't suck as much as you think - Spreading positivity to the subreddit
1360590701.0,373,Tribute to the times when in-game situations leave you stunned and your reflexes fail you
1356897277.0,379,Problems with PlanetSide 2 as I see them.
1366983451.0,371,[SOE Please fix this continuing issue] - (At the risk of beating a dead horse): Returning from VR room still resets load outs
1371808955.0,377,I told myself once I died I would go to sleep.... then this happened
1356700984.0,374,The current metagame
1353880158.0,371,Why I am TR.
1358704071.0,377,Warpgates will be rotating for this end of January patch.
1376341988.0,373,[Suggestion]Would be nice to see which Trees get the most kills.
1369834381.0,372,"When a drop pod lands, it opens like a cocoon [PTS]"
1356207539.0,375,"Please, SoE; for the love of God..."
1375456486.0,372,"Presenting the non-intrusive, multi purpose Player activated Cover system"
1369506092.0,375,"Can we get these windows resized? Crouching down it blocks my fire, and stand up I can't see through it..."
1371619195.0,368,"The Case to bring back the PS1 Lasher (Or: ""How I miss my shiny balls"")"
1365779497.0,367,Why can't we deploy turrets on slightly elevated terrain like this?
1360481076.0,370,Has anyone elses' minimap been displaying the wrong colors occasionally since the last patch?
1371892136.0,366,"Now virtually everythings been nerfed, buffed or changed since launch a re-cert round would be a gesture of goodwill to the players."
1363926823.0,368,New decals fit for taking the Crown
1368331650.0,371,Instant Action now tells you where you're going
1367464552.0,368,The VS Charge Pistol
1371519938.0,367,[suggestion] Death Screen Revamp
1371159237.0,368,Tell SOE we don't need more shotguns and SMGs.
1357502934.0,369,Do you older gamers still get blown away by how amazing this is?
1354718614.0,369,Frame rate improvements almost ready
1372016413.0,362,[Suggestion] Add better reflex sight reticles
1360652426.0,369,I really don't see why MAX's can't have SMG's.  There's absolutely nothing silly about this.
1372632923.0,366,Every time I see the loading screen for Indar.
1363202926.0,367,So there is a bug with the cloaking flashes... hopefully they don't fix it.
1357008689.0,362,This pretty much sums up my New Years. 
1355096785.0,365,SOE: Your Operatives are causing disruptions of balance and a faction's ability to coordinate. Get them the hell off our screens or let us kill them.
1361791362.0,360,Shadows Are Overpowered
1368992423.0,360,Some ideas to improve the rush-lane map.
1358450271.0,363,My People Need Me!
1375362546.0,361,"Silly SOE, bullet doesn't go there"
1353556870.0,359,"[PSA] Press ""Q"" to spot enemy players/vehicles when they're in your crosshair. It greatly helps your team. "
1353440932.0,359,DO NOT USE YOUR ALPHA SQUAD BOOST RIGHT AWAY!
1348190112.0,357,"Congrats on 10,000 Auraxians from the Planetside 2 dev team!"
1355386922.0,361,SOE quietly implemented audio device selection for VOIP. THANK YOU!
1354063904.0,356,Helpful visual guide for selecting a faction
1376147187.0,359,So I thought about BioLab...
1368180749.0,353,So we somehow got a sunder in there.
1354435491.0,354,Platoon Leader Command Center Concept by [WMD] Siaxis/DeltaHawk5 [More in Comments]
1365595509.0,355,They are very serious about their describtions
1358826593.0,353,Other factions are BABIES! (I was bored today and made this... thing)
1360007902.0,349,[Suggestion] Public test server.
1360862288.0,350,"[Suggestion] Give pilots their kills, when enemy pilots eject suicide"
1354874311.0,351,How (not) to repair a Mosquito.  I know I'm not alone.
1368435636.0,347,"[Suggestion]: Vehicle Dashboard info, MBT Gunners, Max Abilities &amp; Galaxy Passenger bay."
1363632144.0,347,My pistol bugged out while aiming down and then... Doom
1370138964.0,352,Higbys mother.
1367702882.0,346,I think I just saw Mufasa in Planet side...
1354899805.0,350,"Had this game for three days, and I just gotta say I'm pretty blown away, here's why..."
1373058110.0,347,Dumb ways to die Planetside 2 by OUTFIT-X
1371281219.0,345,"The proposed resource cost changes will break the game, I've ran the numbers. SOE, Do not implement this change without first revamping the whole resource system."
1363532044.0,349,It would make my day if Instant Action would deploy me to a big fight involving my faction.
1358958038.0,345,"After switching continents and having to change my appearance on every weapon, in every loadout I wish this were a feature"
1364471266.0,348,Epic Mid-Air Rocket Shot + Fly Away... I'm so stoked right now!!!
1356957577.0,341,"In Light of BuzzCutPsycho Recent Post, SOE These are the Kind of Stats You Should Be Tracking, Do You See KDR Anywhere? "
1356656192.0,351,How I know what my gunner is seeing
1357705933.0,343,"Jan 30, 2013 Update news from Higby"
1362073556.0,344,Planetside 2 - War Correspondent | Episode 1 (made by me!)
1371756105.0,342,[Suggestion] Let's get some new loading screens
1364034565.0,344,This is how you evade enemy ESF's 
1375035349.0,341,"[QOL] Let's face it: The flash is terrible. It handles like a wet noodle, flips like a desperate politician, and 100 resources is insane for something that can be taken out in one shot."
1368584071.0,338,I'm requesting your top bugs and quality of life issues!
1364075182.0,340,... and no one else!
1358827663.0,339,There's no kill like overkill.
1366279295.0,345,"Thank you, SOE for moving the game from bar-based to number-based stats"
1359832586.0,338,"Getting massive framerate problems after game update 2, anyone else?"
1374103931.0,340,"A little small, and certainly no Harasser, but... LOYALTY UNTIL DEATH!"
1359064303.0,344,"[Mod Post] MDMI Final Voting Post! Vote early, vote often! Please upvote to keep visible."
1356809033.0,335,Does this happen to anyone else when killed by an engineer turret?
1353712970.0,340,Make population bonuses based off continent and not server!
1366448077.0,339,Exclusive footage of the new VS vehicle!
1362686052.0,334,"Higby: So, minimap zooming is a thing now."
1362590505.0,333,freaking white dots for squad members on map
1373990735.0,330,Implants
1367523707.0,335,Colossus Helm + Ogre Armour + Camo
1360417772.0,335,Mid Air Fire Suppression 
1373646578.0,332,I'm surprised this question hasn't been asked yet.
1360958377.0,331,[Suggestion] Let us pick up unexploded C4 and tank/AI mines
1355188729.0,332,Remove the K:D display.  It fosters bad teamwork and gameplay mechanics.
1364633102.0,335,Support Darker Nighttime
1367856947.0,329,"This annoys me more than it probably should, but this is the way the vehicle list should be."
1355635635.0,332,"If you are switching factions in the same server to sabotage a team, you are the lowest form of human existence."
1371474782.0,329,When a max suit dies make it explode but leave the Dead body of the person inside to allow revival
1370347333.0,325,Multiple kinds of waypoints?
1366552571.0,332,If only I had more ammo! [Sniper spot]
1356194065.0,333,Dear SOE: I get it.
