created_utc,score,title
1361923762.0,177,"SOE has banned 8,401 players since launch"
1357368046.0,179,I don't know how else to put this...I want to play in more areas where i don't have to worry about vehicles. 
1355291623.0,176,DON'T SHOOT THE TERMINALS AHHH FUCK
1352009004.0,182,Something is amiss here...
1376480090.0,177,Suggestion: Raise the flight ceiling.
1373753504.0,177,The impact of the population balance changes
1370888132.0,177,It takes 4 Lightning AP rounds to kill Level 2 Composite Harasser
1367987403.0,176,Heavy Assault Illumi
1365441163.0,182,Public Test Server Policies and Download
1361818859.0,177,Planetside 2 servers hacked
1361415207.0,180,Please make cutting territory off matter
1354911244.0,181,HORNS coming with next week patch!!!!
1353382407.0,181,The Last Word on Performance
1339264171.0,180,Planetside 2 - Fan Trailer - It's epic
1374309431.0,176,"[Request]: SOE, Please make a voice channel for people sharing the same vehicle."
1371948696.0,175,A thanks to the Devs for putting up with us.
1371829436.0,177,[Suggestion] Can we get discounts on bundled items we already own
1370039983.0,178,I'd LOVE a base like this
1368980756.0,179,Updated Drifter Jump Jets Review (Favorite ability evarrrrr.)
1367079192.0,179,"Spawn indicator at The Crown. Not gamebreaking, but it bugs me a little bit."
1366236458.0,176,[Suggestion] Tint the minimap territory with the color of the faction who owns it for easier navigation while flying.
1363871581.0,180,(Opinion) Making it easier to understand for new players should be priority no. 1
1362268063.0,179,SOE Should Move Away From New Weapons Toward New Cosmetics
1359865375.0,173,"The names of people who kill you no longer show up in chat, making it even more difficult to report hackers"
1347167820.0,176,"The crown, 7 months ago"
1340723017.0,178,Beta launch info!
1338526094.0,176,"Planetside 2 - Dual Commentary with Matt Higby and TotalBiscuit
      - YouTube"
1376287109.0,172,A Visual Guide for Terrible Sunderer Placement
1374781140.0,174,How SOE should handle the altimeter.
1371396011.0,179,Fan Made 3D Small Bunker Concept for PS2
1363552208.0,179,Suggestion: Capture music based on the winning faction
1359295446.0,174,Awesome Galaxy Montage (set to some Queen)
1358391160.0,176,"Announcing the first ""Community Design Meeting"" with SOE Developers! Take your ideas to SOE! "
1375896590.0,173,[Suggestion] Making the outfit MOTD visible: Display at character select
1373062687.0,177,[Update] Let's get some new Loading Screens (See Comments for Details)
1372765486.0,174,"For the love of Higby's hair, fix the vehicle FOV"
1365689444.0,173,Am I the only one actually enjoying the game?
1362925231.0,173,I thought I was just about to make my greatest kill
1362104314.0,175,Love the new NC helmet... But I'm still waiting on that PS1 R-Exo helmet for the HA that's been on the front of PS2 advertising
1355154167.0,176,PSA: 170 Free Station Cash!!!
1353762550.0,177,Quick Keybinding Cheat Sheet I made up- Blue is Vehicle
1347030546.0,173,Something isn't quite right with this map...
1339778804.0,176,A reminder to all our undecided new comers. 
1375077426.0,173,Inclusion of cityscapes in early Planetside 2 concept art makes me wonder if they will ever come to fruition.
1373142896.0,174,This is why Sphere of Influence needs to be implemented.
1371298128.0,173,Reduced cost for vehicles at the warpgate: A solution for underpopulated factions and lack of territory.
1368731971.0,172,Rocket pods? Psh... I have jump pads!
1365456281.0,174,Look at this defensible base i found.
1365084789.0,176,"People keep saying that everything in this game is a sidegrade and yet, in comparison to breaker rockets, these don't even have certifications"
1344358864.0,176,"""The Planetside 2 Beta has started"" -Smedley"
1376216161.0,174,My collection of the best from /yell
1370615347.0,172,I found a very scenic pond on Amerish in the middle of nowhere
1366529533.0,171,"[Suggestion] For us rare players who use Toggle Zoom, can a reload please cancel zoom?"
1365139682.0,171,Please fix Borderless Windowed mode
1361996795.0,172,"[Suggestion] Remove ""Add as friend"" from ""Q"" menu."
