created_utc,score,title
1357646192.0,986,Blue Teen Room [1046×629]
1371500924.0,981,My ideal solarium. [600x399]
1344605980.0,982,Guaranteed sex (x-post r/pics) [1800x900]
1355934198.0,972,"Bath in the village house, Poland [690X1035]"
1358655544.0,971,The Adventurer's Club [1753x1042]
1355414684.0,976,Top Floor with sunroof [640 x 527] 
1355492864.0,979,Aviation Room [960 x 638]
1374553809.0,970,"Brookfield Place Atrium in Toronto, ON [816x1088]"
1364435465.0,969,A retired schoolbus. [499x596]
1352673204.0,969,"Tattered Cover Book Store inside Morey Mercantile Building, Denver, CO [1936×1296]"
1338010838.0,974,House in the Woods [800x600]
1348314319.0,966,Aquarium Bed [500 x 405]
1347631389.0,964,Book nook [500x629]
1372852895.0,957,This place is abandoned but I think it's better suited to this sub reddit. (1024x700)(oc)
1361932451.0,954,Oceanfront Room [1500x1174]
1363307130.0,955,Library Room with Fireplace [1024 x 1294]
1356624217.0,956,"My tiny yet comfortable living room, taken this morning [1799 x 1799] [OC]"
1354993489.0,957,"Living room of 12 Container House (Brooklin, ME), a house made up of a dozen shipping containers. Designed by Adam Kalkin [570x380]"
1362759867.0,957,"Stone walls and rustic beamed ceiling, Catalonia Spain. By Minim Design Studio (MIC) [1000x1500] "
1359460943.0,947,Amazing wood ceilings in a converted church [720×476]
1361119456.0,950,Contemporary Barn Conversion [600 x 400]
1375122414.0,950,My Library [2000x956] [OC]
1364780886.0,946,The place I'm lucky enough to call home [640x800]
1345060819.0,945,"Inside of a drug store, 1913. [1056x1200] (x-post /r/OldSchoolCool)"
1331217784.0,949,Amazing shower [403x565]
1365172816.0,944,A cavernous Greek lounge [1170x828]
1340567425.0,943,Tiny Balcony in a High Rise [530 x 399]
1349649616.0,942,[OC] My dad's new kitchen [1024x768]
1344607242.0,942,Glass-Walled Bathroom [1366x768]
1338759063.0,942,Kohler Waterfall Shower [600x800]
1359295556.0,937,"Walcot Hall Chapel Kitchen,  Lydbury North, South Shropshire, UK [2362x2357] (OS)"
1350186219.0,932,Clean white kitchen. [1920x1200]
1357955948.0,924,Modern Restored 15th Century Italian Villa [600x902]
1356372302.0,931,Incredible kitchen. [400x500]
1341984144.0,928,Log Tile Flooring [600x901]
1354382373.0,932,"Chalet Lhotse, Val d′Isere, France [1654x2480]"
1342983353.0,930,Infinity pool overlooking L.A. (crosspost /r/pics) (1567×1029)
1361366616.0,926,On the Oasis of the Seas [1024 x 768]
1367615687.0,922,Low key bedroom. [509 × 720]
1351898941.0,921,"It's not as awesome as all the other rooms here, but I love my bedroom [OC] [826x600]"
1364291451.0,920,Bathroom ideas [500x752]
1359701488.0,921,St Lucian Villa - Villa Eluna (4215x3162)
1347288609.0,915,That ceiling. [351x450]
1334593579.0,910,Wine Cellar X Home Theater = Epic Mancave [768 X 432] [OS]
1368782311.0,909,Hollywood Hills cantilevered house I used to live in [1000x667] [OC]
1358700906.0,913,From the couch of my Fighting Winter Blues Command Center[1200x533]
1365079941.0,901,"A WW2 bunker in Berlin, now home to a couple of art collectors. [500x622]"
1339488174.0,904,"Backyard movie - not technically a room, but I'm sure it belongs here [1000×900]"
1333722942.0,896,The ultimate cabin kitchen [1200×805]
1366017855.0,898,Chinese Architecture Student designs and constructs a very minimalist wooden house complete with all the essentials (X-Post from r/Pics) [440x6083]
1359588195.0,899,Incredible library [2559x1599]
1369415354.0,896,Ross Residence by Griffin Enright Architects [1000 x 768] (Album in Comments)
1352797820.0,894,"A kitchen in Queenstown, NZ [800x533]"
1368410315.0,888,Control room of the abandoned Kelenföld Power Plant in Budapest [1024 x 685]
1368276943.0,890,My friend works in this beautiful library in Utrecht so I got a private tour - the library is located in former working-palace of King Louis Bonaparte of Holland (brother of French emperor Napoleon Bonaparte) (1000x500) (OC)
1344534550.0,890,Favorite loft in Birmingham [640x480] [OC] [mic]
1353171215.0,893,Kick-ass Loft [2500 × 1583]
1368069776.0,884,Modern yet simple bedroom [1000x667]
1363267771.0,884,"A house in Queenstown, New Zealand [1000 x 667]"
1360532225.0,893,Reading room in Orestad College [450 x 582]
1343443299.0,887,"Loft I recently listed. Pretty expensive buildout, thought I'd share. [1684x1123] [OC] [mic]"
1358474553.0,889,Foggy view from inside a condo. [610x458]
1322783446.0,887,An Awesome Studio Apartment [683x1024]
1327334811.0,891,"1926 bank converted into restaurant - The Bedford, in Chicago [1280x853]"
1335725423.0,882,University of Dublin Library [922x1231]. 
1371553989.0,883,The definitive. RoomPorn doesn't get any higher than this. [4288 x 2848]
1367070675.0,880,"Classy penthouse in Sondrio, Italy [1,100 x 732] Album in comments"
1340038583.0,883,"More of an outdoor room. I present ""Tree Lounge"" [554x831]"
1351521471.0,880,Great Hall of the Natural History Museum in London [680x1024]
1363266666.0,881,"Park Avenue Living Room [2,458 x 1,635] Album in comments"
1346841447.0,880,Karl Lagerfeld's Paris Studio [1150x766]
1360601388.0,869,Glass walls and LED lights [600x400]
1369755089.0,876,My Grand Rapids MI apartment [5209x2947]
1362404734.0,875,Home Office and Living Room with a Movable Wall [1784x1200]
1361111519.0,869,"One of the Hearst Castle Pools [2,560 x 1,920]"
1352842588.0,873,Japanese Kitchen [650x450]
1367238438.0,869,Updated Poseidon Undersea Resort Room [640x478]
1367100170.0,865,Sweet Bedroom bed! [480x330]
1360247396.0,868,Open Living Room with High Ceilings [768X432] [OS]
1348711669.0,865,"Jewelry Shop in Paris, Designed by Artist Alphonse Mucha in 1901 [2464 x 1632] [os]"
1339050491.0,863,"The Hidden Life Within - Artist Giuseppe Penone carefully removes the rings of growth to reveal the ‘sapling within’. By carving out the inside of a tree trunk and leaving the knots in place, they eventually emerge as tiny limbs [1064x1600]"
1361672531.0,858,School Bus House (x-post from r/pics) [650x433]
1353258701.0,855,beautiful sitting room [500x413]
1365484690.0,857,"the lobby of Disney's Grand Californian Hotel in Anaheim, CA [1600x1060]"
1328721824.0,852,Swimming pool in bedroom + that view. Kill me now  [500x414]
1345163529.0,851,Police Station in Poland [972x648]
1375329448.0,852,Stone Foundation [800x532]
1348360507.0,845,Converted cement factory [714x293]
1337289370.0,850,Suspended Meeting Room at NYkredit bank in Copenhagen [1024x813]
1333907418.0,840,Underwater Hotel in Istanbul [502x377]
1330453375.0,838,"Desert View Suite, Amangiri Resort, Utah [1280×949]"
1374066041.0,833,Beautiful Outdoor Living Room by SAOTA and Three 14 Architects. Album in comments. (1200 x 800)
1347979692.0,828,Open plan living in East London [720x478]
1336745960.0,831,Wide open space living room with big glass ceiling [1000x1012]
1366650227.0,828,"Guest Room, Hotel Ca' Pisani - Venice, Italy [3000x1987] [OC]"
1356910061.0,826,"Shalin Liu Performance Center in Rockport, MA [575×383] [OS]"
1332933804.0,825,Perfect Bathroom [1200 x 800]
1366209720.0,824,Beautiful Staircase [639x960]
1365092329.0,825,Comfort in zones [1280 x 1293]
1336325781.0,816,Brooklyn Loft [700x460]
1350516635.0,818,"Radisson Blu Hotel, Berlin [1600x1064]"
1372423954.0,809,Beautiful marble entrance staircase to a château in Belgium (924 x 1200) (OC)
1372792241.0,811,"Opulence: 'The mirrored salon', Paris, designed by Valerian Rybar and Jea-François Daigre [850 x 540]"
1346668155.0,812,"Old meets new in clean, open kitchen. [800 x 482]"
1333023540.0,811,Nice bathtub [1200 x 800]
1345561566.0,810,"Sitting area with a view, New South Wales [1200x797]"
1331485911.0,808,Home theater bed [548x365]
1350335532.0,810,"Arches and sky lights, oh my! [2700×2160] [OS]"
1330599634.0,811,What better way to wake yourself up?? (crosspost from r/funny) [500x612]
1349112589.0,807,Tree House Lodge in Costa Rica [600 x 369]
1329425192.0,805,"Levels, Jerry [600x894]"
1362816355.0,807,One our many themed conference rooms [2597x1731]
1352864661.0,802,Sometimes I miss my old Seattle studio apartment. [1024x683]
1345329750.0,797,The amazing stair in my neighbours awesome apartment. (500x750)
1372607035.0,804,Liverpool Central Library [OC][4000x6000]
1358388003.0,800,[OC] A girl's room [2304x1728]
1339123048.0,794,Beautiful bookstore (x-post r/pics) [533x796]
1354313163.0,798,"Hotel rooms made from recycled concrete drainage pipes: TuboHotel, Forty-five minutes south of Mexico City. [1080x810]"
1344891936.0,792,Contemporary office cafeteria/lounge area [900 x 758]
1330375747.0,787,Perfect Bunkroom - [640 x 452]
1341401620.0,783,"Cabin in a dwarf redwood grove, central coast of California [1280x852]"
1375104249.0,779,Beautiful Spiral Staircase in London [900x600]
1348790415.0,785,"Cast Iron Staircase, New Haven, CT [3155x2083] [OC] ©Jessica Zielonka"
1370826236.0,781,"One room school. Chippewa Nature Center, Midland Michigan [1024 x 650] [OC]"
1332254701.0,774,Bedroom with skylights [499x375]
1353277624.0,772,A Wisconsin home that was custom built by architect Robert Harvey Oshatz [1850 x 1156]
1371749111.0,769,"""Look up"" at the inner yard in the New Emergency Clinic Malmö, Sweden. If you know art - let's call it ""Mondrian with a twist"". (1000x500) (OC)"
1353447023.0,771,A hidden wine cellar next to a sunken living room that gets covered by a bed that drops from the ceiling! Only in the YO! Home [800 × 533]
1347113925.0,766,Porch furniture [1000x900]
1348377801.0,770,Closet bed [960x640] (x-post from r/pics)
1368376261.0,766,The University of Michigan Law Library [1200 x 800]
1352061613.0,765,"Glass igloos in Lapland, northern Finland [721 × 480]"
1374396877.0,764,"La Trobe Reading Room (a.k.a. ""The Dome""), State Library of Victoria [2532x3582]"
1363101729.0,765,A very natural bathroom. [1000×810]
1366814839.0,761,Cinderella Castle Suite Bathtube [1024x768][OC][OS] - Link to more in comments
1359645304.0,760,To continue on with the theme of libraries... [3008x2000]
1344695481.0,758,Beautiful Home Theater [2640x2088]
1331394177.0,754,"Seaside overhead shower bath, Italy [553×765]"
1342153155.0,757,Backyard fire pit and open room [960x632]
1342521041.0,760,Glamping [1024 x 768]
1373283793.0,751,"A sitting room with low, clean lines [1438x1920]"
1347037958.0,755,Rotunda of Stockholm Public Library [2939x1954]
1327616261.0,753,Roll It: An experimental housing cylinder that can be rotated by walking to create new living spaces [750×1414]
1349182412.0,746,Swinging porch beds. [392x476]
1335619401.0,750,Valentine Apartment Hanging Bedroom [1100x863]
1364580901.0,744,Bedsit Concept [1920x1080]
1349085227.0,747,The blue bedroom out of heaven. [1200x710]
1342396914.0,748,AquariRoom [445x1024]
1361993050.0,737,Breathtaking Windows [480x660]
1341599001.0,742,"Blackbird Studios, Studio C  [800x586]"
1356239564.0,740,Bright kitchen &amp; living space with a view of the city. [2200x1601]
1336918368.0,734,A unique spiral wooden staircase [959x1242]
1331909697.0,732,Home library and lounge of a former cement factory in Barcelona [440×560]
1327527647.0,731,Pool Bedroom? I bring you Pool Living Room - [500 x 365]
1365998002.0,728,Cabin in the woods. 3264x2484. One room loft over kitchen &amp; bath. Gallery:http://imgur.com/a/Ufau4
1335126805.0,730,The dream living room [1280x800]
1339975806.0,723,Open Living Room/Kitchen [OS] [1280x853]
1352716611.0,727,Cool live/work open-plan studio [800×557]
1339537029.0,720,Suitcase Shelving [540x814]
1369626321.0,719,Loft with Skylight [1000x1425]
1333285622.0,719,Nice Cozy Loft [1221x1800]
1375982584.0,718,Naka Phuket villa (945x630)
1350914535.0,716,Inside Stockholm Public Library [1920x566]
1373601372.0,717,Eclectic Design done right in New York City Loft (1024 x 652)
1336239996.0,713,Minimal Shower [466x700]
1335967267.0,718,Under Stair Storage - The Perfect Solution To Maximizing Space [500x752]
1354111114.0,714,"Royal Suite at the Four Seasons Washington, D.C., $15,000/night [1080x810]"
1363278048.0,710,Cozy Reading Spot [1090×949]
1331658950.0,704,"Sunlit, high-ceilinged living room [900×600] "
1368622777.0,711,"Living room of a custom built Hobbit house in Chester County, Pennsylvania [5184 x 3456]"
1351180998.0,704,Hallway to Heaven in Tokyo [474X700]
1358041611.0,705,"My Bedroom in the East Village, NYC [OC] [3240x2420]"
1329690435.0,703,Royal Loft Suite on the Oasis of the Seas [2100x1400]
1336672115.0,703,I love how they made the most of such a narrow and tall space. The hanging plane model is a nice touch and adds to the theme of being high in the air with the floor-to-roof windows and outside balcony where you can look out into the city from a grand height. [1155x1600]
1342203626.0,698,eco-friendy penthouse [1267x766]
1340973563.0,701,"Indoor Pool at the Crown Towers Hotel in Taipa Island, Macau [1500 x 1000]"
1359991839.0,693,Stylish SOHO Kitchen  [1809 x 1200]
1336620069.0,700,Exotic bathroom [1500 x 1132]
1371412558.0,692,"Malmö City Library (Sweden), I loved how light it is and the big windows towards the park, by famous Danish architect Henning Larsen (1000x500) (OC)"
1359327241.0,684,"Luxury Suite, Burj Al Arab, Dubai [1280x1028]"
1354190078.0,685,Chunky timer beams. Everywhere. More photos inside [800×508]
1344298497.0,684,"The Mens Room, Level 35, Sofitel Hotel - Melbourne Australia [1024 x 768]"
1368113596.0,687,Lobby of a spa at the Maldives.[OC][1204x798]
1352509501.0,685,I finally cleaned up my room and stored my bike! [2448 x 1836] [OC]
1325023752.0,675,The small bar that a Redditor built in his living room. [2706×1799]
1340882221.0,677,Paradise [600x400]
1348510553.0,678,Space shuttle Endeavor's flight deck [1050 x 699] (X-post from r/pics) 
1320323045.0,679,A penthouse bedroom in London [1400x800]
1368944884.0,675,[466 x 700] Color Splash apartment
1366688280.0,674,"Gorgeous living room in Oakville, Ontario [878x374]"
1326934996.0,678,"Open backyard and living room of the Ipês House in São Paulo, Brazil [1415×768]"
1361983233.0,676,Japanese Theme [1200x800]
1328611759.0,674,"Staircase in Scientist Emile Tassel's Home, Brussels, Belgium 1893 by Victor Horta [1010 x 1280]"
1341915820.0,673,"A room with a view: Jade Mountain, St Lucia [2249 x 1499]"
1342487642.0,673,Rustic and elegant bathroom [567x772]
1367555138.0,673,Al Capone's Cell at Eastern State Penitentiary [1024x780]
1327703356.0,667,"Small, bright home of two interior designers with hideaway loft in Brooklyn, NY [1150×766]"
1330358926.0,666,A compact computer nook [1067×1600]
1370388285.0,660,My Beautiful Lake House [960x1440] (album in comments)
1343527744.0,658,"Couple converts old church in Kyloe, Northumberland. (Cross-post from /r/atheism)[OS][570x352]"
1342624048.0,662,NY bedroom at sunrise [600 x 405]
1350860053.0,661,I'm an alcoholic. I've started my recovery 2 months ago. Repair of my apartment was the main point of dealing with fears and cravings. These are results: (album in comments) [585x812] 
1351321488.0,661,Minimal living room with huge windows. [2880x1800]
1335903092.0,654,Bathroom Scene - Night Time (x-post from r/ThingsToMakeYouDrool) [1200x1200]
1364976598.0,657,Luxury Cabin Theater Room [600x400]
1344223509.0,657,"Penthouse - District 5, Zurich [800x600]"
1344784427.0,654,This looks like a great way to light a room [OS][600x716]
1340500577.0,653,"Chalet Zermatt Peak, Luxury Chalet in Switzerland [1620x1080]"
1362149626.0,654,"Condo with a city view in Seattle, WA [1,200 x 900]"
1350038752.0,650,A classy study [800x528]
1357753533.0,648,Modern living room with swiveling doors (376 x 500)
1333801631.0,650,Salvaged Boeing 727 Airplane Converted into Hotel Room [600×398]
1361971724.0,648,Sunny California Villa [1228×726]
1335008917.0,642,Glass reception area [1680x1120]
1361593917.0,645,"Opéra de Paris in Paris, France. (x-post from r/pics) [960x649]"
1338445415.0,644,"Serene small bathroom space in Sydney, Australia [1024x683]"
1345540557.0,639,"Nashville's old Union Station, now a hotel [1024x768] [OC]"
1328484602.0,640,Luxury Retreat Hidden Within Australian Outback [721x404]
1349877569.0,644,"1930's Chicago apartment by Edgar Miller.  The craftsman/designer/artist personally hand-crafted every detail, including the stained glass. [611x404]"
1322061533.0,640,"Tori Tori Restaurant, Mexico City [818x1234]"
1359906616.0,638,"Beautiful Malibu kitchen [1,800 x 1,197] Album in comments. "
1357229647.0,634,Living Room with a view [942x684]`
1343123204.0,641,Incredible flooring in this apartment [525x716]
1336575458.0,635,Trees Interacting with Living Space: Corallo House in Guatemala [940x1385]
1331049004.0,636,"Imagine taking a hot bath here on a cold winter day. The Milner Residence in Big Sky, MT. [433×650]"
1347384097.0,638,High ceiling and library [853 x 1280]
1335689496.0,631,Cozy media room [800x527]
1374658326.0,636,A room in the Love Hotel Caribbean in Tokyo [640 x 512]
1373252810.0,633,Kids bedroom [800x600]
1337622600.0,632,Finnish Ice Hotel. [2048x1371]
1344105034.0,628,Minimalist loft bedroom [446 x 700]
1333500880.0,629,Mondavi Cellars - [2927x1951]
1344364896.0,627,"Loft I listed; Birmingham, AL [1684x1123] [OC] [MIC]"
1343262101.0,623,Zen Room v3 (Modeled and rendered by me) [1920x1080]
1346035064.0,618,The Wang Theatre in Boston (1024 x 678)
1371942442.0,615,A small yet versatile room/performance space with perfect acoustics [1154x768]
1335467140.0,618,Tub By The Sea (x-post from r/ThingsToMakeYouDrool) [640x600]
1363784190.0,616,Awesome Austin City Loft[641 x 514]
1337945053.0,618,Home Theater Seating made from old wooden pallets and pillows [492x738]
1371827086.0,611,Woodworker's Wet Dream [1920 x 1280] [OC]
1360721062.0,608,Mediterranean Interiors [700x466]
1336771474.0,616,"Inside the one-room house, the reclaimed-redwood platform bed hangs on slender steel rods fastened to the ceiling. The ceiling cap is a vent—the house’s thermostat. [1062x717]"
1336532024.0,614,Sun Room Kitchen [500x751]
1353617641.0,610,Internal Courtyard [475 x 356]
1337405980.0,611,Sleeping in Seattle [1024x651]
1336051127.0,609,Ocean Villa Beach House in the Maldives [1024x681]
1374159938.0,604,"Anticipated view of Rafael Vinoly's 432 Park Avenue master suite bathroom, expected to be completed in 2016 [818 x 818]"
1373599825.0,601,"My favorite place to stay in LA: Hotel Figueroa, Los Angeles [564x509]"
1328432689.0,607,Parched sitting room atop windswept cliffs [2560x1600]
1371915929.0,602,Man cave. [960 x 641]
1341485487.0,605,"Indoor/outdoor office in Sao Paolo, Brazil [680 x 450]"
1376495062.0,593,RoomPorn on a budget. My Dorm room including a home theatre. [2000x1200] [OC]
1363099381.0,593,Bathroom Barn Door [616x821]
1356978383.0,592,This double lounge chair set up is so snuggly. [845 × 586]
1338766763.0,600,Beautiful treehouse cabin [599 × 640]
1344145785.0,599,Japanese-Inspired Living Room [1920x1200]
1358803964.0,589,"Downtown Seattle Condo [1,400 x 779]"
1328100828.0,592,Sunken seating in Vegas custom home [1024x683]
1370402383.0,586,Aaron Sorkin's Hollywood Office (more inside) [900x600]
1357821481.0,594,Staircase in abandoned school (1200x800)(OC)
1347737794.0,592,Living room with a view and a water feature!  Full album of house included in comments [504x653]
1366071830.0,591,Stylish Two Bedroom Duplex [640x569]
1347459397.0,585,My dream sun room [600x400]
1362638319.0,584,Massive modern kitchen with wine racks on the side of the fridge [1126x751]
1360608581.0,585,"Underwater living room, Fish House, Singapore. [1220x779]"
1335768924.0,585,Bedroom skylights [585x439]
1327847455.0,584,"Neptune's Pools, Hearst Castle [3233x1980] designed by architect Julia Morgan"
1370627826.0,586,"Cozy, compact log cabin [1221x1800]"
1347444468.0,585,So...creamy. With a touch of Moroccan-inspired light fixtures [500x750]
1375791663.0,578,My room in a studentsflat. [3264x2448][OC]
1362752787.0,580,"Beautiful living room in Cape Town, South Africa with gorgeous views[1,150 x 763] Album in comments"
1332100738.0,578,"Most Expensive Apartment in San Francisco at $28,000,000 (links in comments inside) [870 x 580]"
1320756997.0,577,Man Cave [834x614]
1356028763.0,576,"Loft 24-7 São Paulo, Brazil by Fernanda Marques Arquitetos Associados [1200x797][OS]"
1352497951.0,584,Smooth Bathroom [3184x2480]
1344612806.0,579,Tiny loft studio design. [554x436] [OS]
1344904143.0,577,pools for hallways-Cabo Beachfront Estate [940 × 579] [OS] (xpost architectureporn)
1355756710.0,576,Attic Loft in Stockholm/Sweden [700x461]
1346937779.0,573,An awesome kitchen! [534x800]
1332805219.0,579,Attic Bedroom - [475 x 573]
1370669255.0,572,HermanMiller - Hero Living Lounge [1285x750]
1330545399.0,572,Bohemian Attic [500 x 414]
1373646909.0,566,"A library, minus the books, at Pitt's Cathedral of Learning. A serious Neo-Gothic space. [4884 x 3256][OC]"
1353897038.0,570,We've Got Personality [2048x1365] [OC]
1351353434.0,565,The living room in my new flat. [3648 × 2736] [OC]
1344151448.0,572,"Large, Contemporary Loft in San Francisco [800x531]"
1373658618.0,564,"Mansueto Grand Reading Room, University of Chicago [1000x612]"
1347037962.0,564,Lovely shades of grey [580x873]
1357132343.0,563,"Contemporary suburban home, full gallery in comments [624x416]"
1343698911.0,557,Dream staircase with multiple drawers (Cross-post from /r/pics) [720x518]
1375529985.0,559,Cob houses can have beautiful living spaces. [490 × 368]
1354610502.0,551,"Nuevo Estilo, Barcelona [750X600]"
1345444155.0,557,La Jolla Cove Cottage [2889×1902] [OC]
1347532165.0,553,"A little too much blue, but imgur says it's 'lovely' [480x600]"
1342486529.0,552,Peaceful library/reading space [500x500]
1347273660.0,548,Old world green [600x751]
1333992337.0,556,Bedroom with jacuzzi [1024x639]
1343837385.0,544,"Incredible hand-drawn mural of Swedish provincial flowers @ the studio of Jonas Carlberg, Stockholm [OS] [600x800]"
1338597557.0,551,Attic Bedroom [373x560]
1329086577.0,546,"Yellowstone Club, Big Sky, Montana - East Slopeside Chalet [1150x862]"
1357333635.0,545,Excited to finally sleep next to my baby! [X-post from r/motorcycles] [3110x2073]
1368460008.0,545,"An octagonal theatre, here dissections were shown to medical students 1663-1766, in Uppsala Sweden (1000x500) (OC)"
1349183671.0,547,Amazing Log and Timber Frame Great Room [362x500]
1370464219.0,541,"The Wolf House --Toronto, Canada (720x540)"
1340647765.0,541,London Loft [642 x 728]
1336842418.0,536,"Old Faithful Inn, Yellowstone National Park [1648x2464]"
1327263499.0,540,Billionaire's Sunroom on Private Island [4992x2186]
1325714212.0,541,"A serenely sunlit loft in the Mini-Maison in Brussels, Belgium (x-post from r/pics) [1000×667]"
1375048621.0,541,"UT Architecture &amp; Planning Library - Battle Hall | Austin, TX, USA [2474 x 1649] [OC]"
1354188336.0,537,Ubiquitous Agency Office in Manchester [960x650] [OS]
1345498195.0,545,"Unique skylight pillar extending to the floor, Darvishabad [1000x930]"
1356469475.0,544,New York Penthouse[1800 × 1200]
1356203165.0,541,Denver Kitchen [640x360]
1329236004.0,538,"Chic penthouse apartment in TriBeCa, New York City [800×600]"
1338941632.0,540,Sophisticated with a touch of nautical [553x738]
1324927014.0,536,Very nice Mountain Cabin [682x1024]
1344212310.0,533,Eames Chair [600x402]
1340632136.0,527,A Rustic Looking Tiny Balcony in a High Rise [632 x 624]
1352129041.0,527,Main Bedroom on the Superyacht Reverie [1000x671]
1336997336.0,536,"An Old Slaughterhouse Is Now A Public Cinema Center in Matadero de Legazpi, Madrid [714x765]"
1362491305.0,537,Cabin in the woods (x-post from r/pics)[810x540]
1337538055.0,528,Indoor Pool [2032 x 1352]
1365172655.0,531,Hellenic-Modern Kitchen [1170x828]
1375607764.0,525,Nice contemporary bathroom [800x1199]
1368891414.0,530,Malibu Living Room [2190x1460]
1358853438.0,530,Gothic style kitchen. This house has a lot of character [800x599]
1356810349.0,524,Drake and Josh's bedroom (630x400)
1355154655.0,527,[OS] My parents' house last Christmas. Merry Christmas /r/RoomPorn! [900x600]
1332604298.0,524,"Just look at that view. Southern Ocean Lodge, Kangaroo Island, Australia [1152×768]"
1324536886.0,526,Not your typical indoor pool (crosspost from pics) [800x734]
1368119462.0,522,"'The Long Room' is an oak library built between 1712 and 1732 - Dublin, Ireland [922×1231]"
1351966999.0,526,"Hôtel Solvay, Victor Horta, 1900 [1247 × 1600]"
1345532061.0,519,I love the idea to make the couch reddit-ready!!! [x-post from r/pics] [1850x857]
1354356420.0,518,Moscow style [1070X716]
1363894451.0,524,House in the Hollywood hills overlooking Los Angeles [750 x 449]
1328047712.0,521,"OfficePOD: A secluded, peaceful work environment that can be built anywhere—indoors or out. [702×1746]"
1335211090.0,521,Inside of Wooden Cabin Room [1280x853]
1374347265.0,518,Canadian Senate Chamber [1536 x 1024]
1369324971.0,518,"Seating area, RIT [800x1000][OC]"
1360858282.0,516,"Beautiful hotel room in Santorini, Greece [2008 x 887]"
1360689094.0,518,Exposed brick walls in this stylish warehouse-style apartment [800x533]
1368071886.0,516,A nice man-cave. [2000x1333]
1365169972.0,514,Hanz Zimmer's studio [960x637]
1341485446.0,514,Entrance to indoor pool [500 x 669]
1317993810.0,514,Say Hello to the Rest of your Life [1500x907]
1358432021.0,513,Cave Art [670x340]
1320046183.0,511,Interesting use of a garage door [520x592]
1338531729.0,515,I finished decorating my living room and wanted to share. [1434x750] oc
1376401335.0,510,"Just a sun-drenched family room in Purchase, NY [1000x1452"
1352589127.0,502,The rooms at the Capsule &amp; Sauna Century Shibuya in Tokyo. [3000x1909]
1334092317.0,506,Rooftop Penthouse Living Area - Australia [1000x666] by MPR Design Group
1334034427.0,508,Hardwood floors and a stellar view [640x480]
1369916822.0,505,Warm modern kitchen and dining area [1600x1200]
1331995031.0,504,Apartment living room [461x692]
1330505340.0,497,You Sit between Water &amp; Fire [992x737]
1350186820.0,503,Coastal bedroom with a view. [1920x1200]
