created_utc,score,title
1334530340.0,508,Nice Basement [800 x 600]
1372873002.0,497,An amazing beautiful theatre that has been left to decay (1024 x 681) (OC)
1366825877.0,497,Tucson Mountain Retreat (818x525) (Source in Comments)
1366209393.0,497,Black Kitchen Under The Stairs [580x764]
1351695447.0,494,Orangery with glass folding doors [600x450]
1340757911.0,497,Suspended Bedroom [1100x863] (x-post from r/pics)
1352558793.0,497,A ryokan - traditional Japanese inn [1024x683]
1332861399.0,500,"Verdant, sunlit kitchen of the Marsh Residence in Birmingham, AL [627×859]"
1374439008.0,496,"The Chapel, MIT. [3871x2576]"
1358144129.0,495,The Zen Room - Takashi Amano [993 x 494]
1369066015.0,492,[OC] My Shanghai studio apartment. [1077x720]
1359265025.0,492,Bathroom Redux
1357189598.0,494,yellow doors [376x500]
1348666617.0,493,Another amazing bathtub. [575x390]
1334328650.0,494,Carefully lit kitchen [OC] [640 x 800]
1372343052.0,494,"Stedelijk Museum 's-Hertogenbosch, The Netherlands [960x1280]"
1364448640.0,486,Kogod Courtyard at the National Portrait Gallery [871x1000]
1342064195.0,484,The inside of the Pantheon in Paris. [OC] [2000x1333]
1332435097.0,488,"A house, balanced over a ridge, has a see-through floor for a living room [530 x 398]"
1342642139.0,491,Windowed kitchen and dining room - New Zealand [1000 x 666]
1362330281.0,486,Beautiful Modern Living Area with a Lake View [1388x690]
1343663293.0,488,A writer's dream [750x490]
1371950284.0,479,EcoPerch [800x606]
1371476784.0,481,Sun-splashed open living room [900x555]
1340266753.0,480,"My Moms Modern Kitchen, Rest of the house in comments [1024x668]"
1334677427.0,479,Natural lines - Esherick House near Valley Forge [2099x1432]
1325494149.0,483,Walstrom House [640 x 480]
1340223652.0,477,Sweden's most popular kitchen ATM. Link to full gallery of the competition in thread. Private picture [990x742]
1368424872.0,477,Floating in blue skies [ 988 x 718 ]
1349011026.0,474,Bondi House [426 x 640]
1344033491.0,479,Cozy living room with lovely view [500X334]
1339076017.0,474,"An amazing deck with an unreal view in Marin County, CA [OS] [768 X 432]"
1376423266.0,479,(xpost r/AbandonedPorn) Incredibly ornate abandoned room [1000x668]
1329842025.0,479,"Living room, kitchen and bedroom loft of the ProtoHaus (x-post from r/pics) [720×1128]"
1318414506.0,482,The Yellow Submarine Bathroom [533x800]
1350076979.0,473,"If you're going to go condo, you might as well do it right [1200x800]"
1332394017.0,481,Bookshelf Doorway [480x587]
1373144118.0,475,Indoor/Outdoor [736x882]
1364532401.0,471,Tiny house on wheels main living room [600x388] [OS] (More pictures in comments)
1356183862.0,475,Minimal Kid's Room [1200x857]
1318781964.0,471,Greatest living room ever [1366x768]
1367973302.0,469,Jacuzzi Room [396x500]
1329764040.0,474,"Living room with skylight in Holland Park, London [1153×768]"
1348898813.0,467,Elegance [500x344]
1336410882.0,469,Fairytale Bathroom [790x1000]
1316523428.0,463,Compact cabin. [approx. 725x950]
1359934873.0,467,Crazy wood stairs. (xpost from /r/crazystairs) [800x600]
1329972316.0,459,Seclusion in The Forest [384 x 499]
1362608990.0,462,open [915x484]
1354865499.0,461,Paris apartments [909X682]
1366216482.0,460,one sunlit tub to rule them all [3000x2000]
1351000447.0,464,The living room of art collector Alfred F. Pillsbury (1908) [609 x 480]
1348743355.0,461,For those who hate doors [1000x666]
1359477364.0,460,A kitchen with a view. Indoor swimming pool in this amazng glass fronted house [800×532]
1358629038.0,458,"Room inside a Boeing 747-200 jumbo jet that has been converted into a 25 room hotel and cafe.  Arlanda Airport, Stockholm [3500x2382]"
1331814411.0,459,"Luxury Chalet - Zermatt Peak, Switzerland [1620x1080]"
1354269286.0,456,"Le Train Bleu, restaurant in train station in Paris [900 x 581]"
1359224176.0,461,"Grandma's attic - kent, UK [1024 x 681]"
1329008753.0,458,"Glass Pavilion in Montecito, California [1136x757]"
1375019905.0,452,"Mainport Hotel, Rotterdam, The Netherlands [1280x960]"
1341232403.0,455,Valley View [1366 x 768]
1343756832.0,452,Small but cute modern kitchen [960x717]
1333381074.0,456,"Impractical but amazing: The NA House in Tokyo, Japan [960×1926]"
1342346990.0,454,Unique Hotel Rooms - The Das Park Hotel in Austria is located in a public park along the Danube River. The hotel offers rooms made from large repurposed drain pipes. [1600x1300]
1365439017.0,446,Contemporary concrete house in São Paulo [720 x 720]
1327793044.0,453,"The magnificent Alali Villas in Uluwatu, Bali. More in comments. [3471×1604]"
1370796690.0,447,Quality kitchen [402x604] [xpost /r/pics/] Link to rest of the appartment in comments!
1333336411.0,453,Cozy Library With Couch [500x500] [OS r/pics]
1337443019.0,450,A former warehouse in Los Angeles converted into a loft [1024x836]
1320841095.0,451,Stone basement pool [608x456]
1336010855.0,443,"A novel by an anonymous author written on the walls on an abandoned house - Chongqing, China. [500x578] "
1361267055.0,447,Barn to a home [550x807]
1340833255.0,449,"Luxurious bathroom at the Four Seasons Resort in Bora Bora, a French-Polynesian island. [1280x720]"
1339940247.0,443,Modern Home Theater in the Millbrae Residence in London [1200x800]
1336084036.0,439,"Hanging off a cliff overlooking Lake Wakatipu in Queenstown, New Zealand is a house with one hell of a view [1280x1920]"
1324418455.0,445,Golden Crown's glass-roofed igloos offer breathtaking panoramas of the Finnish Lapland [1600×1071]
1334785543.0,444,Refreshing Luxury Bedroom [1200 x 710]
1361403066.0,442,Great concrete billiards room (1280x853).
1332192429.0,447,Beautiful loft [399x600]
1329494977.0,437,"Comfy, curvy guest house in Casey Key, Florida [945×1280]"
1326232254.0,440,Like A Don [970 × 545]
1325350466.0,446,Meeting room in the Nykredit bank in Copenhagen by Schmidt Hammer Lassen Architects [1024x813]
1359975546.0,443,One hell of an apartment in Prague [551x537]
1354076839.0,437,Man Cave [834x614]
1331331142.0,438,Quite the balance in color scheme (and a great living-room view) [600 x 450]
1356384363.0,440,I've always wanted a black room. [554 × 556]
1330138602.0,443,"Fluid Staircase, Michal Vesely [682x1024]"
1331567352.0,435,Living room of the Trillium Treehouse in Washington State [384×576]
1359154511.0,438,My cute little Manhattan studio [1440 x 1440]
1355093751.0,440,Staircase in a Portuguese bookshop [800x400] (x-post r/pics)
1342452022.0,430,"Stunning home in Johannesburg, for those who like their living rooms to smell like chlorine! [600 x 415]"
1374179021.0,431,"Does a rooftop patio count as a ""room?"" This is my own little slice of heaven. [2048x442][OC]"
1357753075.0,434,My tiny law school studio apt. I get the feeling I'll be nostalgic for it one day. [1024x768]
1346709339.0,427,Casa Vogue (Brazilian magazine) [620×623] [OS]
1317642863.0,435,Awesome Shower in a Warehouse Loft Renovation in San Francisco [1136×867]
1365687416.0,429,a bathroom that roomporn likes? [940x627]
1328908720.0,424,The ultimate bachelor pad: Sheats Goldstein Residence in Beverly Hills [1024 ×1400]
1341163824.0,429,Gorgeous penthouse living room in NYC [720x405]
1318122785.0,422,Clocktower kitchen [1369x912]
1360277223.0,421,"Amazing chalet I was lucky enough to spend two weeks in over christmas. (Zermatt, Switzerland) [1024x309] [OC]"
1326563339.0,429,Cottage in the Woods [582 x 1860]
1362064958.0,421,The ceiling is okay I guess. [1017x656]
1328663750.0,423,Surreal Steampunk Apartment in Chelsea [900x600]
1347698125.0,421,California Home Theater with Star Ceiling (800 x 533) (os)
1364608288.0,420,My grandparent's guestroom [OC] [1024x768]
1362196436.0,428,My Friends Cabin [960 × 640]
1345209251.0,423,"Opera House of Paris, the Palais garnier's grand salon; Paris, France [2048x1366]"
1339452045.0,424,United States Air Force Academy Chapel [1689x2550]
1333557817.0,418,"I'd love to work here. Parliament Design's office in Portland, Oregon. [1024×683]"
1349457134.0,420,King Christian IV (of Denmark and Norway) lived in this quite simple apartement in the 17th century [1024 x 638]
1357567925.0,413,"Penthouse kitchen in Manhattan [1,800x1,200] Album in comments"
1338992924.0,419,W Barcelona [1024x762]
1367799215.0,418,Gorgeous bathroom with granite boulder bathtub and chandelier shower head [612x800][X-post r/pics]
1323991124.0,415,Botanical bathroom [1280x879]
1361854713.0,419,Modern Winter Escape [500x329]
1331290410.0,413,This is going to be in my house one day. [960x682] (xpost /r/pics)
1358023344.0,415,Beautiful wood kitchen - more photos in comments [400 x 719]
1337193014.0,417,"Water Tower Converted Into House - Zecc Architects managed the impossible: converting a 1931 water tower in Soest, The Netherlands into a contemporary home with no less than nine levels. [735x1100]"
1326202674.0,417,Hearst Castle Indoor Pool [1024 x 683]
1356912450.0,417,Living room or slice of heaven? [407 x 610]
1354628118.0,411,Russian Decoration Style in Movie Interiors (more in comments) [600 × 566]
1339676286.0,414,Empty Japanese home. [5616x3744]
1333255516.0,410,Desk With a View [480x625]
1341308149.0,410,"'The Long Room' library at my university, Trinity College Dublin [922 x 1231]"
1349459490.0,408,Octagonal Hamptons Office [686 x 449]
1326750638.0,405,The dining room of Japan's Highland Hotel is awash in natural light as Mt. Fuji looms in the distance. [2724×1813]
1357273847.0,404,hot tub haven [500x631]
1356553427.0,406,Bedroom in the forest. [500x333]
1350384059.0,408,An old fashioned games room in London [620x411]
1349547339.0,399,"Riggs Library at Georgetown University, circa 1980"
1323224021.0,401,Cozy wood shack [432x576]
1363561270.0,403,Living Room on a Lush Pond [1250x833] Info and Album in comments
1344795715.0,405,"Drawing Room, Fanhams Hall, Ware, England [1500 x 997] [OC]"
1344631173.0,404,"If you're going to block your million dollar view with a TV, this is the right way to do it. [1649 x 843]"
1334773347.0,403,Stairs are for suckers - Tokyo [666x1000]
1325627419.0,398,"Curvaceous living room of the Fennell Residence, floating on a river in Portland, Oregon [623×792]"
1370694961.0,402,"Meditation space,Altea,Spain[1024 x 709]"
1330097306.0,403,"Kaiser-Drobac house, Orcas Island, Washington. [954x635]"
1332759033.0,398,Modern bathroom with old-fashioned touches [500x750]
1354341762.0,401,"St. George's Hall, Windsor Castle.  State banquet for the Emir of Kuwait [1050x1600]"
1334254739.0,399,Luxury Bathroom in the Burj Al Arab Hotel in Dubai [1600 x 1234]
1331443495.0,403,Loft With Chill Lounge Area and Direct Roof Access [500 x 646]
1370525305.0,400,Quaint Roof Top Porn [500x741]
1369641723.0,400,Beautiful bathroom in Southern Australia [850 x 597]
1371179395.0,397,"The Hermitage Hotel lobby in Nashville, TN. Currently the only 5 star hotel in the state and the classiest place I've ever worked at. [554x402]"
1342101491.0,396,Bubble Hotel [638 x 461]
1341363411.0,402,Cockpit Bedroom [2966x1972]
1357134740.0,395,bohemian bedroom [554x831]
1355848600.0,392,"Tato House - Rokko, Kobe, Japan [818 x 645] - Lower room seen via exterior"
1366166895.0,392,Notorious gangster Al Capone's Prison Cell [OC] [1024x702]
1363009028.0,394,"Tribeca Loft with lots of natural light [1,434 x861] Album in comments"
1342282916.0,396,Fantastic Living Room with Great Fireplace [700x806]
1323302258.0,397,"Inside the Bibliotheca Alexandrina in Alexandria, Egypt [1000×667]"
1324332504.0,390,Surreal interior of the Nautilus House in Mexico City [800×570] 
1375363396.0,392,"San Diego penthouse [2,694 x 1,794]"
1372504603.0,388,A chapel under demolition. Complete with Jesus and his apostles mural. (1200 x 1200) (OC)
1336158449.0,396,Warm Kitchen Where I Wouldn't Mind Baking [600x400]
1349315333.0,389,Pool Side [500x375]
1315093568.0,390,The view!
1361496035.0,392,A nice place to stargaze. [500x375]
1340647157.0,390,Beautiful staircase [473x700]
1367975672.0,392,Wrap around balcony. Open walkway. [550x708]
1362098166.0,390,Rustic Luxury [OS] [554x369]
1361924607.0,391,Bedroom View of the Mountains. [x-post r/pics] [800x535]
1352459845.0,384,Living Room - Outback Australia [4320 × 942]
1340808138.0,390,Desert living room [1200x800]
1362202692.0,386,Nautical Style Game Room[683x1024]
1361972593.0,383,Penthouse Suite [2048x1226]
1334623509.0,384,"Don't know where it is, but I want to be there [700 x 525]"
1329598001.0,389,Elegant open kitchen [947×570]
1360087845.0,384,Inside a modern Finca near Barcelona [1280x800]
1335620046.0,382,Industrial Loft In Downtown Barcelona [1000x666]
1322399840.0,388,"One Madison Park, New York [1000x959]"
1319754116.0,382,Hearst Castle Indoor Pool - Hearst Castle is a National Historic Landmark mansion located on the Central Coast of California [912x1200]
1374371976.0,386,Reading Room of Schwarzman Building - NY Public Library [oc] [1024x683]
1352301311.0,381,A plaster craftsman designed what might just be the coolest living room ever in an abandoned house in Europe. [826x558][OC]
1370945048.0,377,[OS] Indian Roomset. Wallpaper design by Tony Roche. [228X233].
1344607292.0,375,White Bedroom w/ Blue Accents [1920x1200]
1375107570.0,383,"Mainport Hotel, Rotterdam, The Netherlands [1280x853]"
1327099301.0,380,Elegant city penthouse in Seattle [1200×900]
1362669457.0,382,Corner view [900x400]
1362089086.0,376,"""Passive House"" in Big Sur, California [505 × 700]"
1363018220.0,378,Cozy Loft [1221 x 1800]
1341043584.0,380,"Finished my front room - black marble, gold and chocolate [2560 x 1920] [OC]"
1320684340.0,373,Hammock Bedroom [675x481]
1369718793.0,373,Underwater Resort Fiji [820x614]
1364912962.0,378,"Hot spring hotel, Fukushima, Japan [1280x853]"
1333220369.0,372,I could get used to eating breakfast here [600x825]
1371801414.0,378,Bay Windows Overlooking Irish CountrySide.[1024x677]
1365903557.0,373,Hidden wine cellar [610x736]
1352758980.0,378,"After four years in the Marine Corps, I finally got my own barracks room! How'd I do? [880 x 557][OC]"
1334291242.0,375,A room in the Harem in Istanbul [1280x853]
1363999840.0,376,In Antwerp Pop-Up Hotels With a Fleeting View [600x577]
1329530924.0,375,The bar in Malinard Manor [1024x699]
1339302091.0,373,Houzz Kitchen [500x623]
1376015987.0,375,Tasteful interior of the Smithsonian American museum [1024x683]
1337538416.0,374,"A house in Queenstown, New Zealand [1000x667]"
1372590471.0,369,Entrance hallway to the beautiful Château Lumiere (1761 x 2000) (OC)
1357567983.0,368,"Indoor pool with a beautiful view in Yeatman Hotel Portugal [2,952x1.593]"
1326827532.0,371,Vintage Bedroom - [650 x 432]
1364232556.0,366,Stunning curved wood staircase and hallway [587×800]
1343857604.0,370,Theater conversion loft [1000x667] [OC] [MIC]
1330997506.0,370,Attic Bedroom - [1024 x 665]
1365970461.0,362,Cozy Tack House [540x814]
1339026210.0,369,"Zero carbon Houl House, southern Scotland [1000x750]"
1322501286.0,366,Library Room with Fireplace [1024x1294]
1333141882.0,363,Gorgeous bathroom [554x363]
1333104257.0,372,Classy Kitchen [1200 x 800]
1343084191.0,368,Pool courtyard area in a totally outlandish $33 Million dollar super mega-house [1650x1100][x-post from r/woahdude]
1350553977.0,361,Simple open space living room [800x600]
1339200685.0,368,"Under Pohutukawa, Piha, Auckland. [834x1250]"
1359508123.0,366,Swashbuckling bedroom [900 x 600]
1347459322.0,361,"Modern but cozy, the flowers make all the difference [400x500]"
1363136236.0,361,Hammock Bedroom [675 x 481]
1347974958.0,360,Cozy attic space. [580 × 779]
1345924963.0,366,The Russian Pavilion at La Biennale [612x612]
1355595596.0,353,"Rotunda balcony inside the capitol building, Lansing Michigan [1024 x 768] [OC]"
1338870541.0,360,"Creekside Residence in San Mateo County, California [853x1280]"
1366943126.0,358,Contemporary London Penthouse [600 x 597]
1335593527.0,358,Wenge timber shower [800x1202]
1336126986.0,357,"A beautiful bathroom overlook Lake Tahoe, Nevada [800x569]"
1354013370.0,354,Panoramic view of Swiss mountains from this luxury chalet [500 × 334]
1338489672.0,356,The Trunk House is a small cabin in Victoria’s Central Highlands in Australia [856x550]
1339666752.0,355,Shanghai Marriot Hotel bar [940x626] more pics in comments
1370103658.0,356,"Ski room in Chalet le Petit Chateau [3,490 x 2,155]"
1341291328.0,355,Cozy but modern: Inside the HGTV dream home of 2011 [850x590]
1328391502.0,355,Hong Kong Apartment [600x415]
1352433460.0,353,Chicago Music Exchange [1500 x 1000] [OC]
1322692349.0,353,Living Room with views of the Icelandic countryside (Casa G) [880x1348]
1357961704.0,348,"Robert Stilin Living Room | Clean, Simple [933 x 700]"
1344466156.0,352,Comic book strore designed to look like a comic book (x-post r/books) [580x434] 
1366714386.0,351,Children's room [900X906]
1336363486.0,350,Study Space at Ørestad College in Denmark [1000x1296]
1321651772.0,352,"Sit back, open the windows, turn the volume up, and relax. [1600x1033]"
1356077989.0,350,Blackbird Studio C [1024x837]
1328157105.0,347,"Lego Development Building, w/Slide! [1024x683]"
1324809128.0,349,Hollywood hills home that Ashoton Kutcher is rumored to be very interested in.[1280x785]
1340098701.0,348,[OC] Custom Home Cinema Installation [1092x768]
1325867253.0,349,Hi-Rise Bedroom at Twilight (2700x1784)
1371143067.0,345,Minimalistic neutrals and amazing windows (architect: David Jameson) [1159x1500]
1358753366.0,346,The best treehouse room [900x1193]
1352070024.0,349,"El Tovar Hotel, by the Grand Canyon [2650×1490]"
1331569436.0,345,What an amazing view from your living room [600 x 386]
1324072382.0,350,Sunlight streams into an earth-toned apartment [1024×768]
1330963932.0,346,"Math Slide, University of Munich [2448 x 3264] photo by Better Than Bacon"
1328982502.0,348,"Writing in Washington Life, Karin Tanabe describes the remarkable writing office designed by Travis Price architects for Wade Davis, National Geographic's ""Explorer in Residence."" It's one of the most beautiful rooms I've ever seen, the apotheosis of writing-caves. [1715x2160]"
1320807633.0,341,This is so cool. - King of the Frogs Treehouse [1700x1103]
1349339061.0,347,Such a lovely place! [600x900] Rest of the house in comments.
1342796141.0,341,"Team house of chinese dota team DK (album in 
comments) [640x426]"
1325292286.0,343,"Zen room. Designed, modeled, and rendered by me.[1920x1080]"
1371891094.0,341,"Stunning Great Hall in 1882 German built Pollaro - Braun House - Denison, Texas [1200x800] [OC]"
1358015475.0,342,[OC] Cozy shared bedroom in a cheap rental [1800x2707]
1346116228.0,340,100th Floor of the International Commerce Centre [4288x2848][OC]
1356299152.0,341,"My friend's third story balcony aka the princess room, over looking the sinkhole [2048x1536]"
1331145236.0,338,Bedroom with nice view [1024x683] (X-post from /r/whyineedtoberich)
1321108234.0,335,The Floating Bed [1280x847]
1366118235.0,333,A room in a traditional Japanese ryokan [4592x3056]
1372948757.0,333,"MEININGER Hotel Berlin Airport, Germany [1280x853]"
1360667383.0,335,Children bedroom ideas. [600x447]
1357942425.0,339,Williamsburg Kitchen [887 x 590]
1345035556.0,335,"Notre Dame de Paris, France [4000 x 3000] [OC]"
1342098605.0,341,View from Cousin's Cabin - Oslo Fjord [604x453][OC]
1334431558.0,336,House of Commons [1573x 1600]
1328207022.0,336,"Spiral Staircase, Law Library, Munich, Germany (x-post from r/pics) [499x496]"
1363398524.0,335,Wood Cabin [1280 x 853]
1317060273.0,338,Comfortable home theatre
1374071467.0,332,Circular penthouse [600x400] (album in comments)
1372182913.0,334,Rustic Lodge with Pool Table [1000 x 1500] [OC]
1329891913.0,339,"Open kitchen/living/dining room, Far North, New Zealand [800x534]"
1376113963.0,332,Underwater Observation Room [2000x1333]
1332859002.0,333,DC Townhouse [800x600]
1331238739.0,337,The perfect way to spend a summer evening. This is paradise. [2560 x 1600]
1329247547.0,333,Strand Craft 122 Super Yacht Interior [1700x1000]
1363394204.0,336,"Glass Pavillion in Montecito, California [1136 x 757]"
1352448866.0,331,Lady Mary's sitting room in Casa Loma [1500x844][oc]
1342578544.0,331,"Inside Hassan II mosque with it's retractable roof and carved stucco inlay - Casablanca, Morocco [oc] [1024x683] "
1334346404.0,336,Exotic Jacuzzi [1024 x 768]
1332697730.0,328,I like how the light rests on the wall in this hallway [600 x 400]
1326380346.0,334,Bohemian Bedroom [426 × 640]
1374086067.0,329,[2400x1500] Modern home office space with a view... and lazy dog for good measure
1364673085.0,333,Pisa is more than the tower... The Duomo (cathedral) in Pisa Italy (part of the UNESCO World Heritage Site) (1000x500)
1342949767.0,325,Staircase to nowhere. Abandoned office Belgium.  (1200x800)(oc)
1363118630.0,328,New York apartment overlooking the East River [1019x680]
1351321986.0,322,Bedroom with a small balcony. [1500x1125]
1337791895.0,323,"The hall of mirrors, Palace of Versailles [1024x682]"
1370670483.0,333,"Craft Design loft space in London, UK [1200x800]"
