created_utc,score,title
1359046785.0,3229,[OC] My flat was previously a church. It's not super glamorous but I love it. [1273x955]
1355780718.0,3101,I could chill here and read books the entire day (chalet in Switzerland) [718x430]
1348566811.0,3042,Imagine sitting here and reading a book as the rain beats down overhead [1200x988]
1360771099.0,3012,A Clock Tower Home [960 x 639]
1357675040.0,2864,My college man-cave. I'm in love with this place! [2765x2074]
1364397678.0,2862,Can a warehouse be RoomPorn? [1600x900]
1365000265.0,2773,A place to sit. [403x403]
1335321071.0,2742,Bathroom with glass floor built above an abandoned elevator shaft [625x418]
1354938010.0,2718,"Glass rain shower that extends over the ship's edge in the 1,636 square-foot Reflection Suite on the new Carnival Reflection, one of the largest on any ship. [3150x2372]"
1359388647.0,2703,Japanese Tea Room [1680 x 1050]
1361455384.0,2641,Home Office with a View [838x600]
1360155049.0,2622,Sleeping platform with floating steps [640x740]
1355674072.0,2620,Industrial Loft [844x1073]
1373483242.0,2593,Outdoor Kitchen [940x575][OS]
1358184161.0,2561,Beautiful attic room with Cape Cod view. [1200 × 1800]
1374268605.0,2545,Luxury tent in Africa.[1680x1118]
1376236758.0,2513,A lovely little terrace with a hot-tub. Perfect to spend a winter evening. [990x692]
1356832372.0,2471,Those windows alone do it [960 × 638]
1366989406.0,2465,I love the morning light in my living room. OC [ 1688 x1125 ]
1375187337.0,2457,My reading and reddit corner [2008x1483] [OC]
1371603193.0,2451,"My friends built this house out of local trees, mud, and cow dung. Traditional Kenyan architecture with a modern twist [600x901] (size corrected) [OC]"
1360422282.0,2423,Garage Living Room [960x508]
1366909176.0,2413,"Wall of Plants, Wall of Books, Floor of Fishes. [1500x1000] (More pics in comments)"
1370569286.0,2349,I just really like this idea. [304x540]
1374856608.0,2353,"Ok, but this one is an indoor infinity pool I promise [2544x1588]"
1365608775.0,2334,Inside Ellen Degeneres and Portia De Rossi's Home [1194 × 797]
1352915205.0,2329,"Imagine: Clock alarm ring, you wake up, slowly open your eyes and every day see this [510x413]"
1359502891.0,2311,Small Apartment Concept [700x700]
1368547859.0,2308,"Meeting room inside the bank, Denmark [960x670]"
1367973690.0,2301,Looking up at the stars every night. [484 x 704]
1376443427.0,2295,Bedroom by the sea [1900x1281]
1366118605.0,2292,The Suite in Cinderella's Castle at Disney World [2000x1325]
1361888589.0,2281,Bunk Beds [4256×2832]
1370523023.0,2252,Indoor Roman Pool - Hearst Castle [1200x807]
1368994057.0,2255,That natural feeling. Takashi Amano enjoys a glass of wine admiring his masterpiece.[992 × 495]
1376160669.0,2216,A lovely reading room with a view of a rain forest [500x583]
1349718025.0,2213,Colorful exposed brick [1101x733]
1360357820.0,2185,Masculine Mountain Home [1200X800]
1374757560.0,2150,Now THIS is how you do First Class. Singapore's First Suite on their Airbus A380 [3000x1728]
1364825230.0,2146,Roommate moved out... I think this was the only reasonable option for the spare bedroom [1280x854]
1361024802.0,2144,Mornings like this make floor to ceiling windows worth it [3264 × 2448]
1372979966.0,2132,Revamped penthouse in St Pancras Chambers. Gorgeous modern design and exposed beams [1500x1493]
1367164339.0,2119,Goksu Rope Factory Lofts / Suyabatmaz Demirel Architects [1500 x 2000]
1373904064.0,2121,Care to breakfast among my indoor trees? [1558x1033]
1375885624.0,2112,Rustic kitchen in a renovated barn [650x975].
1345733437.0,2105,A room fit for an adventurer. [500x684]
1351399418.0,2098,Girl's Bedroom [440x353]
1367905966.0,2087,Rooftop Hiding Spot [480 x 729]
1351788450.0,2077,"It may not be much, but I absolutely love my new bedroom. [1632x1224]"
1374705223.0,2075,First class seat in Emirates Airbus [960x640]
1343966229.0,2075,Hot tub in front of a fireplace [600 x 520]
1363730806.0,2069,House in the Woods [800 x 600]
1358824932.0,2060,"My Living Room (SF, Album in Comments, X-post)[1024x681]"
1346765495.0,2049,Fancy living in a converted church? [1024 x 683]
1371302752.0,2057,"Suite at Hilton Maldives Resort and Spa, Rangali, Alif Dhaal Atoll, Maldives [1600 x 1065]"
1357503041.0,2047,A simple modern loft [1702 x 1054]
1375643655.0,2045,Does this count? An nice big city apartment! [640x835]
1347810681.0,2043,The Ultimate Reading Room [814x815]
1369144084.0,2033,Outdoor Living Room in Mexico [900x559]
1357914457.0,2025,A River Runs Under It [x-post r/pics]
1357852151.0,2014,Underwater nightclub in the Maldives [930x380]
1351098941.0,1993,Modern Rustic Kitchen in The Netherlands [500x710]
1362927775.0,1985,"Colorado Kitchen with wrap around windows [1,600 x 1,064]"
1353685707.0,1975,Lofted Workspace [1600 x 1067]
1370283592.0,1956,What $115million buys in NYC [2800x1865] (link in comments)
1369227719.0,1952,Manhattan Living Room [1200x799]
1370005809.0,1939,Beautiful bar and wine cellar [1200x735]
1341519048.0,1925,One cool curved door! [1280x960]
1350637835.0,1924,Red. Brick. Everything. [800x600]
1359133766.0,1922,My Cozy Living Room [2048 x 1096]
1365945350.0,1918,Creative use of a map [500x469]
1359847527.0,1916,"Farmhouse Kitchen [1,200 x 780] Chicago"
1368825054.0,1908,Unique. A central shower. [550x440]
1372086488.0,1905,Lakeside Living Room [1200 x 799] - Album in comments
1373390826.0,1892,Quaint Roof Top Porn [500x741]
1365131342.0,1889,Cozy cabin reading room. [553x651]
1350078461.0,1879,Awesome fish tank integration [616x462]
1362239873.0,1871,"Reading Room/Library in Tribeca, New York [1,280 x 853] Album in comments"
1355240463.0,1868,The rooftop lounge at The Roosevelt Hotel NYC [2345x1597]
1368655129.0,1866,Frasier's Apartment [953x448]
1361287472.0,1864,Room with a view. [2148x1342]
1349026090.0,1857,Bachelor Pad [1024x683]
1369062490.0,1850,Our room for 3 days and 4 nights. A small yurt tucked into a pocket of trees on the edge of an ocean cliff. [2112x2816] [OC]
1372700775.0,1847,This Vancouver penthouse bedroom seems like a nice place to rest one's head. [1500x999] (info and pics in comments)
1363352522.0,1842,A cozy reading room &amp; library [1203 x 799]
1354180394.0,1826,Overwater Bungalow - Bora Bora (2100 × 1457)
1368811783.0,1825,A manly apartment [500x697]
1376065082.0,1820,The living room of Will &amp; Jada Pinkett Smith's Malibu home. [900x600] (MIC)
1362494822.0,1815,Minimalist ocean view home in South Africa [1.725× 972] Album in comments
1363810851.0,1803,Desk with a View [480 x 625]
1351510158.0,1796,Is this the ultimate in warehouse loft living? [600x400]
1375716442.0,1794,Clean lines with a view to an exterior terrace [988x740].
1353319600.0,1779,Watch reindeer in the middle of nowhere in this breathtaking room [500x500]
1374159092.0,1774,Got to shoot this two story downtown modern flat yesterday [2956x1958] [OC]
1376497958.0,1770,Gorgeous outdoor shower inside your bathroom [500x746].
1359728263.0,1760,"Bathroom with a soft, warm atmosphere [1297x970]"
1367346386.0,1745,Exquisitely restored tatami room in Japan [1024x576]
1352390877.0,1744,Desert Home. $1.5m (x-post /r/IfIWonTheLottery) [699×465]
1356933909.0,1742,Beautiful custom home that I know nothing about other than I LOVE IT [576x720]
1373142126.0,1740,Steampunked Bathroom [990x974]
1364047423.0,1737,"Beautiful Stockholm Loft [1,055 x 702] Album in comments"
1373995071.0,1730,"“To relax on a lounge chair by the pool in the middle of February during a blizzard with the wind howling outside the windows..."" North NJ [2295x1428]"
1365860260.0,1727,Castello di Sammezzano in Tuscany [502x753]
1374600707.0,1723,"Lush, narrow rooms (MIC) [OS] [1000x703]"
1332492430.0,1720,"Wake up, shower, dress. [1524 X 969]"
1345966643.0,1712,Dream among the stars!!! [x-post from r/pics] [1600x1071]
1376357806.0,1716,A serene Singaporean shop house recently renovated and restored [1680x2247]
1369674928.0,1702,"Room in Sculpture Park in Dietikon, Switzerland by architect, Bruno Weber. [1,600×800]"
1371058659.0,1699,[2700 x 1800] [OC] Boston Roof Deck Sanctuary at Sunset
1346503718.0,1692,Enormous loft [1600 x 1285]
1349988194.0,1672,"Comfy, dimly lit, brick-interior loft (500 x 500)"
1356708284.0,1675,Stylish cabin in the woods [900x600]
1353145124.0,1675,"The Painted Room, Old Royal Naval College, Greenwich — single-handedly painted by one man over the course of 19 years [1600x1067][x-post from /r/pics]"
1366732339.0,1653,"Midtown Phoenix Penthouse [1,000 x 664]"
1367859403.0,1653,State Library of Iowa (Des Moines Capitol) [1840x3264]
1375349509.0,1656,Not sure if this counts.... but here's a small gazebo room on Lake Malawi [1600 x 1064]
1350277848.0,1650,Penthouse with a view of Hong Kong. [2000x1333]
1366465476.0,1636,"High ceiling kitchen with custom see-through cabinets, in a cottage on the Severn River in the Maryland countryside [630x887]"
1354033523.0,1629,"Whole tree architecture reading room, Wisconsin [600x396]"
1365769904.0,1631,A retro indoor garden/lounge [600x900]
1351583705.0,1628,Any love for bathrooms in here? [1726x1271]
1373046398.0,1622,"Open Corridors at ""Hôtel le Hameau"" in Saint-Paul-de-Vence, France [1071x720]"
1369934535.0,1618,"If I had this setup, I would never find an excuse to exercise [800 x 600]"
1335254924.0,1619,Bunks [800x533]
1364327901.0,1619,My San Francisco loft. [OC] [2183x1455]
1358529495.0,1609,Wood living room near Seattle [1280x800][OS]
1358871766.0,1599,This loft has been my home for four years. We're moving this weekend and it will be missed. [OC] [1024x768]
1363663390.0,1603,Church converted into home [800x600]
1341659484.0,1595,"Cave pool, Santorini, Greece. [1024x768]"
1366307757.0,1598,A Breathtaking View [1200x797]
1362056850.0,1590,Those City Views [2000x1333]
1363957014.0,1584,"All white loft [2,000 x 912] Album in comments"
1356620538.0,1588,"A hotel in Santorini, too white? [640x608]"
1360951536.0,1568,Library of Humboldt University Berlin (x-post from r/Architecture) [5066×3413]
1367661238.0,1568,Studio apartment by The Brooklyn Home Company [640x461]
1365284586.0,1571,"home library - west los angeles, california [721 x 481]"
1363003232.0,1567,Mountain Lounge [950×600]
1369830624.0,1566,Bamboo accented modern kitchen [1200x623]
1376313545.0,1560,Skyscraper Suite [603x460]
1350562932.0,1564,Living in Cape Town (x-post from r/pics) (1200x797)
1362149486.0,1564,As far as the eye can see [1107x673]
1353807856.0,1560,"Sagrada Familia, Barcelona [534x800] [OS in comments]"
1370985982.0,1557,"Charcoal, weathered office [600x826]"
1365685499.0,1549,Clouds and fur [500x750]
1340382051.0,1548,A room with a Map Floor [640x600]
1363219470.0,1550,The Yellow Submarine Bathroom [533 x 800]
1362337549.0,1540,Loft overlooking the Mississippi [1200×900]
1362406047.0,1538,London Flat [1650×1100]
1355315385.0,1529,Modern sauna in Helsinki [600x800]
1352598327.0,1529,Another awesome studio apartment. [550x825]
1361805024.0,1512,In sunny Spain [1000X817]
1370612480.0,1517,Master of all bedrooms in Smoke Rise NJ [2747x2041]
1361322005.0,1507,I love the suspended loft above the kitchen. Designed by Balance Associates Architects [550 x 734]
1364228307.0,1511,Hammock corner in a Tokyo townhouse [975x1463]
1349548143.0,1507,Vitro done right. [460x876]
1367713755.0,1503,I love windows. [550x827]
1363441632.0,1499,House with glass walls and glass floors [1000 x 1400]
1372267189.0,1497,Livingroom on top of an old Reichsbahn Bunker in Berlin [940 × 620] (Album in comments)
1369488957.0,1493,Ski Chalet with a Beautiful Fireplace [1200x899]
1372871681.0,1489,"Sauna raft [1350x900] Joensuu, Finland, info inside."
1354708658.0,1484,"Glass walls everywhere and a retractable roof [1,025×768]"
1357572973.0,1482,The question is: where would you honestly rather sleep? [2304 x 734]
1368191807.0,1478,"Living room with a view of Hyde Park, London [1200x720]"
1342747975.0,1485,Main floor of 43 million dollar house on Lake Tahoe [800x533]
1371436753.0,1482,My dream porch. [421x525]
1362580244.0,1472,"London Penthouse Living Room[1,400 x 800] Album in comments"
1337094112.0,1480,This is incredible! Wood &amp; Chains [1440x980]
1356310964.0,1468,Perfect winter reading room [520 × 655]
1362709194.0,1470,Flight Themed Kids Room [1126x764]
1345612088.0,1460,"A cozy, modern bedroom meant to replicate the feeling of a yacht [1600x839]"
1374075975.0,1459,Skylit Bedroom [1024x614]
1335393392.0,1463,Space Saver [469x508]
1366860942.0,1450,A stylish window [500 × 750]
1371132723.0,1442,"Grand Staircase (Grand Escalier) at Palais Garnier (Opéra Garnier) in Paris, France [2000x1596]"
1361182948.0,1432,"Old Faithful Inn lobby interior, Yellowstone National Park. [683x1024]"
1351461172.0,1429,My fathers barn turned man cave... [4355x990][OC]
1373206610.0,1429,'In Suite Garage' uses thumbprint operated lift for residents of an exclusive Singapore high-rise apartment. [2426x1617]
1360904614.0,1422,The Green Dragon Inn [640 x 433]
1358954114.0,1421,"The newly redesigned, enchanted dining room... [1600x1066]"
1366394726.0,1404,"Laundromat Cafe Reykjavik, a library inside a bar inside a laundromat [841x315]"
1363601161.0,1411,Bedroom in a converted mill. Rustic look with machinary still hanging from the ceiling [620×413]
1357415353.0,1407,"Outdoor dining room with spectacular views.[1,200x803]"
1354777038.0,1406,"Great Room in mountain home at Telluride, Colorado. [700x496] "
1366308288.0,1402,A wardrobe that opens to Narnia. More secret rooms inside. [1200 x 814]
1358773873.0,1398,"Books, books and more books. A bookshelf wall [1,153×768]"
1353197871.0,1404,Amazing loft oriented around exterior greenery [791x396]
1358274059.0,1398,Where I spend my workday [720x540]
1350414256.0,1392,"Frank Lloyd Wright's ""Little House"" [1424x1130]"
1358093737.0,1390,Acid green windows in an amazing kitchen! [600 x 801] (originally from homedit.com)
1348640552.0,1393,I've never wanted to sleep anywhere more than here [535X356]
1332330780.0,1392,Dream Kitchen [500×684]
1367263238.0,1392,"Room with a view at Hayman Island, Great Barrier Reef, Australia [5000 x 3333]"
1368728437.0,1392,Sunny &amp; Nautical[1600×1032]
1375575615.0,1378,Amazing Home Office(x-post r/pics)[640x744]
1352126760.0,1386,Underwater Bedroom [3405x2266]
1350760380.0,1376,"Luxury 5 star hotel in Paris, just stunning. [500x617]"
1361721284.0,1369,Simplicity [610×407]
1372183462.0,1363,Cathedral Ceilings (literally - converted church) Part Deux [1000 x 1466] [OC]
1351858483.0,1366,"Azure Indoor Pool, Hearst Castle, California [3976 x 5232]"
1368462485.0,1355,The British Museum at Dusk [5800 x 2200][OC]
1338685157.0,1349,I really love this pool [540x443]
1351697847.0,1345,Earthship kitchen with big windows [500 × 500]
1357292864.0,1340,One fantastic bathroom [630x700]
1360673148.0,1329,Australia's most expensive apartment. Album in comments. [540x320]
1353519978.0,1334,Living Room in Las Vegas with amazing Strip view [800 x 533]
1367798175.0,1335,Beautiful modern living room [701x917]
1357347673.0,1330,high ceiling kitchen (550x734)
1376572756.0,1330,"Beams, beams and more beams [620×413]"
1360072254.0,1328,"Villa in South Africa [1,200x797] Album in comments"
1338327565.0,1314,Solitude [OS][620x890]
1360625012.0,1317,Amazing Vancouver kitchen with stunning ocean views. Full album in comments [1920x1056]
1352008459.0,1315,Slightly re-done 1850s East Village bedroom [800x1000]
1374502323.0,1316,Just a room with a decent view in RI [935x620]
1367755822.0,1315,Our new bathroom [2736x3648]
1365214128.0,1309,An amazing earth-tone colored living room with snow-capped mountains just outside [640x433]
1350476198.0,1311,"Modern living room looking out on a large tree, Venice, California [810 x 1000] [os]"
1369596171.0,1314,Thomas Edison's Chemistry Laboratory [1024x683]
1365413763.0,1309,Smart log cabin style hotel lobby? [2560x1490]
1361542319.0,1291,Ridiculous Wine Cellar in Chicago [640x480]
1357227839.0,1294,Minimalistic bedroom [1920X1080]
1365523918.0,1287,"Kitchen overlooking Hood Canal, WA. Album in comments. [OS][608x811]."
1349827075.0,1288,What a view [1920x1080]
1344168467.0,1281,Bachelor Pad [844x1073] (x-post r/pics)
1373556981.0,1275,Industrial [630x945]
1375285854.0,1281,Fans of the Pergola ceiling rejoice - Houston TX [1024x682]
1362307999.0,1271,"Ocean House in Big Island, Hawaii [1024x1532]"
1362403180.0,1265,Living room over looking the ocean [1239x826]
1337819614.0,1269,Indoor Pool - [421 x 516]
1373745791.0,1269,"The University of Washington Library, Seattle [2048x1367]"
1330864623.0,1263,The Man Apartment [1453x721]
1366043606.0,1260,Beautiful SOHO loft [600 x 400]
1349921834.0,1259,Exploitation of free samples from Home Depot [x-post r/pics] [2430x3240]
1360841377.0,1258,Holy Library [600x755] and more library ideas.
1371664325.0,1255,"Minimalistic living room with dark gray, white, neutrals and yellow accents [1024x817]"
1374939788.0,1251,San Francisco living room with a view [800 x 600]
1348053255.0,1240,For those who love disorder: an artist's studio [800x532]
1340702583.0,1243,"Bathing over the water [800 x 1,200]"
1354354234.0,1233,One awesome use for an attic [310x466](x/post from r/pics)
1372033865.0,1228,Bathroom above the sea (x-post /r/pics) [3150 x 2372]
1348423768.0,1225,Theological Hall of the Strahov Monastery Library in Prague [1540x1027]
1355964627.0,1220,Arabian Tent [3888x2592]
1346333755.0,1218,Riverside living. I could not ask for a better view. [800 x 450]
1362857577.0,1223,"House in Lo Curro, Chile [1440x1080]"
1367514683.0,1217,Beautiful views of New Zealand countryside [587x389] Album in comments
1367415839.0,1217,"Scandinavian kitchen, simple but beautiful [500x375]"
1360474999.0,1216,Non-Suicidal Garage Living Room [960x508]
1355065092.0,1217,Amazingly re-purposed water tower (gallery and info in comments) [600x894]
1347925502.0,1214,Huge 200-year-old church converted into single-family dwelling. Here's the living room. [1280 x 720]
1375798780.0,1212,Contemporary home library [1360x908].
1361221573.0,1208,"The Infinity Room, The House on the Rock [800x600]"
1340911193.0,1213,A room with a view [2148 x 1342]
1337708771.0,1211,Cabin on the Lake with a 20' x 30' openable window wall. [991 x 762] MIC
1360533346.0,1206,"awesome lobby room with huge chandelier [2,099 x 1,499]"
1357065985.0,1207,Bohemian Chalet in the French Alps [600x480]
1357737516.0,1202,London living room with views of The Thames [1.322x879] Album in comments
1366239834.0,1197,Library Slide by Moon Hoon [640x960]
1369597446.0,1191,"This is the living room of some people I know! It was an old farm, they renovated it into a house. [874x583]"
1363094939.0,1183,Open. [1280×854]
1363047367.0,1185,I call top bunk! [616x812]
1375400657.0,1188,Kitchen/living room in House Galvani - Paris [938x737]
1370357890.0,1186,Yves Saint Laurent's Guest Bathroom. [625x500]
1354547178.0,1178,"This is my studio where i write movies and jingles for TV. [3,642 x 1,196]"
1370393296.0,1179,Beautiful built-in book shelf leading into a naturally bright bedroom [480x600]
1373337673.0,1179,"""There and Back Again"" - Hobbit House, Wales [2560 x 1794] [More info in comments]"
1344485893.0,1179,Congrats /r/RoomPorn. You are the Subreddit of the Day today!
1362183887.0,1176,Open and Natural [1040×768]
1342283926.0,1177,I think every apartment needs an indoor swing [989x1280]
1363182736.0,1173,"Converted Victorian Tea Warehouse, London [600x400] (Album in comments)"
1363125449.0,1179,Penthouse Bedroom in London [1400 x 800]
1369747137.0,1179,Elegant home library [900x560]
1352319822.0,1176,Starry Night Bedroom [500 × 652]
1351337170.0,1176,"My dark, IKEA fueled room [OC] [1440x960]"
1356550505.0,1170,"Swim cellar, part of the Black and White house in Kuwait [600x914]"
1346907446.0,1171,"As a Practical Guy, I need a Practical Wardrobe [287x500]"
1370986233.0,1170,"Bathroom of black, charcoal gray, and unfinished wood [610x813]"
1362608452.0,1171,The Study [1200x824]
1374198114.0,1168,Clock Tower Apartment [1024x697]
1356148964.0,1170,Visualized Bathroom [1024x768]
1368354112.0,1163,"Since we're doing libraries, here's where I'm working at the moment: Gonville and Caius Library, Cambridge. [1190x1508]"
1368110731.0,1166,"White, Black and Red Modern Living Space [1280x800]"
1353965973.0,1168,Super cool loft space. More photos inside. [645×859]
1373898407.0,1160,"The house that time forgot: when a man died in 1932, his family kept the house exactly as it was. Article and more pictures inside. [964x634]"
1339593381.0,1159,Reclaimed Timber Home in Wyoming [600x900]
1370095866.0,1163,Gorgeous dining inside wine cellar [2422x1600]
1356274183.0,1155,Japanese Sitting Room [1920 x 1200]
1359119664.0,1155,My loft living room.  Back when it was still warm enough to open the windows.....[1920x1920]
1366204262.0,1154,Beautiful Dining Room filled by Natural Light [1920x1200]
1361972340.0,1147,Alpine Abscond [1515×1200]
1354456327.0,1142,"Modern great room (you can rent this house, btw, in Roswell, GA. I'm not a realtor; it's just cool when your porn is rentable) [596 x 446]"
1346170676.0,1137,Kitchen in a modern castle [800x533]
1365348859.0,1135,Quirky Kitchen [550×733]
1362818265.0,1131,Hawaiian bathroom [800x533]
1334169867.0,1124,"High Ceilings, Exposed Brick and Hardwood Floors in SF apartment [768 X 432]"
1347885897.0,1123,Boat bed [463x640]
1353042782.0,1122,My dream kitchen has lots of windows [499x751]
1371438652.0,1126,Dream office. [530x633]
1352983039.0,1116,Stunning barn conversion in Oxford [600x400]
1360000185.0,1114,Inside Google's new office in Tel Aviv [700x467]
1358984877.0,1114,[OC] My minimal living room with a view [950x650]
1368503439.0,1109,Zen room in forest. [1680 x 1050]
1353378709.0,1109,Modern kitchen/dining/living space [1280 x 853]
1344430972.0,1105,"The Shore at Katathani - Phuket, Thailand [1920x1080]"
1355747901.0,1099,Movie Room - Shades of Blue [1600x1067]
1359952807.0,1104,"Eclectic, Rugged Kitchen by Marchi Cucine [1200x800]"
1359561433.0,1100,Contemporary home library [689x855]
1348219060.0,1099,A converted stable in West London [800x398]
1334897012.0,1101,In-floor bed and an amazing roof [395x600]
1353861709.0,1098,Waterfall Bay House in New Zealand [554 × 720]
1346410082.0,1092,The stones look so Zen. [792x720]
1357124175.0,1098,"Loft with a custom spiral staircase, gallery in comments [779x494] "
1343048115.0,1091,Aquadom at the Radisson Blu Hotel in Berlin [1024 x 768]
1364172175.0,1093,Would love to lounge here with a couple of drinks and friends on a Friday night [2099x1499]
1341822740.0,1088,"Photograph taken inside the ""core"" of an abandoned 1970s apartment tower due to be rejuvenated [586 x 439]"
1361639821.0,1085,Hitler's work study in the New Reich Chancellery c. 1939 [1535x1000]
1354267090.0,1080,Best spa designs.. [900x600]
1366573198.0,1081,Kitchenette and loft of high-ceiling bungalow [1600x2000] - album in comments
1358608731.0,1088,"Don't know why I took so long to show this to Reddit,  but this is my living room [995x561] (video in comments)"
1375465948.0,1074,Boston loft with exposed brick and vintage neon signs [OC] [1600x1066]
1370133543.0,1077,Wood accents everywhere in this stunning house [890 x 1280]
1349155547.0,1067,An Awesome Studio Apartment[638x1024]
1356461165.0,1065,"Brazilian garden house [1,200 × 800]"
1356406906.0,1065,A boy's room [1024x1312]
1353733066.0,1061,Where I spent my Thanksgiving: A beautiful log cabin in northern New Mexico [3264 × 2448]
1359633885.0,1061,Loving the dark colours (800x528)
1352220647.0,1058,Striking architecture and modern interior in old converted church [682×454]
1371941717.0,1055,Glass House Bedroom [610 x 381 ]
1349225696.0,1056,"Living room of church converted into a home, Utrecht, the Netherlands [714 x 884] [os]"
1359984423.0,1047,"A book shelf heaven [1,161×768]"
1339757364.0,1053,"Microsoft's Headquarters in Vienna, Austria [900x622]"
1359907738.0,1046,New Zealand living room [650 x 424]
1344951523.0,1048,My kind of library! [700x554]
1348456537.0,1040,Beautiful kitchen with circular nook [690x596]
1335845820.0,1038,What an amazing view [1183×800]
1341877887.0,1035,One of the best hot tub rooms I've seen [1277x1920]
1375970264.0,1036,"Book Mountain Library, Spijkenisse, The Netherlands [1280x960]"
1364391955.0,1031,Beach House Bunk Beds [980 x 651]
1361085809.0,1028,"Luxury in the desert - Amangiri Resort - Canyon Point, Utah [818x611]"
1358057772.0,1028,This is my patio in Hawaii [1600 x 1064] [oc]
1369891673.0,1019,There's potential for roomporn everywhere! [960 × 320]
1359162639.0,1027,Living Room in a Converted Barn [890x575] 
1353597722.0,1024,London penthouse loft. Timber cathedral style ceilings and exposed brick [800×529]
1363536411.0,1015,"Beautiful Houston, Texas kitchen[1,200 x 800] Album in comments"
1349629410.0,1015,Curvaceous wooden room in the Eco Villa on the Thai island of Koh Kut [x-post r/pics] [1024x683]
1373285037.0,1016,"Apsley's Restaurant at The Lanesborough, London [1500x1125]"
1351259657.0,1012,Overlooking Tower Bridge and the Shard [800x550]
1360270490.0,1013,"Farmhouse Attic Bedroom, Delhi, NY. [1789x1140]"
1329322299.0,1010,Mediterranean cliffside villa with an 18-ton retractable glass wall [670×555]
1328800511.0,1005,Mobile roomporn [569x3777]
1353077328.0,1006,My dream kitchen ALSO has lots of windows! [OS] [700x465]
1367465994.0,1004,"Egg Treehouse, British Columbia [1100 x 729]"
1344726534.0,1004,Outdoor bedroom with a pool. [640x480]
1363880641.0,1001,1910 Restored Parlor [OC] [2676 x 2007]
1349337342.0,998,tree house [500 x 735]
1358729743.0,992,"Contemporary polished concrete - Koh Tao, Thailand (xpost from /r/floorgasm) [1280x854]"
1356059404.0,994,"Inside the tallest hotel in the World, Hong Kong [918 × 454]"
1371223822.0,992,All the metrostations of Tashkent are masterpieces! [1024 x 768]
1365430176.0,987,[OC] Basement Remodel [530x800]
1361991719.0,987,Bright and comfortable living room [999 x 599]
