title,score
My local humane society posts pictures of new adoptions. This one makes me so happy.,10813
This cat is prettier than most humans,7128
"My golden retriever made friends with a baby fox today. After I took this picture, they took nap together.",6464
kittens activate a vacuum,6151
Our dog is really good at balancing things on his head. Name a common household item for him to balance!,6110
Baby Polar Bear Learns to Walk,6037
He is crying because he thinks he is locked out ... Dumb as a brick but he is mine and I love him.,6007
So there was a baby jaguar at my gf's house,5966
Bow-ties are cool and cute!,5618
Someone left this little guy at the subway i work at,5501
Surprised Red Panda,5400
"This guy runs in a local triathlon every year with his 13 year old daughter. She has cerebral palsy - he pulls her in a kayak during swim, in a cart during the bike and pushes her wheelchair for the run.",5384
Being followed by this guy in Alaska,4964
"I'm obviously a shitty carpenter, but my old dog has tiny legs and can't jump like he used to.",4920
"Emma Watson to 5 year old boy: Excuse me, are you Harry Potter? That’s great, because I’m Hermonie Granger and we’re best of friends.",4901
My puppy liked the child size chairs at the vet,4886
I fostered several karma machines. Here's one of them terrorizing a dollhouse.,4887
The happiest animal in the world-- I present the quokka!,4886
Getting the best view from our tent,4813
My sister is in Borneo and sent me this picture. Apparently Orangutans don't enjoy the rain. ,4784
Caucasian shepherd puppy.,4771
"A friend painted our dog for us as a wedding gift, how do you think it turned out reddit?",4660
I live by the beach and this little guy just popped by for a visit,4642
"After a mother chimpanzee who lived in a zoo died, one of the zoo’s employees took the baby chimp home to care for it. It never crossed his mind that his dog, who had recently given birth, would adopt the chimp and raise it with her pups",4605
This is what bored dads do.,4541
For anyone who was wondering how the mustache puppy looked almost all grown up,4529
He doesn't even care if you turn the water on.,4505
My 100 year old Grandpa and his 17 year old cat,4499
A secret and labor of love 13 years in the making,4482
She likes to sleep in the bowl..,4463
"47 Years of Marriage, still buys her flowers every Monday.",4460
I didn't know they could do that.... ,4403
"Pike, a 30 year old Polar Bear had 10 tons of snow gifted to him on his birthday in a California zoo.",4355
Prepare to be overloaded ,4249
My Finnish Lapphund on a windy mountain top in the midnight sun.,4213
At Petco the other day looking for food when I came across this dude who just came out of surgery.,4203
Some affectionate Sled Dogs,4188
My daughter and her guardian. (was told by /r/pics this belonged here),4185
I recently realized that my 6 year old sister has been modeling our dog and taking pictures of it on my camera,4164
Just go and look they said. You don't have to get one they said.,4121
My dog's favorite place to sleep,4122
It's my ball... mine.,4109
My laptop snaps a photo of the person that wakes up my computer...,4103
"Unlikely aww, a baby musk ox",4098
"My friend just went to pet cats at our local animal shelter, and found her cat that had been missing for over a year. ",4055
Wake up daddy,4054
Husky/Retriever Mix,4045
Russian Winter Kitty,3948
"My friend works at a dog grooming spa, she turned around and saw this happening.... ",3917
"Whenever we catch him doing something bad, this is his go-to position to butter us up. He thinks he's so damn cute.",3917
"My new panda bear, Jax",3882
Too much cute,3890
FB friend went to the woods for pics....FOX!!!!!!!!!,3884
Gentleman,3887
boop,3865
How real friendship looks like,3835
This dentist brings his dog in as a way to calm the nerves of children who may be nervous. So great.,3802
"I have a delivery of, uh, a box full of warm? ",3800
My Uncle's dog stole his granddaughter's pacifier and sent this ,3712
"We had to take ""his seat"" out of our van so we could fit a dresser in the back. He has been sitting like this, waiting to go for a ride for the past 15 minutes.",3699
"Every morning my grandmother feeds this squirrel a peanut, so every morning it shows up at her door. This was him today.",3671
He's Pretty Popular With The Chicks,3650
Annnnd nope,3640
Simply Amazing!,3635
It's not hard to be helpful,3621
"On my cakeday, all I want to do is spread awareness of my favorite animal, the Red Panda.",3601
This dog has helped my sister cope with being bullied because of her down syndrome. He's like family now.,3596
My dog after an hour of puppy school. ,3591
"She isn't a puppy, but I think my dog liked seeing the Oregon woods for the first time",3583
Thank you small kind human for this foods,3575
So my friends starfish had babies,3555
"Whenever I'm sad, I look at this guy... He always makes me smile :)",3539
"Girlfriend decided to put a sock on my dogs foot, and my dog seemed a little shocked to say the least.",3510
She puts her paws on her tail when the floor is cold..,3481
I work at a zoo. Have a 2-day-old zebra.,3481
"Our dog made her own lookout on our deck. When it was redone, the carpenter custom measured her a new one.",3479
Odd-eyed Van kitten,3476
New puppy just didn't like the rain,3478
My dog,3456
Fear.,3447
"Her favourite spot, photos taken 3 months apart.",3444
A fleet of foxes.,3439
Mutual pillow,3443
On our way home from the adoption shelter.,3437
Looks like my niece will be sleeping soundly for this trip,3420
Baby goat conquers human,3403
"Went to the Galapagos for my honeymoon, this happy little fellow is who welcomed my wife and me.",3402
A Grandmother and her Cat,3398
FB friend went to the woods for pics....FOX!!!!!!!!! -- the result,3391
This is how my Grandparents cat relaxes. ,3375
Nothing seems to crush the spirit of a good dog c:,3369
Nice catch! (Double aww),3351
"not a typical submission, but saw this guy walking around a pet store enjoying his day",3353
So my car broke down yesterday in the middle of nowhere. These three guys kept me company the whole time,3342
My dog Buster is 13 yrs old and cannot walk a whole lot anymore. My cat keeps him company every night because he cannot come upstairs into our room to sleep. This is just so precious to me. &lt;3,3335
"My friend found a kid falcon starving on her porch last week. Now it's healthy and flies off everyday, but always comes back. Meet hermann.",3331
"It wasn't easy to get this photo, I hope you all like them much as I do :)",3325
A bobcat and its bobkitten.,3313
Puppy found in combat. Then &amp; Now.,3315
All the way down!,3302
My corgi bringing joy to an elderly man whom she met this morning.,3306
Snapped this on my phone in Yosemite yesterday.,3305
"My friend saw on Animal Planet that Golden Retriever's mouths are so soft they can carry eggs without breaking them, so she tested it.",3292
"Due to the flooding in Duluth, MN, several animals escaped the local Zoo.  I ran into this guy late last night!",3271
My new girl enjoying the special bed I had made to keep her toasty.,3261
"My dog has been chasing deer trying desperately to make a friend for 12 years, despite his life long case of arthritis. Today, one of them finally stopped to say hello!",3268
"My dog knows our routine when we are leaving and runs to her ""bye bye spot"". She will give a kiss to the 1st person to leave but always does this to the 2nd person. I guess she hopes they wont leave without a kiss.",3264
It was his birthday,3265
Shady dealings on the balcony.,3240
"At Nara, Japan this morning in the rain - saw this kid sharing his umbrella with a deer... melted my heart :)",3240
Baby bunny nuzzling time.,3237
Meet Toki Wartooth; our adopted Afghan Hedgehog.,3236
They think it's their mom.,3236
My wife and I got back today from a week long vacation. This is what happened when I tried to move the car so I could mow.,3226
Howling lesson,3218
what I got in exchange for an acorn..,3220
This is how I know someone did something bad,3218
"I see that you guys have dogs that are excited to see you when you get home, this is my dog when I get home",3219
Rescued a puppy.. I think my dog likes her!,3211
Here is one of my dogs comforting her sister during a storm.,3205
"""We're friends, right?"" ""Yes, yes, we are."" (incredible shot from a friend of mine)",3214
"Last night, my university gave an honorary master's degree to the service dog who sat through every one of his owner's classes. He dressed appropriately for the ceremony.",3205
"My physio's office is connected to his house. His dogs aren't allowed past this line, so they wait here patiently trying to lure people to give them cuddles",3206
I found 4 tiny rabbits in a hole next to a dead rabbit... I bottle fed them 4 times a day for 2 months.,3202
"My friends new sheep, Elmo. Seems like a pretty happy lil guy.",3196
They see me rollin',3203
This is how koalas run,3195
Arctic Fox Pup Calling,3199
"''What'd you do today?'' ''Not much, just saved some baby ducks.''",3195
My friend's parents raise deer for a living... This is ridiculous.,3186
My dog is a little happy about meeting my new puppy..,3192
My son and dog's 2 1/2 year friendship,3175
This girl lives next to me. I pet her one time and this is what I come home to everyday.,3176
A True Friend...,3172
I took over 1000 pictures in Greece and this is the only one anybody wants to see.,3159
"My aunt's picture of ""her men working on the new sail"" ...",3153
"Left my baby husky alone for a minute, and I come back to this .",3155
"Well, that's a waste of twenty bucks.",3158
Saw a kitten run through my backyard and disappear behind some bricks. Looked over to find this...,3153
This little guy followed us for 35 minutes. He even managed to climb at the back of the kayak.,3159
She was always praised as a puppy when she smiled for pictures so now if Shadow sees someone holding a camera she will stop and make this face,3155
Meet Sanford...I'm two years old and tiny (barely five inches tall full grown)!,3151
My cat should probably avoid sleeping on soccer fields.,3137
Sleepy sleepy,3140
I am a dog-sitter. You can tell which dog's mine by looking for the one who agrees with me on the early mornings not being awesome thing.,3137
My parrot likes to take a bath every day. He looks funny afterwards.(apologies for the image quality),3136
Sweet and Sour,3138
COME BROTHER. WE MUST DIG THE WATER.,3128
The happiest little goat,3114
"It's going to hurt, isn't it?",3111
I didn't know they could do that....,3110
"She begged and pleaded, but in the end she had to take a bath.",3102
"Someone dropped this guy off at the Arizona Humane Society because of its ""unusual meows and markings."" Turns out, baby bobcat! ",3100
The adorableness of baby meerkats. ,3098
They do this every day,3100
"My cat, Batman, came to us a stray around 5 years ago. The other day he came back with this little guy in tow. About 99% sure they're related.",3100
My GF works for an airline. Part of her job is comforting puppies who have to fly alone.,3095
A deer wandered into my front yard. It stopped to watch my neighbor's little dog. My cat stopped to watch the deer. I stopped to watch my cat.,3087
An orphaned puma kitten that was rescued in the Amazon,3080
"Came into my room with this guy sitting there all like ""sup?""",3087
LOOK IT IS A TINY HERD OF OWLS,3086
Cute dog copies owner.,3079
Pup Holder,3073
"Let me clean you... oh sorry! Here, I'll make it feel better...",3079
A 6 month old baby kangaroo I am raising is very impatient at bottle time....,3075
This is what happens when I cross my legs while sitting down.,3076
My sister came to visit and she brought her dog. I couldn't find him for a while and here's why.,3060
"We followed a truck full of Golden Retrievers 8 miles, when they stopped, joy ensued.",3071
"I was eating some bread, when suddenly...",3057
Kisses,3058
Our long-haired Persian cat had most of her hair shaved off. She's still having trouble coming to terms with it.,3055
Look what i woke up to this morning,3049
Not a cat or dog.. but made me smile ,3048
"Born without the use of her hind legs, Lola learned to walk just fine",3049
"Every time I leave the house, I spot a rabbit hanging out under my shrubs. Looked closer and found this!",3049
"She was yelling, ""auntie he's squishing me!"" I look back to find him completely content.",3045
Running of the bulls,3045
One day I would like to be this happy.,3044
Done for the evening.,3043
Hug?,3040
Probably the best picture I took of my dog. ,3035
"After sending off my husband's ship for an 8 month deployment, a flower delivery to my office turned into the sweetest thing he could've done for me...",3036
Look who we caught cuddling at the Zoo...,3036
"Hey Baby, why are you sad ??",3035
"this dog has pulled a sled at least 25,000 miles, that's more than a lap around the equator. His name is Armstrong",3024
"A section of my fish tank broke yesterday, causing a corner of my house to be lit up by rainbow colors. My cat Bailey decided to sit in that corner and became....Rainbow Cat.",3023
"The family I babysit for has a puppy, I think he was trying to bribe me with gifts to let him inside.",3028
Poor dog's terrifying first train ride...,3025
This is Radar.  Someone cut off his ears and I adopted him after his recovery.  He still loves his head to be scratched.,3023
"My friend's new puppy is so little it can fit through the spaces in their backyard fence and escape, so this was their solution.",3013
"This little guy was stuck in a football goal net, was freed without injuries :)",3004
My cat's new favorite thing to do is lovingly watching a live feed of golden retriever puppies.,3004
At least someone's having fun after the hurricane,3005
True Love,3008
He must think he's a lapdog.,3005
"Delilah, blind from birth, listening to my voice.",2992
Orphaned pony's best friend is a teddy bear called Button.,2997
How my cat Refurb accidentally raised nearly $1000 for charity,2996
"I was just joking with him, but the look he gave me was complete betrayal.",2994
Fennec fox,2993
"Tore up an old shed in the backyard today. This fellow wanted to watch, apparently.",2990
"When she comes home from a long day at school, having a bad day, been told off or sad... She cuddles her best friend.",2981
This is the face the river otter gave my girlfriend when she ran out of trout.,2985
"Meet Patrick, the world's oldest wombat.",2982
How I found my dog after discovering ripped up paper towels in the kitchen... He couldnt look me in the eye,2978
He likes to surprise me whenever he can.,2976
He sat and watched me eat Chinese take-out for half an hour. Then this happened..,2976
"Gophers line the city sidewalks after a flood in Alberta, Canada. June 2013",2976
Mountain bluebird,2972
My mom just moved from Seattle to the midwest. Her dog is discovering a lot of new things.,2969
Little lion looks nervous during his check-up,2966
Paying bills at comcast when I meet this guy.,2967
A soft landing,2972
Saw this little dude snoozin at the zoo this morning,2968
Our kitten loves to snuggle into my hoodie when I'm not paying her enough attention.,2961
Friend took his new puppy to the beach. It just dug a hole and fell asleep. ,2966
My own angry bird!,2964
My new best friend,2964
Best friend nap after rough housing all day,2966
My dog is more awkward around girls than I am.,2955
18 months later and he still sleeps with his duck.,2952
"I told my friend her brother's new kitten should be named Upvote, but she didn't get the reference.",2949
There aren't enough foxes on r/aww.,2958
Cat and fox are best friends,2946
So I got to play with an Arctic Fox a few weeks ago in Norway.,2939
Baby seals playing on the beach,2947
She makes that face just as I reach out to pet her,2940
"My wife told my daughter that the kitty was hurt(arthritis) and to be careful with her.  Daughter: ""Ok I'll read to her""",2948
"Mmmm, carrot :)",2943
"""Don't take him! HE'S A PART OF ME!""",2941
"My cousin's rabbit just had 8 little bunnies, thought I'd share a picture of one with you guys",2932
It was thundering and she started shaking. She stopped when I put her in the anti-thunder fort. :),2923
You know your dog is getting old when he falls asleep begging for food.,2931
Hey you tired? I'll be your pillow [X-post from r/gifs],2927
"I present you with my best buddy, Bevo.",2926
Godzilla!,2922
Three different reactions to bath time,2924
The top photo is my welcoming committee when I take out the trash. The bottom photo is a reminder that we have a blind dog.,2926
Newborn baby bison at Yellowstone National Park,2919
Little red fox likes to sleep on my doormats when it's cold outside!,2918
"My cat took my spot on the couch, so I decided to annoy her enough to get her to move. We are at a stalemate.",2921
My Dog uses my cat as a pillow....,2917
My kitten hugs himself when he sleeps.,2911
Just an elephant...visiting a sea lion.,2909
A friend works at a summer camp and found what was scaring campers,2921
Owl Burrito,2916
So our dog has taken to our new baby rabbits. Here she is looking majestically over them.,2913
Brought my new puppy Charlie into work the other day. Had to follow the employee dress code.,2913
accidentally captured a sunrise wedding proposal this morning at Bondi Beach in Sydney,2915
"Years from now, when they're teenagers and hate each other, I'll show them this picture.",2907
Tibetan Mastiff,2911
Baby chameleons,2907
Saw this while walking through a small town in VA - it's nice to know that someone is looking out for all the pups in this summer heat.,2913
Its hard to get ready in the morning when this is happening...,2912
"Bagel the bengal, destroyer of boxes",2902
Let me pet you,2907
So my cat likes to look out the window.,2903
I was working in his neighbor's yard. He kept climbing up and nudging the ball at me. How could I deny him?,2905
Someone is a little shy. ,2903
5 little puppies belonging to my friend,2893
Saw a baby seal on the beach today,2897
My wife made a Chewbacca teddy bear for our baby boy that is due in May.,2896
Girlfriend's puppy fractured his leg jumping off the bed. Hes not too happy about it either.,2898
Four chubby fluff-butts! [xpost r/DelightfullyChubby],2900
Meet Snooty. He turns 65 in July.,2889
"Pike, a 30 year old Polar Bear was gifted 10 tons of snow for his birthday in a California zoo",2900
"My Husky gets in the shower with me everyday...he brought his penguin, Frank, to the party this morning.",2895
I took her for a little walk to go get the mail. She made me carry her back.,2895
Walking across lily pads,2890
"After four days of searching, my brother in-law found Duncan after being lost in the woods.",2886
I love it when puppies play like this (gif),2887
Took him on a charity walk but he didn't make it very far,2879
Otter mom carrying her snoozing baby cub ,2883
stopping to smell the flowers,2882
I work at a doggie daycare that sells dog cakes. A client sent us this picture of their dog.,2880
Chronicling the growth of my shoulder kitty.,2884
"I volunteer at a Wildlife Sanctuary (England); Meet Raven, one of our tame foxes!",2887
Hop!,2880
A Happy Cat,2887
Moms in nature....,2874
^_^,2872
"not too familiar with aww, but figured this belonged here.",2880
He wouldn't stop eating the sand,2867
Careful kitty,2870
Came across a 150lbs wolf dog,2877
"Her name is Audrey, she is the smallest kitten I've ever seen, and she fell asleep in my roommate's pocket like this. Looks comfortable.",2868
"I take one self portrait per day with my dog. Since reddit seemed to love this last time, here's a few more while I'm on break. (Originals included)",2873
I can't tell who is more comfortable.,2866
Why my dad loves being a veterinarian.,2871
My friend's new puppy doing its first howl,2869
"She might be 13, but she was letting me know how much she loves the snow today. ",2872
"My friend from college raised a raccoon. 5 years after she let him go into the wild, he still comes to visit. Meet Bandit! ",2864
Porpoises make bubbles,2861
Cuddle Attack,2861
This little ducky wanted to be like the flamingos,2867
"Play with the lion cubs they said, it will be fun they said!",2864
"Meet Inigo Montoya. Born in the middle of Movember, and rocking that handlebar from day one.",2858
Kitten notices hand and promptly takes action.,2858
Misha the snow leopard &amp; her mom at the Detroit zoo.,2866
I couldn't keep a straight face with this dude looking like he was cheesin super hard,2851
Guide dog meets a friend at Disney world,2856
I found a duck that doesn't like rain. He pecked at the door for over an hour wanting to come in!,2850
"Living alone in Nashville, I used to wake up every morning to this gal (she's wild) squawking for food at my back slider. One morning I serenaded her with my guitar. The next week she made a nest and laid eggs on my patio... I named her Greta....",2851
Meanwhile in my friend's kitchen...,2859
"Found this guy at about 13,000 ft, on Colorado's Mt. Bierstadt. He followed us for about a mile.",2853
My New Beach Buddy!,2851
Apparently Flynn the cat stands up like this all the time...,2858
"Surprise! Dog, what you doing? Dog..dog...dog...dog...DOG! PAY ATTENTION TO ME!",2854
Went to clean the pool this morning.. This little guy's a trooper.,2848
This is what you get when you cross a dachshund and a golden retriever.,2846
Snow leopard cub,2841
"My cat turns 20 this year. My friends say she is a ""forever kitten"". :)",2846
It was just for fun at first but now he runs up to it to be put in it.,2840
"The face that made it hard to work today. She was in pain, so had to stop several times to love on her.",2848
My dog gives me annoyed looks when I throw the ball too far,2844
"My dog is 14, and has had this blanket since he was a puppy. When I finished washing it to put it in the dryer, I left the room to answer my phone. Came back to this",2840
My dog tripped up my dad while playing catch in the backyard causing him to fall and fracture his tibia and fibula. He has been waiting at the front door for hours like this waiting for him to come home from the hospital.,2846
"My friend got new cat and her dog adopted her immediately, they always sleep like this",2839
"So my new rental home has a doggie door, didn't ever think to lock it. Today came home to this on my couch.",2835
A golden retriever and his unusual friend! [x-post /rgoldenretreivers,2836
"Shame, this is what it looks like",2839
Owl and Owlette,2831
A photo one of my good friends took at a zoo... Priceless moment!,2838
Water was set out for the dogs to drink after a doggy marathon. He was the only one to do this.,2835
My friend is looking after a meerkat and took this photo of her enjoying some sun with his dog :),2839
The eyes says it all,2833
Rescued baby Pangolin. Cutest armoured critter.,2835
A woman that owns a zoo came into my friend's salon today...,2835
It Was His Birthday,2828
Snapped a photo yesterday of a surprised Chipmunk with a mouth full of peanuts,2827
Baby ladybugs hatching in my garden,2824
What I saw when I finished mowing the lawn yesterday,2820
Adopted a cat from the shelter last weekend. It looks like I made the right choice.,2822
Not ashamed of the cone of shame :),2826
My kitten has a crush on the neighbor's cat and waits patiently for him to return when he leaves the windowsill.,2814
I thought my dog would eat the kitten I found yesterday. I was wrong. I had to make an account just to share this beautiful moment.,2825
Just another adorable day at my awesome dog-friendly office...,2816
My miniature husky puppy napping in an over-sized bean bag.,2811
The goat kept ramming the W.A Policeman for 10 minutes while he talked to the owner,2815
I met this little guy in Mexico City,2810
A baby dugong rescued in the Philippines,2802
Every night at around 9 my cat tucks himself in and waits for my mom to get into bed.  He usually lays with her this way for about an hour.,2804
Growing up with her turtle,2809
This little guy was sitting patiently on my shoe when I took a break from hiking in Colorado,2799
My beagle on a very windy day at the beach,2802
My stalker at work,2799
"She is afraid of the real ones, but she loves this one",2800
So my friend got to play with bears today,2797
Best part of my day.,2786
My little brother &amp; his dog Fergus. ,2792
"Anakin, the two legged kitty, playing.",2790
My white german shepherd when he was 1 year old.,2788
Corgi trying to leave the tent,2790
The sweetest friendship ,2789
I have to use a decoy keyboard to get any work done.,2787
Lurleen the cat nursing orphaned week-old pit bull at Cleveland animal shelter,2787
The cutest couple,2785
Look what cuddled up to me :3,2782
"Like father, like son.",2790
She is very protective of her ducklings.,2781
It was my dog and her sister's birthday today...,2784
My friends cat adopted some baby rabbits.,2783
My friend's puppy's head is too heavy for his body.,2779
MY friend's dad took this picture,2780
Squirrel kissing a Kitten,2779
So this is what happens now when I don't lock the door when I take a bath.,2776
"This guy built a custom side car for his Chocolate Lab, I see him all the time, He's awesome...",2773
My dog has a useless talent.,2768
This little bunny looks like peter rabbit,2780
Cat Somersaults,2776
My friends dog found a broken battery operated toy in the snow. She thinks it is a hurt animal and has been trying to help it.,2770
Saw this guy Sleeping in a Bodega in NYC.,2774
New roommates are creepers. I need blinds.,2769
Not ashamed of the cone of shame :),2765
Couldn't pick a better spot for a nap if he tried,2776
Baby geese leave the nest for the first time,2769
"This fox's name is Kuzya. He lives in Kronotsky nature reserve, Russia.",2774
Bodyguard! [X-post r/corgi],2767
The lemurs at the Duke lemur center got cupcakes yesterday. Then this happened.,2770
These guys like to keep an eye on me while I work,2770
