title,score
3 musketeers,2533
"Franky, my new baby cat",2530
My pup got a little crushed on the ride back home last weekend...,2528
Chun-Li,2532
My wife is 8 months pregnant now.... This has been his favorite hangout for last 3 months.,2533
I have a large dog. Meet Kuma,2527
"Doing an internship at a seal hospital, this little guy is 1 week old and abandoned",2525
Harley meeting Jack for the first time,2528
What friends are for,2529
This is my best friend,2529
Zoey loves playing bubbles,2530
My friend found this little guy terrorizing her chickens this morning. He doesn't look so bad to me.,2525
Silly and serious.,2527
"I think, eating all of his food made him tired.",2533
"It took a while of trying, but she finally stayed still long enough for me to get the shot.",2523
"Decoy keyboard, success!",2525
Penelope the hedgehog in her new pink tent!,2521
He just wants the cats to like him so bad. :(,2521
"My friends dog, Henry.",2522
I swear she thinks she is a human child,2542
"We just got a new kitten, needless to say she's taken a liking to our dog.",2525
Retreat!,2525
Paralyzed dog runs for first time!,2529
"George, dealing with a real low point in his life.",2525
Can we play in the puddles?,2521
I promise you will grow into those ears…,2524
My dog has only-child syndrome and I think he's devising a plan to get rid of the new kitten..,2523
-What?! -No.. nothing,2525
This is my friend's burrowing owl Archimedes.,2519
Puppy sized bear,2522
"We also got a new kitty, except our dog likes to lay on him.",2525
"Meet Otto, he is 7 weeks old, and he is a farmer.",2520
Interning at a wildlife rehab center this summer allowed me to work with baby hares smaller than my hand.,2524
My kitten and niece's first time meeting. She insisted on wearing cat ears and a cat shirt to help break the ice.,2515
This little lady was living in a hollow tree on my property,2523
She has had this bear for 2 years and carries it everywhere. It's the only toy she won't tear up,2521
We were really worried that our cat wouldn't like the new kitten,2519
I see your Chocolate Lab in sidecar and raise you this.,2522
Gaming buddy,2520
A little girl with a big Irish Wolfhound,2519
"My dog has a pet rock. He doesn't bite it, just paws it around and hangs out with it. Only this rock, no other. Video in comments.",2516
Just in case they get cold.,2516
Just adopted from the local shelter. That smile!,2524
Fred hates the snow and really wants to get back inside,2521
I don't know how you'll feel about this...But I found this next to my sleeping son when I got home from work at 2am.  I don't cry often.,2512
I asked my mom how my dog was doing in Florida. She responded with this,2521
"Never let go Rose, never let go...",2520
My friend found this little fella outside work,2520
Been looking around the house for this kitten.....,2518
He slept like this for half an hour,2520
Animal Control officer cradles a dog rescued from a suspected dog fighting ring. He looks quite happy about it. ,2524
Mom Hug.,2515
My friends 3 month old big ears rabbit,2520
She came up the stairs but is now afraid to come down..,2518
He begged and begged for some playtime but grandma was too tired,2512
"I always told Nala that the neighborhood dog was too old for her.  But whenever he visits the yard, they are attached at the hip.  ",2519
We took our new dog and our very old dog together on a boat - complete with puppy life jacket!,2511
I think I need a bigger bed ,2519
My neighbor found a stray cat the other day and was worried about it getting along with her dog. I would say they are doing just fine. ,2516
Adoption kicks ass,2515
"Hey, pet me!",2513
"This fawn and bobcat were found in an office together, cuddling under a desk after a forest fire",2516
Loving family.,2512
Don't look at him,2511
My lab looks like a black bear when she lays like this,2515
I found this little guy on my walk back home,2514
Dog Fetch's a Stick That Has a Go Pro Camera Attached,2515
This happy girl will be 18 this year,2514
My Siberian Husky Turns 17 Today. Still Going Strong!,2511
Introduced new to old. They seem to like each other.,2513
My sister is under a lot of pressure to start a family. Her mother-in-law sent her a box of baby clothes so her husband immediately put them to good use.,2514
Took our cat for a boat ride and surprisingly enjoyed himself,2511
"Jub Jub and I walked by the balloon artists... He stopped us and said ""I must make you..."" and then he handed us this little guy!!!!! Made my day!",2510
Efforts to keep Mia out of the cupboards = ineffective,2507
Open the door!,2512
My guinea pig's stunt double is this butternut squash.,2513
I recently bumped into a group of overly friendly deer while out photographing some fall scenery. This guy in particular loved my camera.,2505
My Cross Eyed Kitty&lt;3,2510
"After removing enough fur to make another dog, she looks exactly the same",2511
"Gave Neighbors barking dogs cheese, made friends for life. They no longer bark at me, they beg.",2514
Wake Up!!,2514
This is Boston. He loves his Teddy bear. He carries it everywhere and cries if you take it away from him.,2511
The RL version of Garfield and Odie,2513
"My dog may forever be remembered by Reddit as the dog hit in the crotch with a tennis ball, but on her 8th birthday I wanted to share with Reddit that she is so much more than that. Happy Birthday Grayce!",2505
Went to grab a water and almost pissed myself,2503
Moved from the city to a cabin surrounded by 200 acres of woods. My cats reaction when first looking out the window.,2511
Baby Otters So Cute.... :),2507
boop,2502
They won't get along they said. She's going to eat him they said.,2505
New puppy or teddy bear?,2508
"HAND, pet me.",2504
This is what I woke up to.,2504
"I rescued a doberman from a very rural shelter only to find that she was pregnant. Here is their weekly photos from birth to 10 weeks old, when they all got adopted. ",2507
He's a happy cat,2606
Rescued Tortoise Cuddling With Rescued Dogs,2502
My weiner dog kind of looks like snoop.,2505
Life is full of difficult decisions.  ,2501
Our birthday boy!,2499
Thanks for not letting my ears get wet.,2497
My 90 lb golden likes to be held like a baby...,2503
A friend of mine stumbled upon a foxhole on campus!,2505
"Dog was barking, and I came out to see these two crawling along our fence",2505
My dog and my bf's cats sharing the cat tower,2503
A cat at my local shelter was super happy to go to his forever home with his brother.,2494
Action shot!,2504
Guess this is his chair now,2501
"""Whatcha doin?""",2504
Cold meerkats at London zoo!,2499
It's freezing in Montreal and this cat and her kitty have taken refuge in my parent's solarium. My dad found an ingenious way to keep them cozy.,2498
Give and Take,2495
"Corgis, roll out!",2494
What I see when I am getting out of the shower,2497
You bought me flowers!,2493
"Scared by fireworks, our dog was really determined to stay next to Daddy",2500
Blue heeler family portrait,2494
"Listening for any of the key words: frisbee, walk, outside, treat",2494
I don't like losing my chameleon. Problem solved.,2490
"My friend's pup was grumpy, so she turned into a platypus...",2498
Went to take a picture with my kitten....,2489
This looks really comfortable,2498
There is a definite lack of Puffins on reddit,2494
"My kitten recently broke both of his legs, this is him in casts, leaned up against his bed watching birds on Youtube.",2495
Your face is soft,2494
Look what I found.,2489
Sweaters for Penguins Affected by New Zealand Oil Spill,2488
He was so upset he had to stay outside while everybody ate...,2494
So my kittens are learning to drink from the water bowl..,2486
Bilbo the 8 week lab mix hanging out on the couch,2487
"I don't know what they did, but I've never seen more guilt on either of their faces...",2495
He fell asleep like this,2492
My parents visited me at school this weekend and brought my new puppy. Little guy kept falling asleep everywhere,2490
Cozy and warm (Malamute son and mother),2492
My daughter's favorite spot to hangout is in the picture window with the cat.,2497
Bunny spooning...,2493
Service dog in training at the grocery store,2497
Day dreaming away,2487
How my cat Dave was laying. He does this all the time!,2493
Checking up on junior,2487
Tennis balls used at Wimbledon are donated to provide homes for endangered Eurasian harvest mice.,2485
My old girl :),2488
Daughter wanted stuffed puppy in surgery with her - nurse suited him up.,2485
So I went down to my friends kitchen to find their new puppy just chillin out!,2486
Here's me wearing a dejected kitty hat,2486
My mom's capybara loves my cat.,2485
"I'm in your zoo, messing with your otters!",2492
Adopted a blind puppy and his brother to guide him around. They have been inseparable. Meet Booker and Tiberius.,2486
I work at a zoo; these are our boys,2489
"It's okay if I get too sleepy at the park, Mom will carry me home.",2488
This guy walked into the firehouse today and hung out with us for a few hours.,2485
My friend's cat and dog like snuggling.,2489
"Slow down guys, I'm coming",2485
"First time meeting, guess who's more nervous",2482
"My friend's cat has a tough life. Yes, that is a tiny handmade couch.",2490
Bantam Chicken,2486
My dog isn't the best at going for walks.,2480
Boss is complaining about the lack of productivity today. I think I know the cause...,2479
Lions can be cute too,2486
My brother's husky likes to hold hands ,2484
It was raining so these two foxes took shelter on my welcome mat,2481
So I'm raising two orphaned lambs in my house,2484
Every morning when I step out of the shower...,2484
Friends just brought this little guy home!,2477
"She slept like this, it's hard not to smile back",2478
Firefighter with a respirator resuscitating a mama cat while her kitten looks on. Eyes only slightly watered,2481
My girlfriend has a family of foxes living under her porch!,2480
"If ever a Great White looked cute, this is it.",2478
Life imitates art,2483
I had surgery on my achilles and our puppy associates my crutches with me. So here's a photo of him finding comfort near them.,2476
they said i could be anything so i became a greyhound,2476
My vet friend rescued a abandoned baby mini horse. ,2476
Best Friends Since 1997,2479
Clever girl (gif),2480
Giant purple Indian squirrel,2479
"I'm going to bring my owner a newspaper, owners love newspapers",2484
A soldier and his squirrel.,2478
This guy met my pup. My pup planted one on his cheek. My heart melted.,2479
Need a pillow?,2478
This beer has a lot of hops,2481
Owner makes disabled fish a life jacket to prevent him from sinking to the bottom of the tank (story in comments),2475
She knows what she did.,2480
Sisters.,2471
Howdy neighbor,2476
Let me just calibrate my cat,2480
"woke up to see these, a fox and his cubs playing in my garden",2476
She smiled for a picture!,2474
My dog is always too happy when his feet are in the pool.,2473
"Started working as a dog groomer from home on weekends. This was my first dog, Enzo.",2472
"Just adopted my very first dog at a rescue shelter. Half Shiba Inu, half Siberian Husky. She aint a puppy but still... meet Yuna!",2472
Found this little guy in the garden,2471
