title,score
My friend works at a bird of prey rehabilitation center. This morning she woke up with this cutie on her chest.  ,2769
My housemate's puppy looks like a polar bear :),2769
He was so tired he had to be carried home,2764
"Saw this at the Barber yesterday. When the stylist asked him why he had his dog he replied, ""he's my best friend, I go with him to get his hair cut and he comes with me to get mine cut.""",2774
Dog &amp; Butterfly,2764
"found a baby cottontail in my yard, he wouldn't leave my side",2766
My friend heard scratching behind her apartment wall...,2764
Shooting a movie in friends backyard and this big guy kept popping in and saying hello,2772
Caracal kittens,2767
I should buy a coat,2762
Jerry (rescued from kill shelter) loves to smell flowers,2763
Comfort dogs arrive in Boston to help the victims,2758
Lonely little guy,2759
The newest addition to the ski patrol,2761
"It starts to rain, owner photographs her cat's reactions first before opening the door",2763
Animals that can't process what's happening,2756
"Most posts to r/aww are of loveable and adorable animals, unfortunately my cat isn't like that.",2759
 bears first climbing lesson ,2755
Wolf Puppy,2752
I've got a houseguest for a few weeks.,2750
Thankfully my dad found them BEFORE he started mowing,2764
Cutest stranger I've ever met,2755
SNIPER! GET DOWN!!,2755
My marine buddy swept roads for bombs in Afghanistan with this pup. They gave him custody of her this week.,2752
My Old English Sheepdog before and after his haircut,2749
"After 13 days lost, my stepfather left his coat out where she was last seen. At sunrise, she was found sleeping on it. Welcome home, Emma Lee!",2751
"Stay right here guys, I'll protect you.",2749
An albino lion enjoying a smooch,2747
"""I did something bad.""",2749
"The sun, kids, and pool were just too much for Nala. She fell asleep on the stairs like this when nobody was looking.",2746
Just like Mommy,2747
My 25th birthday present was wolf kisses.,2750
I met a domesticated fox at Petco today. Her name's Foxy Lady. ,2744
"Now, armed with his new name, Bo-Bo has taken to climbing bed comforters and waiting patiently for everyone to wake up.",2744
"Silly foal, you're not a puppy! (x-post from /gifs)",2746
My Dog and My Girlfriend's Dog Face-timing.  They weren't amused.  ,2739
Lion feets,2740
Tool-Using ,2734
My dog likes the snow,2737
He's sat on this chair since he was a puppy. I guess he doesn't realize how big he's gotten...,2731
Abandoned baby squirrel ran up my leg and lived in the hood of my jacket until I passed him on to a trained wildlife rehabilitator.,2740
Appreciating nature. ,2738
BANG! I'm dead! ...Am I still dead?,2737
Wet corgi in a life jacket. Tobias enjoyed his first 4th of July on the lake.,2734
"When I Reddit from my phone laying down, this happens on top of me...",2732
My puppy's first time sticking her head out the window resulted in pure ecstasy,2734
Steve Irwin and his wombat,2733
"Not quite, my friend",2729
Adopted orphan lamb,2734
A young bird flew up to my friend and I managed to get this photo before we let it go,2735
Some Baby Caracals  ,2737
Yin and Yang puppies,2725
Mother duck &amp; her ducklings going through the White House metal detectors,2732
"""ball, ball, ball, BALL!!"" - Corgi",2739
At least someone is happy about the first snow (Sweden),2727
My nephew and pet bunny on his computer,2731
"My wife hates it when I hold him like this, but he doesn't seem to mind",2727
"My son and his puppy, friends for life.",2727
That moment when you find out your cat is a better skater than you are.,2725
So my friend rescued this moustache from an animal shelter;,2727
So my cat followed me to work last night.,2722
What happens when Dachshunds and Huskies get together,2719
"Yea, she's overly attached... But it works for her.",2719
My wife told me to play with our puppy more. I sent her this.,2723
Just a chilling cat giving zero fucks in a local store.,2720
"I have been feeding a friendly stray cat for months, at work, and today she brought the kids along.",2710
Sometimes you really have to feel for those huskies living in tropic zones.,2719
Baby Clydesdale,2716
My girlfriend volunteers at an animal shelter and this little guy came in this morning!,2719
This couple walk around my block every evening,2712
"""When a man loves cats, I am his friend and comrade without further introduction"" - Mark Twain",2709
my friend and i rescued a scared and stranded pup from the swollen brandywine creek today.,2714
My dad has always been adamant about not having pets. I brought this little guy home expecting a shit storm...,2714
"Go shopping with your dog they said, It'll be fun they said.",2718
This is Sydney. To date she has killed 11 rattlesnakes that have threatened my family's home.,2715
My bosses dog comes and visits me everyday at 1:30.,2712
"Don't resist, fork! I'm taking you with me.",2715
I think my Husky is missing the point of her crate,2713
"Seven homes, three girlfriends, four cars, five jobs, and 19 years ago I got Dax. Happy birthday, old lady.",2707
I love when he does this with his legs.,2710
"I love you, leg",2702
"You guys, my heart just exploded. Can't even process how cute this is.",2712
Couldn't find my dog anywhere until I noticed that there was something wrong with the couch.,2708
So perfect that she looks like a stuffed animal.,2709
Normally my dog sleeps next to me. This night was a little different. ,2704
My kitty puts his paws up on his cheeks when he gets petted. He's 15 and his name is Sebastian. ,2699
"One day, I'll be a big scary cheetah, just like mom",2702
Older daughter wanted a kitten. Younger daughter wanted a puppy. I said no. Now we have this.,2702
I will sit...riiiiiiight here.,2707
"My dad said ""I asked for a puppy, not a bear"" the first time I brought him home.",2704
Caught a picture of this guy before his mom showed up and the two took off,2703
She thought we were leaving without her,2705
Shiba puppy playing with a pool of water,2697
My 1-eye'd Scottish Fold would like to say hello to reddit!,2698
My pastor's groundhog that he rescued is adjusting quite nicely.,2691
Little hippo in a tub.,2694
Pitbull Fight,2695
Baby squirrel after being fed a treat.,2692
Frank ran across the street. Frank got carried back home,2688
My neighbors have an 11 and 7 year old that love to come over and play fetch with our dog. My dog loves it equally as much. This is her staring at their house waiting for them to come out and play.,2696
Jessie dosen't like to share with her sister,2692
This little guy's training to help the blind,2695
He's not very happy after his bath.,2684
My friend had to hide the catnip cigar due to level 10 freakout,2683
Always nap with a buddy!,2685
There's a bug on the ceiling. He's been like that for almost 5 minutes.,2686
I have never seen a baby dolphin before in my life,2688
"""If I fit...""",2684
Little Inuit girl and her husky. ,2685
Started watching a documentary about bears on Netflix when my cat looked up at the tv and then shot off the couch like something stung him. He never looked away for the entire hour.,2689
"A homeless man in my area only had his dog left and someone took him away, good thing the community saw how much he loved him.",2685
One of the many reasons I love my job,2681
These are the dogs i'm watching for the next few weeks,2682
One of my sister's newest rescue stories.,2688
My girlfriend's pet has his own pet,2678
Got to love a baby Booby,2678
"Chin up, little buddy.",2678
Baby kitten i found in my back yard.,2680
Husky/Retriever mix.,2678
Baby Lion Proud Walk,2678
Bathtime!,2672
This is Penny. She lives in the hotel I'm staying at. This is how she waits in the lobby to greet the guests.,2673
Here's a picture of a lynx kitten,2672
"Our dog was looking a little sad in his cone of shame, so we thought he'd look better as a sunflower",2673
This stray cat asked politely for some of my food today,2669
This was supposed to be a cute picture of my GF and puppy cuddling..,2668
My wife is a Vet Tech. She just text me this picture.,2672
I was laying down because I didn't feel well and my dog wanted to join me under the pillow,2679
I'd Call It A Successful Day At The Park,2666
This little guy just looks too cute while sleeping.,2668
Baby white Lion and Ocelot,2670
morning glory,2663
"He killed the beanbag, apparently it attacked him first...",2668
I asked my friend how my dog was getting along without me for the weekend. This was the response.,2665
My friend was worried her older cat wouldn't accept the new kitten,2671
RELEASE THE BUNNIES!,2666
Today I visited a cat cafe in Toyko. Was definitely not disappointed. ,2668
My favorite puppy went to her new home and I was worried how she was......got this the next morning. I think she's fine.,2665
"Little guy trying to play dead.. His mom and him were crossing the street, mom jumped off the road and this little guy just laid down.",2665
Intruder detected,2668
My girlfriend's dog hates thunderstorms,2666
Just let me get comfy!,2665
Firemen at a Houston department give a stray dog a bath after it walked into the station this morning!,2662
Proud Parents of 10 Little Golden Retrievers :) [Fixed - Link Is Now Working],2662
I'm not sure everyone likes the new apartment as much as I do...,2657
My pug loves to carry around toys everywhere he goes.,2658
Look who was sleeping on my Dad's porch the other morning.,2661
We bought a new bed for the dog. Came back to find this. ,2660
"Here /r/aww, a logo for you!",2662
I fell asleep on the trampoline and woke up to this.,2659
"Bobcat kitten and 3-day old fawn take shelter together after the Jesusita Fire in Santa Barbara , CA.",2654
Tiny turtles,2652
Heard my pup crying. I guess he forgot how he got in there. ,2655
It's my husband's birthday today. This is the first thing he saw when he woke up.,2648
Soft fluffy therapy dog at the Boston Marathon runners' bag pickup area today,2653
My dog in his younger days.,2653
Lion Cub and Meercat,2654
"I gave up a lot to raise my niece, and Father's Day has always been bittersweet for me. This year, though, she got some dust in my eye...",2647
The Struggle,2649
Baby elephant greets his keeper.,2655
Pretty sure our dog likes her new winter boots...,2652
"Started fostering kittens yesterday, this guy tuckered himself out playing with his siblings",2648
My puppy cannot come to terms with the fact that she doesn't fit where she used to,2649
just me being a dog,2648
Wait for me guys!,2649
Lion cub licking the glass at the Omaha Zoo,2652
So adorable!,2650
my adopted dog helps me play call of duty - when i snipe and he sees movement he barks &amp; i shoot... i love him. ,2647
Snooze Train,2641
"She jumps in the shower, regrets everything, jumps out &amp; then cries because shes wet.",2638
Sharing is caring.,2641
"Hello, little dappled dachshund!",2641
Clouded Leopard,2642
A curious Beluga whale,2641
waiting for the vet,2642
German Shepherd Puppy,2645
"I'm a zookeeper and this is my two day old friend, Wilson. ",2640
This little squirrel keeps coming in through the doggy door to hang out with my cat.,2644
Norwegian Forest Cats,2638
The kitten really needs to stop bullying the dog.,2636
Found thus guy at Memorial Day service at military cemetery.,2641
Friend heard kitten cries from within the walls of her apartment.. she fought to rescue them.,2642
"My nephew helping his pet chicken, Biscuit, smell a flower.",2644
My puppy's first vet visit.,2644
This is a bunny wearing a sombrero.,2641
Golden Blanket,2642
Walked in to this...,2640
"All my life I've wanted a dog and finally it's happened! Meet my new husky/shepherd puppy ""Miles.""",2637
It's fluffier than the stuffed animal...,2641
Told my grandma about reddit...I told her you guys liked kittens. She said you might like this photo of her in 1955.,2636
My friend's bunny rabbit loves to explore the garden.,2635
From my Facebook feed: Volunteers form a human wall to guide baby turtles to the sea,2636
"My roommate's cat trying to get in my room, even though I'm allergic to him.",2638
My rainbow cat is less glamorous...,2636
"My 3-legged dog who hates to be left behind, but can't always keep up with the big kids. Also, didn't want to leave his toy at home. ",2634
"I bought him his own bed, he decided to take his big brothers instead...",2631
Just hanging out with Daddy...and being very Dane about it,2633
I guess their swim school is taking place in my backyard.,2633
Worried about his toys.,2636
We're treating this young guinea pig for burns on her feet. I think her bandages are pretty cute.,2636
My Golden Retriever is to scared to jump this ladder that is half the size of him,2630
My kitten's reaction to me blowing bubbles at him,2636
This guy loves playing princess.  ,2634
My cats are brothers and the only two from their litter to survive. They've never been apart and often sleep like this.,2623
My dog used to follow me where ever I went.......... until now.,2632
One of my local humane societies came up with a really cute idea for making money.,2630
The animals have claimed the air conditioning vents,2629
"Little guy decided to crawl up me, and proceeded to fall asleep in my hood.",2629
"Why I love national Geographic, a new species of mouse lemur.",2633
"As a single adult who has to board my dog when I travel for work, these updates are one of the reasons I love the place I board her with.",2631
"We get this doofus a big soft bed, and this is how he uses it.",2623
"Grumpy Old Man, but now I have a friend.",2632
My mom denied my dad a dog for 25 years..finally she relents,2624
Bringing her home.,2622
He likes to be the small spoon.,2628
Elephants need to escape the heat too.,2626
Unusual best friends!,2631
"Adorable baby seals are seriously lacking here, those big eyes!",2624
My dogs Lenny and Carl are always excited to see me grab my flight bag because this happens.,2627
This is my dog trying to fit through the cat door. ,2626
Walked into my room and found this.,2625
Left for work this morning and found these siblings at my front door...,2623
I think he has the hiccups,2625
My deaf dog fell asleep watching out the window for us to get home...,2625
Poor little guy,2620
"""Aren't we supposed to have antlers or something?""",2617
I think it's fully charged,2616
His bear is very important to him,2621
Found this guy in my backyard today,2620
Cute Chubby Penguin,2624
My proud little pup won runner up for best young dog and first place for best retriever. The face. ,2616
My dog is terrified of crossing bridges. ,2621
"baby lamb (just look at its little knee patches, look at them!)",2617
"We just got a letter, we just got a letter, we just got a letter, wonder who it's from!?",2617
"The difference a year and a half makes, for both my cat and his toy monkey",2618
Wife took this pic in front of a gas station. They look like they've done this before,2618
RAWR,2614
Sled dog puppies and mom.,2614
Check out these fluffy ass cows!,2620
Baby puma playing in snow,2616
Some baby foxes,2614
Wasn't sure if our dog would get along with the new cat...,2615
This dog comes to our coffee shop everyday to get a donut hole and it makes my heart melt.,2612
"Oh man, what a difference 8 weeks makes.",2608
A Chimpanzee Adopts An Orphaned Puma Cub,2606
My daughter is home with a fever. Puppy therapy has commenced.,2613
Roommate got a cat. This is now how I take a bath. ,2608
Cat gets a kiss from the vacuum it's licking.(X-Post from r/gifs),2609
Family portrait.,2606
Oh Hey ....whachya readin?,2611
He looks so elegant,2604
&lt;3,2603
A howling Arctic Wolf cub,2607
"My hero Molly, she saved my life",2599
So we bought this cat tower for our cat...,2602
PUPPITY HOP HOP,2600
I like to be near my human.,2604
Gym owner got a new mascot for the gym I go to,2599
A less blurry of the fox that caused so much controversy lately,2600
My friend's dog is adorably stupid,2602
Siberian Husky puppy with a hoodie,2601
When my cat follows me into the bathroom only to realize I'm taking a poo...,2598
Ever seen a baby opossum riding a fawn?,2599
r/aww needs more quetzals,2596
"my cousin's kittens doing an Escher of sorts, but ever so much cuter",2596
"My dog has to touch me when we nap, that way he knows if I try to leave the room without him.",2594
I caught the some teenage hoodlums in my yard this morning. I let them go with a warning.,2591
Too proper to sit on grass.,2592
Adorable Chubby Penguin,2598
Everytime I walk past this guy I have to say hello... I think he's lonely.,2596
Found this little guy today sleeping mid-drink.,2591
"Surprised my 10 year old today on his birthday by letting him bring home a cat from the shelter. His cat was the runt of the litter, shy, and timid. When asked why he picked that cat he said ""I don't know, he just seemed so special."" I think they were meant for each other.",2599
Because I knew she would sit in the same exact spot when she wanted to come in,2598
My dog and his minime,2593
Come down from there and play with me,2595
New french bulldog puppy down the street. Dexter is his name.,2591
Now is my chance!,2589
Had to put cardboard up to keep the baby ducks from getting out still figured they might want to see what's going on. ,2588
"""Lap dog""",2589
Hunter Unleashed,2587
Special Delivery,2593
My aussie's first trip to the pet store,2593
Today this cute little baby GOAT broke into my house in search of grass,2588
Visited Steve Irwin's Zoo today...a Koala just had her baby!,2589
kitten sleeping with its nose above water,2589
BBQ party yesterday. My sister's dog ran around playing for hours. This is the face of pure happiness.,2584
My puppy was watching tv like this.,2612
"My girlfriend and I just got ourselves a puppy, who seems to have figured out cameras already. Meet Annabelle.",2587
"Scout, pretending to be asleep to get closer to stealing my breakfast (look at his left eye)",2588
"Rescued a blind kitty from the streets, I think he is adapting.",2590
Volunteered at the Humane Society yesterday to take pictures of the new arrivals. This little guy was exceptionally happy.,2583
Two years of watching over his younger brother.,2587
RAWR! Fear me...or els...uh...I'm stuck. ,2586
Left my lab with my sister over the weekend...,2582
Posted this big pup a couple days ago and you guys loved him. Went back yesterday and found out he had a small friend (more in comments),2579
This is John. He's almost 40 and has given pony rides to thousands of kids.,2581
Our new baby bunny,2581
My dad sent me this picture of a stray dog he brought home. The vet told him it is a chihuahua pitbull mix.,2585
Meet Gadget! Siberian Husky/Welsh Corgi,2577
Big cats like to cuddle too,2577
My sister has the best job EVER.,2575
This dog in my neighborhood just sleeps like this every day on the sidewalk.,2582
Oscar meeting the neighbor’s baby,2583
Cutest little guy. He's a guide dog in training that I always see on campus.,2580
Britain's Smuggest Owl,2583
You are my human.,2585
"Thanks cat, just in case I forgot where the food lived.",2581
Dog seeing his owner after 2 years,2574
So I left my pizza for all of 45 seconds..,2579
Too hot for windows down in Florida! [OC],2576
Do you guys like Highland cows?,2576
Apparently any size box will do,2582
Dining with predators,2582
The smell of spring,2574
Noms ,2576
Husky puppy,2572
So happy for a cuddle.,2569
If only he had a date.,2570
"Rescued a dog, wasn't sure how my Rottweiler would react with a new dog in the house and then this happened",2579
Adorable. ,2569
wakey! wakey!,2573
"Why my cat, Ridley, always tends to get stepped on when we use our bathroom.  ",2571
"My Great Dane is turning 8 in October, he's the most majestic dog I know",2576
Found this guy hiding on a hike,2570
Words cannot explain how relaxing this looks,2571
This is the all mighty CLYDE.,2570
Sock Kitty. I used to put her in a sock to keep her warm while I was hand raising her. Now she gets in my jumpers.,2575
"Friend rescued a cat, now it won't leave his side...",2571
We rescued a hummingbird...without using energy drink!,2567
Had my window open to have a smoke when I suddenly heard meowing... turned around to see this guy,2568
Whatcha reading?,2567
"Went to dump some trash this morning, and found these curious little guys.",2569
Found this stray living on a trust in the mountains. He took us for a quest. We named him Gandalf.,2561
Today we got a new receptionist. She's adorable!,2568
An eye on you.,2563
Bulldog on a trampoline,2570
I give you the Sand cat. Full grown they are the smallest of the genus Felis (which includes domestic cats) and the only cats to live in natural desert. THEY LIVE IN HOLES IN THE GROUND.,2564
Golden don't care,2565
How my friends dog fell asleep yesterday...,2564
Was on my way to the bank when I saw this guy enjoying his breakfast,2570
This wild pony came to warm up next to our campfire.,2562
Walking in Costa Rica my friend said I had something on me and picked it off. I thought she meant a bug!,2562
Bunny and bubbles,2557
This is what a baby polar bear looks like!,2563
Best alarm I've ever had. She taps me awake every morning.,2563
This little guy takes feeding time a bit to the extreme,2567
Hand raised reindeer,2565
Four kittens with their rabbit counterparts,2555
My cat again: she loves horses!,2564
My friend opened up a doggie daycare... my facebook feed exploded in aww,2560
They've been together for 9 years. Brotherly love.,2562
"We recently rehomed our first litter, and had a lot of anxiety over whether we'd chosen good homes for them. The new owners sent us an update pic - I'd say we got at least one right.",2562
Vet said he needed to lose 5 pounds so we're working on it.. but it's not going well.,2559
Mystic White Sri Lankan Sea Turtle,2556
"Get a border collie they said, they're one of the smartest breeds they said.",2558
My nephew and his yellow lab,2555
"I fits, I sits. The dish is there specifically for the cat and is not used for any other purpose.",2563
he's a big fan of chin scratches,2552
1/2 black husky 1/2 German shepherd... At least I get HBO with her ears,2557
Long-distance relationship,2548
Corner Cat,2553
Fetching the mail,2551
"So, can I? Pleeeease?",2554
Patience of a parent,2560
Can I haz?,2551
Husky party.,2557
"This is Hailey. She found a litter of abandoned kittens in the forest behind our house. She then proceeded to carry them inside by the scruffs of their necks one by one, and then let them try to nurse.",2553
Panda Slide!,2551
I present you a wolf nomming on a watermelon! :D,2553
Rawr!,2553
Spike Lee hates his bath.,2558
This is a tiny horse.,2550
Don't put me in there :(,2550
Aliens,2550
All the baristas at my Starbucks want a break when this little service dog in training walks in.,2548
"I am a new father... Reddit, meet Biscuit!",2555
Prairie dog puppies,2547
"My doctor encouraged me to get a service dog for my PTSD, so I adopted Stitch. Two months in and I couldn't have made a better choice than this smart little girl.",2546
My cat loves to sit in boxes,2551
"The Humane Society said that introducing a female Pitbull puppy into our home with a 6 year old female Boxer might not be a good idea, and that our boxer would be territorial... boy were they wrong :)",2554
Donated to the animal shelter and got my cat this classy tie!,2550
A Shared Treasure,2543
Thought you guys may enjoy this,2547
Birds being bros.,2545
Meet Rocky! Siberian Husky and Corgi mix.,2549
"When we touched the glass, he hopped up and did this.",2542
"Big dogs do need love! For clarity I'm 6'7"" Reddit meet my best friend Mia, the giant pyr pup!",2548
"My cousin's Golden Retriever puppy, Dusty.",2548
Our new shop dog,2548
"I was messing around one night and put on ""The Aristocats"" for my 15 week old kitten as a joke. She literally watched it until she fell asleep.",2547
"I thought you were going to take me to the dog park, not the Land of Giants!",2548
My dachshund pawing me to share a moment ,2548
Foxes are kinda like puppies - so lovable,2539
Pet Prom 2013,2548
He's back to his stalking ways,2547
My wife took our son to the zoo today. Looks like it went well.,2549
Baby elephant greets his keeper,2543
Why coming home is the best part of the day,2539
"Well, he tried",2541
"Excuse me fellows, pardon me, sorry, sorry, ahhh finally... god DAMN IT",2538
Calvin and Hobbes,2541
My cat has been like this for 30 minutes now...the heater is not on so I have no idea...,2546
Porkour,2541
"My gf is deployed. I put her shirt on a pillow and I found this when I came out of the shower. Someone else misses her, too.",2542
"St. Bernard puppy, anyone?",2543
"They were wrestling, and suddenly stopped to smile at me while I tried to take a picture.",2544
My poor little guy outgrew his bed and doesn't want to give it up. ,2546
"After trying to kill each other for a week, they started getting along. They cuddle like this all the time now.",2542
I think he's plotting...,2540
OOP,2539
50% Husky + 50% Lab = 100% adorable,2540
"When I open my eyes, this is the first thing I see every morning",2537
My dog loves the new kitten!,2539
"Took My Dog to a Local WooFstock, The Ice Cube Mound Was a Huuuge Hit! ",2543
Baby donkey goes for a trot,2537
That moment before the scratches.,2535
For me?,2537
The internal struggle between desire for doggie treats and disdain for doggie boots. ,2533
Peeling out,2538
Loyalty is mutual,2536
I leave my roommate alone with my cat for ONE WEEK and this is what happens...,2540
"Just to show that not everything in Australia is out to kill,  meet our Pygmy Possum.",2532
This is Reggie showing that dogs can fall asleep anywhere,2532
No child left behind [GIF],2538
Rescued pets know love is not bound by species. ,2536
I always dig a happy ending.,2536
A friend posted her dog and bird to facebook. They should be an advertisement.,2528
My dog is a cat person.,2533
"As a landscaper, I try my hardest to make sure nothing happens to these little guys.",2536
apparently my desk is nice and cool on hot days,2531
Spotted skunk rescued by conservation group in Naples,2533
