title,score
The tale of Doradus,3763
Excuse making hambeast in class shut down,3490
I figured this sub needs some fat anti-rage every now and then,3033
Asthma Medication,3023
How /fit gaybros deal with fattie at the gym (x-post from r/gaybros where it was removed by an overly sensitive mod),2779
Fatties like their coffee creamy.,2707
My job fuels your stories. You're welcome.,2679
"I Did A Bad Thing, Guys...",2664
She wanted to ride a horse. ,2565
So proud,2461
Love happy endings,2347
[TP] There is not a thin person trapped inside me,2192
The anti-gravity whale.,2165
Anon is a pizza guy [xpost from /r/4chan],2107
Fatty breaks her leg while shitting,2082
Feels from /fit/,2036
"Hey, /r/FatPeopleStories. You're subreddit of the day! Congrats!",2024
They've all fallen and none of them can get up.,1899
Hamthrax VIII: Not Born to Run,1898
HOW LONG ARE YOU GOING TO WAIT BEFORE OFFERING YOUR SEAT?,1881
Big Beauty in Illinois [From Dear Abby],1847
A HamPlanet Seeks Medical Treatment,1815
Double standards.,1787
"Fat Girl Has Problems Compounded by Haters, Turns it Around Into a Heartwarming Story (x-post from fit)",1740
[TP] Thin privilege is being a successful stripper.,1686
The Alpha Old Man and the Spherical Object.,1663
"The reason they tried to reach for her, is because they wanted to eat her",1650
Hamthrax VII: Let it Beetus,1646
"Holy shit guys, I can't stop laughing.",1617
Thin privilege in Les Mis (x-post r/tumblrinaction),1605
/fit/ Fps poem,1581
Anon administers the red pill to a friend in need,1561
"I don't know if you guys meant to do this, but... yeah. Thanks.",1549
World's Shortest FPS (with apologies to Hemingway),1548
"Godspeed, Pukey",1537
"Kids need to eat junk food, she's too skinny!",1531
Fresh from /pol/,1511
Land whale attacks Scotty.,1488
Another example of how fatasses and their fatassery affect the people around them.,1473
Tales from IT pt.5: 'Lawyer' up,1469
Yay for double standards,1442
FAT IS A DISABILITY,1435
Nuclear Whale,1413
"The story of Andrew, the fat Hitler. (X-post from /r/4chan)",1404
Fatty tries to cook herself,1389
So today a hamplanet was so embarrassed by her own deplorable behavior and rancid smell she decided to change her life for the better by dieting and exercising.,1379
"Tales from IT pt.4: ""MUH CONDITIONS ARE REEEAL""",1375
Another hambeast at the con,1377
Fat logic and justification,1379
[x-post from /fit/] The hot body and the atrocity against nature,1376
TIL Being obese is the same as having cancer... but don't try to debate me on this,1364
[TP] thin privilege is being able to fit in a seat at a stadium,1342
"MISSION ACCOMPLISHED; also, flair. (more in comments)",1335
Flood Relief Fatty,1322
Fatties do a class presentation.,1322
Fatty pissing contest.,1296
I don't have diabeetus!,1294
thin privilege is fitting in an airplane seat,1281
/Fit/izen going to London,1281
"Fatty attempts rape, is not successful (/fit/)",1278
But I stopped drinking Coke!,1272
Tales from IT pt.1: Please do not lick the keyboard.,1263
Fattie tries to be known as most athletic in the office,1257
Sick of my fatty family outcasting me because I'm healthy...,1237
"Those calories don't count, they're healthy",1215
[Series] Hamthrax VI: Where the Beasts Have No Shame (II),1211
[TP] A whale has learnt how to type,1209
[TP] Thin privilege is fitting in a shower,1202
[TP] There's hope in the fight against fatlogic!,1200
Tales from IT pt.3: Desperation knows no bounds,1197
Hamthrax VI: Where the Beasts Have No Shame (I),1184
Gluttonous Whale Gets What's Coming to Her,1180
Chinese Buffet ,1172
Textbook publishers photoshopped fat people out my book!,1167
U Mad HR?,1165
A fatass more badass than I,1148
Broccoli!,1136
thinprivilege is not having your family put a padlock on the fridge,1132
/fit/izen destroys some fatty logic that drifted onto a thread. Harsh but awesome. (x/post from r/4chan),1131
Second Hand Hamthrax: Live at Fudokan,1127
Vaseline...,1121
Law &amp; Order: FPS,1125
Hamplanet angry I'm in a handicap spot at the gym.,1116
Jacob the fatty who made my life At University Hell,1110
Yo dawg...,1111
Tales from IT pt.2: Not even Zeus would hit that,1099
Fat people think I'm mean for eating ice cream.,1097
Sandwich artistry at its finest.,1096
Fat friend can't fit on fair ride,1081
Tales from IT: An update with a REAL Lawyer,1080
You want WHAT in your Fupaccino?,1063
[TP] Fat privilege is ignoring the risk of cancer,1062
Tales of Hamthrax III: Lollipopalooza,1059
Psychology with a a side of pork,1055
Thin privileged child with Down Syndrome gets told (or how I lost hope in humanity),1043
Thin privilege is being attractive to the opposite sex.,1050
Navigating the Hamplanetary-System.,1042
"Oh man, my jimmies were not prepared for this",1034
[TP]Thin privilege is not overfeeding your cat.,1030
Tales of Hamthrax II: Oozefest,1022
The Joys of Being a Taxi Driver 2,1024
Hamplanets On A Plane,1021
Good story for a change from /fit/,1022
Tale of Hamthrax,1009
Thin Privilege is having Celiac Disease,1010
Hamplanets of Med School: Fat-Scamming,1010
Beating a Hammie at Her Own Game.,1000
"Tales of the Breadstick Garden. I have many, and tonight I humbly submit for you: Las Gigantes Blanco.",998
Cheesebeast teaches a child a terrible lesson,996
"Maggie, My Ham Housemate: The Fourth of July",1000
Fat logic on how to lose weight,996
[Meta] How long does one have to be on this subreddit to think this is an fps?,988
"The Year of Hell, Part Three: Want a side of lobster with your butter?",980
The short tale of how a hamplanet stole donuts from a little girl,978
[TP] Marilyn Monroe lifted weights and I can see her ribs. Did I just end Thin Privilege?,980
The Human Blob and the Local Grocery.,977
Found this gem in the Youtube comments section.,965
"Even in the military, I can't escape the fat logic...",960
YEAH STOOPID!,940
"The best way to tell someone you just met that you like them, is to tell the police he raped you. And yell fat discrimination",946
The sexy secretary,944
"""But we're the same size""",940
Tales of Hamthrax V: Elevator to Heaven (II),939
Part 2: Thin Privilege is winning your small claims lawsuit,935
Tales of Hamthrax IV: Scary Monster And Loads of Sprite,939
Incredibly short FPS,935
Planetary Gym Tourist,924
Wherein I am sexually harassed by a hamplanet,916
"fat logic hard at work… side order of racism, too (pt3)",916
Who Drinks Water?,916
"Hamplanet eats &gt; 7,000 calories in stolen MRE's",904
[TP] Thin Privilege is Pizza.,900
[F2F] I can't believe it. I actually made it.,905
My husband's disabled; a story of a fat angry rat.,897
Momma Ham and Tween Ham are offended by my thin body at the pool.,902
TP is not being ashamed of ashamed of admitting he likes you; I guess I dealed with TP when I discovered I was gay,897
/fit/izen on lifting,897
"The Nightmare Waddles, Part IV: The Finale",881
Feral Pizzabeast tries to go Sailing,881
[TP] Thin Privilege is only taking up one seat on the bus and not six.,874
"The source of the ""Scumbag Fat Girl"" pic: ""Family who are 'too fat to work' say £22,000 worth of benefits is not enough""",872
Guys! Is anyone a lawyer? I need one! I'm going down for rape! Story of the Manatee [Part 6],876
Righto- This one has to be said,868
Ambulocetus at the Bar (x-post from fit),870
Hamplanets and yoga pants: the first,860
Tales of Hamthrax V: Elevator to Heaven (I),859
Fatsplainin' at the Doctors office,852
"Maggie, My Ham Housemate: The Grocery Run",844
"Rotten Logic, Flying Chicken and Oozing Entitlement: Tales of a Social Worker Part I",840
William MilkShakespeare at the Track,836
I need to buy muh groceries!,832
Hammala goes to Beetus Hut and almost spends my entire paycheck,830
"Fatso steals chicken wings. Implies being skinny makes you gay, assaults skinny person.",824
"My Year with Ginger, Pt. 7: The Rains of Castor Oil",819
Thin Privilege is not sustaining an eating-related injury,818
"[4chan]Guy with bone cancer ""isn't disabled""; muh glandular problems",816
I thought a fat lady was pregnant. ...,814
Jolly Roommate: The Carrot Revelations,811
(mildly NSFW) Bathtub Troubles for My Family of Fatties.,809
"""Boys like girls with curves..like me""",806
"Little Old Lady comes to my aid, in a battle against the Gym Rhino.",807
Help a sista out!,800
"My Year with Ginger, Pt. 9: Breaking Ginger",805
Drinks don't have calories,804
The Saggy Roommate pt. 11 - The Justice,795
These clothes are too small!,801
"[TP] If you're this big, there's a problem...",794
The Time I Oppressed a Hamplanet Pool Hopper PART 3,793
Hamelia Wants to Ride Me,791
the tell tale signs of a workout + diet that will absolutely NOT work... ever,791
"Hamplanetry Isn't Contagious, Thank Fuck",790
Fattie bitches that I was offered a seat on the bus.,784
[TP] Thin privilege is fitting into plus sizes,777
Running is bad for you. ,779
Burritos in ghetto USA,781
Second Hand Hamthrax II: Dairy Queen's Greatest Fits,776
[TP] Thin privilege is fitting on one bus seat.,772
"If you're jogging before 5am in winter, you're gonna make it.",769
planet proceeds to make eating disorder patients uncomfortable,771
**¿Donde Esta the seating for Los Whalepeople?**,768
Fatty Fat Fat in Obama's 'Murica [x-post r/4chan],772
Hamplanet goes to the gas station.,778
The Manatees insistence that I am her boyfriend and like her. Now with molestation! [Part 4],771
Australian bariatric doctor recounts her experiences with fatlogic and its heartbreaking consequences. I know I often feel a sense of (hopeful) disbelief at some of the stories in this sub - but these people are frighteningly real.,774
"My Year with Ginger, Pt. 5: Satisfaction",771
"An ex-Navy Seal, a Hamnebula and a gas station attendant.",764
[TP] Hamplanets cry lard over the color choice of a dress,766
Hamplanet Roomie: The Nightmare Waddles,767
Me vs. Hamplanet,761
Electric Cart Beast Goes to the Grocery Store,764
The Case of the Skinny Hamplanet (NSFW),755
Anon's thoughts on fat women who aren't generally interested in fat men,758
The Time I Oppressed a Hamplanet Pool Hopper,751
Tales from IT pt.6: Stories to break your soul,751
Fatty Following,742
Counting calories is pseudoscience,743
"My Year with Ginger, Pt. 6: One Leaves the Nest",749
Thin Privilege is not getting your car spray-painted when you park in a construction site...,745
"The Nightmare Waddles, Part III",746
[TP] Thin Privilege is Not Being Hypocritical,744
Beyond rustled.,738
Chocolate Wallet,744
The story of Bikebro,733
"Maggie, My Ham Housemate: The Break Up",730
[FA Logic]Fat privilege is preserving 470 lb curves while eating only salads,730
"Some people don't understand the concept of ""that's not a public horse.""",729
Anon goes on a date (x-post from /r/4chan),730
We are all going to make it,728
Hamplanet Cousin From Hell,733
The Oatmeal: The Terrible &amp; Wonderful Reasons Why I Run Long Distances,719
Waterslide weight limits are discrimination,722
Did Someone Say Disney World?,720
"The Year of Hell, Part Six: The Jealousy of the Whale.",720
Hamplanet wants revenge,721
(The long awaited) Muh Muh’s Odyssey Part I: Muh Muh’s Entrance,718
The Time I Oppressed a Hamplanet Pool Hopper PART 2,715
"Guys, it's official I'm the Manatees girlfriend and I've cheated on her at this party we had! [Part 5]",715
Big Momma at the water park,711
"The Year of Hell, Part Two: Moving in; Glimpses of Hell incoming.",717
Ursa Minor: Pokemon Master,716
Hamplanet crashes eating disorder clinic,707
Sad one from the hospital,714
"The Year of Hell, Part One: Meeting the whale, signing the lease, and the sign of problems to come.",706
Second Hand Hamthrax III: License to Fill,706
404: Face not found,705
[X-post] How I left my first job...,702
"My Year with Ginger, Pt. 4: A Special Birthday Gift",697
"Fatzilla tries to brainwash my kids that eating junk food is good, and accuses me of emotional abuse for teaching healthy eating habits.",702
A Hamplanet Restricts Her Calories,697
Weight loss shaming doctor,693
"Eventual Planet wants a ""summer body.""",696
How I oppressed some poor big boned lady with a condition and her husband and almost killed them at a amusement park.,691
Retail Whale: The Mother,690
"fat logic hard at work… side order of racism, too (pt2)",691
"[TP] Not from TiTP, but still oh so relevant",683
"Submitted to the approval of the Midnight society, I call this story “Tale of a Ghastly Fatass” pt3",684
[TP] Apparently hospital beds have unlimited weight capacity,682
/fit/izen harrassed by the WALMART SCOOTER SQUAD™ [FPS from r/4chan ],683
"The Year of Hell, Part Five: Apocalypse Now!",673
"[Meta] Important: Updates, Reminders and Suggestion Box Time!",679
"Maggie, My Ham Housemate: The Beginning",673
Anon describes the mentality of future fatties,678
BUFFET IS CLOSED,678
Real woman puts dirty citizen of a third world country in his place,671
[TP] Thin Privilege Is Eating 12 Pastries At Once,674
Retail Whale: The Awakening,673
Oh /fit/...,673
"Somebody call 911, fatty's cryin' murder on the McDonald's floor, woah-oh.",671
"The Year of Hell, Part Four: A Wild Alpha Alex Emerges!",670
Prt 2 to Jacob the atty who made my life at University hell,668
Hamplanets of Med School: Foie Gross,667
"Being fat is ""extra"" disability",664
Sorbitol rains vengeance upon Mt. Roommate,672
We are all going to make it. ,669
"Maggie, My Ham Housemate: The Routine",661
Fatman vs Superman: Or Why You Should Never Work At Amusement Parks.,662
Showdown at the OK-Buffet,660
Hamgar V: The Final Showdown,659
"[TP] Thin privilege is someone asking a question, and getting a bitchy, rude response in return.",655
Scooter conflict,657
"My Year with Ginger, Pt. 3: Mating Call",650
[LONG] I think I'd remember us having sex you Manatee,650
The Adventures of Starbeetus' Own Land Whale,648
"She ""lost the genetic lottery""",651
Some fatty logic on the Cracked article recently posted,653
Hamplanets Drive An Anorexic Girl To Tears,653
Toss some bacon on it. More bacon.,646
Office Fatlogic,646
[TP] Thin privilege is not having drs assume you're sick because you weigh 600 fucking lbs,640
Hambeast gives femanon advice,637
Retail Whale: Jealousy,644
UPDATE: Two Hamplanets Drive An Anorexic Girl To Tears,637
"Chinese Buffet: No, you can not eat all the food!",642
Clash of the Titans,643
"fat logic hard at work… side order of racism, too (pt1)",643
No one puts Baby in a stairwell!,637
The Fatmate - Part I,634
Thin Privilege is having your coworkers actually believe you're pregnant.,632
&gt;be CEO (x-post /r/4chan),632
Fatty Paranoia [TP],631
"[Meta] Okay FPS, Let's have a serious talk.",632
Melted ice cream with Oreos in it? That's a snack.,624
"I got accused of ""fat discriminating"" today.",625
So glad I haven't had the opportunity to encounter a thin privilege 'activist' ,627
"My Year with Ginger, Pt. 8: Ginger Pie",625
McBeetus FPS (although I'm starting to think it should go in morbid reality).,624
"Unsurprisingly, a hamplanet family demolishes a snack station meant for 200 people",626
Porky Princess gets a job,624
Fatty can't fit in the MRI machine.,617
[TP] Thin privilege is taking sound medical advice,619
[TP] Thin privelege is being seated in chairs at a restaurant.,624
But he had a doctor's note...,625
The moon comes to earth and tries to thin shame my dog,620
[Meta] A large collection of many FPS series. Enjoy!,622
The Saggy Roommate pt. 5 - The Revenge of Feeder,617
Retail Whale: The Average Lunch,613
The Saggy Roommate pt. 1 - I'm a Interior Designer!,617
Small Planet vs. Bus,612
/fit/izen messes with 'yay-scale',609
Poor Cal,610
The Saggy Roommate pt. 4 - The Feeder Boyfriend,610
"""Can you just hold her legs up?""",612
Friend just posted this to facebook,610
Thin privilege is not being profiled as a terrorist by the TSA,613
[TP] Thin Privilege is liking raw melon and not being on insulin anymore.,600
Thin priviledge is fititng into a dentist's chair.,599
Short and sweet: The Ice Cream Line,608
The Saggy Roommate pt. 10 - Da Po-Po,599
Retail Whale: The Training Part 1,599
PorkPlanet Housemate: Chapter Six - The meal.,600
Thin privilege greeting cards,604
[x-post from /fit/] The Rembrandt of ketchup application,598
The Saggy Roommate pt. 2 - Mmmmmm....Black Booty,601
YOU FUCKING PRIVILEGED FAT SHAMERS SHOULD BE ASHAMED,599
"""Have you ever heard of Health At Every Size?""",597
I wonder why,598
"Big, fat (be)hindsight is 20/20",593
Nutrition advice from the office whale,591
"My Year with Ginger, Pt. 2: Quest for a Plunger",588
Retail Whale: Post Wedding,589
Moving a stinking hambeast to her new lair.,584
[TP] Thin privilege is not being posted on fat fetish blogs,592
The Saggy Roommate pt. 3 - Manbait,592
(The much anticipated) Muh Muh’s Odyssey Part II: Muh Muh Gits Her Medicine,584
The Manatee has been arrested [Part 9],583
The Dark Future of Hamerica,580
The Saggy Roommate pt. 8 - Revenge of Baby!,582
The most morally questionable FPS I've ever read (from /fit/),585
Forced to Eat Ice Cream,587
Big Bertha of the Bathroom,583
Flight attendant vs. fatties,583
Muh Muh's Odyssey Part III: From Beetus to Worse,582
This broke my heart.,584
"Rapidly Expanding Co""worker"" IV: Meet the DM",583
"Bless You, Mum",581
"""We're the same size!""",576
The Saggy Roommate pt. 9 - Poor Fridge Cage...,578
My sister...unfortunately ,576
Thin Privilege is... I can't even say it just read this,581
Muh Rights...,577
Traveling Fats: How two women ruined a good time for dozens of strangers.,575
Hammy can't ham anymore...,575
Thin Privilege is never really being disabled.,567
Retail Whale: The Jewelry Fiasco,575
"My Year with Ginger, Pt.1",569
Scooter Beast taken down at Wal Mart,573
"""People hate me because I'm fat!""",569
Retail Whale: Boss Loses her Shit,569
[TP] Thin Privilege is getting mad at thin people because you're so ashamed of your body that you can't wear a short-sleeved shirt.,564
I never thought I would say this; I feel terrible for that poor TSA officer.,563
Porkplanet Housemate: Chapter Two - The tale of my two broken fingers.,565
The Fatmate - Part IV - The Afterfat,565
TEEHEE,561
"Porkplanet Housemate: Chapter One, Part 2: Porkplanet cries, breaks stuff in the nightclub and pukes all over herself.",562
Fatties Love to Talk About Boobs,562
Living With Jacob Prt 3: Learning on what he believes is an ideal lifestlye,563
The Fatmate - Part III,562
Living with Hamtaro,552
The Fatmate - Part II,556
"Hamplanets visits ""TJ's""",557
The Epic of Porcina - Epilogue,557
One Night with Hamela Anderson (semi-NSFW),552
Anon starts bulking,558
"Bertha and the relay: Times don't real, only feels real",548
Internet dating is dangerous UPDATE,554
An Open Letter,549
That's no moon... (Jabba the Cunt: No Hope pt I),552
Hamplanet stalker at the zoo,551
"[TP] ""So, are you telling me that only thin women can be bridesmaids?""",547
bacon princess at wally world,553
Wherein a pod of Hamwhales try to deny me a handicapped parking spot.,549
"Hamily pesters me for being vegetarian, gets told off by my brother",543
Women and burgers first!,540
Ares vs Mother and Sister Hambulas Part I,547
"Avoid Fat Weaboos Like the Plague, Guys.",539
Retail Whale: The Mating Part 3,543
Llardvark isn't Picky; Sugartits Takes Over Security Operations,543
Dat moral,542
The Not So Little Drummer Boy,544
Hershey Park Hammy.,544
Retail Whale: The Mating Part 1,543
Chubs McNasty: The Roommate from Hamplanet Hell Part 2,539
"Submitted to the approval of the Midnight society, I call this story “Tale of a Ghastly Fatass” pt1",533
Porkplanet Housemate: Chapter Five - Porkplanet visits me in hospital.,540
Highschool Friend: Losing Curves,540
Overwhaleming logic,537
Chubs McNasty: The Roommate from Hamplanet Hell Part 4,531
I will never play The Sims again...,531
Porkplanet Housemate: Chapter Four - The Shopping Trip (I will be Victorious),533
[WARNING : FAT LOGIC] Medical professionals advice results in fatty wanting new dentist.,530
Hamplanet attacks relationship- it wasn't very effective!,539
Water is bad for you! My teacher told me so!,529
"Porkplanet Housemate: Chapter One, Pt1: The Night Out",530
Anon goes above and beyond the call of duty against fattie.,528
The Manatee insistence that I like her. Now with poop [Part 3],531
Jigglybitch and Slowbro-Sweet Justice.,531
DON'T TOUCH MY CAKE (from /r/pettyrevenge),529
Tales of hamplanetry and fatlogic through the eyes of a cardiologist (I),525
Hamarella vs. Big Momma,526
Retail Whale: The Training Part 2,526
Hamplanet doesn't understand real tea or tolerance,527
Get lectured at for trying to decrease my gravitational pull.,529
FPS: Horse show edition. With a small side of sugar-free justice.,527
'Disabled' guy vs. disabled guy at a theme park,523
Shoving beliefs down other peoples' throats... Literally,526
Chubs McNasty: The Roommate from Hamplanet Hell Part 1,521
"My coworker lost 18% of his body weight in three months to win a company weight loss challenge, then gains it all and more back afterwards.",519
"""Actually, the left kidney became more visible as it fell out""",524
How is this situation at my workplace ok?,517
"The Nightmare Waddles, part II",519
Hambert gets some Health Insurance,523
"OP wants to change point of view on fat logic, gets post full of fat logic.",521
Update on slightly psycho moon in love with my bf.,516
Flabberwocky Flips His Shit,519
"Maggie, My Ham Housemate: Pie Tension",517
"Adipose Avenger, and the importance of hand washing",510
[META] An Artist's Rendition of an Antagonist - Hamthrax,511
Milk is healthy!,515
Bumblelard at the bar.,513
A hamplanet and moon orbit into the clinic.,516
Hambeast Prime cripples anon for life (Comic Form),513
"The Planet and The Potheads Part IV: Army Bro Gets Engaged, Kirby Goes To Jail",516
encounter with landwhale while running,509
Mr. Shuga Needs an Operation.,511
The joys of being a taxi driver,509
I have no title [Part 7],508
Thin privilege is not being a pessimist,505
The Manatees insistence that I am her boyfriend [Part 2],506
There is always hope,508
Hamplanet Brother fakes doing things at the gym.,508
[TP] Oh shit! Someone tell /r/bicycling...biking 9 miles is EXCESSIVE and UNHEALTHY!,502
"The time I learned Wicca was a religion for hamplanets, and that Aphrodite is obese. Prepare to be religiously educated, FPS.",504
Muh Muh’s Odyssey Part V: Epilogue (By M. Night. Shamalan) [Kinda NSFL],505
Cool Whip is healthy! Part 3,500
"Fat2Fit: Moon falls in love with ballerina, decides to become human",502
Hamburglar Ruins Dinner For Everyone,500
Some FPSs are Really Sad,499
Saggy Sucks pt. 6 – You’ve Got a ~~Friend~~ Meal in Me,500
Whale harpoons herself,494
"Tales from IT: What's this, an emotional update?",495
Fat People Gym,495
Online dating horror story...,494
"3 REAL Women, 3 Accusations of Homosexuality; A Trifecta of Wat in 24-Hours - Part the Second",499
I think... maybe I just got thin-shamed? wtf.,492
Fat friend sends me hate mail,489
Restaurants displaying calories on menus is problematic.,495
Betha: the Finale,494
Entering...the Adipocyte Zone: The Hamspanic Part I,490
Chubs McNasty: The Roommate from Hamplanet Hell Part 3,494
"""Who the fuck counts calories?""",496
"Ever wonder what whales would say if they could talk? -- Apparently they would ask ""Why am I always wet??"" (x/post from r/4chan)",490
"[TP] Well, if you do weigh 500 lbs you probably do need a hospital, but you can't say that there is nothing wrong with weighing that much.",486
Helping with your diet is abandoning you and being selfish,491
Standing at the takeout counter is Thin Privilege,492
Hammy on holiday needs a scooter!,487
I was a preggo hamplanet,484
Holy Moley rubs her weiner in my face,486
Lipidsaurus has priority parking,491
Retail Whale: The Beginning,485
Grammy Hammy and the peanut butter cake revenge,489
Misogynist Anon Cold-Heartedly Rejects Landmass Mall Employee,492
Foodstamp Hamily,488
"Submitted to the approval of the Midnight society, I call this story “Tale of a Ghastly Fatass” pt2",492
"Textbook fatlogic at Gawker: ""Your size has nothing to do with your health.""",493
Retail Whale: The Mating Part 2,485
You Can't Just Force Us To Move,489
Ice cream with a side of body shame and racism,486
Fire Reveals Coworker's Hidden (lol) Planetness,486
Whales at the Gym,487
Traveling with Lipid,485
"Law &amp; Order: FPS, Episode 3",483
500+ lb patient rolls over my goddamn foot in a 250 lb electric wheelchair.,485
Little Orphan Annie,482
Hamanda Attempts Seduction,489
Battle of the whalecunt,486
[META] Some updates and reminders/new info for new subscribers.,485
Thin privilege is being able to use a broken escalator,484
"""little"" accident",480
"Hamplanet turns me off fruit puree, and makes me want to call an animal protection agency.",486
"I'm not saying I'm a golddigger, but...",480
Tales of hamplanetry and fatlogic through the eyes of a cardiologist (III),480
The Planet and The Potheads Part III: Over Sized Kirby Goes Insane PT. 2,483
"Some people are sexually attracted to very weird things, so it's okay to be obese",479
Starting off TiTP Thursday: Fat shaming is telling people that apples are healthier than cookies.,478
In the club,480
Fatlogic vs IQ,482
The Lard Sisters Go On Vacation,475
Porkplanet Housemate: Chapter Three - The tale of my broken desk &amp; cuteguy screws up.,478
My first experience with ham-logic,477
"My time working in a busy bakery, or ""The Leaners"".",475
Hammy is too big to rock,470
More woes of a hospital employee,472
"Sister: ""you're a loser!"" - eats everything",472
Tales of the Breadstick Garden: Paunchpaunch and the Final Stand.,470
Muh Muh's Odyssey Part IV: Enter the Wildebeetus,468
I Did A Bad Thing Guys Part II!,473
"The Planet and the Potheads Part V: Guess who's back? Back Again? Kirby's Back, Tell a Friend",467
GramHam at Starbeetus,473
"Rapidly Expanding Co""worker"" I: Enter the Fatrix.",473
Fries before Friends,472
Baby Phat,467
The Fat Is Strong In This One,467
Hammelina visits Costco,471
Thin privilege is not acting like an insecure delusional creeper on the train.,467
