title,score
biomoon vs foreign student - the battle of the beetus knowledge,470
Grandma and the fatties,472
Isn't Thin Privilege really just Fat Consequences?,465
His response was AMA-zing,469
Battle of the Bathroom Stall,469
meemaw stays in the car,466
Curvy can't get fat,465
CancerSis Vs TrainPlanet,462
Lettuce-Stealing Land Whale Destroys my Garden,466
Scootersaurus rides out,464
Fatty being extremely rude to girl with eating disorder,463
The deviled egg massacre,466
Cool Whip is healthy!,463
It's 5am here and I'm probably going to fight EventualPlanet.,463
The Saggy Roommate pt. 7 - Kitty,463
Tales of hamplanetry and fatlogic through the eyes of a cardiologist (VIII),461
"[TP] Thin Privilege is being objectified as a ""trophy"" by douchebags",459
More mayonnaise,459
CancerSis Vs TrainPlanet: Update,457
TP is not bring discriminated against on airplanes,451
Tales of hamplanetry and fatlogic through the eyes of a cardiologist (II),451
TiTP in real life.,448
Hambeast thinks that Lactose Intolerance is an excuse,453
Porkplanet Housemate: Chapter Seven - The Transcript.,453
"I seriously was in denial about scooterbeasts, but then...",452
"""The Planet at The Pet Store, and the Tale of All of my Wats"".",456
Hamruto learns the ways of the ninja,450
Tale of a Librarian's Anger,447
The Epilogue of Porcina - Chapter Eighteen - ALTERNATE ENDING,448
Wigglytuff from Elementary School.,448
Lent: Swarm of Whales,450
Like a phoenix from the fatshes,452
The Whale who Drowned in Soda,452
[TP] Thin Privilege is being able to afford any type of clothing you want,450
"""But he liked me first!"" A tale of hamplanet jellyousy",444
"""All of us winced when we saw the pockets of fungus growing within the folds of Gloria's skin."" An emergency room FPS from the memoir I'm reading",446
Arbitrary lies are okay if they're to get fit kids in trouble- so sayeth Bertha,442
This fat bitch in my class right now,445
Hamgar IV: By the Power of Pizza,450
Anon is asked a question,448
"""Your poor child...""",442
The Battle of Scooter Station,445
Bertha and the oppressive ferry seats,444
"No tale from the Breadstick Garden today. Today I bring you the haunting tale of Biggums, and how I am now obligated to cut off my own face.",441
An FPS that we can all learn from.,443
[TP] Thin Privilege is not being denied food as a child.,441
Beer not Babies,444
Landwhale's Wedding Dress Disaster Turns Priest To Drink,444
Entering...the Adipocyte Zone: The Hamspanic Part II,440
[META] An Artist's Rendition of an Antagonist - Daisy,440
[meta] A reminder: this thread is for fat people stories ONLY. Free deep fried dessert pizzas inside!,440
The Chronicle of Kuetreece: Tales of a Social Worker Part II,446
The Fatmate - Part V,440
Fluffy the hampire slayer,442
A boy risks it all to lose weight.,442
Skinny discrimination. I'm so fucking angry right now.,441
"Thinshaming is okay, fatshaming is atrocious",444
The joys of owning a restaurant. In the deep south.,441
Hamplanet needs electrolytes,439
Hambeast at a Job Interview,434
Too heavy for an electric shopping cart,432
Human Privilege is being able to choose your race.,436
"Fatties on the bus go ""waah, mah feelz!""",434
Slowbro and Jigglybitch II- CARRY ME!,438
Cool Whip is healthy! Part 2,432
Some seriously bad parenting.,429
"The goggles, they do nothing.",433
Pac-Ham eats all the dots and my table.,428
"Fishman vs Bertha the sphereoid, in the infamous backpack incident (with bonus papa whale)",433
Women make terrible blind-date decisions,434
"""I'm going to tell him she's a whore, then he'll want a real woman"" - Oiltank. Ruining a quiet beautiful girl's dreams, the only way a hambeast knows how. (Long but drama-y)",429
The Epic of Porcina - Chapter Fifteen,426
Restaurant Terror: The Violent Beetus.,429
Internet dating is dangerous,426
Hamgar III: The Descent,431
The Epic of Porcina - Chapter Twelve,434
Tales of hamplanetry and fatlogic through the eyes of a cardiologist (V),433
"""You have no right to say that""",433
"Tubby Room mate takes on cripple or, The Cane is Mightier Than the Flab(Long)",426
PorkPlanet Housemate: Chapter Eight - The Neighbours.,424
Tales of hamplanetry and fatlogic through the eyes of a cardiologist (IV),433
Encounter at Wal-Mart: pizza rolls most important things ever created,422
How a Hamplanet trainee cost me $50 last week.,429
Hamplanets have a snack in class,426
Hambeast gets what's coming to them,428
Oversized Kirby goes to the County Fair!,422
Hamplanet kills one of my children by feeding it garbage,427
Remember the girl who died in a fire because she was too fat to be rescued? Some of you wondered what Fat Acceptance advocates might say about this. Here is a somewhat similar case. Prepare your jimmies to be rustled.,425
Fatty meets nonbeta,422
A short (and rather disgusting) FPS about my horrible ex roommate.,423
Very Large and Concerned Friend Skinny Shames my 7 Year Old Sister,425
Male Hamplanet Dating Horror,423
Chubwub the Hamtub,424
The Planet and The Potheads Part III: Oversized Kirby Goes Insane PT. 1,420
If you've ever wondered how there is such thing as a fat vegetarian,425
Landwhale friend lets the fat logic flow,430
Hamplanet orbits the Earth,425
Hamplanets of Med School: PCO-noeS,423
[TP] Fatplanet has only eaten cheese and fries for thirty years; cries when she tries to eat a brussel sprout (X-post from r/rage),428
Eruption of Fat Fuck Mountain,423
Christmas Ham (Alt: t'was the night before fat-ass),426
The Epic of Porcina - Chapter Seventeen,422
Laziness is expensive!,421
One of the most intense FPS I've ever read.,426
Summer Emergency Room Adventures. Part 1,423
"Working with obese people means you'll end up doing most of the work, I guess.",421
Hamplanet Christmas,416
FatCat gets caught in a lie,414
"/fit/ makes a new gameshow, ""Faternity House!""",418
I'm not the best aunt ...,418
The love saga of Jigglebitch and Slowbro.,418
A Fatty Insults my Mother's Hospitality and I suck at Petty Revenge,415
"You win, FPS. They really do exist. Introducing the Fast Food Fairy.",415
"Mexican All Inclusive Part 2^0+1-2+2x1: I'm Sorry Sir, You Can't Park Your Son on the Diving Board""",418
The last fatmobile.,414
"Rapidly Expanding Co""worker"" II: Pizza Party",419
Plus-sized Model almost kills her baby,423
The powerlifting adventures of LardTub (from /fit/),417
"Jigglybitch and Slowbro III - The tree, the trailer, and the hamplanet",418
Anons fun as a paramedic,411
Sexy marks,419
The Epic of Porcina - Chapter Sixteen,415
Cool Whip is healthy! Part 3,417
In which I learn a hard lesson about labelling my food properly,413
AXE ATTACKS the Food Trucks,418
The Nugget Tales: Aggravated Assault,415
A Sad and Infuriatting FPS. Weaboo Hamplanet infatuation. and the Kitten who is now in heaven :(,414
Tumblr's FatAndTheIvy gets some fast food. [x-post from /r/FatPeopleDoingStuff/],417
Hammy need ice cream NOW,409
"3 REAL Women, 3 Accusations of Homosexuality; A Trifecta of Wat In 24-Hours - Part the First",413
"No one believes calories in, calories out",415
How many sets of breasts do you have?,411
Hamplanet accuses me of trying to give her a miscarriage.,407
A loss of £1000's of pounds of stock because a staff member hadn't eaten in a few minutes. (x-post from talesfromretail),410
The Prom Dress That Almost Wasn't,406
More disabled parking. McBeetus and the scolding.,410
Hamplanet works out.,411
Hammey loses a husband,407
"Fattleship used hypocrisy, it's ineffective....",406
Thin privilege is never needing a seat on public transit.,410
"[META]We're now the 75th most active subreddit, just behind /r/TumblrinAction",406
The tale of how a nice girl went full Hammy Hippie.,406
Hamanda Trying to Ruin a Memorial vs the Bitch With a Mega-Phone.,404
[More sad than funny] My hamplanet sister is eating up my mothers early retirement,408
[Series] Heat Haze Delirium: Tales of a Social Worker Part III,406
College Roommate,406
"Rapidly Expanding Co""worker"" III: Of Liquid Courage",399
Ares vs Mother and Sister Hambulas Part II,406
How a hamplanet destroyed my first housewarming gift.,404
Thin Privilege is not denying the law of thermodynamics.,407
A little Oversized Kirby sidedish,407
Fat Logic at Blockbuster,405
The whale king of the future (x-post /r/4chan),406
Almost killed walking landfill roommate with chili.,404
Eating Disorder,399
The Nugget Tales: The Grand Finale,404
Army Bro shares his first FPS from his time at Walmart (From Planet and The Potheads series),404
The Fatmate - Part VIII,400
"As promised, update on BF-stalking bitchy moon lady.",404
"Hammila at the Barbeque, Dealing with a Water Allergy.",401
Business Beetus Beast Makes a Scene at the Sandwich Shop,399
Marshmallow Fluff is Food.,404
Moderation is lost in fatties,403
The Fatmate - Part VII,401
You either win the game of mobility scooters or you diet.,395
Revenge is so sweet,403
"No thanks, that's ""rabbit food""",403
The Epic of Porcina - Chapter Eight,396
"Diets and Ribs and Pies, Oh My!",394
Hamtaro finds Oxnard,392
"Hamgar, destroyer of french fries",394
Anon goes to a restaurant ,394
[TiTP] Thin Privilege is eating all the ice cream you want without caring about the consequences,393
Thin Privilege and the Bicycle.,392
"And here we see the Australian Bogan Landwhale, in her natural habitat...",395
A Year after a Year after My Year With Ginger,396
[TiTP] Thin privilege is not having to cut your boots to make them fit your legs.,392
The Fat-shion Designer II,391
Hoboham makes decisions at the supermarket,398
Fat privilege is... this.,396
she ate all the cookies,394
350 lbs (x-post from 4chan),399
UPDATE: Moose pt. 4,390
BURRRNNN[titp],392
The Fatographer,394
"[TP] Bertha (the high school swim team whale) is all grown up!! ""I might be fat, but I bet I could swim faster than you""",391
"Shame of Thrones , a tale from a castle",390
The final woeful story from a hospital employee. Saved the worst for last [Warning: Gross &amp; Long],391
My car only seats 2,394
Worst workout ever.,393
"Curve Queen says my boyfriend needs a ""real woman""",389
[TP] Thin Privilege is riding roller-coasters with your friends,387
Gym Chalk,391
Does anyone else here read FPS for exercise and diet motivation?,390
Hamplanet Forces Child Into the Cult of Fat,387
Muscle weighs more than fat,386
The Epic of Porcina - Chapter Thirteen,391
Hammie and I go for chicken,384
"Fatlogic Strikes, I Counter",388
Hammila Borrows a Cup of Sugar,387
Restaurant Terror: Update. Now with a side of quenching beetus juice.,382
MaccyD's Throw Down,386
Grocery store snacking,389
The Fat-shion Designer,384
The Epic of Porcina - Chapter Ten,386
The Epic of Porcina - Chapter Seven,380
William MilkShakeSphere II: Hamlette,383
Dr. Ham and the wated morning OR How I got an involuntary psych eval.,388
Hammila and the Jar of Preserves.,379
Fating on the Train,390
My experience in the South (thin privilege and other things),388
[Meta] The Hubble Telescope's Shocking New FPS Deep Space Discovery (an FPS inspired wallpaper),389
"Not funny, but a fatal case of fatlogic.",389
I guess fat doesn't float (xpost from 4chan),386
A Hamplanet Judging Others In Orbit,379
Update to the guy's post about the youtube gem he found (I've been following it's hilarious),385
[TP] Thin privilege is not having to listen to your psychiatrist's psychobabble.,380
"Kimmy Gobbler in ""The Juicy Justice""",380
My work's mass produced signs have been fat shaming everyone!,379
Losing a friend to fat logic,388
"Hamplanets At The Pool: Give Me Cheetos, Or Give Me Death!",383
Old Hambeast almost kills a baby,378
My Weekend With a Hamplanet Pt. 3: The Grand Finale,378
My sister went to a nail salon.,376
The Epic of Porcina - Chapter Fourteen,374
The Planet and the Potheads Part II: The Barbeque,377
The Epic of Porcina - Chapter Eleven,383
"r/tall recommended I crosspost my story, so here is a glorious moment I experienced the other day",380
[TP] Not eating babies,375
Christmas with my hamplanet sister.,376
"Thin privilege is being shamed for no reason, but it's okay because you totally deserve it anorexic elitist bitch",383
Hamburglar Makes a 16 Hour Greyhound Bus Ride Hell,377
"""Just wait ten minutes please..."" (A story of betrayal and revenge, Part Two)",377
Gym Class Trauma: Dwarf Planet vs. Nerd Girl [Long],379
Uncle Tito and His Rotting Foot,379
An Hamerican Tale,374
The Pharmacy Applicant,379
Anon tells the truth,379
Fatass Coworker Part 1: A New Beginning,377
Carving some ham,376
Hamplanet goes to the hospital,374
Cross story. NOT green text.,374
Apocalypse fat... the horror.(long),378
The Sheeps Saga,374
The Epic of Porcina - Chapter Three,374
[TP] Thin privilege is not having a jihad against you,372
One night hammed,378
Disney World,375
"Hamgar II: Slurper of Soda, Cruncher of Chips",369
Very short story about my trip to WalBeetus.,368
Entitlement Police - Part I - Rascal-bound Pizza Thief,371
Another horse story.,374
The Epic of Porcina - Chapter Nine,373
Retail Whale: The Breaking,369
Hammy at the 5K snack table,367
Land whale spotted my BBQ. A day with a deep life lesson for me.,367
My Weekend With a Hamplanet Pt. 1 The Mall Adventure,369
Hamplanets of Med School,369
Medusa Nebula: Disneyland,376
Encounter with Canis Majoris and Sagittarii at the grocery store.,373
"My Triumphant Return ""rage follows""",367
A Wooly Hammoth Steals Home Improvement Supplies,375
Hamplanet on a plane.,371
Science Hamplanet decides she hates Elon Musk,371
Teacher hates me for losing weight. I still can't believe this happened.,368
Entering...the Adipocyte Zone: To Serve Ham Part II,369
How Kendall got her name.,369
[TP] The stereotypical fat activist being called out on her bullshit,366
More joy from Disney Land,369
Anon is more alpha than I,366
Fuck you Hamtares I: The Girth of a Legend,368
This story still annoys me to this day,366
"Kudos to anyone that works in the medical field, holy hell.",363
The only FPS I have for you all: UnSimbable,365
Army dad has no tolerance for fat logic... Not even from wife lady,372
fitizen goes to all sizes shop,372
How /fit deals with annoying fattie,360
"""Protein and fat are bad. Carbs are all you need. Trust me, I'm a vegan.""",360
[TP] Thin Privilege is listening to your doctor instead of Tumblr,369
The Nugget Tales: Cyber-Police,365
Hammey and the Cookie Jar,363
Rotundra’s Hamplanet Holiday Hoedown: Tales of a Social Worker Part V,365
The Saga of Popalopagus Part III: How She raped a Jew in my bed.,360
Baconators are more important than safety.,363
The cookie monster (found on /fit/),358
Retail Whale: Hope and Hopelessness,360
[TP] Thin Privelege is having a likeable appearance,362
The Epic of Porcina - Chapter One,364
"Makeup Whale: Part III, ""Fortune's Fool""",366
[Series] Trey’s Turbulent Travail - Part I: Tales of a Social Worker Part VI,360
"Makeup Whale: Part I, ""The Play's the Thing""",365
Fat privilege is...,367
"Oh, lardy!",362
"[NSFW] Hammallow tantrum'd over not being allowed to eat while wearing new and expensive marching band uniform, then leaves a mess in friend's bathroom after losing virginity",363
The death of a monster burrito,365
Fatty Prime and the Anime Con Adventure!,362
Porkplanet owes me a new blouse,360
Eurasia at the merch stand,361
[TP] Apparently some people are born fat.,360
The Epic of Porcina - Chapter Eighteen,357
The Fat-shion Designer III,360
Hamplanet refuses to help her mom when asked,359
A $45 lunch and a declined credit card,356
"[TP] Posted a while ago, but as an artist this makes me rage so hard.",358
[TP] Thin Privilege is not having to try on wedding dresses because you can just look at a model and figure out your exact size.,352
The Fatmate - Part VI,356
The Bus: My body was ready.,355
The Tale of the Lost Keys,360
It's sooooo much harder to be fat than it is to be severely mentally and physically disabled because thin privilege!!!,356
Tales From A Former Lardguard: Tsunami Warning,353
Just a few more stories from the themepark,352
"Walrus set loose in lab, can not keep self from eating possibly bacteria-infected food",356
Fast Food Ham wants free grease~,358
"EX-Body Acceptance Ally, Now have PhD in Fatlogic (KINDA LONG)",350
"""Fat is the new gay"" Prepare your jimmies for the rustlin'.",351
Butterball Art Thief,347
"Tales of my fat, psycho ex-boyfriend Pt.1",354
"Hammie is ""all muscle.""",350
Gargantuan foster-mom gut-golem cries foul at the supermarket.,351
"Ham Planet coworker makes a fool of himself, is inspired to change.",347
Hamager does not understand physics of small spaces,353
"Research Experience for an Ungulate, or How I Learned to Start Worrying (for mankind) and Hate the Hamplanet",352
McEvil: The Worst Kind of Person,349
My Weekend With a Hamplanet Pt. 2: Hammie Hits on My Boyfriend,349
When worlds collide - Moon somehow ends up at my house. Planet gets a fatlogic buddy for the night.,352
Fatty Wonderland,351
Entering...the Adipocyte Zone: The Hamspanic Part IV,353
Hammy's Logic: exercise damages your muscles.,351
Feels So Good Man,350
THIS MILKSHAKE IS ROTTEN,348
"The Tree, the trailer, and the hamplanet part II - They’re still here.",352
Skinny Hamplanets At The Pool,343
"Get the fuck off the elevator, you fatass",353
The one common thread in all fps,346
My first clinical day as a nursing assistant.,347
The Chronicles of Lardnia: The Diamon’ the Itch and the Lardglobe,351
"Sisterhood of the Traveling Hambeast
",351
Part IIIa: Flabpotamus gets a crush part 1,344
I just wanted a late night snack.,346
The Shock of Meeting Hamela Junior,348
Thyroid Excuse,346
"My Military Training with Robo-Fat, Part One: Fatty Can't Fit.",346
[semi-meta] Bought a diabeetus-inducing fuppaccino featured here out of morbid curiosity.,348
Dear Humans (tumblr post),346
Hambert versus The Stairs,350
My hambeast story,348
I was a hamplanet once,348
Popalopagus and the Pie Debacle Part I,346
Cakes over Dates,341
The Epic of Porcina - Chapter Five,346
Tales of hamplanetry and fatlogic through the eyes of a cardiologist (VII),344
In which hamlogic suggests weight equals strength,344
Hamburglar Eats Us Out Of House and Home &amp; Sweet Justice,345
Fatty Summer Changes,345
Poor PartyTray...,345
The Epic of Porcina - Chapter Four,346
Whale Tales: Buffetbane,339
Jimmies Get Rustled at Olive Garden Meeting,341
The time The Manatee got punched in the face [Part 8],342
The wheels on the bus whine about their condushions,342
"Target Landwhale, Casualty: Store Scooter",344
Hambert gets a Special Chair,342
No free dumplings for you.,346
Working at a public library apparently means that I am a slave to all tax payers,343
Ares vs Mother and Sister Hambulas--Part IV,336
Piles of snacks and bottles full of Coke...,336
Scantily-clad cacophonous Hamplanet sticks her nose where it doesn't belong.,342
Grammy Hammy and the morning run hassle,343
The Epic of Porcina - Chapter Two,341
The Fatmate - Part IX,343
The Fat Chronicles Part 1: The Earliest Ruslting,341
Of ham and hotels,339
Slurpee Whale (Beetus Juice Overload),341
[TP] My 9 year old sister is 50 pounds overweight but I swear she is healthy,341
Taco Mattress Dweller Horror,335
Porcinette; A study of fatlogic in healthcare.,341
Here We Go: The Tale of Tubbs,339
Being obese is the same as having cancer (Part 2),338
The voyage of the Pequad.,332
The Epic of Porcina - Chapter Six,340
Hamplanet goes to the gym,334
Saving the whales,337
Part 1: Lardquisha and the Moons - ConfectionAffection's Coming Out Story,331
Human Spheroid,334
Entering the house of ham,335
"TEEHEE, I'm fat cause of GENETICS!",330
Fatty Prime and The Anime Con Adventure Part 2,335
Not all those who fatlogic are hambeasts.,332
My Encounter With A Fat Vegan,337
Hamon-Ra and the chow mein massacre,332
Pharmacy Hamplanet,334
Tales of Hamtrigue: Enter Flabula,338
Big Rascals,337
How a landwhale almost cost me my job and sight.,334
"College room mate FPS--Oh god, the smell.",335
"Hamplanets visit ""TJ's""; chapter 2",334
Hambeast at the con,332
Being a fatty trying to make it,334
Lardzilla needs her beetusjuice,334
"Raised by a psycho planet. (not funny, just sad. Sorry.)",334
[TiTP]the only thing that leaves these mouth is hate.,332
"""Why are you exercising""",333
Two FPS nuggets from the Farmer's Market,333
"Giant Princess Terrorizes Children, or Chance Encounters With Abominable Snow White.",330
Rommates didn't make it,335
IHOP = International House of Planets,332
Ursa Major: Bear in a Restaurant,335
Tales of the hick town hambeasts part two ,335
Short paramedic story of fat people logic,325
21st century fatsunsense,327
[TP] Thin Privilege is not having a thyroid problem so severe that you can't fit in an airplane seat.,329
"Tales of my fat, psycho ex-boyfriend Pt.2",326
Skitty on Wailord Action Episode 1: The Phantom Hammace,331
Tales of hamplanetry and fatlogic through the eyes of a cardiologist (VI),329
Fatty Fakes a Handicap**,332
Part 3: Lardquisha and the Moons - ConfectionAffection’s Coming Out Story,324
"[TP] TV stars tend to be thin; therefore, all thin people look just like TV stars.",323
"[TP] Huff Post, Why?",331
Thin privilege is not putting the toilet through the floor.,330
The Fat and the Furious,330
"Hamplanet tries to force feed me onion rings, karma ensues",329
Nuoh my god,333
"Kimmy Gobbler in ""The Party Pooper""",326
Bar Blubbernought Bitches like a Boss,327
Retail Hamplanet,323
God Bless America,323
The Time Fat Logic ruined a families 4th of July.,322
Flabpotamus Part VII: Comeuppance,321
Dawn of the Dead Lift,322
Thin-shamed by Scooterbeast and Pizzaface,325
The Kid- Destroyer of Hamworlds,321
Hammelina takes me to a sex shop (NSFW),325
My roommate the eventual planet.,318
[Series] Rotundra and the Riotous Romantic Rendezvous: Tales of a Social Worker Part IV,320
"[x-post from /r/TalesFromThePizzaGuy] ""The worst and most awkward delivery that ever happened to me.""",320
Ursa Minor vs. Niobe and Meliboea: Birthday Cake,321
"Kimmy Gobbler in ""The Meaty Meeting""",324
"So with all the cringe-worthy, frustrating FPS on this board, here's one that might make you smile",323
"[TP] Yeah, because that's how the Army works. ",322
An encounter with a boy driven to madness by hamplanets.,317
Ares vs Mother and Sister Hambulas--Part III,314
[TP] Thin Privilege is not thinking the world revolves around you,320
The tale of HamPeezza,320
My roommate the eventual planet - no one else gets opinions.,315
2 cakes 1 spoon,323
"Muh Muh at the Hamily Reunion: Granny vs Hammy, The Final Showdown",318
"""No, duckducktigerduck, you can't stab people at Olive Garden""",320
The Hammoth Enters the Long Term Care Facility,318
Hambert and the half and half,315
Counselor Hamm'e,322
From the mouth of babes,313
Thin privilege is not having to deal wiyh anxiety,318
"What happened to Hammela after the Beetus Hut, FatLogic ensues...",316
The Privelege and the Bicycle II: The Chubbening,320
"As a fat person, I fucking hate fat people.",316
FATTY FAT FAT AND THE DIRT PIZZA,324
The fat-sister from hell,317
PorkPlanet Housemate: Chapter Nine - PorkPlanet's Holiday Romance.,315
[TP] Thin privilege is feeling bad about yourself because you're healthy.,313
These planes keep getting smaller and smaller,317
Hamgirl's idol is Marilyn Monroe,312
Hamifest Destiny I,319
Hamplanet repellant,319
The Trihamthlete.,317
Entering...the Adipocyte Zone: To Serve Ham Part I,317
Harvard disproves study that claims being overweight makes you live longer.,318
Fat People Save Me Money,313
Part 2: Lardquisha and the Moons - ConfectionAffection’s Coming Out Story,313
[META] Can we stop giving the characters in the stories one letter names?,310
Into the Maw of the Beast; Thin Privilege gets Crushed,313
The day I lost my appetite for Subway forever,311
The Twenty-Two Towering Tenets of Fatlogic,312
Your car is a girl's car,319
Waddle goes to Baltimore,311
[TiTP] Thin Privilege is getting shallow attention from Internet strangers!,309
Blubberbutt and The BlunderBus,313
Hamplanet can't get enough of the salt,312
Fat favors,312
The Tale of Ludwig ham Beetusven,313
"What The Shit Consumers, Part 1",315
Target does not Disappoint,315
Force Feeding the Skinny Kids,308
Ursa Minor: A Bear's Tears,314
I just... Wow.,313
Australian Elephant Migration - Epilogue,309
Getting tired of this sh*t,311
Why isn't there ranch on this?,310
Aunt Piggy and the 6 Months of Hamplanet Hell,309
Cloudy with a chance of beetus rain. Behind ThunderFupa and her offspring Fupulous Minor in the checkout lane.,316
[TP] Thin privilege is not being victimized by Facebook and Google,312
Realization of a Hamplanet,312
Shit people say to keep you fat,314
"""Tee-hee, I look like Marilyn Monroe, she was size 12-14!"" (info post with links)",309
Baconator II: Fudgement Day,310
"The Funeral, the Fight, and the Beck-ham: Alpha Anti-Fatties",311
Hammila Invites Me Over for Coffee (While Holding My Dog Hostage),311
