title,score
"Bender's ""smile""",3558
Still upvoting Father's Day posts? Why not Fatherman?,3132
Busted phone screen. Made the best of it.,3066
"Not a whole lot of people knew who I was dressed up as, but I believed in this costume",2762
Sluuuuuuuuurm,2686
Still makes me laugh.,2633
Never thought I'd laugh so hard at a Physics joke.,2526
Girlfriend gave me the Futurama/Simpsons crossover book for Valentines Day. This was my favorite picture inside. ,2483
Futurama fun facts,2460
"How I feel as a person who wanted futurama to come back, but never had time to watch the new episodes.[gif]",2437
Albino Humping Worm,2425
Scruffy's words of wisdom for the day.,2364
SubReddit Of The Day! Time to party,2323
Look who I spotted on the Upper East Side of New York City,2313
Found a 7 leaf clover today.,2297
I hear they rated him the greatest character in history.,2281
Sounds like they kept it.,2260
"After 7 glorious seasons, Futurama will end after this season.",2245
It's the things like this that make me love Futurama,2244
"Whenever someone asks, ""How are the kids?""",2212
I have a light that looks like the crazy robot [x-post],2191
Saving FUTURAMA could require paradigm shifting outside the box,2182
Need a manicure idea? Why not Zoidberg?,2168
I thought you guys might like the menu at vinnies pizza today.,2166
I noticed this in the background today,2162
His time has come!,2145
I made Fry and Leela a child... I have no regrets.,2107
It's just like the story of the grasshopper and the octopus...,2106
Found at a local bar.,2102
I'm looking outside to some beautiful blue skies...,2085
Reddit always bangs on about Fry's dog. This is the scene that always gives me watery eyes.,2082
Labeling some stuff around the workshop...,2071
One of my favorite Calculon moments...,2064
Probably one of my favorite jokes of the entire series..,2058
"I decided to crash as many parties as I could last night. I didn't get turned down at all and danced all night, this was my costume.",2047
I never noticed Bender's stocking before.,2034
"Most people at the con didn't notice him, he just walked around, sweeping things (x-post r/cosplay)",2034
Classic Bender moment,2029
My wife is taking laxatives to prepare for a colonoscopy. I drew this for her while at work.,2016
GF just congratulated me on making the front page of r/Futurama,2013
Many of us will be this guy in a few hours.,2012
Good news everyone! I built a Holophonor! (more in comments),2004
"It's no perfect, but I painted this on my wallet a little while ago!",1999
Halloween costume? Why not Zoidberg?,1998
"I'm a 30 year-old male gamer. This was my reaction when a group of teenage girl wanted to ""show me how to play"" their videogame.",1996
Real Life Planet Express HQ,1987
When worlds collide.,1991
Zoidberg's Life Cycle,1987
Why I love Futurama,1985
THIS IS NOT THE END!!,1983
"Whenever a redditor says ""look at ______ thing I did",1961
The worst part about being a slave..,1958
It's the little things.,1948
"Whatevers in there, it's the only thing I've ever wanted.",1932
I made another kid for Fry and Leels! Hope you like!,1926
This is the card I got for my 18th birthday!,1927
"I always thought that because the Lunar lander blasted off when astronauts left the Moon originally, Fry and Leela couldn't have got in it. Re-watching, I noticed this.",1929
An ex-girlfriend texted me today telling me she wants to get back together. This was all she got back. ,1918
"Sixty six years ago today, Fry did the nasty in the pasty.",1915
I've been rear-ended twice since putting this on my pickup,1913
Legalize it,1916
One of the greatest science jokes ever on television,1908
not sure if good or bad parenting...,1890
Awesome Scruffy cosplay,1886
Remember me! ,1883
One of the many reasons why I will miss futurama,1882
Drinking with my parents on my 21st birthday,1880
FryerFox,1874
How I Feel Now that I Bought My First Home,1873
I say it in my head every time. [xpost from r/misc],1879
This truly is the golden age of television.,1865
"Well, I guess it's time to indulge in some end-of-the-world debauchery. Who's up for an orgy?",1856
One of my favourite Futurama scene ever.,1853
Robot vision.,1846
Lately I've been finding myself relating with Zoidberg more and more...,1845
One of those days [x-post r/funny],1838
"Bender's crest is the equivalent of sex drugs and alcohol. Unless I'm mistaken the motto translates to something like ""Machine from God.""",1838
This was me every time something was said during the presidential debate. ,1832
"Regular Matter, Dark Matter...",1831
I will miss these little jokes.,1821
"One quote from Scruffy. Take note, meatbags",1823
"Whenever I get a bill for my student loans, the more I realize how it went down exactly like this.",1817
Favorite Opening,1811
I can't help but say this every time my phone beeps because the battery is low.,1799
1010011010?!,1782
The true love story of Futurama.,1783
This is my above my desk all day at work.,1773
I'll be in the chamber of understanding,1773
I love how the magazine lines up with Bender's face,1766
TIL this character's name is Earl (but spelled URL),1772
Netflix is letting us know it will never be canceled,1760
Has anyone noticed this loophole.,1761
After nearly 2 years of looking... I've got them all.,1763
Been a fan since the beginning and I'm just realizing what number this episode is.,1752
Just need a layer of paint (x-post woodworking),1747
"What I said to the car salesman, after my test drive. He didn't understand.",1751
Science explained,1744
This Scene always give me the feels,1739
My favourite Futurama moment.,1736
Fry's unfreezing made the papers,1734
Well r/futurama I got my first tattoo.,1738
Fry's coffee mug.,1732
My wife made this for our puppy,1724
"This is ancient Earth’s most foolish program. Why does Ross, the largest friend, not simply eat the other five?",1730
Saw this standing outside a local metal shop,1725
"Oh, Farnsworth...",1726
Recently got my Futurama monopoly board signed by Billy West and John DiMaggio,1721
"Just found this guy hanging around in season 1, 10 years before making his grand appearance in Into the Wild Green Yonder.",1718
"Everyone was in favor of saving Hitler's brain. But when you put it in the body of a great white shark. Ohh, suddenly you go too far!",1701
Don't get into the back of a Nibbler van.,1685
I gotta practice my stabbing!,1682
Painting i did on my bedroom wall,1682
Zoidberg rear window sticker,1674
What I thought of when I heard about the couple who almost killed their kitten with a vegan diet,1662
"So, does the professor have a Zoidberg colored hand?",1671
Xmas Eve...,1666
Scruffy. The Janitor.,1652
Welcome to Robot Hell,1654
Seriously,1648
The second time I've danced in public,1647
Here's a .gif I made of the opening captions of every Futurama episode.,1641
Everyday that I'm trying to get work done.,1635
Tired of old memes?,1635
Never noticed this before. (Futurama S01E03),1633
"Sad, but true.",1635
How I imagine Bender reading TIL posts.,1630
"I've had this poster for years, and I've only just noticed who's been hiding at the back.",1635
Which one of you works at my local Hy-Vee grocery store?,1626
"Sadly, this is me.",1620
"A friend works for Fox/Futurama, and this is her business card.",1611
My all-time favorite Futurama joke,1607
"Horse meat, anyone? [x-post from r/funny]",1614
Our neighbors WiFi name.,1611
"Oh Bender, you kill me",1603
How I usually feel while reading a TIL post,1611
Realistic futurama renders. Farnsworth looks amazing.,1605
I'm only 23 but I already know what my last words will be.,1603
Zapp's inner struggle,1593
I'm not sure why I laughed as hard as I did at this.,1582
It makes sense that Mom's Friendly Robot Co. would start in Japan,1575
This concept of wuv confuses and infuriates us!,1577
How I feel after having a futurama marathon with my friends.,1574
Best of both memes,1575
"I guess this is your lucky day, Pimp-a-roo",1561
This is how I feel shoppin for a car for the first time,1563
"I saw it, I can't unsee it. He messed up the 3rd face. ",1567
"In the end, it was not guns or bombs that defeated the aliens, but that humblest of all God's creatures, the Tyrannosaurus Rex.",1556
My favorite futurama drawing,1554
The sweater I got for my boyfriend :D,1552
Bender's Percentage,1551
My friends Gender Bender costume. AMAZING. ,1528
I know how we should take care of the safe.,1526
"How I feel about the new, but final, season of Futurama",1521
Even the comics are awesome!,1517
Captain Yesterday,1518
"You ask a passer-by for directions, only to find he 
has no face or something. (awesome t-shirt 
purchase from RedBubble)",1518
Woke up to this from my girlfriend yesterday. I even read it in his voice.,1509
Classic Futurama,1508
Welcome...to Jurassic Tank,1509
C'mon baby bender.,1512
"To this day, this is still the most touching thing I've ever seen.",1500
"One of my favorite lines from the show. I feel your pain, Fry.",1502
Futurama X Beavis and Butthead,1497
Bender on canvas. (Xpost from r/stencils),1492
So I was watching Torchwood and apparently the Planet Express building is originally from Cardiff (bottom right),1481
"What I think of when I do something nice and my wife says, ""Aww babe, you're the best!""",1484
Valentine's Day's coming?,1481
"Tom Sawyer, you tricked me...",1472
Just noticed this on my bag of cereal. Guess everyone's gotta start somewhere...,1471
Futurama Backgrounds Dump (Most 1920x1080),1466
"I was watching The Simpsons, when suddenly... (S4E19)",1467
Every time I see a case marked this way,1463
GOOD NEWS EVERYONE!,1470
"As pathetic as I am for feeling this way, this is why I love Futurama. ",1466
Was looking at kraken images when suddenly...,1461
I put up a sign asking my roommates to knock before barging into my room... I think they took their cue from Bender,1461
I'm on break. ,1451
"For my cake day, I present one of my favorite things about the show: Futurama Opening Gag - Seasons 1-9",1445
I sent this to my friend.,1448
"I made this a looooooooooooong time ago and it didn't find much love in /r/funny when I posted it there. Now that I know this place exists, I hope you guys enjoy it more.",1436
The drawer where I keep various lengths of wire,1441
One of my favorite lines from Bender. (S.04 E.04),1437
Girlfriend hasn't watched much futurama... I get this message just now...,1431
I think they left something in 1947,1432
The like/dislike ratio is neutral for all 'neutral' futurama videos. (Not sure if all of you guys saw this in r/mildlyinteresting),1425
Bender's light reading (From Overclockwise),1426
Glazed a bowl yesterday. Can't wait to fire it.,1425
I laughed a little too hard when I first saw this (xpost from r/trees),1421
Classic Zap,1423
Zapp Brannigan weighs in on Ridiculously Photogenic Guy,1423
Found an old Simpsons Comic and noticed a familiar face in the background,1411
Amy's calendar,1409
Paused to use the bathroom. Come back to this,1409
While we're on the subject of sad moments...,1406
What the russian scientists were really thinking,1406
A Futurama Episode about Germany and not a single Nazi reference but Beethoven instead? Thank you Futurama!,1402
"Fell asleep watching Netflix, woke up to this",1400
"12 years later, the REAL culprits are found!",1398
The only question I really want answered before it ends forever,1390
Zoidberg the home owner,1396
Just installed this. Now all I can think of is hamburgers made out of lungs.,1385
Stands back! I'm gonna puts my moves on her,1387
"A little late for the Mother's Day train, but this is my card from my daughter.",1382
Did anyone else notice the name of the tattoo robot when you look at it upside down?,1380
No love from r/funny. I'm getting a new car tomorrow and this is going on the back. This way people will know what the score was!,1380
"Revamping the Planet Express logo for a project in my Comp Graphics class,what do you think so far?",1383
A redditors policy,1380
[x post from /r/funny] thought this would be more appropriate here.. NSFW,1375
Then we add some matter! Any old useless matter will do.,1369
When I get downvoted into oblivion ,1367
Why I love Bender,1368
Well this sounds like a damn good TV show.,1357
We all know who really should be president. ,1360
My Facebook Timeline,1355
One Of Tony Stark's Suits Looks A Lot Like My Favorite Futurama Character [x-post r/ComicBooks],1357
By god. This is hilarious.,1350
"Because if Futurama, I helped by team win a trivia night tonight.",1351
Favorite Professor Joke (S2E14),1348
I may be a little behind but mind = blown,1352
Taco bell in year 3000,1349
Adobe Photoshop,1343
Every time I log in...,1346
This show would be interesting ...,1337
Found this in the physics department...,1340
Fry's words of wisdom for the day.,1336
Whoops,1337
the devil's emotions are playthings.,1327
So im out car shopping today all I can think of,1335
In the women's restroom at my local pizza &amp; brewing co.,1333
I drew my favorite non-Bender character.,1328
Busted Computer Screen [Inspired by M3GACHR0N's Busted Phone Screen],1320
"Recognized some street art when I was walking through Brussels, Belgium",1320
Probably the best thing I've seen Scruffy reading,1325
Futurama Peanuts,1314
Planet Express at its FUTURE location,1319
Futurama cast as the Addams Family,1313
"Oh, how I wished this was true...",1303
"Oh Futurama, it's the subtle things that make you awesome!",1308
Got this awesome iphone case for christmas.,1309
Roberto fan?  Just in case you didn't know...,1304
It's the biggest Jamaican platter I've ever seen.,1299
"After some intense arguing, I convinced my wife to let me put this important photo up on the wall. (x-post /r/funny)",1297
I may think of Futurama a little too much...,1297
Whenever the teacher says asks who would like to present first,1297
Fridays after work,1294
You're not paid to think.,1294
Hypnotoad's real life counterpart: The world will soon be under his control.,1296
oh bender,1288
I'm gonna build my own park bench...,1288
This one always gets me (Bender's Game),1288
Mitt Romney's new home,1286
This is the reason we will always love the show.,1285
All glory to the hypnotoad,1281
"I paused the first episode, nibbler really was there. (Shadow)",1284
Tots too Hot? Why not Zoidberg?,1284
Bite my illuminated orange ass!,1279
Every time I see this scene I can't help but laugh,1285
"Now that Facebook is requiring Timeline, I made the most of it.",1267
Shut up and take my money. ,1268
Sexy Leela (NSFW..?) I did a double-take when I walked past this.,1260
Still waiting...:(,1268
My coworker's iPod speakers thought about stabbing me,1269
"Watching the episode ""Fry and the Slurm Factory"" when I saw the Professor's 3D Scrabble letters",1260
My friends tried to make me feel like I was missing out by not going to a dubstep concert. My response wasn't very popular in /r/funny. Hopefully you guys like it more.,1261
New pope has been chosen. This is my hope,1253
This always makes me laugh,1252
Apparently a Futurama fan works at a local store,1249
Was worried about posting this but then realised nobody doesn't like Molten Boron!,1250
Good news everyone! I finally finished my futurama / star wars crossover project!!,1244
"This show has had a lot of great characters over the years, but this guy is by far my favorite.",1251
This is actually a thing,1244
Thank god most of our fans are huge perverts,1244
"How I feel when anyone asks me to do anything, anywhere, at any time.",1233
"I'm not the best painter, but I painted the Planet Express logo on my xbox.",1232
By far the funniest science joke in the series,1229
It's jokes like these that make futurama the best animated show currently on air!,1233
...I can't think of a more fitting name for it.,1235
East Coast weather reports lately.,1231
"Apparently, there really was a radiator woman from a radiator planet (S4:E12)",1224
Sums up high school fairly well.,1220
"Come on , shake your body baby, do the conga !",1220
We all know what should replace Futurama...[FIXED],1220
lolz were had,1227
"Shit like this, Futurama.",1218
"Sometimes, the best jokes are the simplest",1218
This line from The Why Of Fry has to be one of the saddest in the show,1216
My friend made this when his tangled headphones reminded him of someone.,1210
Map of Europe? Why not Zoidberg?,1205
Someone's pending for a halloween Bending,1208
Random pull and I'm luckier than I thought! ,1205
I thought this was cute (x-post from /r/adventuretime),1199
My 7-year old cousin discovered Futurama. Obsession ensues.,1195
"Was watching ""Bending in the Wind"" when I came across some alien language in Utah. I used the code to translate it, it says HUMAN FARM!",1186
"Was working through my C++ textbook, decided to have some fun with a password checking program.",1188
We're off to the most romantic city on earth!,1187
Shall we begin the campaign for Nixon?,1189
"If it takes forever, I will wait for you *L5P Pizza, Atlanta* [X-Post /r/atlanta]",1187
Flexo's head the day Bender was born - in the assembly line. (Repost?),1190
"Now, I'm not saying that Professor Farnsworth is old, but if you consider his age he's going to die soon",1186
Bender (Cosplay),1180
Every time I get on Netflix and try to find a quality movie,1180
Bender finally did it!,1181
"""Kif, if there's one thing I don't need it's your 'I don't think that's wise' attitude.""",1179
The little things in Futurama...,1173
Lego Bender design available at Ript today only (Link in comments),1173
Scruffy &amp; Washbucket wedding cake topper,1173
To the first guy to make a decoder ring for Futurama's alien language...,1163
So my mum went to Supernova and came back with this,1167
How I feel as trying to sleep on my side.,1159
Every time I drive my car...,1155
Need a candidate to vote for in your local election maybe?,1150
Bender still lives with the penguins.,1146
"Some sculptures I made of Nibbler, Mr. Peppy, and Hypnotoad.",1148
When I hear a child crying on a plane..,1147
Math teacher makes reference to Fry's bank account.,1149
My thoughts about tonight's premiere,1141
"Oh, Linda. Gets me EVERY time :-)",1141
I brewed Benderbrau!(x-post from /r/homebrewing),1135
"60"" full HD 3D TV, still cant make out Amy's obscene tattoo...",1136
So painfully true .. ,1129
...and one more to wash that slurm taste out of my mouth.,1135
Adams Futurama,1124
Professor Farnsworth and a Transformers blanket,1129
"A deal is a deal, even with a dirty dealer!",1125
"Bite my shiny metal ass, classy bender [x–post from /tattoos by suggestion]",1124
So there's a r/zappbrannigan/ now . . . ,1127
"Hey look, an ugly scared guy!",1122
Fry would be pleased [x-post from r/fallout],1118
Look at me! I'm Doctor Zoidberg: HOMEOWNER!,1122
Scruffy Cosplay (X-post r/pics),1121
Something seems fishy about those McBites,1118
What do you think of my Professor Farnsworth cross stitch? ,1105
One of the smoothest gifs of this scene I've ever seen. (also my favorite moment),1110
Zoidberg knows whats up,1110
Hypno toad my wife found,1101
"Oh Bender, you always knew the right things to say...",1099
I have always wanted to do this at an auction,1094
Who's ready for some safe fun? [x-posted from /r/motorcycles],1097
"Posted a comment and saw cake next to my name, had to start here",1097
"Today, Lauren Tom (AKA Amy) came to my city :D.",1096
I'd watch the shit out of this show.,1094
I just noticed that there are 2 Grover Cleveland heads ,1087
Favorite Zoidberg moment from the new season,1085
Never know what I'm gonna do next!,1083
More Drawings! I can't stop!,1085
Hail Science!,1081
More subtlety from our favorite show,1080
Never knew they were the same species!!,1078
DM;HS,1070
The Headless Horseman's Jar [Crossposted from /r/funny] [600 x 400],1074
Its saturday. Today is my birthday. I have no girlfriend but I have my orange soda and my mixed tape music. Im just turned 18. Im ready,1071
It would happen sooner or later,1071
"""Nuh uh, Cause I'm double Leela!""",1070
Happy birthday Billy West!!,1069
Always one of my favorites,1070
Whenever I log into reddit,1068
Karma explained by Futurama,1068
Check out what's on sale today at teefury.com! ,1066
US in 31st century according to Futurama (x-post r/mapporn),1062
Every day off,1064
What time is it?  Time for Slurm!,1061
Good news everyone!,1065
In need of a new emoticon? ,1062
More futurama references in The Simpsons.,1055
New futurama June 19th,1060
The best one of the three!,1054
Zoidberg mirrors my feelings on having spent lots of time accumulating internet points.,1058
Panuccis Pizza Dublin,1057
I love it when they spend an entire episode setting up a joke,1060
Need a Gif to upvote? Why not Zoidberg?,1060
Not now. I'm eavesdropping.,1057
A robot would have to be crazy to want to be a folk singer.,1053
This is why I love Futurama,1057
This guy walked in wearing an awesome shirt. how am I NOT going take a picture?,1054
Zoidberg finally got the attention he deserved ,1052
Seen On The Streets Of Buenos Aires,1053
Picked both of these up for only $10,1050
This is why I love this show.,1052
It's the little things that make this show great,1050
Just got these today... Well I know what I'm doing tonight!,1046
There's something familiar about this...,1047
Parenting level: Bender,1048
On the Curiosity rover that will descend to Mars on Monday,1038
A neutral amount of dedication,1042
Benders hair and stool sample.,1041
"Forget 'Jurassic Bark,' this will always be the saddest episode to me S03E08",1042
I love these little nuggets,1035
Fender Bender,1035
"Couldn't decide which one I wanted, so I got both.",1035
You had one job....,1028
Overly Attached Lobster [FIXED],1033
Every time I see the 'Remember Me' joke get reposted,1030
Did Futurama just do an Enders Game reference before it will be cool?,1022
"Blank! BLANK!? You're not seeing the big picture!
- or -
I like to dress up for work.",1027
Coincidence? I think not.,1026
I love futurama!,1017
"That one hit too close to home, futurama",1021
My newest set of hand-painted Futurama glasses- would you buy these?,1023
(x-post from cosplay) [Photograper] My friends decided to finally finish a long-awaited cosplay for Taiyou Con this weekend.,1016
"Everyone in the dorms were carving pumpkins, here's mine.",1018
"I have to admit, the man likes his miniature golf.",1017
I'm glad people in my town are cool. ,1014
I thought she was pregnant. Nope.,1009
Has anyone else taken the time to read through Amy's calendar,998
One of my favorite little jokes ever.,1004
One of the books Bender reads when he becomes a super computer,1000
My plan to make it to the front page...(X-post from r/AdviceAnimals),995
The Heartbreaking Stories of Fry's Family,994
One of the best intros.,994
Look what I found,987
Still true in 2012,988
"My wife has been watching futurama while we sleep for over 3 years, there is only one episode she has never watched. I can't say I blame her.",988
C'mon man.,985
Special Surprise on Free Comic Book Day!!,986
No no no my friends. This is who should play Zap Brannigan in a live action futurama movie,984
The ending scene in Leela's Homeworld doesn't get enough credit for being one of the best moments in Futurama.,987
He's stabbin' angels now...,982
A coworker made this as a baby gift for our son... 3 months later and it's still the best one.,983
Tonight at 11...,982
I wish i could be this proud one day,974
TIL Bender runs on AMD.,974
A friend recently got me a job where she's my supervisor.  Here's our new relationship.,971
I had the strangest dream last night...,974
I think that's how Barenaked Ladies started,972
Life found on Mars!,970
Quite possibly one of the best episodes in the entire series. ,971
"was watching Futurama, realized he died this year",969
I saw this at my local pet store,969
It's the little things that make this show great [Check the Fireplace],959
Found at a pizzeria in Midtown,958
It's the little things that makes me like futurama,962
"Any futurama fans also like Charlie Chaplin? I found this Modern Times reference in Vol.5, Ep.5, The Duh-Vinci Code.",959
Spotted El Zoido in my hometown.,967
Not sure if I posted this last Halloween,956
"Sometimes you need to have a show on in the background, just listening, before you can catch a great joke like this.",959
If this also applies to Reddit I'm screwed.,956
Mum asked me how I improved her cake recipe,958
My fav opening credits line,956
A quick Kif Kroker portrait i made.,953
Saw this while walking my dog yesterday,951
In the episode of Futurama when the professor makes the forward only time machine...,944
"Congratulations Doddlescoop, you got noticed by Futurama!",944
One of my favorite Bender lines,950
Every time I click the remember me button.,947
Naturama- The last of their species,952
I found an interesting easter-egg in Reddit's robots.txt file,943
You bet your sweet metal ass it's his park! (Xpost from funny),946
"Being a huge Futurama and MST3K fan, this is possibly my favorite reference I have noticed in the entire series.",944
Quit scratching your ax hole and get back in there!,941
"Fear not, my Lord. We shall be with you soon!",939
I would see this in a heartbeat (x-post from r/funny),943
How I tell my girlfriend that I'm on my way over to her place.,928
it's highly addictive!,933
Zoidberg Wallpaper,932
How Amy studies for her doctorate ,930
"I hope, someday, my grandchildren's children can apply Bender's logic to the environment (sort of)",927
"Ask not for whom the bone bones, it bones for thee.",930
Nice little reference.,929
When I ask my boyfriend for more snoo snoo...,930
Continuity excellence from a Scruffy line!,926
awesome futurama sleeve.,920
No love for Zoidberg.,912
"Everyone gets teary eyed about Seymour, but this scene hits home as well.",916
This isn't a fat camp for god's sake....though you wouldn't know it from looking.,914
"After reading a headline in r/science about Ambergris, this is all I could think of.",912
One of my favorite tear jerker moments,913
"""Bite my shiny daffodil ass!""",913
