title,score
Not sure if good Halloween costume or just biased self-perception,909
It's little things like this that always kills me ,912
I recently started painting glasses. I thought I'd start with my favorite Futurama characters. What does reddit think? ,915
This is from Futurama's facebook page,907
New office... had to do something about my bare walls.,905
Just saw this on the Simpsons...,909
Apparently my textbook author watches Futurama (x-post from pics),910
How I felt when I found out Futurama didn't win the Emmy for Best Animated Program,905
"just saw this on a re-air, i love the lines they create for Zapp...",906
Got my new shirt in the mail today!,902
Need a vanity plate?,899
How I feel whoring for karma on my cake day,900
I hope this new Matt Groening show is good (Wired Feb 2000 cover),897
"Also, mine has air conditioning.",896
My black ops 2 Bender,894
I posted this in /r/screenshots and got told it'd be good here too. Cartman's head in the head meseum,899
Futurama Just Updated Their Facebook Page,893
A 3D artist did some renders of lesser Futurama characters and they are AWESOME.  Here's Lrrr of Omicron Persei 8.  Link in comments.,891
Dat small Simpsons reference...,888
"I don't know about you guys, but this is who I'll be missing the most...",887
How I feel about the majority of content on Reddit,892
Futurama Wallpaper I made,890
I've Got a Hot Date Tonight.,891
"Found this in an art gallery in Canberra, ACT",888
I saw this on Fryday.,886
Was watching an episode of Futurama and noticed there were two benders in one scene.,888
"If it's stuck in my head, meatbags, then it should be in yours too.",885
"Oh cruel fate, to be thusly boned",881
How Zoidberg skis,879
spotted this in college station,876
Now Zoidberg is the popular one!,882
These Guys Get It,876
The only actor who could play Zapp in a live action movie/show,872
Calculon never forgot....,870
I found Leela's glasses,871
I needed to share this with people who would care.,864
"Just what the Bureau of Soft Drinks, Tobacco, and Firearms wanted us to believe was in slurm",866
I'm part of a 24 Hours of Lemons race team who's running a Futurama theme. One of the traditions is to bribe the judges with alcohol. Homebrew away!,870
Phillip J. France,870
"If anyone needs me, I'll be in the Angry Dome",866
I bought this for 5 dollars at a garage sale. ,868
"I don't like to screen grab that often, but I had to have this as my desktop.",868
"Welcome to the future, human slave.",862
"Just about sums up how I feel every morning when I get up to go to work, I need a new career chip",865
My Seymour. ,862
"So Tagg Romney wants to take a swing at Obama, eh?",855
ಠ_ಠ,856
A little project I started last summer but never finished,854
Then Explain This!,853
This instantly reminded me of Zoidberg (x-post from /r/WTF),855
"I don't know who you guys are rooting for in the Olympics, but I'm all for Robania.",855
"The Luck of the Fryish, and Jurrasic Bark are both sad, but sweet, episodes. But I don't think enough credit goes to this sad/sweet episode",849
Yep...,849
U.S. Govt. Dept. of Hot Sex,848
"Hubble found a super old galaxy that shouldn't exist, but we all know who He really is, even if we're not sure if He's done anything at all",852
I wish this was a real game.,852
Robot Devil wall mount,843
So I finally decided to translate this note after watching this episode 100 times. (Translation in comments),843
I made a felt Planet Express ship,841
The only sticker allowed on my snowboard...,842
First day of school...,837
I thought Amy had a good point. I'm still confused.,833
Hermes is just fat,834
I love this Fry face - (S01E01),832
Look who makes an appearance at the All-Star Pizza Bar in Cambridge Mass.,835
Bite my shiny metal ass! (Two),836
"Favorite minor / background character? Personally, I freakin LOVE this guy. ",831
A familiar face again in The Simpsons,832
"First image from ""The Six Million Dollar Mon""",825
Why I love Bender.,828
"Well done ""Prometheus"" viral marketing! Very well done indeed...",828
My little brother asked to see my TI-83 and handed it back less than 2 minutes later,826
"Oh, the hypochondriac is back! What is it this time?",827
If Scruffy was a dog.,823
My humble tribute.,823
"Nicely played, Zoidberg.",821
Hipster Number 9 Guy,819
"I'm going to start my own meme, with blackjack and hookers.",818
"Rewatching the first season, one of my favourite 
episodes - ""Fear of a bot planet"" and I caught this.",812
"I turned down a party invite to instead watch Futurama, drink wine, and have some ""me"" time. This was the title caption on the random episode I selected. I am the target audience.",817
I've been saving this for my cake day. My experience on Reddit summed up in one picture,813
I feel like this car has one too many headlights.,813
Snoo Snoo,811
I found this in a truck stop in Tennessee,811
Every time this pops up I always think the same thing...,808
First thing I thought of,813
Found this today for $10,810
Taking it to the next level...,811
The original overly attached girlfriend,802
My co worker drew me a picture for the office,811
"Scooty-Puff, Jr.?",802
Saw this on my way home from work.,801
This bender quote reminded me of troubleshooting in the military...,802
Baby Bender [1920 x 1200],795
I love little jokes like this,797
The third hour of scanning reddit posts...,799
"Matt Groening, you magnificent bastard.",794
This is all i want from Robot Santa,793
Our neighbors understand.,797
"The many, many voices of Mr. Billy West",791
Combined two of my favorite shows using the Futurama iOS app,791
"So this guy's in the rear of a full elevator and he shouts, ""Ballroom please."" A lady standing in front of him turns around and says, ""I'm sorry, I didn't realize I was crowding you.""",786
"I see your holophonor, graveyard, dad, dog, stars, and narwhal, and raise you a twist revealing a bureaucrat's big heart [S06E06 - Lethal Inspection]",789
Got some buddies for my desk!,789
"I saw two cars taken away after a crash today, Then I found out why!",778
Look what I Found!,784
Where can I buy a print of the characters? Fedex Office Print told me NO GO,781
"""Well, getting the brain out was the easy part. The hard part was getting the brain out. HeehahaHaahHeeEehahuh!""",784
Farnsworth on exams,779
Smell-O-Vision,779
DragonGirl485 made a giant Fry and Leela.(xpost from Minecraft),779
Did you hear maracas? No?,778
"Amy Wong, ready for some end of the Earth debauchary. ",774
Got tons of compliments on my new futurama shirt today!,777
"Watch it ya stumble bums, you're booping my Betty.",774
S07E07 - alien language wall grafitti translation,770
"My favorite scene, still makes me laugh every time",770
My favorite joke of the whole series. ,764
Mindblown.,766
I. CANNOT. WAIT.,773
Happy 4th r/futurama,763
Good News Everyone! I've been rendered with horrific detail! (x-post from r/alternativeart),762
Bender in the Simpsons episode Bart vs Lisa vs third grade ,762
Wanted to share my favorite Futurama moment for my cakeday. Never fails to make me laugh.,761
Futurama is quite big in Russia,764
Awwww the subtlety...,758
Watched a video in class..,761
Death by Snoo Snoo!,754
Saw this on my way into work Friday.  Thought y'all would appreciate it.,761
Wooooo!,758
It all makes sense now,754
found this nugget on family guy last night,762
Jazz references I noticed today rewatching Roswell,759
Do a flip!,761
Coloring with my 2-year old. Doing it right...,755
I'm turning 25 this year.,750
Still my favorite quote from Futurama (x-post from r/funny),760
I must've missed this episode.,755
This made me chuckle.,749
"shh, it's sleeping!",751
So which is it? Space Wasps or Space Bees?,746
"Dr. Zoidberg, Terror of the Sea",750
"I Laugh, Every. Single. Time.",749
Everytime I fill out a form that asks if I have any disabilities...,748
The TV was on in the background when I heard the theme song start so I looked up because I wanted to see the caption gag,738
If only it were this easy to get a job that awesome...,742
From Sweetleaf in NYC,740
Before there was Planet Express...,741
"My boyfriend loves Futurama, so I made these for him for our 2-year anniversary. (xpost from r/pics)",738
The things I would do for this...,738
"My newly framed, Billy West Autographed Zoidberg poster.",734
Street Art!  BAM!,732
"I Made This A Long Time Ago, Might As Well Post It",734
One of my favourite lines from one of my favourite characters ,732
"While assembling some furniture, I suddenly felt the need to practise my stabbin'...",730
A few wallpapers,728
Was doing a planet quiz and this made me smile.,730
Fry sure loves Scruffy,727
My collection is coming along nicely.,723
"Didn't want to throw away my old Futurama Calendar. Saved a tree, geeked up a wall. ",724
I think Fry and Leela can now become leeagy weegys like Bender,727
"Professor, my Fry fro is all frizzy",720
Together Wendy we'll live with the sadness,728
"Good news everyone, I made a Futurama pint set!",728
"Every time I see a ""2"" next to my submission.",726
You'll Never Guess Where I've Been,723
one word.....thundercougarfalconbird,720
Did anyone else think this was the funniest part of the latest episode?,720
Explain THIS!,710
Indeed so... most indeededly...,710
"""And one more to wash that Slurm taste out of my mouth""",706
"Fry, of the rotten branch of the Farnsworth family tree, asks immediately ""Whats with the 17 dung beetles"" - hidden genius for numbers?",712
One art please! Card my wife made for me.,712
Futurama by Evan Shaner,706
"I like your nerd glasses, are you a college student?",704
"""That Does Not Fempute!""",701
Hot Crackers!,705
Homer Simpson + Marge Bouvier (x-post from Simpsons),704
When I found out that Comedy Central had canceled Futurama :(,701
Good news everyone! Cake.,701
For the debate tonight,699
"Not sure if they didn't show this part on TV, or I'm just unobservant.",696
The little things exist in the merchandise too. I really will miss Futurama...,695
Is it back already?,690
There is a petition site to help save Futurama. SIGN UP.,690
"I got a new shirt today, meatbags ",685
I am the man with no name.....Zapp Brannigan at your service.,691
Just fueling up.,690
Sooo... I met Billy West today. ,690
One of my favorite Roberto lines,686
"I made this Fry mural from bottlecaps, here's the album",686
Even cooler than we realized. (x-post from pics),687
Before Zoidberg there was... Dr.Crab!,681
Spotted this in Athens (GR) and it looked strangely familiar,679
watching fry (x-post from /r/tvgifs),686
Oh Zoidberg...,678
Futurama saw the Great Recession coming from a mile away (x-post from r/funny),680
"""If you want a truly exceptional knife to slice up your friends in their sleep""",673
What'd I miss? ,677
What happened to Mrs. Zoidberg?,674
Coincidence?,672
Give me back my hands! These things are always touching me in... places.,675
Old Time Bender,671
Bender has a heart. (The Beast with a Billion Backs),671
The making of my Reddit gift,672
Welcome to the world of tomorrow!,668
Bender has fiiiiiive kings.,672
Watching Futurama when suddenly...Firefly?,674
"""Oh my god, a giant roach!""
""oh, i thought i put that away!""",667
Every time I see another positive story about the new Pope...,668
My favorite quote from Bender's Game,669
"My brother's got a thing for Zoiberg, I got a thing for MsPaint...",665
ALL GLORY TO THE HYPNOTOAD!,666
Someone did this in Universe Sandbox. Thought you all would appreciate it.,660
The reason I became fat...,662
My favorite Zap quote,662
Cool Futurama wallpaper for iPhone,658
I feel this is necessary...,661
"One art, please!",655
I found another Simpsons reference (don't know if this is a repost) ,663
My Bender Tattoo,660
Dr. Zoidberg; homeowner!,655
figured some of you might like the shirt being sold at teefury.com today,657
So this is my boyfriend's costume for a mafia themed party (X-post from r/pics),652
Found on a storage unit site. (xpost /r/funny),649
"Continuity! Also, I guess the weather doesn't change much in New New York.",653
A Futurama timeline photo I made for myself.[x-post from pics],651
Leela's parents were in episode 5 of season 2.,655
My favorite bit of continuity [x-post from r/funny],653
"It being mothers day and all, here is my favorite Futurama Mom.",652
Father-Man &amp; Son-Boy,651
"Animated GIF of sad Zoidberg I've made recently. Feels bad, mon.",648
"With all these women around, they were probably *nagged* to death, right fellas?",639
So I looked out of my window and saw these guy's!,648
"""And the other hamburger will also be made of your lungs!""",643
Guess what WE had for dinner?!  ,646
I only had Blue,646
Saw this awesome Nibbler van on the way to work this morning,643
"My reaction to last week's episode
",641
One of my favorite jokes in the entire series,638
The only time I've ever danced in public,634
"Love the consistency in Futurama, just another example here even 6 seasons later. ",630
One of Frys greatest lines,633
"Went to Free Comic Book Day, thwarted a crime, and won a costume contest. All dressed as Roberto. (Xpost from r/funny)",633
This gets me every time. I love the writers. ,632
...fatherman away...,627
The writers of this show know their audience all too well...,632
Saw this little guy at a model convention today.,623
My newspaper unknowingly mentioned New-New York today!,619
What the last spoken line from *this* series finale should be,619
Executives. (X-Post from r/funny),621
Second saddest moment in futurama,624
Everybody was doing it. I just wanted to be popular.,620
Look who I found in a Yahoo Interview!,623
Whenever I see Sweden on the Olympics,626
Came here for the first time after seeing this posted on r/AnythingGoesPics,623
Look who I noticed in Benders Big Score,615
One of my favorite small characters,613
"You're my hero, Hermes! I'm gonna be just like you!",618
Could someone redraw this doodle into a decent looking tattoo? I want to get it but do not have the talent to draw/color it!,613
"Planet Express, the early days (original content)",616
"How I feel as a forever alone, when someone mentions swag",613
What I think when I downvote a comment,619
The House Farnsworth Sigil!,608
How I feel when my first ever post gets downvoted,613
Need a random monster for Spirited Away? Why not...,609
"Is it just me, or is this Philip J. Fry in Home Movies?",611
You guys didn't seem to care for my last drawings but here's another anyway,609
I hope this will be part of the finale.,610
Co-worker knew exactly what to get me for the Christmas exchange,609
I was looking through a jukebox's song selection when suddenly a song title made me think of Fry...,610
Forever Alone With Futurama,604
"Wow, I didn't know a lot of these!",606
My office art making my cubicle feel a little more like home,606
Timeline of Futurama,603
"As an older brother, this episode make me tear up",598
Please wait 987 years...,598
It is time....,600
We can always hope,595
Billy West reads your favorite Fry/Zoidberg Memes!,594
Mother's Day,593
The big brain am winning again!!,588
"I was watching ""Hugo"" which is loosely based on the filmaker Georges Méliès, and during one of his movies, I found that I recognized a scene",587
Still a better love story than Twilight!,587
80's guy. Cat version. ,591
Joined a BestBuy support chat as Bender.. Was not disappointed,590
Why I love Futurama. (Part two),590
Saw this out on a drive today and wanted to share with /r/futurama,586
True Love [Assie &amp; Bender],589
"Well, I guess reality is what you make of it",583
I see your Jurassic Bark and raise you the scene that was truly the most heart-wrenching [S03E10 - Luck of the Fryish],580
"I made a cover photo for you all, hope you like it!",587
They all look so happy!,581
A truly inspiring quote.,578
How my friends deal with politics on facebook,580
"""Give me your skin!""",575
Found this in my Sociology textbook. ,576
We Always Talk of Sad Episodes.  Haven't Seen This Jewel Posted Yet...,577
Think I found A Crazy Stabbing Robot,580
"This birthday present is definitely getting hung over 
the mantle.",578
Philosophical Scruffy,573
Look what my girlfriend made for me!,574
Classic Donbot,573
Sometimes it's the one episode characters that crack me up,575
Life and death are a seamless continuum. mmhm.,566
i've seen a few people posting their Con photos they got with Billy and John. I was their photographer and snapped this in between sessions.,571
FINALLY! A candidate's platform I can firmly stand behind!,571
The images are truly horrific.,568
Re-watching the series for the billionth time..  laughed so hard at this moment...,570
Futurama Car (x-post from /r/gaming),572
When someone tries to tell me to do something. ,567
Absolute Genius.,564
This post is brought to you by Charleston Chew.,566
got milk?,561
Why not trapazoidberg?,563
Makes perfect sense,561
Bender the art critic,558
I know what I'm doing for the rest of the weekend.  I've been saving for this for months.  ,556
I found this guy at a local Goodwill for five bucks. I was over the moon even before I realized that he was filled with DVDs.,559
"Some snacks for my friend and I, as I start him on his journey, beginning in Season 1!",561
The only doctor needed at a festival.,559
"The new episodes are great and all, but I still feel like this was the perfect end to the series...",557
"So I was watching ""The Frighteners"" tonight ... apparently Matt Groening is a fan.",553
All hail hypnotoad (xpost from r/funny),554
Oh Zapp...,554
It's always the little things,548
I deliver pizzas around a large university. Drunk college kids already know Panucci's secret.,549
Futurama wins Emmy for Best Animated Series!,547
"Bender, you're blind stinking sober!",544
"Watching ""Amazon Women in the Mood"" when I noticed the club...",548
This is instantly what I thought,542
Zapp Brannigan: Tactical Genius.,536
TIL Zap Brannigans last name means going on a drinking binge,545
Another Why Not Zoidberg painting!,535
Neat! (A photo album by Bender),533
I wanted to show you what I just finished,534
Pioneering ,539
i laugh everytime,537
"Your graffiti is bad and you should feel bad! (also, you had red paint, why not Zoidberg?)",538
I made a T-Shirt,533
Look who I found,531
Recommended by Dr. Zoidberg,531
Old man waits 10 years in line for a death certificate.,539
The name of That Guy is Steve Castle.,533
Zoidberg Campaign Poster finally printed &amp; framed,534
My Secret Santa Done Good,536
"As smart as the writing is on Futurama, their ""low brow"" humour really makes me laugh.",529
One of the strangest moments in Futurama,532
It's the little things. 10 years later and I just noticed the Trident on Hank Aaron the 24th's Brave's jersey (Atlanta had already sunk),531
My immediate reaction. (X-Post from /r/pokemon),531
My five favorite benders,534
not fooling me..,529
My own Halloween Group,528
How I feel after reaching 300 karma...,532
You call that an ink defense? (S6E6),528
I went to MOMA and...,519
"When I read the TIL about spray-on clothing, I immediately thought of this.",518
...times two... carry the one...,523
"""You know, boys, a good captain needs abilities like boldness, daring and a good velour uniform..."" My Halloween costume. ",522
Futurama Nail Art - Brain Slug by ~KayleighOC on deviantART,520
"I'm sure most of you have seen this, but in case you haven't, here's something I made in MS paint. (x-post r/adviceanimals) I prefer feedback over karma :)",518
Good News Everyone! I finally figured out my FB Cover Photo,519
Awesome lego futurama! (x-post from lego),522
Making room for another unknown comic...,525
"My two favorite things are commitment, and changing myself.",518
I need this.,520
A random line I find myself quoting constantly... what lines do you quote the most?,519
Possibly the sweetest couple of lines I've heard in ages,512
One of my favorite moments from the new seasons of Futurama...,514
"Found this in NYC, thought you might enjoy.",515
My favorite Scruffy quote,514
Snoop Lion showing some love to the Futurama crew (x-post with pics),514
"My sister got this for me for my bday, I love my family",517
One of Fry's best lines...,516
A work-in-progress picture of the Futurama cast that I've been working on since October (warning: super large),514
Oh Zapp...,511
"After watching 10 episodes in a row, I think futurama was trying to tell me to go outside and enjoy the beautiful day!",514
So i was watching the Simpsons last night and look who i noticed,513
"I'm excited for new episodes, but in my opinion, if the show had ended with this scene it would have been perfect.",505
Why I love Futurama (x-post from funny),512
"""Ding-dong""",507
Darth Sploder,515
Look who I ran into in the employee lot the other day...,507
"The life cycle of Dr. Zoidberg, as drawn by my girlfriend.",512
Latest addition to my livingroom,511
I thought you might like this /r/futurama,503
Best Futurama title caption of all time?,508
"I thought if anyone would appreciate this, it would be r/futurama",507
"""Very good, sir. Shall I pre-warm sir's crack pipe?""",504
"I see your graveyard scene, and raise you the most bittersweet scene of the entire show.",507
"The thing that got by the censors David mention in his AMA yesterday, with a bonus shot of the sex shop",505
All Hail the Metal Lord!,503
Need a costume... why not Zoidberg?.. A gift I made for a friend,507
Probably the most heart warming ending.,502
Brannigan's take on smoking,496
ALL HAIL THE HYPNOTOAD!,498
Future Time,498
I predict we'll be seeing lots of these status updates next time Facebook changes its layout. [x-post from r/adviceanimals],496
Let's Parrrrtyyy!,498
"Enter this page, press CTRL+F and search '6'. Google Chrome only.",501
Bender Graces me with his presents every day.,497
This is why I love Futurama.,496
The Death of Every Waterfall Family Member,500
"Being single on February 14th. Ah, Valentine's day...",496
Picked this up at a flee market for 2$. It's going to be a good night,490
Got Milk?,489
Look who's at the Galactic Bazaar,491
Slinky,487
"Like everyone says, it's the little things",492
"Me, when i see my crush with another guy.",494
Jokes in the small details are awesome.,489
How I feel after realising I have no upvotes - thought it might be more appropriate here than in r/memes ,490
Who's playing pin the tail on the moon maggot?,495
"Suddenly, nothing makes sense.",491
Yesterday was my real 40th cakeday - I think my cake was made with blackjack and hookers!,485
Futurama as X-Men characters ,486
How tough am I?,488
3.142857142857142857142857,490
Fry and Leela cosplay (X-post from r/pics).,488
The absolute FIRST appearance of Leela's parents!,484
We're Owwwwwwl Exterminators,486
"Doing chalk drawings with my daughter. I called this one ""Tend to the Widow Pac-Man.""",482
All I can think of when I see the Google Glass...,486
Blernsball clown,484
The same deviled egg,485
Fry says what we're all thinking...,483
Anyone else think it's time that this guy got an episode about him?,481
Turns out Fry isn't the only one who's unsure.,485
S3EP1 - Amazon Women in the Mood - The ground shakes as the giant women approach and Leela's reflection has 2 eyes for a split second.,481
"Monday Monkey lives for the weekend, sir.",483
Kif used to get so much more annoyed back in the early episodes,480
Zoidberg at Starbucks (X-Post),482
"My friend got this from Animex, drawn by the very man himself",480
"Did anyone else not know the ""Zapp Portrait"" was made in reference to a famous portrait of JFK?  ",477
"Regular Matter, Dark Matter or...",478
"Never picked up on this before... (from ""All the Presidents' Heads"")",471
Need a friend to cope with your low self esteem?,472
Welcome to... Jurassic Tank...,475
Need photos for new frame? Why not Zoidberg..(and friends),475
Only futurma would put this kind of effort into a pilot episode and I love it.,471
He's alive!,471
"Why ""Annoying Facebook Girl[s]"" exist",475
It's the big things that make this show great,472
Roberto the Robot Costume. Hiiiyyahhhhh! (x-post from /r/pics),466
I hope everyone has as much fun tomorrow on my caked...,470
Every opening caption from season one.,474
"For my first ever post, I decided to make this Game of Thrones banner in honor of the best house. Be gentle.    ",471
How I feel being done exams before all my peers,470
"Realistic Sculptures of the Professor, Nibbler, Leela, and Dr. Z",472
"Professor Hubert Farnsworth, made in a hour and a half",467
How I've been feeling lately ,467
"Picture of Leela from the 2013 Futurama Calendar. I scanned and cleaned it up a bit, thought I'd share with my fellow Earthicans.",471
Anyone else who got Futurama Blu-Ray movies want to swap post cards?,467
"Just found this sub, thought you all would appreciate my Halloween costume from last year!",469
I wuv u,467
"Alienese intro says, ""Thanks for watching, Futurama slave army!"" (Things I missed the first 12 times watching it)",465
Baby Bender,466
Habemus Papam!,459
"One Art, please!",462
Monopoly surely knows how to take my money,462
Comedy central is replaying all episodes of the latest season today. Futurama for the next 4 hours straight...,463
One of my prized possessions...,461
Bite my shiny metal ice,462
my Nibbler costume.,455
"""Here, try-a deep dish-a pizza.  It contains-a four kinds-a things.""",453
Can't stop thinking of this when I see this box,458
I say this to my girlfriend all the time,456
"The whole world must learn of our peaceful ways, by force!",452
Noticed one of Bender's graffiti leftovers in one of the new episodes!,459
Sometimes I find the best jokes when I freeze-frame...,457
"""But we need to be shut off! Especially you, Hedonism Bot.""",450
He did what had to be done...,452
my favirote line in the entire series,457
Anybody know where i can buy a poster of Fry's Portrait? I cant find one anywhere!,448
