title,score
"""Our people visited your Egypt thousands of years ago. [...] We learned many things from the mighty Egyptians, such as pyramid building, space travel and how to prepare our dead so as to scare Abbott and Costello"" – Somehow, people never seem to get the ""space travel"" part.",450
Just in case anyone wants to know what the alien signs say.,454
It's nature's pocket!,444
"Mom, Dad, don't make me choose!",446
Saw a huge statue of Bender about 30 miles outside of St. Louis. Had to snap a picture.,449
Anybody else see it?,445
John Fucking Zoidberg!,446
Just wanted to remind you all that Futurama starts again in 10 days.,449
Remember Me! (x/post from r/minecraft),448
Getting there.,446
Luck of the Fryish question,448
"One of those gem-like moments in Futurama that my friends don't see the humor in. Every time, I laugh!",446
Wise words from a wise man,441
Let's Rock!,437
Futurama Poster Design Followup,439
This is how I view the rest of reddit,444
Futurama wedding cake,444
"Watched this episode last night, made me inexplicably sad.",436
Finally got myself a copy!,437
And my friend says...,439
'Get a room you two' 'We're in a room' 'Well then lose some weight!',439
finally got around to take pictures of my collection so far.. only bender and kif to finish the robot devil,433
My favorite quote from Futurama.,434
"""I've been givin these things out for six hundred years""",441
Need a Valentine's Day card? Why not Zoidberg? My Girlfriend strikes again.,430
A quick sketch of Gandalf Farnsworth,435
It will be a waste of your time.,433
Why do they always build these?,438
Snacks for the Futurama season premiere tonight!,428
A hungry little guy,425
Every time I re-watch this show I wonder how I missed gems like this.,431
Don't forget your taxes or...,430
Bender for equality. ,428
How about a Slurm bunny suit?,428
"x-post from /r/TodayILearned: Futurama is the ""Current Most Critically Acclaimed Animated Series""",428
Futurama Alignment Chart [x-post from Pics],430
Bender's apartment number is $,428
Curse that Dr. Zoidberg!,426
Prepared for 5 weeks of Christmas break,426
Universe Swim with the Metal Lord,425
Hellboy Futurama ,425
I ain't seen you before neither!,428
Who I think of whenever someone mentions Mitt Romney...,431
Live long and prosper.... I think. ,429
"""In the year one million and a half...""",428
My brother got me the best birthday present ever!,428
new gaming computer needed new desktop image.... i chose this,428
Found this gem in war is H word episode,429
"Man, do I love this show",424
"I have a terrible secret to confess, Mr. DiCaprio; I'm not very smart.",425
"Pfft, Earth Day. Thought you guys might agree with me.",427
This episode still has one of the saddest endings,422
Popped up on the Futurama facebook page,417
"The box says, ""No.""",426
So I was watching Into the Wild Green Yonder when I noticed...,418
Found another Simpsons appearance,417
It's moments like these that make me remember why Fry is my favorite character,421
I think she found the Japanese alternate universe,414
The only time when Futurma is wrong,414
